Course,URL,instructor,Price (full),Price (discount),Rank
Final Cut Pro X - The Complete Beginner's Course - 2020,www.udemy.com/course/final-cut-pro-x-beginner-to-advanced/,"Craig Blewett, Joshua Blewett",€154.99,€11.99,Rating: 3.8 out of 53.8 - (38)
Straight forward portrait retouching,www.udemy.com/course/straight-forward-portrait-retouching/,Matthew Koller,€149.99,€37.50,Rating: 0.0 out of 50.0 - (0)
Basic Photography Lessons by Piyush Pande,www.udemy.com/course/basic-photography-lessons-by-piyush-pande/,Piyush Pande,€19.99,€11.99,Rating: 0.0 out of 50.0 - (0)
Lightroom CC for photo editing,www.udemy.com/course/lightroom-cc-for-photo-editing/,Nicolas Forgue,€39.99,€11.99,Rating: 0.0 out of 50.0 - (0)
Mother's Little Helper,www.udemy.com/course/mothers-little-helper/,Melissa Shanhun,€24.99,€11.99,Rating: 0.0 out of 50.0 - (0)
How To Shoot Sunsets For Dynamic Range,www.udemy.com/course/how-to-shoot-sunsets-for-dynamic-range/,Denis Lemay,€24.99,€11.99,Rating: 0.0 out of 50.0 - (0)
Video editing: Adobe Premiere Masterclass,www.udemy.com/course/video-editing-adobe-premiere-masterclass/,Sio Vaspa,€59.99,€11.99,Rating: 0.0 out of 50.0 - (0)
Video Editing Level 1 (KIDS),www.udemy.com/course/videoeditinglevel1/,Sangeeta Angela Kumar,€79.99,€11.99,Rating: 3.5 out of 53.5 - (1)
Portrait with Black and White Background: Photoshop Tutorial,www.udemy.com/course/portrait-with-black-and-white-background-photoshop-tutorial/,Ask Chris Holdren,€19.99,€11.99,Rating: 4.8 out of 54.8 - (6)
Summer Photo Storytelling,www.udemy.com/course/summer-photo-storytelling/,Julie Ann Price,€19.99,€11.99,Rating: 3.5 out of 53.5 - (5)
Panorama Photography- Create Stunning Panorama Images,www.udemy.com/course/tips-tricks-to-shoot-and-process-panorama-images-photoshop/,Harsh Vardhan Art,€199.99,€11.99,Rating: 3.7 out of 53.7 - (16)
Building an Online Portfolio for Photographers,www.udemy.com/course/building-an-online-portfolio-for-photographers/,Tarek Reslan,€99.99,€25.00,Rating: 4.5 out of 54.5 - (1)
Creating Black & White Photos in Lightroom,www.udemy.com/course/creating-black-white-photos-in-lightroom/,Jerad Hill,€19.99,€11.99,Rating: 4.2 out of 54.2 - (17)
Beginning Photography,www.udemy.com/course/beginning-photography/,Tim Michael,€19.99,€11.99,Rating: 3.2 out of 53.2 - (3)
Google Nik Filter Effects: From Zero to Hero Masterclass,www.udemy.com/course/nik-filter-from-zero-to-hero/,"Mauro Prelli, Katia Ganci",€199.99,€11.99,Rating: 2.8 out of 52.8 - (5)
Wildlife Photography Lightroom CC Basic Photo Editing,www.udemy.com/course/wildlife-photography-lightroom/,Wofty Photo,€24.99,€11.99,Rating: 3.2 out of 53.2 - (2)
How to Take Awesome Pictures with Your iPhone or iPad,www.udemy.com/course/iphone-photography/,Jason R. Rich,"₩22,000","₩13,200",Rating: 3.9 out of 53.9 - (5)
Davinci Resolve 15 : From Beginner To Professional,www.udemy.com/course/davinci-resolve-15-from-beginner-to-professional/,Joseph adam,"₩220,000","₩13,200",Rating: 3.3 out of 53.3 - (27)
The Blueprint Photography Workshop (Vol. 1),www.udemy.com/course/blueprintv1/,Jerrell Trulove,"₩55,000","₩13,200",Rating: 0.0 out of 50.0 - (0)
Adobe Lightroom CC - The Slideshow Module for Beginners,www.udemy.com/course/adobe-lightroom-the-slideshow-module-for-beginners/,YouAccel Training,"₩55,000","₩13,200",Rating: 4.4 out of 54.4 - (4)
Mastering the art of Video Editing from Scratch,www.udemy.com/course/professional-video-editing-with-filmora/,Yaw Sampene Buadu,"¥2,400","¥1,380",Rating: 0.0 out of 50.0 - (0)
Learn How to Film Your Own Online Instructional Course ,www.udemy.com/course/tutorialcamera/,MusicProfessor Online Music Lessons,"¥6,000","¥1,380",Rating: 4.2 out of 54.2 - (4)
Learn Photoshop Animation: Bring your images alive,www.udemy.com/course/learn-photoshop-animation-bring-your-images-alive/,Farid Shukurov,"¥2,400","¥1,380",Rating: 0.0 out of 50.0 - (0)
Lightroom Classic CC Crash Course,www.udemy.com/course/lightroom-cc-crash/,Kasia Zmokla,0,"¥6,000",Rating: 4.1 out of 54.1 - (61)
BARNEY STILLS AND FILM,www.udemy.com/course/barney_edwards_stills_and_film/,Barney Edwards,"¥6,600","¥1,380",Rating: 0.0 out of 50.0 - (0)
Complete Lightroom Workflow for Portraits and Landscape,www.udemy.com/course/complete-lightroom-workflow-for-portraits-and-landscape/,Thomas King,"¥14,400","¥1,380",Rating: 3.7 out of 53.7 - (6)
How to Create a Basketball Highlight Video for Recruiting,www.udemy.com/course/how-to-create-a-basketball-highlight-video-for-recruiting/,Boris Davis,"¥2,400","¥1,380",Rating: 0.0 out of 50.0 - (0)
Analog Photography,www.udemy.com/course/analog-photography/,Jahan Saber Zaimian,"¥2,400","¥1,380",Rating: 0.0 out of 50.0 - (0)
The Basics of Digital Photography,www.udemy.com/course/the-basics-of-digital-photography/,phil hawkins,"¥3,000","¥1,380",Rating: 3.8 out of 53.8 - (4)
Adobe Photoshop the Interface Course,www.udemy.com/course/adobe-photoshop-the-interface-course/,UK Online Training Centre,"¥6,000","¥1,380",Rating: 3.8 out of 53.8 - (5)
How To Open Eyes In Photoshop,www.udemy.com/course/how-to-open-eyes-in-photoshop/,Denis Lemay,"¥3,600","¥1,380",Rating: 0.0 out of 50.0 - (0)
Photoshop Masterclass - 'Cars at Night',www.udemy.com/course/-photoshop-cars-at-night-masterclass/,Nick Pacione,"¥6,000","¥2,300",Rating: 0.0 out of 50.0 - (0)
Photography: So You Want To Be A Professional? Part 2,www.udemy.com/course/photography-professional-part-2/,Kevin Landwer-Johan,0,"¥5,400",Rating: 0.0 out of 50.0 - (0)
Lightroom CC - Smart Collections & Quick Develop Module,www.udemy.com/course/lightroom-smart-collections-quick-develop-module/,YouAccel Training,"¥6,000","¥1,380",Rating: 0.0 out of 50.0 - (0)
הקורס המלא ליצירת והפקת סרטוני ווידיאו מקצועיים ומדהימים,www.udemy.com/course/creatingvideos/,"Video School Online Hebrew Courses, Liam Rubin",0,"¥3,600",Rating: 5.0 out of 55.0 - (1)
A Beginner's Guide to Editing in Adobe Premiere CC,www.udemy.com/course/adobe-premiere-cc/,Megan Hartman,"¥2,400","¥1,440",Rating: 0.0 out of 50.0 - (0)
Mobile Photography: beautiful educational story,www.udemy.com/course/mobile-photography/,Amlab .me,0,"¥12,000",Rating: 4.3 out of 54.3 - (19)
Produce A High Quality Video For A Low Budget,www.udemy.com/course/how-to-create-great-video-on-a-budget/,ESA Films,"¥24,000","¥1,380",Rating: 3.4 out of 53.4 - (5)
Adobe Lightroom CC - The Develop Module for Beginners,www.udemy.com/course/adobe-lightroom-the-develop-module-for-beginners/,YouAccel Training,€49.99,€10.99,Rating: 5.0 out of 55.0 - (1)
Black and White Mastery in Adobe Lightroom,www.udemy.com/course/black-and-white-mastery-in-lightroom/,Steve Weinrebe,€19.99,€10.99,Rating: 3.9 out of 53.9 - (11)
Tell It.,www.udemy.com/course/video-basics/,Erika Gilsdorf & Scott Stohler,€44.99,€10.99,Rating: 0.0 out of 50.0 - (0)
Confidently Capture Amazing Photos in Just 30 Days!,www.udemy.com/course/nowwhatphotography/,Kirk M.,"₩66,000","₩13,200",Rating: 0.0 out of 50.0 - (0)
Photography Fundamentals - A Complete Walkthrough Guide,www.udemy.com/course/photography-fundamentals/,Matthew Celeste,"₩22,000","₩13,200",Rating: 0.0 out of 50.0 - (0)
Creating Digital Slideshows...,www.udemy.com/course/creating-digital-slideshows/,John Tierno,"₩22,000","₩13,200",Rating: 4.0 out of 54.0 - (1)
Video And Audio Editing Course For YouTubers and Instructors,www.udemy.com/course/video-and-audio-editing-course-for-youtubers-and-instructors/,Ammar Pervez,"₩126,500","₩13,200",Rating: 3.3 out of 53.3 - (8)
Working With School Auctions,www.udemy.com/course/working-with-school-auctions/,Gretchen Adams,0,"₩55,000",Rating: 5.0 out of 55.0 - (3)
"Learn to ""Create More Than A Snapshot"" Photography Class",www.udemy.com/course/introduction-to-digital-photography/,Gary Detonnancourt,"₩27,500","₩13,200",Rating: 4.0 out of 54.0 - (26)
Canon 580 EX II / 430 EX II Speedlite Crash Course,www.udemy.com/course/canon-580-ex-ii-430-ex-ii-speedlite-crash-course/,Michael Andrew,0,"₩44,000",Rating: 0.0 out of 50.0 - (0)
Image compositing on 3D rendered background,www.udemy.com/course/image-compositing-on-3d-rendered-background/,Ciprian Pascu,"₩22,000","₩13,200",Rating: 2.0 out of 52.0 - (1)
Configure Your Camera for Fantastic Photos,www.udemy.com/course/configure-your-camera/,Paul Cooper,"₩33,000","₩13,200",Rating: 4.3 out of 54.3 - (8)
Learn Photoshop CC from scratch.,www.udemy.com/course/learn-photoshop-cc-from-scratch/,Selwyn Lloyd,"₩22,000","₩13,200",Rating: 3.7 out of 53.7 - (6)
Digital Blending Dispensary In Battleship North Carolina.,www.udemy.com/course/digital-blending-dispensary-in-battleship-north-carolina/,Denis Lemay,"₩22,000","₩13,200",Rating: 0.0 out of 50.0 - (0)
Completing the Shot: iPhone Photography for Beginners,www.udemy.com/course/beginneriphonephotography/,Steven Mather,"¥9,600","¥1,380",Rating: 0.0 out of 50.0 - (0)
8 Essential Adobe Lightroom Techniques,www.udemy.com/course/8-essential-adobe-lightroom-techniques/,Paul Charlton,"¥2,400","¥1,380",Rating: 4.5 out of 54.5 - (6)
Learn Picasa from Scratch,www.udemy.com/course/learnpicasa/,Ed Vinson,"¥2,400","¥1,380",Rating: 3.5 out of 53.5 - (1)
Beginner Photoshop course with spectacular results,www.udemy.com/course/beginner-photoshop-course-with-spectaculair-results/,EJ Wallet,"¥2,400","¥1,380",Rating: 0.0 out of 50.0 - (0)
MAKE IT! Part 2: Working with Production Companies,www.udemy.com/course/working-with-a-video-production-company/,Erika Gilsdorf & Scott Stohler,"¥5,400","¥1,380",Rating: 0.0 out of 50.0 - (0)
Removing Pesky Halos - Creating Black & Whites In Photoshop,www.udemy.com/course/removing-pesky-halos-creating-black-whites-in-photoshop/,Denis Lemay,"¥2,400","¥1,380",Rating: 0.0 out of 50.0 - (0)
How to create brand video with your logo?,www.udemy.com/course/brand-video-with-logo/,Vadim Yakupov,"¥3,000","¥1,380",Rating: 0.0 out of 50.0 - (0)
P201 Photography and PhotoShop Integration,www.udemy.com/course/photoshop2017/,Zachary Stone,0,"¥2,400",Rating: 5.0 out of 55.0 - (6)
Learn Photography and Filming Tricks from scratch,www.udemy.com/course/learn-photography-and-filming-tricks-from-scratch/,Noor Santosian,"¥17,400","¥1,380",Rating: 0.0 out of 50.0 - (0)
Make Your Portrait Photography Amazing With Easy Photoshop,www.udemy.com/course/make-your-portrait-photography-amazing-with-easy-photoshop-tutorials/,M2 Visuals,"₩22,000","₩13,200",Rating: 4.2 out of 54.2 - (5)
Easy Video Editing With Shotcut Video Editor,www.udemy.com/course/easy-video-editing-shotcutapp-video-editor/,James Woo,0,"₩71,500",Rating: 4.1 out of 54.1 - (5)
Learn Adobe Premiere Pro And Audition Fast - Beginners Guide,www.udemy.com/course/learn-adobe-premiere-pro-and-audition-fast-simple-workflow/,Mark Timberlake,"₩71,500","₩13,200",Rating: 3.7 out of 53.7 - (2)
Create Stunning Marketing & Promotional Videos using InVideo,www.udemy.com/course/create-videos-using-invideo/,VideoLab by Jad Khalili,"₩110,000","₩13,200",Rating: 4.0 out of 54.0 - (3)
Making A Music Video,www.udemy.com/course/making-a-music-video/,David Miller,"₩38,500","₩13,200",Rating: 0.0 out of 50.0 - (0)
The Ultimate Guide to Digital Photography for Beginners,www.udemy.com/course/the-ultimate-guide-to-digital-photography-for-beginners/,Megan Hartman,"₩22,000","₩13,200",Rating: 4.5 out of 54.5 - (1)
Freelensing Tutorial,www.udemy.com/course/freelensing-tutorial/,Eddie Makes,"₩22,000","₩13,200",Rating: 4.5 out of 54.5 - (2)
Digital Photography and Creating Composite Images,www.udemy.com/course/create-a-composite-image-in-photoshop-and-lightroom/,Russell hopper,"₩22,000","₩13,200",Rating: 0.0 out of 50.0 - (0)
Photography Business:Creating High Impact Webcopy That Sells,www.udemy.com/course/photography-business-creating-high-impact-webcopy-that-sells/,Lana King,"₩220,000","₩13,200",Rating: 0.0 out of 50.0 - (0)
How to Create a Professional App Trailer Video,www.udemy.com/course/app-trailer-template-1-video-aso/,Walkabout Media,"₩38,500","₩13,200",Rating: 4.0 out of 54.0 - (5)
How To Become A Wedding Photographer,www.udemy.com/course/how-to-become-a-wedding-photographer/,Tom Calton,0,A$104.99,Rating: 0.0 out of 50.0 - (0)
Five To Ten Minute Portrait Retouching,www.udemy.com/course/five-to-ten-minute-portrait-retouching/,Denis Lemay,A$24.99,A$13.19,Rating: 0.0 out of 50.0 - (0)
Commercial Beer Photography & Retouching Tutorial | PRO EDU,www.udemy.com/course/commercial-beer-photography-retouching-tutorial-pro-edu/,PRO EDU,A$24.99,A$13.19,Rating: 4.3 out of 54.3 - (20)
Making Photos Pop for Instagram,www.udemy.com/course/making-photos-pop-for-instagram/,Jon Mac,A$39.99,A$13.19,Rating: 2.5 out of 52.5 - (1)
Digital Photography 101: Get Professional Quality Images Now,www.udemy.com/course/digital-photography_101/,Bob Creigh,A$79.99,A$13.19,Rating: 4.3 out of 54.3 - (12)
The Travelling Photographer: Packing the Right Gear,www.udemy.com/course/travellingphotographer/,Indeana Underhill,A$24.99,A$13.19,Rating: 0.0 out of 50.0 - (0)
Canon SL3 Crash Course,www.udemy.com/course/canon-sl3-crash-course/,Michael Andrew,0,A$44.99,Rating: 0.0 out of 50.0 - (0)
learn 4 video trick like pro in filmora and Photoshop,www.udemy.com/course/learn-4-video-trick-like-pro-in-filmora/,Webscode ID,A$29.99,A$13.19,Rating: 0.0 out of 50.0 - (0)
Introduction to Adobe Premiere,www.udemy.com/course/introduction-to-adobe-premiere/,Mike Schreurs,0,A$34.99,Rating: 4.0 out of 54.0 - (1)
Selling your portraits via In-Person-Preview Appointments,www.udemy.com/course/selling-your-portraits-via-in-person-preview-appointments/,Gretchen Adams,0,A$54.99,Rating: 4.7 out of 54.7 - (32)
Photography: Lightroom Digital Workflow,www.udemy.com/course/photography-digital-workflow/,Kevin Landwer-Johan,0,A$64.99,Rating: 4.2 out of 54.2 - (10)
Video Editing For Beginners: Learn How To Edit,www.udemy.com/course/video-editing-101-learn-the-basics-of-video-editing/,Christian Figueroa,0,Free,Rating: 3.8 out of 53.8 - (23)
Learn Expert Video Editing using KineMaster App,www.udemy.com/course/learn-expert-video-editing-using-kinemaster-app/,Shaharyar Abdul Khaliq,0,Free,Rating: 4.2 out of 54.2 - (10)
"Photoshop for Beginners, Start Freelancing Fast and Easy",www.udemy.com/course/photoshop-for-freelancers/,Igor Risteski,0,Free,Rating: 4.2 out of 54.2 - (35)
Using a Photographic Light Meter,www.udemy.com/course/using-a-photographic-light-meter/,Don Giannatti,0,Free,Rating: 4.6 out of 54.6 - (823)
Secrets of Magazine Model Photography,www.udemy.com/course/secrets-of-magazine-model-photography/,Learn Photography HQ,0,Free,Rating: 4.1 out of 54.1 - (288)
Create a Gorgeous Photography Site with SmugMug in 90 mins,www.udemy.com/course/create-a-gorgeous-photography-site-with-smugmug-in-90-mins/,Ryan Oakley,0,Free,Rating: 4.4 out of 54.4 - (330)
Natural Light Fashion / Beauty Photography,www.udemy.com/course/natural-light-fashion-beauty-photography/,Don Giannatti,0,Free,Rating: 4.2 out of 54.2 - (455)
Create Your Own Transitions For Premiere Pro,www.udemy.com/course/premiereprotransitions/,Alan Kuna,0,Free,Rating: 4.1 out of 54.1 - (273)
The Ultimate GIMP 2.8 Guide►Book included as sold on Amazon,www.udemy.com/course/gimp-two-point-eight/,Bernard 't Hooft,0,Free,Rating: 5.0 out of 55.0 - (2)
How to VLOG & Grow a YouTube Following,www.udemy.com/course/how-to-vlog-on-youtube/,Jeven Dovey,0,Free,Rating: 4.3 out of 54.3 - (383)
Adobe Premiere Rush CC For Beginners: Learn How To Edit,www.udemy.com/course/adobe-premiere-rush-cc-for-beginners-learn-how-to-edit/,Christian Figueroa,0,Free,Rating: 3.2 out of 53.2 - (7)
Outstanding Composition: How to blow away your audience,www.udemy.com/course/composition/,Thomas Leuthard,0,Free,"Rating: 4.3 out of 54.3 - (1,118)"
Adobe Photoshop Portrait Retouching - Skater Guy,www.udemy.com/course/skateractiontwo/,Manfred Werner,0,Free,Rating: 4.3 out of 54.3 - (6)
Make GIMP 2.10 work as Photoshop,www.udemy.com/course/make-gimp-work-as-photoshop/,Bernard 't Hooft,0,Free,Rating: 4.2 out of 54.2 - (164)
Photo restoration with Photoshop,www.udemy.com/course/photo-restoration-with-photoshop/,Igor Risteski,0,Free,Rating: 4.0 out of 54.0 - (113)
Photography Fundamentals for Beginners,www.udemy.com/course/photography-for-beginners/,"Phil Ebiner, Video School Online Inc",0,Free,"Rating: 4.6 out of 54.6 - (3,963)"
Final Cut Pro X Tutorial,www.udemy.com/course/izzy-final-cut-pro-x-tutorial-10-4-3/,Izzy Hyman,0,Free,Rating: 4.8 out of 54.8 - (390)
Vegas Pro 15 - Basic Video Editing Bootcamp,www.udemy.com/course/vegas-pro-15-basic-video-editing-bootcamp/,Dean McIntyre,0,Free,Rating: 3.5 out of 53.5 - (157)
How to Capture Beautiful Photos with Iphone Professionally,www.udemy.com/course/how-to-capture-beautiful-photos-with-iphone-professionally/,Kelvin Ang,0,Free,Rating: 3.9 out of 53.9 - (156)
Light Painting In 360 With The Ricoh Theta S,www.udemy.com/course/light-painting-in-360-with-the-ricoh-theta-s/,Ben Claremont,0,Free,Rating: 4.2 out of 54.2 - (73)
Master Adobe Photoshop Color Grading & Retouching,www.udemy.com/course/zuluwarrior/,Manfred Werner,0,Free,Rating: 4.3 out of 54.3 - (15)
Drone Photography Basics,www.udemy.com/course/drone-photography-basics/,Umair Vanthaliwala,0,Free,Rating: 4.2 out of 54.2 - (351)
Photoshop Sport Image Retouching - Skater Guy,www.udemy.com/course/skateractionone/,Manfred Werner,0,Free,Rating: 4.0 out of 54.0 - (7)
Adobe Premiere CC 2015 in Arabic under 2 hours,www.udemy.com/course/adobe-premiere-cc-2015-in-arabic-under-2-hours/,Eslam Osama Algwaily,0,Free,Rating: 4.4 out of 54.4 - (91)
Helping Your Church Live Stream 2.0,www.udemy.com/course/church-streaming/,Paul Richards,0,Free,Rating: 4.5 out of 54.5 - (299)
Video Gear for Any Budget,www.udemy.com/course/video-gear-for-any-budget/,Caleb Wojcik,0,Free,Rating: 3.7 out of 53.7 - (206)
Learn How to Use Premiere Pro CC - For Beginners,www.udemy.com/course/learn-how-to-use-premiere-pro-cc-for-beginners/,Jordan Dueck,0,Free,"Rating: 4.5 out of 54.5 - (1,055)"
Cinematic Color Grading With Premiere Pro 2020 For Beginners,www.udemy.com/course/cinematic-color-grading-with-premiere-pro-2020-for-beginners/,Dhabal Video School,0,Free,Rating: 2.7 out of 52.7 - (4)
Contact Sheets: Begin to take & select great street photos,www.udemy.com/course/contact-sheets/,Thomas Leuthard,0,Free,Rating: 4.7 out of 54.7 - (103)
Photoshop People with Adobe's Creative Cloud Apps,www.udemy.com/course/photoshopping-people/,Forge Productions,0,Free,Rating: 0.0 out of 50.0 - (0)
Learn Landscape Photography,www.udemy.com/course/learn-landscapes/,Ray Salisbury,0,Free,"Rating: 4.3 out of 54.3 - (1,466)"
How To Use Adobe Premiere Pro: For Beginners,www.udemy.com/course/how-to-use-adobe-premiere-pro-for-beginners/,David Reilly,0,Free,Rating: 3.8 out of 53.8 - (211)
Landscape Photography Tips :  simple solutions for beginners,www.udemy.com/course/landscape-photography-tips-simple-solutions-for-beginners/,"Ray Salisbury, Lydia Bailey",0,Free,"Rating: 4.4 out of 54.4 - (1,053)"
Photoshop Beginner to Advanced - Complete Photoshop Mastery,www.udemy.com/course/photoshop-basics-for-beginners-learn-adobe-photoshop/,Steve McDonald,0,Free,"Rating: 4.4 out of 54.4 - (1,097)"
The Ultimate GIMP 2.10 Guide►Book included as sold on Amazon,www.udemy.com/course/the-ultimate-gimp-guide-amazon-book-included/,Bernard 't Hooft,0,Free,Rating: 4.5 out of 54.5 - (435)
iPad Video Production with Playback,www.udemy.com/course/ipad-video-production-with-playback/,Leigh Faulkner,0,Free,Rating: 3.7 out of 53.7 - (85)
Unofficial Guide to the Canon PowerShot ELPH 180 and 190 IS,www.udemy.com/course/unofficial-guide-to-the-canon-powershot-elph/,Forge Productions,0,Free,Rating: 5.0 out of 55.0 - (1)
Multimedia Journalism,www.udemy.com/course/multimedia-journalism/,Climate Tracker,0,Free,Rating: 4.3 out of 54.3 - (3)
vMix Master Class - Video Production & Live Streaming,www.udemy.com/course/vmix-live-streaming/,Paul Richards,0,Free,Rating: 4.5 out of 54.5 - (211)
Film and Stitch 360 VR Video with GoPros and AVP,www.udemy.com/course/360gopro/,Noah Scott,0,Free,Rating: 4.6 out of 54.6 - (100)
Learn Photographic Exposure Best Practices,www.udemy.com/course/exposure-best-practices/,Kasia Zmokla,0,Free,Rating: 4.1 out of 54.1 - (380)
Sell Video as Stock Footage - Beginners Guide,www.udemy.com/course/how-to-make-money-selling-stock-footage/,Jeven Dovey,0,Free,Rating: 4.3 out of 54.3 - (396)
A Guide to Accessories for DSLRs,www.udemy.com/course/a-guide-to-accessories-for-dslrs/,Michael Andrew,0,Free,Rating: 4.6 out of 54.6 - (646)
5 BEST set up for Portrait Photography. Natural light,www.udemy.com/course/5-best-set-up-for-portrait-photography-natural-light/,Yuliana Chi,0,Free,Rating: 4.0 out of 54.0 - (21)
GIMP for Beginners: Fast Photo Editing Tricks & Tips,www.udemy.com/course/fast-photo-editing-tricks-tips-for-gimp/,Chris Navarre,0,Free,Rating: 4.4 out of 54.4 - (31)
Creating attractive presentation through Google Slides,www.udemy.com/course/promo-videos-creator-course/,MKCL India,0,Free,Rating: 4.2 out of 54.2 - (3)
Guide to Photo Animation,www.udemy.com/course/animation/,Frederick Barnes,0,Free,Rating: 4.4 out of 54.4 - (30)
Insta360 ONE X Beginners Guide,www.udemy.com/course/insta360-one-x-beginners-guide-crash-course/,Shanil Kawol,0,Free,Rating: 4.8 out of 54.8 - (22)
Lightroom 5 Photographer Workflow,www.udemy.com/course/lightroom-5-photographer-workflow/,Jerad Hill,0,Free,"Rating: 4.0 out of 54.0 - (1,005)"
360 Video Creation Fundamentals,www.udemy.com/course/360-video-production-masterclass-filmmaking/,Josh Gibson,0,Free,Rating: 4.4 out of 54.4 - (89)
Learn more about Luminar 3 in only 1 hour,www.udemy.com/course/luminar-3-free-course/,Mark de Rooij,0,Free,Rating: 4.1 out of 54.1 - (30)
LOCATIONZ : Behind The Scenes,www.udemy.com/course/locationz-bts/,Ray Salisbury,0,Free,Rating: 3.8 out of 53.8 - (33)
From Photo to DVD - Preserving those Precious Memories,www.udemy.com/course/from-photo-to-dvd-preserving-those-precious-memories/,Rick Phillips,0,Free,Rating: 4.0 out of 54.0 - (35)
Enhancing Photos with Photoshop,www.udemy.com/course/enhancing-photos-with-photoshop/,SHAD SLUITER,0,Free,Rating: 4.2 out of 54.2 - (121)
Street Photography: How I approach people on the streets...,www.udemy.com/course/streetphotography/,Thomas Leuthard,0,Free,"Rating: 4.3 out of 54.3 - (1,248)"
Mastering Adobe Premiere Pro,www.udemy.com/course/mastering-adobe-premiere-pro/,Justin Lawrie,0,Free,Rating: 3.6 out of 53.6 - (50)
Introductory Photography Course,www.udemy.com/course/free-photography-course-for-beginners/,Chris Bray,0,Free,"Rating: 4.6 out of 54.6 - (8,377)"
From Story to Screen: Producing a Professional Short Film,www.udemy.com/course/from-story-to-screen-producing-a-professional-short-film/,Vicki Lau,0,Free,Rating: 4.2 out of 54.2 - (742)
Photography guide keys,www.udemy.com/course/ultimate-landscape-photography-guide/,Anas Catalan,0,Free,Rating: 3.7 out of 53.7 - (17)
Affinity Photo: Five Steps to Better Photos,www.udemy.com/course/affinity-photo-five-steps-to-better-photos/,Simon Foster,0,Free,Rating: 4.6 out of 54.6 - (221)
Photography: Ditch Auto - Start Shooting in Manual,www.udemy.com/course/ditch-auto-start-shooting-in-manual/,Jerad Hill,0,Free,"Rating: 4.2 out of 54.2 - (6,105)"
Portrait Photography with Simple Gear,www.udemy.com/course/portrait-photography-with-simple-gear/,Don Giannatti,0,Free,Rating: 4.4 out of 54.4 - (957)
7 Ingredients for Awesome Photography - Take Better Photos,www.udemy.com/course/7-ingredients-for-awesome-photography-take-better-photos/,Chris Parker,0,Free,Rating: 4.0 out of 54.0 - (133)
How to Record & Edit Video Content for Beginners,www.udemy.com/course/how-to-record-edit-video-content/,Bryan Guerra,0,Free,Rating: 3.8 out of 53.8 - (190)
Green Screen Photography,www.udemy.com/course/green-screen-photography/,Dave Cross,0,Free,Rating: 4.2 out of 54.2 - (681)
License Videos+photography Taking+Sells Masterclass,www.udemy.com/course/commercials-videos-photography-takingselling-masterclass/,Aleess Ali,0,Free,Rating: 3.4 out of 53.4 - (7)
Adobe Photoshop CC Masterclass — Vom Einsteiger zum Profi,www.udemy.com/course/photoshop-masterclass/,"Justus Zeemann, Justus Academy",€199.99,€11.99,"Rating: 4.5 out of 54.5 - (1,970)"
業界最先端の動画制作テクニックを制覇！Adobe Premiere Pro 完全版,www.udemy.com/course/premiere-pro-cc-japan/,OMOKAGE TV,€99.99,€11.99,Rating: 4.6 out of 54.6 - (655)
Fotografía Masterclass: Una Guía Completa para la Fotografía,www.udemy.com/course/masterclass-fotografia/,"Phil Ebiner, Video School Online Inc, William Carnahan, Sam Shimizu-Jones",€199.99,€11.99,"Rating: 4.7 out of 54.7 - (1,207)"
Curso de fotografia profissional para iniciantes,www.udemy.com/course/fotografia-simples-e-direta-com-vinicius-waknin/,Vinicius Waknin,€79.99,€11.99,"Rating: 4.4 out of 54.4 - (3,035)"
Adobe Lightroom: Alles komplett von A bis Z inkl. Plugins,www.udemy.com/course/adobe-lightroom-alles-von-a-bis-z-inkl-erweiterungen/,"Justus Zeemann, Justus Academy",€199.99,€11.99,Rating: 4.1 out of 54.1 - (831)
Fotoğraf Öğreniyoruz: Fotoğrafçılık Hakkında Her Şey,www.udemy.com/course/fotograf-ogreniyoruz-fotografcilik-hakkinda-her-sey/,Tahir YILDIZ,€169.99,€11.99,"Rating: 4.5 out of 54.5 - (1,781)"
FOTOGRAFIE 1X1 - Der Fotografiekurs,www.udemy.com/course/fotografie-1x1-der-fotografiekurs/,Matthias Butz,€99.99,€11.99,Rating: 4.2 out of 54.2 - (402)
【1日完結】Premiere Proの使い方~動画クリエイターコース~,www.udemy.com/course/premiere-pro-japan/,OMOKAGE TV,€39.99,€11.99,Rating: 4.5 out of 54.5 - (674)
Masterclass sulla fotografia: Corso Completo,www.udemy.com/course/masterclass-sulla-fotografia-corso-completo/,Stefano Venneri,€159.99,€11.99,Rating: 4.3 out of 54.3 - (583)
