Course,URL,instructor,Price (full),Price (discount),Rank
Cinemagraph Masterclass: Your Complete Guide,www.udemy.com/course/cinemagraph/,Nic Kocher,$124.99,$11.39,Rating: 4.2 out of 54.2 - (18)
Master Lightroom and Photoshop for Photo Editing,www.udemy.com/course/masterlightroom/,Rafael Banha,"¥3,600","¥1,440",Rating: 3.0 out of 53.0 - (1)
Wondershare Filmora 9 Tutorial : Video Editing Tips & Tricks,www.udemy.com/course/flimora-9-complete-video-editing-tutorial/,Henry Lee,"¥3,000","¥1,440",Rating: 3.4 out of 53.4 - (31)
Mastering Photoshop Luminosity Masks,www.udemy.com/course/mastering-photoshop-luminosity-masks/,Robin Whalley,"¥2,400","¥1,440",Rating: 4.0 out of 54.0 - (26)
After Effects : Color Grading Made Easy,www.udemy.com/course/after-effects-color-grading-made-easy/,Aksh Animation,"¥4,800","¥1,440",Rating: 4.5 out of 54.5 - (5)
Stock Footage MasterClass - Full Workflows for Agencies,www.udemy.com/course/stockfootage2/,Greg Hung,"¥12,000","¥1,440",Rating: 3.6 out of 53.6 - (26)
The Photography Guide™ - Beginner's Photography Course,www.udemy.com/course/the-photography-guide/,Adam @ Phoxy,"¥6,000","¥1,440",Rating: 4.6 out of 54.6 - (7)
Photographing Children,www.udemy.com/course/photographing-children/,Emanuele Pontoriero,"¥4,200","¥1,440",Rating: 4.4 out of 54.4 - (10)
Killer 1min iPhone Video Storytelling Editing - iMovie App,www.udemy.com/course/1-min-iphone-video/,"Yukiko Sato, John Scotland","¥7,200","¥1,440",Rating: 4.1 out of 54.1 - (25)
iPhone Photography,www.udemy.com/course/21-rules-for-great-travel-photography/,— Smart Film School —,"¥3,600","¥1,440",Rating: 4.2 out of 54.2 - (2)
Micro Budget FEATURE Filmmaking That Looks Professional,www.udemy.com/course/make-a-micro-budget-feature-film-look-like-a-million-bucks/,Fred Zara,"¥2,400","¥1,440",Rating: 4.3 out of 54.3 - (3)
Adobe Lightroom: Finding Your Unique Editing Style,www.udemy.com/course/finding-your-editing-style-with-adobe-lightroom/,Sean Dalton Dalton,"¥12,000","¥1,440",Rating: 4.5 out of 54.5 - (7)
What The Flash | The Evolution of Light,www.udemy.com/course/what-the-flash-the-evolution-of-light/,Bob Davis,0,"¥4,200",Rating: 4.5 out of 54.5 - (50)
Portrait Retouching Essentials in Photoshop,www.udemy.com/course/retouching-essentials-in-photoshop/,Marcin Mikus,"¥12,000","¥1,440",Rating: 4.5 out of 54.5 - (289)
Master Photo Sharpening in Adobe Lightroom,www.udemy.com/course/master-photo-sharpening-in-adobe-lightroom/,Robin Whalley,"¥2,400","¥1,440",Rating: 4.0 out of 54.0 - (72)
Smartphone Videography: A Practical Guide,www.udemy.com/course/smartphone-videography-a-practical-guide/,Forge Productions,"¥4,800","¥1,440",Rating: 4.1 out of 54.1 - (6)
Strategic Marketing for Photographers,www.udemy.com/course/strategic-marketing-for-photographers/,Mike Rose,"¥23,400","¥1,440",Rating: 4.2 out of 54.2 - (27)
SpeedGrade and Premiere Pro Master Video Color Correction,www.udemy.com/course/speedgrade-and-premiere-pro/,Infinite Skills,£49.99,£11.99,Rating: 4.2 out of 54.2 - (31)
Cell Phone Photography for Pet Lovers,www.udemy.com/course/cell-phone-photography-for-pet-lovers/,Monique Rodriguez,£49.99,£11.99,Rating: 4.5 out of 54.5 - (4)
Adobe Lightroom for Beginners,www.udemy.com/course/lightroom-for-beginners/,Ken Schultz,£34.99,£11.99,Rating: 3.8 out of 53.8 - (58)
Fine Art Compositing with Photoshop CC,www.udemy.com/course/fine-art-compositing/,Kasia Zmokla,0,£29.99,Rating: 4.6 out of 54.6 - (46)
Introduction to Photoshop | Beginner to Master,www.udemy.com/course/introductiontophotoshop/,Dan LeFebvre,£149.99,£11.99,Rating: 5.0 out of 55.0 - (3)
Davinci Resolve 15: Color Correction & Grading,www.udemy.com/course/davinci-resolve-color-correction/,Film Pro,£64.99,£11.99,Rating: 3.7 out of 53.7 - (75)
Making Films on Smartphones,www.udemy.com/course/making-films-on-smartphones/,Gabriel Teo,£19.99,£11.99,Rating: 3.6 out of 53.6 - (3)
Photoshop CC Crash Course,www.udemy.com/course/photoshop-cc-crash-course/,Jeremy Shuback,£49.99,£11.99,Rating: 4.4 out of 54.4 - (113)
Photography : Shoot Stunning Portraits of Your Kids,www.udemy.com/course/shoot-stunning-portraits-of-your-kids/,Bryan Lamb,£49.99,£11.99,Rating: 4.4 out of 54.4 - (51)
Photoshop CC Tutorial for Beginners,www.udemy.com/course/photoshop-cc-tutorial-for-beginners/,Kush Sharma,£19.99,£11.99,Rating: 4.5 out of 54.5 - (60)
✅ Record Audio for Video Production,www.udemy.com/course/record-your-voice-for-video/,Mikael Baggström,£74.99,£11.99,Rating: 4.2 out of 54.2 - (32)
Success with Infrared Photography,www.udemy.com/course/success-with-infrared-photography/,Patrick C. Cook,£99.99,£11.99,Rating: 4.2 out of 54.2 - (20)
Building a Video Studio for live streaming and recording,www.udemy.com/course/live-video-studio/,Paul Richards,£19.99,£11.99,Rating: 3.8 out of 53.8 - (53)
Filmmaking Database: Cinema Camera Lenses Masterclass,www.udemy.com/course/filmmaking-cinematography-video-production-camera-lenses/,"IFH Courses, Egon Stephan Jr",£174.99,£11.99,Rating: 3.2 out of 53.2 - (21)
The HDR Masterclass,www.udemy.com/course/the-hdr-masterclass/,Patrick C. Cook,£99.99,£11.99,Rating: 4.0 out of 54.0 - (17)
From Raw to a Perfect Photo - Develop & Process Like a Pro,www.udemy.com/course/raw-to-perfect-photo/,Kasia Zmokla,0,£49.99,Rating: 4.4 out of 54.4 - (89)
Recreating Famous Music Video Effects,www.udemy.com/course/recreating-famous-music-video-effects/,Reverse Cuts,$199.99,$11.99,Rating: 0.0 out of 50.0 - (0)
"Outdoor Engagement ""Love Story"" Portrait Secrets",www.udemy.com/course/outdoor-engagement-love-story-portrait-secrets/,Photofonz Media,$199.99,$11.99,Rating: 3.9 out of 53.9 - (21)
Adobe Photoshop Beauty Retouching for Beginners,www.udemy.com/course/adobe-photoshop-beauty-retouch-for-beginners/,Diana Kot,$59.99,$11.99,Rating: 4.6 out of 54.6 - (58)
Street Photography Basics,www.udemy.com/course/street-photography-basics/,Yunkin Keophomma,$24.99,$11.99,Rating: 4.1 out of 54.1 - (34)
Mastering HDR Picture Making,www.udemy.com/course/mastering-hdr-picture-making/,Robin Nichols,$49.99,$11.99,Rating: 4.0 out of 54.0 - (6)
Photoshop for Photographer - 3 Courses in 1,www.udemy.com/course/photoshop-for-photographer/,Alex Dominguez,$199.99,$11.99,Rating: 4.3 out of 54.3 - (10)
Secrets of Fitness Photography Revealed,www.udemy.com/course/master-the-art-of-fitness-photography/,Paul Aiken,$39.99,$11.99,Rating: 4.1 out of 54.1 - (36)
Photoshop Retouching for Outdoor Portraits + Landscapes,www.udemy.com/course/photoshop-fall-edits-for-outdoor-portraits-landscapes/,Chris Parker,$39.99,$11.99,Rating: 3.6 out of 53.6 - (3)
Ultimate Guide For Epic GoPro Travel Videos,www.udemy.com/course/ultimate-guide-for-epic-gopro-travel-videos/,Łukasz Gasiulewicz,$19.99,$11.99,Rating: 3.4 out of 53.4 - (4)
After Effects for Photography,www.udemy.com/course/after-effects-for-photography/,Chris Converse,$19.99,$11.99,Rating: 4.6 out of 54.6 - (3)
Amazing Sunset Photography,www.udemy.com/course/amazing-sunset-photography/,Brent Mail,$29.99,$11.99,Rating: 3.7 out of 53.7 - (57)
Learn how to Make Dreamy Collages in Photoshop Easily,www.udemy.com/course/dreamcollages/,Ana Navarro,$29.99,$11.99,Rating: 0.0 out of 50.0 - (0)
LEARN HOW TO BECOME A FULL TIME WEDDING PHOTOGRAPHER,www.udemy.com/course/learn-how-to-become-a-full-time-wedding-photographer/,Philip Harris,0,$69.99,Rating: 4.4 out of 54.4 - (14)
Photography Fundamentals Taught by a Photography Pro!,www.udemy.com/course/photography-fundamentals-taught-by-a-photography-pro/,Chris Parker,$29.99,$11.99,Rating: 4.7 out of 54.7 - (420)
Stock Footage Crash Course For Beginners,www.udemy.com/course/stockfootagecourse/,Life Progression Project,$64.99,$11.99,Rating: 4.1 out of 54.1 - (5)
Photoshop Light Effects - Let There be Light!,www.udemy.com/course/photoshop-light-effects-let-there-be-light/,Chris Parker,$29.99,$11.99,Rating: 4.7 out of 54.7 - (2)
Fundamentals of Photo Editing in GIMP 2.10,www.udemy.com/course/fundamentals-of-photo-editing-in-gimp/,Michael Davies,"₩22,000","₩13,200",Rating: 4.3 out of 54.3 - (5)
Natural Light Portrait,www.udemy.com/course/natural-light-portrait/,Uğur Közler,"₩33,000","₩13,200",Rating: 3.8 out of 53.8 - (5)
Adobe Premiere Pro: Learn audio mixing for your videos/vlogs,www.udemy.com/course/audio-mixing-in-premiere-pro/,Miaw Jyi Sim,"₩99,000","₩13,200",Rating: 4.1 out of 54.1 - (2)
Setting up your own Lightroom Presets Store on Etsy,www.udemy.com/course/lightroomandetsy/,Eugene Tantsurin,"₩22,000","₩13,200",Rating: 4.2 out of 54.2 - (6)
Earn from Photography: A Step By Step Guideline,www.udemy.com/course/earn-from-photography-complete-guideline/,Creative Online School,"₩214,500","₩13,200",Rating: 3.5 out of 53.5 - (49)
How to Capture Great Photos - Made Simple,www.udemy.com/course/how-to-take-great-photos-made-simple/,Clive Gidney,"₩220,000","₩13,200",Rating: 4.6 out of 54.6 - (21)
Take Amazing Underwater Pictures Using Compact Cameras,www.udemy.com/course/underwater-photography-for-beginners/,Randy Travis,"₩33,000","₩13,200",Rating: 3.8 out of 53.8 - (16)
Video Success: Key Steps to Make Great Films and Videos,www.udemy.com/course/video-boot-camp/,Paul Jenkins,"₩137,500","₩13,200",Rating: 4.3 out of 54.3 - (24)
Color Grading and Video Editing with Davinci Resolve 16,www.udemy.com/course/color-grading-and-video-editing-with-davinci-resolve/,Adeep Krishna,"₩60,500","₩13,200",Rating: 4.5 out of 54.5 - (1)
Minimalist Cave Photography Mastery Course,www.udemy.com/course/minimalist-cave-photography-mastery-course/,Brandon Kowallis,"₩104,500","₩13,200",Rating: 4.4 out of 54.4 - (7)
Photography - Build A Home Based Studio Business On A Budget,www.udemy.com/course/home-based-photography-studio-start-your-own-business/,Mark Timberlake,"₩71,500","₩13,200",Rating: 4.5 out of 54.5 - (13)
How to edit videos on your phone like a professional,www.udemy.com/course/vloglikeapro/,Timothy Maxwell,"₩220,000","₩13,200",Rating: 4.2 out of 54.2 - (2)
The Art of Film Photography & Basic Photography Skills,www.udemy.com/course/the-art-of-film-photography-basic-photography-skills/,Dean Benstead,"₩104,500","₩13,200",Rating: 4.0 out of 54.0 - (16)
Adobe Photoshop CC For Beginners,www.udemy.com/course/adobe-photoshop-cc-overview-and-deep-dive-for-beginners/,Sandy Dee,"₩104,500","₩13,200",Rating: 3.8 out of 53.8 - (29)
Learning to monetize your videos using Stock Footage,www.udemy.com/course/create-stock-footage-videos-while-traveling/,Greg Hung,"₩154,000","₩13,200",Rating: 3.6 out of 53.6 - (34)
Adobe Lightroom CC: How To Edit Portraits (Full Retouch),www.udemy.com/course/lightroom-cc-professional-portrait-retouching/,Ustin Kompaniets,"₩137,500","₩13,200",Rating: 4.2 out of 54.2 - (78)
The Ultimate Travel Film Making Course,www.udemy.com/course/the-ultimate-travel-film-making-course/,Thomas King,"₩121,000","₩13,200",Rating: 3.1 out of 53.1 - (19)
How To Take EPIC Drone Videos While Traveling,www.udemy.com/course/how-to-take-epic-drone-videos-while-traveling/,Alex Shoolman,"₩110,000","₩13,200",Rating: 4.5 out of 54.5 - (18)
Colour fundamentals for photo editing,www.udemy.com/course/colour-fundamentals-for-photo-editing/,Paul Naude,"₩22,000","₩13,200",Rating: 4.3 out of 54.3 - (13)
The Art of Black & White photography Yesterday and Today,www.udemy.com/course/the-art-of-black-white-photography-yesterday-and-today/,Serge Ramelli,"₩22,000","₩13,200",Rating: 4.5 out of 54.5 - (37)
Honor Your Family By Making Your Own Family Legacy Videos,www.udemy.com/course/family_history_video/,Stan Prentice,"₩66,000","₩13,200",Rating: 4.6 out of 54.6 - (33)
How to Manage a Profitable Photography Studio,www.udemy.com/course/how-to-manage-a-profitable-photography-studio/,Les Editions Media-coach inc.,"₩55,000","₩13,200",Rating: 4.3 out of 54.3 - (7)
Adobe Photoshop For Beginners Photoshop Users,www.udemy.com/course/photoshop-for-beginners-101/,Manfred Werner,"₩33,000","₩13,200",Rating: 3.6 out of 53.6 - (18)
The Ultimate Guide to Digital Videography for Beginners,www.udemy.com/course/the-ultimate-guide-to-digital-videography-for-beginners/,Megan Hartman,"₩22,000","₩13,200",Rating: 4.3 out of 54.3 - (7)
Professional Jewelry & Small Product Light Tent Photography,www.udemy.com/course/professional-jewelry-small-product-light-tent-photography/,Photofonz Media,"₩27,500","₩13,200",Rating: 4.0 out of 54.0 - (23)
Photography for Beginners: DSLR Photography Camera Settings,www.udemy.com/course/photography-for-beginners-dslr-photography-camera-settings/,Chris Parker,"₩33,000","₩13,200",Rating: 4.2 out of 54.2 - (42)
Boudoir Photography: Cell phone self-portraiture,www.udemy.com/course/boudoir-photography-cell-phone-self-portaiture/,Jennifer Bartlett-Phelps,"₩49,500","₩13,200",Rating: 3.6 out of 53.6 - (2)
Complete Adobe Premiere Pro Video Editing Course! ,www.udemy.com/course/video-editing-in-adobe-premiere-pro-free-basics-course/,Uri Soglowek,"₩104,500","₩26,125",Rating: 4.2 out of 54.2 - (81)
Video Editing In Adobe Premiere Pro CC : Learn The Basics,www.udemy.com/course/video-editing-in-adobe-premiere-pro-cc-learn-the-basics/,Joseph adam,"₩220,000","₩13,200",Rating: 3.8 out of 53.8 - (113)
Edit Your Photos : Like A Professional Photographer,www.udemy.com/course/edit-your-photos-like-a-professional-photographer/,Joseph adam,"₩220,000","₩13,200",Rating: 3.3 out of 53.3 - (47)
Lightroom 80/20 - The most efficient Lightroom Workflow,www.udemy.com/course/lightroom-8020-the-most-efficient-lightroom-workflow/,Andreas Kowacsik,"₩220,000","₩13,200",Rating: 2.5 out of 52.5 - (1)
The Ken Burns Effect: Bring Your Photos to Life in Video,www.udemy.com/course/the-ken-burns-effect/,Jason Boone,"₩22,000","₩13,200",Rating: 4.3 out of 54.3 - (11)
How To Put A Microphone On Talent,www.udemy.com/course/dttwbook/,Thomas Popp,"¥6,000","¥1,380",Rating: 4.6 out of 54.6 - (61)
Fashion Photography - Working With Off Camera Lights,www.udemy.com/course/fashion-photography-working-with-off-camera-lights/,Tahir YILDIZ,"¥2,400","¥1,440",Rating: 3.2 out of 53.2 - (13)
3D Photography for Beginners in under One Hour,www.udemy.com/course/3d-photography/,"Asif Khawaja, PhD","¥2,400","¥1,440",Rating: 3.9 out of 53.9 - (13)
How to Take Better Photos of Your Kids,www.udemy.com/course/how-to-take-better-photos-of-your-kids/,Mary Buck,"¥5,400","¥1,380",Rating: 4.1 out of 54.1 - (12)
Basic Photo Composition: A Simple Guide To Beautiful Photos,www.udemy.com/course/basic-photo-composition-course/,Pong Lizardo,"¥6,000","¥1,380",Rating: 4.3 out of 54.3 - (2)
Photography Basics for Bloggers & Online Businesses,www.udemy.com/course/photography-basics-for-bloggers-online-businesses/,Abigail K,"¥6,600","¥1,380",Rating: 4.0 out of 54.0 - (40)
[OBS] The Perfect Open Broadcaster Software Recording Studio,www.udemy.com/course/obs-the-perfect-open-broadcaster-solution-recording-studio/,Zach Miller,"¥12,000","¥1,380",Rating: 4.0 out of 54.0 - (27)
Portrait Photography: from Studio to Photoshop,www.udemy.com/course/portrait-photography-from-studio-to-photoshop/,Diana Kot,"¥7,200","¥1,380",Rating: 4.3 out of 54.3 - (22)
Premiere Pro CC: The Complete Video Editing Beginners Course,www.udemy.com/course/the-invisible-art-behind-video-editing/,Mark Lim,"¥11,400","¥1,380",Rating: 3.8 out of 53.8 - (36)
Power Video Editing: Adobe Premiere Pro in 45 min,www.udemy.com/course/power-video-editing-adobe-premiere-pro-in-45-min/,Dandan Liu,"¥2,400","¥1,440",Rating: 4.8 out of 54.8 - (7)
The Art and Business of Model Photography,www.udemy.com/course/dslr-photography-modelshoot-101/,Corey Reese,"¥2,400","¥1,440",Rating: 4.6 out of 54.6 - (30)
Start a Photography Business - Plan and startup documents,www.udemy.com/course/start-a-photography-business-plan-and-startup-documents/,Jeff Mack,"¥6,000","¥1,380",Rating: 3.6 out of 53.6 - (15)
"Lightroom 5, Master Adobe Lightroom 5 & Be More Productive",www.udemy.com/course/master-adobe-lightroom-5-be-more-productive/,Chris Parker,"¥4,800","¥1,380",Rating: 4.6 out of 54.6 - (17)
Mastering Camera Raw - Create Breathtaking Images,www.udemy.com/course/mastering-adobe-camera-raw/,Marcin Mikus,"¥6,000","¥1,380",Rating: 4.2 out of 54.2 - (123)
The Youtube Gaming Video Guide.,www.udemy.com/course/the-youtube-gaming-video-guide/,Final Render,"¥2,400","¥1,440",Rating: 4.1 out of 54.1 - (31)
Learn to retouch boudoir and nude photos fast and simple,www.udemy.com/course/retouching-boudoir-and-nude-photos/,Ilya Ishenko,"¥12,000","¥1,380",Rating: 4.2 out of 54.2 - (3)
Shoot Video with Magic Lantern in Canon DSLR Camera,www.udemy.com/course/shoot-like-a-pro-with-magic-lantern-in-canon-dslr-camera/,Nayeem Mahmud,$49.99,$11.39,Rating: 4.4 out of 54.4 - (9)
Photoshop 2020 For Cat Lovers!,www.udemy.com/course/photoshop-2020-for-cat-lovers/,Maya Cohen,$19.99,$11.39,Rating: 5.0 out of 55.0 - (2)
Green Screen Editing In After Effects- Learn The Basics,www.udemy.com/course/green-screen-editing-in-after-effects-learn-the-basics/,Bluefx .,$99.99,$11.39,Rating: 3.8 out of 53.8 - (13)
Mastering Photoshop Channel Masking,www.udemy.com/course/mastering-photoshop-channel-masking/,Robin Whalley,$29.99,$11.39,Rating: 4.4 out of 54.4 - (26)
Gaining Confidence With Speedlights,www.udemy.com/course/gaining-confidence-with-speedlights/,Eddie Makes,$44.99,$11.39,Rating: 4.0 out of 54.0 - (18)
Wedding Photography Workshop,www.udemy.com/course/wedding-photography-workshop/,Marcus Crosberg,$19.99,$11.39,Rating: 3.5 out of 53.5 - (6)
Adobe Lightroom CC - Complete Workflow Masterclass A to Z,www.udemy.com/course/lightroom-cc-for-photographers/,Ustin Kompaniets,$124.99,$11.39,Rating: 3.8 out of 53.8 - (91)
Shooting and Editing Basics,www.udemy.com/course/shooting-and-editing-basics/,Erika Gilsdorf & Scott Stohler,$19.99,$11.39,Rating: 5.0 out of 55.0 - (5)
Royalty Free Images : Get Millions of Stock Photo for Free,www.udemy.com/course/royalty-free-images-for-website-blog-or-commercial-use/,Brilliant Mentor,$99.99,$11.39,Rating: 3.9 out of 53.9 - (15)
Mastering Landscape Editing Using Lightroom,www.udemy.com/course/mastering-landscape-post-processing-using-lightroom/,Aws Zuhair,$29.99,$11.39,Rating: 4.2 out of 54.2 - (30)
Introduction to Wedding videography,www.udemy.com/course/introduction-to-wedding-videography/,Oluwadamilola Adewale,$39.99,$11.39,Rating: 0.0 out of 50.0 - (0)
"Single Light Photography with the Westcott Apollo 28""",www.udemy.com/course/single-light-photography-with-the-westcott-apollo-28/,McGunn Media,$59.99,$11.39,Rating: 4.2 out of 54.2 - (51)
Photography For Beginners: Master Camera Settings,www.udemy.com/course/photography-for-beginners-master-camera-settings/,Ben Taylor,$19.99,$11.39,Rating: 0.0 out of 50.0 - (0)
Professional Directing Techniques - from a working pro,www.udemy.com/course/directingvideo/,Victor Milt,$44.99,$11.39,Rating: 3.9 out of 53.9 - (8)
Photoshop Retouching-Learn Digital Art in Photoshop,www.udemy.com/course/photoshop-retouching-digital-art-photoshop/,Harsh Vardhan Art,$199.99,$11.39,Rating: 3.9 out of 53.9 - (53)
Video Production Video Editing & Video Marketing Made Simple,www.udemy.com/course/video-design-mastery-create-awesome-videos-fast/,"John Colley, Be A Video Pro",$199.99,$50.00,Rating: 3.6 out of 53.6 - (31)
Adobe Photoshop CC 2018 Beginners Course,www.udemy.com/course/adobe-photoshop-cc-2017-beginners-course/,iVito .,€19.99,€11.99,Rating: 4.5 out of 54.5 - (17)
Become Expert in Photoshop- City on Attack PhotoManipulation,www.udemy.com/course/learn-photo-manipulation-photo-editing-photoshop-beginners/,Harsh Vardhan Art,€199.99,€11.99,Rating: 4.2 out of 54.2 - (59)
"The Technical Side: Equipment, Software, Compression",www.udemy.com/course/the-technical-side/,Erika Gilsdorf & Scott Stohler,€44.99,€11.99,Rating: 4.5 out of 54.5 - (2)
"Color Grading for Filmmaking: The Vision, Art, and Science",www.udemy.com/course/colorgradingwithvision/,Dandan Liu,€149.99,€11.99,Rating: 4.0 out of 54.0 - (1)
Adobe Premiere Pro CC 2020: Learn Video Editing From Scratch,www.udemy.com/course/adobe-premiere-pro-cc-2020-master-video-editing-from-scratch/,Rahul Singh Nirvan,€199.99,€11.99,Rating: 4.6 out of 54.6 - (6)
Beginners DSLR Photography: Understanding Your Camera,www.udemy.com/course/beginners-dslr-course/,Sarah Drawwater,€19.99,€11.99,Rating: 4.2 out of 54.2 - (25)
Photo Composite in Photoshop-The Autumn Collector,www.udemy.com/course/learn-photo-composite-in-adobe-photoshop/,Harsh Vardhan Art,€199.99,€11.99,Rating: 4.2 out of 54.2 - (12)
Lightroom CC Mastery: Everything You Need to Know,www.udemy.com/course/lightroom-cc-mastery-everything-you-need-to-know/,Thomas King,€124.99,€11.99,Rating: 4.3 out of 54.3 - (144)
PowerDirector 14 - Video Editing for PC Users,www.udemy.com/course/professional-video-editing-with-powerdirector-for-pc-users/,"CyberLink Software, Phil Ebiner, Video School Online Inc",0,€19.99,Rating: 4.3 out of 54.3 - (342)
What They Didn't Teach you in Film School,www.udemy.com/course/nofilmschool/,Greg Hung,€99.99,€11.99,Rating: 0.0 out of 50.0 - (0)
Photoshop Retouching Masterclass,www.udemy.com/course/photoshop-retouching-masterclass/,Creative Video Library,€199.99,€11.99,Rating: 4.2 out of 54.2 - (3)
Analog Photography: How to Shoot Film in 5 Simple Steps,www.udemy.com/course/film-photography-how-to-shoot-film-in-5-simple-steps/,Christine Smith,€24.99,€11.99,Rating: 4.4 out of 54.4 - (7)
DaVinci Resolve 14+: Complete Guide to Video Editing,www.udemy.com/course/complete-guide-to-davinci-resolve-14/,Chris Navarre,€29.99,€11.99,Rating: 4.1 out of 54.1 - (21)
Quickly Master Mobile Photo Editing with Adobe Lightroom CC,www.udemy.com/course/mastermobilelightroomeditingwithoutpresets/,Steven Mather,€34.99,€11.99,Rating: 4.2 out of 54.2 - (4)
Using the Dodge & Burn Technique for Professional Photoshop,www.udemy.com/course/coloured-lighting-in-photoshop/,Kasia Zmokla,0,€69.99,Rating: 4.5 out of 54.5 - (45)
The Complete Adobe Premiere Pro CS6 Course For Beginners,www.udemy.com/course/adobepremierepro/,"Joe Parys, Michael Nguyen, Joe Parys Support",€199.99,€11.99,Rating: 4.2 out of 54.2 - (86)
Beginner Photography - From Start to Finish! ,www.udemy.com/course/beginner-photography-from-start-to-finish/,Dustin Olsen,$19.99,$11.99,Rating: 4.3 out of 54.3 - (5)
Video Content Accelerator: improve your video skills,www.udemy.com/course/video-content-accelerator-improve-your-video-skills/,Yarin Goren,$94.99,$11.99,Rating: 4.4 out of 54.4 - (12)
Master Photoshop Light Effects & Style Your Images,www.udemy.com/course/ps_light_fx/,Kasia Zmokla,0,$29.99,Rating: 4.5 out of 54.5 - (42)
Anatomy of Digital Photography,www.udemy.com/course/anatomy-of-digital-photography/,"George Kingsnorth, Michael N. Kingsnorth",$19.99,$11.99,Rating: 4.7 out of 54.7 - (7)
Video Editing Course: Premiere Pro CC for Beginners in 2020,www.udemy.com/course/premiere-pro-cc-novice-to-expert-how-to-earn-money-by-video/,Stephen Koel Soren,$19.99,$11.99,Rating: 4.4 out of 54.4 - (16)
Create Stunning Black & White Images with Nik Silver Efex,www.udemy.com/course/create-stunning-black-white-images-with-nik-silver-efexs/,Gary Detonnancourt,$24.99,$11.99,Rating: 3.7 out of 53.7 - (27)
Mastering the modelshoot : The Lightmeter,www.udemy.com/course/mastering-the-modelshoot-the-lightmeter/,Frank Doorhof,$24.99,$11.99,Rating: 4.7 out of 54.7 - (10)
Create a Perfect White Background for Video!,www.udemy.com/course/whitebackground/,Mark de Heide,$19.99,$11.99,Rating: 4.7 out of 54.7 - (20)
LIVE Streaming Music / Concert Events,www.udemy.com/course/live-streaming-music/,Paul Richards,$29.99,$11.99,Rating: 3.8 out of 53.8 - (8)
Bridal & Women's Portrait Photography on Location,www.udemy.com/course/bridal-womens-portrait-photography-on-location/,Photofonz Media,$124.99,$11.99,Rating: 4.0 out of 54.0 - (8)
Photography for Absolute Beginners,www.udemy.com/course/photography-for-absolute-beginners/,Robin Nichols,$104.99,$11.99,Rating: 0.0 out of 50.0 - (0)
Underwater Modeling & Photography Concept Design,www.udemy.com/course/underwater-modeling-photography-concept-design/,Christine Ren,$99.99,$11.99,Rating: 0.0 out of 50.0 - (0)
Architecture Photography - How To Photograph Any Building,www.udemy.com/course/architecture-photography-how-to-photograph-any-building/,Nancy Da Campo,$19.99,$11.99,Rating: 3.0 out of 53.0 - (1)
Photoshop Tips & Tricks For Social Media,www.udemy.com/course/photoshop-tips-tricks-for-social-media/,George Katsilidis,$64.99,$11.99,Rating: 4.9 out of 54.9 - (3)
The Professional Guide to High Quality Video Production,www.udemy.com/course/video-production-create-a-high-end-video/,ESA Films,$199.99,$11.99,Rating: 4.0 out of 54.0 - (9)
Photoshop Elements 2019 Made Easy Training Tutorial,www.udemy.com/course/photoshop-elements-2019-made-easy-training-tutorial/,"TeachUcomp, Inc.",$19.99,$11.99,Rating: 3.9 out of 53.9 - (9)
Lightroom Master Class-Edit Images Like a Pro+Free Presets,www.udemy.com/course/learn-lightroom-master-class/,Harsh Vardhan Art,"₩220,000","₩13,200",Rating: 3.7 out of 53.7 - (57)
Master Audio Editing In Premiere Pro,www.udemy.com/course/master-audio-editing-in-premiere-pro/,Reverse Cuts,"₩220,000","₩13,200",Rating: 4.1 out of 54.1 - (2)
Beyond Selfies: Mastering the Art of Smartphone Photography,www.udemy.com/course/beyond-selfies-mastering-the-art-of-smartphone-photography/,Life Skills Media,"₩22,000","₩13,200",Rating: 1.4 out of 51.4 - (2)
Digital Photography for Beginners,www.udemy.com/course/photography-for-beginners-/,Mujahid ur Rehman,"₩49,500","₩13,200",Rating: 4.7 out of 54.7 - (4)
From iMovie to Final Cut Pro X (FCPX) in Less Than 1 Hour,www.udemy.com/course/from-imovie-to-fcpx-in-less-than-1-hour/,Rafi Saar,"₩104,500","₩13,200",Rating: 3.9 out of 53.9 - (23)
Editing short fashion promo video in DaVinci Resolve,www.udemy.com/course/editing-in-resolve/,Anton Khumala,"₩77,000","₩13,200",Rating: 4.0 out of 54.0 - (4)
