Course,URL,instructor,Price (full),Price (discount),Rank
Photography Masterclass: A Complete Guide to Photography,www.udemy.com/course/photography-masterclass-complete-guide-to-photography/,"Phil Ebiner, William Carnahan, Video School Online Inc, Sam Shimizu-Jones",€199.99,€11.99,"Rating: 4.6 out of 54.6 - (26,550)"
Premiere Pro CC for Beginners: Video Editing in Premiere,www.udemy.com/course/adobe-premiere-pro-video-editing/,"Phil Ebiner, Video School Online Inc",€199.99,€11.99,"Rating: 4.6 out of 54.6 - (12,961)"
Adobe Lightroom Classic CC & CC: Photo Editing Masterclass,www.udemy.com/course/adobe-lightroom/,"Phil Ebiner, Rapid Growth Coaching Top 10% on Udemy, Video School Online Inc",€199.99,€11.99,"Rating: 4.3 out of 54.3 - (4,786)"
iPhone Photography | Take Professional Photos On Your iPhone,www.udemy.com/course/iphonephotography/,Dale McManus,€49.99,€11.99,"Rating: 4.7 out of 54.7 - (5,794)"
The Complete Video Production Bootcamp,www.udemy.com/course/video-production-bootcamp/,"Phil Ebiner, William Carnahan, Sam Shimizu-Jones, Video School Online Inc",€199.99,€11.99,"Rating: 4.5 out of 54.5 - (4,744)"
Night Photography: You Can Shoot Stunning Night Photos,www.udemy.com/course/night-photography/,"Phil Ebiner, William Carnahan, Sam Shimizu-Jones, Video School Online Inc",€99.99,€11.99,Rating: 4.5 out of 54.5 - (995)
Adobe Lightroom CC Masterclass: Complete Photo Editing Guide,www.udemy.com/course/adobe-lightroom-classic-cc-photo-editing-course/,"Phil Ebiner, Video School Online Inc",€199.99,€11.99,"Rating: 4.5 out of 54.5 - (1,031)"
Complete Filmmaker Guide: Become an Incredible Video Creator,www.udemy.com/course/incrediblevideocreator/,Julian Melanson,€199.99,€11.99,"Rating: 4.3 out of 54.3 - (2,144)"
The Complete Final Cut Pro X Course Beginner To Intermediate,www.udemy.com/course/finalcutproxcourse/,"Joe Parys, Joe Parys Support",€199.99,€11.99,"Rating: 4.4 out of 54.4 - (1,052)"
VIDEO STORYTELLING. Creative Excellence Class,www.udemy.com/course/videography-storytelling/,Andrew St.Pierre White,€149.99,€11.99,Rating: 4.5 out of 54.5 - (560)
Color Grading with Da Vinci Resolve:  Beginner to Advanced,www.udemy.com/course/color-grading-with-da-vinci-resolve-beginner-to-advanced/,Matthew Falconer,€149.99,€11.99,Rating: 4.6 out of 54.6 - (665)
Film using ANY Camera! Basics of Shooting Video Correctly,www.udemy.com/course/videocamerabasics/,Gene Nagata,0,€49.99,Rating: 4.7 out of 54.7 - (541)
Beginner Nikon Digital SLR (DSLR) Photography,www.udemy.com/course/jp-nikon-dslr-for-beginners/,JP Teaches Photo .,€29.99,€11.99,"Rating: 4.6 out of 54.6 - (3,894)"
Affinity Photo: Solid Foundations,www.udemy.com/course/affinityphoto-solid-foundations/,Simon Foster,€99.99,€11.99,"Rating: 4.5 out of 54.5 - (3,082)"
Video Editing in DaVinci Resolve 15:  Beginner to Advanced,www.udemy.com/course/davinci-resolve-15-course/,Louay Zambarakji,€199.99,€11.99,Rating: 4.5 out of 54.5 - (919)
GIMP 2.10 Masterclass: From Beginner to Pro Photo Editing,www.udemy.com/course/gimp-photo-editing/,Michael Davies,€199.99,€11.99,Rating: 4.5 out of 54.5 - (830)
Mastering Architecture and Real Estate Photography,www.udemy.com/course/mastering-architecture-and-real-estate-photography/,Charlie Borland,€74.99,€11.99,"Rating: 4.4 out of 54.4 - (2,283)"
Photography Composition & Portrait Photography Masterclass,www.udemy.com/course/creative-photography-composition-masterclass/,"Mark Timberlake, Philomena Timberlake",€199.99,€11.99,Rating: 4.6 out of 54.6 - (975)
Video Production Masterclass: Complete Video Camera Course,www.udemy.com/course/video-production-masterclass-complete-video-camera-course/,"Chris Haroun, Steven Washer",€199.99,€11.99,Rating: 4.7 out of 54.7 - (110)
Digital Photography for Beginners with DSLR cameras,www.udemy.com/course/digital-photography-for-beginners-with-dslr-cameras/,Villiers Steyn,€99.99,€11.99,"Rating: 4.6 out of 54.6 - (1,841)"
Hollywood Film School: Filmmaking & TV Directing Masterclass,www.udemy.com/course/hollywood-film-television-video-directing-filmmaker/,"IFH Courses, Gil Bettman",€174.99,€11.99,Rating: 4.4 out of 54.4 - (756)
VIDEO CINEMATOGRAPHY techniques loved by pro filmmakers,www.udemy.com/course/motivate-inspire-and-empower-your-video-audience/,Andrew St.Pierre White,€99.99,€11.99,"Rating: 4.4 out of 54.4 - (1,221)"
Make Epic Videos for the Internet!,www.udemy.com/course/make-epic-videos-for-the-internet/,Gene Nagata,0,€49.99,Rating: 4.7 out of 54.7 - (787)
Cinematography Course: Shoot Better Video with Any Camera,www.udemy.com/course/online-cinematography-course-filmmaking-video-production-lighting/,"Phil Ebiner, William Carnahan, Video School Online Inc",€199.99,€11.99,"Rating: 4.2 out of 54.2 - (2,061)"
Documentary Filmmaking Masterclass,www.udemy.com/course/documentary-filmmaking-masterclass/,Jonny Von Wallström,€99.99,€11.99,Rating: 4.1 out of 54.1 - (366)
YOUTUBE VIDEO CONTENT CREATORS - Follow the YouTube masters,www.udemy.com/course/youtube-content-masterclass/,Andrew St.Pierre White,€154.99,€11.99,Rating: 4.6 out of 54.6 - (473)
Affinity Photo: Beginner to Pro via Reference and Workflow,www.udemy.com/course/affinity-photo-beginner-to-pro-via-reference-and-workflow/,Simon Foster,€99.99,€11.99,Rating: 4.6 out of 54.6 - (774)
Adobe Lightroom CC + Classic // Learn Photo Editing by Pro,www.udemy.com/course/master-adobe-lightroom-6-in-1-day/,Chris Parker,€199.99,€11.99,Rating: 4.3 out of 54.3 - (955)
Cinematography Course: Shoot Expert Video on Any Camera,www.udemy.com/course/cinematographycourse/,Dale McManus,€74.99,€11.99,"Rating: 4.6 out of 54.6 - (1,521)"
Nikon DSLR Photography: Getting Started with Your DSLR,www.udemy.com/course/nikon-camera-photography-course/,"Phil Ebiner, Video School Online Inc, William Carnahan",€99.99,€11.99,Rating: 4.7 out of 54.7 - (102)
Affinity Photo for the iPad,www.udemy.com/course/affinity-photo-for-the-ipad/,Simon Foster,€99.99,€11.99,Rating: 4.5 out of 54.5 - (817)
Wedding Photography: Complete Guide to Wedding Photography,www.udemy.com/course/wedding-photography-course/,"Phil Ebiner, William Carnahan, Video School Online Inc",€199.99,€11.99,"Rating: 4.4 out of 54.4 - (1,166)"
Portrait Photography and Posing For Photographers,www.udemy.com/course/photography-posing/,Rapid Growth Coaching Top 10% on Udemy,"₩220,000","₩13,200",Rating: 4.0 out of 54.0 - (755)
Beginner Canon Digital SLR (DSLR) Photography,www.udemy.com/course/beginner-canon-digital-slr-dslr-photography-class-jp/,JP Teaches Photo .,"₩33,000","₩13,200","Rating: 4.5 out of 54.5 - (1,934)"
Documentary Filmmaking with Soul,www.udemy.com/course/documentary-filmmaking-with-soul/,Dandan Liu,"₩165,000","₩13,200",Rating: 4.5 out of 54.5 - (289)
Cinematic Color Grading: Making Your Videos Come Alive,www.udemy.com/course/cinematic-color-grading-course/,Matti Haapoja,"₩165,000","₩41,250",Rating: 4.4 out of 54.4 - (953)
VIDEO EDITING. Techniques loved by pro broadcast filmmakers,www.udemy.com/course/creative-video-editing-how-to-edit-to-engage-your-audience/,Andrew St.Pierre White,"₩110,000","₩13,200",Rating: 4.5 out of 54.5 - (696)
Drone Photography | Shoot Professional Photos With Any Drone,www.udemy.com/course/dronephotography/,Dale McManus,"₩82,500","₩13,200",Rating: 4.7 out of 54.7 - (667)
Basic Food Photography,www.udemy.com/course/basic-food-photography/,Andrew Olson,"₩55,000","₩13,200",Rating: 4.5 out of 54.5 - (692)
Beginner Photography Composition,www.udemy.com/course/photography-composition-course/,"JP Teaches Photo ., Phil Ebiner, Video School Online Inc","₩110,000","₩13,200",Rating: 4.3 out of 54.3 - (55)
Canon DSLR Photography: Getting Started with Your DSLR,www.udemy.com/course/canon-dslr-photography-course/,"Phil Ebiner, Video School Online Inc","₩110,000","₩13,200",Rating: 4.7 out of 54.7 - (179)
Documentary Filmmaking Step by Step,www.udemy.com/course/documentary-filmmaking-step-by-step/,Adam Bhala Lough,"₩220,000","₩13,200",Rating: 4.0 out of 54.0 - (316)
Ultimate Guide to Landscape and Nature Photography,www.udemy.com/course/ultimate-guide-to-landscape-and-nature-photography/,Charlie Borland,"₩66,000","₩13,200",Rating: 4.2 out of 54.2 - (430)
Affinity Photo: Complete Guide to Photo Editing in Affinity,www.udemy.com/course/affinity-photo/,"Phil Ebiner, Video School Online Inc, Jeremy Hazel","₩220,000","₩13,200",Rating: 4.2 out of 54.2 - (317)
"Filmmaking: Write, Direct and Distribute Your Feature Film",www.udemy.com/course/indiefilmmaking/,Paul Bright,"₩220,000","₩13,200",Rating: 4.5 out of 54.5 - (307)
Photography Beginners: DSLR Photography Camera Settings,www.udemy.com/course/dslr-camera-settings-photography-for-beginners-photography-made-easy/,Rosie Parsons,"₩110,000","₩13,200","Rating: 4.6 out of 54.6 - (1,005)"
Start Your Photography Business - The Complete Course,www.udemy.com/course/photography-business-course/,"Phil Ebiner, Video School Online Inc, William Carnahan","₩110,000","₩13,200",Rating: 4.3 out of 54.3 - (128)
Posing Like A Pro: Create Your Best Portraits Ever! Part 1,www.udemy.com/course/posing-like-a-pro-create-your-best-portraits-ever/,Sandy Dee,"₩220,000","₩13,200",Rating: 4.3 out of 54.3 - (465)
Photography - The Ultimate Guide to Using Off-Camera Flash,www.udemy.com/course/photography-off-camera-flash-using-speedlights/,Bernie Raffe AMPA,$34.99,$14.99,Rating: 4.5 out of 54.5 - (936)
Food Photography: Capturing Food in Your Kitchen,www.udemy.com/course/food-photography/,"Phil Ebiner, William Carnahan, Video School Online Inc",$99.99,$15.59,"Rating: 4.5 out of 54.5 - (1,134)"
Photography - Become a Better Photographer - Part I,www.udemy.com/course/great-photography-tips-photo-tutorials/,Bernie Raffe AMPA,$34.99,$15.59,"Rating: 4.5 out of 54.5 - (1,493)"
Guide to DaVinci Resolve 16 Video Editing,www.udemy.com/course/guide-to-davinci-resolve-16-video-editing/,Chris Navarre,$39.99,$11.39,Rating: 4.1 out of 54.1 - (109)
Learn Adobe After Effects CC 2019 for Beginners,www.udemy.com/course/adobe-after-effects-beginners/,Jordy Vandeput,$99.99,$11.39,Rating: 4.8 out of 54.8 - (217)
Affinity Photo: The Little Box of Tricks,www.udemy.com/course/affinity-photo-the-little-box-of-tricks/,Simon Foster,$99.99,$13.19,Rating: 4.3 out of 54.3 - (510)
The Art of Finding Light: Photography for the artist in you,www.udemy.com/course/a-room-for-improvement-the-art-of-finding-light/,Adam Marelli,$19.99,$11.99,Rating: 4.5 out of 54.5 - (576)
A Practical Guide to Shooting Video on Panasonic GH5 & GH5S,www.udemy.com/course/gh5guide/,Myles Fearnley,$89.99,$22.50,Rating: 4.4 out of 54.4 - (183)
Lightroom CC MasterClass,www.udemy.com/course/lightroom-cc-masterclass/,Martin Perhiniak,$199.99,$14.99,Rating: 4.5 out of 54.5 - (143)
Color Grading Masterclass: Resolve 15,www.udemy.com/course/color-grading-masterclass/,Jonny Von Wallström,$139.99,$16.79,Rating: 4.2 out of 54.2 - (409)
Adobe Lightroom CC: Landscape Photography Masterclass 2020,www.udemy.com/course/lightroom-cc-masterclass-landscape-photography-workflow/,Fabian Rosshirt,$179.99,$15.59,Rating: 4.6 out of 54.6 - (436)
Sell Stock Footage & Photography from ZERO to PASSIVE INCOME,www.udemy.com/course/stockcreators/,Gui Siebert Make Money Online with Stock Photography & Stock Footage,0,$29.99,Rating: 4.6 out of 54.6 - (234)
Posing Like A Pro: The Ultimate Posing Flow! Part 2,www.udemy.com/course/the-ultimate-posing-flow-for-portrait-photographers/,Sandy Dee,$199.99,$14.99,Rating: 4.3 out of 54.3 - (132)
The Complete Adobe Premiere Pro CC Master Class Course,www.udemy.com/course/adobepremiereprocc/,"Joe Parys, Joe Parys Support, Jack Cole",$199.99,$14.39,Rating: 4.6 out of 54.6 - (496)
The Ultimate Photoshop Elements Training Bundle - 73 Hours,www.udemy.com/course/the-ultimate-photoshop-elements-training-course/,Simon Sez IT,$199.99,$16.19,Rating: 4.2 out of 54.2 - (308)
Complete Guide to Colour Grading in Final Cut Pro X,www.udemy.com/course/fcpx-grading/,Myles Fearnley,$89.99,$22.50,Rating: 4.5 out of 54.5 - (33)
DSLR Video Production - Start Shooting Better Video Today,www.udemy.com/course/dslr-video-production-online-course-tutorial-training/,"Phil Ebiner, Video School Online Inc","¥24,000","¥1,440","Rating: 4.3 out of 54.3 - (1,065)"
The Ultimate Photography Course For Beginners,www.udemy.com/course/the-ultimate-photography-course-for-beginners/,Jellis Vaes,"¥24,000","¥1,440",Rating: 4.4 out of 54.4 - (569)
The Ultimate Beginner's Guide to Outdoor Photography - 2018,www.udemy.com/course/joshkatz/,Josh Katz,"¥24,000","¥1,440",Rating: 4.5 out of 54.5 - (483)
The Craft of Photoshop: Solid Foundations,www.udemy.com/course/the-craft-of-photoshop-solid-foundations/,Simon Foster,"¥24,000","¥1,440",Rating: 4.8 out of 54.8 - (29)
Final Cut Pro X - Beginner To Advanced ( FCP MASTERY 2020 ),www.udemy.com/course/final-cut-pro-x-beginner-to-advanced-z/,"Craig Blewett, Joshua Blewett","¥22,800","¥1,440",Rating: 4.2 out of 54.2 - (155)
Video Editing: Premiere Pro & After Effects Dynamic Linking,www.udemy.com/course/video-editing-premiere-pro-after-effects-dynamic-linking/,Louay Zambarakji,"¥12,600","¥1,440",Rating: 4.5 out of 54.5 - (192)
How to be a Professional Outdoor and Nature Photographer,www.udemy.com/course/how-to-be-a-professional-outdoor-and-nature-photographer/,Charlie Borland,"¥7,200","¥1,440",Rating: 4.5 out of 54.5 - (816)
Photoshop Retouching Techniques for Every Problem,www.udemy.com/course/photoshop-retouching-techniques-for-every-problem/,Marcin Mikus,"¥24,000","¥1,440",Rating: 4.5 out of 54.5 - (55)
Stunning Aerial Videography and Photography Using Drones,www.udemy.com/course/drones-aerial-videography-and-photography/,Bruce Geddes,"¥11,400","¥1,440",Rating: 4.1 out of 54.1 - (977)
EasyDSLR Digital Photography Course for Beginners,www.udemy.com/course/easydslr-for-beginners/,Ken Schultz,"¥4,200","¥1,440",Rating: 4.5 out of 54.5 - (663)
Night Sky Photography - Milky Way and Star Trails,www.udemy.com/course/photographing-the-night-sky-milky-way-and-star-trails/,"Sandy Dee, Matthew Dee","¥24,000","¥1,440",Rating: 4.8 out of 54.8 - (203)
The Art of Seeing Photography training for the Artist in you,www.udemy.com/course/a-room-for-improvement/,Adam Marelli,"¥2,400","¥1,440",Rating: 4.5 out of 54.5 - (887)
Shoot & Edit iPhone Video Like a Pro - Masterclass,www.udemy.com/course/make-smartphone-video-like-a-pro-level-1/,Robb Montgomery,"¥24,000","¥1,440",Rating: 4.0 out of 54.0 - (510)
Sony A7Riii / A7iii Crash Course,www.udemy.com/course/sony-a7riii-crash-course/,Michael Andrew,0,"¥4,800",Rating: 4.4 out of 54.4 - (93)
iPhone 11 Video: Filmic Pro & LumaFusion: iPhone Filmmaking,www.udemy.com/course/iphone-pro-filmmaking/,Robb Montgomery,"¥12,000","¥1,440",Rating: 4.7 out of 54.7 - (37)
Elevate Your Photography - Master Composition.,www.udemy.com/course/elevate-your-photography/,El Gale,"¥9,000","¥1,440",Rating: 4.3 out of 54.3 - (568)
Premiere Pro Lumetri: Color Correct like a Pro,www.udemy.com/course/premiere-pro-lumetri-color-correct-like-a-pro/,Jordy Vandeput,€39.99,€11.99,Rating: 4.5 out of 54.5 - (774)
DJI Drones: How To Become The Ultimate Pilot,www.udemy.com/course/dji-drones-how-to-become-the-ultimate-pilot/,Alex Shoolman,€199.99,€13.19,Rating: 4.2 out of 54.2 - (238)
Pro Long Exposure Photography: Learn from the best,www.udemy.com/course/long-exposure-photography-e/,"Rapid Growth Coaching Top 10% on Udemy, Robert Warren",€199.99,€11.99,Rating: 4.3 out of 54.3 - (266)
The Art of Black and White Photography,www.udemy.com/course/the-art-of-black-and-white-photography/,David J. Nightingale,€149.99,€14.99,Rating: 4.3 out of 54.3 - (822)
How to Be a Commercial Photographer,www.udemy.com/course/total-training-in-commercial-photography/,Charlie Borland,€94.99,€11.39,Rating: 4.7 out of 54.7 - (241)
Become an iMovie Master - Create Amazing Movies Today,www.udemy.com/course/masteringimovie/,Steve Burnich,€199.99,€11.39,Rating: 4.6 out of 54.6 - (447)
Perspective: Photography tools that make your pictures POP,www.udemy.com/course/perspective-photography-tools-that-make-your-pictures-pop-adam-marelli/,Adam Marelli,€19.99,€11.39,Rating: 4.5 out of 54.5 - (631)
SOUND for Film and Television,www.udemy.com/course/sound-for-film-and-television/,Wrightsville Beach Studios,€49.99,€12.50,Rating: 4.7 out of 54.7 - (274)
The Art of Figure to Ground: Photography's untaught secret,www.udemy.com/course/a-room-for-improvement-the-art-of-figure-to-ground/,Adam Marelli,€19.99,€11.39,Rating: 4.6 out of 54.6 - (473)
Street Photography for Beginners,www.udemy.com/course/photography-with-anthony-carbajal/,"Phil Ebiner, Anthony Carbajal, Video School Online Inc",€99.99,€13.19,Rating: 4.7 out of 54.7 - (359)
TV Documentary Professional Productions. Start to finish.,www.udemy.com/course/learn-by-example-gripping-tv-documentaries/,Andrew St.Pierre White,€94.99,€11.99,Rating: 4.7 out of 54.7 - (384)
How to VLOG: Complete Beginner's Course,www.udemy.com/course/vlogging/,Brad Newton,€149.99,€13.19,Rating: 4.6 out of 54.6 - (216)
The Complete Talking Head Video Production Masterclass,www.udemy.com/course/the-complete-talking-head-video-production-masterclass/,TJ Walker,€199.99,€11.39,Rating: 4.4 out of 54.4 - (111)
Professional Retouching Course in Photoshop,www.udemy.com/course/professional-retouching-in-photoshop/,Marcin Mikus,€199.99,€11.39,Rating: 4.5 out of 54.5 - (802)
Complete Photography : 21 Courses in 1 [Beginner to Expert],www.udemy.com/course/interactive-photography-basics/,Creative Online School,€199.99,€11.39,Rating: 3.8 out of 53.8 - (478)
Drone Video for Real Estate Masterclass,www.udemy.com/course/drone-real-estate-course/,R-P Plourde,€199.99,€11.99,Rating: 4.7 out of 54.7 - (99)
Learning Final Cut Pro X - Video Editing Mastery ,www.udemy.com/course/learning-final-cut-pro-x-video-editing-mastery/,Infinite Skills,€49.99,€11.99,Rating: 4.4 out of 54.4 - (924)
The Ultimate Photography Course - Beginner to Advanced,www.udemy.com/course/the-ultimate-photography-course-beginner-to-advanced/,Quinton Batchelor,€199.99,€11.99,Rating: 4.6 out of 54.6 - (175)
"Portrait Photography Masterclass, All About Headshots",www.udemy.com/course/portrait-photography/,"Rapid Growth Coaching Top 10% on Udemy, Phil Ebiner, Video School Online Inc",€99.99,€11.99,Rating: 4.3 out of 54.3 - (313)
Filmmaking in a Box: Indie Feature Film Masterclass,www.udemy.com/course/filmmaker-in-a-box-filmmaking-video-production/,IFH Courses,€99.99,€11.99,Rating: 3.9 out of 53.9 - (84)
Real Estate Photography: How To Get Started,www.udemy.com/course/real-estate-photography/,Greg Gottfried,€89.99,€11.99,Rating: 4.6 out of 54.6 - (406)
Affinity Photo: Raw Image Development,www.udemy.com/course/affinity-photo-raw-image-development/,Simon Foster,€59.99,€11.99,Rating: 4.5 out of 54.5 - (573)
How To Make A Living Making Films: Business Of Filmmaking,www.udemy.com/course/how-to-earn-6-figures-making-films-business-of-filmmaking/,Matti Haapoja,€94.99,€23.75,Rating: 4.1 out of 54.1 - (427)
Record Your Voice Like A Pro! The Complete Voice Over Course,www.udemy.com/course/voicerecord/,"Joe Parys, Justin Fraction, Joe Parys Support",€199.99,€11.99,Rating: 4.5 out of 54.5 - (158)
Quick & Easy Stop-Motion (iPhone + Android),www.udemy.com/course/quick-easy-stop-motion-iphone-android/,Colette Peri,€49.99,€19.99,Rating: 4.3 out of 54.3 - (28)
Affinity Photo: Modern Special Effects,www.udemy.com/course/affinity-photo-modern-special-effects/,Simon Foster,€59.99,€11.99,Rating: 4.6 out of 54.6 - (79)
Photography - Become a Better Photographer - Part II,www.udemy.com/course/ultimate-guide-to-dslr-camera-settings/,Bernie Raffe AMPA,€34.99,€11.99,Rating: 4.5 out of 54.5 - (403)
Photography for Kids: Project-Based Beginner Photography,www.udemy.com/course/photography-for-kids-online-course/,"Phil Ebiner, Anthony Ebiner, Video School Online Inc",€99.99,€11.99,Rating: 4.3 out of 54.3 - (664)
Final Cut Pro X: The Complete Guide to Final Cut Pro X,www.udemy.com/course/final-cut-pro-x-course/,"Video School Online Inc, Phil Ebiner, Greg Hung",€199.99,€11.99,Rating: 3.6 out of 53.6 - (195)
Fuji X-T3 Crash Course,www.udemy.com/course/fuji-x-t3-crash-course/,Michael Andrew,0,€39.99,Rating: 4.4 out of 54.4 - (51)
Cinematic Wedding Films: A Guide to Wedding Videography,www.udemy.com/course/cinematic-wedding-films/,Matti Haapoja,€94.99,€23.75,Rating: 4.2 out of 54.2 - (697)
DSLR Filmmaking: From Beginner to PRO!,www.udemy.com/course/dslr-filmmaking-beginner-pro/,Jordy Vandeput,€69.99,€11.99,Rating: 4.6 out of 54.6 - (529)
Set Up A Photography Studio With Equipment - On A Budget,www.udemy.com/course/setting-up-a-photography-studio-lighting-masterclass/,Sandy Dee,"¥15,000","¥1,440",Rating: 4.6 out of 54.6 - (192)
Adobe Lightroom Masterclass - Beginner to Expert,www.udemy.com/course/adobe-lightroom-masterclass-beginner-to-expert/,YouAccel Training,"¥24,000","¥1,440",Rating: 4.4 out of 54.4 - (183)
Become a master drone pilot in 2 weeks and start a business,www.udemy.com/course/how-to-start-your-own-aerial-filming-business/,Umair Vanthaliwala,"¥24,000","¥1,440",Rating: 4.0 out of 54.0 - (590)
Mobile Video Journalism - Pro iPhone video editing course,www.udemy.com/course/mobile-journalism-video-for-cnn-correspondents/,Robb Montgomery,"¥23,400","¥1,440",Rating: 4.6 out of 54.6 - (168)
LumaFusion Ver 2+ for Beginners,www.udemy.com/course/luma-fusion-for-beginners/,Lance Tegner,"¥2,400","¥1,440",Rating: 4.6 out of 54.6 - (122)
Photoshop Elements 2019 Training: From Beginner to Pro,www.udemy.com/course/adobe-photoshop-elements-2019-training-course/,Simon Sez IT,"¥3,600","¥1,440",Rating: 4.6 out of 54.6 - (135)
Drone Training: 50 Drills to Improve Your Flying Skills,www.udemy.com/course/drone-training-50-drills-to-improve-your-flying-skills/,Greg Reverdiau,"¥3,000","¥1,440",Rating: 4.7 out of 54.7 - (28)
Drone Videography. Creative Excellence Course.,www.udemy.com/course/drone-videography-creative-excellence-class/,Andrew St.Pierre White,"¥6,600","¥1,440",Rating: 4.5 out of 54.5 - (48)
"Easy Product Photography with iPhone, Smartphone or Camera",www.udemy.com/course/product-photography-with-iphone-or-smartphone/,Dave B.,"¥2,400","¥1,440",Rating: 4.3 out of 54.3 - (203)
Adobe Premiere Pro CC 2018: Color Grading Masterclass,www.udemy.com/course/adobe-premiere-color-grading-masterclass/,George Katsilidis,"¥24,000","¥1,440",Rating: 4.1 out of 54.1 - (134)
Bob Davis' Professional Photography Lighting Techniques,www.udemy.com/course/bob-davis-professional-photography-lighting-techniques/,John Wiley & Sons,"¥6,000","¥1,440",Rating: 4.6 out of 54.6 - (291)
Photography - Canon EOS 1300D / REBEL T6 Camera User Course,www.udemy.com/course/canon-eos-1300d-rebel-t6-camera-user-guide/,Jeremy Bayston,"¥4,200","¥1,440",Rating: 4.7 out of 54.7 - (358)
iPhone Photography: Take Amazing Photos with your iPhone,www.udemy.com/course/iphone-photography-take-amazing-photos-with-your-iphone/,Life Progression Project,"¥24,000","¥1,440",Rating: 4.4 out of 54.4 - (69)
Turn Photographs Into Digital Paintings Using Photoshop ,www.udemy.com/course/turn-your-photographs-into-paintings-using-photoshop/,Lori Jill,"¥12,000","¥1,440",Rating: 4.4 out of 54.4 - (343)
GIMP 2.8/2.10 Beginner-Advanced: Free on Windows/MacOS/Linux,www.udemy.com/course/gimp-for-beginners-complete-project-based-training-series/,Brian Jackson,"¥2,400","¥1,440",Rating: 4.5 out of 54.5 - (577)
Nikon Z6 / Z7 Crash Course,www.udemy.com/course/nikon-z6-z7-crash-course/,Michael Andrew,0,"¥4,800",Rating: 4.6 out of 54.6 - (36)
Videography for Beginners: Shooting With a DSLR /Mirrorless,www.udemy.com/course/videography-for-beginners-shooting-with-a-dslr-mirrorless/,Kush Sharma,£149.99,£17.99,Rating: 4.5 out of 54.5 - (44)
Photography - Canon  2000D/1500D/REBEL T7 Camera User Course,www.udemy.com/course/photography-canon-eos-2000d-rebel-t7-camera-user-course/,Jeremy Bayston,£34.99,£11.99,Rating: 4.7 out of 54.7 - (90)
Final Cut Pro X - The ultimate guide,www.udemy.com/course/final-cut-pro-x-from-zero-to-pro/,Konrad Vilhjalmsson,£39.99,£11.99,Rating: 4.6 out of 54.6 - (66)
The Ultimate Recipe For Taking Amazing Portraits Every Time!,www.udemy.com/course/the-ultimate-recipe-for-taking-amazing-portraits-every-time/,Sandy Dee,£89.99,£11.99,Rating: 4.6 out of 54.6 - (32)
"Posing Masterclass 2019 (Models, Couples, Families)",www.udemy.com/course/posing-masterclass-models-couples-families/,Alex Dominguez,£199.99,£11.99,Rating: 4.2 out of 54.2 - (27)
Adobe Premiere Pro: Ultimate Beginner Course,www.udemy.com/course/premiere-pro-with-brad-newton/,Brad Newton,£199.99,£17.99,Rating: 4.5 out of 54.5 - (463)
Photography - Individual & Family Posing - Live Sessions,www.udemy.com/course/photography-individual-and-family-posing/,Bernie Raffe AMPA,£34.99,£11.99,Rating: 4.6 out of 54.6 - (295)
Fusion VFX in Davinci Resolve 16,www.udemy.com/course/fusion-vfx-in-davinci-resolve/,Nick Carter,£19.99,£11.99,Rating: 4.2 out of 54.2 - (31)
Sony A6100/A6400/A6600 Crash Course Training Tutorial Video,www.udemy.com/course/sony-a6400-crash-course-traiing-tutorial-video/,Michael Andrew,0,£39.99,Rating: 4.8 out of 54.8 - (30)
"The Unofficial Guide to Sony's a6000, a6300, and a6500",www.udemy.com/course/the-unofficial-guide-to-the-sony-a6000/,Forge Productions,£119.99,£11.99,Rating: 4.2 out of 54.2 - (220)
High End Beauty Retouching in Photoshop 2.0,www.udemy.com/course/professional-beauty-retouching-in-photoshop/,Marcin Mikus,£199.99,£11.99,Rating: 4.6 out of 54.6 - (168)
Affinity Photo for the iPad: Special Effects,www.udemy.com/course/affinity-photo-for-the-ipad-special-effects/,Simon Foster,£59.99,£11.99,Rating: 4.8 out of 54.8 - (37)
