Course,URL,instructor,Price (full),Price (discount),Rank
Portraitfotografie mit Blitz + Retusche und Bildbearbeitung,www.udemy.com/course/portraitfotografie-und-bearbeitung/,Andrey Isotov,"₩33,000","₩13,200",Rating: 4.1 out of 54.1 - (9)
DaVinci Resolve 15/16 - (4) Fusion (Einsteigerkurs),www.udemy.com/course/davinci-resolve-15-4-fusion-einsteigerkurs/,Jürgen Möthrath,"₩27,500","₩13,200",Rating: 4.2 out of 54.2 - (7)
Corso intensivo di Equipaggiamento Video,www.udemy.com/course/equipaggiamento-video-vm24/,Michele Bonechi,0,"₩22,000",Rating: 4.8 out of 54.8 - (3)
Азбука Adobe Premiere 2019,www.udemy.com/course/adobe-premiere-free/,Илья Зернов,"₩22,000","₩13,200",Rating: 4.8 out of 54.8 - (26)
Aprenda a Fotografar no Modo Manual,www.udemy.com/course/aprenda-a-fotografar-no-modo-manual/,Claudia Tavares,"₩66,000","₩13,200",Rating: 4.4 out of 54.4 - (163)
Final Cut Pro X 10.2 e aggiornamento 10.3,www.udemy.com/course/final-cut-pro-x-102-e-aggiornamento-103/,Teacher-in-a-Box | Videocorsi Professionali,0,"₩44,000",Rating: 4.2 out of 54.2 - (36)
Photoshop İle Etkileyici Fotoğraf Düzenleme Teknikleri II,www.udemy.com/course/etkileyici-fotograf-duzenleme-teknikleri-ii/,İlhan Eroğlu,0,"₩159,500",Rating: 4.2 out of 54.2 - (2)
Curso de Adobe Premiere Pro CC,www.udemy.com/course/aprende-adobe-premiere-pro-cc/,Estudio Other Space,"₩55,000","₩13,200",Rating: 3.7 out of 53.7 - (129)
Curso de Fotografia - Método Thales Trigo,www.udemy.com/course/curso-de-fotografia-metodo-thales-trigo/,Thales Trigo,0,"₩126,500",Rating: 4.7 out of 54.7 - (13)
Final Cut Pro X: Corrección de color y etalonaje avanzado,www.udemy.com/course/final-cut-pro-x-etalonaje-y-correccion-de-color/,Jesús Hernández Ruiz,$199.99,$11.99,Rating: 4.7 out of 54.7 - (11)
Grundlagen der digitalen Fotografie-Einsteiger,www.udemy.com/course/grundlagen-der-digitalen-fotografie-einsteiger/,Stefan Radinger,$34.99,$11.99,Rating: 4.2 out of 54.2 - (53)
Color Grading: Seus Vídeos com Qualidade de Cinema,www.udemy.com/course/curso-color-grading/,Asteroide LAB,$19.99,$11.99,Rating: 4.0 out of 54.0 - (196)
Corso rapido su Luminar 3 da zero! In Italiano,www.udemy.com/course/luminar3-corso-rapido-in-italiano/,Alessio Furlan,$24.99,$11.99,Rating: 4.7 out of 54.7 - (101)
Premiere Pro CC : Domine o melhor editor de videos do mundo.,www.udemy.com/course/premiere-pro-cc-r/,Vejaeaprenda Treinamentos em Software,$19.99,$11.99,Rating: 4.3 out of 54.3 - (137)
Film Çekim Teknikleri (Kamera Hareketleri - Açılar-Ölçekler),www.udemy.com/course/film-cekim-teknikleri/,İstanbul Film Akademi,$19.99,$11.99,Rating: 4.1 out of 54.1 - (55)
Adobe Lightroom CC Classic 2020 - Coerente e fácil!,www.udemy.com/course/adobe-lightroom-cc-classic-2020-descomplicado/,Carlos Eduardo Rincon,$199.99,$11.99,Rating: 4.5 out of 54.5 - (4)
Fotos im Gemäldelook,www.udemy.com/course/fotos-im-gemaeldelook/,Corwin von Kuhwede,0,$99.99,Rating: 4.8 out of 54.8 - (12)
Die Milchstraße fotografieren lernen für Anfänger,www.udemy.com/course/milchstrassenfotografie/,Lars Wilhelm,$19.99,$11.99,Rating: 4.1 out of 54.1 - (8)
摄影后期处理--为摄影爱好者学习后期处理量身打造,www.udemy.com/course/ssnyapco/,lin feng lou,$199.99,$11.99,Rating: 5.0 out of 55.0 - (1)
Edición de fotos espectaculares en el iPhone con Snapseed,www.udemy.com/course/editar-fotos-iphone-snapseed/,Edgar Felipe Fuentes Perea,$19.99,$11.99,Rating: 4.5 out of 54.5 - (12)
Schritt für Schritt Hundeportraits im Studio,www.udemy.com/course/hundeportraits-im-studio/,Tobias Gawrisch,$39.99,$11.99,Rating: 4.7 out of 54.7 - (15)
1回の撮影から3つの作品を作り出す！3倍楽しい星景写真,www.udemy.com/course/133-zaem/,及川 均,$69.99,$11.99,Rating: 4.0 out of 54.0 - (21)
Adobe Premiere Pro y Adobe After Effects - 2 cursos en 1,www.udemy.com/course/adobe-premiere-pro-y-adobe-after-effects-2-cursos-en-1/,Biblioteca Digital x86,$24.99,$11.99,Rating: 4.0 out of 54.0 - (1)
WakeUp | Aperfeiçoar - Fotografia de Recém-Nascidos,www.udemy.com/course/wakeup-aperfeicoar-fotografia-de-recem-nascidos/,José Cruz,$59.99,$19.99,Rating: 4.5 out of 54.5 - (150)
Final Cut Pro X 10.3 - Montage vidéo de façon pro -Débutants,www.udemy.com/course/final-cut-pro-x-montage-video-de-facon-pro-debutants/,Etienne de Saint Victor,$34.99,$10.99,Rating: 3.8 out of 53.8 - (109)
Smartphone Fotografie,www.udemy.com/course/smartphone-fotografie/,Matthias Butz,$59.99,$10.99,Rating: 3.7 out of 53.7 - (21)
Vorbereitung zum Kenntnisnachweis nach §21d LuftVO,www.udemy.com/course/vorbereitung-zum-kenntnisnachweis/,Martin Keydel,$89.99,$10.99,Rating: 3.4 out of 53.4 - (5)
Fotografía de Comida: Capturando la Comida en Tu Cocina,www.udemy.com/course/fotografia-de-comida-capturando-la-comida-en-tu-cocina/,"Video School Online Inc, Federico Garay, William Carnahan",$199.99,$10.99,Rating: 4.5 out of 54.5 - (55)
Emotional Nude: oltre la bellezza del corpo (Ultra HD 4K),www.udemy.com/course/emotional-nude/,Mauro Prelli,$199.99,$10.99,Rating: 4.9 out of 54.9 - (5)
تعلم تصميم الفيديو بصورة احترافية مع برنامج الأدوبي بريمير,www.udemy.com/course/learn-adobe-premier-cc-essentials-in-arabic-language/,Dr.Nasim Matar,$199.99,$10.99,Rating: 4.7 out of 54.7 - (14)
Video Editing für Anfänger: Videoschnitt mit HitFilm Express,www.udemy.com/course/lerne-wie-du-deine-videos-kostenlos-bearbeiten-kannst/,Mirona Birsan,$19.99,$10.99,Rating: 4.3 out of 54.3 - (16)
Segredo Revelado - Lightroom e Photoshop Completo,www.udemy.com/course/segredo-revelado-edicao-de-imagens-completa-no-lightroom-e-photoshop/,André Bankada,$74.99,$10.99,Rating: 4.2 out of 54.2 - (18)
Photoshop e Lightroom-Bianco e nero mozzafiato,www.udemy.com/course/photoshop-e-lightroom-bianco-e-nero-mozzafiato/,Teacher-in-a-Box | Videocorsi Professionali,0,$19.99,Rating: 4.1 out of 54.1 - (21)
Hagamos un Video Musical de CERO!,www.udemy.com/course/video_musical_de_cero/,Angel Ortez,$19.99,$10.99,Rating: 4.2 out of 54.2 - (92)
Schritt für Schritt Hundefotografie im Freien,www.udemy.com/course/hundefotografie-im-freien/,Tobias Gawrisch,$39.99,$10.99,Rating: 4.3 out of 54.3 - (20)
"Curso Design Gráfico com Photoshop, Illustrator e Indesign",www.udemy.com/course/melhor-curso-de-dicas-e-truques-no-adobe-photoshop-cc/,"André Rossiter, Michele de Lima Rossiter",$99.99,$10.99,Rating: 4.0 out of 54.0 - (15)
Guadagna con la tua Reflex: dalla Vendita al Fotoritocco,www.udemy.com/course/guadagna-con-la-tua-reflex-dalla-vendita-al-fotoritocco/,Mauro Prelli,$199.99,$10.99,Rating: 4.3 out of 54.3 - (116)
Photoshop für Web-Designer,www.udemy.com/course/photoshop-deep-dive/,Frank Schatz,$19.99,$10.99,Rating: 4.4 out of 54.4 - (14)
"Curso creativo de Final Cut Pro X: efectos, animación, etc",www.udemy.com/course/curso-creativo-avanzado-de-final-cut-pro-x/,Jesús Hernández Ruiz,$199.99,$10.99,Rating: 3.9 out of 53.9 - (3)
Photographie de mariage,www.udemy.com/course/comment-devenir-meilleur-photographe-mariage/,Antoine Maume,$129.99,$10.99,Rating: 3.7 out of 53.7 - (4)
Lightroom Mobile CC Komplettkurs - Entwickeln am Smartphone,www.udemy.com/course/lightroom-mobile-cc-komplettkurs/,Karl Zenker,€99.99,€11.99,Rating: 4.1 out of 54.1 - (12)
CURSO DE ILUMINAÇÃO E MONTAGEM DE ESTÚDIO FOTOGRÁFICO,www.udemy.com/course/curso-de-iluminacao-e-montagem-de-estudio-fotografico/,Rogério Costa,€69.99,€19.99,Rating: 4.1 out of 54.1 - (29)
Dirección de Cámara: Tamaños de Planos,www.udemy.com/course/direccion-de-camara-tamanos-de-planos/,Jorge E. Blein,€19.99,€11.99,Rating: 4.5 out of 54.5 - (67)
"Kurs Photoshop - triki, porady, sztuczki",www.udemy.com/course/photoshop-triki/,Edugrafia.pl - wideo kursy,€29.99,€11.99,Rating: 3.9 out of 53.9 - (4)
DaVinci Resolve 15/16 - (3) Color Management (Einsteiger),www.udemy.com/course/davinci-resolve-3-color-management-einsteiger/,Jürgen Möthrath,€24.99,€11.99,Rating: 4.5 out of 54.5 - (14)
Stock Footage Masterclass - passive Einnahmen generieren!,www.udemy.com/course/stock-footage-masterclass/,Barney Elo,€89.99,€22.50,Rating: 4.7 out of 54.7 - (3)
Cámara réflex digital,www.udemy.com/course/curso-camara-reflex-digital/,El Profesor Online Plataforma e-learning,€19.99,€11.99,Rating: 4.7 out of 54.7 - (44)
Formation photographie avec Genaro Bardy,www.udemy.com/course/formation-photographie-genaro-bardy/,Genaro Bardy,€149.99,€11.99,Rating: 3.9 out of 53.9 - (30)
Como vender tus fotos por Internet,www.udemy.com/course/como-vender-tus-fotos-por-internet/,Enrique Silva,€74.99,€11.99,Rating: 4.5 out of 54.5 - (12)
Marketing online dla branży foto/video,www.udemy.com/course/marketing-online-dla-branzy-fotovideo/,Edugrafia.pl - wideo kursy,€19.99,€11.99,Rating: 4.4 out of 54.4 - (5)
Photoshop-Correzione del colore di venti fotografie,www.udemy.com/course/photoshop-correzione-del-colore-di-venti-fotografie/,Teacher-in-a-Box | Videocorsi Professionali,0,€19.99,Rating: 4.7 out of 54.7 - (15)
Curso de Fotografia para Fotógrafos da Hauseful,www.udemy.com/course/curso-de-fotografia-para-imoveis/,Robson Madalosso Vieira,€19.99,€11.99,Rating: 4.5 out of 54.5 - (41)
Photoshop-Correzione colore estrema,www.udemy.com/course/photoshop-correzione-colore-estrema/,Teacher-in-a-Box | Videocorsi Professionali,0,€19.99,Rating: 4.5 out of 54.5 - (29)
必ずできる！360°VRパノラマの製作,www.udemy.com/course/360vr-dc/,及川 均,€84.99,€11.99,Rating: 4.4 out of 54.4 - (38)
Curso General de Cine y Vídeo,www.udemy.com/course/curso-general-de-cine-y-video/,Juanjo Castro,€19.99,€11.99,Rating: 4.5 out of 54.5 - (38)
MONTANDO UM ESTÚDIO EM CASA PARA YOUTUBER,www.udemy.com/course/estudio-para-youtuber/,Asteroide LAB,€19.99,€11.99,Rating: 3.7 out of 53.7 - (42)
Photoshop Essencial : Segredos da Edição que ninguém ensina.,www.udemy.com/course/photoshopessencial/,Flavio Mattos,0,£189.99,Rating: 5.0 out of 55.0 - (13)
Kurs Photoshop obróbka fotografia produktowa,www.udemy.com/course/kurs-photoshop-obrobka-fotografia-produktowa/,Edugrafia.pl - wideo kursy,£19.99,£11.99,Rating: 0.0 out of 50.0 - (0)
Apprendre le Montage Vidéo sur PC Gratuitement et Rapidement,www.udemy.com/course/apprendre-le-montage-video-sur-ordinateur-gratuitement-et-rapidement/,Ayoub Baa,£24.99,£11.99,Rating: 3.2 out of 53.2 - (4)
Curso de Composición Fotográfica,www.udemy.com/course/curso-de-composicion-fotografica/,El Profesor Online Plataforma e-learning,£39.99,£11.99,Rating: 4.0 out of 54.0 - (52)
一攝入魂系列課程-初階【第一季】,www.udemy.com/course/photographylecture/,英華國際影像團隊 Rich your mind,£104.99,£26.25,Rating: 4.1 out of 54.1 - (14)
Drohnen: lernen zu steuern inkl. Grundlagen Video u. Foto,www.udemy.com/course/drohnen-fliegen-lernen-zu-steuern-grundlagen-video-u-foto-bearbeitung/,Markus Kirch,£99.99,£11.99,Rating: 4.3 out of 54.3 - (2)
MasterClass de Lightroom e Photoshop,www.udemy.com/course/masterclass-de-lightroom-e-photoshop/,Carlos Eduardo Rincon,£109.99,£11.99,Rating: 4.8 out of 54.8 - (19)
Formation videoscribe,www.udemy.com/course/formation-videoscribe/,Arnaud Marketing,£29.99,£11.99,Rating: 4.2 out of 54.2 - (5)
Fotografia Movil: Cómo mejorar fotos con la edición,www.udemy.com/course/edicion-de-fotos-movil/,Ale Sánchez Medina,£69.99,£11.99,Rating: 4.3 out of 54.3 - (41)
⭐️Perfekte Instagram Fotos mit Presets in Lightroom+Snapseed,www.udemy.com/course/perfekte-instagram-fotos-mit-presets-in-lightroom/,Alexander Hammerschmied,£49.99,£11.99,Rating: 3.8 out of 53.8 - (4)
Photoshop - in einer Stunde,www.udemy.com/course/photoshop-grundlagen-fuer-einsteiger/,Michael Jordan,£34.99,£11.99,Rating: 4.5 out of 54.5 - (12)
Motion 5 avanzado: Creación de plantillas para Final Cut Pro,www.udemy.com/course/motion-5-avanzado-creacion-de-plantillas-para-final-cut-pro/,Jesús Hernández Ruiz,£199.99,£11.99,Rating: 5.0 out of 55.0 - (1)
Bildbearbeitung Leicht Gemacht: Schöne Bilder mit Lightroom,www.udemy.com/course/bildbearbeitung-leicht-gemacht-schone-bilder-mit-lightroom/,"Justus Zeemann, Justus Academy",£139.99,£11.99,Rating: 3.9 out of 53.9 - (46)
Profesyonel Moda Fotoğraf Çekimi Nasıl Yapılır?,www.udemy.com/course/profesyonel-moda-fotograf-cekimi-nasil-yapilir/,Tahir YILDIZ,£19.99,£11.99,Rating: 3.8 out of 53.8 - (120)
Die Sprache der Fotografie,www.udemy.com/course/die-sprache-der-fotografie/,Björn Göttlicher,£29.99,£11.99,Rating: 4.4 out of 54.4 - (3)
Etkili Fotoğraflar İçin Kompozisyon,www.udemy.com/course/etkili-fotograflar-icin-kompozisyon/,Okan YILMAZ,£69.99,£11.99,Rating: 4.4 out of 54.4 - (11)
Fotografia Pubblicitaria: Vendita Realizzazione e Sviluppo,www.udemy.com/course/fotografia-pubblicitaria-vendita-realizzazione-e-sviluppo/,Mauro Prelli,€174.99,€11.99,Rating: 3.8 out of 53.8 - (29)
Photoshop rápido! Especial montajes fotográficos,www.udemy.com/course/photoshop-rapido-especial-montajes-fotograficos/,Hector Novo,€109.99,€11.99,Rating: 4.2 out of 54.2 - (26)
Sécurité et poses des nouveau-nés pour les photographes,www.udemy.com/course/securite-et-poses-des-nouveau-nes-pour-les-photographes/,José Cruz,€59.99,€19.99,Rating: 4.2 out of 54.2 - (13)
Nik Software Collection: dalle Basi ad un Utilizzo da Pro,www.udemy.com/course/nik-software-collection-dalle-basi-ad-un-utilizzo-da-pro/,Mauro Prelli,€199.99,€11.99,Rating: 4.3 out of 54.3 - (220)
Edição de Vídeo,www.udemy.com/course/edicao-de-video/,Daniel Smiderli,€19.99,€11.99,Rating: 4.4 out of 54.4 - (20)
Colorimetria per tutti,www.udemy.com/course/colorimetria-per-tutti/,Claudio Breda,€79.99,€11.99,Rating: 4.0 out of 54.0 - (16)
Profesjonalny Retusz Dodge & Burn w Photoshopie,www.udemy.com/course/profesjonalny-retusz-dodge-burn-w-photoshopie/,Marcin Mikus,€199.99,€11.99,Rating: 0.0 out of 50.0 - (0)
Game of Thrones Style Portraits mit Photoshop erstellen,www.udemy.com/course/game-of-thrones-portraits/,Tobias Gawrisch,€29.99,€11.99,Rating: 4.5 out of 54.5 - (21)
After Effects でモザイク・ぼかし入門講座,www.udemy.com/course/after-effects-mosaic/,AdobeMania ミハラ,€199.99,€11.99,Rating: 4.6 out of 54.6 - (2)
Nudo Art in Studio e Location con l'uso di Flash Off Camera,www.udemy.com/course/nudo-art-in-studio-e-location-con-luso-di-flash-off-camera/,Mauro Prelli,€174.99,€11.99,Rating: 4.4 out of 54.4 - (49)
婚礼摄影完全教程,www.udemy.com/course/wedding-photography-course-chinese/,"Video School Online Inc, Transvidio Inc., William Carnahan",€29.99,€11.99,Rating: 4.8 out of 54.8 - (5)
How to start on ShutterStock (ภาษาไทย),www.udemy.com/course/how-to-start-on-shutterstock/,Nattavuth Sudtanakit,€19.99,€11.99,Rating: 4.3 out of 54.3 - (12)
Desvendando o FLASH dedicado - entenda seu speedlight,www.udemy.com/course/desvendando-o-flash-dedicado-entenda-seu-speedlight/,Vinicius Waknin,€49.99,€11.99,Rating: 4.7 out of 54.7 - (12)
Photoshop - Fotografia di interni professionale,www.udemy.com/course/photoshop-fotografia-di-interni-professionale/,Teacher-in-a-Box | Videocorsi Professionali,0,€19.99,Rating: 4.1 out of 54.1 - (64)
Aprende Adobe Premiere: Edita tus Vídeos como un Profesional,www.udemy.com/course/adobe-premiere-edita-tus-videos/,Carlos Muñoz,€199.99,€11.99,Rating: 3.8 out of 53.8 - (114)
Apprendre le Montage Vidéo avec Adobe Premiere Rush CC,www.udemy.com/course/apprendre-le-montage-video-sur-smartphone-avec-adobe-premiere-rush-cc/,Ayoub Baa,€24.99,€11.99,Rating: 5.0 out of 55.0 - (2)
Kreativität und Inspiration für Fotografen,www.udemy.com/course/kreativitaet-und-inspiration-fuer-fotografen/,Tobias Wessling,"¥6,000","¥1,380",Rating: 4.4 out of 54.4 - (8)
動画ビジネスの初歩！ストーリーボード（絵コンテ）の作り方,www.udemy.com/course/story-board/,"石崎力也 (RIKIYA ISHIZAKI), あずさ 鈴木","¥24,000","¥1,620",Rating: 5.0 out of 55.0 - (1)
Fotografia Digital Nikon: Funções e Configurações,www.udemy.com/course/fotografia-digital-nikon-funcoes-e-configuracoes/,Rogério Costa,"¥8,400","¥2,300",Rating: 4.0 out of 54.0 - (70)
Kurs Affinity Photo,www.udemy.com/course/kurs-affinity-photo/,eduweb.pl - Kursy Wideo,0,"¥4,800",Rating: 5.0 out of 55.0 - (2)
DaVinci Resolve 15/16 - (5) Fairlight (Einsteiger),www.udemy.com/course/davinci-resolve-1516-5-fairlight-einsteiger/,Jürgen Möthrath,"¥3,000","¥1,380",Rating: 3.3 out of 53.3 - (4)
Kurs Fotografia Studyjna,www.udemy.com/course/kurs-fotografia-studyjna/,eduweb.pl - Kursy Wideo,0,"¥7,200",Rating: 3.5 out of 53.5 - (1)
夜景ポートレート編～クリップオンストロボで夜景ポートレートが簡単キレイ☆オンシューの基礎から、カラーシフトや屋外多灯まで,www.udemy.com/course/yakeiportrait/,踊るカメラマンAKIRA しみずあきら,0,"¥5,400",Rating: 4.3 out of 54.3 - (20)
Aprende Fotografía desde cero hasta el máximo de ti,www.udemy.com/course/aprende-fotografia-desde-cero-hasta-el-maximo-de-ti/,Xisco Fuster,"¥24,000","¥2,300",Rating: 4.3 out of 54.3 - (31)
En Kapsamlı Düğün Fotoğrafçılığı Eğitimi,www.udemy.com/course/dugun-fotografciligi/,Yücel Durmaz,"¥2,400","¥1,440",Rating: 3.2 out of 53.2 - (5)
Deixe suas fotos mais bonitas com presets no Lightroom,www.udemy.com/course/embelezando-fotos-com-presets-no-lightroom/,Helinton Andruchechen,"¥24,000","¥1,380",Rating: 4.1 out of 54.1 - (23)
Adobe Lightroom CC in Italiano: Edizione 2019,www.udemy.com/course/lightroom-cc-in-italiano-edizione-2019/,Alessio Furlan,"¥4,200","¥1,380",Rating: 4.2 out of 54.2 - (29)
Adobe Lightroom: Conviértete en un experto en retoque,www.udemy.com/course/adobe-lightroom-conviertete-en-un-experto-en-retoque/,Josue Velasquez,"¥13,800","¥1,380",Rating: 4.5 out of 54.5 - (4)
Photoshop-30 trucchi insoliti che funzionano sempre,www.udemy.com/course/photoshop-30-trucchi-insoliti-che-funzionano-sempre/,Teacher-in-a-Box | Videocorsi Professionali,0,"¥2,400",Rating: 4.3 out of 54.3 - (9)
Photoshop - Selezione e scontorno con le versioni CC e CS6,www.udemy.com/course/photoshop-selezione-e-scontorno-con-le-versioni-cc-e-cs6/,Teacher-in-a-Box | Videocorsi Professionali,0,"¥2,400",Rating: 4.6 out of 54.6 - (28)
Photoshop - Tecniche di fotomontaggio pubblicitario,www.udemy.com/course/photoshop-tecniche-di-fotomontaggio-pubblicitario/,Teacher-in-a-Box | Videocorsi Professionali,0,"¥2,400",Rating: 4.2 out of 54.2 - (5)
Dalla fotografia alla tipografia: stampa in quadricromia,www.udemy.com/course/dalla-fotografia-alla-tipografia-stampa-in-quadricromia/,Teacher-in-a-Box | Videocorsi Professionali,0,"¥2,400",Rating: 4.4 out of 54.4 - (5)
Masteriza la luminosidad,www.udemy.com/course/masteriza-la-luminosidad/,Sandro Cabrera,"¥2,400","¥1,440",Rating: 4.9 out of 54.9 - (15)
FOTOGRAFÍA DE LENCERÍA Y BOUDOIR,www.udemy.com/course/fotografia-de-lenceria-y-boudoir/,Cristina Conde,"¥2,400","¥1,440",Rating: 0.0 out of 50.0 - (0)
Fotografia de Animais,www.udemy.com/course/fotografia-de-animais/,Claudia Tavares,"¥7,200","¥1,440",Rating: 4.1 out of 54.1 - (34)
Photoshop como transformar fotos em Pintura Digital,www.udemy.com/course/photoshop-como-transformar-fotos-em-pintura-digital/,Thiago Christo,"¥12,000","¥1,440",Rating: 5.0 out of 55.0 - (22)
GUION:Método PRACTICO y EFECTIVO para CREAR historias cortas,www.udemy.com/course/cursodeestructuradeguion/,Reynaldo Cantú,"¥6,000","¥1,440",Rating: 4.0 out of 54.0 - (22)
Guión de Cine: Estructura Narrativa Clásica - Primer Acto,www.udemy.com/course/guion-de-cine-estructura-narrativa-clasica-primer-acto/,Jorge E. Blein,"¥2,400","¥1,440",Rating: 4.7 out of 54.7 - (82)
AVID Fundamental,www.udemy.com/course/avidfundamental/,Alberto Jaraba,"¥2,400","¥1,440",Rating: 3.7 out of 53.7 - (9)
プロがおしえる「きれいな商品写真」撮影講座：カメラアングル・ライティング・演出まで細かく説明！,www.udemy.com/course/ecqtdoib/,長谷川 修,"¥10,800","¥1,440",Rating: 2.3 out of 52.3 - (3)
Motion Graphics & Infographics - After effects  بالعربي,www.udemy.com/course/motion-graphics-infographics-after-effects/,Ayman.M Yousif,0,"¥2,400",Rating: 4.0 out of 54.0 - (54)
街头摄影完全指南,www.udemy.com/course/street-photography-course-chinese/,"Phil Ebiner, Anthony Carbajal, Video School Online Inc, Transvidio Inc.","¥3,600","¥1,440",Rating: 4.8 out of 54.8 - (3)
Fotoğrafçılık Öğreniyorum | Yeni Başlayanlar İçin,www.udemy.com/course/fotografcilik-ogreniyorum/,AmcaOğlu,0,"¥2,400",Rating: 4.2 out of 54.2 - (59)
夜景拍摄实战完全指南,www.udemy.com/course/night-photography-course-in-chinese/,"Video School Online Inc, Transvidio Inc., William Carnahan, Sam Shimizu-Jones","¥3,600","¥1,440",Rating: 5.0 out of 55.0 - (2)
Affinity Photo de 0 a 100: Fotografía para diseñadores,www.udemy.com/course/affinity-photo-de-0-a-100-fotografia-para-disenadores/,Raul Martinez,"¥3,000","¥1,440",Rating: 3.2 out of 53.2 - (12)
Lightroom CC classic débutant à intermédiaire,www.udemy.com/course/apprendre-lightroom-cc-classic/,Nicolas Forgue,"¥4,800","¥1,440",Rating: 3.5 out of 53.5 - (7)
After Effects CC 2019 - Effekte wie in Star Wars erstellen,www.udemy.com/course/after-effects-star-wars/,Markus Hermannsdorfer,"¥2,400","¥1,440",Rating: 4.7 out of 54.7 - (2)
Tworzenie LUTów w Photoshop - Dla Zdjęć i Video,www.udemy.com/course/jak-tworzyc-luty-w-photoshop/,Marcin Mikus,"¥7,200","¥1,440",Rating: 3.7 out of 53.7 - (18)
Kurs Obsługi Aparatu,www.udemy.com/course/kurs-obsugi-aparatu/,eduweb.pl - Kursy Wideo,0,$34.99,Rating: 4.8 out of 54.8 - (4)
Las mejores Fotos de Comida con tu Móvil,www.udemy.com/course/fotos-comida-movil/,Ale Sánchez Medina,$139.99,$11.99,Rating: 3.9 out of 53.9 - (28)
Corso Base di Fotografia,www.udemy.com/course/corso-base-di-fotografia-t/,Enzo Alessandra,$64.99,$11.99,Rating: 4.5 out of 54.5 - (4)
Aurora HDR 2019 • Corso in Italiano,www.udemy.com/course/aurora-hdr-2019-corso-in-italiano/,Alessio Furlan,$24.99,$11.99,Rating: 4.5 out of 54.5 - (7)
Einfach Zeitraffer Erstellen,www.udemy.com/course/zeitraffer-erstellen-lernen/,Christian Kremsl,$49.99,$11.99,Rating: 4.2 out of 54.2 - (4)
"Photoshop CC 2018 - Canais, Máscaras e Seleções",www.udemy.com/course/aula-de-photoshop-aprenda-como-recortar-imagens/,Thiago Christo,$134.99,$11.99,Rating: 4.3 out of 54.3 - (54)
Portrait Pro 18: dalle Basi ad un utilizzo Professionale,www.udemy.com/course/portrait-professional/,Mauro Prelli,$199.99,$11.99,Rating: 5.0 out of 55.0 - (4)
Scontorno capelli con Photoshop,www.udemy.com/course/scontorno-capelli-con-photoshop/,Bettina Di Virgilio,$114.99,$11.99,Rating: 4.5 out of 54.5 - (15)
Final Cut Pro X  - Speaking Arabic,www.udemy.com/course/final-cut-pro-x-/,Maged Abdel Hady,$99.99,$11.99,Rating: 4.5 out of 54.5 - (13)
Komple Uygulamalı Premiere Pro ile Kurgu/Montaj Eğitimi,www.udemy.com/course/komple-uygulamal-premierede-kurgumontaj-egitimi/,Sinan Karabalta,$94.99,$11.99,Rating: 4.1 out of 54.1 - (164)
Photoshop - Ottenere fotografie HDR da professionisti,www.udemy.com/course/photoshop-ottenere-fotografie-hdr-da-professionisti/,Teacher-in-a-Box | Videocorsi Professionali,0,$19.99,Rating: 4.1 out of 54.1 - (3)
摄影后期处理进阶课程--为摄影爱好者学习后期处理量身打造,www.udemy.com/course/whorbico/,lin feng lou,$199.99,$11.99,Rating: 4.3 out of 54.3 - (2)
Smartphone-Fotografie für Blog und Business,www.udemy.com/course/smartphone-fotografie-blog-und-business/,Dimitri Avdeev,$49.99,$11.99,Rating: 0.0 out of 50.0 - (0)
Aprende Fotografía Digital y hazte Fotógrafo Profesional,www.udemy.com/course/fotografia-digital-profesional/,"Miguel-Ángel Plaza, Alberto Plaza, Rosalvy Puentes",0,$54.99,Rating: 0.0 out of 50.0 - (0)
LIGHTROOM CLASSIQUE C.C - Sublimer vos Noir et Blanc,www.udemy.com/course/lightroom-classique-cc-sublimer-vos-noir-et-blancs/,Jerome Henri MAILLOT,$69.99,$11.99,Rating: 4.0 out of 54.0 - (1)
VEGAS Pro - Dein Erfolg mit Videos!,www.udemy.com/course/vegas-pro-dein-erfolg-mit-videos/,Jürgen Möthrath,$24.99,$11.99,Rating: 4.0 out of 54.0 - (12)
Guión de Cine: Estructura Narrativa Clásica - Segundo Acto,www.udemy.com/course/guion-de-cine-estructura-narrativa-clasica-segundo-acto/,Jorge E. Blein,"¥2,400","¥1,380",Rating: 4.8 out of 54.8 - (34)
"Fotogrammetria, Video e Foto col Drone",www.udemy.com/course/fotogrammetria-video-e-foto-col-drone/,Giuseppe Compare,"¥2,400","¥1,380",Rating: 4.1 out of 54.1 - (16)
Logiciel Darktable pour la retouche photo,www.udemy.com/course/logiciel-darktable-pour-la-retouche-photo/,Nicolas Forgue,"¥4,800","¥1,380",Rating: 3.7 out of 53.7 - (5)
Crie seu fluxo de trabalho no Adobe Lightroom,www.udemy.com/course/lightroom-para-fotografos-fluxo-de-trabalho-inteligente/,Roberley Antonio,"¥12,000","¥1,380",Rating: 4.6 out of 54.6 - (12)
Photoshop: pubblicare fotografie sui social e sul web,www.udemy.com/course/photoshop-pubblicare-fotografie-sui-social-e-sul-web/,Teacher-in-a-Box | Videocorsi Professionali,0,"¥2,400",Rating: 0.0 out of 50.0 - (0)
Curso básico en Davinci Resolve 14,www.udemy.com/course/curso-practico-en-davinci-resolve-14/,Daniel Domínguez Gutiérrez,"¥6,000","¥1,380",Rating: 4.1 out of 54.1 - (63)
Photoshop - Correzione colore di altre venti fotografie,www.udemy.com/course/photoshop-correzione-colore-di-altre-venti-fotografie/,Teacher-in-a-Box | Videocorsi Professionali,0,"¥2,400",Rating: 4.0 out of 54.0 - (4)
Lightroom Classic CC - Camera Raw: tecniche e creatività,www.udemy.com/course/lightroom-classic-cc-camera-raw-tecniche-e-creativita/,Teacher-in-a-Box | Videocorsi Professionali,0,"¥2,400",Rating: 4.3 out of 54.3 - (10)
Photoshop - Tecniche di restauro fotografico,www.udemy.com/course/photoshop-tecniche-di-restauro-fotografico/,Teacher-in-a-Box | Videocorsi Professionali,0,"¥2,400",Rating: 4.3 out of 54.3 - (10)
