Course,URL,instructor,Price (full),Price (discount),Rank,Category 1,Category 2,Category 3
Illustrator CC 2020 MasterClass,www.udemy.com/course/illustrator-cc-masterclass/,Martin Perhiniak,199.99,12.59,"4.6(17,616 ratings)",Design,,Adobe Illustrator
Adobe Illustrator CC - Essentials Training Course,www.udemy.com/course/adobe-illustrator-course/,Video School Online Inc,199.99,11.99,"4.7(5,203 ratings)",Design,,Adobe Illustrator
Adobe Illustrator CC – Advanced Training Course,www.udemy.com/course/adobe-illustrator-cc-advanced-training/,Daniel Walter Scott,199.99,11.39,"4.7(2,115 ratings)",Design,,Adobe Illustrator
"Adobe CC Masterclass: Photoshop, Illustrator, XD & InDesign",www.udemy.com/course/adobe-cc-masterclass-graphic-design-photoshop-illustrator-xd-indesign/,Lindsay Marsh,179.99,14.39,4.6(727 ratings),Design,,Adobe Illustrator
Logo Design in Adobe Illustrator - for Beginners & Beyond,www.udemy.com/course/logodesign/,Daniel Evans,199.99,11.99,"4.5(2,317 ratings)",Design,,Adobe Illustrator
UI & Web Design using Adobe Illustrator CC,www.udemy.com/course/ui-web-design-using-adobe-illustrator-2017/,Daniel Walter Scott,199.99,11.39,"4.6(1,693 ratings)",Design,,Adobe Illustrator
Adobe Illustrator Advanced Vector Artwork,www.udemy.com/course/adobe-illustrator-advance-vector-artwork/,"Widhi Muttaqien, S.Kom, MMSI",89.99,11.99,4.6(949 ratings),Design,,Adobe Illustrator
Logo Design Masterclass: Learn Logo Design + Illustrator,www.udemy.com/course/become-a-professional-logo-designer/,"Chad Neuman, Ph.D.",199.99,11.39,"4.3(1,257 ratings)",Design,,Adobe Illustrator
Illustrator CC 2020 MasterClass : Be a Creative Professional,www.udemy.com/course/illustrator-cc-masterclass-c/,Khalil Ibrahim,199.99,11.39,4.7(440 ratings),Design,,Adobe Illustrator
Logo Design in Adobe Illustrator - The Intermediate Level,www.udemy.com/course/logodesignintermediate/,Daniel Evans,199.99,11.39,4.6(288 ratings),Design,,Adobe Illustrator
Learn to draw fashion with Adobe Illustrator CC - Beginners,www.udemy.com/course/learn-to-draw-fashion-with-adobe-illustrator-cc-beginners/,Jo Hughes,44.99,11.39,4.3(626 ratings),Design,,Adobe Illustrator
Adobe Illustrator: Mastering the Fundamentals,www.udemy.com/course/adobe-illustrator-training/,[ School of Game Design ],54.99,11.39,"4.6(4,786 ratings)",Design,,Adobe Illustrator
Photoshop and Illustrator speed illustration workflow,www.udemy.com/course/photoshop-and-illustrator-speed-illustration-workflow/,"Widhi Muttaqien, S.Kom, MMSI",99.99,11.39,4.8(371 ratings),Design,,Adobe Illustrator
Learn to draw fashion with Adobe Illustrator CC Intermediate,www.udemy.com/course/learn-to-draw-fashion-with-adobe-illustrator-cc-intermediate/,Jo Hughes,44.99,11.39,4.4(151 ratings),Design,,Adobe Illustrator
Adobe Illustrator CC Mastery: Zero to Hero in Illustrator,www.udemy.com/course/illustrator-introduction/,"Chad Neuman, Ph.D.",49.99,11.39,"4.4(1,217 ratings)",Design,,Adobe Illustrator
Adobe Illustrator Pattern Making Masterclass,www.udemy.com/course/make-patterns-in-illustrator/,Helen Bradley,19.99,11.39,4.6(116 ratings),Design,,Adobe Illustrator
Adobe Illustrator for Zombies (and beginners too),www.udemy.com/course/teaching-zombies-adobe-illustrator/,Brad Colbow,19.99,11.39,4.7(338 ratings),Design,,Adobe Illustrator
Create HUD graphics in After Effects and Illustrator,www.udemy.com/course/hud-interface-animation-in-after-effects-and-illustrator/,Motion School,164.99,11.39,4.8(118 ratings),Design,,Adobe Illustrator
Adobe Illustrator Masterclass: Learn from an Expert Designer,www.udemy.com/course/adobe-illustrator-masterclass-learn-from-an-expert-designer/,Lindsay Marsh,144.99,11.39,4.3(92 ratings),Design,,Adobe Illustrator
Adobe Illustrator CC Tutorial - Training Taught By Experts,www.udemy.com/course/adobe-illustrator-cc-tutorial/,Infinite Skills,49.99,11.39,"4.5(1,837 ratings)",Design,,Adobe Illustrator
Adobe Illustrator CS6 Tutorial - Training Taught By Experts,www.udemy.com/course/learning-adobe-illustrator-cs6/,Infinite Skills,49.99,11.39,4.5(834 ratings),Design,,Adobe Illustrator
Great Shirt Design in Adobe Illustrator for Merch By Amazon,www.udemy.com/course/great-shirt-design-in-adobe-illustrator-for-merch-by-amazon/,Brad Colbow,19.99,11.39,4.7(138 ratings),Design,,Adobe Illustrator
Character Design For Animation in Illustrator,www.udemy.com/course/character-design-for-animation-in-illustrator/,2D Animation 101 Courses,49.99,11.39,4.4(480 ratings),Design,,Adobe Illustrator
The Ultimate Guide to Every Adobe Illustrator Tool,www.udemy.com/course/adobe-illustrator-cs6-cc-pen-tool-paintbrush-tutorial-graphic-design/,Dawid Tuminski,194.99,11.39,4.3(158 ratings),Design,,Adobe Illustrator
How to create flat design icons in 15 minutes in Illustrator,www.udemy.com/course/how-to-create-flat-design-interface-icons-in-illustrator/,Dawid Tuminski,194.99,11.39,4.6(256 ratings),Design,,Adobe Illustrator
Business Card and Letterhead Design in Adobe Illustrator,www.udemy.com/course/stationery/,Daniel Evans,99.99,11.39,4.6(103 ratings),Design,,Adobe Illustrator
Mastering Geometric Grid-Based Designs in Adobe Illustrator,www.udemy.com/course/mastering-geometric-grid-based-designs-in-adobe-illustrator/,Evgeniya & Dominic Righini-Brand,79.99,11.39,4.8(7 ratings),Design,,Adobe Illustrator
Adobe Illustrator Essentials for Character Design,www.udemy.com/course/adobe-illustrator-essentials-for-character-design/,2D Animation 101 Courses,49.99,11.39,4.5(731 ratings),Design,,Adobe Illustrator
Essential Skills for Designers - Mastering the Pen Tool,www.udemy.com/course/pen-tool/,Martin Perhiniak,44.99,11.39,4.7(125 ratings),Design,,Adobe Illustrator
Create Detailed and Poseable Character in Adobe Illustrator,www.udemy.com/course/charactercreationillustrator/,Rafael John Regidor,49.99,11.39,3.8(143 ratings),Design,,Adobe Illustrator
The Business Graphic Design 2019,www.udemy.com/course/businessgraphicdesign/,Rahul Giri,199.99,11.39,3.8(284 ratings),Design,,Adobe Illustrator
Making isometry illustrations in Adobe Illustrator,www.udemy.com/course/making-isometry-illustrations-in-adobe-illustrator/,Mad Rabbit,24.99,11.39,4.1(115 ratings),Design,,Adobe Illustrator
Icon & Logo Symbol Design in Adobe Illustrator,www.udemy.com/course/icondesign/,Daniel Evans,79.99,11.39,4.3(65 ratings),Design,,Adobe Illustrator
Adobe Illustrator Advanced Pattern Techniques - Masterclass,www.udemy.com/course/adobe-illustrator-advanced-pattern-techniques-masterclass/,Helen Bradley,19.99,11.39,5.0(3 ratings),Design,,Adobe Illustrator
Make Creative Assets in Adobe Illustrator Masterclass,www.udemy.com/course/make-creative-assets-in-adobe-illustrator-masterclass/,Helen Bradley,19.99,11.99,4.5(28 ratings),Design,,Adobe Illustrator
Vintage Logo Design in Illustrator for Beginners & Beyond,www.udemy.com/course/vintagelogodesign/,Daniel Evans,99.99,11.39,4.7(108 ratings),Design,,Adobe Illustrator
Complete Illustrator CC  MasterCourse : 36 Projects Included,www.udemy.com/course/complete-illustrator-mastercourse/,Supriyo Kundu,199.99,11.39,4.4(164 ratings),Design,,Adobe Illustrator
Typographic Logo Design in Illustrator - Beginners & Beyond,www.udemy.com/course/typographical-logo-design/,Daniel Evans,99.99,11.39,4.2(164 ratings),Design,,Adobe Illustrator
Adobe Illustrator For Beginners,www.udemy.com/course/illustrator-cc-tutorial-adobe-illustrator-cc-the-essentials/,Chris Parker,39.99,11.39,4.1(101 ratings),Design,,Adobe Illustrator
Adobe Illustrator for Children's Books: Watercolor Style,www.udemy.com/course/adobe-illustrator-for-childrens-books-watercolor-style-by-moylobito/,Moy Lobito,194.99,11.39,4.3(44 ratings),Design,,Adobe Illustrator
Character Design & Digital Art Demo in Adobe Illustrator,www.udemy.com/course/character-design-and-digital-painting-in-adobe-illustrator/,Michael Austin,99.99,11.39,3.7(111 ratings),Design,,Adobe Illustrator
Adobe Illustrator Text Effects Masterclass,www.udemy.com/course/master-text-effects-in-adobe-illustrator/,Helen Bradley,19.99,11.39,4.9(34 ratings),Design,,Adobe Illustrator
Most Wanted Flat Design Techniques in Adobe Illustrator,www.udemy.com/course/flat-design-flat-ui-design-flat-colors-flat-design-illustrator/,Dawid Tuminski,194.99,11.39,4.8(79 ratings),Design,,Adobe Illustrator
Create Whimsical Art in Adobe Illustrator,www.udemy.com/course/create-whimsical-art-in-adobe-illustrator/,Helen Bradley,19.99,11.39,4.9(25 ratings),Design,,Adobe Illustrator
Learn Adobe Illustrator CC,www.udemy.com/course/learn-adobe-illustrator-cc/,Sasikumar Arasaratnam,19.99,11.39,0.0(0 ratings),Design,,Adobe Illustrator
Make your own 2D Game Backgrounds with Adobe Illustrator ,www.udemy.com/course/makegamebackgrounds/,Rafael John Regidor,49.99,11.39,4.5(143 ratings),Design,,Adobe Illustrator
How To Learn Illustrator by Designing Awesome Logos,www.udemy.com/course/designing-logos-learning-illustrator/,Dawid Tuminski,194.99,11.39,4.3(280 ratings),Design,,Adobe Illustrator
Digital Illustration for Beginners in Adobe Illustrator,www.udemy.com/course/digital-illustration-for-beginners-in-adobe-illustrator-by-moylobito/,Moy Lobito,194.99,11.39,4.4(14 ratings),Design,,Adobe Illustrator
Make the most of your Adobe Illustrator & Photoshop skills,www.udemy.com/course/passive-income-by-selling-simple-stock-vector-illustrations/,Harish Marnad,0,99.99,4.4(100 ratings),Design,,Adobe Illustrator
Illustrator CC: Design and drawing from scratch to expert!,www.udemy.com/course/illustrator-cc-design-and-drawing-from-scratch-to-expert/,Joel Combes,149.99,11.39,4.3(283 ratings),Design,,Adobe Illustrator
Adobe Illustrator for Mobile Game Art - A Beginners Guide,www.udemy.com/course/mobilegameartmastery/,Rafael John Regidor,49.99,11.39,4.3(322 ratings),Design,,Adobe Illustrator
Learn Illustrator CC: Create Simple Flat Vector Characters,www.udemy.com/course/simple-flat-vector-characters/,Jonathan Lam,49.99,11.39,4.3(239 ratings),Design,,Adobe Illustrator
Beginners Adobe Illustrator CS5 Tutorial,www.udemy.com/course/adobe-illustrator-cs5/,Infinite Skills,49.99,11.39,4.7(127 ratings),Design,,Adobe Illustrator
Every Adobe Illustrator Effect Explained,www.udemy.com/course/every-illustrator-effect-explained-illustrator-tutorial-cc-c6/,Dawid Tuminski,144.99,11.39,4.7(32 ratings),Design,,Adobe Illustrator
Adobe Illustrator form beginner to expert,www.udemy.com/course/adobe-illustrator-comprehensive-training/,Sanjeev Kumar,19.99,11.99,4.0(150 ratings),Design,,Adobe Illustrator
Modern Flat Design Masterclass in Adobe Illustrator,www.udemy.com/course/photoshop-flat-design-tutorial-adobe-illustrator-cc/,Dawid Tuminski,199.99,11.39,4.0(18 ratings),Design,,Adobe Illustrator
Adobe Illustrator CC - Basic Fundamentals For Beginners,www.udemy.com/course/adobe-illustrator-cc-basic-fundamentals-for-beginners/,Khaqan Chaudhry,199.99,11.39,4.7(18 ratings),Design,,Adobe Illustrator
"Adobe Illustrator CS5  (Beginning, Intermediate, & Advanced)",www.udemy.com/course/adobe-illustrator-cs5-beginning-intermediate-advanced/,Learn iT! Anytime,29.99,11.39,4.8(156 ratings),Design,,Adobe Illustrator
Learn Adobe Illustrator: Semi-Automatic Mandalas Drawing,www.udemy.com/course/learn-adobe-illustrator-semi-automatic-mandalas-drawing/,Andrey Bzhitskikh,199.99,11.39,4.0(68 ratings),Design,,Adobe Illustrator
Create Icons in Adobe Illustrator for Beginners,www.udemy.com/course/create-icons-in-adobe-illustrator-for-beginners/,Anne Bracker,19.99,11.39,4.5(20 ratings),Design,,Adobe Illustrator
Adobe Illustrator For Everyone: Create Detailed Vector Image,www.udemy.com/course/how-to-create-your-own-steampunk-vehicle-part-1/,Andrey Bzhitskikh,184.99,11.39,4.2(55 ratings),Design,,Adobe Illustrator
Adobe Illustrator CC - From scratch ,www.udemy.com/course/adobe-illustrator-cc-from-scratch/,Apostu Adrian Albert,44.99,11.39,4.8(25 ratings),Design,,Adobe Illustrator
How to Doodle: Basics and Lettering,www.udemy.com/course/how-to-doodle-basics-and-lettering/,Andrey Bzhitskikh,184.99,11.39,3.7(81 ratings),Design,,Adobe Illustrator
How To Master Pen Tool In Illustrator and Photoshop,www.udemy.com/course/pen-tool-pen-magnetic-pen-tool-illustrator-photoshop-tutorial/,Dawid Tuminski,194.99,11.39,4.5(65 ratings),Design,,Adobe Illustrator
Flat Landscape Design in Illustrator (Perfect For Beginners),www.udemy.com/course/flat-landscape-design-in-illustrator-perfect-for-beginners/,Sasikumar Arasaratnam,19.99,11.39,4.5(4 ratings),Design,,Adobe Illustrator
Learn Adobe Illustrator from Scratch,www.udemy.com/course/learn-adobe-illustrator-from-scratch/,Eduonix Learning Solutions,29.99,11.39,3.6(400 ratings),Design,,Adobe Illustrator
Adobe Illustrator Vectors For Hand Letterers,www.udemy.com/course/adobe-illustrator-vectors-for-hand-letterers/,Melanie Greenwood,99.99,11.39,4.7(15 ratings),Design,,Adobe Illustrator
Extraordinary Illustrator Brushes for Pattern Design & ATD,www.udemy.com/course/extraordinary-illustrator-brushes-pattern-design-and-atd/,Delores Orridge Naskrent,24.99,11.39,4.5(1 rating),Design,,Adobe Illustrator
Creative Texturing with Adobe Illustrator,www.udemy.com/course/creative-texturing-with-adobe-illustrator/,Taiwo Kajopelaye-ola,19.99,11.39,3.7(3 ratings),Design,,Adobe Illustrator
Illustrator CC 2018: Fundamentals For Beginners + 5 Projects,www.udemy.com/course/adobe-illustrator-cc-fundamentals-5-projects/,Abdelwahab Achoub,194.99,11.39,4.2(428 ratings),Design,,Adobe Illustrator
Adobe Illustrator For Beginners: Design A Typographic Logo,www.udemy.com/course/illustratorforbeginners/,Will Paterson,29.99,11.39,4.3(124 ratings),Design,,Adobe Illustrator
Adobe Illustrator CC - Print Design for Beginners,www.udemy.com/course/adobe-illustrator-cc-print-design/,Jason Hill,24.99,11.39,4.0(64 ratings),Design,,Adobe Illustrator
Creating Vector Illustration: Adobe Illustrator CC All Steps,www.udemy.com/course/creating-vector-illustration-with-adobe-illustrator-cc-all-steps/,Mehmet Emin Aykurt,19.99,11.39,3.8(10 ratings),Design,,Adobe Illustrator
Learn to Master After Effects and Illustrator,www.udemy.com/course/creating-vector-illustrations-and-animating-them/,Motion School,99.99,11.39,4.5(13 ratings),Design,,Adobe Illustrator
Intro to Adobe Illustrator,www.udemy.com/course/intro-to-adobe-illustrator/,Joseph Caserto,19.99,11.39,4.7(24 ratings),Design,,Adobe Illustrator
Adobe Illustrator Brushes to Make and Sell,www.udemy.com/course/adobe-illustrator-brushes-to-make-and-sell/,Delores Orridge Naskrent,24.99,11.39,0.0(0 ratings),Design,,Adobe Illustrator
Complete Graphic Design Boot Camp Zero to Master 2020,www.udemy.com/course/complete-graphic-design-boot-camp-zero-to-master-in-2109/,Graphic Zone,199.99,11.39,3.9(3 ratings),Design,,Adobe Illustrator
Mastering Types feature in illustrator 2019,www.udemy.com/course/mastering-types-in-illustrator/,Rahul Giri,189.99,11.39,5.0(15 ratings),Design,,Adobe Illustrator
How to Fake a Watercolour Part 1 Illustrator Brushes,www.udemy.com/course/how-to-fake-a-watercolour-simple-and-complex-illustrator-brushes/,Delores Orridge Naskrent,29.99,11.39,0.0(0 ratings),Design,,Adobe Illustrator
Charming Illustrator Pansy Brushes for Sweet Pattern Repeats,www.udemy.com/course/illustrator-custom-pansy-brushes-for-pattern-repeats/,Delores Orridge Naskrent,24.99,11.39,4.5(1 rating),Design,,Adobe Illustrator
Learn Basic Illustrator,www.udemy.com/course/learn-basic-illustrator/,Learn Tech Plus,199.99,11.39,3.8(58 ratings),Design,,Adobe Illustrator
Adobe Illustrator CS6 Tutorial For Beginners,www.udemy.com/course/learn-adobe-illustrator-cs6/,Howard  Simpson,19.99,11.39,3.6(20 ratings),Design,,Adobe Illustrator
Adobe Illustrator CC - Learn the Tools,www.udemy.com/course/adobe-illustrator-cc-2018-learn-the-tools-of-the-trade/,Devrishi Gupta,19.99,11.39,4.3(12 ratings),Design,,Adobe Illustrator
Adobe Illustrator: How to Draw Squared Animals Icons,www.udemy.com/course/adobe-illustrator-how-to-draw-squared-animals-icons/,Andrey Bzhitskikh,179.99,11.39,4.5(59 ratings),Design,,Adobe Illustrator
Adobe Illustrator for Photoshop Users,www.udemy.com/course/illustrator-for-photoshop-users/,Helen Bradley,19.99,11.39,4.7(23 ratings),Design,,Adobe Illustrator
Adobe Illustrator for Non-Artists,www.udemy.com/course/adobe-illustrator-for-non-artists/,Helen Bradley,19.99,11.39,4.3(8 ratings),Design,,Adobe Illustrator
Introduction to Adobe Illustrator CC,www.udemy.com/course/introduction-to-adobe-illustrator-cc/,Framework Television Inc.,99.99,11.39,4.6(3 ratings),Design,,Adobe Illustrator
Beginner's Course on Logo & Graphic Design using Illustrator,www.udemy.com/course/beginners-course-on-logo-graphic-design-using-adobe-illustrator/,Ummu Salma,94.99,11.39,3.5(3 ratings),Design,,Adobe Illustrator
"Speed, Efficiency, and Productivity in Adobe Illustrator",www.udemy.com/course/speed-efficiency-and-productivity-in-adobe-illustrator/,Anne Bracker,19.99,11.39,4.3(7 ratings),Design,,Adobe Illustrator
How To Draw Your Illustration Using Pen Tool in Illustrator,www.udemy.com/course/digital-illustration-pen-tool-adobe-illustrator-trace-illustrator-cs6/,Dawid Tuminski,194.99,11.39,4.2(18 ratings),Design,,Adobe Illustrator
Create Flat Design Spaceships in Adobe Illustrator!,www.udemy.com/course/create-flat-design-spaceships-in-adobe-illustrator/,Mammoth Interactive,99.99,11.39,5.0(1 rating),Design,,Adobe Illustrator
Badge / Sticker Template Design With Adobe Illustrator,www.udemy.com/course/badge-sticker-template-design-with-adobe-illustrator/,Nicholas Romanakis,19.99,11.39,0.0(0 ratings),Design,,Adobe Illustrator
Digital Illustration: Make A Custom Character Illustration,www.udemy.com/course/digital-illustration/,Cory Kensinger,44.99,11.39,4.0(26 ratings),Design,,Adobe Illustrator
Creating Puzzle Pieces with Illustrator and Photoshop,www.udemy.com/course/creating-puzzle-pieces-with-illustrator-and-photoshop/,Shane Hogan,19.99,11.39,4.9(6 ratings),Design,,Adobe Illustrator
Self Publish Greeting Cards,www.udemy.com/course/learn-to-create-saleable-greeting-cards/,Delores Orridge Naskrent,24.99,11.39,0.0(0 ratings),Design,,Adobe Illustrator
Illustrator - Creating stylised images from a photo,www.udemy.com/course/illustrator-free-creating-stylised-images-from-a-photo-using-trace/,David Newton,49.99,11.39,4.7(14 ratings),Design,,Adobe Illustrator
How to create a 10 diffrent Patterns in Adobe Illustrator,www.udemy.com/course/how-to-create-a-10-diffrent-patterns-in-adobe-illustrator/,Tomasz Kościański,59.99,11.39,3.5(14 ratings),Design,,Adobe Illustrator
Web design : How To Design a Website in Illustrator,www.udemy.com/course/web-design-design-website-a-web-design-software-illustrator-cs6/,Dawid Tuminski,194.99,11.39,3.8(31 ratings),Design,,Adobe Illustrator
How to design  retro and flat design badges in Illustrator,www.udemy.com/course/badge-design-in-adobe-illustrator-tutorial-graphic-design/,Dawid Tuminski,194.99,11.39,4.7(3 ratings),Design,,Adobe Illustrator
Adobe Illustrator | Master in 3D,www.udemy.com/course/adobe-illustrator-master-in-3d/,HU Shahir,24.99,11.39,3.7(6 ratings),Design,,Adobe Illustrator
Adobe Illustrator T-Shirt Design for Merch by Amazon,www.udemy.com/course/merchbyamazondesign/,Michael Peterson,69.99,11.39,3.4(114 ratings),Design,,Adobe Illustrator
Web Design Fundamentals in Illustrator,www.udemy.com/course/web-design-software-web-designer-adobe-illustrator-cs6/,Dawid Tuminski,194.99,11.39,3.7(74 ratings),Design,,Adobe Illustrator
Adobe illustrator Full Practical course Video Training,www.udemy.com/course/adobe-illustrator-full-practical-course-video-training/,Mr.Sarwar Ahmed,24.99,11.39,5.0(3 ratings),Design,,Adobe Illustrator
Adobe Illustrator CS ACE Exam - Practice Tests,www.udemy.com/course/adobe-illustrator-cs-ace-exam-practice-tests/,Aravind Selvam,19.99,11.39,2.9(8 ratings),Design,,Adobe Illustrator
Triangulated Bird: Origami Styled Bird in Adobe Illustrator,www.udemy.com/course/triangulated-bird-origami-styled-bird-in-adobe-illustrator/,Andrey Bzhitskikh,194.99,11.39,4.6(31 ratings),Design,,Adobe Illustrator
Logo Design Workshop,www.udemy.com/course/logoworkshop/,Daniel Evans,49.99,11.39,4.2(97 ratings),Design,,Adobe Illustrator
Adobe Illustrator CC Advanced,www.udemy.com/course/adobe-illustrator-advanced/,Intellezy Trainers,39.99,11.39,4.1(6 ratings),Design,,Adobe Illustrator
Adobe Illustrator CC Portfolio Course,www.udemy.com/course/adobe-illustrator-cc-portfolio-course/,Maggie Hobson-Baker,19.99,11.39,0.0(0 ratings),Design,,Adobe Illustrator
Learn Illustrator CC: Create a Simple Flat Vector Orc,www.udemy.com/course/learn-illustrator-cc-create-a-simple-flat-vector-orc/,Jonathan Lam,49.99,11.39,4.4(84 ratings),Design,,Adobe Illustrator
"Illustrator Complete Beginner Tips, Tricks & Basics.",www.udemy.com/course/illustrator-tips-and-tricks-master-class-course/,Youssef Sanad,99.99,11.39,3.6(108 ratings),Design,,Adobe Illustrator
Great Creative Market Listings That Sell,www.udemy.com/course/creative-market-listings-that-sell/,Delores Orridge Naskrent,24.99,11.39,0.0(0 ratings),Design,,Adobe Illustrator
How To Draw a Realistic Glass in Adobe Illustrator CC,www.udemy.com/course/how-to-draw-glass-in-adobe-illustrator-cc/,Sasikumar Arasaratnam,24.99,11.39,0.0(0 ratings),Design,,Adobe Illustrator
Adobe illustrator in an easy way : create awesome designs,www.udemy.com/course/adobe-illustrator-in-an-easy-way-create-awesome-designs/,Joseph adam,199.99,11.39,4.0(188 ratings),Design,,Adobe Illustrator
Adobe Illustrator CC Beginner,www.udemy.com/course/adobe-illustrator-beginner/,Intellezy Trainers,39.99,11.39,4.7(35 ratings),Design,,Adobe Illustrator
Learn to Use Blend By Making Geometric Art in Illustrator,www.udemy.com/course/learn-to-use-blend-by-making-geometric-art-in-illustrator/,Aleksey Shlenchik,19.99,11.39,3.9(9 ratings),Design,,Adobe Illustrator
Learn to Create a Mandala with Adobe Illustrator,www.udemy.com/course/learn-to-create-a-mandala-with-adobe-illustrator/,UK Online Training Centre,49.99,11.39,4.2(3 ratings),Design,,Adobe Illustrator
How to make cartoon characters | Photoshop to Illustrator,www.udemy.com/course/how-to-make-cartoon-characters/,Adam Miconi,59.99,11.39,3.5(1 rating),Design,,Adobe Illustrator
Foundation Skills on Adobe Illustrator: Learn Fast!,www.udemy.com/course/foundation_skills_illustrator/,Farabi Shayor ACIM,49.99,11.39,4.4(50 ratings),Design,,Adobe Illustrator
Adobe Illustrator CC : Graphic Design tools in Illustrator,www.udemy.com/course/illustratorsupercourse/,Prem Chand,64.99,11.39,4.1(82 ratings),Design,,Adobe Illustrator
Creating Icons with Adobe Illustrator,www.udemy.com/course/creating-icons-with-illustrator/,Max Burnside,29.99,11.39,4.3(31 ratings),Design,,Adobe Illustrator
Adobe Illustrator for Illustration and Design,www.udemy.com/course/adobe-illustrator-for-illustration-and-design/,Aaron Porter,89.99,11.39,5.0(1 rating),Design,,Adobe Illustrator
Create Easy Simple Shaped Cartoons in Adobe Illustrator,www.udemy.com/course/simple-shaped-cartoons-illustrator-shape-builder/,Deanna Sheehan,29.99,11.39,4.3(27 ratings),Design,,Adobe Illustrator
Flat Design One Page Website with Photoshop and Illustrator,www.udemy.com/course/flat-design-one-page-website-with-photoshop-and-illustrator/,Ferdi Armagan,29.99,11.39,3.7(57 ratings),Design,,Adobe Illustrator
Create Your First Low Poly Portrait and Sell it Online,www.udemy.com/course/create-your-first-low-poly-portrait-and-sell-it-online/,Assem Hafsi,69.99,11.39,0.0(0 ratings),Design,,Adobe Illustrator
Master Terrazzo: Creating Vector Tiles with Adobe Illustrati,www.udemy.com/course/master-terrazzo/,Rich Armstrong,19.99,11.39,4.5(4 ratings),Design,,Adobe Illustrator
Adobe Illustrator CC Master-Class: Creating Shapes,www.udemy.com/course/adobe-illustrator-cc-create-any-shape/,Nitish Ganesh Mankeshvar,19.99,11.39,5.0(2 ratings),Design,,Adobe Illustrator
Earn and Learn to create Logo designs in Illustrator quickly,www.udemy.com/course/learn-to-create-wicked-logo-designs-in-illustrator-quickly/,David Newton,49.99,11.39,5.0(2 ratings),Design,,Adobe Illustrator
Mastering Retina Graphics 2019,www.udemy.com/course/mastering-retina-graphics/,Rahul Giri,194.99,11.39,4.9(12 ratings),Design,,Adobe Illustrator
Logo Design Masterclass With Adobe Illustrator,www.udemy.com/course/design-a-brand/,Rapid Growth Coaching Top 10% on Udemy,199.99,11.39,3.7(23 ratings),Design,,Adobe Illustrator
Illustrator Business Course - fast - for beginners,www.udemy.com/course/illustrator-business/,Christoffer Nyland,19.99,11.39,4.2(8 ratings),Design,,Adobe Illustrator
Learn Shading and Depth in Adobe Illustrator,www.udemy.com/course/shading-and-depth-in-adobe-illustrator/,David Miller,29.99,11.39,4.5(1 rating),Design,,Adobe Illustrator
Adobe Illustrator CC 2019:  the Fundamentals,www.udemy.com/course/les-nouvelles-techniques-de-dessin-sur-illustrator/,Rachid Bouyoussef,49.99,18.99,3.7(54 ratings),Design,,Adobe Illustrator
Animating A Badge,www.udemy.com/course/animating-a-badge/,Richard Adam Jones,29.99,11.39,4.6(2 ratings),Design,,Adobe Illustrator
Creating Shapes with Illustrator 2019,www.udemy.com/course/mastering-shapes-creation-in-illustrator/,Rahul Giri,199.99,11.39,4.0(35 ratings),Design,,Adobe Illustrator
Adobe Illustrator CC Graphic Web Design: UI & Logo Design,www.udemy.com/course/adobe-illustrator-cc-graphic-web-design-ui-logo-design/,Easy Learn,184.99,11.39,1.5(100 ratings),Design,,Adobe Illustrator
How to make Geometric Art in Adobe Illustrator,www.udemy.com/course/how-to-make-geometric-line-art-in-adobe-illustrator/,Aleksey Shlenchik,19.99,11.39,4.1(14 ratings),Design,,Adobe Illustrator
Learn to Design a Logo in Adobe Illustrator,www.udemy.com/course/learn-to-design-a-logo-in-adobe-illustrator/,Ray Ledzus,19.99,11.39,4.3(55 ratings),Design,,Adobe Illustrator
Make flat design trees in Adobe Illustrator in 30 minutes!,www.udemy.com/course/make-flat-design-trees-in-adobe-illustrator-in-30-minutes/,John Bura,49.99,11.39,3.8(138 ratings),Design,,Adobe Illustrator
