Course,URL,instructor,Price (full),Price (discount),Rank,Category 1,Category 2,Category 3
Adobe Illustrator CC for beginners create custom brushes,www.udemy.com/course/adobe-illustrator-cc-2019-custom-brushes-design-for-vectors/,Jagdish-Kumar Suthar,54.99,11.39,5.0(3 ratings),Design,,Adobe Illustrator
How to make Digital Art in Adobe Illustrator,www.udemy.com/course/how-to-make-digital-art-in-adobe-illustrator/,Cory Kensinger,29.99,11.39,4.1(68 ratings),Design,,Adobe Illustrator
Digital Illustration Tricks in Adobe Illustrator,www.udemy.com/course/digital-illustration-tricks-in-adobe-illustrator/,Cory Kensinger,29.99,11.39,3.8(39 ratings),Design,,Adobe Illustrator
Coral and Sea Life Easy Illustrator Brush & Pattern Making,www.udemy.com/course/coral-and-sea-life-easy-illustrator-brush-and-pattern-making/,Delores Orridge Naskrent,29.99,11.39,0.0(0 ratings),Design,,Adobe Illustrator
The Play-Doh Technique: Fun Hand-made Vectors In Illustrator,www.udemy.com/course/play-doh-technique/,Rich Armstrong,19.99,11.39,4.2(49 ratings),Design,,Adobe Illustrator
"Illustrator beginner to intermediate, basics and training",www.udemy.com/course/learn-adobe-illustrator/,Nicolas Forgue,39.99,11.39,0.0(0 ratings),Design,,Adobe Illustrator
1 Hour Button Master,www.udemy.com/course/1-hour-button-master/,Ludwig Heijden,19.99,11.39,5.0(2 ratings),Design,,Adobe Illustrator
How to Create Vector Characters in Illustrator or Photoshop,www.udemy.com/course/how-to-create-vector-characters-in-illustrator-or-photoshop/,Bryant Dodd,24.99,11.39,4.2(6 ratings),Design,,Adobe Illustrator
Emoji Design With Adobe Illustrator,www.udemy.com/course/emoji-design-with-adobe-illustrator/,Joseph adam,199.99,11.39,4.0(19 ratings),Design,,Adobe Illustrator
Adobe Illustrator CC - Design Your Own Awesome Avatar,www.udemy.com/course/adobe-illustrator-for-beginners-design-an-awesome-avatar/,Andy Clarke,29.99,11.39,0.0(0 ratings),Design,,Adobe Illustrator
Cartooning using Adobe Illustrator,www.udemy.com/course/cartooning-using-adobe-illustrator/,Hamed Hazel,19.99,11.39,0.0(0 ratings),Design,,Adobe Illustrator
Learn Illustrator CC: Create a Vector Knight,www.udemy.com/course/vector-knight/,Jonathan Lam,29.99,11.39,4.7(52 ratings),Design,,Adobe Illustrator
How To Create A Low Poly Portrait With The Pen Tool,www.udemy.com/course/how-to-create-a-low-poly-portrait-with-the-pen-tool-adobe-illustrator/,Dawid Tuminski,194.99,11.39,5.0(8 ratings),Design,,Adobe Illustrator
Master Adobe Illustrator with ease,www.udemy.com/course/master-adobe-illustrator-with-ease/,Samnan Ahmed,44.99,11.39,4.1(5 ratings),Design,,Adobe Illustrator
Top 10 reasons to use Illustrator for web design,www.udemy.com/course/top-10-reasons-to-use-illustrator-for-web-design/,Dawid Tuminski,44.99,11.39,4.4(86 ratings),Design,,Adobe Illustrator
Adobe Illustrator CC 2017 for beginners: Logo Design Concept,www.udemy.com/course/adobe-illustrator-cc-2017/,Jamshaid Raza,199.99,11.39,3.8(48 ratings),Design,,Adobe Illustrator
Getting Started with Illustrator CC,www.udemy.com/course/getting-started-with-illustrator-cc2/,Stone River eLearning,99.99,11.39,4.5(24 ratings),Design,,Adobe Illustrator
illustrator 3D in-Depth Course,www.udemy.com/course/illustrator-3d-in-depth-course/,M Umar,29.99,11.39,4.7(5 ratings),Design,,Adobe Illustrator
Learn Logo Designing: 5 Types of Logo Designs in Illustrator,www.udemy.com/course/learn-logo-design-tutorial-in-illustrator-beginners/,Sharjeel Ashraf,29.99,11.39,3.0(3 ratings),Design,,Adobe Illustrator
How To Design More in Less Time in Adobe Illustrator,www.udemy.com/course/how-to-get-the-most-from-the-adobe-illustrator/,Alex Kovalenko,49.99,11.39,3.7(10 ratings),Design,,Adobe Illustrator
Most Wanted Flat Design Techniques #3: Office Space,www.udemy.com/course/flat-design-flat-ui-design-flat-colors-flat-design-office-space/,Dawid Tuminski,94.99,11.39,5.0(4 ratings),Design,,Adobe Illustrator
How to Design A 2D Character in Illustrator,www.udemy.com/course/2d-character-in-illustrator/,HU Shahir,19.99,11.39,2.7(4 ratings),Design,,Adobe Illustrator
The Power of Tools: Adobe Illustrator Edition,www.udemy.com/course/the-power-of-tools-adobe-illustrator-edition/,Hans Fleurimont,19.99,11.99,4.5(2 ratings),Design,,Adobe Illustrator
How to Create 25 Flat Tree Designs in Illustrator,www.udemy.com/course/how-to-create-25-flat-tree-designs-in-illustrator/,Skillay Academy,19.99,11.99,5.0(4 ratings),Design,,Adobe Illustrator
How to Create illustration painting with vectors,www.udemy.com/course/how-to-create-illustration-painting-with-vectors/,Alireza Etemadi | Marketing Strategy Expert |,19.99,11.99,4.0(15 ratings),Design,,Adobe Illustrator
How to Design A 2D Character in Illustrator,www.udemy.com/course/2d-character-in-illustrator/,HU Shahir,19.99,11.99,2.7(4 ratings),Design,,Adobe Illustrator
Learn Adobe Illustrator and Premiere Pro in 1 hour,www.udemy.com/course/learn-adobe-illustrator-and-premiere-pro-in-1-hour/,Nicolas Camara,29.99,11.99,0.0(0 ratings),Design,,Adobe Illustrator
Make a Game Background in Adobe Illustrator for Beginners!,www.udemy.com/course/gamebackground-adobeillustrator/,Mammoth Interactive,99.99,11.99,4.0(2 ratings),Design,,Adobe Illustrator
Most Wanted Flat Design Techniques #2: Hipster Businessman,www.udemy.com/course/flat-design-flat-ui-design-flat-colors-flat-design-hipster-businessman/,Dawid Tuminski,94.99,11.99,4.8(8 ratings),Design,,Adobe Illustrator
Adobe holiday season bundle,www.udemy.com/course/adobe-holiday-season-bundle/,John Bura,169.99,11.99,3.8(21 ratings),Design,,Adobe Illustrator
Adobe Illustrator Foundation course for beginners,www.udemy.com/course/adobe-illustrator-foundation/,Rawson Uddin,99.99,11.99,0.0(0 ratings),Design,,Adobe Illustrator
Adobe Illustrator basics,www.udemy.com/course/gdo-adobe-illustrator-basics/,Gabriel Ortolan,24.99,11.99,0.0(0 ratings),Design,,Adobe Illustrator
Basic: Adobe Illustrator for Merch by Amazon,www.udemy.com/course/basic-adobe-illustrator-for-merch-by-amazon/,Merch Maniacs,0,24.99,4.6(82 ratings),Design,,Adobe Illustrator
QuickStart! - Adobe Illustrator CC,www.udemy.com/course/quickstart-adobe-illustrator-cc-vtc/,VTC Software Training,0,19.99,0.0(0 ratings),Design,,Adobe Illustrator
Adobe Illustrator makes me 3000/pm -Retouching Logo Designs,www.udemy.com/course/adobe-illustrator-for-beginners-retouching-logo-designs/,Ankam Academy,19.99,11.99,4.0(24 ratings),Design,,Adobe Illustrator
Learn to Create Easy Wreath Brushes in Adobe Illustrator,www.udemy.com/course/custom-wreath-brushes-in-illustrator/,Deanna Sheehan,19.99,11.99,4.7(7 ratings),Design,,Adobe Illustrator
Advanced Features in Adobe Illustrator,www.udemy.com/course/advanced-features-in-adobe-illustrator/,Bode Ogbe,29.99,11.99,2.2(8 ratings),Design,,Adobe Illustrator
Make Logo design pay with illustrator in less than a day,www.udemy.com/course/designing-logos-with-illustrator-beginners-to-advanced/,David Newton,49.99,11.99,1.0(1 rating),Design,,Adobe Illustrator
Adobe Illustrator for Absolute Beginners,www.udemy.com/course/adobe-illustrator-for-absolute-beginners/,Eduonix Learning Solutions,49.99,11.39,3.8(89 ratings),Design,,Adobe Illustrator
How to Make Volumetric Art in Adobe Illustrator,www.udemy.com/course/how-to-make-patterned-3d-shapes-in-adobe-illustrator/,Aleksey Shlenchik,19.99,11.39,4.0(7 ratings),Design,,Adobe Illustrator
Learn Adobe Illustrator in One Hour!,www.udemy.com/course/1hourillustrator/,Jason Buff,19.99,11.39,3.6(140 ratings),Design,,Adobe Illustrator
Adobe Illustrator: Creativity Completely Uncovered,www.udemy.com/course/adobe-illustrator-creativity-completely-uncovered/,Joshua Geiger,0,29.99,5.0(2 ratings),Design,,Adobe Illustrator
Make tech circles in Adobe Illustrator in 30 minutes,www.udemy.com/course/make-tech-circles-in-adobe-illustrator-in-30-minutes/,John Bura,199.99,11.39,4.5(60 ratings),Design,,Adobe Illustrator
Adobe 9A0-351 Adobe Illustrator CC Recertification New Exam,www.udemy.com/course/adobe-9a0-351-adobe-illustrator-cc-recertification-new-exam/,Prep For Certifications Pass-Certs,34.99,11.39,0.0(0 ratings),Design,,Adobe Illustrator
Golden Ratio Logo Design Master Class,www.udemy.com/course/golden-ratio-logo-design-master-class/,Moegamat Saleem,0,19.99,3.8(24 ratings),Design,,Adobe Illustrator
Gestalt Principles & Pattern Design : Create Festive Pattern,www.udemy.com/course/gestalt-principles-surface-pattern-design-create-festive-pattern/,Shubham Sharma,49.99,11.39,0.0(0 ratings),Design,,Adobe Illustrator
Adobe Illustrator CC 2020: Learn Illustrator from Scratch,www.udemy.com/course/adobe-illustrator-cc-2020-from-scratch-bonus-100-vectors/,Fakhar Ayub,199.99,11.39,0.0(0 ratings),Design,,Adobe Illustrator
Illustrator CC for Photoshop Users,www.udemy.com/course/illustrator-cc-for-photoshop-users/,Dave Cross,29.99,11.39,0.0(0 ratings),Design,,Adobe Illustrator
"Adobe illustrator Latest, simplest and quickest way to learn",www.udemy.com/course/adobeillustratorcc/,Usman Khalid,19.99,11.39,0.0(0 ratings),Design,,Adobe Illustrator
Adobe Illustrator CC Essentials MasterClass,www.udemy.com/course/adobe-illustrator-cc-essentials-masterclass/,Jawad Abdul Mateen,19.99,11.39,4.2(2 ratings),Design,,Adobe Illustrator
Master Graphic Design by Creating in Adobe Illustrator CC,www.udemy.com/course/adobe-illustrator-cc-d/,Megan Hartman,19.99,11.39,0.0(0 ratings),Design,,Adobe Illustrator
Learn Basics Of Adobe Illustrator,www.udemy.com/course/learn-basics-of-adobe-illustrator-under-30-minutes/,Bode Ogbe,29.99,11.39,3.4(40 ratings),Design,,Adobe Illustrator
Create a Majestic Bear on Adobe Illustrator,www.udemy.com/course/bear-adobe-illustrator/,Aerie North,54.99,11.39,0.0(0 ratings),Design,,Adobe Illustrator
Essentials: Adobe Illustrator for Merch by Amazon,www.udemy.com/course/essentials-adobe-illustrator-for-merch-by-amazon/,Merch Maniacs,0,24.99,4.4(5 ratings),Design,,Adobe Illustrator
Create Beveled Lettering in Adobe Illustrator,www.udemy.com/course/create-beveled-lettering/,Natanael Gama,19.99,11.99,1.5(1 rating),Design,,Adobe Illustrator
Make Flat Design Space Ships in 30 Minutes in Illustrator!,www.udemy.com/course/make-flat-design-space-ships-in-30-minutes-in-illustrator/,John Bura,49.99,11.99,4.8(43 ratings),Design,,Adobe Illustrator
Adobe Photoshop and Illustrator for Merch By Amazon and PoD,www.udemy.com/course/adobe-photoshop-illustrator-merch-by-amazon-pod/,Rob Cubbon,0,99.99,4.3(39 ratings),Design,,Adobe Illustrator
Adobe Illustrator: Learn Easy Logo Design.,www.udemy.com/course/logo-design-in-adobe-illustrator/,Veysel KOPARAL,29.99,11.99,4.1(5 ratings),Design,,Adobe Illustrator
Adobe Illustrator Online Training Course,www.udemy.com/course/adobe-illustrator-online-training-course/,Academy of Film Fashion and Design,19.99,11.99,3.0(1 rating),Design,,Adobe Illustrator
Make Tech circles in Adobe Photoshop and Illustrator,www.udemy.com/course/make-tech-circles-in-adobe-photoshop-and-illustrator/,John Bura,199.99,11.99,4.1(13 ratings),Design,,Adobe Illustrator
Setting Up Adobe Illustrator CS6 CC For Maximum Productivity,www.udemy.com/course/tutorials-adobe-illustrator-cs6-cc-for-maximum-productivity/,Douglas James Butner,0,Free,3.8(446 ratings),Design,,Adobe Illustrator
Design Tickets and Vouchers in Photoshop and Illustrator,www.udemy.com/course/design-tickets-and-vouchers-in-photoshop-and-illustrator/,Jestoni Esteban,0,Free,4.1(54 ratings),Design,,Adobe Illustrator
Become an Icon Fonts Pro in No Time,www.udemy.com/course/be-an-icon-fonts-pro-in-no-time/,Ajdin Imsirovic,0,Free,3.7(113 ratings),Design,,Adobe Illustrator
How to Design an Awesome Letterhead in Adobe Illustrator,www.udemy.com/course/letterheaddesign/,Daniel Evans,0,Free,4.1(954 ratings),Design,,Adobe Illustrator
Convert Image to Vector in Adobe illustrator,www.udemy.com/course/convert-image-to-vector-in-adobe-illustrator/,HU Shahir,0,Free,4.0(394 ratings),Design,,Adobe Illustrator
Learn Illustrator By Recreating Top 3 Logos - Beginner Guide,www.udemy.com/course/learn-illustrator/,Kashif Iqbal,0,Free,4.4(721 ratings),Design,,Adobe Illustrator
Adobe illustrator For UI / UX Design,www.udemy.com/course/illustrator-for-ui-ux-design/,HU Shahir,0,Free,3.6(585 ratings),Design,,Adobe Illustrator
Design and Prototype an iOS8 Mobile App on Illustrator,www.udemy.com/course/mobileprototype/,Pablo Stanley,0,Free,4.7(295 ratings),Design,,Adobe Illustrator
A Product Designers Guide To Adobe Illustrator,www.udemy.com/course/a-product-designers-guide-to-adobe-illustrator/,Jack Daly,0,Free,4.0(35 ratings),Design,,Adobe Illustrator
Useful Tricks & Tips in Adobe Illustrator,www.udemy.com/course/useful-tricks-and-tips-in-adobe-illustrator/,Daniel White,0,Free,"4.5(3,177 ratings)",Design,,Adobe Illustrator
Most Wanted Flat Design Techniques #1: Desert Island,www.udemy.com/course/flat-design-flat-ui-design-flat-colors-flat-design-desert-island/,Dawid Tuminski,0,Free,4.2(469 ratings),Design,,Adobe Illustrator
Illustrator CC 2020 for beginners : Basics & Tricks,www.udemy.com/course/illustrator-cc-2018-for-beginners-basics-tricks/,Khalil Ibrahim,0,Free,"4.3(1,155 ratings)",Design,,Adobe Illustrator
Illustrator CC: things beginners want know how to do,www.udemy.com/course/illustrator-cc-things-beginners-want-know-how-to-do/,Omar Ouhra,0,Free,3.8(123 ratings),Design,,Adobe Illustrator
How to Use Dynamic Data with Variables in illustrator,www.udemy.com/course/how-to-use-dynamic-data-with-variables-in-illustrator/,Sasikumar Arasaratnam,0,Free,4.0(5 ratings),Design,,Adobe Illustrator
Illustrator 基礎からプロレベルまで　完全ですべてをゼロから最短で学べる講座,www.udemy.com/course/illustratgor/,村守 康,189.99,11.99,4.3(795 ratings),Design,,Adobe Illustrator
Adobe Illustrator CC Masterclass — Vom Anfänger zum Profi,www.udemy.com/course/adobe-illustrator-cc-masterclass-vom-anfanger-zum-profi/,Justus Zeemann,199.99,11.99,4.6(815 ratings),Design,,Adobe Illustrator
Adobe Illustrator CC: Il corso essenziale da zero ad esperto,www.udemy.com/course/adobe-illustrator-cc-il-corso-essenziale-da-zero-ad-esperto/,Alberto Comper,199.99,11.99,4.6(890 ratings),Design,,Adobe Illustrator
Adobe Illustrator CC Máster: De Básico a Profesional. 2019.,www.udemy.com/course/adobe-illustrator-cc-master/,Marlon Ceballos,199.99,11.99,"4.6(1,133 ratings)",Design,,Adobe Illustrator
Illustrator 2020 : A'dan Z'ye Kolay Öğrenme! (Güncellenmiş),www.udemy.com/course/illustrator-cc-2017-temel-egitimi-yeni/,Burhan KARAKAYA,194.99,11.99,"4.5(1,293 ratings)",Design,,Adobe Illustrator
Illustrator CC para novatos: ¡desde cero hasta experto! ,www.udemy.com/course/illustrator-cc-para-novatos-desde-cero-hasta-experto/,Joel Combes,149.99,11.99,"4.4(2,425 ratings)",Design,,Adobe Illustrator
ADOBE ILLUSTRATOR CC 2018 / 2019 - DO BÁSICO AO AVANÇADO,www.udemy.com/course/adobe-illustrator-cc-2018-2019-do-basico-ao-avancado/,Professor Willian,104.99,11.99,4.6(869 ratings),Design,,Adobe Illustrator
Illustrator CC 2020 Débutants-Techniques de base + Ateliers,www.udemy.com/course/illustrator-pour-debutants-techniques-de-base-et-ateliers/,ROMAIN DUCLOS,59.99,11.99,4.7(436 ratings),Design,,Adobe Illustrator
"Master Diseño Gráfico con Photoshop, Illustrator e InDesign",www.udemy.com/course/master-diseno-grafico-con-photoshop-illustrator-indesign/,Felipe Nicholls,199.99,11.99,4.2(159 ratings),Design,,Adobe Illustrator
Corso completo di Illustrator: da principiante ad esperto,www.udemy.com/course/corso-illustrator-facile-adobe-illustrator/,Alessandro Cuoghi,199.99,11.99,4.3(201 ratings),Design,,Adobe Illustrator
Illustrator CC 2017 e 18 Completo - do Iniciante ao Avançado,www.udemy.com/course/aula-de-illustrator-como-fazer-um-infografico/,Thiago Christo,199.99,11.99,"4.4(2,057 ratings)",Design,,Adobe Illustrator
Curso Completo de Design Gráfico com Adobe Illustrator,www.udemy.com/course/curso-completo-de-design-com-adobe-illustrator/,Viana Patricio Barbosa Neto,79.99,11.99,4.5(804 ratings),Design,,Adobe Illustrator
【印刷物編】知識ゼロから即戦力になるためのillustratorCC実践コース,www.udemy.com/course/illustratorcc-u/,シュムデザイン 新里拓也,44.99,11.39,4.4(80 ratings),Design,,Adobe Illustrator
絵が下手なズブの素人でも真似して描けるイラストレーター講座,www.udemy.com/course/illustrator4basic/,(あくしょん) Murakami Yoshiyuki,44.99,11.39,4.6(84 ratings),Design,,Adobe Illustrator
Illustrator CC 2020-Techniques avancées + Ateliers créatifs,www.udemy.com/course/illustrator-intermediare-techniques-avancees-et-ateliers/,ROMAIN DUCLOS,59.99,11.39,4.7(108 ratings),Design,,Adobe Illustrator
Adobe Illustrator CC 2019: En Temelden İleri Seviyeye,www.udemy.com/course/adobe-illustrator-egitimi/,Merve Talun,199.99,11.39,4.4(363 ratings),Design,,Adobe Illustrator
Adobe Illustrator CC,www.udemy.com/course/adobe-illustrator-cc-m/,Анаит Авдалян -  Anait Avdalyan,49.99,11.39,4.6(124 ratings),Design,,Adobe Illustrator
Diseña imprimibles para fiestas temáticas,www.udemy.com/course/disena-imprimibles-para-fiestas-tematicas/,Wendy Raydé Cruz,0,79.99,4.7(18 ratings),Design,,Adobe Illustrator
Adobe Character Animator: あなたの顔をカメラ認識、自分だけのアバターを生み出すビギナークラス,www.udemy.com/course/character-animator-japan/,OMOKAGE TV,99.99,11.39,4.5(109 ratings),Design,,Adobe Illustrator
【Webバナー編】知識ゼロから即戦力になるためのillustratorCC実践コース,www.udemy.com/course/webillustrator/,シュムデザイン 新里拓也,44.99,11.39,4.3(75 ratings),Design,,Adobe Illustrator
【これ以上、丁寧に解説できません！】初心者のためのillustratorCC基礎徹底マスターコース,www.udemy.com/course/illustratorcc-z/,シュムデザイン 新里拓也,64.99,11.39,4.4(16 ratings),Design,,Adobe Illustrator
Illustrator CC - Arquitetura,www.udemy.com/course/illustrator-cc-arquitetura/,AGA - Alexandre Gonçalves,24.99,11.39,4.3(220 ratings),Design,,Adobe Illustrator
الدورة الشاملة illustrator from zero to hero,www.udemy.com/course/illustrator-arabic/,Melbyt Academy,149.99,11.39,4.8(228 ratings),Design,,Adobe Illustrator
中二病のためのイラストレーター講座 / Adobe Illustrator Tuts For Geeks,www.udemy.com/course/illustratortut4geeks/,(あくしょん) Murakami Yoshiyuki,144.99,11.39,4.6(14 ratings),Design,,Adobe Illustrator
Illustrator CC 2020 - Apprenez à faire des logos percutants,www.udemy.com/course/illustrator-cc-2018-apprenez-a-faire-des-logos-percutants/,ROMAIN DUCLOS,59.99,11.39,4.4(90 ratings),Design,,Adobe Illustrator
Adobe Illustrator od podstaw,www.udemy.com/course/kurs-adobe-illustrator-od-podstaw/,cgwisdom.pl - Kursy online,119.99,11.39,4.4(97 ratings),Design,,Adobe Illustrator
女性目線で解説！基礎からしっかりAdobe Illustrator 講座,www.udemy.com/course/adobe-illustrator-cc-2017-d/,Chieko Baba,24.99,11.39,4.6(48 ratings),Design,,Adobe Illustrator
Curso Online de Adobe Illustrator CS6 e CC,www.udemy.com/course/curso-online-de-adobe-illustrator-cc/,André Rossiter,149.99,11.39,4.5(478 ratings),Design,,Adobe Illustrator
Papelaria Personalizada com Illustrator,www.udemy.com/course/coracaodepapel/,Maíra Calegario,89.99,11.39,4.1(73 ratings),Design,,Adobe Illustrator
Adobe Illustrator и теория дизайна: От нуля до профессионала,www.udemy.com/course/learn-illustrator-as-pro/,Farid Shukurov,19.99,11.39,4.7(42 ratings),Design,,Adobe Illustrator
Illustrator CC 2019 Başlangıç Seviyesinden Usta Sınıfına,www.udemy.com/course/illustrator-cc-2018-baslangc-seviyesinden-usta-snfna/,Batuhan AKGÜN,199.99,11.39,4.5(59 ratings),Design,,Adobe Illustrator
Formation complète Illustrator CC2019,www.udemy.com/course/formation-complete-illustrator-cc2019/,Malko Pouchin,49.99,11.39,4.5(12 ratings),Design,,Adobe Illustrator
ILLUSTRATOR CC 2020  - 15 Ateliers Pratiques et créatifs,www.udemy.com/course/ateliers-creatifs-illustrator-mise-en-pratique/,ROMAIN DUCLOS,54.99,11.39,4.5(40 ratings),Design,,Adobe Illustrator
Adobe Illustrator CC - Avanzado: Magia vectorial. New 2019.,www.udemy.com/course/illustrator-cc-avanzado/,Marlon Ceballos,179.99,11.39,4.7(67 ratings),Design,,Adobe Illustrator
Adobe Illustrator | Paso a Paso | Con Logos Profesionales,www.udemy.com/course/adobe-illustrator-logos-profesionales/,Dsignr Xyz,149.99,11.39,4.9(40 ratings),Design,,Adobe Illustrator
"Adobe大補帖( Premiere, Photoshop, illustrator)",www.udemy.com/course/adobe-premiere-photoshop-illustrator/,McD Q,64.99,11.39,3.4(87 ratings),Design,,Adobe Illustrator
ILLUSTRATOR CC: Curso de Diseño e Ilustración de 0 a 100,www.udemy.com/course/curso-versatil-de-illustrator-cc-de-cero-a-experto/,Leonardo Rincon,149.99,11.39,4.7(42 ratings),Design,,Adobe Illustrator
"Le pack initiation ""ADOBE ILLUSTRATOR et ANIMATE CC""",www.udemy.com/course/le-pack-initiation-adobe-illustrator-et-animate-cc/,Damien Barban,64.99,11.39,3.6(33 ratings),Design,,Adobe Illustrator
Illustrator CC MasterClass الدورة الشاملة فى الإلستراتور,www.udemy.com/course/illustrator-cc-masterclass-a/,Khalil Ibrahim,199.99,11.39,4.7(101 ratings),Design,,Adobe Illustrator
Adobe illustrator CC 2018 [Öğrenme Seti & Uygulama Seti],www.udemy.com/course/adobe-illustrator-cc-2018-ogrenme-seti-uygulama-seti/,Sanal Ogretim Setleri Sanal Ogretim,0,39.99,4.3(27 ratings),Design,,Adobe Illustrator
Illustrator Iniciante: Aprenda a Fazer uma Pintura Digital,www.udemy.com/course/illustrator-aprenda-como-fazer-uma-pintura-digital-do-zero/,Bruno Gama,79.99,11.39,4.5(197 ratings),Design,,Adobe Illustrator
【初級〜中級】Illustrator(イラストレーター)でグラフィックデザインをしよう!!ロゴ・印刷物・WEB用素材,www.udemy.com/course/illustrator_design/,渡部 学,144.99,11.39,0.0(0 ratings),Design,,Adobe Illustrator
Design para Redes Sociais,www.udemy.com/course/design-para-redes-sociais/,Fernando Gomes,0,59.99,4.8(45 ratings),Design,,Adobe Illustrator
Illustrator w praktyce dla początkujących i nie tylko,www.udemy.com/course/illustrator-poradnik-kurs-gradient-logo-tutorial/,Dawid Tuminski,159.99,11.39,4.6(71 ratings),Design,,Adobe Illustrator
Курс по Adobe Illustrator - с нуля до новичка-иллюстратора,www.udemy.com/course/ai-stock/,Roman Sayapin,114.99,11.99,4.0(8 ratings),Design,,Adobe Illustrator
Adobe Illustrator：中級講座　ゼロからパーススケッチが描けるようになる講座,www.udemy.com/course/illustrator-perspective-sketch/,Daisuke Sekiguchi,39.99,11.99,3.8(13 ratings),Design,,Adobe Illustrator
Illustrator 2020 do Zero ao Profissional,www.udemy.com/course/aprenda-illustrator-2018-do-zero/,Carlos Mascarenhas,19.99,11.99,4.6(28 ratings),Design,,Adobe Illustrator
Design Gráfico - Fechamento de Arquivos em PDF,www.udemy.com/course/fechamento-de-arquivos/,Everton Henrique,49.99,11.99,4.2(69 ratings),Design,,Adobe Illustrator
Adobe Illustrator CC 2018 Eğitim Seti,www.udemy.com/course/adobe-illustrator-cc-2018-egitim-seti/,Dijital Pusula,0,19.99,4.8(18 ratings),Design,,Adobe Illustrator
Illustrator CC 2018從入門到專業實務應用,www.udemy.com/course/illustrator-cc-2018-f/,景文 鄭,0,134.99,0.0(0 ratings),Design,,Adobe Illustrator
Illustrator CS6: Sıfırdan İleri Seviyeye Uzmanından Eğitim,www.udemy.com/course/illustrator-cs6-tr/,Video Eğitim,154.99,11.99,3.3(80 ratings),Design,,Adobe Illustrator
Kurs Grafika Wektorowa - Szybki Start,www.udemy.com/course/kurs-grafika-wektorowa-szybki-start/,eduweb.pl - Kursy Wideo,19.99,11.99,4.7(199 ratings),Design,,Adobe Illustrator
Kurs Adobe Illustrator CC,www.udemy.com/course/kurs-adobe-illustrator-cc/,eduweb.pl - Kursy,0,39.99,4.6(3 ratings),Design,,Adobe Illustrator
Illustrator CC Power Workshops (Deutsch),www.udemy.com/course/illustrator-cc-2016-power-workshops-deutsch/,rs maxdesign,149.99,11.99,3.6(50 ratings),Design,,Adobe Illustrator
Illustratorの基礎を学びながらポスターやWebで使えるイラストを描こう,www.udemy.com/course/1illustrator-cc-2019/,KOWAZA デザイン,199.99,11.99,3.8(3 ratings),Design,,Adobe Illustrator
Adobe Illustrator CC 2019 - O curso mais comprado na web,www.udemy.com/course/adobe-illustrator-cc-2018-completo/,Marcos Fabiano Ferreira Nunes,19.99,11.99,4.2(31 ratings),Design,,Adobe Illustrator
Adobe Illustrator：入門講座　工業製品を描きながら基本操作と使いどころをマスターする短期集中講座,www.udemy.com/course/adobe-illustrator-product-design/,Daisuke Sekiguchi,39.99,11.99,4.0(10 ratings),Design,,Adobe Illustrator
"Curso Design Gráfico com Photoshop, Illustrator e Indesign",www.udemy.com/course/melhor-curso-de-dicas-e-truques-no-adobe-photoshop-cc/,André Rossiter,99.99,11.99,4.0(15 ratings),Design,,Adobe Illustrator
Photoshop & Illustrator CC Essentials in Arabic,www.udemy.com/course/photoshop-illustrator-cc-essentials-arabic/,Yohana Hany,49.99,11.99,4.7(650 ratings),Design,,Adobe Illustrator
Initiation à ADOBE ILLUSTRATOR,www.udemy.com/course/initiation-a-adobe-illustrator/,Damien Barban,24.99,11.99,4.0(12 ratings),Design,,Adobe Illustrator
Illustrator CC 2018專業實務應用,www.udemy.com/course/illustrator-cc-2018-h/,景文 鄭,0,84.99,0.0(0 ratings),Design,,Adobe Illustrator
Diseño impreso - Preimpresión para offset en Illustrator,www.udemy.com/course/diseno-impreso/,Natalia Tuttolomondo,19.99,11.39,4.3(70 ratings),Design,,Adobe Illustrator
Ilustração de Moda com Adobe Illustrator,www.udemy.com/course/ilustracao-de-moda-com-adobe-illustrator/,Luciano Augusto,54.99,11.39,4.4(13 ratings),Design,,Adobe Illustrator
Grafik Tasarım: Adobe Illustrator ile Sıfırdan Projeler,www.udemy.com/course/grafik-tasarm-adobe-illustrator-ile-gercek-projeler/,Mehmet Emin Aykurt,99.99,11.39,4.0(25 ratings),Design,,Adobe Illustrator
077 Técnicas super-secretas de Illustrator,www.udemy.com/course/077-tecnicas-super-secretas-de-illustrator/,Iván Gómez,149.99,11.39,4.6(13 ratings),Design,,Adobe Illustrator
