Course,URL,instructor,Price (full),Price (discount),Rank,Category 1,Category 2,Category 3
How to Start an Amazon FBA Store on a Tight Budget,www.udemy.com/course/sell-on-amazon-as-small-start-up/,Theo McArthur,179.99,11.99,"4.6(15,292 ratings)",Business,,Amazon FBA
The Last Amazon FBA Course - 2019 Private Label Guide,www.udemy.com/course/how-to-sell-on-amazon-fba/,Brock Johnson,199.99,11.99,"4.7(1,055 ratings)",Business,,Amazon FBA
Amazon FBA Course - How to Sell on Amazon MASTERY Course,www.udemy.com/course/amazon-seller-central-make-the-most-of-amazon-fba/,COURSE ENVY,199.99,11.99,"4.6(1,806 ratings)",Business,,Amazon FBA
Amazon FBA Escape Plan - From Complete Beginner To Expert,www.udemy.com/course/how-to-sell-on-amazon-fba-course-for-beginners/,Sumner Hobart,199.99,11.99,4.6(208 ratings),Business,,Amazon FBA
The Amazon FBA Private Label Masterclass,www.udemy.com/course/fba-amazon-masterclass/,Robin & Jesper | Digital Marketing Professionals,199.99,11.99,4.6(553 ratings),Business,,Amazon FBA
Amazon FBA as a Private Label Business Launching Platform,www.udemy.com/course/amazon-fba-private-label/,Damir Šerbečić,19.99,11.99,"4.5(1,833 ratings)",Business,,Amazon FBA
Source and Sell on Amazon FBA [Without Private Labeling],www.udemy.com/course/build-a-profitable-amazon-fba-store-without-private-labeling/,Theo McArthur,169.99,11.99,4.5(558 ratings),Business,,Amazon FBA
Amazon FBA - How to Pick Profitable Products in 2 Hours,www.udemy.com/course/amazon-fba-learn-how-to-pick-profitable-products-in-2-hours/,Jordan Minh,109.99,11.99,4.7(647 ratings),Business,,Amazon FBA
Step-By-Step Guide To Picking Your First Amazon FBA Product,www.udemy.com/course/pickaproduct/,Eric John Campbell,24.99,11.99,4.5(529 ratings),Business,,Amazon FBA
From China to Amazon - A LIVE case study and complete guide,www.udemy.com/course/from-china-to-amazon-a-live-case-study-and-complete-guide/,Manuel Becvar,104.99,11.99,"4.5(1,331 ratings)",Business,,Amazon FBA
Amazon PPC Course - 8 PPC Strategies To Lower Your ACOS,www.udemy.com/course/amazon-ppc-course-profitable-amazon-ppc-strategies-and-campaigns/,Sumner Hobart,49.99,11.99,4.7(29 ratings),Business,,Amazon FBA
Work From Home: Sell Wholesale Products Using Amazon FBA,www.udemy.com/course/work-from-home-sell-wholesale-products-using-amazon-fba/,Larry Humphreys,124.99,11.99,4.8(616 ratings),Business,,Amazon FBA
"Amazon SEO , PPC , & Reviews - Improve Your Listing's Rank",www.udemy.com/course/optimize-amazon-listing-amazon-seo-strategy-amazon-seo-course/,Sumner Hobart,124.99,11.99,4.6(27 ratings),Business,,Amazon FBA
Amazon FBA For Beginners: Launch A Best Selling Product,www.udemy.com/course/amazon-fba-masterclass/,Benjamin Wilson,199.99,11.99,4.3(489 ratings),Business,,Amazon FBA
Work From Home: The Amazon FBA MasterPlan,www.udemy.com/course/online-business-selling-simple-products-amazon/,Tim Godfrey,94.99,11.99,"4.2(2,120 ratings)",Business,,Amazon FBA
Amazon FBA + Private Label Products - The Complete Course!,www.udemy.com/course/amazoncourse/,Ash Peat,194.99,11.99,4.7(241 ratings),Business,,Amazon FBA
Amazon FBA Canada: Your Complete Canadian Guide To Profits,www.udemy.com/course/how-to-sell-on-amazon-fba-canada/,Jewel & Auret,49.99,11.99,4.5(573 ratings),Business,,Amazon FBA
Amazon FBA - The Complete Guide to Sell on Amazon,www.udemy.com/course/the-complete-amazon-seller-course-master-amazon-fba/,Diego Davila,194.99,11.99,4.9(490 ratings),Business,,Amazon FBA
Amazon FBA Product Launch & PPC Training,www.udemy.com/course/amazon-fba-product-launch-ppc-training/,Jordan Minh,149.99,11.99,4.6(53 ratings),Business,,Amazon FBA
Amazon SEO Optimization 2.0 For FBA Private Label Products,www.udemy.com/course/amazon-seo-optimization-product-ranking-algorithm/,Damir Šerbečić,19.99,11.99,4.0(364 ratings),Business,,Amazon FBA
Amazon Traffic & Convert Masterclass - PPC Part 2 of 2,www.udemy.com/course/amazon-traffic-convert-masterclass-part-2/,Jason Chan,199.99,11.99,4.7(7 ratings),Business,,Amazon FBA
Amazon FBA Ultimate Course - Master Amazon FBA Selling,www.udemy.com/course/amazon-limitless-course/,Ryan Ford,179.99,19.98,4.3(150 ratings),Business,,Amazon FBA
Amazon Traffic & Convert Masterclass - PPC Part 1 of 2,www.udemy.com/course/amazon-traffic-convert-masterclass-part-1/,Jason Chan,189.99,11.99,4.6(9 ratings),Business,,Amazon FBA
Sells Like Hot Cakes: TURNKEY Amazon FBA & Shopify System,www.udemy.com/course/sells-like-hot-cakes-turnkey-amazon-fba-shopify-system/,Mike Sole,144.99,11.99,4.1(272 ratings),Business,,Amazon FBA
How to Sell on Amazon FBA - Ultimate Hands-On Amazon FBA,www.udemy.com/course/amazon-fba-book-seller-mastery/,Nicholas Woolsey,79.99,11.99,5.0(12 ratings),Business,,Amazon FBA
Amazon - Home Business - Make An Amazon Empire From Home,www.udemy.com/course/build-amazon-home-business/,Lawrence King,199.99,11.99,4.4(483 ratings),Business,,Amazon FBA
Amazon FBA: Complete Guide To Start Your Own Home Business,www.udemy.com/course/amazon-secrets/,Sandor Kiss,199.99,11.99,4.2(718 ratings),Business,,Amazon FBA
Amazon FBA Product Selection with Jungle Scout,www.udemy.com/course/amazon-fba-product-selection-with-jungle-scout-i/,Skill Academy,19.99,11.99,4.5(14 ratings),Business,,Amazon FBA
Arbitrage and Amazon's Fulfillment By Amazon (FBA) Program,www.udemy.com/course/arbitrage/,Chris Green,0,19.99,4.5(276 ratings),Business,,Amazon FBA
"Amazon FBA: Selling On Amazon, Private Label & Amazon PPC",www.udemy.com/course/amazon-fba-selling-on-amazon-private-label-amazon-ppc/,Jean-Gabriel Paquette,184.99,11.99,3.9(24 ratings),Business,,Amazon FBA
Amazon FBA Product Research & Find Products for Amazon FBA,www.udemy.com/course/amazon-fba-how-to-find-a-profitable-product-in-a-few-steps/,Pavlo Pop,124.99,11.99,4.2(17 ratings),Business,,Amazon FBA
How to Start Sell on Amazon FBA 2019-2020 FULL INFO,www.udemy.com/course/how-to-sell-on-amazon-in-2020/,Ramil Gateau,179.99,11.99,5.0(4 ratings),Business,,Amazon FBA
Amazon FBA Suspension Prevention Course,www.udemy.com/course/amazon-fba-suspension-prevention-course/,Ryan Ford,179.99,19.99,4.8(7 ratings),Business,,Amazon FBA
Amazon Copywriting Mastery,www.udemy.com/course/amazon-copywriting-mastery/,Michael Witcoff,199.99,50.00,4.7(9 ratings),Business,,Amazon FBA
Amazon FBA-The Complete Amazon FBA Bootcamp,www.udemy.com/course/the-ultimate-amazon-fba-blueprint/,Mr.Nehemiah |Amazon FBA|Python|Machine Learning|Data Science|Web Development,199.99,11.39,4.5(28 ratings),Business,,Amazon FBA
How To Build A Shopify Store For Ecommerce,www.udemy.com/course/shopify-store-private-label-products-amazon-fba/,Jason Gandy,199.99,11.39,4.7(39 ratings),Business,,Amazon FBA
Advanced Amazon Bundles,www.udemy.com/course/advanced-amazon-bundles/,Joshua Maness,49.99,11.39,4.7(45 ratings),Business,,Amazon FBA
Creating Bundles For Amazon FBA,www.udemy.com/course/creating-bundles-for-amazon-fba/,Jason Wilkey,19.99,11.39,4.1(93 ratings),Business,,Amazon FBA
Amazon FBA Product Research Masterclass,www.udemy.com/course/amazon-fba-product-research-masterclass/,Ryan Ford,179.99,19.99,4.4(35 ratings),Business,,Amazon FBA
How To Sell On Amazon FBA & Make Money Selling On Amazon FBA,www.udemy.com/course/selling-on-amazon/,Kody Amour,199.99,11.39,4.2(69 ratings),Business,,Amazon FBA
The Amazon Sales Formula ~ Build A Private Label Business,www.udemy.com/course/earnthousandspermonth/,Michael Marani,19.99,11.99,4.6(46 ratings),Business,,Amazon FBA
Amazon PPC Mastery,www.udemy.com/course/amazon-ppc-mastery/,Greg Mercer,34.99,11.39,4.5(73 ratings),Business,,Amazon FBA
Make A Bundle Selling Amazon Bundles!,www.udemy.com/course/make-a-bundle-selling-amazon-bundles/,Cordelia Blake,24.99,11.39,4.3(67 ratings),Business,,Amazon FBA
Amazon FBA: Start to Finish Guide -Dominate Your Competition,www.udemy.com/course/amazon-fba-start-to-finish-guide-dominate-your-competition/,Ben Hedley,19.99,11.39,4.3(309 ratings),Business,,Amazon FBA
Passive Income: Top 10 Legit Ways to Make Money Online,www.udemy.com/course/passive-income-top-10-ways/,Victor Gorinov,199.99,13.79,4.2(50 ratings),Business,,Amazon FBA
Amazon FBA Japan - The New Market Revealed - The A-Z Course,www.udemy.com/course/amazon-fba-japan-the-new-market-revealed-the-a-z-course/,FBA RoninJapan,184.99,11.39,4.0(16 ratings),Business,,Amazon FBA
Launch Your First Private Label Product | Amazon FBA,www.udemy.com/course/private-label-products-with-amazon-fba-masterclass/,Jason Gandy,199.99,11.99,4.4(170 ratings),Business,,Amazon FBA
How to sell Books on Amazon FBA Easy Startup on a budget,www.udemy.com/course/how-to-sell-books-on-amazon-fba-easy-startup-on-a-budget/,Rigoberto Rendon,19.99,11.39,4.2(3 ratings),Business,,Amazon FBA
Amazon FBA Lead Generation Websites - Increase Amazon Sales,www.udemy.com/course/amazon-lead-generation-websites/,Adrian Knight,199.99,11.39,4.7(17 ratings),Business,,Amazon FBA
Amazon FBA Product Research- Amazon Money Machine Guide 2019,www.udemy.com/course/amazon-fba-product-research-step-by-step/,Jaz Aylaa,104.99,11.39,3.9(15 ratings),Business,,Amazon FBA
Find & Sell Products With Amazon FBA | Beginners Tutorial,www.udemy.com/course/arbitrage-101-find-sell-products-using-amazon-fba/,Jason Gandy,24.99,11.39,4.5(138 ratings),Business,,Amazon FBA
Amazon FBA: Dominate The #1 Page & Get Reviews Fast in 2019,www.udemy.com/course/amazon-fba-dominate-the-1-page-get-reviews-fast-in-2018/,Dylan Tarno,39.99,11.39,3.2(81 ratings),Business,,Amazon FBA
How To Find and Flip Books for Cash with Amazon FBA,www.udemy.com/course/how-to-find-and-flip-books-for-cash-with-amazon-fba/,Torian Wallace,199.99,11.39,4.1(29 ratings),Business,,Amazon FBA
Amazon FBA SEO: How To Get Amazon Reviews & Rank In 2020,www.udemy.com/course/amazonreviews/,Ivan Westen,179.99,11.39,3.0(139 ratings),Business,,Amazon FBA
Amazon FBA Tycoon - The Ultimate Private Label Masterclass,www.udemy.com/course/amazon-fba-tycoon-private-label-product-research/,Bryan Guerra,199.99,11.39,4.2(124 ratings),Business,,Amazon FBA
Amazon FBA Arbitrage: Make Money Without Private Labeling,www.udemy.com/course/amazon-fba-arbitrage-make-money-without-private-labeling/,Dylan Tarno,39.99,11.39,4.4(35 ratings),Business,,Amazon FBA
Amazon FBA : Private Label Work at Home Blueprint,www.udemy.com/course/amazon-fba-work-from-home/,John Colley,19.99,11.39,3.8(160 ratings),Business,,Amazon FBA
Amazon FBA: Start a Successful Amazon Business in 2019,www.udemy.com/course/amazon-fba-start-a-successful-profitable-amazon-business/,Dylan Tarno,49.99,11.39,4.2(61 ratings),Business,,Amazon FBA
How to Sell Books With Amazon FBA,www.udemy.com/course/how-to-sell-books-with-amazon-fba/,Derek Henderson,39.99,11.39,4.3(12 ratings),Business,,Amazon FBA
How to Get Amazon Verified Review Autopilot Using Manychat,www.udemy.com/course/how-to-get-amazon-verified-review-autopilot-using-manychat/,Mohammed Jamil,0,24.99,4.4(12 ratings),Business,,Amazon FBA
▶ AMAZON POWER 2020: How To Get Free Products Online? ◀,www.udemy.com/course/amazon-power-how-to-get-free-products-for-life-for-free-deals-coupon/,VideoRipetizioni | Leonardo Ok ™,199.99,11.39,4.9(9 ratings),Business,,Amazon FBA
Amazon masterclass: Create Affiliate & Sell on Amazon Course,www.udemy.com/course/amazonprofitmachine/,Sergey Kasimov,199.99,11.39,4.5(68 ratings),Business,,Amazon FBA
Amazon FBA SEO 2020: How To Make a Perfect Listing,www.udemy.com/course/perfect-amazon-listing/,Ivan Westen,179.99,11.39,3.8(27 ratings),Business,,Amazon FBA
Amazon FBA Full Guide - Dominate the Amazon Marketplace,www.udemy.com/course/amazonfbafullguide/,Khaqan Chaudhry,194.99,11.39,4.3(11 ratings),Business,,Amazon FBA
50 Top Products You Should Import for Sale on Amazon or eBay,www.udemy.com/course/alibaba-amazon-ebay-ecommerce-products/,Entrepreneur School,194.99,11.39,4.0(62 ratings),Business,,Amazon FBA
Start Your Own Business Offering Products on Amazon,www.udemy.com/course/amazonsalesbootcamp/,Millionaire Drive,39.99,11.39,4.3(36 ratings),Business,,Amazon FBA
Rank Higher on Amazon FAST :  Get More Sales on Autopilot,www.udemy.com/course/rank-on-page-1-on-amazon-fba-fast/,Omar Deryan,94.99,11.39,4.7(5 ratings),Business,,Amazon FBA
amazon FBA-Amazon-join the biggest online mall,www.udemy.com/course/amazon-join-the-biggest-online-mall/,Laor Kael Heliraz,59.99,11.39,4.9(3 ratings),Business,,Amazon FBA
"Easy eCom and amazon stores, no coding & no hosting needed",www.udemy.com/course/easy-ecom-and-amazon-stores-no-coding-no-hosting-needed/,Kenz Soliman,199.99,11.39,4.6(35 ratings),Business,,Amazon FBA
Amazon FBA For Beginners: How to Get Started,www.udemy.com/course/amazon-fba-for-beginners-how-to-get-started/,Devon Campbell,94.99,11.39,3.7(172 ratings),Business,,Amazon FBA
Amazon FBA Keywords Research - Don't Miss Any Head Keywords,www.udemy.com/course/amazon-fba-keywords-list/,Daniel AMZ,19.99,18.99,0.0(0 ratings),Business,,Amazon FBA
Online Arbitrage Course for Amazon FBA,www.udemy.com/course/online-arbitrage-course-for-amazon-fba/,Ryan Meador,89.99,11.39,4.3(3 ratings),Business,,Amazon FBA
Amazon FBA How to Build your Own Brand Become a Top Seller,www.udemy.com/course/how-to-build-your-on-brand-on-amazon-and-become-a-top-seller/,Richard Vicente,49.99,11.39,4.3(54 ratings),Business,,Amazon FBA
Amazon FBA Guaranteed Success in 2019,www.udemy.com/course/amazon-brand-launch-blueprint/,Ammar Akram,149.99,11.39,4.3(16 ratings),Business,,Amazon FBA
Amazon FBA Selling Academy: Step-by-Step To Success!,www.udemy.com/course/amazon-selling-academy/,Cody Rains,199.99,11.39,4.5(13 ratings),Business,,Amazon FBA
Using & Interpreting CamelCamelCamel & Keepa Charts For FBA,www.udemy.com/course/using-and-interpreting-charts-keepa-and-camelcamelcamel-f/,Jason Wilkey,24.99,11.39,3.4(77 ratings),Business,,Amazon FBA
Amazon FBA - How To Sell Private Label Products & Earn!,www.udemy.com/course/amazon-fba-private-label-course/,Sheldon Evans,199.99,11.39,4.3(3 ratings),Business,,Amazon FBA
Retail Arbitrage: A Beginners Guide to (Amazon FBA),www.udemy.com/course/retailarbitrage101/,Michael Warfield,199.99,11.39,0.0(0 ratings),Business,,Amazon FBA
Amazon FBA: How to Start Your Business from Scratch,www.udemy.com/course/zero-to-hero-amazon-product-business/,Mark Ritchie,49.99,11.39,4.2(25 ratings),Business,,Amazon FBA
Amazon FBA - How to Private Label Products & EARN an income!,www.udemy.com/course/amazon-fba-total-guide-from-a-to-z/,Kaylee Savarie,34.99,11.39,4.7(28 ratings),Business,,Amazon FBA
The Step-by-Step Amazon FBA in 2018 - Beginners to Advanced✔,www.udemy.com/course/step-by-step-amazon-fba-in-2018/,Emmanuel William,104.99,26.25,5.0(2 ratings),Business,,Amazon FBA
Amazon Advanced. Learn How To Increase Your Amazon SaleS.,www.udemy.com/course/advanced-make-money-with-amazon/,Devon Campbell,99.99,11.39,3.7(25 ratings),Business,,Amazon FBA
Your Book to Bestseller Status: Become an Amazon Bestseller,www.udemy.com/course/become-an-amazon-bestseller/,The Covert Formula,49.99,12.50,2.9(2 ratings),Business,,Amazon FBA
Dropshipping Basics: The Beginner's Guide to Amazon FBA,www.udemy.com/course/dropshipping-guide-to-amazon-fba/,Level Up Academy,99.99,11.39,4.1(60 ratings),Business,,Amazon FBA
Arbitrage 101: The Amazon Course,www.udemy.com/course/theamazoncourse/,Ryan M. Smeltz,19.99,11.39,3.6(3 ratings),Business,,Amazon FBA
Amazon Marketing Masterclass,www.udemy.com/course/amazon-marketing-masterclass/,Cyril Gupta,194.99,11.39,4.0(33 ratings),Business,,Amazon FBA
How To Sell On Amazon Master Course|Amazon FBA Private Label,www.udemy.com/course/how-to-sell-on-amazon-fba-course-private-label/,Nick Daniele,19.99,11.39,0.0(0 ratings),Business,,Amazon FBA
Amazon SEO Seller: Rank Your Private Label Products With FBA,www.udemy.com/course/amazon-seo-rank-your-products-search-engine-optimization/,Croxton MBA,19.99,11.39,3.8(69 ratings),Business,,Amazon FBA
Amazon Success Code Secrets,www.udemy.com/course/amazonsuccesscode/,Cheyenne Hall-Burnett,19.99,11.39,0.0(0 ratings),Business,,Amazon FBA
Amazon FBA vs. eBay Selling,www.udemy.com/course/ebay-vs-amazon/,Dave Espino,59.99,11.39,4.5(380 ratings),Business,,Amazon FBA
Selling on Amazon FBA-  Private Label Intro Course,www.udemy.com/course/selling-on-amazon-private-label-intro-course/,Nick The Bum,19.99,11.39,4.4(7 ratings),Business,,Amazon FBA
How to Sell on Amazon for Absolute Beginners 2019 - 2020,www.udemy.com/course/how-to-sell-on-amazon-for-absolute-beginners-2019-2020/,Ramil Gateau,19.99,11.39,3.8(13 ratings),Business,,Amazon FBA
How We Make Money on Amazon while Traveling the World,www.udemy.com/course/amazonmethod/,Riley Bennett,29.99,11.39,3.5(6 ratings),Business,,Amazon FBA
Amazon FBA Beginner Tips & Tricks,www.udemy.com/course/amazon-fba-beginner-tips-tricks/,Ryan Ford,199.99,18.99,4.2(13 ratings),Business,,Amazon FBA
Amazon FBA Course - Starting A Private Label Business A-Z,www.udemy.com/course/amazon-fba-course-starting-a-private-label-business-a-z/,Sebastian Castaneda,19.99,11.39,1.0(1 rating),Business,,Amazon FBA
Start a Profitable Amazon Store with NO Experience!,www.udemy.com/course/bestamazonfbacourseforbeginners/,Mia Santos,19.99,11.39,1.0(1 rating),Business,,Amazon FBA
Bulletproof Product Selection 101,www.udemy.com/course/bulletproof-product-selection-101/,Ammar Akram,19.99,11.39,4.0(1 rating),Business,,Amazon FBA
How To Start A Online Business With Amazon FBA-Private Label,www.udemy.com/course/start-selling-on-amazon-fba/,Mohammed A Sarker,99.99,11.39,0.0(0 ratings),Business,,Amazon FBA
Build A Profitable Business From Amazon FBA,www.udemy.com/course/amazon-fba-software/,Marie Elodhi,49.99,11.39,3.5(3 ratings),Business,,Amazon FBA
Bulletproof Product Launch Formula,www.udemy.com/course/bulletproof-product-launch-formula/,Ammar Akram,24.99,11.39,0.0(0 ratings),Business,,Amazon FBA
The Complete Business Tutorial to Using Amazon FBA,www.udemy.com/course/the-complete-business-tutorial-to-using-amazon-fba/,Xavier Tafoya,19.99,11.39,3.0(2 ratings),Business,,Amazon FBA
Amazon FBA-Profitable product research Criteria masterclass,www.udemy.com/course/amazon-fba-profitable-product-selection-criteria/,MD Fahim,79.99,11.39,0.0(0 ratings),Business,,Amazon FBA
Selling on Amazon FBA A-to-Z Private Label Handbook,www.udemy.com/course/amazon-fba-to-z/,Kris Kay,194.99,11.39,4.4(52 ratings),Business,,Amazon FBA
Bulletproof Amazon FBA Product Selection Formula,www.udemy.com/course/bulletproof-product-selection-formula/,Ammar Akram,19.99,11.39,0.0(0 ratings),Business,,Amazon FBA
Amazon Sponsored Ads In Vendor Express Launch  Hacks,www.udemy.com/course/amazon-traffic-getting-with-vendor-express-ams-sellers/,dave dahl,19.99,11.39,3.2(7 ratings),Business,,Amazon FBA
Increase your sales on Amazon - detailed guide,www.udemy.com/course/sales-boost/,Viktor Kalinichenko,24.99,18.99,3.9(17 ratings),Business,,Amazon FBA
The Amazon FBA Seller Beginner's Toolkit,www.udemy.com/course/the-amazon-fba-seller-beginners-toolkit/,Sorin Constantin,94.99,11.39,3.7(17 ratings),Business,,Amazon FBA
Amazon FBA Made Easy Simple Introduction to Amazon FBA,www.udemy.com/course/amazonfbaintroduction/,John Colley,19.99,11.39,4.1(117 ratings),Business,,Amazon FBA
How To Start Your Own Successful Amazon FBA Business,www.udemy.com/course/how-to-start-your-own-successful-amazon-fba-business/,The Elite Team,199.99,11.39,0.0(0 ratings),Business,,Amazon FBA
Amazon 7 Day FBA Successful Seller Work at Home Course,www.udemy.com/course/bossamazonclass/,Yassin Hall,19.99,11.39,1.0(1 rating),Business,,Amazon FBA
Amazon FBA Product Research - AmazeOwl Masterclass,www.udemy.com/course/amazon-fba-product-research-amazeowl-masterclass/,Ryan Ford,179.99,18.99,0.0(0 ratings),Business,,Amazon FBA
Make sales straight away with the Amazon FBA 2019 guide!,www.udemy.com/course/make-sales-straight-away-with-the-amazon-fba-2019-guide/,William Wills,19.99,11.39,0.0(0 ratings),Business,,Amazon FBA
Merch By Amazon Masterclass,www.udemy.com/course/merch-by-amazon-masterclass/,Andrew Seeley,89.99,11.39,4.3(37 ratings),Business,,Amazon FBA
Amazon Echo Development Basics,www.udemy.com/course/amazon-echo-development-basics/,Wesley Lorenzini,0,49.99,4.1(4 ratings),Business,,Amazon FBA
Online Arbitrage Beginner To Full Time - Amazon FBA Training,www.udemy.com/course/online-arbitrage-beginner-to-full-time-amazon-fba-training/,James G,0,Free,4.0(87 ratings),Business,,Amazon FBA
(NEW) Amazon FBA Course 2019 - Ultimate Amazon FBA Blueprint,www.udemy.com/course/new-amazon-fba-course-2019-ultimate-amazon-fba-blueprint/,Pete Coulis,0,Free,4.5(253 ratings),Business,,Amazon FBA
Amazon FBA University,www.udemy.com/course/amazon-fba-university/,Greg Mercer,0,Free,4.3(574 ratings),Business,,Amazon FBA
Amazon FBA Seller Reimbursements: Full Training Guide,www.udemy.com/course/amazon-fba-seller-reimbursements-full-training-guide/,James G,0,Free,4.4(131 ratings),Business,,Amazon FBA
Launch a Product on Amazon FBA - Case Study,www.udemy.com/course/million-dollar-case-study/,Greg Mercer,0,Free,4.5(730 ratings),Business,,Amazon FBA
Amazon FBA Business Course,www.udemy.com/course/amazon-fba-business-course/,eTrain London,0,Free,3.2(6 ratings),Business,,Amazon FBA
How to Sell on Amazon - Amazon FBA Basics for Beginners,www.udemy.com/course/how-to-sell-on-amazon/,Damir Šerbečić,0,Free,"4.4(3,683 ratings)",Business,,Amazon FBA
Amazon FBA + Online Arbitrage Master Degree,www.udemy.com/course/amazon-fba-master-course/,Berke Aliyazicioglu,0,Free,4.1(19 ratings),Business,,Amazon FBA
Amazon FBA Mini Course: Find A Profitable Product To Import,www.udemy.com/course/amazonfbaminicourse/,Eric John Campbell,0,Free,4.3(766 ratings),Business,,Amazon FBA
How to Start an Amazon FBA Store even IF you work Full Time,www.udemy.com/course/amazonoaktale/,Hayley Harman,0,Free,4.4(57 ratings),Business,,Amazon FBA
5 MUST-HAVE AMAZON SOFTWARE TOOLS,www.udemy.com/course/5-must-have-amazon-software-tools/,Wilson Vivas,0,Free,4.4(70 ratings),Business,,Amazon FBA
8 Simple Tools to Scale Up Your Amazon FBA Sales in 2019,www.udemy.com/course/sales-velocity-minicourse/,Pasha Knish,0,Free,4.4(8 ratings),Business,,Amazon FBA
Find & Flip Killer Flea Market Bargains On Amazon & eBay,www.udemy.com/course/how-to-get-amazing-deals-at-flea-markets/,Dave Espino,0,Free,4.3(171 ratings),Business,,Amazon FBA
Amazon Product Research Made Easy,www.udemy.com/course/amazon-product-research-master-class/,Greg Mercer,0,Free,4.6(725 ratings),Business,,Amazon FBA
Find & Flip Killer Flea Market Bargains On Amazon & eBay,www.udemy.com/course/how-to-get-amazing-deals-at-flea-markets/,Dave Espino,0,Free,4.3(171 ratings),Business,,Amazon FBA
5 MUST-HAVE AMAZON SOFTWARE TOOLS,www.udemy.com/course/5-must-have-amazon-software-tools/,Wilson Vivas,0,Free,4.4(70 ratings),Business,,Amazon FBA
The Amazon FBA Private Label Masterclass Updated for 2019!,www.udemy.com/course/zon-ninjas-x-mini-course/,CEO @ THATLifeStyleNinja,0,Free,4.3(127 ratings),Business,,Amazon FBA
How To Be An Amazon FBA Reseller - The Checklist Method,www.udemy.com/course/become-an-amazon-fba-reseller-the-checklist-method/,Samori Augusto,0,Free,4.0(26 ratings),Business,,Amazon FBA
The Amazon FBA 6 Figures in 6 Months Blueprint,www.udemy.com/course/the-amazon-fba-6-figures-in-6-months-blueprint/,BizBuilder Media,0,Free,4.1(28 ratings),Business,,Amazon FBA
Amazon FBA - Product Research in 2019 - Advanced Tactics,www.udemy.com/course/amazon-fba-beginner-to-advanced-course/,Mehmet TEK,0,Free,4.5(86 ratings),Business,,Amazon FBA
Amazon FBA Eğitimi (26 SAAT) - A-Z™,www.udemy.com/course/amazon-fba-kursu/,Mehmet TEK,199.99,11.99,"4.4(1,443 ratings)",Business,,Amazon FBA
Online Arbitrage avec Amazon FBA - Formation ProfitWolf,www.udemy.com/course/amazon-fba-profitwolf/,Joao de Lima,0,94.99,4.2(74 ratings),Business,,Amazon FBA
Amazon FBA – Erfolgreich Private Label Produkte verkaufen,www.udemy.com/course/fba-fulfillment-by-amazon-seller-kurs-private-label-produkte-auf-amazo/,Markus Knopp,149.99,11.99,4.4(259 ratings),Business,,Amazon FBA
Vendere in Amazon corso completo | FBA e FBM,www.udemy.com/course/vendere-in-amazon/,Paolo Caviezel,199.99,11.99,4.4(105 ratings),Business,,Amazon FBA
▶ AMAZON POWER 2020: Ricevi Prodotti Gratis In 30 Minuti..,www.udemy.com/course/come-ricevere-prodotti-gratis-da-amazon-amazonpower-con-metodo-air/,VideoRipetizioni | Leonardo Ok ™,69.99,11.99,4.8(65 ratings),Business,,Amazon FBA
Amazon FBA Bootcamp: Crée Facilement ton Brand sur Amazon,www.udemy.com/course/amazon-fba-bootcamp-cree-facilement-ton-brand-sur-amazon/,Marco Leroux,194.99,11.99,4.2(30 ratings),Business,,Amazon FBA
Amazon de A à Z : La méthode pour créer un business rentable,www.udemy.com/course/amazon-gagnez-1-smicmois-en-travaillant-seulement-1hjour/,Aziz Diallo,74.99,11.99,4.1(330 ratings),Business,,Amazon FBA
Aprende a vender en Amazon en Español,www.udemy.com/course/amazon-en-espanol/,Alberto Caleb White,29.99,11.99,4.1(213 ratings),Business,,Amazon FBA
Amazon Optimierung - mehr Sichtbarkeit = mehr Umsatz,www.udemy.com/course/amazon-optimierung-mehr-sichtbarkeit-mehr-umsatz/,Ronny Marx,49.99,11.99,4.2(65 ratings),Business,,Amazon FBA
Come creare un business con Amazon FBA,www.udemy.com/course/come-creare-un-business-con-amazon-fba/,Francesco Mazzotta,199.99,11.99,4.2(10 ratings),Business,,Amazon FBA
Amazon FBA Eğitimi : Sıfırdan İleri Seviye Satış (2019),www.udemy.com/course/amazon-fba-egitimi-sifirdan-ileri-seviye-satis-2019/,Deniz Arslan,199.99,11.39,4.1(62 ratings),Business,,Amazon FBA
Cómo Vender y Ganar Dinero en Amazon FBA,www.udemy.com/course/gana-dinero-vendiendo-en-amazon/,Aitor Ferreira,199.99,11.39,4.2(111 ratings),Business,,Amazon FBA
Amazon FBA + Online Arbitrage Master Plus,www.udemy.com/course/amazon-fba-online-arbitrage-master-plus/,Berke Aliyazicioglu,99.99,11.39,3.8(19 ratings),Business,,Amazon FBA
初心者向けネット販売で副業しよう！2時間でAmazon、ヤフオク、メルカリの副業の方法が分かります。,www.udemy.com/course/net-sale/,貴男 坂本,0,0,3.4(14 ratings),Business,,Amazon FBA
