Course,URL,instructor,Price (full),Price (discount),Rank,Category 1,Category 2,Category 3
Amazon FBA/Private Label Produkt-Recherche (inkl. Amalyze),www.udemy.com/course/amazon-fba-private-label-produktrecherche-amalyze-product-research/,Mike Schnepf,0,0,3.6(46 ratings),Business,,Amazon FBA
Comment vendre sur Amazon FBA en 2019 ? Se lancer facilement,www.udemy.com/course/amazon-fba-la-methode-pour-se-lancer-en-france/,GUILLAUME HEUZE,0,0,3.8(60 ratings),Business,,Amazon FBA
Merch by Amazon: Passives Einkommen mit Print on Demand,www.udemy.com/course/merch-by-amazon-passives-einkommen-mit-print-on-demand/,Daniel Schroermeyer,0,0,3.9(18 ratings),Business,,Amazon FBA
Como vender en Amazon,www.udemy.com/course/conquistando-amazon-fba/,Oralia Master eLearn2eVolve,0,0,4.2(18 ratings),Business,,Amazon FBA
Ingresos Extras con Productos de Marca Privada en Amazon,www.udemy.com/course/como-generar-25000-al-mes-con-marcas-privadas-en-amazon/,Jose Soto,0,49.99,4.1(67 ratings),Business,,Amazon FBA
Amazon FBA ile Türkiye'den Satış,www.udemy.com/course/amazon-fba-ile-turkiyeden-sats/,Emre Volkan GULEN,0,0,4.3(32 ratings),Business,,Amazon FBA
"Amazon FBA - A'dan Z'ye - Ücretsiz Yazılım, Güncel Taktikler",www.udemy.com/course/amazon-fba-turkce/,Burak Alparslan,0,0,4.3(53 ratings),Business,,Amazon FBA
Amazon SEO Optimierung mit dem Produkt-Ranking Algorithmus,www.udemy.com/course/amazon-seo-optimierung-mit-dem-produkt-ranking-algorithmus/,Markus Knopp,24.99,11.39,3.6(24 ratings),Business,,Amazon FBA
Erfolgreich Videos veröffentlichen auf Amazon Video Direct,www.udemy.com/course/erfolgreich-auf-avd/,Jens Krüger,0,0,4.9(4 ratings),Business,,Amazon FBA
A'dan Z'ye Amazon FBA - Amazon ile Para Kazanmaya Başlayın,www.udemy.com/course/adan-zye-amazon-fba-amazon-ile-para-kazanmaya-baslayin/,Dr. Girişim,0,0,3.1(88 ratings),Business,,Amazon FBA
Amazon FBA - Endlich erfolgreich verkaufen (Short Guide),www.udemy.com/course/amazon-fba-endlich-erfolgreich-verkaufen-short-guide/,Christian Ehrnsperger,24.99,11.39,0.0(0 ratings),Business,,Amazon FBA
488.5K'lık Amazon FBA Satış Taktikleri - FBA Sales Tactics,www.udemy.com/course/amazon-fba-sats-taktikleri-amazon-fba-sales-tactics/,E-Vendik Online Eğitim,0,0,3.5(4 ratings),Business,,Amazon FBA
Amazon S3 ile Wetransfer Sistemi Oluşturma,www.udemy.com/course/amazon-s3-kullanimi/,Emrah Yüksel,19.99,11.39,4.3(20 ratings),Business,,Amazon FBA
Khoá học dropship amazon Ultimate v1,www.udemy.com/course/dropship-amazon/,Vuong Manh Hoang,199.99,11.39,4.4(120 ratings),Business,,Amazon FBA
Marketing Eficaz para Vender tu Libro en Amazon Kindle,www.udemy.com/course/vende-mi-libro-como-best-seller-con-amazon-kindle/,Iberdynamics Creative,0,199.99,4.1(18 ratings),Business,,Amazon FBA
אסטרטגיות לבחירת מוצר לאמזון,www.udemy.com/course/amazonpro1/,Jen David,0,199.99,0.0(0 ratings),Business,,Amazon FBA
Impara ad usare Amazon FBA per il tuo eCommerce,www.udemy.com/course/impara-ad-usare-amazon-fba-per-il-tuo-ecommerce/,Pietro Tibaldeschi,0,49.99,0.0(0 ratings),Business,,Amazon FBA
eBooks und Bücher bei Amazon & Co. erfolgreich verkaufen,www.udemy.com/course/ebooks-und-buecher-bei-amazon-apple-tolino-erfolgreich-vermarkten/,Matthias Matting,0,179.99,4.4(26 ratings),Business,,Amazon FBA
Erfolgreich auf Amazon verkaufen - Amazon FBA Grundlagen,www.udemy.com/course/erfolgreich-auf-amazon-verkaufen-amazon-fba-grundlagen/,Markus Knopp,0,Free,4.4(422 ratings),Business,,Amazon FBA
امازون اف بي اي |amazon fba,www.udemy.com/course/amazon-fba-arabic/,Alaa Al Hasan,0,Free,3.8(142 ratings),Business,,Amazon FBA
كيف تبني عملك التجاري على أمازون 2019,www.udemy.com/course/amazon-fba-arabic2019/,Alaa Al Hasan,0,Free,3.7(40 ratings),Business,,Amazon FBA
(!مقدمة فقط) Amazon شرح امازون إف بي أي - ألتجارة إلكترونية,www.udemy.com/course/amazon-fba-arabic-course/,Omar Deryan,0,Free,4.5(3 ratings),Business,,Amazon FBA
Amazon FBA Başlangıç Eğitimi (9 SAAT) - ÜCRETSİZ,www.udemy.com/course/amazon-fba-baslangic-egitimi/,Mehmet TEK,0,Free,4.5(205 ratings),Business,,Amazon FBA
