Course,URL,instructor,Price (full),Price (discount),Rank,Category 1,Category 2,Category 3
The Complete Copywriting Course : Write to Sell in 2019,www.udemy.com/course/the-complete-copywriting-course/,Codestars by Rob Percival,199.99,11.99,"4.6(3,720 ratings)",Marketing,,Copywriting
Modern Copywriting: Writing copy that sells in 2019,www.udemy.com/course/modern-copywriting-writing-copy-that-sells-in-2018/,Evan Kimbrell,199.99,11.99,"4.5(1,382 ratings)",Marketing,,Copywriting
Copywriting Master Course - Work From Home 3 Hours A Week!,www.udemy.com/course/copywriting-marketing-work-from-home/,Max Barra,194.99,48.75,"4.9(1,684 ratings)",Marketing,,Copywriting
Copywriting secrets - How to write copy that sells,www.udemy.com/course/copywriting-secrets/,Len Smith,89.99,11.99,"4.5(4,304 ratings)",Marketing,,Copywriting
Writing Tools & Hacks: Copywriting/Blogging/Content Writing,www.udemy.com/course/writing-tools-hacks/,Tyler Speegle,194.99,11.99,"4.3(1,233 ratings)",Marketing,,Copywriting
Build a Lucrative Copywriting Portfolio from Scratch,www.udemy.com/course/build-an-awesome-copywriting-portfolio-from-scratch/,Tamsin Henderson,129.99,11.99,4.5(291 ratings),Marketing,,Copywriting
"Copywriting - Become a Freelance Copywriter, your own boss",www.udemy.com/course/how-to-become-a-copywriter-from-home/,Len Smith,89.99,11.99,"4.3(1,921 ratings)",Marketing,,Copywriting
The Ultimate Copywriting Masterclass: Pro Secrets To Success,www.udemy.com/course/the-ultimate-copywriting-masterclass-pro-secrets-to-success/,Sophie A (SuperSoph),199.99,11.99,4.7(229 ratings),Marketing,,Copywriting
Advanced Copywriting Strategies for Online Sales,www.udemy.com/course/copywriting-courses/,Brian Yang,124.99,11.99,4.4(403 ratings),Marketing,,Copywriting
Copywriting White Papers – An All Levels Strategy,www.udemy.com/course/copywriting-how-to-write-a-white-paper/,Len Smith,89.99,11.99,4.4(684 ratings),Marketing,,Copywriting
How To Start Your Own Freelance Copywriting Business,www.udemy.com/course/how-to-become-a-copywriter/,Eric John Campbell,164.99,11.99,4.5(236 ratings),Marketing,,Copywriting
Copywriting: How To Be A Crazy Good Copywriter,www.udemy.com/course/how-to-think-and-write-like-a-copywriter/,Derek Franklin,94.99,11.99,4.4(450 ratings),Marketing,,Copywriting
The Ultimate Marketing Training 2020 - Sales Copy Academy,www.udemy.com/course/sales-copy-academy/,James Ryan,194.99,11.99,4.7(306 ratings),Marketing,,Copywriting
Complete Copywriting Masterclass+Copywriter Master Checklist,www.udemy.com/course/complete-copywriting-masterclass-copywriters-checklist/,Sivakumar Kannan,189.99,11.99,4.7(36 ratings),Marketing,,Copywriting
Write to Ignite - Master the Art of Sales Copy & Copywriting,www.udemy.com/course/write-to-ignite-persuasive-copy-writing-course/,Steve McDonald,89.99,11.99,4.3(267 ratings),Marketing,,Copywriting
Copywriting - The Psychology Of Your Irresistible Offer,www.udemy.com/course/copywriting-the-psychology-of-your-irresistible-copywriting-offer/,Vladimir Raykov,199.99,11.99,4.3(379 ratings),Marketing,,Copywriting
30 Copywriting Secrets from the Best Ad Campaign of All Time,www.udemy.com/course/30-copywriting-secrets-from-the-best-ad-campaign-of-all-time/,Alan Sharpe,49.99,11.39,4.5(379 ratings),Marketing,,Copywriting
How to Become a Freelance Copywriter. Work from Home.,www.udemy.com/course/freelance-copywriter-in-a-week-start-a-copywriting-business/,Alan Sharpe,49.99,11.39,4.6(99 ratings),Marketing,,Copywriting
"Ninja Writing: Writing Skills, Copywriting & Content Writing",www.udemy.com/course/ninja-writing-writing-skills-copywriting-content-writing/,Jean-Gabriel Paquette,184.99,11.39,3.2(140 ratings),Marketing,,Copywriting
Freelance Copywriting: How To Succeed As An Elite Copywriter,www.udemy.com/course/freelance-writer/,Clare Lynch,44.99,11.39,4.2(133 ratings),Marketing,,Copywriting
Digital Copywriting & Content Creation Guide,www.udemy.com/course/copywriting-content-marketing-course/,Indian Institute of Digital Education - IIDE,49.99,11.39,4.4(130 ratings),Marketing,,Copywriting
Copywriting Headline Masterclass,www.udemy.com/course/copywriting-how-to-write-copywriting-headlines/,Vladimir Raykov,99.99,11.39,4.8(206 ratings),Marketing,,Copywriting
Copywriting Public Relations - master PR publicity skills,www.udemy.com/course/pr-for-start-ups/,Len Smith,89.99,11.39,4.4(117 ratings),Marketing,,Copywriting
Copywriting for Beginners Part 2 of 3: Headlines & Openers,www.udemy.com/course/copywriting-for-beginners-part-2-of-5-headlines-openers/,Alan Sharpe,49.99,11.39,4.8(74 ratings),Marketing,,Copywriting
Copywriting; Complete Copy Writing 4 Blogging & Online Sales,www.udemy.com/course/unofficial-copywriting-techniques-for-udemy-instructors/,John Colley,199.99,50.00,4.5(168 ratings),Marketing,,Copywriting
Copywriting Blueprint: Write Epic Marketing and Sales Copy,www.udemy.com/course/write-epic-marketing-and-sales-copy/,Joeel & Natalie Rivera,184.99,11.39,4.4(46 ratings),Marketing,,Copywriting
Online Copywriting: How to Write Persuasive Product Pages,www.udemy.com/course/online-copywriting-how-to-write-persuasive-product-pages/,Alan Sharpe,49.99,11.39,4.5(39 ratings),Marketing,,Copywriting
Simple Copywriting Secrets: How to Write Killer Sales Copy,www.udemy.com/course/simple-copywriting-secrets-how-to-write-killer-sales-copy/,Mirka Pohjanrinne,79.99,11.39,4.4(41 ratings),Marketing,,Copywriting
Copywriting Secrets: Become a Content Writing Expert,www.udemy.com/course/copywritingwordsandphrases/,Tyler Speegle,99.99,11.39,4.2(132 ratings),Marketing,,Copywriting
Become a More Effective Copy Editor,www.udemy.com/course/become-a-more-effective-copyeditor/,Jeremy Rehwaldt,44.99,11.39,4.0(52 ratings),Marketing,,Copywriting
Copywriting for Beginners Part 1 of 3: Seven Vital Questions,www.udemy.com/course/copywriting-for-beginners-part-1-of-5-seven-vital-questions/,Alan Sharpe,49.99,11.39,4.4(164 ratings),Marketing,,Copywriting
Copywriting 101 - How to Turn Words into Passive Income,www.udemy.com/course/copywriting-101-how-to-turn-words-into-passive-income/,Bryan Guerra,199.99,11.39,4.7(109 ratings),Marketing,,Copywriting
Website Copywriting,www.udemy.com/course/website-copywriting/,Mirasee Team,19.99,11.39,3.9(235 ratings),Marketing,,Copywriting
Online Copywriting: How to Write a Profitable Landing Page,www.udemy.com/course/online-copywriting-write-a-landing-page-for-a-lead-magnet/,Alan Sharpe,49.99,11.39,4.6(8 ratings),Marketing,,Copywriting
Copywriting Blunders: Do You Make these 10 Common Mistakes?,www.udemy.com/course/copywriting-blunders-do-you-make-these-10-common-mistakes/,Alan Sharpe,49.99,11.39,4.3(801 ratings),Marketing,,Copywriting
Copywriting for Beginners Part 3 of 3: How to Persuade,www.udemy.com/course/copywriting-for-beginners-part-3-of-5-persuasion/,Alan Sharpe,49.99,11.39,4.6(62 ratings),Marketing,,Copywriting
Professional Copywriting Training,www.udemy.com/course/professional-copywriting-course/,Earners Classroom,119.99,11.39,3.8(99 ratings),Marketing,,Copywriting
Copywriting: How To Convert Features Into Benefits That Sell,www.udemy.com/course/copywriting-how-to-convert-features-into-benefits-sell-copywriting/,Vladimir Raykov,94.99,11.39,3.7(123 ratings),Marketing,,Copywriting
How To Influence And Persuade Your Audience With Copywriting,www.udemy.com/course/how-to-influence-and-persuade-your-audience-with-copywriting/,Jayadeep Rath,29.99,11.39,5.0(1 rating),Marketing,,Copywriting
Master Copywriting- Write Copy that get More Leads & Sales,www.udemy.com/course/master-copywriting-write-copy-that-get-more-leads-sales/,Ali Haider,29.99,11.39,4.4(86 ratings),Marketing,,Copywriting
"Copywriting A-Z write a copy that attract, convince & sells",www.udemy.com/course/copywriting-learning-digital-marketing-sale-content-headline-email/,Alireza Etemadi | Marketing Strategy Expert |,174.99,11.39,4.4(52 ratings),Marketing,,Copywriting
The Complete Copywriting Workshop For Increased Online Sales,www.udemy.com/course/copywriting-make-your-website-ads-videos-sell-more/,Dave Espino,199.99,11.39,4.5(96 ratings),Marketing,,Copywriting
Email Copywriting Strategy,www.udemy.com/course/email-copywriting-strategy/,Mike DeVincent,194.99,11.39,4.3(36 ratings),Marketing,,Copywriting
21 Copywriting Hacks That Deliver Quick And Easy Wins,www.udemy.com/course/21-copywriting-hacks/,Nick Usborne,59.99,11.39,4.5(34 ratings),Marketing,,Copywriting
Copy Intelligence: Write Persuasive Copy that Sells,www.udemy.com/course/copy-intelligence-write-persuasive-sales-copy-that-sells/,Basim Salim,199.99,11.39,4.4(21 ratings),Marketing,,Copywriting
2020 Copywriting Secrets To Write Money Sucking Sales Copy,www.udemy.com/course/copywriting-secret-formula-make-high-converting-sales-letter/,AlPacino Production,54.99,13.75,4.4(3 ratings),Marketing,,Copywriting
Chatbot Copywriting: Use Psychology to tell Stories & Sell,www.udemy.com/course/viral-marketing-how-to-create-sticky-content-viral-ideas-made-to-stick/,Stefan Kojouharov,19.99,11.99,4.2(66 ratings),Marketing,,Copywriting
10 Copywriting Hacks That Work in 2019,www.udemy.com/course/10-copywriting-hacks-that-work-in-2016/,Sandor Kiss,199.99,11.39,4.4(194 ratings),Marketing,,Copywriting
Digital Marketing Copywriting Bootcamp - Web Writing 101,www.udemy.com/course/digital-copywriting-bootcamp/,Scott Selsor,19.99,11.39,4.3(29 ratings),Marketing,,Copywriting
Build an engaging Facebook Messenger Bot That Sells,www.udemy.com/course/build-an-engaging-facebook-messenger-bot-that-sells/,Heba Mahdy,194.99,11.39,4.6(6 ratings),Marketing,,Copywriting
How to Write Sizzling Sales Copy,www.udemy.com/course/how-to-write-sizzling-sales-copy/,Penny Dablin,119.99,11.39,4.5(40 ratings),Marketing,,Copywriting
Complete Copywriting Course For 2020: Write Copy That Sells,www.udemy.com/course/complete-copywriting-course-write-copy-that-sells/,Shubhi Saxena,184.99,11.39,0.0(0 ratings),Marketing,,Copywriting
How To Effectively Persuade Using High Converting Templates,www.udemy.com/course/how-to-effectively-persuade-using-high-converting-templates/,James Canzanella,199.99,11.39,4.4(13 ratings),Marketing,,Copywriting
Copywriting Masterclass - Writing that Sells,www.udemy.com/course/winning-copywriting-strategies/,Doru Catana,199.99,11.39,3.8(121 ratings),Marketing,,Copywriting
How to write a persuasive sales video script (copywriting),www.udemy.com/course/how-to-write-a-persuasive-sales-video-copywriting-tactics/,Heba Mahdy,99.99,11.39,4.1(7 ratings),Marketing,,Copywriting
Story Selling: Supercharge Your Sales with Stories,www.udemy.com/course/story-selling/,Basim Salim,99.99,11.39,3.0(22 ratings),Marketing,,Copywriting
Win Top Paying Copywriting Jobs With My Copywriting Secrets!,www.udemy.com/course/winning-top-paying-copywriting-contracts-how-to-earn-big/,James Bos,89.99,11.39,4.3(22 ratings),Marketing,,Copywriting
How to Write Sales Copy,www.udemy.com/course/sales-copy-that-sells-made-easy/,Mark Tandan,29.99,11.39,4.2(17 ratings),Marketing,,Copywriting
Copywriting - Write Titles Like A Professional Copywriter,www.udemy.com/course/marketing-titles-that-work/,Mark Timberlake,64.99,11.39,3.4(35 ratings),Marketing,,Copywriting
Poetry and Copywriting: a shared approach,www.udemy.com/course/poetry-and-copywriting/,Gwyneth Box,39.99,11.39,3.8(13 ratings),Marketing,,Copywriting
Web CopyWriting: Consistently Outperform Your Competitors,www.udemy.com/course/web-copywriting-that-works/,Oxford Learning Lab,104.99,11.39,3.5(43 ratings),Marketing,,Copywriting
Copywriting - grab the reader by the throat,www.udemy.com/course/copywriting-grab-the-reader-by-the-throat/,Krisztina Rudnay,99.99,11.39,3.9(3 ratings),Marketing,,Copywriting
Email Marketing Guide: Massive List Building For Success,www.udemy.com/course/email-marketing-guide/,Federico Fort,139.99,11.39,4.5(20 ratings),Marketing,,Copywriting
The Complete Copywriting Course,www.udemy.com/course/the-complete-copywriting-course-rosie-bell/,Rosie Bell,29.99,18.99,4.0(1 rating),Marketing,,Copywriting
Copywriting Basics - How to Write the Best Product Reviews,www.udemy.com/course/copywriting-basics-how-to-write-the-best-product-reviews/,Adrian Lauruc,19.99,11.99,4.3(10 ratings),Marketing,,Copywriting
Copywriting for High-Priced Programs,www.udemy.com/course/long-sales-pages/,Marcia Yudkin,94.99,11.99,3.9(6 ratings),Marketing,,Copywriting
Copywriting That Works!,www.udemy.com/course/ltwg-audience-course/,Ed Stanfield,44.99,11.99,4.9(4 ratings),Marketing,,Copywriting
Learn How to Sell your Freelance writing Skills,www.udemy.com/course/freelance-copywriting-5-secrets-of-successful-copywriter/,Sahrish Gull,89.99,11.99,4.4(15 ratings),Marketing,,Copywriting
Copywriting For Non-Copywriters,www.udemy.com/course/copycritique/,Cathy Goodwin,49.99,11.99,4.4(10 ratings),Marketing,,Copywriting
Exclusive Insights from Australian's Copywriter Brett Mcfall,www.udemy.com/course/exclusive-insights-from-australians-copywriter-brett-mcfall/,Daniele Protti,49.99,11.99,3.3(5 ratings),Marketing,,Copywriting
21 Copywriting Hacks (Marketing psychology and Persuasion) .,www.udemy.com/course/21-copywriting-hacks-marketing-psychology-and-persuasion/,Heba Mahdy,179.99,11.99,3.6(7 ratings),Marketing,,Copywriting
The Best Direct Marketing Ads Reviewed Step-By-Step,www.udemy.com/course/the-best-copywriting-direct-marketing-ads-video-review/,Bruno Coelho,49.99,11.99,4.3(3 ratings),Marketing,,Copywriting
How to write sales page for your info product (copywriting),www.udemy.com/course/how-to-write-sales-page-for-your-info-product-copywriting/,Heba Mahdy,199.99,11.99,4.4(16 ratings),Marketing,,Copywriting
Copywriting Tips to Write Better Emails & Sales Pages,www.udemy.com/course/copywriting-tips-to-write-better-emails-sales-pages/,Invert Media,199.99,11.99,0.0(0 ratings),Marketing,,Copywriting
Copywriting for Pros,www.udemy.com/course/copywriting-for-pros/,Mike Collins,49.99,11.99,3.5(62 ratings),Marketing,,Copywriting
Copywriting For Complete Beginners,www.udemy.com/course/copywriting-for-beginners/,Johnson Kee,19.99,11.99,3.7(45 ratings),Marketing,,Copywriting
Easy Copywriting: Write HOT sales letters in 2 hours or less,www.udemy.com/course/copywriting/,Rachel Rofe,49.99,11.99,4.2(12 ratings),Marketing,,Copywriting
How to write better copy,www.udemy.com/course/how-to-write-better-copy/,Catherine Every,24.99,11.99,4.0(1 rating),Marketing,,Copywriting
Copy Mindsets: Mastering the Inner Game of Copywriting,www.udemy.com/course/copy-mindsets/,Basim Salim,49.99,11.99,4.5(4 ratings),Marketing,,Copywriting
The 10 Day Copywriting Challenge,www.udemy.com/course/10-day-copywriting-challenge/,Richard Winser,39.99,11.99,4.0(6 ratings),Marketing,,Copywriting
Killer Copywriting - 17 Crucial Copywriting Steps,www.udemy.com/course/killer-copywriting-17-crucial-copywriting-steps/,Scrembo Paul,19.99,11.39,3.6(11 ratings),Marketing,,Copywriting
Solopreneur success guide: #2 Copywriting and eBook creation,www.udemy.com/course/solopreneur-success-guide-2-copywriting-and-ebook-creation/,Creatives Academy,124.99,11.39,4.2(6 ratings),Marketing,,Copywriting
How To Write Marketing Copy That Sells,www.udemy.com/course/how-to-write-marketing-copy-that-sells/,Eric Sutherland,19.99,11.39,4.1(5 ratings),Marketing,,Copywriting
Copywriting: The Questions Your Prospects Have And Won't Ask,www.udemy.com/course/copywriting-the-questions-your-prospects-have-and-wont-ask/,Vladimir Raykov,19.99,11.39,3.8(131 ratings),Marketing,,Copywriting
Fundamental Copywriting For Beginners,www.udemy.com/course/fundamental-copywriting-for-beginners-digital-marketing/,Michael Naus,19.99,11.39,4.4(5 ratings),Marketing,,Copywriting
Million Value Copy Writing,www.udemy.com/course/million-value-copy-writing/,Seth A. Estrada,199.99,11.39,4.1(12 ratings),Marketing,,Copywriting
Learn To Convert Strangers into Life Long Customers,www.udemy.com/course/how-to-make-ads-that-sell/,Bert Martinez,19.99,11.39,4.0(23 ratings),Marketing,,Copywriting
Top Copywriters’ Secrets Revealed: Creating the Headline,www.udemy.com/course/top-copywriters-secrets-revealed-creating-the-headline/,Pete Mitchell,19.99,11.39,4.3(21 ratings),Marketing,,Copywriting
Copy that Connects and Converts With Passion Points,www.udemy.com/course/passionpointcopy/,Manyon Lisa,194.99,11.39,0.0(0 ratings),Marketing,,Copywriting
ImprovPal - The Humor Sales System,www.udemy.com/course/improvpal-the-humor-sales-system/,Damon Nelson,24.99,11.39,3.5(2 ratings),Marketing,,Copywriting
Digital Marketing  Crash Course - Work From Home 1 HR a day!,www.udemy.com/course/work-from-home-business-freelance-copywriting/,Melissa Elizabeth Ong,149.99,37.50,4.4(35 ratings),Marketing,,Copywriting
19 Copywriting Secrets to Convert Leads into Customers,www.udemy.com/course/19-copywriting-secrets-to-convert-leads-into-customers/,Jamil Muhammad,199.99,11.39,4.5(25 ratings),Marketing,,Copywriting
Copywriting - Copywriting Basics - Secrets That Bring Sales,www.udemy.com/course/crafting-a-marketing-message-that-sells/,Dave Espino,99.99,11.39,3.9(18 ratings),Marketing,,Copywriting
Accelerated Program for Six-Figure Copywriting.,www.udemy.com/course/copywriting-pro/,Mark Henderson,19.99,11.39,0.0(0 ratings),Marketing,,Copywriting
Copywriting & Content Strategy: Knowing Your Audience,www.udemy.com/course/copywriting-content-strategy-knowing-your-audience/,Aldric Tinker Toyad,19.99,11.39,0.0(0 ratings),Marketing,,Copywriting
Content Marketing: How To Create Great Copy For your Content,www.udemy.com/course/content-marketing-a-z/,Barry North,89.99,11.39,3.7(16 ratings),Marketing,,Copywriting
Key to a Great Copywriting Career,www.udemy.com/course/secrets-of-great-copywriting-the-ultimate-course/,Eduonix Learning Solutions,29.99,11.99,4.1(78 ratings),Marketing,,Copywriting
How To Sell More By Becoming A Better Copywriter,www.udemy.com/course/copywriting-secrets-start-your-own-copywriting-journey/,Kevin Farrugia,69.99,11.99,3.1(2 ratings),Marketing,,Copywriting
Copywriting Basics: How To Write Bullet Points,www.udemy.com/course/copybullets/,Cathy Goodwin,19.99,11.99,0.0(0 ratings),Marketing,,Copywriting
Copywriting Blueprint For Beginners + Freebies,www.udemy.com/course/copywriting-blueprint/,Rufeena Jones S,49.99,11.99,3.8(8 ratings),Marketing,,Copywriting
The Complete Copywriting Masterclass - Writing That Converts,www.udemy.com/course/the-copywriting-masterclass/,Robin & Jesper | Digital Marketing Professionals,199.99,11.99,5.0(7 ratings),Marketing,,Copywriting
Secret Copywriting Tactics To Write Copy That Sells in 2020,www.udemy.com/course/secret-copywriting-tactics-to-write-copy-that-sells-in-2020/,AlPacino Production,89.99,22.50,0.0(0 ratings),Marketing,,Copywriting
"Magnetic Copywriting Formula, Boost Sales with Integrity",www.udemy.com/course/magnetic-cash-flow-formula/,Bob Baker,39.99,11.99,4.2(13 ratings),Marketing,,Copywriting
Profitable Email Marketing,www.udemy.com/course/profitable-email-marketing/,Profit Copilot,19.99,11.99,0.0(0 ratings),Marketing,,Copywriting
Killer Copywriting,www.udemy.com/course/killercopywriting/,Darcy Carter,19.99,11.99,0.0(0 ratings),Marketing,,Copywriting
Copywriting Basics,www.udemy.com/course/copywriting-basics-r/,Amit Ray,19.99,11.99,3.1(10 ratings),Marketing,,Copywriting
Sales Copywriting : 2 types of viral content that sells more,www.udemy.com/course/sales-copywriting-2-types-of-viral-content-that-sells-more/,Olympio Vital Yaovi Robert,49.99,11.99,3.5(5 ratings),Marketing,,Copywriting
Copywriting Guide,www.udemy.com/course/copywriting-guide/,Taimo Paavola,24.99,11.99,0.0(0 ratings),Marketing,,Copywriting
"Write Powerful Copywriting, Drive Sales & Generate Leads!",www.udemy.com/course/write-powerful-copywriting-that-sells/,Felipe Quintero,29.99,11.99,2.8(9 ratings),Marketing,,Copywriting
How to Be a Copywriter (Even if You Don't Like Selling),www.udemy.com/course/how-to-be-a-copywriter-even-if-you-suck-at-selling/,Dean Soto,199.99,11.99,3.5(10 ratings),Marketing,,Copywriting
The Complete Freelance Copywriters Course,www.udemy.com/course/the-complete-freelance-copywriters-course/,Kim Bock,29.99,11.99,0.0(0 ratings),Marketing,,Copywriting
Fast Sales Copywriting For The Absolute Beginner,www.udemy.com/course/fast-sales-copywriting-for-the-absolute-beginner/,Mike DeVincent,194.99,11.99,4.5(7 ratings),Marketing,,Copywriting
How to Be a Copywriter (Even if You Don't Like Selling),www.udemy.com/course/how-to-be-a-copywriter-even-if-you-suck-at-selling/,Dean Soto,199.99,11.99,3.5(10 ratings),Marketing,,Copywriting
The Complete Freelance Copywriters Course,www.udemy.com/course/the-complete-freelance-copywriters-course/,Kim Bock,29.99,11.99,0.0(0 ratings),Marketing,,Copywriting
155 Years of Copywriting Insights Taught In 1.5 Hour Course!,www.udemy.com/course/copywriter/,Eric John Campbell,0,Free,4.4(979 ratings),Marketing,,Copywriting
Copywriting Foundations: Sell Using Your Words In 2019,www.udemy.com/course/2019-copywriting-foundations/,Eric John Campbell,0,Free,4.4(42 ratings),Marketing,,Copywriting
Copywriting Quick Start: Top FREE Writing Tools & Hacks,www.udemy.com/course/copywritingquickstart/,Tyler Speegle,0,Free,4.3(810 ratings),Marketing,,Copywriting
Effective Copywriting Basics for Entrepreneuers,www.udemy.com/course/copywriting-basics/,"Skillhance, LLC",0,Free,3.9(209 ratings),Marketing,,Copywriting
Copywriting that sells for ambitious people,www.udemy.com/course/copywriting-that-sells-for-ambitious-people/,Lieze Neven,0,Free,4.3(202 ratings),Marketing,,Copywriting
Copywriting: Fundamentals For Beginners,www.udemy.com/course/copywriting-fundamentals-for-beginners/,Mason Komay,0,Free,4.5(68 ratings),Marketing,,Copywriting
CORSO COPYWRITING: SCRIVERE PER  VENDERE,www.udemy.com/course/action-writing-scrivere-per-coinvolgere-e-vendere/,Gabriele Prevato,199.99,11.99,4.4(260 ratings),Marketing,,Copywriting
免許皆伝：コピーライティング,www.udemy.com/course/copy-writing/,石崎力也 (RIKIYA ISHIZAKI),199.99,11.99,4.0(118 ratings),Marketing,,Copywriting
【これだけでOK！】プロが教える「売れる」チラシの作り方講座,www.udemy.com/course/ok_flyer/,谷本 理恵子,199.99,11.99,4.2(202 ratings),Marketing,,Copywriting
Copywriting Avançado - A Estratégia Milionária do Marketing,www.udemy.com/course/copywriting-avancado-em-marketing-digital/,Andre Silva,199.99,11.99,4.7(21 ratings),Marketing,,Copywriting
Copywriting para negocios online,www.udemy.com/course/copywriting-para-negocios-online/,Isabel romero,149.99,11.99,4.4(262 ratings),Marketing,,Copywriting
コピーライティングの最高戦力：たった一文で人の感情を動かし購買を誘発する『ブレットライティング』,www.udemy.com/course/bullet-writing/,長嶋 雄二,99.99,11.99,4.7(8 ratings),Marketing,,Copywriting
"Copywriting: tudo sobre headlines, sem precisar ser criativo",www.udemy.com/course/copywriting-tudo-sobre-headlines-sem-precisar-ser-criativo/,Gustavo Loureiro dos Reis,134.99,11.99,4.7(14 ratings),Marketing,,Copywriting
Copywriting Expert | Torne-se um Mestre das Vendas,www.udemy.com/course/copywriting-expert/,Rafael Mota,29.99,11.99,4.2(21 ratings),Marketing,,Copywriting
食いっぱぐれないコピーライター：反応率10倍の禁断Webコピーライティング技術,www.udemy.com/course/copywriting-mastery-course/,石崎力也 (RIKIYA ISHIZAKI),124.99,11.99,4.1(53 ratings),Marketing,,Copywriting
Copywriting: Aumenta las Ventas Escribiendo Textos Perfectos,www.udemy.com/course/copywriting-negocios-ventas/,Daniel Alejandro,89.99,11.99,4.4(45 ratings),Marketing,,Copywriting
Copywriting - Jak zostać Copywriterem i zarabiać na pisaniu?,www.udemy.com/course/copywriting-jak-zostac-copywriterem-i-zarabiac-na-pisaniu/,Szymon Owedyk,0,29.99,4.1(6 ratings),Marketing,,Copywriting
コピーライティング基礎マスターテンプレート（書けない、を書けるにするための実践ノウハウ）,www.udemy.com/course/copywriting-basic-master-template/,山田 どうそん,199.99,11.99,4.3(28 ratings),Marketing,,Copywriting
Guide complet de copywriting pour écrire des pages de vente,www.udemy.com/course/guide-complet-de-copywriting-pour-ecrire-des-pages-de-vente/,Renaud Demaret,19.99,11.99,3.4(22 ratings),Marketing,,Copywriting
Corso avanzato in SEO Copywriting 2019,www.udemy.com/course/corso-avanzato-seo-copywriting/,Giovanni Sacheli,0,19.99,3.7(18 ratings),Marketing,,Copywriting
コピーライティング講座：オファー編,www.udemy.com/course/copy-writing-offer/,山田 どうそん,199.99,11.99,4.5(1 rating),Marketing,,Copywriting
コピーライティング講座：リサーチ編,www.udemy.com/course/copywriting-research/,山田 どうそん,199.99,11.99,4.0(9 ratings),Marketing,,Copywriting
Cómo escribir para Internet con SEO y Usabilidad,www.udemy.com/course/como-escribir-para-internet-con-seo-y-usabilidad/,Jonathan Campos,19.99,11.99,4.0(55 ratings),Marketing,,Copywriting
Redação para ENEM e vestibulares,www.udemy.com/course/dafnedino/,Dafne Berbigier Dino,39.99,19.99,4.7(40 ratings),Marketing,,Copywriting
Copywriting Facile : L'art de vendre avec les mots !,www.udemy.com/course/copywriting-facile-lart-de-vendre-avec-les-mots/,Aziz Diallo,74.99,11.99,3.9(96 ratings),Marketing,,Copywriting
コピーライティング講座：ボディコピー編,www.udemy.com/course/copy-body/,山田 どうそん,199.99,11.99,5.0(1 rating),Marketing,,Copywriting
Copywriter Fundamentos,www.udemy.com/course/copywriter-fundamentos/,Rodolfo Nascimento,149.99,11.99,4.5(11 ratings),Marketing,,Copywriting
コピーライティング講座：クロージング編,www.udemy.com/course/copy-closing/,山田 どうそん,199.99,11.99,5.0(2 ratings),Marketing,,Copywriting
コピーライティング講座：ヘッドライン編,www.udemy.com/course/copy-writing-headlines/,山田 どうそん,199.99,11.99,5.0(1 rating),Marketing,,Copywriting
Gravity コピーライティング初級者養成基礎講座,www.udemy.com/course/gravity-copywriting/,Ｂｏｏｋ マン,199.99,11.99,3.9(44 ratings),Marketing,,Copywriting
