Course,URL,instructor,Price (full),Price (discount),Rank,Category 1,Category 2,Category 3
The Data Science Course 2019: Complete Data Science Bootcamp,www.udemy.com/course/the-data-science-course-complete-data-science-bootcamp/,365 Careers,199.99,11.99,"4.5(39,377 ratings)",Development,,Data Science
Machine Learning A-Z™: Hands-On Python & R In Data Science,www.udemy.com/course/machinelearning/,Kirill Eremenko,199.99,11.99,"4.5(101,318 ratings)",Development,,Data Science
Python for Data Science and Machine Learning Bootcamp,www.udemy.com/course/python-for-data-science-and-machine-learning-bootcamp/,Jose Portilla,194.99,11.99,"4.5(58,638 ratings)",Development,,Data Science
R Programming A-Z™: R For Data Science With Real Exercises!,www.udemy.com/course/r-programming/,Kirill Eremenko,199.99,11.99,"4.6(24,899 ratings)",Development,,Data Science
"Machine Learning, Data Science and Deep Learning with Python",www.udemy.com/course/data-science-and-machine-learning-with-python-hands-on/,Sundog Education by Frank Kane,189.99,11.99,"4.5(17,782 ratings)",Development,,Data Science
Data Science A-Z™: Real-Life Data Science Exercises Included,www.udemy.com/course/datascience/,Kirill Eremenko,199.99,11.99,"4.6(22,101 ratings)",Development,,Data Science
Statistics for Data Science and Business Analysis,www.udemy.com/course/statistics-for-data-science-and-business-analysis/,365 Careers,149.99,11.99,"4.5(9,336 ratings)",Development,,Data Science
Python A-Z™: Python For Data Science With Real Exercises!,www.udemy.com/course/python-coding/,Kirill Eremenko,199.99,11.99,"4.6(10,735 ratings)",Development,,Data Science
Complete 2020 Data Science & Machine Learning Bootcamp,www.udemy.com/course/python-data-science-machine-learning-bootcamp/,Philipp Muellauer,199.99,11.99,4.6(804 ratings),Development,,Data Science
Data Science and Machine Learning Bootcamp with R,www.udemy.com/course/data-science-and-machine-learning-bootcamp-with-r/,Jose Portilla,194.99,11.99,"4.6(8,952 ratings)",Development,,Data Science
R Programming: Advanced Analytics In R For Data Science,www.udemy.com/course/r-analytics/,Kirill Eremenko,199.99,11.99,"4.7(4,596 ratings)",Development,,Data Science
Data Science & Deep Learning for Business™ 20 Case Studies,www.udemy.com/course/data-science-deep-learning-for-business-20-case-studies/,Rajeev D. Ratan,199.99,11.99,4.5(138 ratings),Development,,Data Science
Machine Learning: Complete Data Science and Machine Learning,www.udemy.com/course/complete-data-science-and-machine-learning-using-python/,Jitesh Khurkhuriya,199.99,11.99,4.5(229 ratings),Development,,Data Science
Data Science: Deep Learning in Python,www.udemy.com/course/data-science-deep-learning-in-python/,Lazy Programmer Inc.,179.99,11.99,"4.6(5,581 ratings)",Development,,Data Science
SQL & Database Design A-Z™: Learn MS SQL Server + PostgreSQL,www.udemy.com/course/sqldatabases/,Kirill Eremenko,199.99,11.99,"4.4(2,601 ratings)",Development,,Data Science
Data Science Career Guide - Interview Preparation,www.udemy.com/course/data-science-career-guide-interview-preparation/,Jose Portilla,194.99,11.99,"4.5(1,272 ratings)",Development,,Data Science
Machine Learning Practical Workout | 8 Real-World Projects,www.udemy.com/course/deep-learning-machine-learning-practical/,"Dr. Ryan Ahmed, Ph.D., MBA",199.99,11.99,4.5(198 ratings),Development,,Data Science
Data Science: Supervised Machine Learning in Python,www.udemy.com/course/data-science-supervised-machine-learning-in-python/,Lazy Programmer Inc.,119.99,11.39,"4.5(1,381 ratings)",Development,,Data Science
Complete Data Science Training with Python for Data Analysis,www.udemy.com/course/complete-data-science-training-with-python-for-data-analysis/,Minerva Singh,199.99,11.39,"4.2(1,117 ratings)",Development,,Data Science
Causal Data Science with Directed Acyclic Graphs,www.udemy.com/course/causal-data-science/,Paul Hünermund,19.99,11.39,4.6(50 ratings),Development,,Data Science
Python for Machine Learning bootcamp,www.udemy.com/course/python-for-machine-learning-bootcamp/,behi oueslati,184.99,11.39,4.5(78 ratings),Development,,Data Science
Data Science for Beginners: Hands-On Data Science in Python,www.udemy.com/course/data-science-for-beginners-hands-on-data-science-in-python/,Vijay Gadhave,199.99,11.39,4.4(126 ratings),Development,,Data Science
Careers in Data Science A-Z™,www.udemy.com/course/careers-in-data-science-a-ztm/,Kirill Eremenko,199.99,11.39,"4.5(1,362 ratings)",Development,,Data Science
Introduction to Machine Learning for Data Science,www.udemy.com/course/machine-learning-for-data-science/,David Valentine,199.99,11.39,"4.3(2,039 ratings)",Development,,Data Science
Python Programming Bible: Hands-On Python 3 with 10 Projects,www.udemy.com/course/python-programming-bible-hands-on-python-3-with-10-projects/,Vijay Gadhave,199.99,11.39,4.7(126 ratings),Development,,Data Science
Deploy Machine Learning & NLP Models with Dockers (DevOps),www.udemy.com/course/deploy-data-science-nlp-models-with-docker-containers/,UNP United Network of Professionals,49.99,11.39,4.4(434 ratings),Development,,Data Science
Intro to Data Science: Your Step-by-Step Guide To Starting,www.udemy.com/course/intro-to-data-science/,Kirill Eremenko,199.99,11.39,"4.2(1,004 ratings)",Development,,Data Science
Data Science and Machine Learning using Python - A Bootcamp,www.udemy.com/course/data-science-and-machine-learning-using-python-bootcamp-qazi/,"Dr. Junaid Qazi, PhD",199.99,11.39,4.4(366 ratings),Development,,Data Science
Complete Python for data science and cloud computing,www.udemy.com/course/complete-python-for-data-science-and-cloud-computing/,Datagist INC,99.99,11.39,4.3(85 ratings),Development,,Data Science
R programming with Statistics for Data science,www.udemy.com/course/hands-on-r-programming-with-statistics-for-data-science/,Hands-On System,199.99,11.39,4.4(31 ratings),Development,,Data Science
Machine Learning Projects A-Z : Kaggle and Real World Pro,www.udemy.com/course/machine-learning-projects-kaggle-and-real-world-pro/,Geekshub Pvt Ltd,199.99,11.39,3.8(45 ratings),Development,,Data Science
Generate and visualize data in Python and MATLAB,www.udemy.com/course/suv-data-mxc/,Mike X Cohen,29.99,11.39,4.5(142 ratings),Development,,Data Science
Build and train a data model to recognize objects in images!,www.udemy.com/course/pythondatascience/,Mammoth Interactive,199.99,11.39,4.3(165 ratings),Development,,Data Science
Mastering Data Science : Learn Hands-On,www.udemy.com/course/mastering-data-science-learn-hands-on/,Hands-On System,199.99,11.39,3.5(3 ratings),Development,,Data Science
Data Science & Machine Learning : Hands on Data Science 2019,www.udemy.com/course/data-science-with-python-and-pandas/,Ankit Mistry,19.99,11.39,4.4(366 ratings),Development,,Data Science
Data Science complete guide on Linear Algebra - DeepLearning,www.udemy.com/course/linear-algebra-for-data-science-machine-learning-ai/,Manifold AI Learning ®,59.99,11.39,4.4(90 ratings),Development,,Data Science
Complete Time Series Analysis With Python,www.udemy.com/course/complete-time-series-data-analysis-bootcamp-with-python/,Minerva Singh,199.99,11.39,4.1(410 ratings),Development,,Data Science
"Python Data Science basics with Numpy, Pandas and Matplotlib",www.udemy.com/course/python-data-science-basics-with-numpy-pandas-and-matplotlib/,Abhilash Nelson,164.99,11.39,4.3(19 ratings),Development,,Data Science
Statistics Masterclass for Data Science and Data Analytics,www.udemy.com/course/statistics-for-data-science-and-analytics-masterclass/,Vijay Gadhave,199.99,11.39,4.3(134 ratings),Development,,Data Science
Data Science Masterclass With R! 4 Projects+8 Case Studies,www.udemy.com/course/data-science-complete-course/,Up Degree,19.99,11.39,4.3(388 ratings),Development,,Data Science
Mathematics for Data Science and Machine Learning using R,www.udemy.com/course/mathematics-for-data-science-and-machine-learning-using-r/,Eduonix Learning Solutions,39.99,11.39,4.5(31 ratings),Development,,Data Science
Tidy Data: Updated Data Processing With tidyr and dplyr in R,www.udemy.com/course/tidy-data-updated-data-processing-with-tidyr-and-dplyr-in-r/,Minerva Singh,199.99,11.39,4.5(40 ratings),Development,,Data Science
Introduction to Data Science,www.udemy.com/course/learn-data-science/,Data Hawk Tech,19.99,11.39,4.1(477 ratings),Development,,Data Science
Data Science : Master Machine Learning Without Coding,www.udemy.com/course/hands-on-machine-learning-without-writing-code/,Ram Prasad,124.99,11.39,4.3(247 ratings),Development,,Data Science
R for Data Science: Learn R Programming in 2 Hours,www.udemy.com/course/r-for-data-science-learn-r-programming-in-2-hours/,Ajay R Warrier,29.99,11.39,4.4(25 ratings),Development,,Data Science
"Data Science, Machine Learning and Data Analysis with Python",www.udemy.com/course/data-science-machine-learning-and-data-analysis-with-python-a/,Plumira DotCom,19.99,11.39,4.8(7 ratings),Development,,Data Science
Machine Learning Career Guide – Technical Interview,www.udemy.com/course/mlcg-technical-interview/,Vladimir Poliakov,119.99,11.39,4.1(49 ratings),Development,,Data Science
Outlier Detection Algorithms in Data Mining and Data Science,www.udemy.com/course/outlier-detection-techniques/,KDD Expert,74.99,11.39,3.8(121 ratings),Development,,Data Science
Effective Data Science: Delivering Impact & Value End-to-End,www.udemy.com/course/effective-data-science/,datagene.io Inc.,89.99,11.99,4.7(148 ratings),Development,,Data Science
The Comprehensive Statistics and Data Science with R Course,www.udemy.com/course/comprcourse/,"Geoffrey Hubona, Ph.D.",174.99,11.99,3.9(204 ratings),Development,,Data Science
Python + Data Science : Practical Guide [13 Hours],www.udemy.com/course/practical-data-science-using-python/,Eduonix Learning Solutions,69.99,11.99,4.4(20 ratings),Development,,Data Science
Advanced Data Science Techniques in SPSS,www.udemy.com/course/advanced-data-science-techniques-in-spss/,Bogdan Anastasiei,79.99,11.99,4.3(48 ratings),Development,,Data Science
R Programming Hands-on Specialization for Data Science (Lv1),www.udemy.com/course/r-programming-data-science-hands-on-course/,Irfan Elahi,139.99,11.99,4.5(466 ratings),Development,,Data Science
"Data Science with Plotly, NumPy, Matplotlib, and Pandas",www.udemy.com/course/python-pandas-plotly-datascience/,"Ashwin Pajankar • 50,000+ Students Worldwide",19.99,11.99,4.0(37 ratings),Development,,Data Science
Beginner's Guide to Python Data Analysis & Visualization,www.udemy.com/course/complete-pandas-bootcamp-with-python-3/,Alan H Yue,199.99,11.99,4.5(185 ratings),Development,,Data Science
DATA SCIENCE with MACHINE LEARNING and DATA ANALYTICS,www.udemy.com/course/data-science-with-machine-learning-and-data-analytics/,DATAhill Solutions Srinivas Reddy,199.99,11.99,4.0(16 ratings),Development,,Data Science
Statistics for Data science,www.udemy.com/course/datascience-statistics/,Shivprasad Koirala,19.99,11.99,4.5(65 ratings),Development,,Data Science
Master Data Recognition & Prediction in Python & TensorFlow,www.udemy.com/course/datamodelling/,Mammoth Interactive,199.99,11.99,4.4(13 ratings),Development,,Data Science
Statistical Averages : Course in Statistics for Data Science,www.udemy.com/course/statistical-averages-course-in-statistics-for-data-science/,Shilank Singh,109.99,11.99,5.0(3 ratings),Development,,Data Science
Discrete Optimization Data Science Heuristic & Metaheuristic,www.udemy.com/course/discrete-optimization/,Up Degree,19.99,11.99,3.7(4 ratings),Development,,Data Science
Practical Data Science: Analyzing Stock Market Data with R,www.udemy.com/course/practical-data-science-analyzing-stock-market-data-with-r/,Manuel Amunategui,0,49.99,3.5(317 ratings),Development,,Data Science
Data Science Statistics A-Z : Python,www.udemy.com/course/data-science-statistics-python/,Geekshub Pvt Ltd,199.99,11.99,4.0(12 ratings),Development,,Data Science
Learning Path: Julia: Explore Data Science with Julia,www.udemy.com/course/learning-path-julia-explore-data-science-with-julia/,Packt Publishing,199.99,11.99,3.0(36 ratings),Development,,Data Science
A Practical Guide to Alteryx for Data Science & Analytics,www.udemy.com/course/practical-guide-to-alteryx-for-data-science/,Jeff Lo,99.99,11.99,4.2(20 ratings),Development,,Data Science
Data Science and Machine Learning Masterclass with R,www.udemy.com/course/business-analytics-with-r/,Up Degree,199.99,11.39,4.3(238 ratings),Development,,Data Science
Data Science: Machine Learning and Statistical Modeling in R,www.udemy.com/course/ultimate-machine-learning-with-r/,Star Academy,194.99,11.39,4.2(51 ratings),Development,,Data Science
"Python 3 Data Processing with Pandas, Matplotlib, and Plotly",www.udemy.com/course/python-3-data-processing-with-pandas-matplotlib-and-plotly/,"Ashwin Pajankar • 50,000+ Students Worldwide",19.99,11.39,4.3(2 ratings),Development,,Data Science
The Complete Data Science Project Management Course,www.udemy.com/course/data-science-project-management/,HiTech Squad,19.99,11.39,3.9(44 ratings),Development,,Data Science
Beyond Jupyter Notebooks,www.udemy.com/course/beyond-jupyter-notebooks/,Joshua Görner,19.99,11.39,3.5(62 ratings),Development,,Data Science
Data Science with R - Beginners,www.udemy.com/course/data-science-with-r-beginners/,SimpliCode Point,99.99,11.39,3.8(141 ratings),Development,,Data Science
Learn Data Science with Python - Part 1: Python Basics,www.udemy.com/course/learn-data-science-with-python-part-1-python-basics/,Tony Staunton,29.99,11.39,3.8(4 ratings),Development,,Data Science
Data Science and Machine Learning in Python,www.udemy.com/course/data-science-and-machine-learning-in-python/,Gaurav Chauhan,199.99,11.39,4.0(23 ratings),Development,,Data Science
Beginning with Machine Learning & Data Science in Python,www.udemy.com/course/jumpstart-to-data-science-machine-learning-using-python/,UNP United Network of Professionals,24.99,11.39,4.1(120 ratings),Development,,Data Science
How to Become A Data Scientist Using Azure Machine Learning,www.udemy.com/course/azure-machine-learning-introduction/,Mike West,19.99,11.39,4.0(206 ratings),Development,,Data Science
"Machine Learning, AI and Data Science without programming",www.udemy.com/course/machine-learning-ai-and-data-science-without-programming/,Domien Van Damme,19.99,11.39,4.2(13 ratings),Development,,Data Science
Data Science 101,www.udemy.com/course/data-science-101/,Nolita Analytics,199.99,11.39,3.7(17 ratings),Development,,Data Science
Statistical Methods and Applied Mathematics in Data Science,www.udemy.com/course/statistical-methods-and-applied-mathematics-in-data-science/,Packt Publishing,124.99,11.39,4.1(30 ratings),Development,,Data Science
Pandas & Seaborn Data Science and Visualization Masterclass,www.udemy.com/course/pandas-seaborn-data-science-and-visualization-masterclass/,"Ashwin Pajankar • 50,000+ Students Worldwide",19.99,11.39,4.1(26 ratings),Development,,Data Science
Data Science on R By OrangeTree Global,www.udemy.com/course/data-science-on-r-by-orangetree-global/,OrangeTree Global,199.99,11.39,3.4(2 ratings),Development,,Data Science
Data Science and Machine Learning Bootcamp with Python & R™,www.udemy.com/course/data-science-and-machine-learning-bootcamp-with-python-and-r/,Apex Education,199.99,11.39,0.0(0 ratings),Development,,Data Science
Python and Pandas Data Science and Visualization Masterclass,www.udemy.com/course/python-and-pandas-data-science-and-visualization-masterclass/,"Ashwin Pajankar • 50,000+ Students Worldwide",19.99,11.39,0.0(0 ratings),Development,,Data Science
Practical Data Science: Reducing High Dimensional Data in R,www.udemy.com/course/practical-data-science-reducing-high-dimensional-data-in-r/,Manuel Amunategui,0,19.99,4.1(135 ratings),Development,,Data Science
beginner to advanced - how to become a data scientist,www.udemy.com/course/beginner-to-advanced-how-to-become-a-data-scientist/,Dan We,199.99,11.39,4.1(28 ratings),Development,,Data Science
Real data science problems with Python,www.udemy.com/course/real-data-science-problems-with-python/,Francisco Juretig,19.99,11.39,3.8(53 ratings),Development,,Data Science
Unbalanced Data - Quick Start,www.udemy.com/course/imbalanced-learning-quick-start/,Bassam Almogahed,19.99,11.39,4.7(32 ratings),Development,,Data Science
Complete predictive modeling & app building bootcamp,www.udemy.com/course/complete-predictive-modeling-app-building-bootcamp/,Mammoth Interactive,199.99,11.39,3.9(3 ratings),Development,,Data Science
Data Scientist Interview Questions,www.udemy.com/course/data-scientist-interview-questions/,Gaurav Chauhan,199.99,11.39,3.6(5 ratings),Development,,Data Science
Kaggle Masterclass - build a Data Science Portfolio,www.udemy.com/course/kaggle-masterclass/,Taimur Zahid,199.99,11.39,3.0(4 ratings),Development,,Data Science
Complete Guide to Careers in Data Science - Interview Hacks,www.udemy.com/course/complete-guide-to-crack-a-data-science-interview/,Nizamuddin Siddiqui,149.99,11.39,4.3(82 ratings),Development,,Data Science
Employee Attrition Prediction in Apache Spark (ML),www.udemy.com/course/employee-attrition-prediction-in-apache-spark-ml/,Bigdata Engineer,19.99,11.39,3.7(2 ratings),Development,,Data Science
Hands-On Data Science with Anaconda,www.udemy.com/course/hands-on-data-science-with-anaconda/,Packt Publishing,124.99,11.39,3.2(11 ratings),Development,,Data Science
Data Science: Sparklyr Basics for Beginners,www.udemy.com/course/learning-sparklyr-basics/,"Artech Learning, LLC.",199.99,11.39,4.1(20 ratings),Development,,Data Science
Java Data Science Solutions - Analyzing Data,www.udemy.com/course/java-data-science-solutions-analyzing-data/,Packt Publishing,124.99,11.39,4.0(11 ratings),Development,,Data Science
SQL for Data Analysis: Core Data Scientist’s Skills,www.udemy.com/course/sql-for-data-analysis/,Scandinavian Institute of Business Analytics,99.99,11.39,4.0(131 ratings),Development,,Data Science
Machine Learning Mastery (Integrated Theory+Practical HW),www.udemy.com/course/data-science-machine-learning-mastery/,SaifAli Kheraj,44.99,11.39,4.8(5 ratings),Development,,Data Science
Data Science – The Complete Guide (incl. Python & R),www.udemy.com/course/data-science-complete-guide-course/,"Thinkahead Academy, LLC.",194.99,11.39,3.2(16 ratings),Development,,Data Science
Statistics for Data Science,www.udemy.com/course/statistics-for-data-science/,Packt Publishing,124.99,11.99,2.6(5 ratings),Development,,Data Science
24h Pro data science in R,www.udemy.com/course/24h-pro-data-science-in-r/,Francisco Juretig,49.99,11.99,3.6(22 ratings),Development,,Data Science
Learn Data Analysis with Python Pandas,www.udemy.com/course/python-pandas-data-manipulation-and-analysis/,Tony Staunton,114.99,11.99,4.2(54 ratings),Development,,Data Science
Learning Path: From Python Programming to Data Science,www.udemy.com/course/learning-path-from-python-programming-to-data-science/,Packt Publishing,199.99,11.99,3.7(24 ratings),Development,,Data Science
Basic Statistics and Data Mining for Data Science,www.udemy.com/course/basic-statistics-and-data-mining-for-data-science/,Packt Publishing,124.99,11.99,3.9(16 ratings),Development,,Data Science
Data Science on Python Bootcamp,www.udemy.com/course/data-science-on-python-bootcamp/,OrangeTree Global,199.99,11.99,0.0(0 ratings),Development,,Data Science
Data Science 4 Newbs! Skills + Basic Web Experiment Analysis,www.udemy.com/course/data-science-4-newbs/,Larry Wai,59.99,11.99,4.3(91 ratings),Development,,Data Science
Introduction to Data Science Python,www.udemy.com/course/introduction-to-data-science-python/,Data Scientist Academy,29.99,11.99,3.9(6 ratings),Development,,Data Science
Learning Path: Spark: Data Science with Apache Spark,www.udemy.com/course/learning-path-spark-data-science-with-apache-spark/,Packt Publishing,199.99,11.99,3.5(4 ratings),Development,,Data Science
Python Scientific Visualizations with plotly,www.udemy.com/course/python-scientific-visualizations-with-plotly/,"Ashwin Pajankar • 50,000+ Students Worldwide",19.99,11.99,4.4(17 ratings),Development,,Data Science
"Start Data Science with Numpy, Pandas, Matplotlib & Seaborn",www.udemy.com/course/start-data-science-with-numpy-pandas-matplotlib-seaborn/,Pradeep D,169.99,11.99,4.8(2 ratings),Development,,Data Science
Data Science with Python - A Complete Guide!: 3-in-1,www.udemy.com/course/data-science-with-python-a-complete-guide-3-in-1/,Packt Publishing,199.99,11.99,4.2(9 ratings),Development,,Data Science
Data Visualization with Python: The Complete Guide,www.udemy.com/course/data-visualization-with-python-the-complete-guide/,Eduonix Learning Solutions,49.99,11.99,3.7(6 ratings),Development,,Data Science
Data Science:  Machine Learning algorithms in Matlab,www.udemy.com/course/machine-learning-step-by-step-guide/,Geek Cafe,39.99,11.99,3.7(48 ratings),Development,,Data Science
Advanced Data Science: Master Deep Web Experiment Analysis!,www.udemy.com/course/agile-experiment-analytics/,Larry Wai,199.99,11.99,4.2(36 ratings),Development,,Data Science
Data Science on SAS by OrangeTreeGlobal,www.udemy.com/course/data-science-on-sas-by-orangetreeglobal/,OrangeTree Global,199.99,11.99,0.0(0 ratings),Development,,Data Science
Want to be a Big Data Scientist?,www.udemy.com/course/what-to-be-a-big-data-scientist/,"V2 Maestros, LLC",19.99,11.39,4.1(938 ratings),Development,,Data Science
Data Science with Python - Beginners,www.udemy.com/course/educba-data-science-with-python/,EDU CBA,99.99,11.39,3.5(438 ratings),Development,,Data Science
Hands-On Fundamentals of Data Science with Go,www.udemy.com/course/hands-on-fundamentals-of-data-science-with-go/,Packt Publishing,124.99,11.39,3.5(6 ratings),Development,,Data Science
Learn Data Science Basics,www.udemy.com/course/learn-data-science-basics/,Dr. Dheeraj Mehrotra,19.99,11.39,3.8(67 ratings),Development,,Data Science
Top 60 FAQs in Data Science Interview: Be a Data Scientist!,www.udemy.com/course/top-60-faqs-in-data-science-interview-ace-your-interview/,Bhaumik Shah,199.99,11.39,5.0(2 ratings),Development,,Data Science
Learn By Example: Statistics and Data Science in R,www.udemy.com/course/statistics-and-data-science-in-r/,Loony Corn,99.99,11.39,3.7(364 ratings),Development,,Data Science
LEARNING PATH: Statistics and Data Mining for Data Science,www.udemy.com/course/learning-path-ibm-spss-data-science-with-ibm-spss/,Packt Publishing,199.99,11.39,4.0(3 ratings),Development,,Data Science
Create Arrays in Python NumPy - Learn Scientific Computing!,www.udemy.com/course/pythonnumpymath/,Mammoth Interactive,199.99,11.39,3.8(9 ratings),Development,,Data Science
Core skill for data science: learn dplyr package in R,www.udemy.com/course/data-manipulation-in-r-with-dplyr/,Dunk Chawannut,19.99,11.39,3.4(25 ratings),Development,,Data Science
Learning Path: R: Real-World Data Science Solutions with R,www.udemy.com/course/learning-path-r-real-world-data-science-solutions-with-r/,Packt Publishing,199.99,11.39,3.6(3 ratings),Development,,Data Science
Data Science: From Prediction to Production,www.udemy.com/course/predictive-applications-from-concept-to-production/,Snir Madar,199.99,11.39,3.9(20 ratings),Development,,Data Science
Basics of R for Data Science,www.udemy.com/course/basics-of-r-for-data-science/,"Prof. M. NAGABHUSHANA RAO , Team, K L UNIVERSITY - INDIA",19.99,11.39,0.0(0 ratings),Development,,Data Science
Learn Python For Data Science W/ Search & Recommender Algos!,www.udemy.com/course/learn-python-for-data-science-w-search-recommender-algos/,Larry Wai,179.99,11.39,4.3(35 ratings),Development,,Data Science
Introduction To Data Science,www.udemy.com/course/introduction-to-data-science/,Nina Zumel,0,54.99,4.3(140 ratings),Development,,Data Science
Data Science with Jupyter: 2-in-1,www.udemy.com/course/data-science-with-jupyter-2-in-1/,Packt Publishing,199.99,11.39,3.7(10 ratings),Development,,Data Science
R Programming,www.udemy.com/course/r-programming-learn-from-atoz/,Kalino A to Z,199.99,11.39,0.0(0 ratings),Development,,Data Science
Data Scientist Job Ready Data Science Course:,www.udemy.com/course/data-science-with-excel-and-r-the-silicon-valley-way/,Rupak Roy,164.99,11.39,3.7(7 ratings),Development,,Data Science
E20-007 Data Science Associate Certification Practice Exam,www.udemy.com/course/e20-007-data-science-associate-certification-practice-exam/,INFO IT HUB,144.99,11.39,0.0(0 ratings),Development,,Data Science
Data Science Approach from Scratch: A Shortcut Course,www.udemy.com/course/data-science-approach-from-scratch/,Nizamuddin Siddiqui,99.99,11.39,3.7(34 ratings),Development,,Data Science
Statistics for Data Scientists and Data Analysts,www.udemy.com/course/statistics-for-data-scientists-and-decision-makers-part-1/,Nolita Analytics,199.99,11.39,3.8(8 ratings),Development,,Data Science
Excel in the World of Data Analytics,www.udemy.com/course/excel-in-the-world-of-data-analytics/,Data Civilisation,19.99,11.39,0.0(0 ratings),Development,,Data Science
Data Science Career Guide - Career Development in Analytics,www.udemy.com/course/data-science-career-guide-career-development-in-analytics/,R-Tutorials Training,84.99,11.39,3.4(86 ratings),Development,,Data Science
DataScience & Machine Learning 2020:Basics to Advanced,www.udemy.com/course/data-science-with-python-from-basics-to-advanced/,Sahir M S,154.99,11.39,0.0(0 ratings),Development,,Data Science
Introduction to Spatial Data Analysis with R,www.udemy.com/course/spatial-data-analysis-with-r-boot-camp/,Dr. Alemayehu Midekisa,199.99,11.39,3.9(27 ratings),Development,,Data Science
Beginner's guide to Graph Theory: Discrete Mathematics,www.udemy.com/course/beginners-guide-to-graph-theory-discrete-mathematics/,Suman Mathews,19.99,11.39,0.0(0 ratings),Development,,Data Science
Data Science with Spark,www.udemy.com/course/data-science-with-spark/,Packt Publishing,124.99,11.39,3.0(11 ratings),Development,,Data Science
