Course,URL,instructor,Price (full),Price (discount),Rank,Category 1,Category 2,Category 3
Machine Learning with Python: Data Science for Beginners,www.udemy.com/course/machine-learning-with-python-data-science-for-beginners/,"TELCOMA Global 60,000+ Students!",199.99,11.39,3.1(59 ratings),Development,,Data Science
Data Science Masterclass - hands-on NumPy,www.udemy.com/course/data-science-masterclass/,Taimur Zahid,199.99,11.39,0.0(0 ratings),Development,,Data Science
Sprint the Data Science Interview,www.udemy.com/course/sprint-the-data-science-interview/,Muni Kumar Gopu V R,24.99,11.39,4.1(10 ratings),Development,,Data Science
Data Science and Machine Learning with R and Python,www.udemy.com/course/data-science-analysis/,Ankita khanna,94.99,11.39,3.5(15 ratings),Development,,Data Science
Practical Python Data Science Techniques,www.udemy.com/course/practical-python-data-science-techniques/,Packt Publishing,124.99,11.39,4.1(3 ratings),Development,,Data Science
Introduction To Data Science Using R Programming,www.udemy.com/course/introduction-to-data-science-using-r-programming/,Eduonix Learning Solutions,39.99,11.39,3.6(14 ratings),Development,,Data Science
Practical Data Science,www.udemy.com/course/data-science/,Atul Bhardwaj,19.99,11.39,3.8(33 ratings),Development,,Data Science
Data Science with Python for Students & Beginners,www.udemy.com/course/data-science-with-python-for-students-beginners/,Robolabz STEM School,19.99,11.39,3.8(14 ratings),Development,,Data Science
Data Science - Master Analytics and become Data Scientist,www.udemy.com/course/master-data-science-analytics-and-become-data-scientist/,Kaushik Vadali,199.99,11.39,4.2(22 ratings),Development,,Data Science
Fundamentals of Data Science with Python,www.udemy.com/course/fundamentals-of-data-science-with-python/,Packt Publishing,124.99,11.39,0.0(0 ratings),Development,,Data Science
Business Data Science: Time Series Regression,www.udemy.com/course/applied-data-science-multiple-linear-regression-in-r/,Nolita Analytics,199.99,11.39,3.9(2 ratings),Development,,Data Science
"Read, write, and analyze data with pandas & Python!",www.udemy.com/course/datasciencepython/,Mammoth Interactive,199.99,11.39,3.6(8 ratings),Development,,Data Science
Data Science for Interviews,www.udemy.com/course/data-science-for-interviews/,Rohan Soni,59.99,11.39,3.5(4 ratings),Development,,Data Science
Become a Citizen Data Scientist : Marketing perspective,www.udemy.com/course/become-a-citizen-data-scientist-marketing-perspective/,Mohamed Jendoubi,94.99,11.39,3.9(38 ratings),Development,,Data Science
Data Science for Professionals,www.udemy.com/course/data-science-for-professionals/,Gregory Sward,199.99,11.39,4.0(65 ratings),Development,,Data Science
Getting Started with Data Sciences,www.udemy.com/course/getting-started-with-data-sciences/,Partha Majumdar,19.99,11.39,3.4(8 ratings),Development,,Data Science
Data Science: Beginners Guide to the Command Line,www.udemy.com/course/data-science-beginners-guide-to-the-command-line/,Ben Weinstein,34.99,11.39,4.1(132 ratings),Development,,Data Science
Beginning Data Science with Python and Jupyter,www.udemy.com/course/beginning-data-science-with-python-and-jupyter/,Packt Publishing,199.99,11.39,3.5(1 rating),Development,,Data Science
Jupyter for Data Science,www.udemy.com/course/jupyter-for-data-science/,Packt Publishing,124.99,11.39,2.0(4 ratings),Development,,Data Science
Python Pro - Basics for Data Science,www.udemy.com/course/cognitior-dspy/,Rahul Tiwari,24.99,11.39,4.0(22 ratings),Development,,Data Science
Learn Python: Your First Step Toward Data Science,www.udemy.com/course/python-your-first-step-toward-data-science/,Packt Publishing,124.99,11.39,4.0(1 rating),Development,,Data Science
Data Science Crash Course,www.udemy.com/course/data-science-crash-course/,Przemek Chojecki,19.99,11.39,0.0(0 ratings),Development,,Data Science
Getting Started with TensorFlow for Deep Learning,www.udemy.com/course/getting-started-with-tensorflow-for-deep-learning/,Packt Publishing,124.99,11.39,0.0(0 ratings),Development,,Data Science
Data Scientist Terminology Prep,www.udemy.com/course/data-scientist/,Andrew Magdy Kamal,19.99,11.39,3.1(15 ratings),Development,,Data Science
SGLearn@Python A-Z™: Python For Data Science,www.udemy.com/course/sglearnpython-a-ztm-python-for-data-science/,SuperDataScience Singapore,0,199.99,0.0(0 ratings),Development,,Data Science
Learn Data Science With R Part 3 of 10,www.udemy.com/course/learn-data-science-with-r-part-3-of-10/,Ram Reddy,0,19.99,0.0(0 ratings),Development,,Data Science
Data Science Crash Course,www.udemy.com/course/data-science-crash-course/,Przemek Chojecki,19.99,11.39,0.0(0 ratings),Development,,Data Science
Data Science and Machine Learning with Python and Libraries,www.udemy.com/course/data-science-and-machine-learning-with-python-and-libraries/,The DataScience Stealth,19.99,11.39,0.0(0 ratings),Development,,Data Science
Beautiful Data Visualization Projects! D3.js for Beginners,www.udemy.com/course/d3jsdatavisualization/,Mammoth Interactive,199.99,11.39,3.0(2 ratings),Development,,Data Science
R: Programming and Data Science,www.udemy.com/course/r-programming-and-data-science/,Packt Publishing,199.99,11.39,4.0(1 rating),Development,,Data Science
Learn Data Science With R Part 2 of 10,www.udemy.com/course/learn-data-science-with-r-part-2-of-10/,Ram Reddy,0,19.99,0.0(0 ratings),Development,,Data Science
Getting Started with R for Data Science,www.udemy.com/course/getting-started-with-r-for-data-science/,Packt Publishing,89.99,11.39,3.4(6 ratings),Development,,Data Science
Learning Path: Your Guide to Learn Data Science using Python,www.udemy.com/course/learning-path-your-guide-to-learn-data-science-using-python/,Packt Publishing,199.99,11.39,0.0(0 ratings),Development,,Data Science
Data Science and Machine Learning Mathematics and Statistics,www.udemy.com/course/data-science-and-machine-learning-mathematics-and-statistics/,Plumira DotCom,19.99,11.39,0.0(0 ratings),Development,,Data Science
Machine Learning and Data Science with Python,www.udemy.com/course/machine-learning-and-data-science-with-python/,Plumira DotCom,19.99,11.39,0.0(0 ratings),Development,,Data Science
Coaching Course: Adv Analytics in R for Data Science Part 2,www.udemy.com/course/coaching-course-adv-analytics-in-r-for-data-science-part-2/,DioPACT Learning,0,199.99,0.0(0 ratings),Development,,Data Science
E20-007 Data Science Associate Certification Practice Exam,www.udemy.com/course/e20-007-data-science-associate-certification-practice-exam-u/,Best Online IT,104.99,11.39,0.0(0 ratings),Development,,Data Science
LEARNING PATH: Python: Real-World Data Science with Python,www.udemy.com/course/learning-path-python-real-world-data-science-with-python/,Packt Publishing,199.99,11.39,1.0(1 rating),Development,,Data Science
Programming for Data Science with R,www.udemy.com/course/programming-for-data-science-with-r/,Packt Publishing,124.99,11.39,0.0(0 ratings),Development,,Data Science
Datascience with R Language,www.udemy.com/course/datascience-with-r-language/,Ram Reddy,0,19.99,3.1(5 ratings),Development,,Data Science
SAS for Data Analysis and Visualization,www.udemy.com/course/sas-for-data-handling-and-visualization/,Nishant Pandey,174.99,43.75,4.0(4 ratings),Development,,Data Science
Data Science - Python for Machine Learning,www.udemy.com/course/beginners-hands-on-python-for-data-science/,Vinita Silaparasetty,19.99,11.39,2.2(2 ratings),Development,,Data Science
Coaching Course: Adv Analytics in R for Data Science Part 1,www.udemy.com/course/coaching-course-adv-analytics-in-r-for-data-science-part-1/,DioPACT Learning,0,199.99,0.0(0 ratings),Development,,Data Science
Learn Data Science With R Part 4 of 10,www.udemy.com/course/learn-data-science-with-r-part-4-of-10/,Ram Reddy,0,19.99,0.0(0 ratings),Development,,Data Science
Machine Intelligence Masterclass - an Algorithmic Overview,www.udemy.com/course/machine-intelligence-masterclass/,Taimur Zahid,0,Free,3.7(29 ratings),Development,,Data Science
What is Data Science ?,www.udemy.com/course/what-is-data-science/,Gopinath Ramakrishnan,0,Free,4.2(581 ratings),Development,,Data Science
Data Science 101 Data Analytics Class Python Bootcamp NYC,www.udemy.com/course/data-science-101-class-python-pandas-bootcamp-course-nyc-new-york/,Shivgan Joshi,0,Free,3.9(224 ratings),Development,,Data Science
Introduction to Data Science using Python (Module 1/3),www.udemy.com/course/introduction-to-data-science-using-python/,Rakesh Gopalakrishnan,0,Free,"4.3(2,844 ratings)",Development,,Data Science
Essentials of Data Science,www.udemy.com/course/essentials-of-data-science-in-90-minutes/,Maximilian Schallwig,0,Free,4.2(438 ratings),Development,,Data Science
Learn Data Science With R Part 1 of 10,www.udemy.com/course/datascience_with_r/,Ram Reddy,0,Free,4.3(405 ratings),Development,,Data Science
Bootcamp for KNIME Analytics Platform,www.udemy.com/course/knime-bootcamp/,KNIME Inc,0,Free,4.3(651 ratings),Development,,Data Science
Teaching Data Science: A Short Course for Instructors,www.udemy.com/course/teaching-data-science/,Isaac Faber,0,Free,4.7(49 ratings),Development,,Data Science
Complete Data Science Masterclass: Beginner to Advance,www.udemy.com/course/complete-data-science-masterclass-beginner-to-advance/,ABD Muhammad,0,Free,3.5(26 ratings),Development,,Data Science
Career & Jobs in Big Data Science Zero 2 Hero A-Z New York,www.udemy.com/course/career-jobs-in-big-data-science-zero-2-hero-a-z-new-york/,Shivgan Joshi,0,Free,4.5(81 ratings),Development,,Data Science
Career & Jobs in Big Data Science Zero 2 Hero A-Z New York,www.udemy.com/course/career-jobs-in-big-data-science-zero-2-hero-a-z-new-york/,Shivgan Joshi,0,Free,4.5(81 ratings),Development,,Data Science
"Python Bootcamp: Vom Anfänger zum Profi, inkl. Data Science",www.udemy.com/course/python-bootcamp/,Jannis Seemann,199.99,11.39,"4.6(11,479 ratings)",Development,,Data Science
Formação Cientista de Dados com Python e R,www.udemy.com/course/cientista-de-dados/,Fernando Amaral,19.99,11.99,"4.5(6,463 ratings)",Development,,Data Science
Machine Learning de A a la Z: R y Python para Data Science,www.udemy.com/course/machinelearning-es/,Juan Gabriel Gomila Salas,199.99,11.39,4.5(565 ratings),Development,,Data Science
Python para Data Science e Machine Learning - COMPLETO,www.udemy.com/course/python-para-data-science-e-machine-learning/,Rodrigo Soares Tadewald,199.99,11.39,"4.4(5,242 ratings)",Development,,Data Science
"Python für Data Science, Maschinelles Lernen & Visualization",www.udemy.com/course/python-data-science-machine-learning/,Dr. René Brunner,194.99,11.39,4.4(764 ratings),Development,,Data Science
Machine Learning e Data Science com Python de A a Z,www.udemy.com/course/machine-learning-e-data-science-com-python-y/,Jones Granatyr,19.99,11.39,"4.6(2,071 ratings)",Development,,Data Science
Les Data Sciences de A à Z,www.udemy.com/course/les-data-sciences-de-a-a-z/,Kirill Eremenko,199.99,11.39,"4.6(1,537 ratings)",Development,,Data Science
Data Science de A a Z - Extraçao e Exibição dos Dados,www.udemy.com/course/curso-data-science-completo/,Felipe Mafra,199.99,11.39,"4.5(4,234 ratings)",Development,,Data Science
"R für Data Science, Visualisierung und Machine Learning",www.udemy.com/course/r-data-science-machine-learning/,Dr. René Brunner,194.99,11.39,4.6(429 ratings),Development,,Data Science
Programmer en Python pour la Data Science de A à Z,www.udemy.com/course/data-science-avec-python/,Amandine Velt | Data Science - Python - R,159.99,11.39,4.6(158 ratings),Development,,Data Science
実践データサイエンス&機械学習 with Python -統計学の基礎からビッグデータまで-,www.udemy.com/course/datascience-machinelearning/,我妻 幸長 Yukinaga Azuma,124.99,11.39,4.1(435 ratings),Development,,Data Science
Data Science & Maschinelles Lernen in Python - am Beispiel,www.udemy.com/course/data-science-und-machine-learning/,Jannis Seemann,124.99,11.39,4.4(690 ratings),Development,,Data Science
Programa completo de Data Science: Todo para los datos,www.udemy.com/course/programa-completo-de-data-science-todo-para-los-datos/,365 Careers,199.99,11.39,4.5(62 ratings),Development,,Data Science
Corso completo di Data Science con Python,www.udemy.com/course/data-science-con-python/,Valentina Porcu,184.99,11.39,4.2(806 ratings),Development,,Data Science
Data Science Bootcamp 2019: Von 0 auf 100 zum Data Scientist,www.udemy.com/course/data-science-bootcamp-von-0-auf-100-zum-data-scientist/,365 Careers,199.99,11.39,4.1(20 ratings),Development,,Data Science
Monta un cluster Hadoop Big Data desde cero,www.udemy.com/course/monta-un-cluster-hadoop-big-data-desde-cero/,Apasoft Training,19.99,11.99,4.6(750 ratings),Development,,Data Science
R ile Veri Bilimi ve Machine Learning (36 Saat),www.udemy.com/course/veri-bilimi-ve-makine-ogrenmesi-egitimi/,M.Vahit Keskin,199.99,11.99,4.7(467 ratings),Development,,Data Science
"Data Science, Apache Spark & Python: Analysiere echte Daten!",www.udemy.com/course/apache-spark-mit-python/,Jannis Seemann,119.99,11.99,4.5(289 ratings),Development,,Data Science
Programmer en R pour la Data Science de A à Z,www.udemy.com/course/apprendre-la-data-science-avec-r-de-a-a-z/,Amandine Velt | Data Science - Python - R,159.99,11.99,4.6(186 ratings),Development,,Data Science
Machine Learning y Data Science con Python,www.udemy.com/course/aprende-data-science-y-machine-learning-con-python/,Manuel Garrido,99.99,11.99,4.6(585 ratings),Development,,Data Science
Data Science ve Python: Sıfırdan Uzmanlığa Veri Bilimi (2),www.udemy.com/course/data-science-sfrdan-uzmanlga-veri-bilimi-2/,DATAI TEAM,194.99,11.99,"4.6(1,723 ratings)",Development,,Data Science
Curso de Data Science: Bootcamp completo em Data Science,www.udemy.com/course/curso-de-data-science-bootcamp-completo-em-data-science/,365 Careers,199.99,11.99,4.7(27 ratings),Development,,Data Science
Deep Learning e Inteligencia artificial con Keras/Tensorflow,www.udemy.com/course/curso-de-deep-learning-con-kerastensorflow-en-python/,David Fuentes Jiménez,79.99,11.99,4.5(109 ratings),Development,,Data Science
Inteligência Artificial Para Todos com Excel,www.udemy.com/course/inteligencia-artificial-com-excel/,Fernando Amaral,19.99,11.99,4.6(217 ratings),Development,,Data Science
Machine Learning  e Data Science com Python,www.udemy.com/course/machine-learning-e-data-science-com-python/,Marcos Castro,69.99,11.99,"4.1(3,077 ratings)",Development,,Data Science
Data Science e Machine Learning com Estatística e Python,www.udemy.com/course/data-science-e-machine-learning-com-estatistica-e-python/,Danilo Moreira,199.99,11.99,4.7(21 ratings),Development,,Data Science
Bootcamp Cientista de Dados: 10 aplicações Web Completas,www.udemy.com/course/bootcamp-cientista-de-dados/,Fernando Amaral,19.99,11.99,4.4(164 ratings),Development,,Data Science
Corso completo di Data Science con R,www.udemy.com/course/corso-completo-di-data-science-con-r/,Valentina Porcu,179.99,11.99,4.4(185 ratings),Development,,Data Science
Apprendre la Data Science avec R,www.udemy.com/course/datascience-r/,Charles Bordet,199.99,11.99,4.7(138 ratings),Development,,Data Science
Introdução à Estatística com Casos Reais - Data Science em R,www.udemy.com/course/introducao-a-estatistica-para-data-science/,Isaías Lira,199.99,11.99,4.4(313 ratings),Development,,Data Science
R NA PRÁTICA: Data Wrangling com R para Ciência de Dados,www.udemy.com/course/r-na-pratica-ciencia-de-dados/,JOSÉ LOPES,139.99,11.99,4.7(96 ratings),Development,,Data Science
Data Science: do Dado à Tomada de Decisão,www.udemy.com/course/data-science-para-desenvolvedor-do-dado-a-tomada-de-decisao/,Hekima Big Data Analytics,0,109.99,4.2(393 ratings),Development,,Data Science
Gestão de Projetos de Data Science e Big Data,www.udemy.com/course/gestao-de-projetos-de-data-science-e-big-data/,Fernando Amaral,19.99,11.99,4.4(142 ratings),Development,,Data Science
Corso Python e introduzione a Data Science,www.udemy.com/course/corso-python-e-data-science/,Innova Academy,149.99,11.99,4.4(153 ratings),Development,,Data Science
Lógica de Programação para Data Science e AI com Python,www.udemy.com/course/logica-programacao-data-science-python/,Fernando Amaral,19.99,11.99,4.4(57 ratings),Development,,Data Science
Super Academia Data Science,www.udemy.com/course/super-academia-data-science/,MSc. Grimaldo Lopes Oliveira,159.99,11.99,4.1(26 ratings),Development,,Data Science
A-Z™ | R Programlama ile Veri Bilimi,www.udemy.com/course/r-programlama-egitimi/,Onur Boyar,189.99,11.99,4.5(272 ratings),Development,,Data Science
Data science - Découverte de la librairie Pandas pour python,www.udemy.com/course/formation-machine-learning-pandas-pour-python/,Arnaud LAMANDÉ,159.99,11.99,4.0(22 ratings),Development,,Data Science
Data Science em R: ETL parte 2 - Relacionamento entre Dados,www.udemy.com/course/etlpart2/,Isaías Lira,194.99,11.99,4.7(49 ratings),Development,,Data Science
Dashboards Matadores: Domine a Arte de Apresentação de Dados,www.udemy.com/course/dashboards-matadores/,Fernando Amaral,19.99,11.99,4.6(91 ratings),Development,,Data Science
O Guia Completo de Carreira em Data Science e AI,www.udemy.com/course/guia-de-carreira-em-data-science/,Fernando Amaral,19.99,11.99,4.6(123 ratings),Development,,Data Science
Wystartuj z Data Science w Pythonie!,www.udemy.com/course/wystartuj-z-data-science-w-pythonie/,Damian Melniczuk,199.99,11.99,3.6(57 ratings),Development,,Data Science
Matemática para Data Science - Pré-Cálculo,www.udemy.com/course/matematica-para-data-science-pre-calculo/,"Rafael F. V. C. Santos, Ph.D.",19.99,11.99,4.9(11 ratings),Development,,Data Science
"Data Science: Correlação no R, do zero ao avançado em 5h",www.udemy.com/course/correlacaoemr/,Isaías Lira,169.99,11.99,4.7(100 ratings),Development,,Data Science
Fundamentos de Ciência de Dados em Python,www.udemy.com/course/fundamentos-de-ciencia-de-dados-em-python/,Igor Alcantara,49.99,11.99,4.3(33 ratings),Development,,Data Science
Visualização de dados para Data Science com R: Criando Mapas,www.udemy.com/course/mapasnor/,Isaías Lira,199.99,11.99,4.5(99 ratings),Development,,Data Science
"Импорт, парсинг и скрепинг данных на Python",www.udemy.com/course/ittensive-python-api/,Центр digital-профессий ITtensive,24.99,11.99,4.3(2 ratings),Development,,Data Science
Data Science em R: ETL parte 3 - Manipulando Strings no R,www.udemy.com/course/manipulacao-de-strings-no-r-para-data-science/,Isaías Lira,189.99,11.39,4.6(27 ratings),Development,,Data Science
Visualização de Dados- R Data Science: Relatório e Dashboard,www.udemy.com/course/markdown-e-dashboard/,Isaías Lira,199.99,11.39,4.5(19 ratings),Development,,Data Science
Python para Data Science do Zero Absoluto ao Domínio em 5h,www.udemy.com/course/linguagempython/,Isaías Lira,199.99,11.39,4.4(14 ratings),Development,,Data Science
Power BIで学ぶ、データサイエンティストの分析プロセス入門,www.udemy.com/course/power-bi/,株式会社ブレインパッド BrainPad Inc.,49.99,11.39,3.6(65 ratings),Development,,Data Science
Dashboards avançados com CTools: Do zero à entrega,www.udemy.com/course/dashboards-ctools/,Oncase Tecnologia da Informação,49.99,11.39,4.1(31 ratings),Development,,Data Science
Introducción a Data Scientist programando en R,www.udemy.com/course/introduccion-a-data-scientist-programando-en-r/,David Manero,99.99,11.39,4.3(264 ratings),Development,,Data Science
"SQL e Banco de Dados para DataScience, sem mistérios!",www.udemy.com/course/sql-banco-de-dados-datascience/,Felipe Mafra,199.99,11.39,4.5(45 ratings),Development,,Data Science
Machine learning y data science con scikit-learn y pyspark,www.udemy.com/course/machine-learning-y-data-science-con-scikit-learn-y-pyspark/,José Manuel Ortega,94.99,11.39,3.0(159 ratings),Development,,Data Science
Data Science e AI: 300 Testes de Conhecimento em 3 Níveis,www.udemy.com/course/data-science-testes/,Fernando Amaral,19.99,11.39,4.5(12 ratings),Development,,Data Science
Machine Learning no Power BI,www.udemy.com/course/machinelearningnopowerbi/,Vitor Schuwartz Rocha,0,19.99,3.2(33 ratings),Development,,Data Science
Data Science - علوم البيانات,www.udemy.com/course/data-science-ar/,OUMOUSS EL MEHDI,34.99,11.39,2.1(3 ratings),Development,,Data Science
"Data Science R: Manipule, visualize dados com R",www.udemy.com/course/data-science-r-manipule-visualize-dados-com-r/,Leonardo Henrique Oliveira Pena,59.99,11.39,4.3(10 ratings),Development,,Data Science
Veri Bilimi için Python ( Python for Data Science ),www.udemy.com/course/veri-bilimi-icin-python/,Engin Bozaba,199.99,11.39,4.0(163 ratings),Development,,Data Science
Data Science - Les Applications Dans le Domaine des Affaires,www.udemy.com/course/data-science-applications/,Claudia Istrati - Data Science Analyst,199.99,11.39,3.1(54 ratings),Development,,Data Science
Data Science - Les Applications Dans le Domaine Financier,www.udemy.com/course/data-science-les-applications-dans-le-domaines-financiers/,Claudia Istrati - Data Science Analyst,199.99,11.39,3.4(18 ratings),Development,,Data Science
Curso de Ciência de Dados,www.udemy.com/course/ciencia-de-dados/,Alpha Channel,74.99,11.39,3.0(1 rating),Development,,Data Science
Visualização da Dados Python e R: Data Science na Prática,www.udemy.com/course/visualizacao-da-dados-python-e-r-data-science-na-pratica/,MSc. Grimaldo Lopes Oliveira,64.99,11.99,3.8(8 ratings),Development,,Data Science
Orange Data Science e Visualização de Dados com Python,www.udemy.com/course/orange-data-science-e-python/,MSc. Grimaldo Lopes Oliveira,84.99,11.99,4.5(5 ratings),Development,,Data Science
Introdução a Data Science no R com exemplos,www.udemy.com/course/introducao-a-data-science-no-r-com-exemplos-gratuito/,Leonardo Henrique Oliveira Pena,44.99,11.99,4.1(32 ratings),Development,,Data Science
Data Science e Machine Learning com Qlik Sense,www.udemy.com/course/data-science-qlik-sense/,BIX Tecnologia Business Intelligence,199.99,11.99,4.0(1 rating),Development,,Data Science
Introduction à la science des données,www.udemy.com/course/introduction-a-la-science-des-donnees/,Mohamed Jendoubi,99.99,11.99,3.0(1 rating),Development,,Data Science
Python - Introduction à la Data Science,www.udemy.com/course/python-la-data-science-en-20-jours-de-a-a-z/,Formateur Data Science,24.99,11.99,3.1(5 ratings),Development,,Data Science
Science Class X (Simplest way to learn),www.udemy.com/course/sciencecbsex/,Nitin Arya,24.99,11.99,0.0(0 ratings),Development,,Data Science
Gaio Official: Introdução a Ciência de Dados usando Gaio,www.udemy.com/course/gaio-introducao/,EDER BALBINO,0,174.99,4.7(9 ratings),Development,,Data Science
"Data Science Grundlagen: Python, NumPy, Matplotlib & SciPy",www.udemy.com/course/data-science-grundlagen-python-numpy-matplotlib-scipy/,Saif Al-Dilaimi,0,Free,4.1(33 ratings),Development,,Data Science
Veri Bilimi ve Veri Bilimcilik için Giriş Eğitimi,www.udemy.com/course/veri-bilimine-giris/,M.Vahit Keskin,0,Free,"4.6(2,113 ratings)",Development,,Data Science
