Course,URL,instructor,Price (full),Price (discount),Rank,Category 1,Category 2,Category 3
The Complete Financial Analyst Training & Investing Course,www.udemy.com/course/the-complete-financial-analyst-training-and-investing-course/,Chris Haroun,199.99,11.99,"4.5(10,983 ratings)",Finance & Accounting,,Investing
Python for Finance: Investment Fundamentals & Data Analytics,www.udemy.com/course/python-for-finance-investment-fundamentals-data-analytics/,365 Careers,194.99,11.99,"4.5(9,486 ratings)",Finance & Accounting,,Investing
Investment Analysis & Portfolio Management - Core Finance,www.udemy.com/course/investment-analysis-portfolio-management/,Fervent #LearnWithDistinction,179.99,11.99,4.5(402 ratings),Finance & Accounting,,Investing
Investing Success: Learn Keys From A Millionaire Investor!,www.udemy.com/course/investing-success/,"Steve Ballinger, MBA",199.99,11.99,4.3(802 ratings),Finance & Accounting,,Investing
Investing 101: The Complete Online Investing Course 2019,www.udemy.com/course/online-investing-guide/,Wealthy Education,199.99,11.99,"4.3(1,399 ratings)",Finance & Accounting,,Investing
Value Investing Strategies for Stock Market Investing,www.udemy.com/course/value-investing-strategies-for-the-stock-market/,Indian Insight,199.99,11.99,4.7(379 ratings),Finance & Accounting,,Investing
"Comprehensive Guide to Financial Markets, Investing &Trading",www.udemy.com/course/financial-markets-a-to-z-for-beginners/,Hari Swaminathan,0,29.99,"4.5(1,577 ratings)",Finance & Accounting,,Investing
Bond Valuation Mastery - Learn To Value Bonds From Scratch.,www.udemy.com/course/bond-valuation-mastery/,Fervent #LearnWithDistinction,119.99,11.99,4.5(106 ratings),Finance & Accounting,,Investing
Investing Masterclass: Become Your Own CFO In 2019,www.udemy.com/course/investing-masterclass-become-your-own-cfo/,Roshani Pandey,199.99,11.99,4.6(39 ratings),Finance & Accounting,,Investing
Investing The Lazy Investor Way,www.udemy.com/course/investing-lazy-investor-course/,"Steve Ballinger, MBA",199.99,11.99,4.4(232 ratings),Finance & Accounting,,Investing
Get Rich Stock Trading : My Killer Stock Trading Strategy,www.udemy.com/course/get-rich-stock-trading-my-killer-stock-trading-strategy/,Yossof Sharifi,34.99,11.99,4.1(66 ratings),Finance & Accounting,,Investing
"Investment Appraisal Mastery - NPV, IRR, Payback, PI, ARR",www.udemy.com/course/investment-appraisal-mastery/,Fervent #LearnWithDistinction,99.99,11.99,4.7(64 ratings),Finance & Accounting,,Investing
Options Trading: How I trade using Greeks (live trading),www.udemy.com/course/advanced-volatility-trading-vxx-ultimate-trading-experience/,"Pedro Branco (Book Author, Options Trader, Instructor)",19.99,11.99,4.9(63 ratings),Finance & Accounting,,Investing
Financial Modeling: Build Your Own Stock Valuation System,www.udemy.com/course/stock-valuation-using-multiples/,Fervent #LearnWithDistinction,149.99,11.99,4.4(22 ratings),Finance & Accounting,,Investing
"Tesla Company Analysis: Strategy, Marketing, Financials",www.udemy.com/course/tesla-company-analysis-strategy-marketing-financials/,365 Careers,199.99,11.99,4.4(149 ratings),Finance & Accounting,,Investing
The Intelligent Investor,www.udemy.com/course/the-intelligent-investor/,Alex Ramos,29.99,11.99,4.3(122 ratings),Finance & Accounting,,Investing
The Motley Fool's Guide to Investing,www.udemy.com/course/the-motley-fool-guide-to-investing/,The Motley Fool,199.99,11.39,4.3(92 ratings),Finance & Accounting,,Investing
Investment Portfolio Analysis with R,www.udemy.com/course/investment-portfolio-analysis-with-r/,Diego Fernandez,49.99,11.39,4.4(98 ratings),Finance & Accounting,,Investing
Investment Portfolio Analysis with Excel,www.udemy.com/course/investment-portfolio-analysis-with-excel/,Diego Fernandez,49.99,11.39,4.2(53 ratings),Finance & Accounting,,Investing
Index Mutual Funds: Lower Cost-Risk & High Return Investing!,www.udemy.com/course/index-mutual-fund-investing/,"Steve Ballinger, MBA",199.99,11.39,4.3(80 ratings),Finance & Accounting,,Investing
Mastering Mutual Fund Investment - Part 1 of 3,www.udemy.com/course/mastering-mutual-fund-investment-part-1-of-3/,Partha Majumdar,24.99,11.39,4.2(22 ratings),Finance & Accounting,,Investing
Global Macro Investing - Take Control Of The World's Markets,www.udemy.com/course/global-macro-trading-take-control-of-the-worlds-markets/,Tyler Kling,29.99,11.39,4.3(109 ratings),Finance & Accounting,,Investing
The Investing For COMPLETE Beginners Animated Course,www.udemy.com/course/the-investing-for-beginners-animated-course/,Muhammad Abdul Rahim,99.99,11.39,4.3(10 ratings),Finance & Accounting,,Investing
Advanced Portfolio Analysis with Python,www.udemy.com/course/advanced-portfolio-analysis-with-python/,Diego Fernandez,49.99,11.39,4.5(1 rating),Finance & Accounting,,Investing
IncomeMAX - Spreads and Straddles using Options,www.udemy.com/course/incomemax-spreads-and-straddles-using-options/,Hari Swaminathan,0,199.99,4.6(17 ratings),Finance & Accounting,,Investing
Mobile Home Park Investing Experts,www.udemy.com/course/mobile-home-park-investing-experts/,Michael Kane,24.99,11.39,4.6(3 ratings),Finance & Accounting,,Investing
Become a Professional Trader - Beginner Education series,www.udemy.com/course/become-a-professional-trader-beginner-series/,Hitesh Chotalia,19.99,11.39,4.8(5 ratings),Finance & Accounting,,Investing
Investing for Beginners: Learn Investing Strategies & Tools,www.udemy.com/course/investing-strategies/,Upclass - Investing & Finance Coaching,104.99,11.39,4.2(61 ratings),Finance & Accounting,,Investing
Financial Modeling & DCF Valuation Model: Investment Banking,www.udemy.com/course/financial-modeling-dcf-valuation-model-investment-banking/,Jean-Gabriel Paquette,184.99,11.39,3.1(126 ratings),Finance & Accounting,,Investing
Stock Trading: Invest and Trade Safely with Stock Sector ETF,www.udemy.com/course/etf-trading-how-to-invest-safely-profitably-using-efts-stock-trading/,Luca Moschini,199.99,11.99,4.0(35 ratings),Finance & Accounting,,Investing
Investing 101: How to Start Investing in 4 Simple Steps,www.udemy.com/course/investing/,Nathan Winklepleck,24.99,11.39,4.4(82 ratings),Finance & Accounting,,Investing
How to invest in Gold,www.udemy.com/course/howtoinvestingold/,Jalpan Dave,0,19.99,4.5(29 ratings),Finance & Accounting,,Investing
Mastering Mutual Fund Investment - Part 2 of 3,www.udemy.com/course/mastering-mutual-fund-investment-part-2-of-3/,Partha Majumdar,29.99,11.99,4.4(7 ratings),Finance & Accounting,,Investing
Investing in eToro: finding and copying the top traders,www.udemy.com/course/best-etoro-traders-who-are-they-and-how-to-find-them/,Javier Lago,0,24.99,4.1(10 ratings),Finance & Accounting,,Investing
Investing 101: Beginner's Stock Market Investing Masterclass,www.udemy.com/course/how-to-start-investing-in-the-stock-market-for-beginners/,Travis Rose,19.99,11.99,4.2(3 ratings),Finance & Accounting,,Investing
How to Start Building Wealth Investing in the Stock Market,www.udemy.com/course/astotz-ywgr/,"Dr. Andrew Stotz, CFA",199.99,11.99,4.0(113 ratings),Finance & Accounting,,Investing
Fundamentals of Investing!,www.udemy.com/course/investment-basics-lets-invest-series/,Tanuja Yadav,19.99,11.99,3.9(90 ratings),Finance & Accounting,,Investing
Long Term Share Investing Technique (International Edition),www.udemy.com/course/long-term-share-investing/,I-Min Chua,0,84.99,4.6(65 ratings),Finance & Accounting,,Investing
"How to Choose and Use a College Savings Plan (529 Plan, USA)",www.udemy.com/course/how-to-choose-and-use-a-529-college-savings-plan/,Charlie Cameron,49.99,11.99,4.8(16 ratings),Finance & Accounting,,Investing
Learn Global Macro Trading & Investing for Retail Investor,www.udemy.com/course/gms-soros/,Ching Foo Lieu,74.99,11.99,3.7(32 ratings),Finance & Accounting,,Investing
Complete Beginner's Domain Investing,www.udemy.com/course/complete-beginners-domain-investing/,Bryan Truong,199.99,11.99,4.1(49 ratings),Finance & Accounting,,Investing
Real Estate Note Investing - BE THE BANK!,www.udemy.com/course/note-investing-made-easier-introduction/,Martin Saenz,0,19.99,4.0(10 ratings),Finance & Accounting,,Investing
Easy Passive Investing: Make Your Portfolio in 2 Hours (USA),www.udemy.com/course/easy-passive-investing-make-your-portfolio-in-2-hours/,Jane Cui,29.99,11.99,4.1(34 ratings),Finance & Accounting,,Investing
Start Inventing: First 4 Steps for Inventors & Entrepreneurs,www.udemy.com/course/inventing-101-first-4-steps-for-the-inventor-entrepreneur/,Kevin Prince,19.99,11.99,4.5(19 ratings),Finance & Accounting,,Investing
Understanding and Investing in Bonds,www.udemy.com/course/understanding-and-investing-in-bonds/,"Roger Pine CFA, CFP®",24.99,11.99,3.6(16 ratings),Finance & Accounting,,Investing
Investing in Stocks? Master The Art of Covered Calls Selling,www.udemy.com/course/dont-leave-money-on-the-table-sell-covered-calls/,Menachem Reinshmidt,79.99,11.99,3.8(34 ratings),Finance & Accounting,,Investing
How to Eliminate Loss & Profit Consistently in Stock Market,www.udemy.com/course/how-to-eliminate-loss-profit-consistently-in-stock-market/,Kumar Gaurav Khullar,49.99,11.99,4.4(11 ratings),Finance & Accounting,,Investing
Advanced Portfolio Analysis with R,www.udemy.com/course/advanced-portfolio-analysis-with-r/,Diego Fernandez,49.99,11.99,3.3(3 ratings),Finance & Accounting,,Investing
How To Buy Shares for Profit-Step By Step Mastery,www.udemy.com/course/how-to-buy-shares-for-profit-step-by-step-mastery/,Jafar Iqbal,19.99,11.39,5.0(4 ratings),Finance & Accounting,,Investing
A Beginners Guide to Investing in the Stock Market,www.udemy.com/course/wallstreetvalue/,Tom Vilord,24.99,11.39,4.5(68 ratings),Finance & Accounting,,Investing
Handling Investor Objections: Investor Objection Boomerang,www.udemy.com/course/handling-investor-objections-investor-objection-boomerang/,Andrew D. Ive,19.99,11.39,3.9(3 ratings),Finance & Accounting,,Investing
Investment Planning - CFP Certification,www.udemy.com/course/investment-planning-cfp-certification/,International College of Financial Planning,0,54.99,0.0(0 ratings),Finance & Accounting,,Investing
Python for Trading & Investing,www.udemy.com/course/python-for-trading-investing/,Ricardo Naya,94.99,11.39,3.3(42 ratings),Finance & Accounting,,Investing
8 Steps to Wealth through Real Estate,www.udemy.com/course/8-steps-to-wealth-through-real-estate/,Scott Picken,99.99,11.39,4.4(27 ratings),Finance & Accounting,,Investing
Learning the Hard Way Vol 1: Skill Investing,www.udemy.com/course/skill-investing/,Timothy Kenny,199.99,11.39,4.4(41 ratings),Finance & Accounting,,Investing
"Get Out of Debt, SAVE, Increase Wealth, Invest In The Future",www.udemy.com/course/managing-your-finances-become-debt-free-investing-basics/,Drew Case,49.99,11.39,4.9(7 ratings),Finance & Accounting,,Investing
Get Rich By Investing - Alternative Investment Ideas,www.udemy.com/course/alternative-investing/,Dekker Fraser & Associates,79.99,11.39,4.0(17 ratings),Finance & Accounting,,Investing
The Only Investment Strategy You Need For Your Retirement,www.udemy.com/course/the-only-investment-strategy-you-need-for-your-retirement/,Winston Wee,199.99,11.39,4.2(37 ratings),Finance & Accounting,,Investing
Game of Homes: Beginners' Guide to Investing in Real Estate,www.udemy.com/course/everything-you-need-to-know-making-money-with-real-estate/,AROV Education,39.99,11.39,5.0(2 ratings),Finance & Accounting,,Investing
"Investing In Stocks For Big Gains, Growth Investing Method",www.udemy.com/course/fundamental-analysis-of-stocks/,Nrupen Masram,199.99,11.39,4.0(45 ratings),Finance & Accounting,,Investing
Build Your Future: Smart Tips for Investors of All Levels,www.udemy.com/course/build-your-future-smart-tips-for-investors/,Mladjenovic CFP,59.99,11.39,4.4(26 ratings),Finance & Accounting,,Investing
GET RICH SLOW - Step by step value investing with Python,www.udemy.com/course/getrichslow-valueinvesting/,Russell Birkholtz,19.99,11.39,3.2(60 ratings),Finance & Accounting,,Investing
Investing In Stocks For Complete Beginners,www.udemy.com/course/investing-in-stocks-for-complete-beginners/,Neilson M.A Secondary Education,199.99,11.39,3.3(29 ratings),Finance & Accounting,,Investing
Bitcoin Investing: The Complete Buy & Hold Strategy,www.udemy.com/course/bitcoin-investing/,Ravinder Deol,99.99,11.39,3.8(188 ratings),Finance & Accounting,,Investing
The Personal Finance Toolkit for Beginners,www.udemy.com/course/the-personal-finance-toolkit-for-beginners/,Julien Sirard,29.99,11.39,4.3(8 ratings),Finance & Accounting,,Investing
How to invest in Value stocks with Expectations Investing,www.udemy.com/course/oninvesting/,Stefan Larsen,149.99,37.50,4.9(2 ratings),Finance & Accounting,,Investing
Opportunity Zones Explained,www.udemy.com/course/opportunityzones/,William Michael Cunningham,24.99,11.39,4.3(13 ratings),Finance & Accounting,,Investing
Investing and Business Ideas,www.udemy.com/course/investments/,"Stefan Ignatovski, Ph.D.",199.99,11.39,4.4(90 ratings),Finance & Accounting,,Investing
Learn International Real Estate Investing In The U.S,www.udemy.com/course/learn-international-real-estate-investing-in-the-us/,Ebonie Caldwell,119.99,11.39,5.0(3 ratings),Finance & Accounting,,Investing
Hot Trading Investing Strategy: ETF and Futures,www.udemy.com/course/learn-to-trade-stocks-and-futures-with-profitable-strategy/,QSB Funds,29.99,11.39,4.0(22 ratings),Finance & Accounting,,Investing
The 12 Pillars of Trading & Investing,www.udemy.com/course/trading-investing/,Jose Paul Martin,199.99,50.00,4.2(9 ratings),Finance & Accounting,,Investing
How To Make Extra Money Through Lawn Care,www.udemy.com/course/lawncarecourse/,Dante Kohrs,24.99,11.39,3.6(2 ratings),Finance & Accounting,,Investing
Investing 101 Training Course,www.udemy.com/course/investing-101-training-course/,Sheldon Martin,24.99,11.39,4.1(5 ratings),Finance & Accounting,,Investing
Invest in a Heartbeat: Simple Steps to a Stocks Portfolio,www.udemy.com/course/invest-in-a-heartbeat-simple-steps-to-a-stocks-portfolio/,Vinita Ramtri,29.99,11.39,4.6(5 ratings),Finance & Accounting,,Investing
#1 Ultimate Crypto Currency Investing Program + Extras,www.udemy.com/course/1-ultimate-crypto-currency-investing-program-extras/,James Part Time Entrepreneur,194.99,11.39,3.5(237 ratings),Finance & Accounting,,Investing
How To Invest According To Science,www.udemy.com/course/how-to-invest-f/,James Stainbrook,19.99,11.39,5.0(2 ratings),Finance & Accounting,,Investing
Equity Products,www.udemy.com/course/equity-products/,Starweaver Group,24.99,11.39,3.8(59 ratings),Finance & Accounting,,Investing
Stock Market: The Zero Risk Way of Investing,www.udemy.com/course/stock-market-zero-risk-investing/,Eric Blair,99.99,11.39,4.1(25 ratings),Finance & Accounting,,Investing
Beginner's Guide to Shares Investing,www.udemy.com/course/beginners-guide-to-investing/,I-Min Chua,0,39.99,4.4(87 ratings),Finance & Accounting,,Investing
"Stock, Bond and Mutual Fund Investing",www.udemy.com/course/stock-bond-mutualfund-investing/,William Michael Cunningham,29.99,11.39,4.1(24 ratings),Finance & Accounting,,Investing
No Bull Investing: Investing 101 For Financial Freedom,www.udemy.com/course/no-bull-investing-investing-101-for-financial-freedom/,"Terrance Wyatt, MBA",99.99,11.39,4.5(28 ratings),Finance & Accounting,,Investing
Investing in stocks: Avoid stock market loss,www.udemy.com/course/avoid-investment-lossesforecast-the-next-recession/,Knowledge Pursue,199.99,11.39,4.3(19 ratings),Finance & Accounting,,Investing
Cryptocurrency Investing: How To Find Undervalued Altcoins,www.udemy.com/course/cryptocurrency-investing-find-undervalued-altcoins/,Life Progression Project,109.99,11.39,3.7(132 ratings),Finance & Accounting,,Investing
Stock market Investing Encyclopedia: How to invest in stocks,www.udemy.com/course/stockmarket/,Sergey Kasimov,199.99,11.39,3.9(18 ratings),Finance & Accounting,,Investing
✔ Invest in FOREX & USA stocks (0 to Expert) LIVE Examples,www.udemy.com/course/invest_forex_usa-stocks/,Cristian Guereñu ⭐⭐⭐⭐⭐,39.99,11.39,5.0(4 ratings),Finance & Accounting,,Investing
Stock Market Investment : Analysing Software Companies,www.udemy.com/course/stock-market-investment-analysing-software-companies/,Knowledge Pursue,199.99,11.39,4.5(1 rating),Finance & Accounting,,Investing
Intelligent Investing with Financial Ratios,www.udemy.com/course/intelligent-investing-with-financial-ratios/,Greg Vanderford,199.99,11.39,4.3(3 ratings),Finance & Accounting,,Investing
Proven Investment Strategy - Accurate & Beginner Friendly,www.udemy.com/course/proven-investment-strategy-accurate-beginner-friendly/,STOCKbible Trading Academy,99.99,11.39,4.4(17 ratings),Finance & Accounting,,Investing
"Value and dividend investing, Competitive forces analysis",www.udemy.com/course/value-and-dividend-investing-competitive-forces-analysis/,Knowledge Pursue,199.99,11.39,4.2(9 ratings),Finance & Accounting,,Investing
The Seven Best Ways to Get Rich,www.udemy.com/course/the-seven-best-ways-to-get-rich/,Paul Sloane,49.99,11.39,4.0(5 ratings),Finance & Accounting,,Investing
Investing Basics 101: The Important 50% People Ignore,www.udemy.com/course/investing-basics-101-the-50-people-ignore/,Terence (The Tireless Worker),169.99,11.39,4.5(4 ratings),Finance & Accounting,,Investing
Investing like a Margin-Investor + LIVE INVESTMENT,www.udemy.com/course/investing-money/,Marco Dimmelmeier,199.99,11.39,4.1(13 ratings),Finance & Accounting,,Investing
Valuable Stock Market Investing Strategies for Beginners,www.udemy.com/course/investing-fundamentals-how-to-develop-an-investors-mindset/,Matt Bernstein,99.99,11.39,3.0(125 ratings),Finance & Accounting,,Investing
Impact Investing: Making Use of Finance to Change The World,www.udemy.com/course/impact-investing-making-use-of-finance-to-change-the-world/,Svetlana Baurens,0,19.99,3.5(7 ratings),Finance & Accounting,,Investing
Vanguard Investing Using The Ray Dalio All Weather Portfolio,www.udemy.com/course/vanguard/,Hayley Harman,19.99,11.39,2.6(18 ratings),Finance & Accounting,,Investing
Investing: How to Build an All Season Portfolio,www.udemy.com/course/investing-creating-an-all-season-portfolio/,Greg Vanderford,199.99,11.39,0.0(0 ratings),Finance & Accounting,,Investing
A complete walk through stock market investing for beginners,www.udemy.com/course/investing-in-stock-market-for-beginners/,Neilko Ventures Private Limited,19.99,11.39,3.8(5 ratings),Finance & Accounting,,Investing
Investing in Stocks & Shares,www.udemy.com/course/making-money-from-stocks-shares/,Jamie Smith,19.99,11.39,4.0(7 ratings),Finance & Accounting,,Investing
Stock Market investment: Practical Accounting,www.udemy.com/course/stock-market-investment-practical-accounting/,Knowledge Pursue,199.99,11.39,4.1(26 ratings),Finance & Accounting,,Investing
Learn How to invest in Numismatic,www.udemy.com/course/learn-how-to-invest-in-numismatic/,Giorgio Ferrari,19.99,11.39,3.6(10 ratings),Finance & Accounting,,Investing
CFA Level 1 - Quantitative Methods Introduction,www.udemy.com/course/investing-101-guide/,Soleadea Co.,19.99,11.39,0.0(0 ratings),Finance & Accounting,,Investing
Wealth Creation Bootcamp,www.udemy.com/course/wealth-creation-bootcamp/,VMV Academy,154.99,11.39,0.0(0 ratings),Finance & Accounting,,Investing
Getting Investors for Your Business Startup,www.udemy.com/course/how-to-raise-money-for-your-business/,Bplans School of Business,19.99,11.39,4.3(3 ratings),Finance & Accounting,,Investing
How to Find Your Startup Investors,www.udemy.com/course/how-to-find-your-startup-investors/,Andrew D. Ive,19.99,11.39,3.8(5 ratings),Finance & Accounting,,Investing
Calculate Intrinsic Value Of Stocks Like Warren Buffett,www.udemy.com/course/calculate-intrinsic-value-of-stocks-like-warren-buffett/,John Maynard,19.99,11.39,3.4(4 ratings),Finance & Accounting,,Investing
Investing Strategies of the Wealthy,www.udemy.com/course/investing-strategies-of-the-wealthy/,Greg Vanderford,194.99,11.39,4.4(11 ratings),Finance & Accounting,,Investing
Essentials of Finance and Investment in 2 hours,www.udemy.com/course/finance-hien-minh-luu/,Hien Minh Luu,19.99,11.39,3.8(17 ratings),Finance & Accounting,,Investing
Make It Count! -Show a Return on Investment with Training,www.udemy.com/course/make-it-count-show-a-return-on-investment-with-training/,Katy Caselli,24.99,11.39,3.9(38 ratings),Finance & Accounting,,Investing
How To Become A Great Stock Investor Like Warren Buffett,www.udemy.com/course/howtobecomeagreatstockinvestorlikewarrenbuffett/,John Maynard,19.99,11.39,4.1(15 ratings),Finance & Accounting,,Investing
Investment 4 Everyone - Let's Get 2 Business,www.udemy.com/course/investment-4-everyone-lets-get-2-business/,Ahmed Farouk Khalil,24.99,11.39,5.0(1 rating),Finance & Accounting,,Investing
Investment Hacking 101,www.udemy.com/course/investment-hacking-101/,Dylin Redling,49.99,11.39,4.1(2 ratings),Finance & Accounting,,Investing
VestU 101 - Investment Principles,www.udemy.com/course/vestu-101-investment-principles/,Michael & Ted Patrick,19.99,11.39,4.5(12 ratings),Finance & Accounting,,Investing
Buy Hard Too: Beginners' Guide- Investing in Stocks & Bonds,www.udemy.com/course/everything-you-need-to-know-investing-in-stocks-and-bonds/,AROV Education,19.99,11.39,3.8(5 ratings),Finance & Accounting,,Investing
The Complete Cryptocurrency Investment Course 2018/2019,www.udemy.com/course/the-complete-cryptocurrency-investment-course-2017/,Sam Lilli,19.99,11.39,4.2(63 ratings),Finance & Accounting,,Investing
Moat Investing,www.udemy.com/course/moat-investing/,Shi Ern Lau,19.99,11.39,0.0(0 ratings),Finance & Accounting,,Investing
Woman-Smart Investing: Learn Stock Investing Quick & Easy,www.udemy.com/course/woman-smart-investing-learn-stock-investing-quick-and-easy/,"Tracy Watson, CPA",179.99,11.39,4.2(4 ratings),Finance & Accounting,,Investing
Value Investing Turbocharged: Stock Trading with Leverage,www.udemy.com/course/investing-fundamental-to-stock-picks-price-forecasting/,KamMeng Mok,199.99,11.39,3.9(20 ratings),Finance & Accounting,,Investing
Warren Buffett His Exact Strategy and how YOU can apply it,www.udemy.com/course/warrenbuffett/,Hayley Harman,19.99,11.39,3.8(17 ratings),Finance & Accounting,,Investing
Stocks: Quick Method to get started Investing,www.udemy.com/course/quick-method-investing/,Eric Blair,74.99,11.39,3.3(116 ratings),Finance & Accounting,,Investing
"Business Lifecycle, Dividend Policy and Investment Strategy",www.udemy.com/course/business-lifecycle-dividend-policy-and-investment-strategy/,Knowledge Pursue,199.99,11.39,4.3(8 ratings),Finance & Accounting,,Investing
Succeed in Bonds Even if You Don't Know Where to Start,www.udemy.com/course/succeed-in-bonds-even-if-you-dont-know-where-to-start/,Scott Brown,199.99,11.39,3.2(7 ratings),Finance & Accounting,,Investing
Investment Management Course,www.udemy.com/course/investment-management-course/,Bilal Semih Bozdemir,64.99,11.39,0.0(0 ratings),Finance & Accounting,,Investing
The Complete Financial Analytics and Investing Course,www.udemy.com/course/financial-analytics-and-investing-course/,Johan Oakesson,34.99,11.39,0.0(0 ratings),Finance & Accounting,,Investing
Growing Your Future: Financial Investment Tips for Women,www.udemy.com/course/growing-your-future-financial-investment-tips-for-women/,C L Edmonds,44.99,11.39,4.2(14 ratings),Finance & Accounting,,Investing
The Trading Academy Trading Course,www.udemy.com/course/the-trading-academy-trading-course/,Jahdee dowdie,124.99,11.39,0.0(0 ratings),Finance & Accounting,,Investing
Forex Trading: How to Get Started and Build Your Edge,www.udemy.com/course/forex-trading-how-to-get-started/,Cody Harden,19.99,11.39,5.0(2 ratings),Finance & Accounting,,Investing
Investment : invest small amounts of Money wisely,www.udemy.com/course/investment-invest-small-amounts-of-money-wisely/,Fatima Khan,149.99,11.39,0.0(0 ratings),Finance & Accounting,,Investing
Technical Trading and Investing Made Easy,www.udemy.com/course/technical-trading-and-investing-made-easy/,Troy Johnson,19.99,11.39,4.7(15 ratings),Finance & Accounting,,Investing
Technical Trading and Investing Made Easy,www.udemy.com/course/technical-trading-and-investing-made-easy/,Troy Johnson,19.99,11.99,4.7(15 ratings),Finance & Accounting,,Investing
Crash Course: Investing the Proven & Simple Way (US Focused),www.udemy.com/course/crash-course-stock-investing-in-30-minutes/,Charlie Cameron,29.99,11.99,3.8(38 ratings),Finance & Accounting,,Investing
Invest Like The Gurus - A Step-by-Step Guide,www.udemy.com/course/invest-like-the-gurus-a-step-by-step-guide/,"Isom Adiari, CFA, FRM, PRM",19.99,11.99,3.0(1 rating),Finance & Accounting,,Investing
The Complete Investment Course 2018. From 0 To Professional,www.udemy.com/course/investor/,Andrew Borysenko,149.99,11.99,3.8(3 ratings),Finance & Accounting,,Investing
Investing 101 · For Beginners · In your 20's,www.udemy.com/course/investing-for-beginners-in-your-20s/,"Thomasina Shealey, MBA",19.99,11.99,0.0(0 ratings),Finance & Accounting,,Investing
Cryptocurrency Investing Crash Course,www.udemy.com/course/cryptocurrency-investing-crash-course/,Jalaluddin Jabarkhiel,19.99,11.99,3.7(16 ratings),Finance & Accounting,,Investing
Intelligent Investing: The 360° Strategic Road-Map,www.udemy.com/course/investing-roadmap/,Federico Fort,199.99,11.99,4.3(27 ratings),Finance & Accounting,,Investing
Improve Your Investing & Trading Results - Myths to Avoid!,www.udemy.com/course/improve-your-investing-trading-results-myths-to-avoid/,James Lim,129.99,11.99,3.6(20 ratings),Finance & Accounting,,Investing
Bitcoin for Beginners - 17 Reasons to Invest in Bitcoin,www.udemy.com/course/bitcoin-for-beginners-17-reasons-to-invest-in-bitcoin/,Szabolcs Juhasz,0,69.99,4.2(2 ratings),Finance & Accounting,,Investing
Decide whether to Invest in a Business ,www.udemy.com/course/decide-whether-to-invest-in-a-business/,Coursetake Interview Preparation,19.99,11.99,0.0(0 ratings),Finance & Accounting,,Investing
