Course,URL,instructor,Price (full),Price (discount),Rank,Category 1,Category 2,Category 3
User Experience Design Essentials - Adobe XD UI UX Design,www.udemy.com/course/ui-ux-web-design-using-adobe-xd/,Daniel Walter Scott,199.99,11.39,"4.6(11,374 ratings)",Design,,User Interface
Learn Figma - UI/UX Design Essential Training,www.udemy.com/course/learn-figma/,Caleb Kingston,119.99,11.39,"4.5(1,786 ratings)",Design,,User Interface
DESIGN RULES: Principles + Practices for Great UI Design,www.udemy.com/course/design-rules/,Joe Natoli,99.99,11.39,"4.6(3,437 ratings)",Design,,User Interface
UI & Web Design using Adobe Illustrator CC,www.udemy.com/course/ui-web-design-using-adobe-illustrator-2017/,Daniel Walter Scott,199.99,11.39,"4.6(1,693 ratings)",Design,,User Interface
"Adobe XD UI/UX Design, prototype, and handoff from scratch",www.udemy.com/course/learn-adobe-xd-ux-designing-and-prototyping-from-scratch/,Caleb Kingston,119.99,11.99,4.6(687 ratings),Design,,User Interface
Creative Layout Design for Websites and Mobile Apps,www.udemy.com/course/creative-layout-design-for-websites-and-mobile-apps/,Muhammad Ahsan Pervaiz,99.99,11.39,4.5(23 ratings),Design,,User Interface
The Complete Flutter UI Masterclass | iOS & Android in Dart,www.udemy.com/course/the-complete-flutter-ui-masterclass/,Marcus Ng,29.99,11.39,4.4(27 ratings),Design,,User Interface
Typography for Designers & Developers - Don't suck at design,www.udemy.com/course/typography-mastery-for-ui-designers-and-developers/,Muhammad Ahsan Pervaiz,99.99,11.39,4.2(468 ratings),Design,,User Interface
Adobe Xd Animation - Complete Guide From Icons To UI,www.udemy.com/course/adobe-xd-animation-complete-guide-from-icons-to-ui/,Aleksandar Cucukovic,199.99,11.39,4.8(8 ratings),Design,,User Interface
Figma for UI Designers,www.udemy.com/course/figma-for-ui-designers/,Greg Rog,29.99,11.39,4.1(41 ratings),Design,,User Interface
Sketch App - Modern UI Design,www.udemy.com/course/sketch-app-modern-ui-design/,Greg Rog,59.99,11.39,4.5(203 ratings),Design,,User Interface
Create HUD graphics in After Effects and Illustrator,www.udemy.com/course/hud-interface-animation-in-after-effects-and-illustrator/,Motion School,164.99,11.39,4.8(118 ratings),Design,,User Interface
UI Design with Photoshop from Beginner to Expert in 15 days,www.udemy.com/course/learn-photoshop-for-ui-design-from-scratch/,Muhammad Ahsan Pervaiz,199.99,11.39,4.4(913 ratings),Design,,User Interface
Become a UI/UX Designer | Everything You need to know,www.udemy.com/course/become-a-ui-designer/,HU Shahir,94.99,11.39,3.9(217 ratings),Design,,User Interface
Principle App - UI Prototyping,www.udemy.com/course/principle-app-ui-prototyping/,Greg Rog,34.99,11.39,4.7(144 ratings),Design,,User Interface
Mobile UI and UX Design,www.udemy.com/course/mobile-ui-and-ux-design/,Stone River eLearning,19.99,11.39,4.0(129 ratings),Design,,User Interface
Modern UI Development in Unity 4.6/5.0,www.udemy.com/course/modern-ui-development-in-unity-46-or-50/,3D BUZZ Programming and Digital Art training,19.99,11.99,4.6(96 ratings),Design,,User Interface
Mobile App Design In Sketch 3: UX and UI Design From Scratch,www.udemy.com/course/the-complete-design-course/,Rob Percival,199.99,11.39,"4.5(2,747 ratings)",Design,,User Interface
Scilab: The First Course [Beginners to Intermediate],www.udemy.com/course/scilab-the-first-course-beginners-to-intermediate/,Tahir Yaqub,39.99,11.39,4.6(19 ratings),Design,,User Interface
User Experience Design For Mobile Apps & Websites (UI & UX),www.udemy.com/course/user-experience-design-for-mobile-apps-websites-ui-ux/,Benjo Sabban,19.99,11.39,3.4(102 ratings),Design,,User Interface
UI Prototyping in Flinto,www.udemy.com/course/ui-prototyping-in-flinto/,Greg Rog,34.99,11.39,4.5(45 ratings),Design,,User Interface
Create engaging 2D Game UI with Inkscape!,www.udemy.com/course/game-ui-design-with-inkscape/,István Szép,54.99,11.39,4.3(34 ratings),Design,,User Interface
Advanced UX Techniques,www.udemy.com/course/advanced-ux-techniques/,Packt Publishing,124.99,11.39,3.5(4 ratings),Design,,User Interface
Create Game UI in 3 different styles,www.udemy.com/course/create-game-ui-in-3-different-styles/,Oksana Mykytiuk,19.99,11.39,3.6(86 ratings),Design,,User Interface
Building User Interfaces with React.js,www.udemy.com/course/learn-react-js-ui/,Nelson Djalo,49.99,11.39,3.5(48 ratings),Design,,User Interface
Enhancement with Unity UI Advanced,www.udemy.com/course/enhancement-with-unity-ui-advanced/,Packt Publishing,124.99,11.39,3.6(23 ratings),Design,,User Interface
Optimization of UI Design Workflow in Sketch,www.udemy.com/course/optimization-of-ui-design-workflow-in-sketch/,Maksym Snitser,94.99,11.39,3.4(19 ratings),Design,,User Interface
UI & Design Thinking - Design Theory & Sketch Tutorials,www.udemy.com/course/ui-design-thinking-design-theory-sketch-tutorials/,Ali Wilkin,19.99,11.39,3.4(11 ratings),Design,,User Interface
Responsive Android UI Design revealing the pro's secrets,www.udemy.com/course/responsive-android-ui-design-pros-secrets/,N.U PHILIPS,19.99,11.39,3.9(6 ratings),Design,,User Interface
Building Web UIs with Bootstrap 4,www.udemy.com/course/building-web-uis-with-bootstrap-4/,Packt Publishing,124.99,11.39,5.0(1 rating),Design,,User Interface
UI / UX  - The Complete Sketch Course,www.udemy.com/course/complete-sketch-course/,HU Shahir,59.99,11.39,3.1(11 ratings),Design,,User Interface
Automated UI Testing in Android,www.udemy.com/course/automated-ui-testing-in-android/,Packt Publishing,124.99,11.39,3.8(6 ratings),Design,,User Interface
Icons8 Lunacy : Adobe Xd  Alternative User Experience Design,www.udemy.com/course/icon8-lunacy/,Devraj Singhania,199.99,11.99,3.7(4 ratings),Design,,User Interface
Building an App UI with PrimeFaces,www.udemy.com/course/building-an-app-ui-with-primefaces/,Packt Publishing,84.99,11.99,3.0(18 ratings),Design,,User Interface
Learn UI Design: Quickly create an On-boarding Web App,www.udemy.com/course/learn-ui-design-quickly/,Brian White,19.99,11.99,0.0(0 ratings),Design,,User Interface
JQuery UI - Interface Design In JQuery - UI Training,www.udemy.com/course/jquery-ui-interface-design-in-jquery-ui-training/,Infinite Skills,49.99,11.99,3.4(7 ratings),Design,,User Interface
Mobile App : Design Facebook Application UI in Sketch,www.udemy.com/course/design-facebook-application-ui-in-sketch/,HU Shahir,24.99,11.99,0.0(0 ratings),Design,,User Interface
Design UI Faster in Sketch: Design a Cooking Blog UI/UX,www.udemy.com/course/design-ui-ux-faster-in-sketch/,Irfan Rosandi,0,19.99,0.0(0 ratings),Design,,User Interface
Figma Bootcamp 1,www.udemy.com/course/figma-bootcamp-1/,Brian White,19.99,11.99,4.0(1 rating),Design,,User Interface
How to become a UX designer,www.udemy.com/course/how-to-become-a-ux-designer/,Erick Bulatowicz,0,194.99,3.9(43 ratings),Design,,User Interface
Learn Unity's New UI Tools,www.udemy.com/course/learn-unitys-new-ui-tools/,Morgan Page,19.99,11.99,4.5(10 ratings),Design,,User Interface
Building User Interface Using React And Flux,www.udemy.com/course/building-user-interface-using-react-and-flux/,Packt Publishing,124.99,11.99,0.0(0 ratings),Design,,User Interface
Android UI/UX for Developers: Build Stylish & Beautiful Apps,www.udemy.com/course/android-ui-ux/,Ragunath Jawahar,19.99,11.99,3.4(10 ratings),Design,,User Interface
"Learn UI for Dashboards, Data Visualization and BI projects",www.udemy.com/course/ui-for-dashboards-data-visualization-and-bi/,Rainbow Seed Studio,0,49.99,0.0(0 ratings),Design,,User Interface
Master iOS User Interface Elements  in iOS 11 and Swift 4,www.udemy.com/course/master-ios-user-interface-elements-in-ios-11-and-swift-4/,Hafiz Shahzad Ali Khurram,19.99,11.99,3.9(5 ratings),Design,,User Interface
Mobile App UI Design for Beginners: Design a To-Do App,www.udemy.com/course/mobile-app-ui-design-using-sketch-prototyping-with-marvelapp/,Irfan Rosandi,0,19.99,3.4(2 ratings),Design,,User Interface
UI Animation Crash Course with Sketch 4 and Flinto,www.udemy.com/course/ui-animation-crash-course-with-sketch-4-and-flinto/,Angga Risky,19.99,11.99,3.5(7 ratings),Design,,User Interface
Use Sketch Like a Pro in 60 Min,www.udemy.com/course/use-sketch-like-a-pro/,Karim Balaa,19.99,11.99,4.0(12 ratings),Design,,User Interface
The no BS 2 Hour UI Design Course,www.udemy.com/course/learn-ui-design-all-you-need-to-start-a-6-figure-career/,Michael Abehsera,0,Free,4.4(606 ratings),Design,,User Interface
Screens Essentials for UI Designers,www.udemy.com/course/screens-essentials-for-ui-designers/,Greg Rog,0,Free,4.3(458 ratings),Design,,User Interface
Semantic UI - A Complete Beginners Guide,www.udemy.com/course/semantic-ui-for-beginners/,Aditya Giri,0,Free,3.8(489 ratings),Design,,User Interface
Fundamentals of User Interface Design,www.udemy.com/course/fundamentals-of-user-interface-design/,Ahmet Efeoğlu,0,Free,4.3(26 ratings),Design,,User Interface
InVision Studio for UI Designers,www.udemy.com/course/invision-studio-for-ui-designers/,Greg Rog,0,Free,4.5(361 ratings),Design,,User Interface
Design de Interfaces do Zero ao Avançado: UI com foco em UX.,www.udemy.com/course/ui-design-de-interface/,Inkmustache Web & Apps,0,199.99,4.7(322 ratings),Design,,User Interface
UI Design: Design de Interfaces com foco em Projetos Web,www.udemy.com/course/design-de-interfaces-web/,Lucas Assis,49.99,11.39,4.6(443 ratings),Design,,User Interface
Adobe XD: UI Design do básico aos protótipos (Windows e Mac),www.udemy.com/course/design-interfaces-adobe-xd/,Leandro Rezende,39.99,11.39,4.6(480 ratings),Design,,User Interface
Figma: Design colaborativo do básico ao protótipo responsivo,www.udemy.com/course/design-interfaces-figma/,Leandro Rezende,49.99,11.39,4.6(321 ratings),Design,,User Interface
Curso Adobe XD DEFINITIVO - UI UX Design de interação,www.udemy.com/course/curso-adobe-xd-definitivo-ui-ux-design-de-interface-profissional/,Bruno Alecrim,0,19.99,4.5(69 ratings),Design,,User Interface
Sketch: UI Design do básico aos protótipos responsivos,www.udemy.com/course/design-interfaces-sketch/,Leandro Rezende,39.99,11.39,4.4(153 ratings),Design,,User Interface
Invision Studio: do básico às telas responsivas e animações,www.udemy.com/course/design-interfaces-invision-studio/,Leandro Rezende,39.99,11.39,4.9(73 ratings),Design,,User Interface
Aprende jQuery desde cero,www.udemy.com/course/aprende-jquery-desde-cero/,Juan Fernando Urrego,199.99,11.39,4.8(296 ratings),Design,,User Interface
UI 設計入門：畫出有程式邏輯的設計稿,www.udemy.com/course/ui-ux-beginner/,卡斯伯 六角學院,0,64.99,0.0(0 ratings),Design,,User Interface
Curso Android UI - Mejora la Interfaz de Usuario de tus Apps,www.udemy.com/course/curso-android-ui-mejora-la-interfaz-de-usuario-de-tus-apps/,Alberto Palomar,49.99,11.39,4.7(52 ratings),Design,,User Interface
iOS 12: เขียนแอพ iPhone จากดีไซน์ UI/UX (Programmatically),www.udemy.com/course/ios-12-iphone-ui-ux-programmatically/,Wittaya Malaratn,39.99,11.39,4.8(11 ratings),Design,,User Interface
Interface Gráfica para Apps Python com GTK e Glade,www.udemy.com/course/interface-grafica-para-apps-python-com-gtk-e-glade/,Edson Pacholok,19.99,11.39,4.9(7 ratings),Design,,User Interface
Tüm Yönleriyle Arayüz Tasarımı (UI) - 1,www.udemy.com/course/tum-yonleriyle-arayuz-tasarm-ui-1giris/,Ramazan Yildiz,59.99,11.39,4.3(35 ratings),Design,,User Interface
Crie Sites Profissionais com Photoshop [UI Design],www.udemy.com/course/ui-design-desenvolvimento-de-landing-page/,Lucas Assis,24.99,11.39,4.6(8 ratings),Design,,User Interface
Axure RP8 交互设计 原型设计 UI设计 用户体验设计 User Interface必备技能课程,www.udemy.com/course/axure8-uiuiuser-interface/,Sjlyedu wang lijun,59.99,11.39,4.0(1 rating),Design,,User Interface
"Mobile UI design using adobe xd , after effects بالعربي",www.udemy.com/course/mobile-ui-design-using-adobe-xd-after-effects/,Ayman.M Yousif,0,19.99,4.1(14 ratings),Design,,User Interface
UI para Games com Unreal- BluePrints e  UMG,www.udemy.com/course/uicomunreal/,Miguel Coelho de Augustinis,19.99,11.39,4.2(2 ratings),Design,,User Interface
"Prototipando com o Illustrator ,UX com Illustrator",www.udemy.com/course/prototipando-com-o-illustrator-ux-com-illustrator/,Miguel Coelho de Augustinis,59.99,11.39,4.7(2 ratings),Design,,User Interface
Arduino básico: o que é Arduino?,www.udemy.com/course/arduino-basico-o-que-e-arduino/,Clovis Fritzen,19.99,11.39,4.2(5 ratings),Design,,User Interface
SIEMENS NX 11 Gateway,www.udemy.com/course/siemens-nx-11-gateway/,Valdir Silva,19.99,11.39,4.4(4 ratings),Design,,User Interface
UI Design: Da teoria a prática com foco em projetos Web,www.udemy.com/course/curso-de-user-interface-design-online/,UI Lab,0,164.99,4.7(13 ratings),Design,,User Interface
