Course,URL,instructor,Price (full),Price (discount),Rank,Category 1,Category 2,Category 3,Enrollment,Language,Description,Last Update,Date Scraped
The Visual Learning Basic Accounting Course,www.udemy.com/course/the-visual-learning-basic-accounting-course/,Tim Burns,19.99,11.39,0.0(0 ratings), Business,Finance,Accounting,20,English,Learn Basic Accounting the Easy Way with an animated presentation,5/2016,12/31/19
"Accounting basics, the ultimate course",www.udemy.com/course/accounting-basics-the-ultimate-course/,Mr. M. Samier,199.99,11.39,4.0(1 rating),Business,Finance,Accounting,2,English,how to create the three main financial statements easily,4/2018,12/31/19
Corporation Accounting-Presentations Only,www.udemy.com/course/corporation-accounting-presentations-only/,Robert (Bob) Steele,29.99,11.39,4.7(3 ratings),Business,Operations,Accounting,580,English,"Corporate accounting-Issuing stock, closing retained earnings, recording dividends, treasury stock, & preferred stock",8/2018,12/31/19
Corporation Accounting-Practice Test,www.udemy.com/course/corporation-accounting-practice-test/,Robert (Bob) Steele,24.99,11.39,0.0(0 ratings),Business,Entrepreneurship,Accounting,753,English,"Test questions-Corporate accounting-Issuing stock, closing retained earnings, recording dividends, treasury stock",8/2018,12/31/19
Accounting for everyone! ,www.udemy.com/course/accounting-for-everyone/,Axile Talout,34.99,11.39,4.3(7 ratings),Business,Finance,Accounting,430,English,Accounting the way corporate bankers see it,11/2014,12/31/19
Corporation Accounting-Excel Practice Problems Only,www.udemy.com/course/corporation-accounting-excel-practice-problems-only/,Robert (Bob) Steele,34.99,11.39,5.0(1 rating),Office Productivity,Microsoft,Accounting,850,English,"Corporate accounting-Issuing stock, closing retained earnings, recording dividends, treasury stock, & preferred stock",8/2018,12/31/19
Effectively Managing T&E Expense,www.udemy.com/course/effectively-managing-travel-expense/,Illumeo Learning,74.99,11.39,0.0(0 ratings),Business,Finance,Accounting,3,English,"This course covers where T&E fits in the control environment, areas of abuse that go unnoticed, and red flag warnings.",8/2017,12/31/19
Accounting Basics 101 for Understanding Business,www.udemy.com/course/working-capital-formula-secrets-revealed/,Kieran McSherry (BSc Acc; PG Dip Acc; FCA ),19.99,11.39,4.6(7 ratings),Business,Finance,Accounting,37,English,"A practical guide to accounting basics, balance sheet working capital, learn with your #1 Chartered Accountant Coach",1/2016,12/31/19
Accounting for CA Inter Paper 1 (Module 2),www.udemy.com/course/accounting-for-ca-inter-paper-1-module-2/,"Raja Natarajan, B.Com., PGDBA, FCA",149.99,11.39,0.0(0 ratings),Finance & Accounting,Finance Cert & Exam Prep,Accounting,3,English,A Complete Online Course covering Module 2 of Accounting Paper 1 CA Inter,11/2019,12/31/19
Applying the AICPA Code of Professional Conduct,www.udemy.com/course/applying-the-aicpa-code-of-professional-conduct/,Illumeo Learning,49.99,11.39,0.0(0 ratings),Business,Finance,Accounting,4,English,This course summarizes the nearly two-hundred pages of the AICPA code.,8/2017,12/31/19
Using Managerial Accounting to Run a Business,www.udemy.com/course/an-introduction-to-managerial-accounting-in-60-minutes/,Vincent Turner,29.99,11.39,4.6(10 ratings),Business,Finance,Accounting,53,English,How managers and business owners use accounting to run more efficient organizations.,10/2017,12/31/19
Due Diligence for Centralizing Accounts Payable,www.udemy.com/course/due-diligence-for-centralizing-accounts-payable/,Illumeo Learning,49.99,11.39,3.8(3 ratings),Business,Finance,Accounting,7,English,This course explores centralizing accounts payable and the importance of due diligence.,3/2018,12/31/19
Accounting Cycle: Learn the concepts in 60 minutes,www.udemy.com/course/accounting-cycle-in-60-minutes/,Sana Nazir,19.99,11.39,3.0(5 ratings),Business,Finance,Accounting,37,English,Learn the advanced methods to record the Accounting Period and prepare Financial Statements,1/2016,12/31/19
Accounting Crash Course,www.udemy.com/course/accounting-dont-learn-accounting-understand-it/,Johann de Klerk,34.99,11.39,4.0(1 rating),Teaching & Academics,Social Science,Accounting,4,English,Basic Accounting Principles - learn accounting the easy way,2/2019,12/31/19
Exam 1 Review - Managerial Accounting (U of H),www.udemy.com/course/exam-1-review-mgr-acct/,Nathaniel Garrett,29.99,11.39,4.5(14 ratings),Business,Finance,Accounting,66,English,Study. Review. Pass the Exam.,3/2016,12/31/19
Accounting In 45 Minutes,www.udemy.com/course/accounting-in-30-minutes/,Muhammad Naeem,19.99,11.39,4.4(13 ratings),Business,Finance,Accounting,"1,753",English,A Brief Introduction of Accounting in 45 Minutes,10/2018,12/31/19
Accounts Receivable & Allowance Method- Practice Tests Quest,www.udemy.com/course/accounts-receivable-allowance-method-practice-tests-quest/,Robert (Bob) Steele,19.99,11.39,4.3(5 ratings),Teaching & Academics,Test Prep,Accounting,726,English,"Test question-accounts receivable valuation, allowance method, direct write off method, valuation of notes receivable,",7/2018,12/31/19
Teeter-Totter Accounting,www.udemy.com/course/teeter-totter-accounting/,dantes joseph,19.99,11.39,0.0(0 ratings),Business,Finance,Accounting,1,English,Your visual guide to understanding Debits and Credits!,2/2017,12/31/19
Depreciation Accounting & Methods of depreciation,www.udemy.com/course/depreciation_accounting/,Akshata M,0.0,19.99,0.0(0 ratings),Business,Finance,Accounting,0,English,"Straight Line Method (SLM) ,Reducing Balance Method (RBM)/ Written Down Value (WDV), Sum of Year Digits and Annuity",9/2018,12/31/19
ACA Accounting Exam Masterclass,www.udemy.com/course/aca-accounting/,Kieran Doe,0.0,119.99,0.0(0 ratings),Business,Finance,Accounting,0,English,Learn how to ace the ACA Accounting exam,3/2019,12/31/19
Accounting of Partnership Firms-Complete Guide,www.udemy.com/course/accounting-of-partnership-firms/,LetsTute Make it Easy,24.99,11.39,4.4(8 ratings),Business,Finance,Accounting,573,English,Complete course of how partnership accounting gets done,11/2019,12/31/19
Accounting for Employees Stock Ownership Plan,www.udemy.com/course/employees-stock-ownership-plan/,"Raja Natarajan, B.Com., PGDBA, FCA",149.99,11.39,0.0(0 ratings),Business,Finance,Accounting,6,English,A Must Course for studnets pursing CA / CMA / CS Professional Examinations in India,1/2019,12/31/19
Freshbooks Accounting software,www.udemy.com/course/freshbooks-accounting-software/,Lisa Newton,19.99,11.39,3.7(3 ratings),IT & Software,Other,Accounting,26,English,"Learn how to use Freshbooks, the cloud bookkeeping software to perform several essential bookkeeping tasks",4/2016,12/31/19
Accounting for Companies - Issue of Debentures,www.udemy.com/course/accounting-for-companies-issue-of-debentures/,OLECD .,24.99,11.39,0.0(0 ratings),Finance & Accounting,Accounting & Bookkeeping,Accounting,"1,001",English,"Learn about the meaning, features & Complete Accounting Treatment on Issue of Debentures",6/2019,12/31/19
CPA: Certified Public Accounting,www.udemy.com/course/certified-public-accounting/,Harvard Certification Center,139.99,11.39,0.0(0 ratings),Finance & Accounting,Finance,Accounting,1,English,Prepare for Certified Public Accounting Certification by practicing on test exams,12/2019,12/31/19
Introduction to Accounting in 1 hour - Free ebook included!,www.udemy.com/course/accountingintroduction/,"Stefan Ignatovski, Ph.D.",109.99,11.39,4.4(90 ratings),Business,Finance,Accounting,"2,031",English,Get a quick introduction to Accounting. Understand the basic concepts fast.,9/2017,12/31/19
Review of the Accounting Cycle,www.udemy.com/course/review-of-the-accounting-cycle/,Patrick Lee,44.99,18.99,3.5(1 rating),Finance & Accounting,Accounting & Bookkeeping,Accounting,1,English,An Interactive Walk-Through of an Accounting Cycle Problem,8/2019,12/31/19
Accounting for Liabilities – Estimation and Valuation,www.udemy.com/course/accounting-for-liabilities-estimation-and-valuation/,Illumeo Learning,99.99,11.39,0.0(0 ratings),Business,Finance,Accounting,3,English,This course focuses on the accounting-related complexities for estimated liabilities and contingent liabilities.,8/2017,12/31/19
Accounter Live - Master the Accounting Software,www.udemy.com/course/accounter-live-master-the-accounting-software/,SkillTech Academy India,99.99,11.39,4.3(2 ratings),Business,Finance,Accounting,"3,378",English,"Learn using Accounter Live for all Accounting, Sales Invoicing, Purchase Tracking and Bank Account Tracking.",11/2018,12/31/19
Strengthening Vendor Relationships through Accounts Payable,www.udemy.com/course/strengthening-vendor-relationships-through-accounts-payable/,Illumeo Learning,49.99,11.39,2.0(1 rating),Business,Finance,Accounting,3,English,This course explains the detailed steps that can be taken by Accounts Payable to strengthen vendor relationships.,3/2018,12/31/19
Intangible Asset Valuation Accounting and Reporting,www.udemy.com/course/intangible-asset-valuation-accounting-and-reporting/,Illumeo Learning,24.99,11.39,1.0(1 rating),Business,Finance,Accounting,9,English,This course provides an overview of intangible asset accounting and reporting methods.,7/2017,12/31/19
Introduction to Accounting : Mastering Financial Statements,www.udemy.com/course/introduction-to-accounting-mastering-financial-statements/,SIB - School of Investment Banking,0.0,49.99,4.4(42 ratings),Business,Finance,Accounting,"2,014",English,"In 60 mins, master fundamentals of Accounting and pick up key skills through this high impact module for all",12/2016,12/31/19
Accounting Software Bean Balance - SAAS based Accounting,www.udemy.com/course/accounting-software-bean-balance-saas-based-accounting/,SkillTech Academy India,99.99,11.39,4.4(2 ratings),Office Productivity,Other,Accounting,"3,561",English,Learn about Accounting with the powerful SAAS based Accounting and Invoicing software Bean Balance,11/2018,12/31/19
Accounting 101: Understanding Business Accounting,www.udemy.com/course/accounting-101-understanding-business-accounting/,Elizabeth Graham,19.99,11.39,4.0(1 rating),Finance & Accounting,Finance,Accounting,7,English,Understanding why the history of accounting is critical to the success of business.,6/2019,12/31/19
Dr. John's -Management Planning & Control course in the MBA,www.udemy.com/course/principles-of-managerial-accounting-201-section-51/,John Mclellan,29.99,11.39,4.3(6 ratings),Business,Finance,Accounting,38,English,Understanding Management Accounting Tools and Techniques that have been developed by managers themselves and academics,4/2019,12/31/19
Bookkeeping and Accounting at your fingertips,www.udemy.com/course/a-crash-course-on-accounting-basics/,Syed Bilal Hassan Shah,99.99,11.39,0.0(0 ratings),Finance & Accounting,Accounting & Bookkeeping,Accounting,179,"English
 ",Bookkeeping and Accounting,11/2019,12/31/19
Finding the Right Accounts Payable Automation Provider,www.udemy.com/course/finding-accounts-payable-automation-provider/,Illumeo Learning,24.99,11.39,0.0(0 ratings),Business,Finance,Accounting,6,English,This course covers some of the Accounts Payable functions that can be automated.,3/2018,12/31/19
CA CPT - Fundamentals of Accounting - Practice Papers Set 1,www.udemy.com/course/stride-ca-cpt-fundamentals-of-accounting-practice-papers-set-1/,Padmanaban V,19.99,11.39,0.0(0 ratings),Business,Finance,Accounting,2,English,3 Solved Question papers of Fundamentals of Accounting subject in Chartered Accountancy - CPT India,11/2017,12/31/19
Accountz Accounting software,www.udemy.com/course/accountz-accounting-software/,Lisa Newton,19.99,11.39,0.0(0 ratings),Office Productivity,Other,Accounting,3,English,Learn how to use Accountz accounting software to perform common essential bookkeeping tasks.,8/2016,12/31/19
Freeplus Accounting Software,www.udemy.com/course/freeplus-accounting-software/,Lisa Newton,19.99,11.39,0.0(0 ratings),IT & Software,Other,Accounting,0,English,"Learn how to use Freeplus, the free online accounting software to perform several essential bookkeeping tasks",10/2016,12/31/19
Sage 50 Accounting  basic to Advance training in Hindi Urdu,www.udemy.com/course/sageline-50-training-in-urdu-hindi/,Accountech Training & Solutions,119.99,11.39,0.0(0 ratings),Business,Finance,Accounting,270,"English
 ",Sage 50 Accounting Become Sageline 50 Expert | Sageline VAT Expert in Hindi | Urdu,12/2019,12/31/19
Working knowledge of Accounting practice,www.udemy.com/course/working-knowledge-of-accounting-practice/,Fatima Butt,0.0,99.99,0.0(0 ratings),Business,Finance,Accounting,0,English,Inner world of practice,6/2018,12/31/19
Accounting made easy in 60 minutes,www.udemy.com/course/accounting-made-easy-in-60-minutes/,Joshua Gujjarlamudi,29.99,11.39,4.0(11 ratings),Business,Finance,Accounting,"2,040",English,learn the fundamentals of accounting and its applications in an hour.,11/2018,12/31/19
Working knowledge of Accounting practice,www.udemy.com/course/working-knowledge-of-accounting-practice/,Fatima Butt,0.0,99.99,0.0(0 ratings),Business,Finance,Accounting,0,English,Inner world of practice,6/2018,12/31/19
Learn Basic Accounting in 90 Minutes,www.udemy.com/course/learn-basic-accounting-in-90-minutes/,David Yao,49.99,11.99,2.5(11 ratings),Business,Finance,Accounting,"3,589",English,All You Need to Know about Accounting,9/2018,12/31/19
Sage 50 Accounting  basic to Advance training in Hindi Urdu,www.udemy.com/course/sageline-50-training-in-urdu-hindi/,Accountech Training & Solutions,119.99,11.99,0.0(0 ratings),Business,Finance,Accounting,270,"English
 ",Sage 50 Accounting Become Sageline 50 Expert | Sageline VAT Expert in Hindi | Urdu,12/2019,12/31/19
Learn Accounting by Specific Examples - Part 1,www.udemy.com/course/accounting1/,Annie C,49.99,11.99,0.0(0 ratings),Business,Finance,Accounting,306,English,"Accounting made easy. Learn accounting with easy to follow lessons, including step-by-step exercise problems.",12/2014,12/31/19
The Ultimate 60 Minute Introduction To Accounting Course,www.udemy.com/course/the-ultimate-60-minute-introduction-to-accounting/,Bill Hludzinski,19.99,11.99,0.0(0 ratings),Business,Finance,Accounting,0,English,"Learn the basic fundamentals of accounting, bookkeeping, financial accounting, and managerial accounting in an hour.",4/2019,12/31/19
An Overview of The Accounting Period Adjusting Process,www.udemy.com/course/the-accounting-period-adjusting-process/,Illumeo Learning,49.99,11.99,0.0(0 ratings),Business,Finance,Accounting,1,English,"This course covers the accounting period adjusting process, including its place in the accounting cycle.",7/2017,12/31/19
Problems & Solutions in Accounting Basics,www.udemy.com/course/problems-solutions-in-accounting-basics/,"Raja Natarajan, B.Com., PGDBA, FCA",39.99,11.99,4.1(7 ratings),Business,Finance,Accounting,"4,078",English,Unique course covering only Practice Problems in Accounting Basics,5/2018,12/31/19
Get Your Important Online Account Back!  Cure For The Banned,www.udemy.com/course/get-your-important-online-account-back-cure-for-the-banned/,Daniel Hall,199.99,11.99,4.5(4 ratings),Business,Communications,Accounting,"1,333",English,If you've lost or been banned from your important online account for no reason and want it back this is your course!,8/2015,12/31/19
Accounting - Basic Costing ,www.udemy.com/course/basic-costing/,Steve Currie,39.99,11.99,4.0(5 ratings),Business,Finance,Accounting,115,English,"Learn basic costing principles to improve your accounting knowledge, earn promotion or enhance a college course",8/2015,12/31/19
Accounts Payable Recovery Audit,www.udemy.com/course/accounts-payable-recovery-audit/,Illumeo Learning,49.99,11.99,4.9(4 ratings),Business,Finance,Accounting,13,English,This course explores the benefits of an Accounts Payable Recovery Audit.,3/2018,12/31/19
Learn Accounting with Quicken,www.udemy.com/course/learn-accounting-with-quicken/,Gaurav Narula,19.99,11.99,1.0(5 ratings),IT & Software,Other,Accounting,6,English,Just Got your hands on Quicken? Checkout This course for quicken to know more how you can Do accounting with Quicken,7/2018,12/31/19
beginning accounting,www.udemy.com/course/beginning_accounting/,Cody Hassler,19.99,11.99,0.0(0 ratings),Business,Finance,Accounting,0,English,basic accounting,12/2016,12/31/19
Pandle Accounting Software,www.udemy.com/course/pandle-accounting-software/,Lisa Newton,19.99,11.99,4.4(4 ratings),Business,Operations,Accounting,16,English,Learn how to use Pandle accounting software to perform common essential bookkeeping tasks,7/2017,12/31/19
CA CPT - Quantitative Aptitude - Practice Papers Set 1,www.udemy.com/course/stride-ca-cpt-quantitative-aptitude-practice-papers-set-1/,Padmanaban V,19.99,11.99,0.0(0 ratings),Business,Finance,Accounting,2,English,3 Solved Question papers of Quantitative Aptitude subject in Chartered Accountancy - CPT India,11/2017,12/31/19
Essential Accounting Skills - Transaction Analysis Explained,www.udemy.com/course/essential-accounting-skills-transaction-analysis-explained/,Anthony Ford,19.99,11.99,4.5(11 ratings),Business,Finance,Accounting,"1,606",English,Learn to perform important Accounting Transaction Analysis & Interpretation using the most fundamental accounting rules,1/2019,12/31/19
"Making 'No PO, No Pay' Work for Your Organization",www.udemy.com/course/no-po-no-pay/,Illumeo Learning,49.99,11.99,3.5(1 rating),Business,"Finance
 ",Accounting,5,English,"This course explains what âNo PO, No Payâ means and why companies are moving to this model.",7/2017,12/31/19
"Making 'No PO, No Pay' Work for Your Organization",www.udemy.com/course/no-po-no-pay/,Illumeo Learning,49.99,11.39,3.5(1 rating),Business,Finance,Accounting,5,English,"This course explains what âNo PO, No Payâ means and why companies are moving to this model.",7/2017,12/31/19
beginning accounting,www.udemy.com/course/beginning_accounting/,Cody Hassler,19.99,11.39,0.0(0 ratings),Business,Finance,Accounting,0,English,basic accounting,12/2016,12/31/19
Liberty Accounts,www.udemy.com/course/liberty-accounts/,Lisa Newton,39.99,11.39,0.0(0 ratings),IT & Software,Other,Accounting,0,English,Learn how to use Liberty accounting software to perform common essential bookkeeping tasks,11/2016,12/31/19
Practical Accounts Training A,www.udemy.com/course/mobile-practical-accounts-training-a/,Moses Carson Bakaluba,0.0,Free,4.6(710 ratings),Business, Finance,Accounting,"12,923",English,"Using Software, Manage & Record 80 Document Types, Interpret 15 Period Reports",2/2017,12/31/19
Accounting Debits and Credits - Accounting Play,www.udemy.com/course/accounting-debits-and-credits/,John Gillingham,0.0,Free,4.1(714 ratings),Business,Finance,Accounting,"15,340",English,"With PDF Course Book, Finally Learn Your Accounting Debits & Credits",10/2015,12/31/19
Cloud Accounting Course,www.udemy.com/course/cloud-accounting-course/,Deepa Shekhar,0.0,Free,3.9(51 ratings),Business,Operations,Accounting,"4,187",English,Learn Cloud Tools to make you a Next Gen Accountant,3/2018,12/31/19
Wave Accounting Free Cloud-based Software for Small Business,www.udemy.com/course/wave-accounting-free-cloud-based-software-for-small-business/,Larry Aiello,0.0,Free,3.7(3 ratings),Finance & Accounting,"Accounting & Bookkeeping
 ",Accounting,"1,619",English,Take Control of your Business Finances and Make Better Decisions,11/2019,12/31/19
"How to Prepare, Read and Analyse a Company Balance Sheet",www.udemy.com/course/balance-sheet/,The Duomo Initiative,0.0,Free,4.3(866 ratings),Business,Finance,Accounting,"16,773",English,A practical first step in company analysis,8/2018,12/31/19
Introduction to Financial Accounting,www.udemy.com/course/introduction-to-financial-accounting-course/,Tim Vipond,0.0,Free,4.1(745 ratings),Business,Finance,Accounting,"9,759",English,Learn the fundamentals and building blocks of the accounting process,11/2018,12/31/19
Financial Ratios Simplified : A practicle guide,www.udemy.com/course/financial-ratios-simplified-a-practicle-guide/,EduFinWizards Edu,0.0,Free,3.7(70 ratings),Business,Finance,Accounting,"3,092",English,This course is for accounting and finance students . This course covers various types of financial ratios with examples,4/2019,12/31/19
Changing Accounting Systems,www.udemy.com/course/changing-accounting-systems/,Mark Smolen,0.0,Free,0.0(0 ratings),Business,Finance,Accounting,835,"English
 ",Learn How Make A Fresh Start In A New Accounting System,10/2019,12/31/19
"Balance Sheet, Accounting Equation",www.udemy.com/course/balance-sheet-accounting-equation/,Baker Abdallah,0.0,Free,4.2(9 ratings),Business,Finance,Accounting,628,English,"An overview of the balance sheet, the accounting equation and its components",9/2019,12/31/19
Financial Accounting in Excel - New Business,www.udemy.com/course/financial-accounting-in-excel-new-business/,Robert (Bob) Steele,0.0,Free,4.2(981 ratings),Business,Finance,Accounting,"17,979",English,We will start a comprehensive worksheet in Excel and enter journal entries related to setting up a new business.,6/2018,12/31/19
Excel for Accountants: Mapping Tables,www.udemy.com/course/excel-for-accountants-mapping-tables/,Jeff Lenning,0.0,Free,"4.3(4,044 ratings)",Office Productivity,Microsoft,Excel,"56,384",English,Automate reporting tasks with a mapping table,9/2017,12/31/19
Beginner's Guide to Merchant Accounts,www.udemy.com/course/merchant-accounts/,Lesa Townsend,0.0,Free,4.1(63 ratings),Business,Finance,Accounting,"3,508",English,Tips for Choosing a Credit Card Processor for Your Business,11/2017,12/31/19
Learn Wave accounting to maintain books properly,www.udemy.com/course/learn-wave-accounting-to-maintain-books-properly/,Payel Podder,0.0,Free,4.0(361 ratings),Business,Finance, Accounting,"4,839",English,Learn how to maintain your books of accounts on Wave Accounting,1/2016,12/31/19
Basic Accounting Skills for Business Owners,www.udemy.com/course/accounting-for-business-owners/,Adnan Hasbi,0.0,Free,3.9(683 ratings),Business,Finance,Accounting,"11,367",English,"A very short , concise and to the point accounting course",2/2017,12/31/19
Stacked Careers for Accounting and Finance,www.udemy.com/course/accounting-finance-cpa-careers/,Karen Gurney,0.0,Free,4.2(19 ratings),Personal Development,Career Development,Accounting,"1,439",English,"Double Your Job Interviews, Leverage Recruiters, Unlock LinkedIn",11/2019,12/31/19
Basic Accounting Terms,www.udemy.com/course/accounting-for-entrepreneurs/,Irfan Sharif,0.0,Free,4.2(677 ratings),Business,Finance,Accounting,"6,718",English,An introduction to Accounting terms,2/2015,12/31/19
Accounting: In Just 60 Minutes!,www.udemy.com/course/accounting-in-one-hour/,Brendan McCoy,0.0,Free,4.0(9 ratings),Finance & Accounting,Accounting & Bookkeeping,Accounting,"1,252",English,"Learn Accounting with a real accountant, Brendan McCoy, who owns a Top Rated Accounting Company in the U.S.",11/2019,12/31/19
Contabilità Generale. Le Solide Basi per Capirla a Fondo.,www.udemy.com/course/contabilitageneraledibase/,Marco Bianchi,114.99,11.39,4.4(329 ratings),Business,Management,Amministrazione,1.486,Italiano,Impara in modo semplice e chiaro i fondamentali della ContabilitÃ  Generale che ti garantiranno approfondimenti futuri.,12/2019,12/31/19
Contabilidad Financiera para todos.,www.udemy.com/course/contabilidad-financiera/,Isabelle O.A.,159.99,40.00,4.5(61 ratings),Negocios,Finanzas,Contabilidad,275,EspaÃ±ol,Aprende a gestionar la contabilidad completa de una empresa.,11/2019,12/31/19
Buchführung lernen leicht gemacht,www.udemy.com/course/buchfuehrung-lernen-leicht-gemacht/,Christian Borcherding,0.0,39.99,4.7(230 ratings),Business,Finanzen,Rechnungswesen,1.065,Deutsch,PrÃ¼fungsvorbereitung in BuchfÃ¼hrung fÃ¼r SchÃ¼ler und Studenten,12/2019,12/31/19
CONTABILIDADE BÁSICA,www.udemy.com/course/contabilidade-basica-professorjoaorafael/,João Rafael Alberton,54.99,11.39,4.3(155 ratings),Desenvolvimento pessoal,Desenvolvimento de carreira,Contabilidade,724,PortuguÃªs,Aprendendo contabilidade de um jeito diferente.,12/2019,12/31/19
Sıfırdan İleri Seviye Uygulamalı Muhasebe Dersleri,www.udemy.com/course/sifirdan-ileri-seviye-uygulamali-muhasebe-dersleri/,Uğur Tufan,94.99,11.39,4.6(264 ratings),ÃÄretim ve Akademi,SÄ±nava HazÄ±rlÄ±k,Muhasebe,1.161,TÃ¼rkÃ§e,"HiÃ§ bir Ã¶n bilgi gerektirmeden muhasebe Ã¶Ärenin! Ãstelik uygulamalÄ±, Ã¶rnekli ve Ã¶Ärenme garantili!",6/2019,12/31/19
Contabilidad rápida y eficaz,www.udemy.com/course/contabilidad11/,Joel Silvera,39.99,11.39,4.4(312 ratings),Negocios,Finanzas,Contabilidad,1.260,EspaÃ±ol,"Con esta tÃ©cnica veras la contabilidad mÃ¡s fÃ¡cil, podrÃ¡s subir tus ingresos y ganar mÃ¡s tiempo libre.",1/2018,12/31/19
Mali Tablolar Analizi Nasıl Yapılır?,www.udemy.com/course/mali-tablolar-analizi-nasil-yapilir-kursu/,Aydın Tuzcu,94.99,11.39,4.3(145 ratings),Finans ve Muhasebe,Muhasebe ve Defter Tutma,Muhasebe,718,TÃ¼rkÃ§e,"Herkes yapabilsin diye, herkesin anlayabileceÄi seviyede... AnlatÄ±mÄ± basit ama iÃ§eriÄi deÄer katÄ±cÄ±... ÃdÃ¼llÃ¼ SMMM'den..",10/2018,12/31/19
Comptabilité pratique pour les entrepreneurs,www.udemy.com/course/comptabilite-micro-entreprise-societe-demarrage-pratique/,Radoykov Stephane,74.99,11.39,4.7(52 ratings),Business,Entreprenariat,ComptabilitÃ©,357,FranÃ§ais,Comment commencer en dÃ©but d'activitÃ©?,1/2019,12/31/19
Contabilidade Completa para Iniciantes,www.udemy.com/course/contabilidade-completa-para-iniciantes/,Ademir Círico Junior,44.99,11.39,4.0(107 ratings),NegÃ³cios,Empreendedorismo,Contabilidade,895,PortuguÃªs,DO BÃSICO AO AVANÃADO,4/2019,12/31/19
