Course,URL,instructor,Price (full),Price (discount),Rank,Category 1,Category 2,Category 3,Enrollment,Language,Description,Last Update,Date Scraped
"Introduction to Finance, Accounting, Modeling and Valuation",www.udemy.com/course/introduction-to-accounting-finance-modeling-valuation-by-chris-haroun/,Chris Haroun,199.99,11.99,"4.4(9,795 ratings)",Business,Finance,Accounting,"58,243",English,"Learn Finance & Accounting from Scratch by an Award Winning MBA Professor, Ivy Grad, worked @ Goldman & VC",10/2019,12/31/19
Financial Accounting - #1 Ranked University: Course 1 of 5,www.udemy.com/course/learnaccountingforfree/,Norm Nemrow,199.99,11.99,"4.6(1,254 ratings)",Business,Finance,Accounting,"16,802",English,"Honored by the President of the United States for outstanding teaching, learn Accounting from the self-made millionaire.",9/2019,12/31/19
Accounting: From Beginner to Advanced!,www.udemy.com/course/accounting101/,"Stefan Ignatovski, Ph.D.",199.99,11.99,"4.3(2,162 ratings)",Teaching & Academics,Social Science,Accounting,"10,657",English,Learn accounting like never before. Learn easy and fast. Easy to understand Accounting. #1 accounting course online.,1/2019,12/31/19
The Complete Introduction To Accounting and Finance,www.udemy.com/course/finance-and-accounting-for-startups/,"Chris Benjamin, MBA & CFO",199.99,11.99,4.4(524 ratings),Business,Finance,Accounting,"4,830",English,The Original Course on Accounting & Finance! It's easy once you know the basics. Learn introductory accounting & finance,10/2019,12/31/19
Accounting Basics - A Complete Study,www.udemy.com/course/fundamentals-of-accounting-a-complete-study/,"Raja Natarajan, B.Com., PGDBA, FCA",199.99,11.99,4.3(336 ratings),Business,Finance,Accounting,"2,573",English,A - Z Guide for learning the Basics of Accountancy,12/2019,12/31/19
2019-20 Updated : Bookkeeping & Accountancy Complete Course,www.udemy.com/course/bookkeeping-courses/,LetsTute Make it Easy,34.99,11.99,4.6(24 ratings),Finance & Accounting,Accounting & Bookkeeping,Accounting,"1,556",English,Basic to advance Bookkeeping & Accountancy course for professionals & students. Learn Bookkeeping with easy methods.,9/2019,12/31/19
The Complete Advanced Accounting and Finance Course,www.udemy.com/course/advanced-finance-and-accounting-for-startups/,"Chris Benjamin, MBA & CFO",149.99,11.99,4.2(52 ratings),Business,Finance,Accounting,"1,321",English,Advanced accounting & finance topics related to startup and early stage companies. Learn accounting and finance in 2019,10/2019,12/31/19
Advanced Accounting A Complete Study for CA/CMA/CFA/ACCA/CS,www.udemy.com/course/branch-accounts-a-complete-analysis/,"Raja Natarajan, B.Com., PGDBA, FCA",199.99,11.99,4.4(83 ratings),Business,Finance,Accounting,"2,670",English,Prepare yourself for Advanced Accountancy Paper on CA / CMA / CS / B.Com Courses as well to acquire practical knowledge,12/2019,12/31/19
Accounting 101: How to read an Accounting Balance Sheet,www.udemy.com/course/financial-statements-101-how-to-read-a-balance-sheet/,KayOne Academy,199.99,11.99,4.3(275 ratings),Business,Finance,Accounting,"4,048",English,"Accounting 101: Non-Accountants' Guide to Accounting. Learn Accounting. Get Paid More, and Get Promoted Faster!",4/2015,12/31/19
Accounting in 60 Minutes - A Brief Introduction,www.udemy.com/course/accounting-in-60-minutes-a-brief-introduction/,Vincent Turner,34.99,11.99,"4.5(7,866 ratings)",Business,Finance,Accounting,"76,301",English,Learn the very basics of accounting in just about an hour.,10/2015,12/31/19
Finance & Accounting for Management Consultants and Analysts,www.udemy.com/course/finance-accounting-for-management-consultants-and-analysts/,Asen Gyczew,189.99,11.99,4.5(38 ratings),Finance & Accounting,Financial Modeling & Analysis,Accounting,"1,154",English,Practical guide that will help you understand financial statements & do financial analyses during consulting projects,11/2019,12/31/19
Introduction to bookkeeping and Accounting,www.udemy.com/course/introduction-to-bookkeeping-and-accounting/,Paula Guilfoyle,34.99,11.99,4.5(342 ratings),Business,Finance,Accounting,"3,230", English,"Introduction to Bookkeeping and Accounting, Assets, liabilities, I&E and the Accounting equation",7/2019,12/31/19
Complete financial bookkeeping and accounting course,www.udemy.com/course/complete-financial-bookkeeping-and-accounting-course/,LetsTute Make it Easy,49.99,11.99,3.8(67 ratings),Business,Finance,Accounting,"1,605",English,Complete Bookkeeping & Accounting Course For Level 1 & 2,11/2019,12/31/19
Accounting 101 - The Principles Of Accounting,www.udemy.com/course/accounting-101-the-principles-of-accounting/,Shakir Elahi,99.99,11.99,4.4(285 ratings),Teaching & Academics,Social Science,Accounting,"4,514",English,Start Making Journal Entries Today!,9/2019,12/31/19
Accounting 101: Learn Basic Accounting Concepts With Ease,www.udemy.com/course/accounting-101-basic-accounting-concepts-explained/,"Chris Benjamin, MBA & CFO",49.99,11.99,4.3(70 ratings),Business,Finance,Accounting,"1,292",English,"Learn Basic Accounting 101 Concepts, How To Account for Debits and Credits, Financial Reporting, Revenue & Expenses 2019",10/2019,12/31/19
Business Administration for Your Business - BUS102,www.udemy.com/course/micro-mba-program-for-everyone-learn-with-erik-and-susan/,Animate U,19.99,11.99,4.6(539 ratings),Business,Management,Finance Fundamentals,"8,106",English,"MBA, Finance, Accounting, Marketing, Management, Strategy, Entrepreneurship, Sales, Human Resource, Business English",6/2018,12/31/19
Accounting Fundamentals Using Quickbooks,www.udemy.com/course/accounting-fundamentals-using-quickbooks/,Humberto Vicetti,19.99,11.99,4.2(51 ratings),Business,Operations,Accounting,225,English,"For Solopreneurs, Small Business Owners and Students",11/2016,12/31/19
Introduction to Business Accounting,www.udemy.com/course/introduction-to-business-accounting/,Integrity Training,199.99,11.99,4.1(15 ratings),Business,Management,Accounting,71,English,Introduction to Business Accounting,10/2018,12/31/19
Accounting Basics for Success in Business and in Life!,www.udemy.com/course/accounting-basics-for-success-in-business-and-in-life/,Uday Gehani,199.99,11.99,4.5(161 ratings),Business,Finance,Accounting,"1,767",English,Understand Accounting and Financial Statements in this easy to follow course.,8/2019,12/31/19
Bookkeeping & Accounting Level - 1,www.udemy.com/course/book-keeping-accountancy-level-1/,LetsTute Make it Easy,124.99,11.99,4.0(60 ratings),Business,Finance,Accounting,390,English,Complete guidance for book-keeping & accountancy class - 11 in less than 7 hours,10/2019,12/31/19
Intro to Accounting the Easy Way! Free Book Included!,www.udemy.com/course/business-school-basic-introduction-to-accounting-the-easy-way-mba/,Chris Haroun,49.99,11.99,4.1(71 ratings),Business,Entrepreneurship,Accounting,"1,607",English,"Accounting the Easy Way by Award Winning MBA Business School Prof., IVY League MBA & Venture Capitalist",10/2019,12/31/19
Fundamentals of Business Taxes,www.udemy.com/course/fundamentals-of-business-taxes/,Mike M.,19.99,11.99,4.1(16 ratings),Business,Finance,Accounting,562,English,Learn the fundamentals of business taxes and understand the basics of doing taxes for your business,3/2019,12/31/19
"Accounting, Finance and Banking - A Comprehensive Study",www.udemy.com/course/accounting-finance-and-banking-a-comprehensive-study/,"Raja Natarajan, B.Com., PGDBA, FCA",199.99,11.99,3.7(156 ratings),Business,Finance,Accounting,"1,270",English,Learn Fundamentals to Advanced Concepts of three different but interrelated domains in a single course,11/2019,12/31/19
Accounting101: Learn Accounts Receivable From A to Z,www.udemy.com/course/learn-accounts-receivable-basics-and-best-practices/,"Chris Benjamin, MBA & CFO",54.99,11.99,4.1(46 ratings),Business,Finance,Accounting,"2,601",English,"Learn The Accounts Receivable Cycle, Basics of Accounts Receivable, Accelerating Collections and Much More in 2019!",10/2019,12/31/19
Accounting 101 - Learn the Basic Principles the Right Way,www.udemy.com/course/accounting-101-course-learn-basics-fundamentals-small-business/,Mark Cunningham,44.99,11.99,4.5(31 ratings),Business,Finance,Accounting,96,English,"Learn about debits and credits, balance sheets, profit & loss, journals, assets, liabilities, trial balance and more.",10/2019,12/31/19
Payroll Accounting Introduction,www.udemy.com/course/payroll-accounting-introduction/,Illumeo Learning,49.99,11.99,3.6(259 ratings),Business,Finance,Accounting,"1,046",English,This course prepares the learner with the basic knowledge needed to administer the accounting for payroll.,6/2017,12/31/19
Fundamentals of US GAAP Accounting,www.udemy.com/course/fundamentals-of-us-gaap-accounting-part-1/,Neilko Ventures Private Limited,19.99,11.99,3.1(49 ratings),Business,Finance,Accounting,612,English,US GAAP,6/2019,12/31/19
Governmental Accounting 100,www.udemy.com/course/governmental-accounting-100/,Robert (Bob) Steele,199.99,11.99,3.4(8 ratings),Finance & Accounting,Accounting & Bookkeeping,Accounting,"2,079",English,Fund accounting-governmental accounting-General Fund & government-wide activity transactions-modified accrual method,6/2019,12/31/19
Revenue Recognition - ASC Topic 606,www.udemy.com/course/revenue-recognition-asc-topic-606/,Illumeo Learning,49.99,11.99,4.3(55 ratings),Business,Finance,Accounting,153,"English
 ",This course explains the 5 steps to Revenue Recognition under the new standards.,6/2017,12/31/19
Professional Bookkeeping & Accounting 1: Sales & Purchases,www.udemy.com/course/professional-bookkeeping-and-accounting-1/,Paula Guilfoyle,34.99,11.99,4.0(66 ratings),Business,Finance,Accounting,748,English,A comprehensive guide to bookkeeping and accounting for Sales and Purchases,7/2019,12/31/19
Accounting Standards  A Complete Study for CA/CMA/CS,www.udemy.com/course/accounting-standards-a-complete-study/,"Raja Natarajan, B.Com., PGDBA, FCA",199.99,11.99,4.4(22 ratings),Business,Finance,Accounting,252,English,Course on Accounting Standards for CA / CMA / CS / MBA / M Com / B Com Students,12/2019,12/31/19
Accounts Payable Operations Responsibilities,www.udemy.com/course/accounts-payable-operations-responsibilities/,Illumeo Learning,74.99,11.99,4.2(38 ratings),Business,Finance,Accounting,159,English,This course reviews liabilities as it pertains to Accounts Payable (AP) and the different responsibilities of AP.,3/2018,12/31/19
Dr  John's Managerial Accounting course in  MBA program,www.udemy.com/course/get-an-a-in-your-mba-managerial-accounting-course/,John Mclellan,29.99,11.39,4.7(54 ratings),Business,Finance,Accounting,"1,188",English,The Managerial Accounting Course is a major part of the Masters of Business Administration Program,4/2019,12/31/19
Learn Accounting. Understand Business.,www.udemy.com/course/learn-accounting-understand-business/,Calvin Liu,199.99,11.39,4.3(186 ratings),Business,Finance,Accounting,"6,087",English,Developing a Business Mindset through the Application of Accounting Concepts,10/2015,12/31/19
Basic Accounting & Bookkeeping For Beginners,www.udemy.com/course/basic-accounting-and-bookkeeping-for-beginners/,LetsTute Make it Easy,19.99,11.39,4.2(16 ratings),Business,Finance,Accounting,"1,918",English,This Accounting course is specifically designed for Beginners to know the basics of bookkeeping and accounting.,5/2019,12/31/19
Sarbanes-Oxley (SOX) Identifying and Documenting Controls,www.udemy.com/course/sarbanes-oxley-sox-identifying-and-documenting-controls/,Illumeo Learning,99.99,11.39,4.4(38 ratings),Business,Finance,Accounting,202,English,This course explores how identifying and documenting controls for Sarbanes-Oxley.,8/2017,12/31/19
Introduction to Small Business Accounting Training Tutorial,www.udemy.com/course/introduction-to-small-business-accounting-training-tutorial/,"TeachUcomp, Inc.",24.99,11.39,4.0(44 ratings),Business,Finance,Accounting,365,English,"Learn the basics of small business accounting. Includes video lessons, tests and glossary of accounting terms.",6/2013,12/31/19
"CPA Exam (FAR): Income Taxes, In a Snap!",www.udemy.com/course/taxinasnap/,Test Prep In a Snap!,29.99,18.99,4.9(13 ratings),Teaching & Academics,Test Prep,Accounting,87,English,Pass the CPA Exam! Master Income Taxes for FAR,12/2019,12/31/19
MBA Accounting and Finance for Managers(Paper MS04 of IGNOU),www.udemy.com/course/dividend-decision-a-comprehensive-study/,"Raja Natarajan, B.Com., PGDBA, FCA",199.99,11.39,4.2(40 ratings),Business,Finance,Accounting,"1,622",English,Learn all the topics prescribed in Paper MS 04 - MBA Course conducted by IGNOU,12/2019,12/31/19
BookKeeping & Accounting Level - 2,www.udemy.com/course/book-keeping-accountancy-level-2/,LetsTute Make it Easy,109.99,11.39,4.3(12 ratings),Business,Finance,Accounting,271,English,"Entire Partnership Accounting, Non Profit Organisations, Single Entry System, Joint stock company, bills of exchange,etc",10/2019,12/31/19
Accounting 101: Accounts Payable Best Practices For 2020,www.udemy.com/course/learn-accounts-payable-best-practices/,"Chris Benjamin, MBA & CFO",49.99,11.39,4.2(35 ratings),Business,Finance,Accounting,431,English,"Avoid common mistakes and pitfalls when it comes to Accounts Payable. No more fraud, incorrect payments or voided checks",10/2019,12/31/19
Partnership Accounting,www.udemy.com/course/partnership-accounting/,Robert (Bob) Steele,199.99,11.39,4.7(19 ratings),Business,Entrepreneurship,Accounting,"3,435",English,"Partnership formation, net income allocation, adding new partners, liquidation, partner leaving, closing process",9/2019,12/31/19
Accounting 201: Advanced Accounts Payable Concepts and Tools,www.udemy.com/course/learn-advanced-accounts-payable-save-money-and-time/,"Chris Benjamin, MBA & CFO",49.99,11.39,4.1(16 ratings),Business,Finance,Accounting,608,English,Advanced Accounts Payable - Learn how to reduce expenditure and use time efficiently in your Accounts Payable department,10/2019,12/31/19
Accounting 2 Simplified for You,www.udemy.com/course/accounting-2-simplified-for-you/,Majo Jacinto,49.99,11.39,4.5(127 ratings),Business,Finance,Accounting,"1,995",English,"Manage payroll, cash, receivables, inventories & liabilities in easy to follow steps. Great companion of Accounting 1.",12/2014,12/31/19
How to read a Profit & Loss Account and Balance Sheet,www.udemy.com/course/how-to-read-a-profit-loss-account-and-balance-sheet/,Lisa Newton,19.99,11.39,3.7(37 ratings),Business,Finance,Accounting,168,English,Interpret the figures on a profit and loss account and a balance sheet for both businesses and for yourself (personal),5/2017,12/31/19
Advanced Accounting for Investment Banking,www.udemy.com/course/advanced-accounting-for-investment-banking/,Wall Street  Prep,0.0,49.99,4.6(127 ratings),Business,Finance,Accounting,"1,400",English,Learn frequently encountered investment banking accounting topics not covered in introductory courses.,9/2014,12/31/19
Accounting 102 - The Ledger & The Trial Balance,www.udemy.com/course/accounting-102-the-ledger-the-trial-balance/,Shakir Elahi,99.99,11.39,4.6(42 ratings),Teaching & Academics,Social Science,Accounting,"2,022",English,Learn to post to the Ledger & Create a Trial Balance Today,2/2018,12/31/19
Fundamentals of Accounting,www.udemy.com/course/fundamentals-of-accounting/,Pier Hill Accounting,24.99,11.39,4.1(205 ratings),Business,Finance,Accounting,"2,083",English,Learn the basics of accounting in an easy to understand method,7/2019,12/31/19
Basic Accounting and Bookkeeping for Beginners and Startups,www.udemy.com/course/basic-accounting-and-bookkeeping-for-beginners-and-startups/,Niran Marshall Perera,24.99,11.99,4.3(94 ratings),Business,Finance,Accounting,"1,974",English,Simple Accounting for Better life,8/2017,12/31/19
Intro to Audit Sampling & GAAP Reporting | Breezy CPA,www.udemy.com/course/auditing-2/,Philip J.,89.99,11.99,4.2(5 ratings),Finance & Accounting,Accounting & Bookkeeping,Accounting,980,English,"Learn Auditing & Accounting from Scratch from a Certified Public Accountant, CPA",6/2019,12/31/19
Business Valuations - Approaches and Methods,www.udemy.com/course/business-valuations-approaches-and-methods/,Illumeo Learning,49.99,11.99,4.6(32 ratings),Business,Finance,Accounting,139,English,This course covers business valuation basics.,8/2017,12/31/19
Sarbanes-Oxley (SOX) General and Applications Controls,www.udemy.com/course/sarbanes-oxley-sox-general-and-applications-controls/,Illumeo Learning,99.99,11.99,4.2(33 ratings),Business,Finance,Accounting,161,English,"This course speaks directly to the importance of general controls (GC), application controls (AC) and spreadsheet.",8/2017,12/31/19
Professional Bookkeeping and Accounting 3: Double Entry,www.udemy.com/course/professional-bookkeeping-and-accounting-3-double-entry/,Paula Guilfoyle,34.99,11.99,3.6(28 ratings),Business,Finance,Accounting,231,English,A comprehensive course for those that require Double Entry Bookkeeping and Accounting skills,11/2019,12/31/19
Lease Accounting Fundamentals - ASC Topic 842,www.udemy.com/course/lease-accounting-asc-topic-842/,Illumeo Learning,49.99,11.99,4.1(60 ratings),Business,Finance,Accounting,319,English,This course provides a basic understanding of the new lease accounting rules (ASC Topic 842).,6/2017,12/31/19
Financial Statements: Learn Accounting. Unlock the Numbers.,www.udemy.com/course/learn-accounting-unlock-the-numbers/,Nathaniel Garrett,49.99,11.99,4.6(24 ratings),Business,Finance,Accounting,330,English,"Learn Accounting to Get Promoted, Become a Successful Entrepreneur, and Make Smarter Investments
 ",5/2016,12/31/19
Accounting 1 Simplified for You,www.udemy.com/course/accounting-1-simplified-for-you/,Majo Jacinto,49.99,11.99,4.3(294 ratings),Business,Finance,Accounting,"3,566",English,Your no-nonsense guide to understanding accounting principles in easy to follow explanations and step-by-step examples.,11/2014,12/31/19
Shark Accounting - Building a Business by the Numbers!,www.udemy.com/course/shark-accounting/,Vincent Turner,19.99,11.99,4.6(265 ratings),Business,Finance,Accounting,"6,676",English,An introduction to management accounting for entrepreneurs and business owners.,5/2014,12/31/19
Professional Bookkeeping & Accounting 4:Trial Balance & More,www.udemy.com/course/professional-bookkeeping-accounting-4trial-balance-more/,Paula Guilfoyle,34.99,11.99,4.3(26 ratings),Business,Finance,Accounting,212,English,"Learn about Journal entries, Calculating Payroll, Deducting Taxes, Control Account and Preparing the Trial Balance",11/2017,12/31/19
Professional Bookkeeping & Accounting 2 - Bank Daybook,www.udemy.com/course/professional-bookkeeping-accounting-2-petty-cash-bank/,Paula Guilfoyle,34.99,11.99,4.1(27 ratings),Business,Finance,Accounting,226,English,A comprehensive and Professional guide to Bookkeeping and Accounting for Bank Transactions,10/2019,12/31/19
Cost and Managerial Accounting - Part 2,www.udemy.com/course/severson-managerial-accounting-part2/,Chris Severson,19.99,11.99,4.0(11 ratings),Business,Finance,Accounting,687,English,Understanding Budgets and Variance Analysis,8/2019,12/31/19
Intro to Financial Statements | Breezy CPA,www.udemy.com/course/financial-statements/,Philip J.,189.99,11.99,4.5(5 ratings),Finance & Accounting,Accounting & Bookkeeping,Accounting,"1,200",English,"Learn Accounting from Scratch from a Certified Public Accountant, CPA",7/2019,12/31/19
60 Minutes to Fundamental Accounting Skills,www.udemy.com/course/60-minute-fundamental-accounting-skills/,Illumeo Learning,74.99,11.99,4.3(344 ratings),Business,Finance,Accounting,"1,472",English,This course is for aspiring accounting or non-CPA finance professionals who want to improve their accounting skills.,6/2017,12/31/19
Master Budgets – Managerial Accounting/Cost Accounting,www.udemy.com/course/master-budgets-managerial-accountingcost-accounting/,Robert (Bob) Steele,199.99,11.99,3.5(6 ratings),Business,Strategy,Accounting,"4,735",English,Master budget-Components & order of the master budget & examples of each part including budgeted financial statements,4/2019,12/31/19
Finance and Accounting for Beginners to Intermediate,www.udemy.com/course/finance-and-accounting-for-beginners/,Chris Moore,94.99,11.99,4.4(36 ratings),Business,Finance,Accounting,"1,363",English,This course will help you understand finance and accounting from beginner to more advanced areas of accounting,3/2018,12/31/19
Accounting and Finance for Bankers - A Comprehensive Study,www.udemy.com/course/crash-course-on-financial-management/,"Raja Natarajan, B.Com., PGDBA, FCA",199.99,11.39,3.7(36 ratings),Business,Finance,Accounting,"3,258",English,Understand and appreciate Accounting and Finance nuances relevant for Bankers,11/2019,12/31/19
SOX 302: Internal Controls over Financial Reporting,www.udemy.com/course/sox-302-internal-controls-over-financial-reporting/,Illumeo Learning,74.99,11.39,4.4(16 ratings),Business,Finance,Accounting,86,English,This course provides a deeper understanding of the requirements behind SOX 302.,8/2017,12/31/19
"Not-for-Profit Accounting-Charities, Colleges, & Health Care",www.udemy.com/course/not-for-profit-accounting-charities-colleges-health-care/,Robert (Bob) Steele,199.99,11.39,3.6(4 ratings),Finance & Accounting,Accounting & Bookkeeping,Accounting,"1,834",English,Learn Not-for-Profit accounting from a practicing CPA,9/2019,12/31/19
Complete US Accounting Standards Based Accounting Course,www.udemy.com/course/accounting-courses-from-introduction-to-advance/,LetsTute Make it Easy,34.99,11.39,4.5(2 ratings),Finance & Accounting,Accounting & Bookkeeping,Accounting,"1,121",English,Learn accounting and make your accounting simple with our basic to advance accounting course : 2019-20,9/2019,12/31/19
Accounting 101: Detecting Accounting Fraud In 2020,www.udemy.com/course/detect-accounting-fraud-in-financial-reports/,"Chris Benjamin, MBA & CFO",49.99,11.39,4.3(14 ratings),Business,Finance,Accounting,528,English,"Learn how to detect common accounting frauds used by corporations such as Enron, Tyco, WorldCom and more in 2020!",10/2019,12/31/19
Sarbanes-Oxley (SOX) Testing,www.udemy.com/course/sarbanes-oxley-sox-testing/,Illumeo Learning,99.99,11.39,4.1(23 ratings),Business,Finance,Accounting,104,English,"This course focuses on the validation of operation, which is executed through a test of control within Sarbanes-Oxley.",8/2017,12/31/19
Accounting 101-Master Class for Understanding Business,www.udemy.com/course/master-key-financial-indicators-and-build-business-success/,Kieran McSherry (BSc Acc; PG Dip Acc; FCA ),19.99,11.39,4.7(23 ratings),Business,Finance,Accounting,141,English,"This business accounting course gives you a Financial Edge, learn with your #1 Chartered Accountant coach",10/2015,12/31/19
Regulation Practice Test 2019-20,www.udemy.com/course/regulation-practice-test-2019/,Sumaira Kousar,19.99,11.39,0.0(0 ratings),Business,Business Law,Accounting,13,English,Regulation.,5/2019,12/31/19
Accounting 101: Guide to Business Accounting,www.udemy.com/course/book-keeping-level-1-learn-accounting-in-6-8-hours-amazing/,Christos Pittis,49.99,11.39,3.7(26 ratings),Business,Finance,Accounting,"3,055",English,"Accounting:A comprehensive, easy-to-follow course on bookkeeping and accounting skills geared to business professionals",11/2014,12/31/19
Fundamentals of Accounting & Bookkeeping,www.udemy.com/course/fundamentals-of-accounting-for-beginners-bookkeeping-basics/,LetsTute Make it Easy,19.99,11.39,4.4(60 ratings),Business,Finance,Accounting,"2,318","English
 ",Learn the very basics of accounting in less than 2 hours - A beginners guide for bookkeeping and accounting.,11/2019,12/31/19
Filing with Companies House UK,www.udemy.com/course/filing-with-companies-house-uk/,Lisa Newton,29.99,11.39,4.1(17 ratings),Business,Finance,Accounting,91,English,Learn how to file the UK statutory annual return with Companies House (CH) and essential Company filing information,3/2018,12/31/19
Excel 4 Accounting & Bookkeeping - Master Lookup Functions,www.udemy.com/course/excel-4-accountants-bookkeepers-master-lookup-fuctions/,Paula Guilfoyle,34.99,11.39,4.2(162 ratings),Business,Finance,Accounting,"2,745",English,"Lookup to the right, Lookup to the left, Index, Match and Choose - Master Lookups Now",11/2017,12/31/19
Accounting for ECommerce Business A Complete Study,www.udemy.com/course/accounting-for-ecommerce-business-a-complete-study/,"Raja Natarajan, B.Com., PGDBA, FCA",39.99,11.39,4.2(31 ratings),Business,Finance,Accounting,"10,697",English,Comprehensive Course on E Commerce and its Accounting based on CA Final Syllabus,11/2019,12/31/19
"Accounting of Non profits, Single Entry & Bills of exchange",www.udemy.com/course/accounting-of-non-profits-single-entry-bill-of-exchange/,LetsTute Make it Easy,19.99,11.39,4.1(7 ratings),Business,Finance,Accounting,93,English,"Learn Accounting for Non Profit organisations, Incomplete records & Bill of Exchange (Negotiable instrument)",11/2019,12/31/19
Governmental Accounting 300 Proprietary & Fiduciary Funds,www.udemy.com/course/governmental-accounting-300-proprietary-fiduciary-funds/,Robert (Bob) Steele,199.99,11.39,0.0(0 ratings),Finance & Accounting,Accounting & Bookkeeping,Accounting,"1,911",English,Learn governmental fund accounting focusing in on proprietary funds (internal service & enterprise) and fiduciary funds.,9/2019,12/31/19
The Ultimate Accounting Refresher Course,www.udemy.com/course/the-ultimate-accounting-refresher-course/,Justin Lake,94.99,11.39,4.3(34 ratings),Business,Finance,Accounting,110,English,Learn introductory accounting in simple terms from an experienced Senior Finance Executive,7/2018,12/31/19
"Accounting Basics — Easy, Fast, & Fun for Beginners",www.udemy.com/course/goventureaccounting/,Mathew Georghiou,29.99,11.39,4.4(4 ratings),Finance & Accounting,Accounting & Bookkeeping,Accounting,14,English,Modern and innovative experiential learning methods to keep you engaged from start to finish,8/2019,12/31/19
