Course,URL,instructor,Price (full),Price (discount),Rank,Category 1,Category 2,Category 3,Enrollment,Language,Description,Last Update,Date Scraped
ACCA F3 - Financial Accounting Video Kurs / Tapoyren,www.udemy.com/course/accaf3financialaccounting/,ALISHOVS' EDUCATION,0.0,49.99,4.9(144 ratings),Business,Finance,Accounting,287,Azeri,"KEYFÄ°YYÆTÄ°N ADRESÄ°! Ä°mtahana HazÄ±rlÄ±q Ã¼Ã§Ã¼n ""ALISHOVS EDUCATÄ°ON"" Video KurslarÄ±.",9/2019,12/31/19
Muhasebecilik Mesleğine Giriş: Ön Muhasebe - Mali Müşavirlik,www.udemy.com/course/muhasebecilik-meslegine-giris-on-muhasebe-mali-musavirlik/,Uğur Tufan,44.99,11.39,4.4(31 ratings),Finans ve Muhasebe,Muhasebe ve Defter Tutma,Muhasebe,133,TÃ¼rkÃ§e,MuhasebeciliÄe saÄlam adÄ±mlarla baÅlayÄ±n. Ãn muhaseden SMMM'liÄe giden yolda yalnÄ±z deÄilsiniz!,12/2019,12/31/19
Diventa Impiegato/a Amministrativo/a: Basi di Contabilità,www.udemy.com/course/diventa-impiegatoa-amministrativoa-basi-di-contabilita/,Add Skills,29.99,11.39,4.2(7 ratings),Finanza e contabilitÃ ,ContabilitÃ  e registrazione contabile,Amministrazione,61,Italiano,ContabilitÃ  e Bilancio,7/2019,12/31/19
Curso de Cálculos Revisionais para Advogados e Contadores,www.udemy.com/course/curso-de-calculos-revisionais-para-advogados-e-contadores/,Diógenes Veiga,34.99,11.39,4.5(34 ratings),NegÃ³cios,FinanÃ§as,Contabilidade,195,PortuguÃªs,Aprenda a Elaborar CÃ¡lculos para AÃ§Ãµes Revisionais de Contratos BancÃ¡rios de EmprÃ©stimos e Financiamentos.,2/2019,12/31/19
Le Scritture di Assestamento. Un approccio semplice.,www.udemy.com/course/scritture-di-assestamento-un-approccio-semplice/,Marco Bianchi,154.99,11.39,4.5(33 ratings),Business,Dati & Analisi,Amministrazione,223,Italiano,Comanda la ContabilitÃ !,11/2017,12/31/19
１時間でサクッと学ぶ！会計職ではない人のための「現場で役立つ」会計知識,www.udemy.com/course/masukawa_014/,マスカワ シゲル,39.99,11.39,3.9(105 ratings),ãã¸ãã¹ã¹ã­ã«,ãã¡ã¤ãã³ã¹,ä¼è¨,372äººã®åè¬çãç»é²,æ¥æ¬èª,ç¾å ´ã§å½¹ç«ã¤ä¼è¨ç¥è­ãæ¬²ããï¼ã§ããã©ãããæãä»ãã¦ããã®ãããããªããç°¿è¨ï¼ç´ãã¨ã£ããã©ãä½¿ããç¥è­ãèº«ã«ã¤ããªãã£ããå½¹ã«ç«ã£ããä½¿ããäºä¾ããé¡ã£ã¦ãã©ãçããä¼è¨ç¥è­ã®ã¿ããå¹çããå­¦ç¿ã§ãããããã¶ã¤ã³ãããã³ã¼ã¹ã¯ãã¡ãï¼,12/2019,12/31/19
Contabilidade Completa para Investidores,www.udemy.com/course/contabilidade-completa-para-investidores/,Ademir Círico Junior,199.99,11.39,4.0(12 ratings),NegÃ³cios,Empreendedorismo,Contabilidade,128,PortuguÃªs,Aprenda tudo sobre tÃ©cnicas de avaliaÃ§Ã£o de empresas na PRÃTICA para investir em negÃ³cios de SUCESSO,11/2019,12/31/19
Contabilidade do Zero a Profissional    Módulo Essencial,www.udemy.com/course/realiza-contabilidade-essencial/,Realiza Treinamentos,59.99,11.39,4.4(12 ratings),FinanÃ§as e contabilidade,Contabilidade e escrituraÃ§Ã£o contÃ¡bil,Contabilidade,95,PortuguÃªs,"Aprenda de VERDADE, Alcance o PrÃ³ximo NÃ­vel e Mude a Sua Carreira",9/2019,12/31/19
CONTABILIDADE DE CUSTOS,www.udemy.com/course/contabilidade-de-custos-preparatorio-exame-de-suficiencia/,João Rafael Alberton,54.99,11.39,4.1(31 ratings),Desenvolvimento pessoal,Desenvolvimento de carreira,Contabilidade,351,PortuguÃªs,ConheÃ§a os meus outros dois cursos: CURSO HP 12C COM O AUXÃLIO DO EXCEL e CONTABILIDADE BÃSICA... dois Ã³timos cursos...,10/2019,12/31/19
Buchführung für Kleinunternehmer - Inklusive EÜR-Tool,www.udemy.com/course/buchfuehrung-fuer-kleinunternehmer/,David Zaißmann,24.99,11.39,3.9(22 ratings),Business,SelbststÃ¤ndigkeit,Rechnungswesen,215,Deutsch,Buchhaltung leicht gemacht mit der EinnahmenÃ¼berschussrechnung (EÃR),12/2018,12/31/19
"Como classificar os CST's de ICMS, IPI, PIS e COFINS",www.udemy.com/course/como-classificar-o-cst-de-icms-ipi-pis-e-cofins/,Learned Treinamentos e Capacitação,114.99,28.75,4.1(31 ratings),Ensino e estudo acadÃªmico,Outros tipos de ensino e estudo acadÃªmico,Contabilidade,67,PortuguÃªs,"Classificando os CST's de ICMS, IPI, PIS e COFINS",4/2019,12/31/19
Contabilità Generale,www.udemy.com/course/contabilita-generale/,Forever Learning,199.99,11.39,3.0(113 ratings),Business,Finanza,Amministrazione,349,Italiano,Nozioni per gestire le finanze,5/2017,12/31/19
Contabilidade tributária - Entenda o lucro real e presumido,www.udemy.com/course/contabilidade-tributaria-entenda-o-lucro-real-e-presumido/,Marteson Rocha,49.99,12.50,3.7(22 ratings),NegÃ³cios,AdministraÃ§Ã£o,Contabilidade,110,PortuguÃªs,Abordagem apenas tributos empresariais com destaque para LUCRO REAL e PRESUMIDO.,8/2019,12/31/19
Contabilidade para não contadores,www.udemy.com/course/contabilidade-para-nao-contadores/,Marteson Castelo Branco,54.99,13.75,4.0(44 ratings),NegÃ³cios,AdministraÃ§Ã£o,Contabilidade,202,PortuguÃªs,Uma linguagem simples mas sem abandonar a tÃ©cnica contÃ¡bil,8/2019,12/31/19
Introducción a la contabilidad,www.udemy.com/course/contabilidad-en-una-hora/,Emilio Alvarez Arjona,19.99,11.39,4.3(85 ratings),Business,Finance,Accounting,372,Spanish,Aprenda los conceptos bÃ¡sicos de la contabilidad y a hacer asientos contables de forma rÃ¡pida y amena.,1/2015,12/31/19
Contabilidade tributária,www.udemy.com/course/contabilidade-tributaria/,Marteson Castelo Branco,19.99,11.39,3.8(22 ratings),NegÃ³cios,Empreendedorismo,Contabilidade,81,PortuguÃªs,Ãnfase no lucro real e presumido,10/2019,12/31/19
連結会計速習講座2,www.udemy.com/course/diva_renketsu_sokusyu_2/,株式会社ディーバ 教育講座担当,24.99,11.39,4.0(16 ratings),ãã¸ãã¹ã¹ã­ã«,æ¥­çå¥ã¹ã­ã«,ä¼è¨,83äººã®åè¬çãç»é²,æ¥æ¬èª,æ¯éç²å¾æåã³ç²å¾å¾ã®è³æ¬é£çµãåé¨åå¼ã®æ¶å»,5/2018,12/31/19
Introdução a contabilidade e o direito tributário básico,www.udemy.com/course/introducao-a-contabilidade-e-o-direito-tributario-basicos/,Marteson Castelo Branco,24.99,11.39,4.7(15 ratings),NegÃ³cios,AdministraÃ§Ã£o,Contabilidade,86,PortuguÃªs,IntroduÃ§Ã£o a contabilidade e a legislaÃ§Ã£o tributÃ¡ria,5/2019,12/31/19
Ganime Ünlü - Muhasebe Soru Çözümü,www.udemy.com/course/ganime-unlu-muhasebe-soru-cozumu/,Soru Bankası,119.99,11.39,4.9(17 ratings),ÃÄretim ve Akademi,SÄ±nava HazÄ±rlÄ±k,Muhasebe,89,TÃ¼rkÃ§e,"KPSS A, SMMM ve Kurum SÄ±navlarÄ±na girmeden Ã¶nce muhasebe konularÄ± tekrar edebileceÄiniz kapsamlÄ± bir Ã§alÄ±Åma.",7/2019,12/31/19
Zelf je BTW aangifte doen voor ZZP'ers (2019 update),www.udemy.com/course/diybtwzzp/,Patricia van der Stek,39.99,11.99,4.0(16 ratings),Zakelijk,FinanciÃ«n,Boekhouding,93,Nederlands,DIY BTW voor ZZP,3/2019,12/31/19
連結会計速習講座4,www.udemy.com/course/diva_renketsu_sokusyu_4/,株式会社ディーバ 教育講座担当,24.99,11.99,4.4(7 ratings),ãã¸ãã¹ã¹ã­ã«,æ¥­çå¥ã¹ã­ã«,ä¼è¨,79äººã®åè¬çãç»é²,æ¥æ¬èª,éå§ä»è¨³ãç¨å¹æä¼è¨ãé£çµç²¾ç®è¡¨ç­ã®ä½æ,5/2018,12/31/19
連結会計速習講座3,www.udemy.com/course/diva_renketsu_sokusyu_3/,株式会社ディーバ 教育講座担当,24.99,11.99,4.0(12 ratings),ãã¸ãã¹ã¹ã­ã«,æ¥­çå¥ã¹ã­ã«,ä¼è¨,79äººã®åè¬çãç»é², æ¥æ¬èª,è²¸åå¼å½éã®èª¿æ´ãæªå®ç¾æçã®æ¶å»ï¼ããªå¸è³ç£/åºå®è³ç£ï¼,2/2018,12/31/19
Contabilidade para não contadores 2.0,www.udemy.com/course/contabilidade-para-nao-contadores-20/,Marteson Castelo Branco,29.99,11.99,4.0(1 rating),FinanÃ§as e contabilidade,Contabilidade e escrituraÃ§Ã£o contÃ¡bil,Contabilidade,19,PortuguÃªs,Com anÃ¡lise avanÃ§ada da DRE e BalanÃ§o patrimonial,10/2019,12/31/19
Bilmeyene Muhasebe (Sıfır Seviyesi) - Muhasebenin Mantığı,www.udemy.com/course/muhasebenin-mantigi-nedir/,Aydın Tuzcu,49.99,11.99,4.6(117 ratings),Finans ve Muhasebe,Muhasebe ve Defter Tutma,Muhasebe,294,TÃ¼rkÃ§e,"ÃdÃ¼llÃ¼ Mali MÃ¼Åavirden, Ãok Basit AnlatÄ±m Ä°le ""Muhasebeye GiriÅ""",1/2018,12/31/19
Contabilidade Comercial e Financeira,www.udemy.com/course/contabilidade-comercial-e-financeira/,Juarez Lira de Souza,39.99,11.99,4.4(2 ratings),FinanÃ§as e contabilidade,Contabilidade e escrituraÃ§Ã£o contÃ¡bil,Contabilidade,27,PortuguÃªs,Aprender contabilizaÃ§Ã£o de forma completa. ConheÃ§a tambÃ©m o meu curso de Contabilidade de Custos,10/2019,12/31/19
Contabilidad Electrónica en México,www.udemy.com/course/contabilidad-electronica/,Cesar Aurelio Ceballos Peña,49.99,11.99,4.2(32 ratings),Business,Other,Accounting,185,Spanish,CÃ³mo cumplir con esta nueva obligaciÃ³n fiscal y que informaciÃ³n sensible hay que cuidar para evitar inconvenientes,5/2017,12/31/19
Corso per Impiegato Contabile,www.udemy.com/course/corso-per-impiegato-contabile/,Add Skills,29.99,11.99,3.8(6 ratings),Finanza e contabilitÃ ,ContabilitÃ  e registrazione contabile,Amministrazione,14,Italiano,Basi pratiche con il gestionale SimplyFatt,7/2019,12/31/19
Sped Contábil (ECD) e (ECF),www.udemy.com/course/sped-contabil-ecd-e-ecf/,Everson Hirt,34.99,11.99,4.3(4 ratings),Produtividade no escritÃ³rio,Outro,Contabilidade,45,PortuguÃªs,EscrituraÃ§Ã£o ContÃ¡bil Digital e EscrituraÃ§Ã£o ContÃ¡bil Fiscal,5/2019,12/31/19
Entiende la contabilidad,www.udemy.com/course/fundamentos_de_contabilidad_foli/,Foli Centre d'Estudis,44.99,11.99,4.0(43 ratings),Negocios,Finanzas,Contabilidad,388,EspaÃ±ol,"El diario, el mayor y los balances no tendrÃ¡n secretos para ti",10/2019,12/31/19
Contabilidade societária e tributária,www.udemy.com/course/contabilidade-societaria-e-tributaria/,Turma da contabilidade,0.0,19.99,4.0(1 rating),FinanÃ§as e contabilidade,Contabilidade e escrituraÃ§Ã£o contÃ¡bil,Contabilidade,15,PortuguÃªs,2 cursos em 1. Abordando o lucro real e presumido.,8/2019,12/31/19
Contabilidad Gubernamental en México,www.udemy.com/course/contabilidad-gubernamental/,Universidad Meridiano,29.99,11.99,4.5(46 ratings),Business,Finance,Accounting,355,Spanish,Curso creado para conocer y aplicar conceptos derivados del marco legal de contabilidad gubernamental.,8/2015,12/31/19
Ön Muhasebeci Olun Muhasebe Öğrenin,www.udemy.com/course/on_muhasebeci_olun/,Burak Çokça,69.99,11.99,3.6(55 ratings),Ä°Åletme,Finans,Muhasebe,147,TÃ¼rkÃ§e,Ä°Åletmelerin Ã¶n muhasebesinde Ã§alÄ±Åmak isteyen ama hiÃ§bir bilgisi olmayan kiÅiler bu kurs tam size gÃ¶re,3/2019,12/31/19
Contabilidade Aplicada ao Setor Público,www.udemy.com/course/contabilidade-aplicada-ao-setor-publico/,Universidade Estácio,29.99,11.99,4.5(49 ratings),Ensino e estudo acadÃªmico,CiÃªncias humanas,Contabilidade,235,PortuguÃªs,Prof. Rogerio Antonio da Silva,1/2018,12/31/19
Fundamentos de Contabilidad,www.udemy.com/course/fundamentos-de-contabilidad-practica/,José Bazalar,44.99,11.99,4.2(5 ratings),Negocios,Finanzas,Contabilidad,21,EspaÃ±ol,Curso BÃ¡sico para aprender sobre los Estados Financieros,11/2019,12/31/19
Aprende a llevar la contabilidad con el ContaPlus,www.udemy.com/course/aprende-a-llevar-la-contabilidad-con-el-contaplus/,Pedro Carmona Ibáñez,24.99,11.99,3.1(3 ratings),Business,Finance,Accounting,28,Spanish,El ContaPlus como herramienta para la llevanza de la contabilidad,4/2018,12/31/19
Administração de Salão de Beleza e Barbearia,www.udemy.com/course/administracao-de-saloes-de-beleza-e-barbearias/,Mario Neubern,74.99,11.39,4.5(4 ratings),NegÃ³cios,Empreendedorismo,Contabilidade,19,PortuguÃªs,"Como aumentar o LUCRO de SalÃµes, Barbearias e Estudios de EstÃ©tica atravÃ©s da GestÃ£o",10/2019,12/31/19
Basics of Accounting (தமிழ் மொழியில் கணக்கியல் அடிப்படைகள்),www.udemy.com/course/accounting-in-tamil/,"Raja Natarajan, B.Com., PGDBA, FCA",199.99,11.39,4.7(13 ratings),Business,Finance,Accounting,66,Tamil,Guide for learning Basics of Accountancy in Tamil ( à®¤à®®à®¿à®´à¯ à®®à¯à®´à®¿à®¯à®¿à®²à¯ à®à®£à®à¯à®à®¿à®¯à®²à¯ à®à®à®¿à®ªà¯à®ªà®à¯à®¯à¯ à®à®±à¯à®±à¯à®à¯à®à¯à®³à¯à®µà®¤à®±à¯à®à®¾à®© à®µà®´à®¿à®à®¾à®à¯à®à®¿),11/2019,12/31/19
Contabilidade Geral,www.udemy.com/course/contabilidade-geral/,Karina Rocha Henriques Gehlen,39.99,11.39,4.0(20 ratings),Ensino e estudo acadÃªmico,Outros tipos de ensino e estudo acadÃªmico,Contabilidade,93,PortuguÃªs,NoÃ§Ãµes de Contabilidade Geral com exercÃ­cios prÃ¡ticos,7/2019,12/31/19
ECD - Escrituração Contábil Digital,www.udemy.com/course/ecd-escrituracao-contabil-digital/,Learned Treinamentos e Capacitação,159.99,40.00,4.7(4 ratings),NegÃ³cios,Dados e anÃ¡lises,Contabilidade,11,PortuguÃªs,ECD - EscrituraÃ§Ã£o ContÃ¡bil Digital,4/2019,12/31/19
Controlling - Einstieg ins Kostenmanagement,www.udemy.com/course/controlling-einstieg-ins-kostenmanagement/,Kristoffer Ditz,24.99,11.39,0.0(0 ratings),Finanzen & Rechnungswesen,Rechnungswesen & Buchhaltung,Rechnungswesen,7,Deutsch,"Lernen Sie die Grundlagen, wie Sie effektiv Kosten einsparen und analysieren kÃ¶nnen",11/2019,12/31/19
Odoo Functional Implementation Guide | Accounting,www.udemy.com/course/o-fig-acc/,Yossef Elsherif. CMA,129.99,11.39,4.6(25 ratings),IT & Software,Other,Accounting,318,Arabic,Odoo Implementation from scratch till Go Live,8/2019,12/31/19
Simples Nacional (aprendendo a calcular tributos),www.udemy.com/course/simples-nacional-aprendendo-a-calcular-tributos/,Marteson Castelo Branco,19.99,11.39,4.5(14 ratings),NegÃ³cios,FinanÃ§as,Contabilidade,48,PortuguÃªs,Identificar anexos e calcular alÃ­quota efetiva,5/2019,12/31/19
Contabilidad Básica Super Fácil,www.udemy.com/course/contabilidad-basica-super-facil/,Jair Herrera Ruiz,19.99,11.39,4.3(12 ratings),Negocios,GestiÃ³n empresarial,Contabilidad,54,EspaÃ±ol,Fundamentos de Contabilidad para principiantes de la forma mÃ¡s prÃ¡ctica y sencilla hoy en dÃ­a en Internet,9/2015,12/31/19
Tutto Carburanti,www.udemy.com/course/tutto-carburanti/,Stefano Failla,0.0,69.99,0.0(0 ratings),Business,Management,Amministrazione,1,Italiano,Come gestire gli acquisti di carburante in base alle nuove regole fiscali.,6/2018,12/31/19
Análise das Demonstrações Contábeis,www.udemy.com/course/analise-das-demonstracoes-contabeis/,João Rafael Alberton,54.99,11.39,4.3(2 ratings),Desenvolvimento pessoal,Desenvolvimento de carreira,Contabilidade,27,PortuguÃªs,Para quem quer aprender a fazer anÃ¡lise das demonstraÃ§Ãµes contÃ¡beis e a prova do exame de suficiÃªncia em contabilidade,7/2019,12/31/19
Contabilidade para Empreendedores Digitais,www.udemy.com/course/contabilidade-para-empreendedores-digitais/,Ademir Círico Junior,44.99,11.39,5.0(2 ratings),NegÃ³cios,Empreendedorismo,Contabilidade,70,PortuguÃªs,Aprendizagem completa sobre contabilidade voltada ao empreendedorismo digital,3/2019,12/31/19
KPSS A  MUHASEBE -SMMM (MUSA TEKŞAN Detaylı 380 Soru Çözümü),www.udemy.com/course/smmm_kpss_muhasebe/,Soru Bankası,199.99,11.39,4.6(9 ratings),ÃÄretim ve Akademi,SÄ±nava HazÄ±rlÄ±k,Muhasebe,236,TÃ¼rkÃ§e,"KPSS A, SMMM ve Kurum SÄ±navlarÄ±na girmeden Ã¶nce muhasebe konularÄ± tekrar edebileceÄiniz kapsamlÄ± bir Ã§alÄ±Åma.",10/2018,12/31/19
المحاسبة للإداريين و غير المحاسبين,www.udemy.com/course/accounting-for-non-accountants-trendcast/,عماد ملكاوي,19.99,11.39,4.0(12 ratings),Business,Finance,Accounting,42,Arabic,Ø¯ÙÙÙ Ø§ÙØ¥Ø¯Ø§Ø±ÙÙÙ Ù ØºÙØ± Ø§ÙÙØ­Ø§Ø³Ø¨ÙÙ ÙÙÙØ­Ø§Ø³Ø¨Ø©,4/2016,12/31/19
Curso Completo de Contabilidade Geral: Teoria e Prática,www.udemy.com/course/curso-completo-de-contabilidade-geral-teoria-e-pratica/,Ademir Círico Junior,39.99,11.39,4.3(19 ratings),Ensino e estudo acadÃªmico,EducaÃ§Ã£o online,Contabilidade,170,PortuguÃªs,"Aprenda sobre a teoria e a prÃ¡tica contÃ¡bil de forma prÃ¡tica, clara e objetiva",6/2019,12/31/19
Introducción a la Contabilidad,www.udemy.com/course/introduccion-a-la-contabilidad/,Neumann Business School,0.0,29.99,4.1(41 ratings),Business,Finance,Accounting,"1,251",Spanish,AprenderÃ¡s los conceptos bÃ¡sicos y estarÃ¡s preparado para introducirte al mundo de las ciencias contables.,1/2016,12/31/19
Contabilidade para não contadores 2.0 (com análise avançada),www.udemy.com/course/contabilidade-para-nao-contadores-20-com-analise-avancada/,Fábrica de Empreendedores,0.0,19.99,2.5(1 rating),FinanÃ§as e contabilidade,Contabilidade e escrituraÃ§Ã£o contÃ¡bil,Contabilidade,13,PortuguÃªs,Com anÃ¡lise avanÃ§ada das demonstraÃ§Ãµes contÃ¡beis,9/2019,12/31/19
SMMM / KPSS A - Muhasebe ( Ayrıntılı Soru Çözümü ),www.udemy.com/course/muhasebe/,Soru Bankası,199.99,11.39,4.6(10 ratings),ÃÄretim ve Akademi,SÄ±nava HazÄ±rlÄ±k,Muhasebe,152,TÃ¼rkÃ§e,"SMMM, KPSS A ve Kurum sÄ±navlarÄ±na girmeden Ã¶nce muhasebe konularÄ± tekrar edebileceÄiniz kapsamlÄ± bir Ã§alÄ±Åma.",9/2018,12/31/19
Formação em Contabilidade Online,www.udemy.com/course/formacao-em-contabilidade-online/,Ademir Círico Junior,104.99,11.39,4.0(5 ratings),NegÃ³cios,Empreendedorismo,Contabilidade,64,PortuguÃªs,Empreenda em Contabilidade Online de maneira rÃ¡pida e prÃ¡tica,2/2019,12/31/19
Contabilidad de los Gastos de Personal,www.udemy.com/course/contabilidad-de-los-gastos-de-personal/,Isabelle O.A.,39.99,11.39,3.6(2 ratings),Negocios,Finanzas,Contabilidad,14,EspaÃ±ol,Aprende a registrar todos los gastos de personal.,2/2017,12/31/19
Contabilidade básica,www.udemy.com/course/contabilidade-basica/,Marteson Castelo Branco,19.99,11.39,4.0(25 ratings),NegÃ³cios,AdministraÃ§Ã£o,Contabilidade,56,PortuguÃªs,IntroduÃ§Ã£o geral contabilidade.,5/2019,12/31/19
Bloco X,www.udemy.com/course/bloco-x-o/,Learned Treinamentos e Capacitação,159.99,40.00,0.0(0 ratings),FinanÃ§as e contabilidade,Contabilidade e escrituraÃ§Ã£o contÃ¡bil,Contabilidade,2,PortuguÃªs,ReduÃ§Ã£o Z e controle de estoque no emissor de cupom fiscal PAF - ECF,6/2019,12/31/19
Curso Exame de Suficiência do CFC - Contadores,www.udemy.com/course/curso-exame-de-suficiencia-do-cfc-contadores/,Ramon da Silva,0.0,64.99,4.2(3 ratings),NegÃ³cios,AdministraÃ§Ã£o,Contabilidade,33,PortuguÃªs,ResoluÃ§Ã£o de QuestÃµes das Provas nÂº 1 e 2,4/2019,12/31/19
"Contabilidad Para Principiantes (sencilla, fácil y práctica)",www.udemy.com/course/contabilidad-para-principiantes-sencilla-facil-y-practica/,Jota Eme Rojas Gonz,24.99,11.39,0.0(0 ratings),Negocios,Finanzas,Contabilidad,2,EspaÃ±ol,"los principios de contabilidad generalmente aceptados, asientos contables, balance general, estado de resultados",10/2018,12/31/19
Introdução às Demonstrações Financeiras (Contabilidade),www.udemy.com/course/introducao-as-demonstracoes-financeiras-contabilidade/,Rogerio Buso,89.99,11.39,3.5(1 rating),FinanÃ§as e contabilidade,Contabilidade e escrituraÃ§Ã£o contÃ¡bil,Contabilidade,9,PortuguÃªs,IntroduÃ§Ã£o Ã s DemonstraÃ§Ãµes Financeiras (Contabilidade) - A Linguagem Universal do Mundo dos NegÃ³cios,10/2019,12/31/19
Contabilidade Introdutória para TODOS os públicos,www.udemy.com/course/contabilidade-introdutoria-para-todos-os-publicos/,Marcos Rodrigues,19.99,11.39,5.0(2 ratings), FinanÃ§as e contabilidade,Contabilidade e escrituraÃ§Ã£o contÃ¡bil,Contabilidade,12,PortuguÃªs,"Conhecimento nunca Ã© demais. Mergulhe pelos conceitos contÃ¡beis, demonstraÃ§Ãµes financeiras e indicadores conosco.",7/2019,12/31/19
Contabilidade Geral com Tecnologia na PRÁTICA,www.udemy.com/course/contabilidade-geral-com-tecnologia-na-pratica/,Ademir Círico Junior,49.99,11.39,4.3(5 ratings),NegÃ³cios,Empreendedorismo,Contabilidade,201,PortuguÃªs,"Aprenda sobre Contabilidade Geral por meio de visÃµes prÃ¡ticas, abordagens claras e objetivas com o uso da Tecnologia",5/2019,12/31/19
Finansal Muhasebe,www.udemy.com/course/finansal-muhasebe/,Mehmet Can Yumuşaker,19.99,11.39,2.8(11 ratings),Ä°Åletme,Finans,Muhasebe,60,TÃ¼rkÃ§e,Muhasebe UzmanlÄ±ÄÄ±,6/2018,12/31/19
دبلومة المحاسبة الشاملة,www.udemy.com/course/khozthqx/,Crest for Development Solutions,199.99,50.00,0.0(0 ratings),Finance & Accounting,Accounting & Bookkeeping,Accounting,1,Arabic,Ø¯Ø¨ÙÙÙØ© Ø§ÙÙØ­Ø§Ø³Ø¨Ø© Ø§ÙØ´Ø§ÙÙØ©,8/2019,12/31/19
Contabilidad de la Periodificación Contable,www.udemy.com/course/contabilidad-de-la-periodificacion-contable/,Isabelle O.A.,39.99,11.39,0.0(0 ratings),Negocios,Finanzas,Contabilidad,10,EspaÃ±ol,Aprende a calcular el beneficio o pÃ©rdida de una empresa,7/2017,12/31/19
Ganho de Capital de bens com Ajuste ao Valor Presente - AVP,www.udemy.com/course/ganho-de-capital-com-avp/,Learned Treinamentos e Capacitação,49.99,12.50,0.0(0 ratings),FinanÃ§as e contabilidade,Contabilidade e escrituraÃ§Ã£o contÃ¡bil,Contabilidade,2,PortuguÃªs,ApuraÃ§Ã£o de ganhos de capital na venda de bens do imobilizado ajustados a valor presente - AVP na aquisiÃ§Ã£o,7/2019,12/31/19
Cómo Crear Políticas Contables bajo NIIF para PYMES,www.udemy.com/course/como-crear-politicas-contables-bajo-niif-para-pymes/,Yasmin Perez,19.99,11.39,4.1(24 ratings),Business,Finance,Accounting,62,Spanish,Modelo de creaciÃ³n de PolÃ­ticas y Procedimientos contables. Incluye Formatos editables para comenzar ahora mismo.,8/2015,12/31/19
"Ressarcimento do ICMS ST, DRCST e Mudanças do ICMS ST",www.udemy.com/course/ressarcimento-restituicao-e-complementacao-do-icms-st/,Learned Treinamentos e Capacitação,159.99,40.00,4.7(2 ratings),NegÃ³cios,FinanÃ§as,Contabilidade,8,PortuguÃªs,"Novas regras para ressarcimento, restituiÃ§Ã£o e complementaÃ§Ã£o do ICMS ST, DRCST e principais mudanÃ§as 2019.",5/2019,12/31/19
Curso Completo sobre Constituição do MEI na PRÁTICA,www.udemy.com/course/curso-completo-sobre-constituicao-do-mei-na-pratica/,Ademir Círico Junior,24.99,11.99,3.9(2 ratings),NegÃ³cios,Empreendedorismo,Contabilidade,27,PortuguÃªs,"Aprenda do ZERO tudo o que vocÃª precisa saber ANTES, DURANTE e DEPOIS da constituiÃ§Ã£o da sua empresa do MEI na PRÃTICA",8/2019,12/31/19
Contabilidad de los Gastos e Ingresos de Explotación,www.udemy.com/course/contabilidad-de-los-gastos-e-ingresos-de-explotacion/,Isabelle O.A.,49.99,12.50,0.0(0 ratings),Negocios,Finanzas,Contabilidad,15,EspaÃ±ol,Domina la contabilizaciÃ³n de las cuentas de gastos e ingresos.,4/2017,12/31/19
Contabilidad pública: Presupuesto de Gastos e Ingresos,www.udemy.com/course/contabilidad-publica-presupuesto-de-gastos-e-ingresos/,Fernández Almagro,19.99,11.99,2.4(4 ratings),EnseÃ±anzas y disciplinas acadÃ©micas,Ciencias sociales,Contabilidad,20,EspaÃ±ol,Conoce y contabiliza las operaciones mÃ¡s relevantes de las Administraciones PÃºblicas.,10/2015,12/31/19
التدريب العملي للمحاسبة في الشركات في مصر,www.udemy.com/course/practical-training-for-accounting-in-companies-in-egypt/,Ahmed Shaban,199.99,11.99,0.0(0 ratings),Business,Finance,Accounting,4,Arabic,Ø§ÙØªØ¯Ø±ÙØ¨ Ø§ÙØ¹ÙÙÙ ÙÙÙØ­Ø§Ø³Ø¨Ø© ÙÙ Ø§ÙØ´Ø±ÙØ§Øª ÙÙ ÙØµØ±,7/2018,12/31/19
Contabilidade Básica - II,www.udemy.com/course/contabilidade-basica-ii/,Camila Sá,19.99,11.99,0.0(0 ratings),NegÃ³cios,Empreendedorismo,Contabilidade,8,PortuguÃªs,Aprenda como Apurar resultado e registrar compra e venda de mercadorias,5/2019,12/31/19
Noções de Contabilidade para Empreendedores,www.udemy.com/course/nocoes-de-contabilidade-para-empreendedores/,Ademir Círico Junior,34.99,11.99,3.5(2 ratings),FinanÃ§as e contabilidade,Contabilidade e escrituraÃ§Ã£o contÃ¡bil,Contabilidade,11,PortuguÃªs,"Aprenda na PRÃTICA sobre aspectos contÃ¡beis, noÃ§Ãµes empresariais, societÃ¡rias, tributÃ¡rias, fiscais e trabalhistas",6/2019,12/31/19
Belajar GF Akuntansi Express,www.udemy.com/course/belajar-gf-akuntansi-express/,Gigantara Int,19.99,11.99,3.5(1 rating),TI dan Perangkat Lunak,Lainnya,Akuntansi,13,Indonesia,GF Akuntansi,11/2019,12/31/19
FPw Intermediário - Sistema de Folha de Pagamento,www.udemy.com/course/fpw-intermediario-sistema-de-folha-de-pagamento/,Marco Antonio Chinarelli,0.0,34.99,0.0(0 ratings),TI e software,Sistemas operacionais,Contabilidade,2,PortuguÃªs,"Curso FPw IntermediÃ¡rio (Cadastro e CÃ¡culos, EmissÃµes, Interface ContÃ¡bil, AutorizaÃ§Ã£o e Centro de Ajuda)",1/2019,12/31/19
Contabilidad Fácil de Aprender,www.udemy.com/course/contabilidad-facil-de-aprender/,Elizabeth Ramirez,19.99,11.99,5.0(1 rating),Business,Finance,Accounting,11,Spanish,Fundamentos contables,11/2018,12/31/19
