Course,URL,instructor,Price (full),Price (discount),Rank,Category 1,Category 2,Category 3,Enrollment,Language,Description,Last Update,Date Scraped
How to Design A 2D Character in Illustrator,www.udemy.com/course/2d-character-in-illustrator/,HU Shahir,19.99,11.39,2.7(4 ratings),Design,Graphic Design,Adobe Illustrator,12,English,Design a 2D Character in Adobe Illustrator if you don't have any experience in character design .,2/2017,12/29/19
The Power of Tools: Adobe Illustrator Edition,www.udemy.com/course/the-power-of-tools-adobe-illustrator-edition/,Hans Fleurimont,19.99,11.99,4.5(2 ratings),Design,Design Tools,Adobe Illustrator,2,English,Basics & fundamentals for 33 tools you can use in adobe illustrator,5/2019,12/29/19
How to Create 25 Flat Tree Designs in Illustrator,www.udemy.com/course/how-to-create-25-flat-tree-designs-in-illustrator/,Skillay Academy,19.99,11.99,5.0(4 ratings),Design,Graphic Design,Adobe Illustrator,21,English,Learn how to illustrate 25 flat tree icons in Adobe Illustrator,5/2018,12/29/19
How to Create illustration painting with vectors,www.udemy.com/course/how-to-create-illustration-painting-with-vectors/,Alireza Etemadi | Marketing Strategy Expert |,19.99,11.99,4.0(15 ratings),Design,Graphic Design,Vector Graphic,"1,782",English,"Learn to Make your hand stronger, how to draw and add color with adobe illustartor",9/2017,12/29/19
How to Design A 2D Character in Illustrator,www.udemy.com/course/2d-character-in-illustrator/,HU Shahir,19.99,11.99,2.7(4 ratings),Design,Graphic Design,Adobe Illustrator,12,English,Design a 2D Character in Adobe Illustrator if you don't have any experience in character design .,2/2017,12/29/19
Learn Adobe Illustrator and Premiere Pro in 1 hour,www.udemy.com/course/learn-adobe-illustrator-and-premiere-pro-in-1-hour/,Nicolas Camara,29.99,11.99,0.0(0 ratings),Design,Graphic Design,Adobe Illustrator,3,English,2 Softwares in 1 Course! Yes! You will learn Adobe Premiere and Illustrator in 1 hour,6/2017,12/29/19
Make a Game Background in Adobe Illustrator for Beginners!,www.udemy.com/course/gamebackground-adobeillustrator/,Mammoth Interactive,99.99,11.99,4.0(2 ratings),Design,Game Design,Adobe Illustrator,14,English,"Learn to draw a park scene for games. A Compact Course on Adobe Illustrator, developed for highly efficient learning.",9/2017,12/29/19
Most Wanted Flat Design Techniques #2: Hipster Businessman,www.udemy.com/course/flat-design-flat-ui-design-flat-colors-flat-design-hipster-businessman/,Dawid Tuminski,94.99,11.99,4.8(8 ratings),Design,Graphic Design,Adobe Illustrator,"1,034",English,Flat design : How to create advanced flat design projects Most wanted flat design techniques Flat design in Illustrator,1/2017,12/29/19
Adobe holiday season bundle,www.udemy.com/course/adobe-holiday-season-bundle/,John Bura,169.99,11.99,3.8(21 ratings),Design,Design Tools,Adobe Illustrator,"4,090",English,"Learn how to make holiday related content with Illustrator, Photoshop and After Effects!",9/2014,12/29/19
Adobe Illustrator Foundation course for beginners,www.udemy.com/course/adobe-illustrator-foundation/,Rawson Uddin,99.99,11.99,0.0(0 ratings),Design,Graphic Design,Adobe Illustrator,0,English,Best Beginner Course for Adobe Illustrator,2/2017,12/29/19
Adobe Illustrator basics,www.udemy.com/course/gdo-adobe-illustrator-basics/,Gabriel Ortolan,24.99,11.99,0.0(0 ratings),Design,Graphic Design,Adobe Illustrator,2,English,It's time to learn once and for all the basics of Adobe Illustrator!,10/2018,12/29/19
Basic: Adobe Illustrator for Merch by Amazon,www.udemy.com/course/basic-adobe-illustrator-for-merch-by-amazon/,Merch Maniacs,0.0,24.99,4.6(82 ratings), Design,Design Tools,Adobe Illustrator,675,English,The basics on learning how to use Adobe Illustrator to create designs for Merch by Amazon,5/2016,12/29/19
QuickStart! - Adobe Illustrator CC,www.udemy.com/course/quickstart-adobe-illustrator-cc-vtc/,VTC Software Training,0.0,19.99,0.0(0 ratings),Design,Design Tools,Adobe Illustrator,5,English,Get started right away using Adobe's industry standard for creating beautiful and clean vector artwork and logos,9/2013,12/29/19
Adobe Illustrator makes me 3000/pm -Retouching Logo Designs,www.udemy.com/course/adobe-illustrator-for-beginners-retouching-logo-designs/,Ankam Academy,19.99,11.99,4.0(24 ratings),Business,Home Business,Logo Design,762,English,Learn practical Illustrator skills focused on logo design and retouching,10/2015,12/29/19
Learn to Create Easy Wreath Brushes in Adobe Illustrator,www.udemy.com/course/custom-wreath-brushes-in-illustrator/,Deanna Sheehan,19.99,11.99,4.7(7 ratings),Design,Graphic Design,Adobe Illustrator,602,English,"Easily Create Complex Brushes in Illustrator for Logos, using Blends, and the Transform Panel in Adobe Illustrator",11/2017,12/29/19
Advanced Features in Adobe Illustrator,www.udemy.com/course/advanced-features-in-adobe-illustrator/,Bode Ogbe,29.99,11.99,2.2(8 ratings),Design,Graphic Design,Adobe Illustrator,"1,356",English,Advanced Guide to Learning Adobe Illustrator,10/2016,12/29/19
Make Logo design pay with illustrator in less than a day,www.udemy.com/course/designing-logos-with-illustrator-beginners-to-advanced/,David Newton,49.99,11.99,1.0(1 rating),Design,Graphic Design,Adobe Illustrator,28,English,"Learn how to create stunning Logos with Illustrator, this course is set up for Beginners to Advanced users.",3/2017,12/29/19
Adobe Illustrator for Absolute Beginners,www.udemy.com/course/adobe-illustrator-for-absolute-beginners/,Eduonix Learning Solutions,49.99,11.39,3.8(89 ratings),Design,Design Tools,Adobe Illustrator,"10,022",English,Learn to master Adobe Illustrator with real world examples,12/2018,12/29/19
How to Make Volumetric Art in Adobe Illustrator,www.udemy.com/course/how-to-make-patterned-3d-shapes-in-adobe-illustrator/,Aleksey Shlenchik,19.99,11.39,4.0(7 ratings),Design,Graphic Design,Adobe Illustrator,872,English,"Learn Adobe Illustrator by making custom patterned textures, 3D shapes and finalizing with Photoshop",4/2018,12/29/19
Learn Adobe Illustrator in One Hour!,www.udemy.com/course/1hourillustrator/,Jason Buff,19.99,11.39,3.6(140 ratings),Design,Graphic Design,Adobe Illustrator,"4,582",English,Getting comfortable with Adobe Illustrator is quick and easy. I will show you how to get up and running in not time.,7/2015,12/29/19
Adobe Illustrator: Creativity Completely Uncovered,www.udemy.com/course/adobe-illustrator-creativity-completely-uncovered/,Joshua Geiger,0.0,29.99,5.0(2 ratings),Design,Design Tools,Adobe Illustrator,42,English,51 Videos - 41 Downloadable Illustrator Files - 1080p HD Video - All from the SuiteTuts Adobe Certified Instructors,1/2014,12/29/19
Make tech circles in Adobe Illustrator in 30 minutes,www.udemy.com/course/make-tech-circles-in-adobe-illustrator-in-30-minutes/,John Bura,199.99,11.39,4.5(60 ratings),Design,Graphic Design,Adobe Illustrator,947,English,Learn to make fancy tech circles in Adobe Illustrator. Upgrade your skills in just 30 minutes.,10/2015,12/29/19
Adobe 9A0-351 Adobe Illustrator CC Recertification New Exam,www.udemy.com/course/adobe-9a0-351-adobe-illustrator-cc-recertification-new-exam/,Prep For Certifications Pass-Certs,34.99,11.39,0.0(0 ratings),IT & Software,IT Certification,Adobe Illustrator,0,English,Before Taking Official Exam This test will help you to pass your exam,12/2019,12/29/19
Golden Ratio Logo Design Master Class,www.udemy.com/course/golden-ratio-logo-design-master-class/,Moegamat Saleem,0.0,19.99,3.8(24 ratings),Design,Graphic Design,Adobe Illustrator,"3,144",English,Golden Ratio Logo Design Master Class,7/2019,12/29/19
Gestalt Principles & Pattern Design : Create Festive Pattern,www.udemy.com/course/gestalt-principles-surface-pattern-design-create-festive-pattern/,Shubham Sharma,49.99,11.39,0.0(0 ratings),Design,Graphic Design,Surface Pattern Design,341,English,"Create Beautiful Festive Patterns Using The Gestalt Principles, Learn The Process, Techniques",4/2017,12/29/19
Adobe Illustrator CC 2020: Learn Illustrator from Scratch,www.udemy.com/course/adobe-illustrator-cc-2020-from-scratch-bonus-100-vectors/,Fakhar Ayub,199.99,11.39,0.0(0 ratings),Design,Graphic Design,Adobe Illustrator,0,English,"Adobe Illustrator CC 2020- 100+ Vectors(Icons,Design elements, Logos, Invitation card, Business card, Infographics",12/2019,12/29/19
Illustrator CC for Photoshop Users,www.udemy.com/course/illustrator-cc-for-photoshop-users/,Dave Cross,29.99,11.39,0.0(0 ratings),Design,Graphic Design,Adobe Illustrator,0,English,Get up to speed quickly and start using Illustrator and Photoshop together,4/2019,12/29/19
"Adobe illustrator Latest, simplest and quickest way to learn",www.udemy.com/course/adobeillustratorcc/,Usman Khalid,19.99,11.39,0.0(0 ratings),Design,Graphic Design,Adobe Illustrator,1, English,Project based Short videos with high value,4/2019,12/29/19
Adobe Illustrator CC Essentials MasterClass,www.udemy.com/course/adobe-illustrator-cc-essentials-masterclass/,Jawad Abdul Mateen,19.99,11.39,4.2(2 ratings),Design,Graphic Design,Adobe Illustrator,"1,181",English,Get up and running with clear understanding of Illustrator cc essentials,9/2018,12/29/19
Master Graphic Design by Creating in Adobe Illustrator CC,www.udemy.com/course/adobe-illustrator-cc-d/,Megan Hartman,19.99,11.39,0.0(0 ratings),Design,Graphic Design,Adobe Illustrator,1,English,An introduction to the world of design using the leading software (Adobe Illustrator) for students grades Jr. High & up.,7/2018,12/29/19
Learn Basics Of Adobe Illustrator,www.udemy.com/course/learn-basics-of-adobe-illustrator-under-30-minutes/,Bode Ogbe,29.99,11.39,3.4(40 ratings),Design,Graphic Design,Adobe Illustrator,"1,458",English,Beginners Guide to Learning Adobe Illustrator CC,9/2016,12/29/19
Create a Majestic Bear on Adobe Illustrator,www.udemy.com/course/bear-adobe-illustrator/,Aerie North,54.99,11.39,0.0(0 ratings),Design,Graphic Design,Adobe Illustrator,7,English,Digital Illustration Using 2017 Colors of the Year + Contemporary Tribal Technique,1/2017,12/29/19
Essentials: Adobe Illustrator for Merch by Amazon,www.udemy.com/course/essentials-adobe-illustrator-for-merch-by-amazon/,Merch Maniacs,0.0,24.99,4.4(5 ratings),Design,"Design Tools
 ",Adobe Illustrator,47,English,"The Essentials for creating designs Merch by Amazon, in Adobe Illustrator",8/2016,12/29/19
Create Beveled Lettering in Adobe Illustrator,www.udemy.com/course/create-beveled-lettering/,Natanael Gama,19.99,11.99,1.5(1 rating),Design,Graphic Design,Adobe Illustrator,105,English,Become a Digital Stone Carver,2/2017,12/29/19
Make Flat Design Space Ships in 30 Minutes in Illustrator!,www.udemy.com/course/make-flat-design-space-ships-in-30-minutes-in-illustrator/,John Bura,49.99,11.99,4.8(43 ratings),Design,Graphic Design,Adobe Illustrator,"1,151",English,"If you have 30 minutes, learn to draw simple spaceships from scratch!",3/2016,12/29/19
Adobe Photoshop and Illustrator for Merch By Amazon and PoD,www.udemy.com/course/adobe-photoshop-illustrator-merch-by-amazon-pod/,Rob Cubbon,0.0,99.99,4.3(39 ratings),Design,Graphic Design,Adobe Illustrator,386,English,The Complete Photoshop and Illustrator Course for Merch By Amazon and Print On Demand (PoD) Merchandise Design,11/2018,12/29/19
Adobe Illustrator: Learn Easy Logo Design.,www.udemy.com/course/logo-design-in-adobe-illustrator/,Veysel KOPARAL,29.99,11.99,4.1(5 ratings),Design,Graphic Design,Adobe Illustrator,377,English,Beginner and intermediate level logo design.,9/2016,12/29/19
Adobe Illustrator Online Training Course,www.udemy.com/course/adobe-illustrator-online-training-course/,Academy of Film Fashion and Design,19.99,11.99,3.0(1 rating),Design,Design Tools,Adobe Illustrator,5,English,Adobe Illustrator Online Training Course - Focusing on the Workspace and Exploring the Various Tools in Illustrator,4/2017,12/29/19
Make Tech circles in Adobe Photoshop and Illustrator,www.udemy.com/course/make-tech-circles-in-adobe-photoshop-and-illustrator/,John Bura,199.99,11.99,4.1(13 ratings),Design,Graphic Design,Adobe Illustrator,"1,159",English,Learn to make fancy tech circles in just 30 minutes. Upgrade your skills in just 1 hour.,10/2015,12/29/19
Setting Up Adobe Illustrator CS6 CC For Maximum Productivity,www.udemy.com/course/tutorials-adobe-illustrator-cs6-cc-for-maximum-productivity/,Douglas James Butner,0.0,Free,3.8(446 ratings),Design,Design Tools, Adobe Illustrator,"20,996",English,Set up Adobe Illustrator CS6/CC to make you a more productive graphic artist. Beginners to Experts welcome!,6/2019,12/29/19
Design Tickets and Vouchers in Photoshop and Illustrator,www.udemy.com/course/design-tickets-and-vouchers-in-photoshop-and-illustrator/,Jestoni Esteban,0.0,Free,4.1(54 ratings),Design,Graphic Design,Adobe Illustrator,"5,826",English,Learn how to design printable promotional materials in Photoshop and Illustrator,4/2018,12/29/19
Become an Icon Fonts Pro in No Time,www.udemy.com/course/be-an-icon-fonts-pro-in-no-time/,Ajdin Imsirovic,0.0,Free,3.7(113 ratings),Design,Web Design,Adobe Illustrator,"5,125",English,"A guide to creating images using icon fonts, with the bonus lecture of use of icon fonts in bootstrap",4/2017,12/29/19
How to Design an Awesome Letterhead in Adobe Illustrator,www.udemy.com/course/letterheaddesign/,Daniel Evans,0.0,Free,4.1(954 ratings),Design,"Graphic Design
 ",Adobe Illustrator,"27,181",English,Learn Letterhead Design from a published professional!,11/2019,12/29/19
Convert Image to Vector in Adobe illustrator,www.udemy.com/course/convert-image-to-vector-in-adobe-illustrator/,HU Shahir,0.0,Free,4.0(394 ratings),Design,Graphic Design,Adobe Illustrator,"10,317",English,Learn how to create full deatiled vector shapes and patterns from image in Adobe illustrator .,7/2016,12/29/19
Learn Illustrator By Recreating Top 3 Logos - Beginner Guide,www.udemy.com/course/learn-illustrator/,Kashif Iqbal,0.0,Free,4.4(721 ratings),Design,Graphic Design,Adobe Illustrator,"18,522",English,In this course you'll learn how to use illustrator by recreating top 3 logos.,10/2015,12/29/19
Adobe illustrator For UI / UX Design,www.udemy.com/course/illustrator-for-ui-ux-design/,HU Shahir,0.0,Free,3.6(585 ratings),Design,Graphic Design,Adobe Illustrator,"12,974",English,How to use Adobe illustrator for UI / UX Design all things you need to know .,1/2017,12/29/19
Design and Prototype an iOS8 Mobile App on Illustrator,www.udemy.com/course/mobileprototype/,Pablo Stanley,0.0,Free,4.7(295 ratings),Design,User Experience,Adobe Illustrator,"12,849",English,"Create beautiful, high-fidelity iOS8 app prototypes with interactions and transitions. No coding skills required.",4/2015,12/29/19
A Product Designers Guide To Adobe Illustrator,www.udemy.com/course/a-product-designers-guide-to-adobe-illustrator/,Jack Daly,0.0,Free,4.0(35 ratings),Design,Graphic Design,Adobe Illustrator,"5,554",English,"Create professional graphics for both physical and digital design, quickly and effectively with Adobe Illustrator",12/2019,12/29/19
Useful Tricks & Tips in Adobe Illustrator,www.udemy.com/course/useful-tricks-and-tips-in-adobe-illustrator/,Daniel White,0.0,Free,"4.5(3,177 ratings)",Design,Design Tools,Adobe Illustrator,"33,605",English,"In this training course, you will learn a variety of useful tricks and tips to improve your skills in Adobe Illustrator.",5/2015,12/29/19
Most Wanted Flat Design Techniques #1: Desert Island,www.udemy.com/course/flat-design-flat-ui-design-flat-colors-flat-design-desert-island/,Dawid Tuminski,0.0,Free,4.2(469 ratings),Design,Graphic Design,Adobe Illustrator,"14,035",English,Flat design : How to create advanced flat design projects in Illustrator Adobe Illustrator Tutorial,5/2017,12/29/19
Illustrator CC 2020 for beginners : Basics & Tricks,www.udemy.com/course/illustrator-cc-2018-for-beginners-basics-tricks/,Khalil Ibrahim,0.0,Free,"4.3(1,155 ratings)",Design,Design Tools,Adobe Illustrator,"34,695",English,Familiarize with Adobe illustrator and get to know the the essentials,12/2019,12/29/19
Illustrator CC: things beginners want know how to do,www.udemy.com/course/illustrator-cc-things-beginners-want-know-how-to-do/,Omar Ouhra,0.0,Free,3.8(123 ratings),Design,3D & Animation,Adobe Illustrator,"4,980",English,Master Adobe Illustrator CC with this in-depth training for all levels.,12/2017,12/29/19
How to Use Dynamic Data with Variables in illustrator,www.udemy.com/course/how-to-use-dynamic-data-with-variables-in-illustrator/,Sasikumar Arasaratnam,0.0,Free,4.0(5 ratings),Office Productivity,Other,Adobe Illustrator,"2,457",English,How to Use Variable data from a CSV file and import and use dynamic external Data in Adobe Illustrator,11/2019,12/29/19
Illustrator 基礎からプロレベルまで　完全ですべてをゼロから最短で学べる講座,www.udemy.com/course/illustratgor/,村守 康,189.99,11.99,4.3(795 ratings),ãã¶ã¤ã³,ãã¶ã¤ã³ãã¼ã«,Adobe Illustrator,7419äººã®åè¬çãç»é²,æ¥æ¬èª,Illustrator CCã«ãããã®ãåãã¦ã®äººã§ãåãããããåºæ¬ããå­¦ã¹ã¾ããæãåããã¦å­¦ã¹ãããã«å¤ãã®ç·´ç¿ç´ æãç¨æããçè«ã ãã§ãªãç¾å ´ã®Tipsãå­¦ã¹ãã¤ã©ã¬ã®å®å¨ãªã³ã¼ã¹ã§ãã,11/2019,12/29/19
Adobe Illustrator CC Masterclass — Vom Anfänger zum Profi,www.udemy.com/course/adobe-illustrator-cc-masterclass-vom-anfanger-zum-profi/,Justus Zeemann,199.99,11.99,4.6(815 ratings),Design,Grafikdesign,Adobe Illustrator,4.284,Deutsch,Entdecke was Adobe Illustrator dir bietet und meistere praxisnah alle Funktionen. Inkl. TastenkÃ¼rzel und Tipps & Tricks.,11/2019,12/29/19
Adobe Illustrator CC: Il corso essenziale da zero ad esperto,www.udemy.com/course/adobe-illustrator-cc-il-corso-essenziale-da-zero-ad-esperto/,Alberto Comper,199.99,11.99,4.6(890 ratings),Design,Graphic Design,Adobe Illustrator,3.836,Italiano,Il corso facile e completo di Adobe Illustrator CC per realizzare grafica e design.,11/2018,12/29/19
Adobe Illustrator CC Máster: De Básico a Profesional. 2019.,www.udemy.com/course/adobe-illustrator-cc-master/,Marlon Ceballos,199.99,11.99,"4.6(1,133 ratings)",Design,Design Tools,Adobe Illustrator,"5,956",Spanish,Aprende todo sobre dibujo vectorial con Illustrator y sÃ© un experto: de dibujos simples a grÃ¡ficos complejos y avanzados,2/2019,12/29/19
Illustrator 2020 : A'dan Z'ye Kolay Öğrenme! (Güncellenmiş),www.udemy.com/course/illustrator-cc-2017-temel-egitimi-yeni/,Burhan KARAKAYA,194.99,11.99,"4.5(1,293 ratings)",TasarÄ±m,Grafik TasarÄ±m,Adobe Illustrator,6.651,TÃ¼rkÃ§e,"Temelden ve DetaylÄ± AnlatÄ±mÄ± ile Son Versiyon Illustrator 2020 EÄitimi ile UzmanlaÅÄ±n, Ãizmeye BaÅlayÄ±n!!",11/2019,12/29/19
Illustrator CC para novatos: ¡desde cero hasta experto! ,www.udemy.com/course/illustrator-cc-para-novatos-desde-cero-hasta-experto/,Joel Combes,149.99,11.99,"4.4(2,425 ratings)",Design,Graphic Design,Adobe Illustrator,"9,606",Spanish,"La guÃ­a definitiva para crear asombrosos diseÃ±os grÃ¡ficos , dibujos e iconos en Adobe Illustrator CC",4/2019,12/29/19
ADOBE ILLUSTRATOR CC 2018 / 2019 - DO BÁSICO AO AVANÇADO,www.udemy.com/course/adobe-illustrator-cc-2018-2019-do-basico-ao-avancado/,Professor Willian,104.99,11.99,4.6(869 ratings),Design,Design grÃ¡fico,Adobe Illustrator,2.884,PortuguÃªs,Aprenda na pratica a utilizar o Adobe Illustrator de forma avanÃ§ada criando diversos trabalhos e exercÃ­cios,5/2019,12/29/19
Illustrator CC 2020 Débutants-Techniques de base + Ateliers,www.udemy.com/course/illustrator-pour-debutants-techniques-de-base-et-ateliers/,ROMAIN DUCLOS,59.99,11.99,4.7(436 ratings),Design,Conception graphique,Adobe Illustrator,2Â 139,FranÃ§ais,Outils ILLUSTRATOR - Ateliers - logo - Carte de visite - Design - Flyer - CV - Pictogramme - Illustration - Dessin,12/2019,12/29/19
"Master Diseño Gráfico con Photoshop, Illustrator e InDesign",www.udemy.com/course/master-diseno-grafico-con-photoshop-illustrator-indesign/,Felipe Nicholls,199.99,11.99,4.2(159 ratings),Design,Graphic Design,Adobe Illustrator,"2,198",Spanish,"Aprende diseÃ±o grÃ¡fico con Photoshop, Illustrator e InDesign desde cero. Crea imÃ¡genes, ilustraciones y publicaciones",5/2019,12/29/19
Corso completo di Illustrator: da principiante ad esperto,www.udemy.com/course/corso-illustrator-facile-adobe-illustrator/,Alessandro Cuoghi,199.99,11.99,4.3(201 ratings),Design,Graphic Design,Adobe Illustrator,1.023,Italiano,Impara in maniera pratica a disegnare con il mouse ed entra nel mondo della grafica vettoriale,11/2019,12/29/19
Illustrator CC 2017 e 18 Completo - do Iniciante ao Avançado,www.udemy.com/course/aula-de-illustrator-como-fazer-um-infografico/,Thiago Christo,199.99,11.99,"4.4(2,057 ratings)",Design,Ferramentas de design,Adobe Illustrator,10.573,PortuguÃªs,"Domine as principais ferramentas do Illustrator utilizadas para criaÃ§Ã£o Logotipo, Vetores, Design GrÃ¡fico",12/2019,12/29/19
Curso Completo de Design Gráfico com Adobe Illustrator,www.udemy.com/course/curso-completo-de-design-com-adobe-illustrator/,Viana Patricio Barbosa Neto,79.99,11.99,4.5(804 ratings),Design,Design grÃ¡fico,Adobe Illustrator,3.128,PortuguÃªs,Aprenda Design GrÃ¡fico Profissional de maneira prÃ¡tica criando elementos e composiÃ§Ãµes com o Adobe Illustrator,6/2018,12/29/19
【印刷物編】知識ゼロから即戦力になるためのillustratorCC実践コース,www.udemy.com/course/illustratorcc-u/,シュムデザイン 新里拓也,44.99,11.39,4.4(80 ratings),ãã¶ã¤ã³,ã°ã©ãã£ãã¯ãã¶ã¤ã³,Adobe Illustrator,654äººã®åè¬çãç»é²,æ¥æ¬èª,ãã©ã·ããã¹ã¿ã¼ããã©ã¤ã¤ã¼ç­ã®å¶ä½ã¹ã­ã«ãæéã»æç­ã§å­¦ç¿ã§ãã,4/2018,12/29/19
絵が下手なズブの素人でも真似して描けるイラストレーター講座,www.udemy.com/course/illustrator4basic/,(あくしょん) Murakami Yoshiyuki,44.99,11.39,4.6(84 ratings),ITã¨ã½ããã¦ã§ã¢,ãã®ä»,Adobe Illustrator,906äººã®åè¬çãç»é²,æ¥æ¬èª,çµµãä¸æã§ã¤ã©ã¬ãè§¦ã£ããã¨ããªãã¦ããä»ããããªããã¹ã­ã«ãèº«ã«ã¤ãéæ»ã§ä»äºã«ãã«æ´»ç¨ã§ããï¼,6/2019,12/29/19
Illustrator CC 2020-Techniques avancées + Ateliers créatifs,www.udemy.com/course/illustrator-intermediare-techniques-avancees-et-ateliers/,ROMAIN DUCLOS,59.99,11.39,4.7(108 ratings),Design,Conception graphique,Adobe Illustrator,981,FranÃ§ais,"Perfectionnez-vous avec ILLUSTRATOR: logo, carte de visite, flyer, affiche, illustration, dessin, pictogramme, crÃ©ation",11/2019,12/29/19
Adobe Illustrator CC 2019: En Temelden İleri Seviyeye,www.udemy.com/course/adobe-illustrator-egitimi/,Merve Talun,199.99,11.39,4.4(363 ratings),TasarÄ±m,Grafik TasarÄ±m,Adobe Illustrator,1.712,TÃ¼rkÃ§e,Temelden ileri seviyeye gÃ¼ncellenmiÅ Adobe Illustrator CC 2019 eÄitimi ile grafik tasarÄ±m dÃ¼nyasÄ±yla tanÄ±ÅÄ±n!,7/2019,12/29/19
Adobe Illustrator CC,www.udemy.com/course/adobe-illustrator-cc-m/,Анаит Авдалян -  Anait Avdalyan,49.99,11.39,4.6(124 ratings),ÐÐ¸Ð·Ð°Ð¹Ð½,ÐÑÐ°ÑÐ¸ÑÐµÑÐºÐ¸Ð¹ Ð´Ð¸Ð·Ð°Ð¹Ð½,Adobe Illustrator,507,Ð ÑÑÑÐºÐ¸Ð¹,Vector graphics. ÐÐµÐºÑÐ¾ÑÐ½Ð°Ñ Ð³ÑÐ°ÑÐ¸ÐºÐ°,12/2019,12/29/19
Diseña imprimibles para fiestas temáticas,www.udemy.com/course/disena-imprimibles-para-fiestas-tematicas/,Wendy Raydé Cruz,0.0,79.99,4.7(18 ratings),Design,Graphic Design,Adobe Illustrator,56,Spanish,Aprende a crear y diseÃ±ar los elementos bÃ¡sicos para armar las decoraciones de una fiesta temÃ¡tica con Adobe Illustrator,10/2019,12/29/19
Adobe Character Animator: あなたの顔をカメラ認識、自分だけのアバターを生み出すビギナークラス,www.udemy.com/course/character-animator-japan/,OMOKAGE TV,99.99,11.39,4.5(109 ratings),ãã¶ã¤ã³,ãã¶ã¤ã³ãã¼ã«,After Effects,908äººã®åè¬çãç»é²,æ¥æ¬èª,Adobe Character Animatorã«ä½¿ã£ããããªãã ãã®ã­ã£ã©ã¯ã¿ã¼ã¢ãã¡ã¼ã·ã§ã³ãä½ãã³ã¼ã¹ã§ããPCã«ã¡ã©ã«åãã£ã¦ãªãªã¸ãã«ã­ã£ã©ã¯ã¿ã¼ã«èªèº«ã§æ¼æãã¤ãããã¨ã§ãé«åº¦ãªåããèª°ã§ãç°¡åã«åç¾ãããã¨ãã§ãã¾ã,11/2018,12/29/19
【Webバナー編】知識ゼロから即戦力になるためのillustratorCC実践コース,www.udemy.com/course/webillustrator/,シュムデザイン 新里拓也,44.99,11.39,4.3(75 ratings),ãã¶ã¤ã³,ã°ã©ãã£ãã¯ãã¶ã¤ã³,Adobe Illustrator,558äººã®åè¬çãç»é²,æ¥æ¬èª,æ¬ç©ã®å¶ä½ã¹ã­ã«ãæéã»æç­ã§å­¦ç¿ã§ãã,8/2018,12/29/19
