Course,URL,instructor,Price (full),Price (discount),Rank,Category 1,Category 2,Category 3,Enrollment,Language,Description,Last Update,Date Scraped
Illustrator CC 2018 手把手入門應用技巧,www.udemy.com/course/illustrator-cc-2018-a/,景文 鄭,0.0,74.99,0.0(0 ratings),è¨­è¨,å¹³é¢è¨­è¨, Adobe Illustrator,0,Traditional Chinese,ä¸è«æ¯ Q çç¹ªåææç«ï¼çææ¯åæ¥­è¨­è¨ï¼æ¨é½å¯ä»¥å©ç¨ Illustrator å¹«æ¨å®æ,10/2019,12/29/19
IllustratorのAdobe Fontsと文字タッチツールを使ったデザイン手法,www.udemy.com/course/adobe-fonts/,KOWAZA デザイン,199.99,11.99,0.0(0 ratings),ãã¶ã¤ã³,ã°ã©ãã£ãã¯ãã¶ã¤ã³,Adobe Illustrator,149äººã®åè¬çãç»é²,æ¥æ¬èª,ãã¶ã¤ã³ã®ååã¯æå­ã§ã§ãã¦ãã,11/2019,12/29/19
Tipografía Creativa con Adobe Ilustrador,www.udemy.com/course/tipografia-creativa-con-adobe-ilustrador/,Henry Pineda,19.99,11.99,4.5(1 rating),DiseÃ±o,DiseÃ±o grÃ¡fico,Adobe Illustrator,23,EspaÃ±ol,TipografÃ­a Creativa con Adobe Ilustrador,5/2018,12/29/19
"Illustrator débutant à intermédiaire, bases et entraînements",www.udemy.com/course/apprendre-a-maitriser-adobe-illustrator/,Nicolas Forgue,39.99,11.99,3.4(6 ratings),Design,Conception graphique,Adobe Illustrator,32,FranÃ§ais,MaÃ®triser l'ensemble des bases du logiciel Illustrator et entrainement sur des projets graphiques,11/2019,12/29/19
Ilustración Digital para Principiantes en Adobe Illustrator,www.udemy.com/course/ilustracion-digital-para-principiantes-en-adobe-illustrator-moylobito/,Moy Lobito,194.99,11.99,4.3(32 ratings),Design,Design Tools,Adobe Illustrator,665,Spanish,"Aprende a ilustrar de manera profesional con Adobe Illustrator. Crea dibujos vectoriales de alta calidad, fÃ¡cil y rÃ¡pido",1/2018,12/29/19
WEBデザイナーコース（必須アプリ基本機能操作習得パック）Adobe CC 2015版,www.udemy.com/course/web-adobe-cc-2015/,アテイン 株式会社,49.99,11.99,3.8(34 ratings),ãã¶ã¤ã³,ã¦ã§ããã¶ã¤ã³,Dreamweaver,218äººã®åè¬çãç»é²,æ¥æ¬èª,WEBãã¶ã¤ã³ã«å¿é ã®Dreamweaverãã¤ã¡ã¼ã¸ç»åãåååçã®è£æ­£ã»å å·¥ã«å¿è¦ãªPhotoshopãã­ã´ããã¶ã¤ã³ãã¼ãå¶ä½ã«æ¬ ãããªãIllustratorããããã®CC 2015çã®åºæ¬çãªä½¿ç¨æ³ãã¾ã¨ãã¦ç¿å¾ã§ããããã¯ã§ãã,1/2016,12/29/19
Adobe Illustrator CC de Novato a Profesional en 70 clases,www.udemy.com/course/adobe-illustrator-cc-de-novato-a-profesional-en-70-clases/,Alberto Peña,0.0,59.99,4.3(19 ratings),DiseÃ±o,DiseÃ±o grÃ¡fico,Adobe Illustrator,37,EspaÃ±ol,"ConviÃ©rtete partiendo desde cero en un experto de Illustrator CC, el programa de dibujo vectorial lÃ­der del mercado",9/2017,12/29/19
Diseño de LOGO para emprendedores muy fácil y rápido (ADOBE),www.udemy.com/course/illustrator-para-emprendedores/,Ludwig Marx Pucha Cofrep,99.99,11.99,3.9(2 ratings),DiseÃ±o,DiseÃ±o grÃ¡fico,Adobe Illustrator,9,EspaÃ±ol,"En tiempo rÃ©cord diseÃ±arÃ¡s tu LOGOTIPO, tarjetas de presentaciÃ³n, afiches y hojas volantes para tu emprendimiento",9/2019,12/29/19
Aprende como hacer un Arte Final en Illustrator,www.udemy.com/course/aprende-como-hacer-un-arte-final-en-illustrator/,Javier Vicente,19.99,11.99,4.3(22 ratings),Design,Graphic Design,Adobe Illustrator,400,Spanish,"ConviÃ©rtete en un experto en Arte Final, conoce todos los trucos para que tus diseÃ±os salga bien en la impresiÃ³n.",6/2018,12/29/19
"Illustrator CC: fundamentos, trucos y técnicas",www.udemy.com/course/illustrator-cc-fundamentos-trucos-y-tecnicas/,Iván Gómez,99.99,11.99,4.4(10 ratings),Design,Graphic Design,Adobe Illustrator,50,Spanish,Aprende las tÃ©cnicas de ilustraciÃ³n vectorial utilizadas por reconocidos artistas digitales,5/2018,12/29/19
Illustrator CC - Creare un'illustrazione vettoriale,www.udemy.com/course/illustrator-cc-creare-unillustrazione-vettoriale/,Teacher-in-a-Box | Videocorsi Professionali,0.0,69.99,0.0(0 ratings),Design,Graphic Design,Adobe Illustrator,21,Italiano,Graziano Vitale,3/2018,12/29/19
Aprende y domina Adobe Illustrator CC - Curso completo 2019,www.udemy.com/course/aprende-y-domina-adobe-illustrator-cc/,Biblioteca Digital x86,19.99,11.99,4.3(6 ratings),Design,Graphic Design,Adobe Illustrator,26,Spanish,RegÃ­strate ya en este curso y aprende a usar las diferentes herramientas y opciones de Adobe Illustrator CC.,4/2018,12/29/19
Adobe Illustrator - от новичка-иллюст. до векторного стокера,www.udemy.com/course/ai-stocker/,Roman Sayapin,114.99,11.99,3.2(2 ratings),ÐÐ¸Ð·Ð°Ð¹Ð½,ÐÑÐ°ÑÐ¸ÑÐµÑÐºÐ¸Ð¹ Ð´Ð¸Ð·Ð°Ð¹Ð½,Adobe Illustrator,22,Ð ÑÑÑÐºÐ¸Ð¹,"{ÑÑÐ¾ÐºÐ¸, shutterstock, creativemarket, 123rf, graphicriver, istock, depositphotos}",1/2018,12/29/19
誰でもわかるAdobe Illustrator CC 2019,www.udemy.com/course/adobe-illustrator-cc-2019/,アテイン 株式会社,29.99,11.99,0.0(0 ratings),ãã¶ã¤ã³,ã°ã©ãã£ãã¯ãã¶ã¤ã³,Adobe Illustrator,4äººã®åè¬çãç»é²,æ¥æ¬èª,ãã¹ãå³å½¢ã®æç»ãã«ã©ã¼ã®è¨­å®ãæå­å¥åãåççã®éç½®æ¹æ³ãªã©ãIllustratorã®åºæ¬çãªæä½ãå­¦ã¹ãåå¿èåãã®è¬åº§ã§ãã,9/2019,12/29/19
Aprende y domina Affinity Designer - Curso completo,www.udemy.com/course/aprende-y-domina-affinity-designer-curso-completo/,Biblioteca Digital x86,19.99,11.99,0.0(0 ratings),Design,Design Tools,Adobe Illustrator,3,Spanish,"Aprende y domina Affinity Designer, la mejor alternativa a Adobe Illustrator.",8/2019,12/29/19
كيفية إنشاء أيقونات مسطحة ( flat icon ) بإستعمال illustrator,www.udemy.com/course/how-to-create-flat-icon-design-in-illustrator-cc-arabic/,Zakaria Chkouch,29.99,11.99,0.0(0 ratings),Design,Graphic Design,Adobe Illustrator,1,Arabic,How to create flat Icon design in Illustrator CC (Arabic),12/2017,12/29/19
بالعربي adobe illustrator  تعلم برنامج,www.udemy.com/course/adobe-illustrator-arabic/,mohamed hiekal,19.99,11.99,0.0(0 ratings),Design,Graphic Design,Adobe Illustrator,11,Arabic,ØªØ¹ÙÙ Ø§ÙØ§Ù ÙÙÙ ØªØµÙÙ Ø¹ÙÙ Ø¨Ø±ÙØ§ÙØ¬ Ø§ÙØ§ÙÙØ³ØªØ±ÙØªÙØ± ÙØ§ÙØ¯Ø®ÙÙ ÙØ¹Ø§ÙÙ Ø§ÙØ¬Ø±Ø§ÙÙÙ,9/2019,12/29/19
誰でもわかる Adobe Illustrator CS5,www.udemy.com/course/adobe-illustrator-cs5-k/,アテイン 株式会社,19.99,11.99,0.0(0 ratings),ãã¶ã¤ã³,ã°ã©ãã£ãã¯ãã¶ã¤ã³,Adobe Illustrator,7äººã®åè¬çãç»é²,æ¥æ¬èª,Illustratorã®åºæ¬çãªä½¿ãæ¹ãå­¦ã¶ææã§ããããã¤ãã®ä¾¿å©æ©è½ãè§£èª¬ãã¦ãã¾ããåå¿èåãã«ããããããè§£èª¬ãã¦ãã¾ãã,11/2015,12/29/19
Adobe Illustrator para Libros Infantiles - Estilo Acuarela,www.udemy.com/course/adobe-illustrator-para-libros-infantiles-estilo-acuarela-por-moylobito/,Moy Lobito,194.99,11.99,4.1(12 ratings),Design,Design Tools,Adobe Illustrator,325,Spanish,Crea hermosas ilustraciones digitales para libros infantiles en Adobe Illustrator - Dibujos vectoriales estilo acuarela,12/2017,12/29/19
Vectorizar y pintar un dibujo hecho a mano con Illustrator,www.udemy.com/course/vectorizar-y-pintar-un-dibujo-hecho-a-mano-con-illustrator/,Alexander Marroquín,19.99,11.99,0.0(0 ratings),Design,Other,Adobe Illustrator,3,Spanish,Calco interactivo y Pintura interactiva con Adobe Illustrator para ilustraciones digitales,8/2019,12/29/19
الدورة الشاملة لتعلم التصميم في برنامج آلستريتور,www.udemy.com/course/ali-course/,Ali Hmadi,74.99,11.99,2.7(2 ratings),Design,Graphic Design,Adobe Illustrator,15,Arabic,Ø£ÙØ¶Ù Ø¯ÙØ±Ø© ÙÙ ØªØ¹ÙÙÙ Ø¨Ø±ÙØ§ÙØ¬ Ø¢ÙØ³ØªØ±ÙØªÙØ± ÙØ¬ÙÙØ¹ Ø§ÙÙØ³ØªÙÙØ§Øª,7/2018,12/29/19
Illustratorでポストカード・名刺・フライヤーを作ろう,www.udemy.com/course/illustrator-practice/,アテイン 株式会社,19.99,11.99,4.2(14 ratings),ãã¶ã¤ã³,ãã¶ã¤ã³ãã¼ã«,Adobe Illustrator,79äººã®åè¬çãç»é²,æ¥æ¬èª,Illustratorã®åºæ¬çãªæ©è½ãæä½ããå­¦ã³ãå·ä½çãªä½ä¾ã®å¶ä½ãéãã¦èªåå¥½ã¿ã®ååºãªã©ãä½ããããã«ãªãã¾ã,5/2016,12/29/19
誰でもわかる！これから始める Adobe Illustrator CC,www.udemy.com/course/attain-illustrator-cc/,アテイン 株式会社,19.99,11.99,3.8(15 ratings),ãã¶ã¤ã³,ãã¶ã¤ã³ãã¼ã«,Adobe Illustrator,87äººã®åè¬çãç»é²,æ¥æ¬èª,ã¢ã¼ãã¯ã¼ã¯ã®å¤å½¢ãåæãææ¸ãè¡¨ç¾ãæå­ã®éç½®æ¹æ³ã¨ãã£ããIllustratorãã¶ã¤ã³ã«å¿è¦ãªåºæ¬æä½ãè¦ãããã¨ãã§ãã¾ããDTPãã¶ã¤ãã¼ãç®æãåå¿èã¯ãã¡ãããã¦ã§ããã¶ã¤ãã¼ã®æ¹ã«ããªã¹ã¹ã¡ã§ãã,8/2015,12/29/19
Basic Illustrator CC (Speed Shortcut),www.udemy.com/course/basic-in-illustrator-cc-by-shr/,Sakchai Booncharoenyos,64.99,11.99,5.0(1 rating),à¸à¸²à¸£à¸­à¸­à¸à¹à¸à¸,à¸à¸²à¸£à¸­à¸­à¸à¹à¸à¸à¸à¸£à¸²à¸à¸´à¸,Adobe Illustrator,à¸à¸¹à¹à¹à¸£à¸µà¸¢à¸à¸¥à¸à¸à¸°à¹à¸à¸µà¸¢à¸,à¹à¸à¸¢,à¹à¸£à¸µà¸¢à¸à¸£à¸¹à¹à¹à¸à¸£à¹à¸à¸£à¸¡ ILLUSTRATOR à¸à¹à¸§à¸¢à¸§à¸´à¸à¸µà¸¥à¸±à¸ à¹à¸£à¸µà¸¢à¸à¸£à¸¹à¹à¹à¸£à¹à¸§ à¹à¸à¹à¸à¸²à¸à¹à¸à¹à¸à¸£à¸´à¸,6/2019,12/29/19
KohのIllustrator スーパーテクニック　トレーニング'01 卵の顔,www.udemy.com/course/kohillustrator-01/,村守 康,19.99,11.99,4.4(8 ratings),ãã¶ã¤ã³,ãã¶ã¤ã³ãã¼ã«,Adobe Illustrator,189äººã®åè¬çãç»é²,æ¥æ¬èª,Illustratorã®ã¹ã¼ãã¼ãã¯ããã¯ãç¢ºå®ã«èº«ã«ã¤ã,7/2015,12/29/19
Illustrator CS6 do básico ao intermediário,www.udemy.com/course/illustrator-cs6-do-basico-ao-intermediario/,Impacta Online,164.99,11.99,4.7(46 ratings),Design,Ferramentas de design,Adobe Illustrator,174,PortuguÃªs,"Aprenda Illustrator CS6 com a melhor escola de TI, gestÃ£o e design do Brasil, por um preÃ§o imperdÃ­vel!",10/2017,12/29/19
Crea un paisaje con Adobe Illustrator,www.udemy.com/course/crea-un-paisaje-con-adobe-illustrator/,Luis Zambrano,19.99,11.99,4.5(6 ratings),DiseÃ±o,DiseÃ±o grÃ¡fico,Adobe Illustrator,19,EspaÃ±ol,Aprende a crear un paisaje aprovechando las herramientas que brinda Adobe Illustrator,2/2018,12/29/19
Adobe Illustrator CC: Curso completo desde cero,www.udemy.com/course/curso-de-illustrator-cc/,Felipe Nicholls,79.99,11.99,3.8(80 ratings),Design,Design Tools,Adobe Illustrator,"1,041",Spanish,Ya no tienes excusa. Puedes aprender Illustrator sin tener conocimientos previos. FÃ¡cil y rÃ¡pido.,11/2017,12/29/19
Crea Mandalas para colorear con Adobe Illustrator,www.udemy.com/course/crea-mandalas-para-colorear-con-adobe-illustrator/,Cristina Rodriguez,19.99,11.99,5.0(2 ratings),DiseÃ±o,DiseÃ±o grÃ¡fico,Adobe Illustrator,15,EspaÃ±ol,Conoce los orÃ­genes y dos maneras sencillas de crear un mandala,6/2018,12/29/19
Illustrator CC 2018,www.udemy.com/course/illustrator-cc-2018/,Luciano Augusto,74.99,11.99,4.5(6 ratings),Design,Design grÃ¡fico,Adobe Illustrator,21,PortuguÃªs,Illustrator CC,,12/29/19
Aprenda Adobe Illustrator do Zero,www.udemy.com/course/aprenda-adobe-illustrator-do-zero/,Alexsandro Sunaga,19.99,11.39,4.6(5 ratings),Design,Ferramentas de design,Adobe Illustrator,129,PortuguÃªs,Domine o software padrÃ£o para grÃ¡ficos vetoriais e torne-se um artista digital,6/2019,12/29/19
Curso Online de Adobe Illustrator CC,www.udemy.com/course/top-melhor-curso-online-de-adobe-illustrator-cc-c/,André Rossiter,49.99,11.39,4.5(28 ratings),Design,Design grÃ¡fico,Adobe Illustrator,289,PortuguÃªs,OrientaÃ§Ãµes por meio de vÃ­deo aulas em alta definiÃ§Ã£o com especialista adobe. Confira aulas demo sem compromisso.,12/2017,12/29/19
Curso Online de Adobe Illustrator CS6,www.udemy.com/course/top-melhor-curso-online-de-adobe-illustrator-cs6-equipe-andre-rossiter/,André Rossiter,34.99,11.39,4.3(6 ratings),Design,Ferramentas de design,Adobe Illustrator,50,PortuguÃªs,OrientaÃ§Ãµes por meio de vÃ­deo aulas em alta definiÃ§Ã£o com especialista Adobe. Confira vÃ­deo aulas demo sem compromisso.,10/2018,12/29/19
Curso de Illustrator CC 2018 - Vetorização e Criação,www.udemy.com/course/curso-de-illustrator-2018-vetorizacao-e-criacao/,Hugo Vasconcelos,19.99,11.39,3.4(5 ratings),Design,Design grÃ¡fico,Adobe Illustrator,51,PortuguÃªs,Illustrator na PrÃ¡tica,12/2017,12/29/19
Adobe Illustrator CC 2017,www.udemy.com/course/adobe-illustrator-cc-2017-o/,Neri Neitzke,49.99,11.39,4.3(5 ratings),Design,Design grÃ¡fico,Adobe Illustrator,36,PortuguÃªs,Illustrator,11/2017,12/29/19
Curso de Illustrator CC 2018,www.udemy.com/course/curso-de-illustrator-cc-2018/,Hugo Vasconcelos,19.99,11.39,4.4(19 ratings),Design,Design grÃ¡fico,Adobe Illustrator,63,PortuguÃªs,Illustrator para Iniciantes,12/2017,12/29/19
A'dan Z'ye Adobe Illustrator CC 2018 Eğitimi,www.udemy.com/course/adan-zye-adobe-illustrator-cc-2018-egitimi/,Kutay Öztürk,59.99,11.39,3.5(1 rating),TasarÄ±m,Grafik TasarÄ±m,Adobe Illustrator,7,TÃ¼rkÃ§e,Sizde harika logolar ve tasarÄ±mlar yapabilirsiniz.,11/2018,12/29/19
Tutorial Dasar Adobe Illustrator!,www.udemy.com/course/belajaradobeillustrator/,Dani Irawan,19.99,11.39,0.0(0 ratings),Desain,Desain Grafis,Adobe Illustrator,0,Indonesia,Mengenal dan Menguasai Tools di Adobe Illustrator,,12/29/19
User Interface全鏈路學UI設計第二季：Illustrat技能 UI design 插畫 網頁設計 圖标繪製,www.udemy.com/course/user-interfaceuiillustrat-ui-design/,Sjlyedu wang lijun,59.99,11.39,0.0(0 ratings),è¨­è¨,è¨­è¨å·¥å·,Adobe Illustrator,8,Traditional Chinese,é¶åºç¤å­¸ç¿Illustrat å¾å¥éå°ç²¾éUser Interface åºæ¬æè½,6/2019,12/29/19
Aprende Adobe Illustrator desde cero,www.udemy.com/course/aprende-adobe-illustrator-desde-cero/,Noe Cristo,0.0,19.99,0.0(0 ratings),DiseÃ±o,DiseÃ±o grÃ¡fico,Adobe Illustrator,7,EspaÃ±ol,Crea tus propios diseÃ±os en Adobe Illustrator con este curso paso a paso,10/2017,12/29/19
Adobe Illustrator  CC 2018 : Fundamentos básicos,www.udemy.com/course/adobe-illustrator-fundamentos-basicos-para-diseno-grafico/,Angel Sanz,59.99,11.39,3.4(2 ratings),Design,Graphic Design,Adobe Illustrator,3,Spanish,"Aprende como usar Adobe Illustrator con sus tÃ©cnicas de ilustraciÃ³n como diseÃ±o grÃ¡fico, aprende nuevas habilidades!",4/2018,12/29/19
Illustrator para iniciantes: logotipo,www.udemy.com/course/illustrator-para-iniciantes-logotipo/,Veronica Piacenso,0.0,59.99,4.9(8 ratings),TI e software,Outro,Adobe Illustrator,18,PortuguÃªs,Aprendendo do zero,2/2018,12/29/19
Kurs Illustrator Masterclass Sztuka Ilustracji,www.udemy.com/course/kurs-illustrator-masterclass-sztuka-ilustracji/,eduweb.pl - Kursy Wideo,0.0,59.99,0.0(0 ratings),Projektowanie,Projektowanie graficzne,Adobe Illustrator,0,Polski,Praktyczne przykÅady,6/2019,12/29/19
Adobe Illustrator: Entrenamiento esencial,www.udemy.com/course/adobe-illustrator-entrenamiento-esencial/,Mariano Caino,19.99,11.39,0.0(0 ratings),Design,Design Tools,Adobe Illustrator,0,Spanish,Conceptos y tÃ©cnicas bÃ¡sicas para cualquier flujo de trabajo en Illustrator,7/2018,12/29/19
Kurs Adobe Illustrator Techniki Wektoryzacji,www.udemy.com/course/kurs-adobe-illustrator-techniki-wektoryzacji/,eduweb.pl - Kursy,0.0,19.99,0.0(0 ratings),Projektowanie,Projektowanie graficzne,Adobe Illustrator,2,Polski,Kompletny projekt wektoryzacji samochodu,6/2019,12/29/19
illustrator desde 0 a la imprenta,www.udemy.com/course/illustrator-desde-cero-a-la-imprenta/,Marco Multimedia,19.99,11.39,3.8(13 ratings),DiseÃ±o,DiseÃ±o grÃ¡fico,Adobe Illustrator,624,EspaÃ±ol,Aprende a usar illustrator CC y prepara tus ficheros para imprenta.,12/2017,12/29/19
Illustrator - Trucchi e tecniche creative,www.udemy.com/course/illustrator-trucchi-e-tecniche-creative/,Teacher-in-a-Box | Videocorsi Professionali,0.0,69.99,3.8(3 ratings),Design,Graphic Design,Adobe Illustrator,27,Italiano,Andrea Spinazzola,7/2018,12/29/19
ABC do Adobe Illustrator,www.udemy.com/course/abc-do-adobe-illustrator/,Marcos Cropalato,34.99,11.99,4.2(53 ratings),Design,Design grÃ¡fico,Adobe Illustrator,237,PortuguÃªs,Tornando umas das principais ferramentas de criaÃ§Ã£o do mercado simples :D,2/2017,12/29/19
Illustrator desde Cero a Experto,www.udemy.com/course/illustrator-desde-cero-a-experto-netcurso/,NETCURSO | Aprendizaje a un click de distancia,149.99,11.99,3.8(14 ratings),DiseÃ±o,DiseÃ±o grÃ¡fico,Adobe Illustrator,757,EspaÃ±ol,Crea bonitas ilustraciones vectoriales con el programa de diseÃ±o n.Âº 1,11/2018,12/29/19
Pack d'initiation ILLUSTRATOR et AFFINITY DESIGNER,www.udemy.com/course/pack-dinitiation-illustrator-et-affinity-designer/,Damien Barban,39.99,11.99,0.0(0 ratings),Design,Conception graphique,Adobe Illustrator,16,FranÃ§ais,Apprenez les bases de ces deux logiciels pour crÃ©er des illustrations en vectoriel,9/2017,12/29/19
Illustrator CC - De básico a intermedio en menos de una hora,www.udemy.com/course/illustrator-cc/,Juan de Dios León,0.0,19.99,4.6(3 ratings),DiseÃ±o,Herramientas de diseÃ±o,Adobe Illustrator,9,EspaÃ±ol,IlustraciÃ³n vectorial,11/2016,12/29/19
Illustrator 時間短縮テクニック　「Halloweenのカボチャ」と「Kawaii カメレオン」,www.udemy.com/course/illustrator-quick-tip10kawaii/,村守 康,19.99,11.99,3.6(42 ratings),ãã¶ã¤ã³,ã°ã©ãã£ãã¯ãã¶ã¤ã³,Adobe Illustrator,625äººã®åè¬çãç»é²,æ¥æ¬èª,KawaiiãHalloweenã®ã«ããã£ãã¨ãã«ã¡ã¬ãªã³ããæãã¦ãIllustratorã®æç­ãã¯ããã¯ãèº«ã«ä»ããã,4/2018,12/29/19
Curso Online de Adobe Illustrator CC,www.udemy.com/course/top-melhor-curso-online-de-adobe-illustrator-cc/,André Rossiter,49.99,11.99,4.3(20 ratings),Design,Ferramentas de design,Adobe Illustrator,633,PortuguÃªs,OrientaÃ§Ãµes por meio de vÃ­deo aulas em alta definiÃ§Ã£o com especialista Adobe. Confira vÃ­deo aulas demo sem compromisso.,12/2017,12/29/19
誰でもわかる Adobe Illustrator CC 2015,www.udemy.com/course/adobe-illustrator-cc-2015/,アテイン 株式会社,29.99,11.99,3.9(26 ratings),ãã¶ã¤ã³,ãã¶ã¤ã³ãã¼ã«,Adobe Illustrator,143äººã®åè¬çãç»é²,æ¥æ¬èª,ã¢ã¼ãã¯ã¼ã¯ã®å¤å½¢ãåæãçµµç­ã®ææ¸ããã¹ãã¬ã¼æ£å¸ã®è¡¨ç¾ãæå­ã®éç½®æ¹æ³ã¨ãã£ããIllustratorãã¶ã¤ã³ã«å¿è¦ãªåºæ¬æä½ãè¦ãããã¨ãã§ãã¾ããDTPãã¶ã¤ãã¼ãç®æãåå¿èã¯ãã¡ãããã¦ã§ããã¶ã¤ãã¼ã®æ¹ã«ããªã¹ã¹ã¡ã§ãã,11/2015,12/29/19
Automazioni in Photoshop e Illustrator - Base,www.udemy.com/course/automazioni-in-photoshop-e-illustrator-base/,Teacher-in-a-Box | Videocorsi Professionali,0.0,69.99,4.7(2 ratings),Design,Graphic Design,Adobe Illustrator,13,Italiano,Matteo Discardi,4/2018,12/29/19
Adobe Illustrator iniciando en la ilustración,www.udemy.com/course/adobe-illustrator-iniciando-en-la-ilustracion/,Alejandra Montes,19.99,11.99,0.0(0 ratings),IT & Software,Hardware,Adobe Illustrator,0,Spanish,curiosos por la ilustraciÃ³n digital,11/2018,12/29/19
Kurs Projektowanie Graficzne - Tworzenie Opakowań,www.udemy.com/course/kurs-projektowanie-graficzne-tworzenie-opakowan/,eduweb.pl - Kursy Wideo,0.0,59.99,4.0(1 rating),Projektowanie,Projektowanie graficzne,Adobe Illustrator,2,Polski,Opakowania i nadruki,6/2019,12/29/19
誰でもわかる Adobe Illustrator CS6,www.udemy.com/course/adobe-illustrator-cs6-j/,アテイン 株式会社,19.99,11.99,3.9(4 ratings),ãã¶ã¤ã³,ã°ã©ãã£ãã¯ãã¶ã¤ã³,Adobe Illustrator,22äººã®åè¬çãç»é²,æ¥æ¬èª,DTPãã¶ã¤ãã¼ã»ãªãã¬ã¼ã¿ã¼ãç®æãäººã«å¿é ã§ããä»ã®Adobeã½ããã¦ã§ã¢ããèª­ã¿è¾¼ããç´ æå¶ä½ã«ãä½¿ããã®ã§ãå¨ã¦ã®ã¯ãªã¨ã¤ã¿ã¼ã«å½¹ç«ã¤ã½ããã¦ã§ã¢ã§ãã,10/2015,12/29/19
Illustrator CS5 + novità CS6 + novità CC (2013),www.udemy.com/course/illustrator-cs5-novita-cs6-novita-cc-2013/,Teacher-in-a-Box | Videocorsi Professionali,0.0,199.99,4.4(8 ratings),Design,Graphic Design,Adobe Illustrator,32,Italiano,"Andrea Spinazzola, Claudio Marconato",4/2018,12/29/19
Criando Logotipo 3D com Vetores.,www.udemy.com/course/criando-logotipo-3d-com-vetores/,Marconi Bomfim Paiva,34.99,11.99,4.5(1 rating),Design,3D e animaÃ§Ã£o,Adobe Illustrator,6,PortuguÃªs,"Adobe Illustrator, Cine 4D e Keyshot.",1/2019,12/29/19
Impara ad Usare Illustrator Cs 6,www.udemy.com/course/impara-ad-usare-illustrator-cs-6/,Roberto De Grandi,29.99,11.99,3.9(3 ratings),Design,Graphic Design,Adobe Illustrator,7,Italiano,Corso Illustrator CS 6,5/2018,12/29/19
illustrator CC 2015.3 - Curso básico de ferramentas,www.udemy.com/course/illustratorcc20153/,Vitor Santos Fonseca,19.99,11.99,4.3(11 ratings),Design,Design grÃ¡fico,Adobe Illustrator,34,PortuguÃªs,illustrator CC bÃ¡sico,7/2016,12/29/19
"Documentos en LaTeX con AutoCAD, Adobe Acrobat e Illustrator",www.udemy.com/course/documentos-en-latex-con-autocad-adobe-acrobat-e-illustrator/,Miguel Ángel Aguilar García,0.0,Free,2.7(3 ratings),Design,Design Tools,Adobe Acrobat,"2,705",Spanish,Documentos avanzados con LaTeX,7/2019,12/29/19
Nouveautés Adobe CC 2019... (PSD-AI-INDD),www.udemy.com/course/nouveautes-adobe-cc-2019-psd-ai-indd/,ROMAIN DUCLOS,0.0,Free,4.3(19 ratings),Design,Conception graphique,Adobe Illustrator,1Â 209,FranÃ§ais,Mettez -vous a jour pour la version 2019 des logiciels Adobe - Photoshop - Illustrator - indesign,11/2019,12/29/19
AI初级--从放弃到入门视频课程,www.udemy.com/course/yangyigang/,宜刚 杨,0.0,Free,4.1(5 ratings),è®¾è®¡,è®¾è®¡å·¥å·,Adobe Illustrator,155,Simplified Chinese,ä»é¶å¼å§äºè§£AI,9/2019,12/29/19
İleri Blend Tool ve Shape Builder Tool Teknikleri,www.udemy.com/course/ileri-blend-tool-ve-shape-builder-tool-teknikleri/,Gamze Genc Celik,0.0,Free,4.3(134 ratings),TasarÄ±m,TasarÄ±m AraÃ§larÄ±,Adobe Illustrator,3.534,TÃ¼rkÃ§e,Adobe Illustrator CC 2018,9/2018,12/29/19
Illustratorの「線」パネルを使ってイラストを描く,www.udemy.com/course/illustration-fireworks/,KOWAZA デザイン,0.0,Free,0.0(0 ratings),ãã¶ã¤ã³,ã°ã©ãã£ãã¯ãã¶ã¤ã³,Adobe Illustrator,100äººã®åè¬çãç»é²,æ¥æ¬èª,ç·ã®è¡¨ç¾ãç¥ãã¨ãã¶ã¤ã³åãããã,11/2019,12/29/19
【ペンツール編】知識ゼロから即戦力になるためのillustratorCCマスターコース,www.udemy.com/course/illustratorcc-y/,シュムデザイン 新里拓也,0.0,Free,0.0(0 ratings),ãã¶ã¤ã³,ãã¶ã¤ã³ãã¼ã«,Adobe Illustrator,67äººã®åè¬çãç»é²,æ¥æ¬èª,ç¥è­ã¼ã­ããæéã»æç­ã§ãã³ãã¼ã«ããã¹ã¿ã¼ã§ããï¼,12/2019,12/29/19
