Course,URL,instructor,Price (full),Price (discount),Rank,Category 1,Category 2,Category 3,Enrollment,Language,Description,Last Update,Date Scraped
Mastering Types feature in illustrator 2019,www.udemy.com/course/mastering-types-in-illustrator/,Rahul Giri,189.99,11.39,5.0(15 ratings),Design,Graphic Design,Adobe Illustrator,"2,096",English,Super cool and A-Z guide to understanding types in illustrator with hands on project !,5/2019,12/29/19
How to Fake a Watercolour Part 1 Illustrator Brushes,www.udemy.com/course/how-to-fake-a-watercolour-simple-and-complex-illustrator-brushes/,Delores Orridge Naskrent,29.99,11.39,0.0(0 ratings),Design,Graphic Design,Adobe Illustrator,6,English,Learn to create simple and complex water-colour brushes,9/2019,12/29/19
Charming Illustrator Pansy Brushes for Sweet Pattern Repeats,www.udemy.com/course/illustrator-custom-pansy-brushes-for-pattern-repeats/,Delores Orridge Naskrent,24.99,11.39,4.5(1 rating),Design,Graphic Design,Adobe Illustrator,6,English,Learn many Illustrator hidden features when you create custom brushes and a pattern repeat,11/2019,12/29/19
Learn Basic Illustrator,www.udemy.com/course/learn-basic-illustrator/,Learn Tech Plus,199.99,11.39,3.8(58 ratings), IT & Software,Other,Adobe Illustrator,"10,158",English,Learn Everything you need to know about Illustrator,12/2019,12/29/19
Adobe Illustrator CS6 Tutorial For Beginners,www.udemy.com/course/learn-adobe-illustrator-cs6/,Howard  Simpson,19.99,11.39,3.6(20 ratings),IT & Software,Other,Adobe Illustrator,640,English,Learn the basics of Illustrator CS6 with Getting Started and New Features tutorials,3/2015,12/29/19
Adobe Illustrator CC - Learn the Tools,www.udemy.com/course/adobe-illustrator-cc-2018-learn-the-tools-of-the-trade/,Devrishi Gupta,19.99,11.39,4.3(12 ratings),Design,Graphic Design,Adobe Illustrator,542,English, Learn more than 80 tools in Adobe Illustrator CC.,2/2018,12/29/19
Adobe Illustrator: How to Draw Squared Animals Icons,www.udemy.com/course/adobe-illustrator-how-to-draw-squared-animals-icons/,Andrey Bzhitskikh,179.99,11.39,4.5(59 ratings),Design,Graphic Design,Adobe Illustrator,"2,973",English,Graphic Design. The Complete Adobe Illustrator Course For Beginners and Advanced Designers. Drawing Animals Icons.,6/2018,12/29/19
Adobe Illustrator for Photoshop Users,www.udemy.com/course/illustrator-for-photoshop-users/,Helen Bradley,19.99,11.39,4.7(23 ratings),Design,Design Tools,Adobe Illustrator,238,English,Get up and running fast in Illustrator CC by harnessing the knowledge you have from working in Photoshop.,9/2019,12/29/19
Adobe Illustrator for Non-Artists,www.udemy.com/course/adobe-illustrator-for-non-artists/,Helen Bradley,19.99,11.39,4.3(8 ratings),Design,Graphic Design,Adobe Illustrator,35,English,Create designs in Illustrator even if you can't draw - create and monetize your designs today!,10/2018,12/29/19
Introduction to Adobe Illustrator CC,www.udemy.com/course/introduction-to-adobe-illustrator-cc/,Framework Television Inc.,99.99,11.39,4.6(3 ratings),Design,Design Tools,Adobe Illustrator,22,English,Learn the Fundamentals of Digital Illustration and Vector Graphics Manipulation,7/2019,12/29/19
Beginner's Course on Logo & Graphic Design using Illustrator,www.udemy.com/course/beginners-course-on-logo-graphic-design-using-adobe-illustrator/,Ummu Salma,94.99,11.39,3.5(3 ratings),Design,Graphic Design,Logo Design,29,English,Beginner's Course on Logo & Graphic Designing,10/2017,12/29/19
"Speed, Efficiency, and Productivity in Adobe Illustrator",www.udemy.com/course/speed-efficiency-and-productivity-in-adobe-illustrator/,Anne Bracker,19.99,11.39,4.3(7 ratings),Design,Graphic Design,Adobe Illustrator,"1,498",English,"Increase your Adobe Illustrator speed and efficiency with tips, tricks and keyboard shortcuts tailored for productivity",5/2019,12/29/19
How To Draw Your Illustration Using Pen Tool in Illustrator,www.udemy.com/course/digital-illustration-pen-tool-adobe-illustrator-trace-illustrator-cs6/,Dawid Tuminski,194.99,11.39,4.2(18 ratings),Design,Design Tools,Adobe Illustrator,513,English,How To Efficiently Draw Your Illustration Using Pen Tool in Illustrator Digital illustration Trace,7/2018,12/29/19
Create Flat Design Spaceships in Adobe Illustrator!,www.udemy.com/course/create-flat-design-spaceships-in-adobe-illustrator/,Mammoth Interactive,99.99,11.39,5.0(1 rating),Design,Graphic Design,Adobe Illustrator,9,English,A Compact Course on Adobe Illustrator developed for highly efficient learning. Digitally draw 3 flat design spaceships.,9/2017,12/29/19
Badge / Sticker Template Design With Adobe Illustrator,www.udemy.com/course/badge-sticker-template-design-with-adobe-illustrator/,Nicholas Romanakis,19.99,11.39,0.0(0 ratings),Design,Graphic Design,Adobe Illustrator,4,English,Learn To Make Badge / Sticker Template Designs & Prepare Them For Print,11/2019,12/29/19
Digital Illustration: Make A Custom Character Illustration,www.udemy.com/course/digital-illustration/,Cory Kensinger,44.99,11.39,4.0(26 ratings),Design,Graphic Design,Adobe Illustrator,"1,510",English,Learn How To Use Adobe Illustrator CC to Create Custom Designs & Illustrations For Your Online Products,11/2015,12/29/19
Creating Puzzle Pieces with Illustrator and Photoshop,www.udemy.com/course/creating-puzzle-pieces-with-illustrator-and-photoshop/,Shane Hogan,19.99,11.39,4.9(6 ratings),Design,Design Tools,Adobe Illustrator,353,English,Learn to create puzzle pieces of any size or shape for use in your latest project or App using Photoshop & Illustrator,12/2013,12/29/19
Self Publish Greeting Cards,www.udemy.com/course/learn-to-create-saleable-greeting-cards/,Delores Orridge Naskrent,24.99,11.39,0.0(0 ratings),Design,Graphic Design,Adobe Illustrator,4,English,Learn the workflow and many Illustrator and Photoshop skills,9/2019,12/29/19
Illustrator - Creating stylised images from a photo,www.udemy.com/course/illustrator-free-creating-stylised-images-from-a-photo-using-trace/,David Newton,49.99,11.39,4.7(14 ratings),Design,Graphic Design,Adobe Illustrator,"1,532",English,Quickly convert a photo to a vector using the trace tools in illustrator,3/2017,12/29/19
How to create a 10 diffrent Patterns in Adobe Illustrator,www.udemy.com/course/how-to-create-a-10-diffrent-patterns-in-adobe-illustrator/,Tomasz Kościański,59.99,11.39,3.5(14 ratings),Design,Graphic Design,Adobe Illustrator,299,English,Learn how to create10 diffrent Patterns using Adobe Illustrator. For beginners and beyond.,8/2017,12/29/19
Web design : How To Design a Website in Illustrator,www.udemy.com/course/web-design-design-website-a-web-design-software-illustrator-cs6/,Dawid Tuminski,194.99,11.39,3.8(31 ratings),Design,Web Design,Adobe Illustrator,"1,451",English,Web design How to design a Corporate Website in Adobe Illustrator Design Web Layout in Illustrator CS6,11/2016,12/29/19
How to design  retro and flat design badges in Illustrator,www.udemy.com/course/badge-design-in-adobe-illustrator-tutorial-graphic-design/,Dawid Tuminski,194.99,11.39,4.7(3 ratings),Design,Graphic Design,Adobe Illustrator,46,English,Design stunning retro and flat design badges in Adobe Illustrator CC,7/2019,12/29/19
Adobe Illustrator | Master in 3D,www.udemy.com/course/adobe-illustrator-master-in-3d/,HU Shahir,24.99,11.39,3.7(6 ratings),Design,Graphic Design,Adobe Illustrator,459,English,"Complete guide to 3D Extruding , Beveling , Mask interaction in 3D and Mapping with Adobe Illustrator.",7/2016,12/29/19
Adobe Illustrator T-Shirt Design for Merch by Amazon,www.udemy.com/course/merchbyamazondesign/,Michael Peterson,69.99,11.39,3.4(114 ratings),Design,Graphic Design,Adobe Illustrator,"1,627",English,This Merch by Amazon course will teach you how to create a basic t-shirt for Merch by Amazon & learn Adobe Illustrator,7/2017,12/29/19
Web Design Fundamentals in Illustrator,www.udemy.com/course/web-design-software-web-designer-adobe-illustrator-cs6/,Dawid Tuminski,194.99,11.39,3.7(74 ratings),Design,Web Design,Adobe Illustrator,"1,527",English,Web design basics in Illustrator Web Design Fundamentals Web design essentials Web design in Illustrator Web design,4/2017,12/29/19
Adobe illustrator Full Practical course Video Training,www.udemy.com/course/adobe-illustrator-full-practical-course-video-training/,Mr.Sarwar Ahmed,24.99,11.39,5.0(3 ratings),Design,Graphic Design,Adobe Illustrator,23,English,Be a dominator with Adobe Illustrator,6/2018,12/29/19
Adobe Illustrator CS ACE Exam - Practice Tests,www.udemy.com/course/adobe-illustrator-cs-ace-exam-practice-tests/,Aravind Selvam,19.99,11.39,2.9(8 ratings),Development,Development Tools,Adobe Illustrator,36,English,This is a compilation of the actual questions and answers from the Adobe Illustrator CS ACE Exam test.,12/2017,12/29/19
Triangulated Bird: Origami Styled Bird in Adobe Illustrator,www.udemy.com/course/triangulated-bird-origami-styled-bird-in-adobe-illustrator/,Andrey Bzhitskikh,194.99,11.39,4.6(31 ratings),Design,Graphic Design,Adobe Illustrator,"2,118",English,Graphic Design: How to draw a magnificent bird from triangles in Adobe Illustrator. Creative Illustration.,4/2017,12/29/19
Logo Design Workshop,www.udemy.com/course/logoworkshop/,Daniel Evans,49.99,11.39,4.2(97 ratings),Design,Graphic Design,Logo Design,"1,285",English,"Learn from a Published, Multi-Award Winning Logo Designer! 20+ Years Experience!",11/2019,12/29/19
Adobe Illustrator CC Advanced,www.udemy.com/course/adobe-illustrator-advanced/,Intellezy Trainers,39.99,11.39,4.1(6 ratings),Design,Graphic Design,Adobe Illustrator,32,English,Take your Illustrator skills to the next level in this advanced course,4/2018,12/29/19
Adobe Illustrator CC Portfolio Course,www.udemy.com/course/adobe-illustrator-cc-portfolio-course/,Maggie Hobson-Baker,19.99,11.39,0.0(0 ratings),Design,Graphic Design,Adobe Illustrator,4,English,5 Fun Portfolio Building Projects in Illustrator CC,4/2018,12/29/19
Learn Illustrator CC: Create a Simple Flat Vector Orc,www.udemy.com/course/learn-illustrator-cc-create-a-simple-flat-vector-orc/,Jonathan Lam,49.99,11.39,4.4(84 ratings),Design,Graphic Design,Adobe Illustrator,"13,769",English,Start learning Adobe Illustrator CC by creating a Flat Orc Character in this quick and easy course.,10/2019,12/29/19
"Illustrator Complete Beginner Tips, Tricks & Basics.",www.udemy.com/course/illustrator-tips-and-tricks-master-class-course/,Youssef Sanad,99.99,11.39,3.6(108 ratings),Design,Graphic Design,Adobe Illustrator,"4,251",English,"Learn Illustrator Complete Beginner Tips, Tricks & Basics. Updatable course!",6/2018,12/29/19
Great Creative Market Listings That Sell,www.udemy.com/course/creative-market-listings-that-sell/,Delores Orridge Naskrent,24.99,11.39,0.0(0 ratings),Design,Graphic Design,Adobe Illustrator,3,English,Make passive income from Assets you already have,11/2019,12/29/19
How To Draw a Realistic Glass in Adobe Illustrator CC,www.udemy.com/course/how-to-draw-glass-in-adobe-illustrator-cc/,Sasikumar Arasaratnam,24.99,11.39,0.0(0 ratings),Design,Graphic Design,Adobe Illustrator,3,English,Learn advanced skills you need to create a realistic vector illustrations using Adobe Illustrator CC,11/2019,12/29/19
Adobe illustrator in an easy way : create awesome designs,www.udemy.com/course/adobe-illustrator-in-an-easy-way-create-awesome-designs/,Joseph adam,199.99,11.39,4.0(188 ratings),Design,Graphic Design,Adobe Illustrator,"13,993",English,The Adobe Illustrator course allow you to learn the most important tools to create your own designs,3/2019,12/29/19
Adobe Illustrator CC Beginner,www.udemy.com/course/adobe-illustrator-beginner/,Intellezy Trainers,39.99,11.39,4.7(35 ratings),Design,Graphic Design,Adobe Illustrator,89,English,"Gain a comprehensive overview of Adobe Illustrator, the premier drawing program used by artists and graphic designers.",4/2018,12/29/19
Learn to Use Blend By Making Geometric Art in Illustrator,www.udemy.com/course/learn-to-use-blend-by-making-geometric-art-in-illustrator/,Aleksey Shlenchik,19.99,11.39,3.9(9 ratings),Design,Graphic Design,Adobe Illustrator,"1,293",English,How to use blend tool to create geometric art,7/2018,12/29/19
Learn to Create a Mandala with Adobe Illustrator,www.udemy.com/course/learn-to-create-a-mandala-with-adobe-illustrator/,UK Online Training Centre,49.99,11.39,4.2(3 ratings),Design,Graphic Design,Adobe Illustrator,39,English,Want to learn how to create a Mandala in Illustrator if the answer is yes! then take this indepth course,4/2017,12/29/19
How to make cartoon characters | Photoshop to Illustrator,www.udemy.com/course/how-to-make-cartoon-characters/,Adam Miconi,59.99,11.39,3.5(1 rating),Design,Graphic Design,Cartoon Drawing,16,English,"Learn to draw and illustrate, cute and grumpy cartoon characters.",11/2017,12/29/19
Foundation Skills on Adobe Illustrator: Learn Fast!,www.udemy.com/course/foundation_skills_illustrator/,Farabi Shayor ACIM,49.99,11.39,4.4(50 ratings),Design,Graphic Design,Adobe Illustrator,"2,510",English,Your BEST GUIDE to learn Adobe Illustrator to designing your own print-ready marketing materials super fast!,2/2017,12/29/19
Adobe Illustrator CC : Graphic Design tools in Illustrator,www.udemy.com/course/illustratorsupercourse/,Prem Chand,64.99,11.39,4.1(82 ratings),Design,Graphic Design,Adobe Illustrator,"1,526",English,Learn how to expertly use Adobe Illustrator for Vector Graphic Design. Explains every illustrator tool in full detail.,1/2019,12/29/19
Creating Icons with Adobe Illustrator,www.udemy.com/course/creating-icons-with-illustrator/,Max Burnside,29.99,11.39,4.3(31 ratings),Design,Graphic Design,Adobe Illustrator,"2,282",English,Learn to create a custom set of icons that complements the needs and feel of any project.,8/2015,12/29/19
Adobe Illustrator for Illustration and Design,www.udemy.com/course/adobe-illustrator-for-illustration-and-design/,Aaron Porter,89.99,11.39,5.0(1 rating),Design,Graphic Design,Adobe Illustrator,8,English,"A beginner to intermediate course on using Adobe Illustrator to create illustrations, logos, icons and design",7/2019,12/29/19
Create Easy Simple Shaped Cartoons in Adobe Illustrator,www.udemy.com/course/simple-shaped-cartoons-illustrator-shape-builder/,Deanna Sheehan,29.99,11.39,4.3(27 ratings),Design,Graphic Design,Adobe Illustrator,"1,175",English,Learn to create fun Easy Illustrator Cartoons using Simple Shapes in Adobe Illustrator in this Project Based Course,11/2017,12/29/19
Flat Design One Page Website with Photoshop and Illustrator,www.udemy.com/course/flat-design-one-page-website-with-photoshop-and-illustrator/,Ferdi Armagan,29.99,11.39,3.7(57 ratings),Design,Web Design,Adobe Illustrator,597,English,"A step-by-step course to master modern webdesign styles such as flat design, one-page layout with Photoshop/Illustrator",11/2014,12/29/19
Create Your First Low Poly Portrait and Sell it Online,www.udemy.com/course/create-your-first-low-poly-portrait-and-sell-it-online/,Assem Hafsi,69.99,11.39,0.0(0 ratings),Design,Graphic Design,Adobe Illustrator,2,English,Learn how to create a low poly portrait in Adobe Illustrator and print your final design on a T-shirt to sell it online,10/2019,12/29/19
Master Terrazzo: Creating Vector Tiles with Adobe Illustrati,www.udemy.com/course/master-terrazzo/,Rich Armstrong,19.99,11.39,4.5(4 ratings),Design,Graphic Design,Adobe Illustrator,14,English,Combine Generative Art Practices with Adobe Illustrator to Make Amazing Artwork,3/2017,12/29/19
Adobe Illustrator CC Master-Class: Creating Shapes,www.udemy.com/course/adobe-illustrator-cc-create-any-shape/,Nitish Ganesh Mankeshvar,19.99,11.39,5.0(2 ratings),Design,Design Tools,Adobe Illustrator,14,English,When It Comes To Illustrator It Comes To Building And Creating Vector Shapes.,5/2018,12/29/19
Earn and Learn to create Logo designs in Illustrator quickly,www.udemy.com/course/learn-to-create-wicked-logo-designs-in-illustrator-quickly/,David Newton,49.99,11.39,5.0(2 ratings),Design,Graphic Design,Adobe Illustrator,30,English,"Create stunning logos all in Illustrator, these can be scaled indefinetly and always remain crystal sharp.",3/2017,12/29/19
Mastering Retina Graphics 2019,www.udemy.com/course/mastering-retina-graphics/,Rahul Giri,194.99,11.39,4.9(12 ratings),Design,Graphic Design,Adobe Illustrator,"2,589",English,Let's Learn and Master to Create Retina or HiDPI graphics in Photoshop and Illustrator with hands on experience.,5/2019,12/29/19
Logo Design Masterclass With Adobe Illustrator,www.udemy.com/course/design-a-brand/,Rapid Growth Coaching Top 10% on Udemy,199.99,11.39,3.7(23 ratings),Marketing,Branding,Adobe Illustrator,"1,843",English,Discover logo design from scratch with Adobe Illustrator using a simple method that gets advanced results.,10/2016,12/29/19
Illustrator Business Course - fast - for beginners,www.udemy.com/course/illustrator-business/,Christoffer Nyland,19.99,11.39,4.2(8 ratings),Design,Graphic Design,Adobe Illustrator,"2,615",English,"Make the design for your own business - Logo, Businesscard, Letterhead and Brochure",12/2019,12/29/19
Learn Shading and Depth in Adobe Illustrator,www.udemy.com/course/shading-and-depth-in-adobe-illustrator/,David Miller,29.99,11.39,4.5(1 rating),Design,Graphic Design,Adobe Illustrator,545,English,Add Atmosphere and Life to Graphic Design in Illustrator,10/2017,12/29/19
Adobe Illustrator CC 2019:  the Fundamentals,www.udemy.com/course/les-nouvelles-techniques-de-dessin-sur-illustrator/,Rachid Bouyoussef,49.99,18.99,3.7(54 ratings),Design,Graphic Design,Adobe Illustrator,"3,414",English,Learn How To Become Creative With Adobe Illustrator CC,4/2019,12/29/19
Animating A Badge,www.udemy.com/course/animating-a-badge/,Richard Adam Jones,29.99,11.39,4.6(2 ratings),Design,"3D & Animation
 ",After Effects,13,English,Workflow from Illustrator to After Effects,3/2017,12/29/19
Creating Shapes with Illustrator 2019,www.udemy.com/course/mastering-shapes-creation-in-illustrator/,Rahul Giri,199.99,11.39,4.0(35 ratings),Design,Graphic Design,Adobe Illustrator,"3,020",English,"Let's learn, understand and unleashed the true super power of illustrator by mastering shape creations in it.",5/2019,12/29/19
Adobe Illustrator CC Graphic Web Design: UI & Logo Design,www.udemy.com/course/adobe-illustrator-cc-graphic-web-design-ui-logo-design/,Easy Learn,184.99,11.39,1.5(100 ratings), Design,Graphic Design,Adobe Illustrator,"2,363",English,"Adobe Illustrator CC Graphic Design: Web Design, UI Design, Logo Design, Sketch & UX Design For Designers & Developers",1/2018,12/29/19
How to make Geometric Art in Adobe Illustrator,www.udemy.com/course/how-to-make-geometric-line-art-in-adobe-illustrator/,Aleksey Shlenchik,19.99,11.39,4.1(14 ratings),Design,Graphic Design,Adobe Illustrator,"1,292",English,Creating Digital Vector Art in Adobe Illustrator,3/2018,12/29/19
Learn to Design a Logo in Adobe Illustrator,www.udemy.com/course/learn-to-design-a-logo-in-adobe-illustrator/,Ray Ledzus,19.99,11.39,4.3(55 ratings),Design,Graphic Design,Logo Design,"3,400",English,"Learn how to turn ""nice"" logos into ones that capture the hearts and imaginations of clients and their customers.",10/2014,12/29/19
Make flat design trees in Adobe Illustrator in 30 minutes!,www.udemy.com/course/make-flat-design-trees-in-adobe-illustrator-in-30-minutes/,John Bura,49.99,11.39,3.8(138 ratings),Design,Graphic Design,Adobe Illustrator,"2,210",English,Learn how to easily make flat design trees. Learn about the sophistication of simplicity of flat design.,1/2016,12/29/19
Adobe Illustrator CC for beginners create custom brushes,www.udemy.com/course/adobe-illustrator-cc-2019-custom-brushes-design-for-vectors/,Jagdish-Kumar Suthar,54.99,11.39,5.0(3 ratings),Design,Design Thinking,Adobe Illustrator,7,English,Learn creating almost all types of brushes for Adobe Illustartor to make vectors,6/2019,12/29/19
How to make Digital Art in Adobe Illustrator,www.udemy.com/course/how-to-make-digital-art-in-adobe-illustrator/,Cory Kensinger,29.99,11.39,4.1(68 ratings),Design,Graphic Design,Adobe Illustrator,"3,324",English,"Creating Complex Vector Illustrations, Line Art, & Shapes",11/2017,12/29/19
Digital Illustration Tricks in Adobe Illustrator,www.udemy.com/course/digital-illustration-tricks-in-adobe-illustrator/,Cory Kensinger,29.99,11.39,3.8(39 ratings),Design,Graphic Design,Adobe Illustrator,"4,687",English,Using the Mesh Tool & Custom Swatch Patterns,12/2017,12/29/19
Coral and Sea Life Easy Illustrator Brush & Pattern Making,www.udemy.com/course/coral-and-sea-life-easy-illustrator-brush-and-pattern-making/,Delores Orridge Naskrent,29.99,11.39,0.0(0 ratings),Design,Design Tools,Adobe Illustrator,1,English,Use Illustrator brushes to make more brushes for creating the intricate fitted Coral and Sea Life pattern design,12/2019,12/29/19
The Play-Doh Technique: Fun Hand-made Vectors In Illustrator,www.udemy.com/course/play-doh-technique/,Rich Armstrong,19.99,11.39,4.2(49 ratings),Design,Graphic Design,Adobe Illustrator,"1,174",English,Learn to use the Warp tool in Illustrator to give your designs a hand-made feel,9/2019,12/29/19
"Illustrator beginner to intermediate, basics and training",www.udemy.com/course/learn-adobe-illustrator/,Nicolas Forgue,39.99,11.39,0.0(0 ratings),Design,Graphic Design,Adobe Illustrator,63,English,"Learn Adobe Illustrator from the beginning, master the different tools, create your own projects",12/2018,12/29/19
1 Hour Button Master,www.udemy.com/course/1-hour-button-master/,Ludwig Heijden,19.99,11.39,5.0(2 ratings),Design,User Experience, Adobe Illustrator,9,English,The fastest way to create and organize buttons in Adobe Illustrator CC,10/2018,12/29/19
How to Create Vector Characters in Illustrator or Photoshop,www.udemy.com/course/how-to-create-vector-characters-in-illustrator-or-photoshop/,Bryant Dodd,24.99,11.39,4.2(6 ratings),Design,Graphic Design,Adobe Illustrator,109,English,A perfect video guide to drawing each element step by step.,3/2015,12/29/19
Emoji Design With Adobe Illustrator,www.udemy.com/course/emoji-design-with-adobe-illustrator/,Joseph adam,199.99,11.39,4.0(19 ratings),Design,Graphic Design,Adobe Illustrator,"5,781",English,Learn how to use the Adobe Illustrator in an easy and simple way.,9/2019,12/29/19
Adobe Illustrator CC - Design Your Own Awesome Avatar,www.udemy.com/course/adobe-illustrator-for-beginners-design-an-awesome-avatar/,Andy Clarke,29.99,11.39,0.0(0 ratings),Design,Graphic Design,Adobe Illustrator,652,English,Get hands on experience and 'learn-by-doing' in this course designed for individuals who want to learn Illustrator CC.,5/2019,12/29/19
Cartooning using Adobe Illustrator,www.udemy.com/course/cartooning-using-adobe-illustrator/,Hamed Hazel,19.99,11.39,0.0(0 ratings),Design,3D & Animation,Adobe Illustrator,9,English,Let's Draw!,9/2018,12/29/19
Learn Illustrator CC: Create a Vector Knight,www.udemy.com/course/vector-knight/,Jonathan Lam,29.99,11.39,4.7(52 ratings),Design,Graphic Design,Adobe Illustrator,"8,045",English,Start learning Adobe Illustrator CC by creating a Vector Knight in this quick and easy course.,10/2019,12/29/19
How To Create A Low Poly Portrait With The Pen Tool,www.udemy.com/course/how-to-create-a-low-poly-portrait-with-the-pen-tool-adobe-illustrator/,Dawid Tuminski,194.99,11.39,5.0(8 ratings),Design,Graphic Design,Adobe Illustrator,326,English,How To Create A Low Poly Portrait With The Pen Tool in Adobe Illustrator How To Learn the Pen Tool in Illustrator,12/2016,12/29/19
Master Adobe Illustrator with ease,www.udemy.com/course/master-adobe-illustrator-with-ease/,Samnan Ahmed,44.99,11.39,4.1(5 ratings),Design,Graphic Design,Adobe Illustrator,618,English,A Completely new perspective of learning Adobe Illustrator,10/2017,12/29/19
Top 10 reasons to use Illustrator for web design,www.udemy.com/course/top-10-reasons-to-use-illustrator-for-web-design/,Dawid Tuminski,44.99,11.39,4.4(86 ratings),Design,Web Design,Adobe Illustrator,"4,874",English,Why Illustrator is great for web design. Web design tricks and tips. Web design basics,10/2016,12/29/19
Adobe Illustrator CC 2017 for beginners: Logo Design Concept,www.udemy.com/course/adobe-illustrator-cc-2017/,Jamshaid Raza,199.99,11.39,3.8(48 ratings),Design,Graphic Design,Adobe Illustrator,"2,539",English,"Learn Adobe Illustrator CC 2017 and Have fun learning the basic, essential skills in Graphic Design. And make your logo.",6/2017,12/29/19
Getting Started with Illustrator CC,www.udemy.com/course/getting-started-with-illustrator-cc2/,Stone River eLearning,99.99,11.39,4.5(24 ratings),Design,Graphic Design,Adobe Illustrator,129,English,A step-by-step guide to mastering Adobeâs flagship vector graphics editor!,2/2017,12/29/19
illustrator 3D in-Depth Course,www.udemy.com/course/illustrator-3d-in-depth-course/,M Umar,29.99,11.39,4.7(5 ratings),Design,Graphic Design,Adobe Illustrator,"1,096",English,"Let's go advance with illustrator 3D Capabilities packed with bundle of Tips, Tricks and Example Projects",7/2018,12/29/19
Learn Logo Designing: 5 Types of Logo Designs in Illustrator,www.udemy.com/course/learn-logo-design-tutorial-in-illustrator-beginners/,Sharjeel Ashraf,29.99,11.39,3.0(3 ratings),Design,Graphic Design,Adobe Illustrator,106,English,"Simple Steps to learn Iconic, Typography and 3D Logo Designs in Adobe Illustrator. Make KFC, Kit kat and others.",5/2017,12/29/19
How To Design More in Less Time in Adobe Illustrator,www.udemy.com/course/how-to-get-the-most-from-the-adobe-illustrator/,Alex Kovalenko,49.99,11.39,3.7(10 ratings),Design,Design Tools,Adobe Illustrator,58,English,"Increase your productivity in Adobe Illustrator by automating boring stuff using action, graphic styles and scripts",3/2018,12/29/19
Most Wanted Flat Design Techniques #3: Office Space,www.udemy.com/course/flat-design-flat-ui-design-flat-colors-flat-design-office-space/,Dawid Tuminski,94.99,11.39,5.0(4 ratings),Design,Graphic Design,Adobe Illustrator,"1,047",English,Flat design : How to create advanced flat design projects Most wanted flat design techniques Flat Design in Illustrator,1/2017,12/29/19
