Course,URL,instructor,Price (full),Price (discount),Rank,Category 1,Category 2,Category 3,Enrollment,Language,Description,Last Update,Date Scraped
Illustrator CC 2020 MasterClass,www.udemy.com/course/illustrator-cc-masterclass/,Martin Perhiniak,199.99,12.59,"4.6(17,616 ratings)",Design,Graphic Design,Adobe Illustrator,"85,582",English,Master Adobe Illustrator CC with this in-depth training for all levels.,11/2019,12/29/19
Adobe Illustrator CC - Essentials Training Course,www.udemy.com/course/adobe-illustrator-course/,Video School Online Inc,199.99,11.99,"4.7(5,203 ratings)",Design,Graphic Design,Adobe Illustrator,"22,173",English,"Learn Adobe Illustrator CC graphic design, logo design, and more with this in-depth, practical, easy-to-follow course!",12/2019,12/29/19
Adobe Illustrator CC – Advanced Training Course,www.udemy.com/course/adobe-illustrator-cc-advanced-training/,Daniel Walter Scott,199.99,11.39,"4.7(2,115 ratings)",Design,Graphic Design,Adobe Illustrator,"14,490",English,"In this Adobe Illustrator Advanced course we'll learn Advanced techniques for graphic design, logo design & illustration",11/2019,12/29/19
"Adobe CC Masterclass: Photoshop, Illustrator, XD & InDesign",www.udemy.com/course/adobe-cc-masterclass-graphic-design-photoshop-illustrator-xd-indesign/,Lindsay Marsh,179.99,14.39,4.6(727 ratings),Design,Design Tools,Adobe Illustrator,"9,521",English,"Learn graphic design today with Photoshop, Illustrator, Adobe XD, InDesign & more in this Adobe CC Masterclass!",11/2019,12/29/19
Logo Design in Adobe Illustrator - for Beginners & Beyond,www.udemy.com/course/logodesign/,Daniel Evans,199.99,11.99,"4.5(2,317 ratings)",Design,Graphic Design,Logo Design,"13,737",English,"Learn from a Published, Multi-Award Winning Logo Designer! 20+ Years Experience!",,12/29/19
UI & Web Design using Adobe Illustrator CC,www.udemy.com/course/ui-web-design-using-adobe-illustrator-2017/,Daniel Walter Scott,199.99,11.39,"4.6(1,693 ratings)",Design,Web Design,User Interface,"10,466",English,Build professional web & app designs using Adobe Illustrator CC,7/2019,12/29/19
Adobe Illustrator Advanced Vector Artwork,www.udemy.com/course/adobe-illustrator-advance-vector-artwork/,"Widhi Muttaqien, S.Kom, MMSI",89.99,11.99,4.6(949 ratings),Design,Graphic Design,Adobe Illustrator,"6,141",English,Learn the secrets of creating every type of vector illustration you can think of from a real expert,11/2019,12/29/19
Logo Design Masterclass: Learn Logo Design + Illustrator,www.udemy.com/course/become-a-professional-logo-designer/,"Chad Neuman, Ph.D.",199.99,11.39,"4.3(1,257 ratings)",Design,Graphic Design,Logo Design,"13,103",English,Learn logo design with Adobe Illustrator CC by applying logo design principles and techniques. For beginners and beyond.,11/2019,12/29/19
Illustrator CC 2020 MasterClass : Be a Creative Professional,www.udemy.com/course/illustrator-cc-masterclass-c/,Khalil Ibrahim,199.99,11.39,4.7(440 ratings),Design,Design Tools,Adobe Illustrator,"2,075",English,Master Adobe Illustrator CC from Beginner to Creative Professional in Artistic way with Design Concepts & Theories !,11/2019,12/29/19
Logo Design in Adobe Illustrator - The Intermediate Level,www.udemy.com/course/logodesignintermediate/,Daniel Evans,199.99,11.39,4.6(288 ratings),Design,Graphic Design,Adobe Illustrator,"7,235",English,"Learn from a Published, Multi-Award Winning Logo Designer! 20+ Years Experience!",11/2019,12/29/19
Learn to draw fashion with Adobe Illustrator CC - Beginners,www.udemy.com/course/learn-to-draw-fashion-with-adobe-illustrator-cc-beginners/,Jo Hughes,44.99,11.39,4.3(626 ratings),Design,Fashion,Adobe Illustrator,"3,100",English,Illustrator training specifically tailored for fashion designers,8/2015,12/29/19
Adobe Illustrator: Mastering the Fundamentals,www.udemy.com/course/adobe-illustrator-training/,[ School of Game Design ],54.99,11.39,"4.6(4,786 ratings)",Design,Game Design,Adobe Illustrator,"64,704",English,Learn powerful illustration techniques in Adobe Illustrator master digital painting and graphic design with new skills!,11/2018,12/29/19
Photoshop and Illustrator speed illustration workflow,www.udemy.com/course/photoshop-and-illustrator-speed-illustration-workflow/,"Widhi Muttaqien, S.Kom, MMSI",99.99,11.39,4.8(371 ratings),Design,Graphic Design,Adobe Illustrator,"2,713",English,"Combine the power of raster and vector to create any type of digital drawing In fast, beautiful and modular way",7/2019,12/29/19
Learn to draw fashion with Adobe Illustrator CC Intermediate,www.udemy.com/course/learn-to-draw-fashion-with-adobe-illustrator-cc-intermediate/,Jo Hughes,44.99,11.39,4.4(151 ratings),Design,Fashion,Adobe Illustrator,"1,774",English,Illustrator training specifically tailored for fashion designers,3/2016,12/29/19
Adobe Illustrator CC Mastery: Zero to Hero in Illustrator,www.udemy.com/course/illustrator-introduction/,"Chad Neuman, Ph.D.",49.99,11.39,"4.4(1,217 ratings)",Design,Design Tools,Adobe Illustrator,"42,426",English,Illustrator introduction for beginners or illustrators who want to learn more about illustrator. Learn the essentials!,11/2019,12/29/19
Adobe Illustrator Pattern Making Masterclass,www.udemy.com/course/make-patterns-in-illustrator/,Helen Bradley,19.99,11.39,4.6(116 ratings),Design,Graphic Design,Adobe Illustrator,559,English,Boost your Graphic Design skills - make seamless patterns in Illustrator - in-depth training for all experience levels,10/2019,12/29/19
Adobe Illustrator for Zombies (and beginners too),www.udemy.com/course/teaching-zombies-adobe-illustrator/,Brad Colbow,19.99,11.39,4.7(338 ratings),Design,Design Tools,Adobe Illustrator,"1,316",English,Learning Illustrator shouldn't be this much fun. Join us as we teach a zombie Adobe Illustrator.,8/2017,12/29/19
Create HUD graphics in After Effects and Illustrator,www.udemy.com/course/hud-interface-animation-in-after-effects-and-illustrator/,Motion School,164.99,11.39,4.8(118 ratings),Design,3D & Animation,After Effects,"1,135",English,Design and Animate HUD Interface using After Effects and Illustrator,6/2018,12/29/19
Adobe Illustrator Masterclass: Learn from an Expert Designer,www.udemy.com/course/adobe-illustrator-masterclass-learn-from-an-expert-designer/,Lindsay Marsh,144.99,11.39,4.3(92 ratings),Design,Graphic Design,Adobe Illustrator,"1,891",English,"Master Adobe Illustrator with Practical Projects Including: Logo Design, Tshirt, Social Graphics, Posters, Flyers & More",4/2019,12/29/19
Adobe Illustrator CC Tutorial - Training Taught By Experts,www.udemy.com/course/adobe-illustrator-cc-tutorial/,Infinite Skills,49.99,11.39,"4.5(1,837 ratings)",Design,"Design Tools
 ",Adobe Illustrator,"21,584",English,Learn the skills to become creative with Adobe Illustrator CC. A practical hands-on tutorial for users of all levels,1/2017,12/29/19
Adobe Illustrator CS6 Tutorial - Training Taught By Experts,www.udemy.com/course/learning-adobe-illustrator-cs6/,Infinite Skills,49.99,11.39,4.5(834 ratings),Design,Design Tools,Adobe Illustrator,"10,440",English,Learn to create stunning art work Adobe Illustrator. A practical hands-on tutorial for Illustrator users of all levels,1/2017,12/29/19
Great Shirt Design in Adobe Illustrator for Merch By Amazon,www.udemy.com/course/great-shirt-design-in-adobe-illustrator-for-merch-by-amazon/,Brad Colbow,19.99,11.39,4.7(138 ratings),Design,Graphic Design,Adobe Illustrator,932,English,Well designed t-shirts just sell better. Learn about design while also learning all the basics of Adobe Illustrator.,7/2018,12/29/19
Character Design For Animation in Illustrator,www.udemy.com/course/character-design-for-animation-in-illustrator/,2D Animation 101 Courses,49.99,11.39,4.4(480 ratings),Design,3D & Animation,Adobe Illustrator,"9,666",English,Design Memorable Character With a Strong Personality and Learn How to Prepare them for Animation,9/2018,12/29/19
The Ultimate Guide to Every Adobe Illustrator Tool,www.udemy.com/course/adobe-illustrator-cs6-cc-pen-tool-paintbrush-tutorial-graphic-design/,Dawid Tuminski,194.99,11.39,4.3(158 ratings),Design,Design Tools,Adobe Illustrator,"1,681",English,"More than 80 Adobe Illustrator tools explained step-by-step. Pen tool, Live Paint tool, Gradients finally explained!",11/2018,12/29/19
How to create flat design icons in 15 minutes in Illustrator,www.udemy.com/course/how-to-create-flat-design-interface-icons-in-illustrator/,Dawid Tuminski,194.99,11.39,4.6(256 ratings),Design,Graphic Design,Adobe Illustrator,"3,289",English,Learn how to create flat design interface icons in 15 minutes using Adobe Illustrator. Flat design made easy!,11/2018,12/29/19
Business Card and Letterhead Design in Adobe Illustrator,www.udemy.com/course/stationery/,Daniel Evans,99.99,11.39,4.6(103 ratings),Design,Graphic Design,Adobe Illustrator,"1,809",English,"Learn Business Card, Letterhead, Compliment Slip & Envelope Design",11/2019,12/29/19
Mastering Geometric Grid-Based Designs in Adobe Illustrator,www.udemy.com/course/mastering-geometric-grid-based-designs-in-adobe-illustrator/,Evgeniya & Dominic Righini-Brand,79.99,11.39,4.8(7 ratings),Design,Graphic Design,Adobe Illustrator,58,English,Learn a Range of Illustrator Tools & Techniques to Efficiently Create Precise Geometric Designs & Boost Your Creativity,11/2019,12/29/19
Adobe Illustrator Essentials for Character Design,www.udemy.com/course/adobe-illustrator-essentials-for-character-design/,2D Animation 101 Courses,49.99,11.39,4.5(731 ratings),Design,3D & Animation,Adobe Illustrator,"11,332",English,Learn how to turn your paper drawings into beautiful art. Presentable products that you can pitch or sell,9/2018,12/29/19
Essential Skills for Designers - Mastering the Pen Tool,www.udemy.com/course/pen-tool/,Martin Perhiniak,44.99,11.39,4.7(125 ratings),Design,Graphic Design,Adobe Illustrator,996,English,Learn everything you need to know about the tool that every Designer has to master!,5/2013,12/29/19
Create Detailed and Poseable Character in Adobe Illustrator,www.udemy.com/course/charactercreationillustrator/,Rafael John Regidor,49.99,11.39,3.8(143 ratings),Design,Game Design,Adobe Illustrator,"3,426",English,"Learn how to create your own game character in adobe illustrator. Game Character Design workflows, tips and tricks",5/2016,12/29/19
The Business Graphic Design 2019,www.udemy.com/course/businessgraphicdesign/,Rahul Giri,199.99,11.39,3.8(284 ratings),Business,Home Business,Graphic Design,"8,204",English,"Learn to create professional graphics with photoshop and illustrator and create living from it. logo, web design & more.",5/2019,12/29/19
Making isometry illustrations in Adobe Illustrator,www.udemy.com/course/making-isometry-illustrations-in-adobe-illustrator/,Mad Rabbit,24.99,11.39,4.1(115 ratings),Design,Graphic Design,Adobe Illustrator,"2,062",English,How to make isometric illustration by the simplest way,8/2019,12/29/19
Icon & Logo Symbol Design in Adobe Illustrator,www.udemy.com/course/icondesign/,Daniel Evans,79.99,11.39,4.3(65 ratings),Design,Graphic Design,Adobe Illustrator,"1,376",English,"Learn how to design a stunning, material vector icons quickly and easily!",10/2019,12/29/19
Adobe Illustrator Advanced Pattern Techniques - Masterclass,www.udemy.com/course/adobe-illustrator-advanced-pattern-techniques-masterclass/,Helen Bradley,19.99,11.39,5.0(3 ratings),Design,Graphic Design,Adobe Illustrator,43,English,Boost Graphic Design skills by making complex seamless patterns in Illustrator - in-depth training,11/2019,12/29/19
Make Creative Assets in Adobe Illustrator Masterclass,www.udemy.com/course/make-creative-assets-in-adobe-illustrator-masterclass/,Helen Bradley,19.99,11.99,4.5(28 ratings),Design,Graphic Design,Adobe Illustrator,155,English,"Develop graphic design skills making assets for scrapbooking, design projects, social media, printables, & social media",1/2019,12/29/19
Vintage Logo Design in Illustrator for Beginners & Beyond,www.udemy.com/course/vintagelogodesign/,Daniel Evans,99.99,11.39,4.7(108 ratings),Design,Graphic Design,Logo Design,"3,995",English,"Learn from a Published, Multi-Award Winning Logo Designer! 20+ Years Experience!",10/2019,12/29/19
Complete Illustrator CC  MasterCourse : 36 Projects Included,www.udemy.com/course/complete-illustrator-mastercourse/,Supriyo Kundu,199.99,11.39,4.4(164 ratings),Design,Design Tools,Adobe Illustrator,"1,789",English,"Learn Illustrator CC step by step with 36 Projects by designing logos, mandalas, cartoon faces, flowers and many more",3/2018,12/29/19
Typographic Logo Design in Illustrator - Beginners & Beyond,www.udemy.com/course/typographical-logo-design/,Daniel Evans,99.99,11.39,4.2(164 ratings),Design,Graphic Design,Logo Design,"2,555",English,"Learn from a Published, Multi-Award Winning Logo Designer! 20+ Years Experience!",10/2019,12/29/19
Adobe Illustrator For Beginners,www.udemy.com/course/illustrator-cc-tutorial-adobe-illustrator-cc-the-essentials/,Chris Parker,39.99,11.39,4.1(101 ratings),Design,Design Tools,Adobe Illustrator,"4,372",English,"Adobe Illustrator CC, a complete course on mastering Adobe Illustrator. Adobe Illustrator for beginners!",7/2019,12/29/19
Adobe Illustrator for Children's Books: Watercolor Style,www.udemy.com/course/adobe-illustrator-for-childrens-books-watercolor-style-by-moylobito/,Moy Lobito,194.99,11.39,4.3(44 ratings),Design,Design Tools,Adobe Illustrator,333,English,Create Beautiful Digital Illustrations for Children's Books in Adobe Illustrator - Watercolor Style Illustration,6/2017,12/29/19
Character Design & Digital Art Demo in Adobe Illustrator,www.udemy.com/course/character-design-and-digital-painting-in-adobe-illustrator/,Michael Austin,99.99,11.39,3.7(111 ratings),Design,Graphic Design,Adobe Illustrator,888,English,Learn character design and digital art painting in Adobe Illustrator,9/2017,12/29/19
Adobe Illustrator Text Effects Masterclass,www.udemy.com/course/master-text-effects-in-adobe-illustrator/,Helen Bradley,19.99,11.39,4.9(34 ratings),Design,Graphic Design,Adobe Illustrator,142,English,"Create text effects of varying complexity, boost your graphic design skills, learn valuable Illustrator techniques",12/2018,12/29/19
Most Wanted Flat Design Techniques in Adobe Illustrator,www.udemy.com/course/flat-design-flat-ui-design-flat-colors-flat-design-illustrator/,Dawid Tuminski,194.99,11.39,4.8(79 ratings),Design,Graphic Design, Adobe Illustrator,"2,453",English,How to create advanced flat design projects in Adobe Illustrator,2/2017,12/29/19
Create Whimsical Art in Adobe Illustrator,www.udemy.com/course/create-whimsical-art-in-adobe-illustrator/,Helen Bradley,19.99,11.39,4.9(25 ratings),Design,Graphic Design,Adobe Illustrator,165,English,Learn to create a range of whimsical illustrations in Illustrator as you develop graphic design and Illustrator skills,12/2017,12/29/19
Learn Adobe Illustrator CC,www.udemy.com/course/learn-adobe-illustrator-cc/,Sasikumar Arasaratnam,19.99,11.39,0.0(0 ratings),Design,Graphic Design,Adobe Illustrator,19,English,Learn basic &Â advanced skills you need to create vector illustrations using Adobe Illustrator CC,10/2019,12/29/19
Make your own 2D Game Backgrounds with Adobe Illustrator ,www.udemy.com/course/makegamebackgrounds/,Rafael John Regidor,49.99,11.39,4.5(143 ratings),Design,Game Design,Adobe Illustrator,"2,151",English,Workflows and best practices for making game backgrounds with Adobe Illustrator,5/2016,12/29/19
How To Learn Illustrator by Designing Awesome Logos,www.udemy.com/course/designing-logos-learning-illustrator/,Dawid Tuminski,194.99,11.39,4.3(280 ratings),Design,Graphic Design,Logo Design,"4,080",English,Logo design in Illustrator. Fundamentals of logo design in Illustrator Logo design form scratch Logo design basics,11/2018,12/29/19
Digital Illustration for Beginners in Adobe Illustrator,www.udemy.com/course/digital-illustration-for-beginners-in-adobe-illustrator-by-moylobito/,Moy Lobito,194.99,11.39,4.4(14 ratings),Design,Design Tools,Adobe Illustrator,415,English,Learn to easily make professional illustratrations in Adobe Illustrator. Make high quality vector drawings easily.,4/2018,12/29/19
Make the most of your Adobe Illustrator & Photoshop skills,www.udemy.com/course/passive-income-by-selling-simple-stock-vector-illustrations/,Harish Marnad,0.0,99.99,4.4(100 ratings),Business,Home Business,Photoshop,415,English,Learn all you need to get creative & sell simple illustrations or photos on microstock websites to earn passive income,5/2018,12/29/19
Illustrator CC: Design and drawing from scratch to expert!,www.udemy.com/course/illustrator-cc-design-and-drawing-from-scratch-to-expert/,Joel Combes,149.99,11.39,4.3(283 ratings),Design,Graphic Design,Adobe Illustrator,"3,491",English,"The definitive guide to create stunning designs graphics, pictures and icons in Adobe Illustrator CC",3/2017,12/29/19
Adobe Illustrator for Mobile Game Art - A Beginners Guide,www.udemy.com/course/mobilegameartmastery/,Rafael John Regidor,49.99,11.39,4.3(322 ratings),Design,Game Design,Adobe Illustrator,"4,055",English,"Create mobile game art in Adobe illustrator just by using basic concepts, essential tools and proven workflows.",5/2016,12/29/19
Learn Illustrator CC: Create Simple Flat Vector Characters,www.udemy.com/course/simple-flat-vector-characters/,Jonathan Lam,49.99,11.39,4.3(239 ratings),Design,Graphic Design,Adobe Illustrator,"29,110",English,Start learning Adobe Illustrator CC by creating some Flat Characters in this quick and easy course.,10/2019,12/29/19
Beginners Adobe Illustrator CS5 Tutorial,www.udemy.com/course/adobe-illustrator-cs5/,Infinite Skills,49.99,11.39,4.7(127 ratings),Design,Design Tools,Adobe Illustrator,"1,072",English,Learn Adobe Illustrator CS5 at your own pace. Over 10 hours of tutorial videos from a leading Adobe Expert.,1/2017,12/29/19
Every Adobe Illustrator Effect Explained,www.udemy.com/course/every-illustrator-effect-explained-illustrator-tutorial-cc-c6/,Dawid Tuminski,144.99,11.39,4.7(32 ratings),Design,Design Tools,Adobe Illustrator,422,English,How to use each and every effect in Adobe Illustrator Create stunning effects in Illustrator,7/2017,12/29/19
Adobe Illustrator form beginner to expert,www.udemy.com/course/adobe-illustrator-comprehensive-training/,Sanjeev Kumar,19.99,11.99,4.0(150 ratings),Design,Graphic Design,Adobe Illustrator,"20,978",English,Learn detailed and comprehensive Adobe Illustrator in 15 hours,3/2019,12/29/19
Modern Flat Design Masterclass in Adobe Illustrator,www.udemy.com/course/photoshop-flat-design-tutorial-adobe-illustrator-cc/,Dawid Tuminski,199.99,11.39,4.0(18 ratings),Design,Graphic Design,Adobe Illustrator,252,English,Build Your Own Portfolio of Modern Flat Design Digital Illustrations and Use Adobe Illustrator Independently,11/2018,12/29/19
Adobe Illustrator CC - Basic Fundamentals For Beginners,www.udemy.com/course/adobe-illustrator-cc-basic-fundamentals-for-beginners/,Khaqan Chaudhry,199.99,11.39,4.7(18 ratings),Design,Graphic Design,Adobe Illustrator,"2,238",English,"Learn The Basics Of Adobe Illustrator CC Like Various Graphic Styles, Drawing Tools, Brushes, Typography and More",1/2019,12/29/19
"Adobe Illustrator CS5  (Beginning, Intermediate, & Advanced)",www.udemy.com/course/adobe-illustrator-cs5-beginning-intermediate-advanced/,Learn iT! Anytime,29.99,11.39,4.8(156 ratings),Design,Design Tools,Adobe Illustrator,"1,191",English,"Adobe Illustrator CS5 Tutorials for Print and Web Design. All levels covered: (beginning, Intermediate, & Advanced)",6/2012,12/29/19
Learn Adobe Illustrator: Semi-Automatic Mandalas Drawing,www.udemy.com/course/learn-adobe-illustrator-semi-automatic-mandalas-drawing/,Andrey Bzhitskikh,199.99,11.39,4.0(68 ratings),Design,Graphic Design,Adobe Illustrator,"1,437",English,Graphic Design. Create a semi-automatic template for quickly drawing your own mandala and patterns in Adobe Illustrator.,5/2017,12/29/19
Create Icons in Adobe Illustrator for Beginners,www.udemy.com/course/create-icons-in-adobe-illustrator-for-beginners/,Anne Bracker,19.99,11.39,4.5(20 ratings),Design,Graphic Design,Adobe Illustrator,"2,449",English,"Are you a beginner to Adobe Illustrator? In this intro to Illustrator, you'll learn the basic AI tools and palettes.",2/2019,12/29/19
Adobe Illustrator For Everyone: Create Detailed Vector Image,www.udemy.com/course/how-to-create-your-own-steampunk-vehicle-part-1/,Andrey Bzhitskikh,184.99,11.39,4.2(55 ratings),Design,Graphic Design,Adobe Illustrator,469,English,The Complete Adobe illustrator Course For Beginners Who Wants To Learn Graphic Design From Expert.,4/2017,12/29/19
Adobe Illustrator CC - From scratch ,www.udemy.com/course/adobe-illustrator-cc-from-scratch/,Apostu Adrian Albert,44.99,11.39,4.8(25 ratings),Design,Graphic Design,Adobe Illustrator,202,English,One of the best guides to learn Adobe Illustrator from scratch. Best course explained for everyone.,6/2015,12/29/19
How to Doodle: Basics and Lettering,www.udemy.com/course/how-to-doodle-basics-and-lettering/,Andrey Bzhitskikh,184.99,11.39,3.7(81 ratings),Design,Graphic Design,Adobe Illustrator,"2,642",English,Graphic Design & Illustration: Draw Kawaii Doodles in Adobe Illustrator and create letters of cartoon characters.,4/2017,12/29/19
How To Master Pen Tool In Illustrator and Photoshop,www.udemy.com/course/pen-tool-pen-magnetic-pen-tool-illustrator-photoshop-tutorial/,Dawid Tuminski,194.99,11.39,4.5(65 ratings),Design,"Design Tools
 ",Adobe Illustrator,"1,755",English,Pen Tool : How To Master Pen Tool In Illustrator and Photoshop Most effective ways of using the pen tool in Photoshop,11/2016,12/29/19
Flat Landscape Design in Illustrator (Perfect For Beginners),www.udemy.com/course/flat-landscape-design-in-illustrator-perfect-for-beginners/,Sasikumar Arasaratnam,19.99,11.39,4.5(4 ratings),Design,Graphic Design,Adobe Illustrator,"1,983",English,How to Design a Modern Flat Design Artwork Just Using Basic Shapes in Adobe Illustrator,11/2019,12/29/19
Learn Adobe Illustrator from Scratch,www.udemy.com/course/learn-adobe-illustrator-from-scratch/,Eduonix Learning Solutions,29.99,11.39,3.6(400 ratings),Design,Design Tools,Adobe Illustrator,"33,879",English,A Complete Guide to Master Adobe Illustrator,12/2018,12/29/19
Adobe Illustrator Vectors For Hand Letterers,www.udemy.com/course/adobe-illustrator-vectors-for-hand-letterers/,Melanie Greenwood,99.99,11.39,4.7(15 ratings),Design,Graphic Design,Adobe Illustrator,132,English,"Learn How To Make Your Hand Lettering Illustrations Into Vector Art, using the Pen Tool, Curvature Tool and Auto Trace.",10/2016,12/29/19
Extraordinary Illustrator Brushes for Pattern Design & ATD,www.udemy.com/course/extraordinary-illustrator-brushes-pattern-design-and-atd/,Delores Orridge Naskrent,24.99,11.39,4.5(1 rating),Design,Graphic Design,Adobe Illustrator,10,English,Amazing Techniques to Streamline Pattern Creation and Colorization,11/2019,12/29/19
Creative Texturing with Adobe Illustrator,www.udemy.com/course/creative-texturing-with-adobe-illustrator/,Taiwo Kajopelaye-ola,19.99,11.39,3.7(3 ratings),Design,Graphic Design,Adobe Illustrator,16,English,Painting with hand-made textures in adobe illustrator,5/2019,12/29/19
Illustrator CC 2018: Fundamentals For Beginners + 5 Projects,www.udemy.com/course/adobe-illustrator-cc-fundamentals-5-projects/,Abdelwahab Achoub,194.99,11.39,4.2(428 ratings),Design,Graphic Design,Adobe Illustrator,"35,179",English,Learn Illustrator CC 2018 Fundamentals and Enjoy Drawing with Adobe Illustrator CC the 5 Facebook Emoji Projects,5/2018,12/29/19
Adobe Illustrator For Beginners: Design A Typographic Logo,www.udemy.com/course/illustratorforbeginners/,Will Paterson,29.99,11.39,4.3(124 ratings),Design,Graphic Design, Adobe Illustrator,540,English,A beginners course to Adobe Illustrator CC for aspiring Logo Designers. Learn how to to design a professional logotype.,10/2015,12/29/19
Adobe Illustrator CC - Print Design for Beginners,www.udemy.com/course/adobe-illustrator-cc-print-design/,Jason Hill,24.99,11.39,4.0(64 ratings),Design,Graphic Design,Adobe Illustrator,263,English,A hands-on approach to creating engaging designs for print using Adobe Illustrator CC covering all of the basics.,3/2017,12/29/19
Creating Vector Illustration: Adobe Illustrator CC All Steps,www.udemy.com/course/creating-vector-illustration-with-adobe-illustrator-cc-all-steps/,Mehmet Emin Aykurt,19.99,11.39,3.8(10 ratings),Design,Graphic Design,Adobe Illustrator,"1,568",English,A whole-process course about vector illustration. More illustrations are added continuously.,1/2019,12/29/19
Learn to Master After Effects and Illustrator,www.udemy.com/course/creating-vector-illustrations-and-animating-them/,Motion School,99.99,11.39,4.5(13 ratings),Design,3D & Animation,After Effects,"1,061",English,Design and Illustrate Vectors and Animate then in After Effects using Shape Layers,3/2017,12/29/19
Intro to Adobe Illustrator,www.udemy.com/course/intro-to-adobe-illustrator/,Joseph Caserto,19.99,11.39,4.7(24 ratings),Design,Graphic Design,Adobe Illustrator,254,English,"Get up and running with the design world's standard software for drawing logos, icons, and all types of vector artwork.",10/2015,12/29/19
Adobe Illustrator Brushes to Make and Sell,www.udemy.com/course/adobe-illustrator-brushes-to-make-and-sell/,Delores Orridge Naskrent,24.99,11.39,0.0(0 ratings),Design,Graphic Design,Adobe Illustrator,7,English,Reinforce skills in making custom Illustrator brushes,11/2019,12/29/19
Complete Graphic Design Boot Camp Zero to Master 2020,www.udemy.com/course/complete-graphic-design-boot-camp-zero-to-master-in-2109/,Graphic Zone,199.99,11.39,3.9(3 ratings),Design,Graphic Design,Adobe Illustrator,15,English,"Project-Based Learning For Beginners: Learn Photoshop, Illustrator,by creating posters, and more.",12/2019,12/29/19
