Course,URL,instructor,Price (full),Price (discount),Rank,Category 1,Category 2,Category 3,Enrollment,Language,Description,Last Update,Date Scraped
After Effects CC 2020: Complete Course from Novice to Expert,www.udemy.com/course/after-effects-kinetic-typography/,Louay Zambarakji,199.99,11.39,"4.6(13,679 ratings)",Design,3D & Animation,After Effects,"81,800",English,"Create stunning Motion Graphics, VFX Visual Effects & VFX Compositing with hands-on tutorials & 50+ practice projects.",11/2019,12/31/19
After Effects CC Masterclass: With CC 2020 Updates,www.udemy.com/course/after-effects-cc/,Phil Ebiner,199.99,17.99,"4.5(3,705 ratings)",Design,Design Tools,After Effects,"76,192",English,Learn After Effects CC to improve your videos with professional motion graphics and visual effects.,11/2019,12/31/19
After Effects - Motion Graphics & Data Visualization,www.udemy.com/course/animated-infographic-video-data-visualisation/,Daniel Walter Scott,194.99,11.39,"4.6(2,379 ratings)",Design,3D & Animation,After Effects,"15,450",English,"Using Adobe After Effects create beautiful VFX Visual Effects, data visualization & VFX Compositing.",7/2019,12/31/19
Adobe After Effects CC: The Complete Motion Graphics Course,www.udemy.com/course/adobe-after-effects-2017-essential-motion-graphics-training/,Louay Zambarakji,199.99,11.39,"4.6(2,204 ratings)",Design,Design Tools,Motion Graphics,"63,835",English,Create Motion Graphics with Adobe After Effects CC: Best Techniques and Methods to Become a Top Motion Graphics Artist,8/2019,12/31/19
Adobe After Effects CC - Motion Graphics Design & VFX,www.udemy.com/course/become-a-motion-graphic-designer-using-after-effects/,Daniel Walter Scott,94.99,11.39,4.6(990 ratings),Design,3D & Animation,After Effects,"5,998",English,Learn the techniques to start your career as a Motion Graphic artist.,7/2019,12/31/19
After Effects CC 2019 Motion Graphics & Animation Principles,www.udemy.com/course/motion-graphics-course/,Louay Zambarakji,199.99,11.39,4.7(274 ratings),Business,Media,After Effects,"11,362",English,In After Effects CC Learn to create motion graphics animations and apply the animation principles in After Effects CC,6/2019,12/31/19
Futuristic HUD Motion Graphics in After Effects,www.udemy.com/course/futuristic-hud-animations-in-after-effects/,Sam DeZeeuw,74.99,11.39,4.7(225 ratings),Design,Design Tools,After Effects,"2,399",English,"Learn how to create motion graphics in After Effects like what you see in Iron Man, Star Wars or other action movies",1/2018,12/31/19
Learning Adobe After Effects CC Tutorial Videos,www.udemy.com/course/learning-adobe-after-effects-cc-tutorial/,Infinite Skills,49.99,11.39,4.0(626 ratings),Design,"Design Tools
 ",After Effects,"5,123",English,Learn How To Use After Effects To Create Stunning Digital Motion Effects. Taught By Leading Adobe Effects Trainer,1/2017,12/31/19
After Effects CC: Beginner's Guide to VFX Visual Effects,www.udemy.com/course/visual-effects-in-after-effects/,Louay Zambarakji,149.99,13.79,4.2(132 ratings),Design,Design Tools,After Effects,"6,899",English,VFX in After Effects CC: An In-depth Guide to Perspective and Generate Visual Effects in Adobe After Effects CC,9/2017,12/31/19
Advanced Particle VFX in Unity and After Effects,www.udemy.com/course/advanced-particle-vfx-in-unity-and-after-effects/,Timothy Trankle,49.99,11.39,4.4(334 ratings),Design,3D & Animation,Unity,"5,576",English,Learn advanced texture creation and particle behaviors by creating your own custom AAA quality particle effects,3/2018,12/31/19
VFX Compositing with After Effects: The Complete Edition,www.udemy.com/course/vfx-compositing-with-after-effects-the-complete-edition/,Vicki Lau,74.99,11.39,4.3(136 ratings),Design,3D & Animation,VFX Compositing,932,English,A comprehensive guide to compositing for live-action films in post-production visual effects using Adobe After Effects.,11/2019,12/31/19
3D in After Effects CC: Working & Animating in 3D Space,www.udemy.com/course/after-effects-3d-animation-motion-graphics/,Louay Zambarakji,99.99,11.39,4.4(160 ratings),Design,3D & Animation,3D Animation,"9,320",English,"Adobe After Effects CC: A complete guide to Animating in After Effects 3D Space and using Cameras, Lights and Shadows...",8/2018,12/31/19
Create HUD graphics in After Effects and Illustrator,www.udemy.com/course/hud-interface-animation-in-after-effects-and-illustrator/,Motion School,164.99,11.39,4.8(118 ratings),Design,3D & Animation,After Effects,"1,137",English,Design and Animate HUD Interface using After Effects and Illustrator,6/2018,12/31/19
After Effects CC Expressions: Animated Infographics Design,www.udemy.com/course/adobe-after-effects-expressions-create-motion-infographics/,Louay Zambarakji,99.99,11.39,4.7(199 ratings),Design,3D & Animation,Infographic Design,"7,670",English,Learn all about Expressions while Animating Interesting and useful Infographics Designs in Adobe After Effects CC,9/2017,12/31/19
Save Time in Character Animation for After Effects,www.udemy.com/course/2d-character-animation-puppet-in-after-effects/,2D Animation 101 Courses,49.99,11.39,4.4(280 ratings),Design,3D & Animation,Character Animation,"5,387",English,"Animation can be a fast process if you know the secret: Do Animation with rigged characters, with a few clicks and drags",9/2018,12/31/19
Course Design - How to Create Impressive Text Animations,www.udemy.com/course/udemy-course-design-text-animations-kinetic-typography/,Louay Zambarakji,99.99,11.39,4.7(80 ratings),Teaching & Academics,Online Education,After Effects,"4,267",English,Concise & Easy to Use Techniques to Help You Create Your Text Animations using Adobe After Effects - Kinetic Typography,4/2017,12/31/19
After Effects: The Complete Beginner Course (All Versions),www.udemy.com/course/after-effects-complete-beginner-course/,Surfaced Studio,149.99,11.39,4.9(188 ratings),Design,Design Tools,After Effects,623,English,Learn How to Create Professional Motion Graphics & Animations. Add Exciting Visual Effects to Your Own Video Projects,4/2019,12/31/19
After Effects Logo Animation - after effects motion graphics,www.udemy.com/course/after-effects-logo-animation/,Andrzej Pach,94.99,11.39,4.9(83 ratings),Design,3D & Animation,After Effects,"1,454",English,Create motion graphics logo animations in After Effects. A complete guide to title openers in after effects,11/2019,12/31/19
After Effects : Create Motion Graphics & Advertising Videos,www.udemy.com/course/after-effects-create-motion-graphics-advertising-videos/,Aksh Animation,39.99,11.39,4.0(217 ratings),Design,3D & Animation,After Effects,"1,812",English,Learn how to create stunning motion graphic & advertising videos using After Effect with project based learning approach,5/2017,12/31/19
Rigging a Character in After Effects for Animation,www.udemy.com/course/rigging-a-character-in-after-effects-for-animation/,2D Animation 101 Courses,49.99,11.39,3.7(192 ratings),Design,3D & Animation,After Effects,"4,473",English,Take your Illustrator File and connect each body part to easily control your character for animation,9/2018,12/31/19
After Effects CC: 2D Character Animation - Puppet & Rig,www.udemy.com/course/after-effects-2d-character-animation-course/,Louay Zambarakji,99.99,11.39,4.0(143 ratings),Design,3D & Animation,After Effects,"7,578",English,Adobe After Effects CC - Master the two most important techniques for 2D animations in Adobe After Effects.,5/2018,12/31/19
After Effects CC: Design Professional Video Transitions,www.udemy.com/course/after-effects-transitions/,Louay Zambarakji,99.99,11.39,5.0(291 ratings),Design,3D & Animation,After Effects,"27,818",English,Learn how to Design Professional Video Transitions in After Effects CC and How to use them in Premiere Pro Video Editing,2/2018,12/31/19
Turn a 2d photo into a 3d animation with After Effects!,www.udemy.com/course/2d-to-3d-with-photoshop-and-after-effects/,Zoltan Siket,24.99,11.39,4.7(109 ratings),Design,3D & Animation,3D Animation,"1,402",English,Learn the basics of Photoshop and After Effects and create your own 3D animations from scratch!,2/2017,12/31/19
Adobe After Effects CC - Create Lower Third Text Animation,www.udemy.com/course/master-lower-third-text-animation-in-after-affects/,Louay Zambarakji,99.99,11.39,4.2(109 ratings),Design,3D & Animation,After Effects,"11,989",English,Adobe After Effects Tutorial - Create Lower Third Text Animation and Package your Work for Resale â Kinetic Typography,2/2018,12/31/19
Advanced CGI / VFX Compositing,www.udemy.com/course/advanced-cgi-compositing/,Digital Learning Solutions,179.99,11.39,4.2(5 ratings),Design,3D & Animation,After Effects,54,English,Mini Master Class in Visual Effects Compositing,11/2019,12/31/19
After Effects Masterclass: The Ultimate Guide for Beginners,www.udemy.com/course/after-effects-masterclass-the-ultimate-guide-for-beginners/,Ozgur Gorgun,199.99,11.39,4.5(33 ratings),Design,3D & Animation,After Effects,206,English,"Learn how to use the industry standard motion graphics, animation and visual effects software with this course",10/2018,12/31/19
Adobe After Effects CC: Motion Tracking & Compositing Basics,www.udemy.com/course/after-effects-motion-tracking/,Life Progression Project,144.99,11.39,4.6(180 ratings),Design,Design Tools,After Effects,"12,983",English,"Motion Tracking & Compositing Basics in Adobe After Effects CC: Pimple/Acne Removal, Sign/Screen Replacement, Mocha AE",12/2019,12/31/19
Learning  Cinema 4D Lite For After Effects,www.udemy.com/course/cinema-4d-lite-for-after-effects/,Infinite Skills,49.99,11.39,4.1(108 ratings),Design,3D & Animation,After Effects,725,English,Learn how to use Cinema 4D (Lite) in conduction with Adobe After Effects. A definitive course from Infinite Skills,1/2017,12/31/19
Rigging and Animating PSDs with Duik and Joysticks,www.udemy.com/course/rigging-and-animating-psds-with-duik-joysticks-n-sliders/,Chad Troftgruben,64.99,11.39,4.5(13 ratings),Design,3D & Animation,After Effects,71,English,Animate image based characters in After Effects powered with plugins Duik and Joysticks 'n Sliders!,11/2019,12/31/19
Learning Adobe After Effects CS6 - Tutorial Video,www.udemy.com/course/learning-adobe-after-effects-cs6-the-essential-guide/,Infinite Skills,49.99,11.39,4.0(132 ratings),Design,Design Tools,After Effects,"2,848",English,Master The Art Of Digital Motion Effects and Compositing. An Essential Video Based Tutorial For All Videographers,1/2017,12/31/19
After Effects Basics - Morphing Shapes in After Effects,www.udemy.com/course/after-effects-motion-graphics-morphing-shapes/,Andrzej Pach,94.99,11.39,4.4(54 ratings),Design,3D & Animation,After Effects,"1,412",English,Learn After Effects motion graphic animation. After Effects CS6 and CC basics,11/2019,12/31/19
Motion Graphic Workshop : Full Project,www.udemy.com/course/motion-graphic-workshop-full-project/,Joseph adam,199.99,11.39,4.3(66 ratings),Design,3D & Animation,After Effects,"10,024",English,Learn motion graphics step-by-step until you become a professional.,6/2019,12/31/19
After Effects: Create Slide Shows - Build a Complete Project,www.udemy.com/course/after-effects-tutorial-slide-show/,Louay Zambarakji,39.99,11.99,4.5(112 ratings),Design,3D & Animation,After Effects,"12,116",English,Adobe After Effects Tutorial - Build a Complete Slide Show and Package your Project for Re-Sale or for Personal Use,4/2017,12/31/19
After Effects for Beginners Complete Intro to After Effects,www.udemy.com/course/aftereffects-beginners-complete/,Andrzej Pach,194.99,11.99,4.3(270 ratings),Design,3D & Animation,After Effects,"2,254",English,Complete Intro to After Effects - Learn After Effects CC typography and animation,11/2019,12/31/19
After Effects CC: Create Cool Lower Thirds & Motion Graphics,www.udemy.com/course/after-effects-lower-thirds-titles-text-animation/,Video Course Center Inc.,19.99,11.99,4.7(135 ratings),Design,3D & Animation,After Effects,"11,666",English,"Create & Sell Professional Lower Thirds, Titles Animation, Motion Graphics & Master Graphic Design in After Effects CC",7/2019,12/31/19
10 Adobe After Effects projects to create right away!,www.udemy.com/course/after-effects-motion-graphics/,Andrzej Pach,94.99,11.99,4.5(57 ratings),Design,3D & Animation,After Effects,407,English,Learn After Effects CC by working in it! Design 10+ animated motion graphics in after effects,11/2019,12/31/19
Adobe After Effects: Futuristic Motion Graphics & Animation,www.udemy.com/course/after-effects-futuristic-graphics/,Duncan Rogoff,134.99,11.99,4.6(100 ratings),Design,3D & Animation,Animation,"3,285",English,Master the tools you need to conquer any project in just 1.5 hours!,4/2017,12/31/19
After Effects CC Complete Guide to Video Transitions Presets,www.udemy.com/course/after-effects-cc-video-transitions-presets/,Louay Zambarakji,104.99,11.99,4.0(73 ratings),Design,3D & Animation,After Effects,"14,656",English,A comprehensive guide to Movement / Wipes / Dissolve Video Transitions Presets in Adobe After Effects CC 2018,6/2019,12/31/19
Super Sila (School of motion design),www.udemy.com/course/supersilaschool/,Alex Anshukov,99.99,11.99,4.1(4 ratings),Design,3D & Animation,After Effects,28,English,"After Effects (AE): basics of animation, motion graphics and visual effects + Element 3D, Stardust, Newton",10/2018,12/31/19
Adobe After Effects: Advanced Shape Layers,www.udemy.com/course/after-effects-tutorials-advanced-shape-layers/,Phil Ebiner,99.99,11.99,4.0(239 ratings),Design,3D & Animation,After Effects,"23,352",English,"Animate shape layers to create hip, professional, and powerful motion graphics in After Effects. Start learning today!",1/2018,12/31/19
Animate an Explainer Video Using Adobe After Effects CC,www.udemy.com/course/animate-an-explainer-video-in-after-effects/,Lucas Ridley,109.99,11.99,4.5(42 ratings),Design,3D & Animation,After Effects,475,English,Learn a valuable freelance skill of animating an explainer video in After Effects!,3/2019,12/31/19
Motion Graphics Design & Flat Animation in After Effects CC,www.udemy.com/course/flat-animation-buildup-adobe-after-effects-illustrator-motion-graphics/,Video Course Center Inc.,19.99,11.99,4.1(95 ratings),Design,3D & Animation,After Effects,"8,757",English,Become a Motion Graphics designer in After Effects. Learn top techniques to start your career as a Motion Graphic artist,3/2019,12/31/19
After Effects Video Editing: Edit Your Home Video Like a Pro,www.udemy.com/course/after-effects-video-editing-edit-video/,Louay Zambarakji,39.99,11.99,4.7(26 ratings),Photography,Video Design,After Effects,"1,421",English,"Edit Your Home Video in After Effects- Create Transitions, Add Animated Text and Motion Graphic. Produce Quality Videos",4/2017,12/31/19
Adobe After Effects: Flat Animation Buildup,www.udemy.com/course/dive-into-adobe-after-effects-flat-animation-buildup/,Phil Ebiner,99.99,11.99,4.4(164 ratings),Design,3D & Animation,After Effects,"21,119",English,Jump right into animating motion graphics in Adobe After Effects with this quick-start guide to creating 2D animations.,1/2018,12/31/19
"Animate with Depth: Cameras, Lights and 3D Layers in AE",www.udemy.com/course/animate-with-depth/,Rich Armstrong,39.99,11.99,4.2(38 ratings),Design,3D & Animation,3D Animation,215,English,"Learn to master 3D composition and aniation in Adobe After Effects with this thorough, step-by-step guide",9/2019,12/31/19
"Green Screen Editing: Premiere Pro, Final Cut, After Effects",www.udemy.com/course/greenscreen/,Phil Ebiner,99.99,11.99,3.9(67 ratings),Photography,Video Design,After Effects,"15,554",English,"Premiere Pro, After Effects, Final Cut Pro, FCPX! Learn how to edit green screen video like a pro in all major programs!",1/2018,12/31/19
Adobe After Effects CC For Beginners: Learn After Effects CC,www.udemy.com/course/learn-adobe-after-effects/,Life Progression Project,114.99,11.99,4.2(396 ratings),Design,Design Tools,After Effects,"18,666",English,"Adobe After Effects CC For Beginners: Create Motion Graphics, Animate Text, Key Framing, Importing, Exporting & More!",10/2019,12/31/19
Animated Infographics With After Effects,www.udemy.com/course/animated-infographics-with-after-effects/,Joseph adam,199.99,11.99,3.6(53 ratings),Design,3D & Animation,After Effects,"12,951",English,Learn to design and animate infographics using the After Effects software,8/2019,12/31/19
Adobe After Effect: Create 15 Advance Motion Graphic Element,www.udemy.com/course/15-advance-mograph-elements-with-after-effect/,HU Shahir,29.99,11.99,3.3(28 ratings),Design,Graphic Design,Motion Graphics,341,English,Learn how to create motion graphic elements using after effect built in tools with project files.,1/2017,12/31/19
After Effects : Your Way To Learn Motion Graphics,www.udemy.com/course/after-effects-your-motion-graphics/,Joseph adam,199.99,11.99,4.2(57 ratings),Design,3D & Animation,After Effects,"8,960",English,Learn motion graphics with the after effects software in a special way,11/2019,12/31/19
Animate a Logo in Adobe After Effects CC with Motion Graphic,www.udemy.com/course/animate-a-logo-in-adobe-after-effects-cc-with-motion-graphic/,Lucas Ridley,99.99,11.99,4.5(14 ratings),Design,3D & Animation,Animation,376,English,Follow along as we create an appealing logo animation using motion graphics in Adobe After Effects!,1/2018,12/31/19
Adobe After Effects: Liquid Text Animation in After Effects,www.udemy.com/course/after-effects-liquid-text-animation/,Andrzej Pach,49.99,11.99,4.6(94 ratings),Design,3D & Animation,After Effects,"2,059",English,"Learn Adobe After Effects. Basic Animation in Adobe After Effects, working with Text Animation and Motion Graphics",11/2019,12/31/19
Trapcode Form: Making UI Elements,www.udemy.com/course/trapcode-form-ui/,Chad Perkins,19.99,11.99,4.4(3 ratings),Design,3D & Animation,After Effects,35,English,A project-based course for Trapcode Form users of all experience levels!,6/2019,12/31/19
After Effects: Create an Intro Video / Bumper for your Brand,www.udemy.com/course/how-to-create-your-own-video-intro/,Phil Ebiner,99.99,11.99,3.9(134 ratings),Marketing,Branding,After Effects,"20,538",English,"A complete guide to conceptualizing, creating, and using a video intro to promote, grow, and strengthen your brand.",1/2018,12/31/19
After Effects CC: Create Stunning Video Transitions Quickly!,www.udemy.com/course/after-effects-cc-video-transitions-motion-graphics/,Video Course Center Inc.,19.99,11.99,4.6(17 ratings),Design,3D & Animation,After Effects,"6,563",English,Design professional video transitions in After Effects & create awesome Motion Graphics for your video transitions,5/2019,12/31/19
Animation In After Effects (Full Version),www.udemy.com/course/animation-in-after-effects/,Dara Harper,19.99,11.99,4.4(38 ratings),Design,3D & Animation,After Effects,656,English,"2D and 3D animation techniques, including lip-syncing cartoon characters, lighting and creating custom special effects.",1/2015,12/31/19
VFX 101: Learn Adobe After Effects / PFTrack / 3ds Max,www.udemy.com/course/introtovfx/,Ruan Lotter,29.99,11.99,3.8(81 ratings),Design,3D & Animation,After Effects,"1,764",English,"Do you want to learn how to do amazing VFX (Visual Effects)? Learn 3ds Max, After Effects and PFTrack in this course!",3/2015,12/31/19
Adobe After Effects For Beginners - VFX & Motion Graphics,www.udemy.com/course/adobe-after-effects-basic-beginner-course/,Surfaced Studio,19.99,11.99,4.1(29 ratings),Design,Graphic Design,After Effects,159,English,Learn How To Use Adobe After Effects To Create Cool Motion Graphics & Visual Effects - For Beginners,12/2017,12/31/19
From Beginner to Expert:  Master Type in After Effects,www.udemy.com/course/master-type-in-after-effects/,Motion School,199.99,11.99,0.0(0 ratings),Design,3D & Animation,After Effects,239,English,Learn everything you need to know to work with type in After Effects,4/2019,12/31/19
After Effects: Learn Adobe After Effects In 2 Hours,www.udemy.com/course/adobeaftereffects/,Ruan Lotter,24.99,11.99,4.2(60 ratings),Design,Graphic Design,After Effects,878,English,Learn Adobe After Effects to create amazing Motion Graphics and Visual Effects in just 2 hours.,9/2017,12/31/19
Master working with Textures in After Effects,www.udemy.com/course/master-working-with-textures-in-after-effects/,Motion School,164.99,11.99,4.1(15 ratings),Design,3D & Animation,After Effects,104,English,Learn everything you need to know to work with textures in After Effects,6/2018,12/31/19
Create Explainer Videos Using Adobe After Effects,www.udemy.com/course/explainervideos/,Ruan Lotter,24.99,11.99,3.9(14 ratings),Design,3D & Animation,After Effects,101,English,Learn how to create your own amazing Explainer Videos using Adobe After Effects,8/2018,12/31/19
After Effects : Master Shape Layers Motion Graphics Basics,www.udemy.com/course/adobe-after-effects-master-shape-layers-essentials/,Maggie Osama,129.99,11.99,4.9(42 ratings),Design,3D & Animation,After Effects,"5,290",English,Master Shape Layers in Adobe After Effects for Powerful Video Intros/Transitions &More!- After Effects Projects Included,11/2019,12/31/19
After Effects Template from A to Z,www.udemy.com/course/after-effects-templates/,Shoaib Khan,199.99,11.99,5.0(1 rating),Design,3D & Animation,After Effects,32,English,Learn Motion Graphic Design to help you Create and Sell After Effects Templates,10/2018,12/31/19
Learn Basic After Effects,www.udemy.com/course/learn-basic-after-effects/,Learn Tech Plus,199.99,11.99,3.4(43 ratings),IT & Software,Other,After Effects,"12,072",English,Learn Everything you need to know about Basic After Effects,12/2019,12/31/19
Mesmerizing Gifs and How to Make Them,www.udemy.com/course/mesmerizing-gifs-and-how-to-make-them/,Rich Armstrong,19.99,11.99,4.9(17 ratings),Design,3D & Animation,After Effects,113,English,Create Mind-Bending Loops with After Effects and Photoshop,2/2017,12/31/19
15  Motion Graphic Elements in After Effect (Series 2),www.udemy.com/course/15-motion-graphic-elements-in-after-effect-series-2/,HU Shahir,29.99,11.99,3.8(10 ratings),Design,Graphic Design,Motion Graphics,110,English,"Mastering Creating of Motion Graphic Elements in After Effect Series of Course , 15 Elements with Project File .",4/2017,12/31/19
Adobe After Effects and Premiere,www.udemy.com/course/adobe-after-effects-and-premiere/,Jennifer Clark,39.99,11.99,4.9(29 ratings),Design,Design Tools,After Effects,193,English,Creating a Photo Slide Show,9/2017,12/31/19
Advanced After effects : Create Beautiful Transitions,www.udemy.com/course/advanced-after-effects-create-beautiful-transitions/,Yassine Boutaib,34.99,11.99,4.1(42 ratings),Design,3D & Animation,After Effects,"3,960",English,Make your business videos stand out from competitors with these practical After Effects transitions to boost your brand!,5/2018,12/31/19
UI Animations and Interactions with After Effects,www.udemy.com/course/ui-animations-and-interactions-with-after-effects/,Karim Balaa,19.99,11.99,3.9(4 ratings),Design,3D & Animation,After Effects,547,English,Learn how to create smooth interactions for your products,10/2019,12/31/19
Animate Hipster Logos & Badges in After Effects,www.udemy.com/course/after-effects-tutorial-badge-animation/,Phil Ebiner,49.99,11.99,4.6(109 ratings),Design,3D & Animation,After Effects,"22,413",English,Step-by-step guide to designing and animating a fun badge logo using Adobe Illustrator and Adobe After Effects.,1/2018,12/31/19
An Intro to Adobe Premiere and After Effects,www.udemy.com/course/an-intro-to-adobe-premiere-and-after-effects/,GetFilming Film School,34.99,11.99,4.7(17 ratings),Photography,Video Design,After Effects,104,English,"Industry expert, Evan Abrams will teach you to create a title sequence used in popular shows like The Walking Dead.",9/2016,12/31/19
Cinema 4D - Daily Render Scifi Scene with Octane Render,www.udemy.com/course/dailyrender/,Dave Bergin,0.0,49.99,4.3(37 ratings),Design,3D & Animation,3D Animation,101,English,Level up your Cinema 4D and Octane skills and start making Daily Renders Fast!,4/2019,12/31/19
Natural Touchups: Video Retouching in After Effects,www.udemy.com/course/aftereffectstouchups/,Mikey Borup,49.99,11.99,4.9(10 ratings),Design,Other,After Effects,73,English,Learn beauty and skin retouching on video in After Effects,11/2016,12/31/19
Learn to Master After Effects and Illustrator,www.udemy.com/course/creating-vector-illustrations-and-animating-them/,Motion School,99.99,11.99,4.5(13 ratings),Design,3D & Animation,After Effects,"1,061",English,Design and Illustrate Vectors and Animate then in After Effects using Shape Layers,3/2017,12/31/19
How To Edit After Effects Template And Make Amazing Videos,www.udemy.com/course/how-to-edit-after-effects-template-and-make-amazing-videos/,Bluefx .,99.99,11.99,4.4(21 ratings),Photography,Video Design,After Effects,87,English,Learn The Basics Of After Effects To Edit Any After Effects Template,4/2018,12/31/19
After Effects CC: Advanced Animation Techniques,www.udemy.com/course/after-effects-cc-advanced-animation-techniques/,Jonathon Parker,199.99,11.99,3.8(23 ratings),Design,3D & Animation,After Effects,940,English,Create Polished Proffesional Animations,10/2019,12/31/19
After Effects HUD Design & Animation,www.udemy.com/course/after-effects-hud-design-animation/,Shoaib Khan,149.99,11.99,4.3(8 ratings),Design,3D & Animation,Animation,58,English,Learn HUD Design and Animation in Illustrator and After Effects from the Expert,11/2018,12/31/19
Create Glass Effect Video Slideshow in Adobe After Effects,www.udemy.com/course/aftereffectsglasspaneslideshow/,Maggie Osama,149.99,11.99,4.9(13 ratings),Design,3D & Animation,After Effects,"3,027",English,Make a slideshow for photos or videos with sliding glass using After Effects - After Effects Project File Included,10/2019,12/31/19
