Course,URL,instructor,Price (full),Price (discount),Rank,Category 1,Category 2,Category 3,Enrollment,Language,Description,Last Update,Date Scraped
After Effects for Photography,www.udemy.com/course/after-effects-for-photography/,Chris Converse,19.99,11.99,4.6(3 ratings),Photography,Digital Photography,After Effects,31,English,Create unique stunning effects for your photographs that will set your work apart,12/2018,12/31/19
Create Stunning Video Transitions in Adobe After Effects,www.udemy.com/course/aftereffectsvideotransitions/,Maggie Osama,149.99,11.99,4.8(14 ratings), Design,3D & Animation,After Effects,"2,736",English,Design stunning video slideshows with these transitions quickly & easily in After Effects -Learning By Doing Approach,8/2019,12/31/19
After Effects for Entrepreneurs: 9 Practical Video Projects,www.udemy.com/course/adobe-after-effects-for-entrepreneurs/,Phil Ebiner,29.99,11.99,4.3(50 ratings),Business,Media,After Effects,536,English,Make your videos better than the competition! You'll make practical After Effects projects to boost your video branding!,3/2017,12/31/19
Creating Data and Infographics in After Effects,www.udemy.com/course/creating-data-and-infographics-in-after-effects/,Motion School,89.99,11.99,5.0(1 rating),Design,3D & Animation,After Effects,517,English,Design and Animate a Data graphic skateboarder in After Effects,8/2019,12/31/19
After Effects: Create Publishable Motion Graphic Templates,www.udemy.com/course/after-effects-create-publishable-template-using-expressions/,Aksh Animation,39.99,11.99,4.4(27 ratings),Design,3D & Animation,After Effects,680,English,"The complete course you need to learn expressions, various controls & creating motion graphic templates in After Effects",6/2017,12/31/19
The Basics of Animating in After Effects,www.udemy.com/course/the-basics-of-animating-in-after-effects/,Michael Lynam,44.99,11.99,3.8(68 ratings),Design,3D & Animation,After Effects,397,English,An introduction to 2D animation within After Effects. Learn the basics of the animated explainer video.,10/2015,12/31/19
Shape Layers Tutorial in AfterEffects,www.udemy.com/course/shape-layers-tutorial-in-aftereffects/,Shoaib Khan,49.99,11.99,5.0(2 ratings),Design,3D & Animation,After Effects,8,English,Learn all about Shape Layers and also how to create Shape Elements in After Effects,10/2019,12/31/19
Animation in After Effects – Project oriented course,www.udemy.com/course/animation-in-after-effects-project-oriented-course/,Vadim Daschinsky,29.99,11.99,4.7(7 ratings),Design,3D & Animation,After Effects,"1,196",English,"South Park style music video, New amazing adventures of Winnie-The-Pooh and other wonderful projects!",4/2017,12/31/19
Cinemagraph Masterclass: Your Complete Guide,www.udemy.com/course/cinemagraph/,Nic Kocher,124.99,11.99,4.1(17 ratings),Photography,Video Design,After Effects,142,English,"Learn to create professional cinemagraphs from an expert instructor, that are cut-above the competition.",2/2017,12/31/19
Animate 3D Parallax Camera in Photoshop and After Effects,www.udemy.com/course/animate-3d-parallax-camera-in-photoshop-and-after-effects/,Motion School,19.99,11.99,3.3(185 ratings),Design,3D & Animation,After Effects,"9,068",English,Animate a still photo using Adobe Photoshop and After Effects,6/2018,12/31/19
Green Screen Keying Techniques with Adobe After Effects CC,www.udemy.com/course/green-screen-keying-techniques-with-adobe-after-effects-cc/,David Newton,49.99,11.99,4.0(4 ratings),Design,Design Tools,After Effects,67,"English
 ",In this course I will show you how to create your own studio green screen and produce great keying in After Effects,3/2017,12/31/19
Adobe After Effects: Tips and Tricks,www.udemy.com/course/adobe-after-effects-tips-and-tricks/,Alexey Rybkin,49.99,11.99,4.3(7 ratings),Design,Design Tools,After Effects,33,English,Essential information required to become a professional AE artist,7/2018,12/31/19
After Effects: Make 11 Fun After Effects Video Titles,www.udemy.com/course/lowerthirds/,Phil Ebiner,99.99,11.99,4.7(48 ratings),Design,3D & Animation,After Effects,"18,378",English,Learn how to create your own video titles and graphics in Adobe After Effects with this fun project-based course.,1/2018,12/31/19
After Effects Beginner - Typography Reveal in After Effects,www.udemy.com/course/after-effects-animation-typography-reveal-in-after-effects/,Andrzej Pach,94.99,11.99,4.0(22 ratings),Design,3D & Animation,After Effects,722,English,After Effects Basics 4 beginners - Design Your First Complete After Effects motion project in CS6 CC,11/2019,12/31/19
Adobe After Effects CC - How to add Motion to your Photos,www.udemy.com/course/adobe-after-effects-cc-how-to-add-motion-to-your-photos/,Sunny Heera,79.99,11.99,4.4(91 ratings),Design,3D & Animation,After Effects,"18,438",English,This Beginners After Effects Guide will show you how to add Movement and Effects to your own Photos or Images,10/2018,12/31/19
Animated Icons in After Effects,www.udemy.com/course/animated-icons-after-effects/,Shoaib Khan,49.99,11.99,5.0(4 ratings),Design,3D & Animation,After Effects,20,English,Design & Animate Credit card icon into Mobile phone icon creatively and seemlessly by using mutual shapes,2/2019,12/31/19
Adobe After Effects Scripts,www.udemy.com/course/adobe-after-effects-scripts/,Bluefx .,99.99,11.99,3.7(2 ratings),Design,3D & Animation,After Effects,6,English,How to use and organize After Effects scripts and how to find free hot resources online for additional scripts,5/2019,12/31/19
Create Watercolor Story Video Slideshow in After Effects,www.udemy.com/course/create-sketch-watercolor-story-slideshow-in-after-effects/,Maggie Osama,149.99,11.39,4.6(31 ratings),Design,3D & Animation,After Effects,"4,105",English,A step by step course;creating sketch watercolor slideshow using After Effects - After Effects Project File Included,11/2019,12/31/19
After Effects for Graphic Design,www.udemy.com/course/after-effects-for-graphic-design/,Chris Converse,19.99,11.39,4.6(11 ratings),Design,Graphic Design,After Effects,86,English,"Learn how to use After Effects to create stunning, unique, and professional-quality graphics for any design project.",7/2018,12/31/19
Synthetic Stop-Motion in After Effects,www.udemy.com/course/synthetic-stop-motion-in-after-effects/,Rich Armstrong,39.99,11.39,4.4(16 ratings),Design,3D & Animation,After Effects,127,English,Quick and Easy Techniques for Hand-made Animations,8/2017,12/31/19
Compositing using After Effects,www.udemy.com/course/compositing-using-after-effects/,Data Training Campus,99.99,11.39,4.6(9 ratings),Design,3D & Animation,After Effects,"5,318",English,"This software application, you can even work on some non-linear editing in Video and Audio platforms.",1/2019,12/31/19
After Effects: Convert Photos to Amazing Painting Animations,www.udemy.com/course/after-effects-photoshop-convert-photo-to-painting-animations-cartoon/,Video Course Center Inc.,74.99,11.39,4.3(6 ratings),Design,3D & Animation,After Effects,"3,359",English,Learn how to create amazing painting animations from photos in After Effects and Convert photos to sketches in Photoshop,11/2019,12/31/19
"After Effect Mastery: Logo, Transition and Lowerthirds",www.udemy.com/course/after-effect-mastery-logo-transition-and-lowerthirds/,HU Shahir,49.99,11.39,3.6(18 ratings),Design,Graphic Design,After Effects,210,English,"Ultimate guide on creating Logo Animation, Shape Transition and Designing Lower Thirds in After Effect.",2/2018,12/31/19
Video Transitions in After Effects. After Effects Template,www.udemy.com/course/after-effects-video-transitions/,Andrzej Pach,49.99,11.39,4.8(80 ratings),Design,3D & Animation,After Effects,"2,989",English,Design video transitions in After Effects. Create and package After Effects templates for sale or use.,11/2019,12/31/19
Green Screen Editing In After Effects- Learn The Basics,www.udemy.com/course/green-screen-editing-in-after-effects-learn-the-basics/,Bluefx .,99.99,11.39,3.9(12 ratings),Photography,Video Design,After Effects,65,English,Learn How To Edit Green Screen And Make Professional Videos In After Effects,11/2016,12/31/19
Learn Adobe CC - For Beginners,www.udemy.com/course/adobe-for-beginners/,Avijit's Work,134.99,11.39,3.0(454 ratings),Design,Design Tools,After Effects,"44,021",English,Learn to use Adobe CC package the easy way,7/2019,12/31/19
Advanced Green Screen Editing in After Effects,www.udemy.com/course/advanced-green-screen-editing-in-after-effects/,Bluefx .,99.99,11.39,4.0(1 rating),Design,3D & Animation,After Effects,9,English,Learn how to achieve a clean key even on badly shot footage or poor lighting conditions,5/2019,12/31/19
Master Animating in After Effects by Creating a Glitch Title,www.udemy.com/course/creating-a-glitch-arcade-title-in-after-effects/,Motion School,99.99,11.39,4.5(10 ratings),Design,3D & Animation,After Effects,"1,450",English,Design and Animate a Glitch Title in After Effects,6/2018,12/31/19
Create 3D Intro Using Adobe After Effects & Element 3D,www.udemy.com/course/create-3d-intro-using-adobe-after-effects/,Uri Soglowek,19.99,11.39,4.5(10 ratings),Marketing,Video & Mobile Marketing,After Effects,207,English,"Almost every professional course, video or youtube channel has some short logo animation of the video's creator",7/2015,12/31/19
Create 3D Commercial in After Effects & Element 3D,www.udemy.com/course/create-3d-commercial-in-after-effects-element-3d/,Uri Soglowek,19.99,11.39,3.9(17 ratings),Marketing,Video & Mobile Marketing,After Effects,205, English,Commercial Breakdown: Learn the basics of creating real 3D Commercial in After Effects,12/2015,12/31/19
After Effects :Create Lower Thirds Animation For Your Videos,www.udemy.com/course/after-effects-create-sell-your-professional-lower-thirds/,Maggie Osama,179.99,11.39,4.5(39 ratings),Design,3D & Animation,After Effects,"5,008",English,Learn-by-doing approach course; guiding you through creating Lower Thirds with different techniques in After Effects,11/2019,12/31/19
"After Effects CC & CS6: Motion Graphics, VFX & Animation",www.udemy.com/course/after-effects-cc-cs6-motion-graphics-vfx-animation/,Easy Learn,184.99,11.39,2.3(78 ratings),Design,3D & Animation,After Effects,"2,393",English,"After Effects CC & CS6 Training: Master Motion Graphics, VFX & Animation. Use Kinetic Typography & Visual Effects!",1/2018,12/31/19
After Effects CC: How to Make The Elegant Logo Animation,www.udemy.com/course/the-reveal-logo-animation-techniques-in-depth/,Ahmet SARISAKAL,59.99,11.39,4.1(9 ratings),Design,3D & Animation,After Effects,834,English,Teaching the logo animation techniques with examples In-Depth For Beginner&Advanced Designers,5/2018,12/31/19
Morphing  with After Effect : Everything you need to know,www.udemy.com/course/adobe-after-effect-morph-anything/,HU Shahir,29.99,11.39,3.8(18 ratings),Design,Graphic Design,After Effects,472,English,Learn how to create cinemtaic morphing effect in Adobe after effect .,7/2016,12/31/19
Motion Graphics & VFX|After Effects|Videocopilot Saber,www.udemy.com/course/create-motion-graphics-and-visual-effects-with-saber-plugin/,Reza Zare,19.99,11.39,4.4(91 ratings),Design,3D & Animation,Motion Graphics,"6,077",English,Create Amazing Motion Graphics In After Effects,4/2016,12/31/19
Icon Animation in After Effects - Animate Vector Icons,www.udemy.com/course/icon-animation-in-after-effects/,Andrzej Pach,49.99,11.39,4.3(14 ratings),Design,3D & Animation,Animation,116,English,Animate a vector icon within After Effects! A complete project workflow in After Effects,11/2019,12/31/19
Tracking Motion In Adobe After Effects,www.udemy.com/course/tracking-motion-in-adobe-after-effects/,Bluefx .,99.99,11.39,4.5(1 rating),Design,3D & Animation,After Effects,11,English,"How to track motion, track broken footage and use the 3D Camera tracker effectively",4/2019,12/31/19
Make an amazing retro title in After Effects,www.udemy.com/course/amazing-retro-title-in-after-effects/,Marcus Melin,24.99,11.39,4.9(14 ratings),"Design
 ",3D & Animation,After Effects,945,English,"Be able to take your game, movie or trailer titles to a new level.",3/2016,12/31/19
learn after effects from beginner to intermediate to expert,www.udemy.com/course/learn-after-effects-from-beginner-to-intermediate-to-expert/,Businge Ismail,19.99,11.39,5.0(1 rating),Design,3D & Animation,After Effects,115,English,The Complete Guide to Adobe After Effects,3/2018,12/31/19
Wats App Animation In After Effects,www.udemy.com/course/messanger-app-animation-in-after-effects/,Sergey Basharin,34.99,11.39,5.0(1 rating),Design,3D & Animation,After Effects,"2,414",English,User Interface Animation,1/2019,12/31/19
Create 3D Parallax Video Slideshow Easily in After Effects!,www.udemy.com/course/aftereffectsparallaxslideshow/,Maggie Osama,149.99,11.39,4.5(49 ratings),Design,3D & Animation,After Effects,"6,367",English,A step by step course; creating 3D Parallax Slideshow using Adobe After Effects - After Effects Project File Included,11/2019,12/31/19
Adobe After Effects Online Course,www.udemy.com/course/adobe-after-effects-online-course/,Academy of Film Fashion and Design,19.99,11.39,5.0(1 rating),Design,Design Tools,After Effects,20,English,Adobe After Effects Online Course,4/2017,12/31/19
After Effects Master Class: The 3D Camera Explained,www.udemy.com/course/after-effects-master-class-the-3d-camera-explained/,"Tizzy Labs, LLC",99.99,11.39,3.9(12 ratings),Design,3D & Animation,After Effects,44,English,Don't just use the 3d camera...become a Master of it.,10/2017,12/31/19
Travel Mobile App Animation In After Effects,www.udemy.com/course/travel-mobile-app-animation-in-after-effects/,Sergey Basharin,34.99,11.39,4.2(4 ratings),Design,3D & Animation,After Effects,"1,863",English,User Interface Interface Animation,9/2018,12/31/19
Breathtaking Title Animation in After Effects like Hollywood,www.udemy.com/course/breathtaking-title-animation-in-after-effects-like-hollywood/,Amil Neal,19.99,11.39,4.0(3 ratings),Design,3D & Animation,After Effects,"2,182",English,Complete guide to Text and Title Animation in After Effects for advanced film making and video editing,6/2019,12/31/19
Create Professional Lighting Logo Reveal in After Effects CC,www.udemy.com/course/after-effects-lighting-logo-reveal-animation/,Video Course Center Inc.,19.99,11.39,4.3(9 ratings),Design,3D & Animation,After Effects,"4,660",English,A step-by-step guide to creating professional Lighting Logo Reveal Animations in Adobe After Effects CC,7/2019,12/31/19
How To Work With Text in Adobe After Effects,www.udemy.com/course/how-to-work-with-text-in-adobe-after-effects/,Bluefx .,99.99,11.39,0.0(0 ratings),Design,3D & Animation,After Effects,2,English,"Learn everything about texts, 3D extruded texts and more inside Adobe After Effects",4/2019,12/31/19
After Effects - Motion Graphics & Infographics,www.udemy.com/course/motion-graphic-with-aftereffects-cc-be-infinity/,Camak Academy,54.99,11.39,0.0(0 ratings),Design,Design Tools,After Effects,3,English,Building Animations & Commercial Teaser And Motion Graphics In After Effects CC For All Levels,8/2019,12/31/19
First look at Adobe After Effects CC - Motion Graphics 101,www.udemy.com/course/after-effects-course/,Sunny Heera,99.99,11.39,4.8(4 ratings),Design,3D & Animation,After Effects,23,English,Learn the Essentials in Adobe After Effects CC + Motion Graphic in this Beginners Animation + Motion Design Course,7/2019,12/31/19
After Effects CC: Make Professional Lower Thirds Titles,www.udemy.com/course/aftereffects-lower-thirds-titles/,Life Progression Project,74.99,11.39,4.1(88 ratings),Design,Design Tools,After Effects,"12,737",English,Professional Lower Thirds Video Titles in After Effects CC. Create Dynamic modern animated graphics name titles in AE,10/2019,12/31/19
After Effects CC: Create a Sci fi Futuristic Interface (HUD),www.udemy.com/course/after-effects-cc-create-a-futuristic-interface-hud/,Film Pro,59.99,11.39,4.6(4 ratings),Photography,Video Design,After Effects,32,English,Add production value to your sci-fi film learn the techniques to create different Futuristic Interface elements,10/2018,12/31/19
Rotoscopying using After Effects,www.udemy.com/course/rotoscopying-using-after-effects/,Data Training Campus,199.99,11.39,3.5(18 ratings),Design,3D & Animation,After Effects,"6,168",English,"After Effects is a Compositing, VFX, and Motion graphics application developed and owned by Adobe Systems.",2/2019,12/31/19
Create 80's Retro title in After Effects!,www.udemy.com/course/80s-style-retro-text/,Peter Nagy,19.99,11.39,4.5(1 rating),Design,3D & Animation,After Effects,9,English,"Create an editable retro title in After Effects. Animate it, then use it as GIF what you can share wherever you want.",11/2016,12/31/19
"After Effects: Tips, Tricks, and Techniques",www.udemy.com/course/after-effects-tips-tricks-and-techniques/,Alsayed Eltbakh,199.99,11.39,4.4(11 ratings),Design,3D & Animation,After Effects,"2,288",English,welcome to this course where we're going to focus on learning quick tips and fixes that will help you get better Results,5/2018,12/31/19
How to Work With Adjustment Layers in After Effects,www.udemy.com/course/how-to-work-with-adjustment-layers-in-after-effects/,Bluefx .,74.99,11.39,0.0(0 ratings),Design,3D & Animation,After Effects,1,English,Learn how to use and work with Adjustment Layers inside After Effects,5/2019,12/31/19
HUD Interface Animation in After Effects,www.udemy.com/course/hud-interface/,Sergey Basharin,49.99,11.39,3.7(6 ratings),Design,3D & Animation,After Effects,38,English,Learn how to create motion graphics in After Effects like what you see in Iron Man or other action movies,5/2018,12/31/19
How to Create GIF Animations in After Effects,www.udemy.com/course/how-to-create-gif-animations-in-after-effects/,Bluefx .,74.99,11.39,3.9(2 ratings),Design,3D & Animation,After Effects,4,English,"Learn how to create GIF animations, export them and post them in social media",5/2019,12/31/19
QuickStart! - Adobe After Effects CC,www.udemy.com/course/quickstart-adobe-after-effects-cc-vtc/,VTC Software Training,0.0,19.99,0.0(0 ratings),Design,Design Tools,After Effects,8,English,Get started creating amazing special effects on still images and video.,9/2013,12/31/19
Rotoscoping in After Effects,www.udemy.com/course/rotoscoping-in-after-effects/,Bluefx .,99.99,11.39,0.0(0 ratings),Design,3D & Animation,After Effects,4,English,"The paint tools inside After Effects, The Rotobrush and Rotoscoping and Challenging Selecting",4/2019,12/31/19
The Custom Effects Workshop,www.udemy.com/course/customeffectsworkshop/,Mikey Borup,19.99,11.39,4.8(22 ratings),Design,3D & Animation,After Effects,184,English,Learn how to create amazing Custom Effects presets in After Effects. These are also sometimes called Pseudo Effects.,3/2015,12/31/19
An Introduction into Adobe After Effects (For beginners),www.udemy.com/course/after-effects-beginners/,Romaine Reid,19.99,11.39,4.5(1 rating),Design,3D & Animation,After Effects,1,English,A short introduction course to teach you the fundamental skills in Motion Design with After Effects.,9/2018,12/31/19
Animating A Badge,www.udemy.com/course/animating-a-badge/,Richard Adam Jones,29.99,11.39,4.6(2 ratings),Design,3D & Animation,After Effects,13,English,Workflow from Illustrator to After Effects,3/2017,12/31/19
Custom Logo Animation Studio Rider For Adobe After Effects,www.udemy.com/course/custom-logo-animation-studio-rider-for-adobe-after-effects/,Smart Teacher,49.99,11.39,3.5(3 ratings),Design,3D & Animation,After Effects,62,English,Advanced Custom Logo/Motion Graphics in Adobe After Effects,4/2019,12/31/19
Learn The Fundamentals of After Effects (Beginner),www.udemy.com/course/after-effects-animation-for-beginners/,Gary E Perlin,59.99,11.39,5.0(1 rating),Design,Other,After Effects,3,English,Create your first animation using simple techniques and just a few tools,8/2019,12/31/19
Quick Tips to Mastering Adobe After Effects,www.udemy.com/course/mastering-adobe-after-effects/,Duncan Rogoff,94.99,11.39,4.5(20 ratings),Design,3D & Animation,After Effects,"1,395",English,"Quick Tips to save Time, Money, & Effort!",10/2017,12/31/19
After Effects - Motion Graphics Title Sequence for beginners,www.udemy.com/course/after-effects-title-sequence-for-advanced-beginners/,Ashley Hills,19.99,11.99,4.2(8 ratings),Design,Design Tools,After Effects,"1,049",English,Create a Rainy Motion Graphic Title Sequence with Adobe After Effects CC,5/2018,12/31/19
After Effects for Beginners: 4 Projects to Get You Started,www.udemy.com/course/after-effects-for-beginners-4-projects-to-get-you-started/,Duncan Rogoff,134.99,11.99,4.5(17 ratings),Design,3D & Animation,After Effects,"1,069",English,Learn the Basics and Create Something fun!,10/2017,12/31/19
Mastering Text Animation in After Effect,www.udemy.com/course/master-text-animation-in-ae/,HU Shahir,19.99,11.99,1.5(2 ratings),Design,Graphic Design,After Effects,7,English,Complete guide to Text Animation in After Effect.,2/2017,12/31/19
Learn the After Effects 2019 User Interface. For Beginners,www.udemy.com/course/learn-the-after-effects-2018-user-interface-for-beginners/,Matthew Foster,19.99,11.99,4.6(22 ratings),Design,3D & Animation,After Effects,"2,735",English,"The best course if you're just breaking into After Effects. Before diving into complex topics, learn how to navigate AE",12/2017,12/31/19
Dive into Adobe After Effects 1: Learn the Basics,www.udemy.com/course/adobe-after-effects-course-tutorial-for-beginners/,Phil Ebiner,29.99,11.99,3.5(193 ratings),Design,Design Tools,After Effects,"21,235",English,A project-based course that guides you through creating a title card of your favorite brand in Adobe After Effects.,5/2016,12/31/19
Dive Into Adobe After Effects 2: Learn to Animate Graphics,www.udemy.com/course/adobe-after-effects-course-tutorial-for-beginners-animating-keyframes/,Phil Ebiner,29.99,11.99,3.9(88 ratings),Design,3D & Animation,After Effects,"20,072",English,A project-based course that guides you through animating a title card of your favorite brand in Adobe After Effects.,5/2016,12/31/19
Motion Graphic With After Effect From Scratch in 5 Hours,www.udemy.com/course/motion-graphic-with-ae/,HU Shahir,49.99,11.99,3.8(15 ratings),Design,Graphic Design,Motion Graphics,91,English,Learn motion graphic form fundamentals concept up to extremel advance project and start career as a MotionGraphic Artist,7/2016,12/31/19
Enhancing Moho Scenes in After Effects,www.udemy.com/course/enhancing-cartoon-scenes-in-after-effects/,Chad Troftgruben,59.99,11.99,3.2(2 ratings),Design,3D & Animation,After Effects,14,English,Create impressive visuals by enhancing your animations in After Effects!,9/2018,12/31/19
Taxi Mobile App Animation In After Effects,www.udemy.com/course/taxi-mobile-app-animation-in-after-effects/,Sergey Basharin,34.99,11.99,4.3(9 ratings),Design,3D & Animation,After Effects,"1,354",English,User Interface Animation In After Effects,1/2019,12/31/19
Developing Star Trek Effects in After Effects,www.udemy.com/course/developing-star-trek-effects-in-after-effect/,QScutter Tutorials,19.99,11.99,3.4(4 ratings),Design,Design Tools,After Effects,75,English,An In-depth course for creating effects you love.,1/2014,12/31/19
How to Create a Realistic Draw-On Effect in After Effects,www.udemy.com/course/create-a-realistic-draw-on-effect-in-after-effects/,Sam DeZeeuw,19.99,11.99,4.8(14 ratings),Design,3D & Animation,After Effects,"1,661",English,The guide to creating a realistic drawing animation in After Effects through 2D Animation,1/2016,12/31/19
Virtual Studio Project,www.udemy.com/course/virtual-studio-project/,Alou TRAORE,99.99,11.99,4.8(34 ratings),Marketing,Content Marketing,After Effects,50,English,Virtual studio,12/2017,12/31/19
Learning Adobe After Effects CC 2014,www.udemy.com/course/learning-adobe-after-effects-cc-2014/,Infinite Skills,49.99,11.99,4.6(13 ratings),IT & Software,Other,After Effects,321, English,Dive into animation and special effects using Adobe's powerful compositing tool to enhance and revitalize your videos.,1/2017,12/31/19
✔️ After Effects :Create Cool Motion Graphics in Adobe AE ✔️,www.udemy.com/course/aesupertypo/,Prem Chand,19.99,11.99,4.4(23 ratings),Design,Design Tools,After Effects,"1,118",English,Create professional looking 2D and 3D Text animations in AfterEffects. Work as a professional Motion Graphics Artiste,6/2016,12/31/19
Pro Skills Pack - Boost your skills with Adobe After Effects,www.udemy.com/course/psp_aftereffects/,Logan Bean,39.99,11.99,0.0(0 ratings),Photography,Video Design,After Effects,24,English,Test yourself with challenges designed by an industry professional. Learn the skills our clients ask for the most!,8/2017,12/31/19
Learn After Effects CS6 from Scratch to Professional,www.udemy.com/course/learn-after-effects-cs6-from-scratch-to-professional/,Benchea Ionel,19.99,11.99,0.0(0 ratings),Design,3D & Animation,After Effects,7,English,"Learn from scratch to use After Effects CS6, and become great video designer",3/2018,12/31/19
Getting Started in After Effects,www.udemy.com/course/getting-started-in-after-effects/,Bluefx .,99.99,11.39,4.0(1 rating),Design,3D & Animation,After Effects,3,English,Learn the basics of After Effects and build a solid foundation for expending your knowledge further,4/2019,12/31/19
After Effects Learn Logo Reveal or Logo Pop-Up Animation,www.udemy.com/course/learn-logo-pop-up-animation-in-after-effects-for-beginners/,Harsh Vardhan Art,199.99,11.39,3.8(37 ratings),Design,3D & Animation,Logo Design,"18,991",English,Start Creating Your own Logo Animation or Logo Reveal Animation Professionally,12/2016,12/31/19
Adobe After Effects basics,www.udemy.com/course/gdo-adobe-after-effects-basics/,Gabriel Ortolan,34.99,11.39,0.0(0 ratings),Design,Graphic Design,After Effects,1,English,It's time to learn once and for all the basics of Adobe After Effects!,11/2018,12/31/19
