Course,URL,instructor,Price (full),Price (discount),Rank,Category 1,Category 2,Category 3,Enrollment,Language,Description,Last Update,Date Scraped
Learn After Effects: A Comprehensive Course for Beginners,www.udemy.com/course/most-comprehensive-after-effects-course-beginners/,Nick Henry,49.99,11.39,4.1(9 ratings),Design,Design Tools,After Effects,246,English,Learn After Effects with no experience! Start working in motion graphics and animation with an always updated course.,11/2016,12/31/19
Motiongraphics Workflow Tricks in After Effects,www.udemy.com/course/information-graphics/,Scott Turner,19.99,11.39,3.7(9 ratings),Design,3D & Animation,After Effects,54,English,Rapid workflow for motiongraphics and information graphics,1/2016,12/31/19
Star Wars Effects! Lightsabers and Force Lightning!,www.udemy.com/course/star-wars-effects-lightsabers-and-force-lightning/,Robert Turrell,19.99,11.39,4.5(9 ratings),Design,3D & Animation,After Effects,39,English,Use Adobe After effects to create professional special effects as seen in the Star Wars Films!,2/2016,12/31/19
Create a Super Hero Special Effect in Adobe After Effects,www.udemy.com/course/create-super-hero-special-effects-in-adobe-after-effects-cc/,David Newton,49.99,11.39,4.5(6 ratings),Design,3D & Animation,After Effects,47,English,"Create amazing effects in this Adobe After Effects Course, learn at a steady pace and get results...",3/2017,12/31/19
Learn to make stunning animated graphs in After effects,www.udemy.com/course/animate-graphs-in-after-effects/,Ashok K M,19.99,11.39,3.8(5 ratings),Design,Graphic Design,2D Animation,"1,634",English,"Learn to make Bar graph,donut diagram,pie diagram & line graph",12/2018,12/31/19
After Effects Premiere Pro Workflow - Adobe Dynamic Linking,www.udemy.com/course/after-effects-premiere-pro-workflow-adobe-dynamic-linking/,Bluefx .,99.99,11.39,0.0(0 ratings),Design,3D & Animation,After Effects,1,English,Learn how After Effects connects with Adobe Premiere Pro and the efficient workflow between them,4/2019,12/31/19
"Creative Split Screens in After Effects, Part 2",www.udemy.com/course/creative-split-screens-in-after-effects-part-2/,Natasha Collette,59.99,11.39,0.0(0 ratings),Design,Design Tools,After Effects,12,English,Make your video work more awesome by creating dynamic composite movement!,9/2016,12/31/19
Learning How To Master Adobe After Effects,www.udemy.com/course/learning-how-to-master-adobe-after-effects/,Jordan North,19.99,11.39,0.0(0 ratings),IT & Software,Other,After Effects,0,English,Learning how to hone you VFX and compositing skills within After Effects,2/2019,12/31/19
Adobe After Effects 101 | From newbie to your first video,www.udemy.com/course/adobe-after-effects-101-from-newbie-to-your-first-video/,Andrea Molteni,29.99,11.39,3.8(4 ratings),IT & Software,Other,After Effects,"2,723",English,Join the world of video by starting to use one of the most used software.,11/2019,12/31/19
Learn  After Effects and master 3d layers in after effects,www.udemy.com/course/the-basics-of-after-effects/,businge ismail,19.99,11.39,3.8(7 ratings),Design,Graphic Design,After Effects,"1,363",English,"learn from the basics to mastering after effects 3d workspace and 3d layers, how to animate a cube we make from 3dlayers",2/2015,12/31/19
"Useful, Fun Animation Techniques Inside After Effects",www.udemy.com/course/useful-fun-animation-techniques-inside-after-effects/,Bluefx .,99.99,11.39,0.0(0 ratings),Design,3D & Animation,After Effects,0,English,Fun animation techniques inside After Effects to help you expand your creativity,4/2019,12/31/19
How to Animate Shapes in After Effects,www.udemy.com/course/how-to-animate-shapes-in-after-effects/,Bluefx .,99.99,11.39,0.0(0 ratings),Design,3D & Animation,After Effects,1,English,"Learn all about shapes, 3D shapes and paths inside After Effects",4/2019,12/31/19
How To Use the Text Animation Presets in After Effects,www.udemy.com/course/how-to-use-the-text-animation-presets-in-after-effects/,Bluefx .,74.99,11.39,0.0(0 ratings),Design,3D & Animation,After Effects,1,English,"Learn how to use the included presets, how to customize them and how to create your own",5/2019,12/31/19
Color Correction On Premiere and After Effects,www.udemy.com/course/color-correction-on-premiere-and-after-effects/,Miguel Coelho de Augustinis,199.99,11.39,0.0(0 ratings),Design,Design Tools,After Effects,1,English,Master the main color correction tools from Premiere and After Effects and create your style.,6/2019,12/31/19
How to Animate Elements of Still Images in 3D Space,www.udemy.com/course/how-to-animate-elements-of-still-images-in-3d-space/,Bluefx .,74.99,11.39,0.0(0 ratings),Design,3D & Animation,After Effects,1,English,"Learn how to edit and prepare photos in Photoshop, and animate the elements in Adobe After Effects",5/2019,12/31/19
Mastering Motion Graphics using Adobe After Effects,www.udemy.com/course/motion-graphic/,Sam Parulekar,54.99,11.39,0.0(0 ratings),IT & Software,Other,After Effects,0,English,A Step by Step course to Mastering Adobe After Effects,6/2019,12/31/19
After Effect Camcorder and Holday tips and tricks,www.udemy.com/course/after-effects-camcorder-and-holday-tips-and-tricks/,David Newton,49.99,11.39,2.4(4 ratings),Photography,Video Design,After Effects,848,English,Improve your holiday videos with this quick to complete course,3/2017,12/31/19
After Effects - Create 3D Parallax Effect : Flying Cards,www.udemy.com/course/parallax-technique-01-for-aftereffects-flying-cards/,Droptuts Course,19.99,11.39,0.0(0 ratings),Design,3D & Animation,After Effects,6,English,Animate a still photo using Adobe Photoshop and After Effects - Create stunning parallax effect,8/2018,12/31/19
"After Effects CC 2019 : Motion Graphics in just 1 hour, Easy",www.udemy.com/course/masterclass-after-effects-motion-graphics-and-passive-income/,Samidkhan Talishinski,19.99,11.39,4.4(7 ratings),Design,Design Tools,After Effects,"2,172",English,"How to make amazing motion graphics in After Effects for your projects, or even sell it online and get passive income.",12/2018,12/31/19
Masks and Mattes in After Effects,www.udemy.com/course/masks-and-mattes-in-after-effects/,Bluefx .,99.99,11.39,0.0(0 ratings),Design,3D & Animation,After Effects,2,English,"How to create masks, masks tracking, face tracking and more",4/2019,12/31/19
"After Effects - Text, Title and Kinetic Typography Animation",www.udemy.com/course/after-effects-text-title-and-kinetic-typography-animation/,Amil Neal,19.99,11.39,4.0(2 ratings),Design,3D & Animation,After Effects,"2,599",English,Complete guide to Minimal Text and Clean Title Animation in After Effects for advanced film making and video editing,11/2019,12/31/19
After Effects CC : Futuristic HUD Motion Graphics Elements,www.udemy.com/course/aftereffectsccanimatedfuturistichudmotiongraphics/,Maggie Osama,149.99,11.39,4.6(15 ratings),Design,3D & Animation,After Effects,"3,488",English,Create Animated Futuristic HUD Motion Graphics Elements in After Effects CC (Learning By Doing) - Project Files Included,11/2019,12/31/19
After Effects: 3D Logo Animation,www.udemy.com/course/after-effects-3d-logo-animation/,Ahmet SARISAKAL,39.99,11.39,0.0(0 ratings),Design,Graphic Design,After Effects,22,English,Teaching 3D logo animation techniques In-Depth For Beginner&Advanced Designers,7/2018,12/31/19
Text Me! in After Effects,www.udemy.com/course/text-me-in-ae/,Natasha Collette,19.99,11.39,5.0(1 rating),Design,3D & Animation,After Effects,63,English,Animate Realistic Text Message Dialogues in After Effects,1/2017,12/31/19
After Effects: Create  Advertisement From an Image,www.udemy.com/course/after-effects-how-to-create-advertisement-from-an-image/,Alsayed Eltbakh,99.99,11.39,4.3(12 ratings),Design,3D & Animation,After Effects,"3,967",English,In this course we will learn How to create an ad from an image using Photoshop and after Effects,2/2018,12/31/19
Cycore Video Effects in Adobe After Effects,www.udemy.com/course/cycore-video-effects-in-adobe-after-effects/,Bluefx .,99.99,11.39,0.0(0 ratings),Design,3D & Animation,After Effects,3,English,How to use the included Cycore Video Effects Pack and the popular CC Particle world Effect to create amazing animations,4/2019,12/31/19
The Essential Beginners Course to Adobe After Effects CS6,www.udemy.com/course/the-essential-beginners-course-to-adobe-after-effects/,David Newton,49.99,11.39,3.9(10 ratings),Design,Design Tools,After Effects,29,English,Getting started with After Effects this is the essential beginners guide to After Efffects - Learn the essentials today!,3/2017,12/31/19
Adobe After Effects From Zero to Grand master Crash Course,www.udemy.com/course/adobe-after-effects-from-zero-to-grandmaster/,Deepali Sharma,19.99,11.39,2.7(3 ratings),Design,3D & Animation,After Effects,"1,625",English,Magic into your creation with a touch of animation in your video,10/2019,12/31/19
2D Animation of a Fire Pit in After Effects for Beginners,www.udemy.com/course/2d-animation-of-a-fire-pit-in-after-effects-for-beginners/,Dorin Achim,19.99,11.39,0.0(0 ratings),Design,Graphic Design,After Effects,3,English,"If you wanna to be great in the 2D animation, this course will be useful for you.",11/2018,12/31/19
Creative Split Screens in After Effects - PART 1,www.udemy.com/course/creative-split-screens-in-after-effects-part-1/,Natasha Collette,49.99,11.39,4.8(7 ratings),Design,Design Tools,After Effects,24,English,Make your video work more awesome by creating interesting composite movement!,3/2016,12/31/19
How To Control Time in Adobe After Effects,www.udemy.com/course/how-to-control-time-in-adobe-after-effects/,Bluefx .,74.99,11.39,0.0(0 ratings),Design,3D & Animation,After Effects,0,English,Learn the secrets of time remapping inside After Effects,5/2019,12/31/19
2D Animation of a Fire Pit in After Effects for Beginners,www.udemy.com/course/2d-animation-of-a-fire-pit-in-after-effects-for-beginners/,Dorin Achim,19.99,11.39,0.0(0 ratings),Design,Graphic Design,After Effects,3,English,"If you wanna to be great in the 2D animation, this course will be useful for you.",11/2018,12/31/19
Adobe After Effects CC: Learn To Make Motion Graphics Now,www.udemy.com/course/learn-basics-of-adobe-after-effects-cc-for-beginners/,Pankaj Pankaj,0.0,Free,3.9(42 ratings),Design,Design Tools,After Effects,"3,075",English,Create motion graphics and animation videos for fun or Profit and get ready for success in Adobe After Effects CC,3/2015,12/31/19
FREE After Effects Basics -2D Flat Shadows in After Effects,www.udemy.com/course/after-effects-basics-flat-shadows-in-after-effects/,Andrzej Pach,0.0,Free,4.3(487 ratings),Design,3D & Animation,After Effects,"23,717",English,Intro to After Effects - Learn After Effects Animation with this basic free course,11/2019,12/31/19
Clean video reveal project in After Effects,www.udemy.com/course/video-reveal-in-after-effects/,Andrzej Pach,0.0,Free,4.0(148 ratings),Design,3D & Animation,After Effects,"9,898",English,Create a real-life After Effects project and use it for your videos! Learn After Effects basics along the way!,11/2019,12/31/19
Adobe After Effects CC: Tips and Tricks,www.udemy.com/course/adobe-after-effects-cc-tips-and-tricks/,Jonathon Parker,0.0,Free,4.1(111 ratings),Design,3D & Animation,After Effects,"10,007",English,Speed up your After Effects workflow,1/2018,12/31/19
After Effects Essentials: Complete VFX and Motion GFX Guide,www.udemy.com/course/aftereffectscc/,Ruan Lotter,0.0,Free,"4.5(1,502 ratings)",Design,Graphic Design,After Effects,"41,579",English,Your complete guide to create amazing Visual Effects and Motion Graphics using Adobe After Effects CC 2017.,8/2017,12/31/19
Basic Animation in Adobe After Effects,www.udemy.com/course/basic-animation-in-adobe-after-effects/,Vadim Daschinsky,0.0,Free,4.2(186 ratings),"Design
 ",3D & Animation,After Effects,"10,548",English,You too can make cartoons!,12/2019,12/31/19
Valentine Memory Book Design,www.udemy.com/course/valentine-memory-book/,Alou TRAORE,0.0,Free,3.7(4 ratings),Marketing,Content Marketing,After Effects,"1,305",English,Valentine's Book,4/2018,12/31/19
Design and Animate a Vintage Badge in After Effects,www.udemy.com/course/design-and-animate-a-vintage-badge-in-after-effects/,Andre Angelo,0.0,Free,4.3(128 ratings),Design,3D & Animation,After Effects,"9,949",English,"A Project-Based walk thru on creating and animating a vintage badge, finished with snow and sound effects!",12/2016,12/31/19
Puppet Pin Rigging in After Effects,www.udemy.com/course/puppet-pin-rigging-in-after-effects/,Chad Troftgruben,0.0,Free,4.0(77 ratings),Design,3D & Animation,After Effects,"5,222",English,Animate 2D cartoon characters in After Effects!,10/2018,12/31/19
After Effects CC for Beginners - The Basics of After Effects,www.udemy.com/course/aftereffectsbasics/,Jordan Dueck,0.0,Free,4.4(498 ratings),Design,Other,After Effects,"12,140",English,Learn the basics of After Effects in this complete beginner's course! Learn After Effects in under 1 Hour!,3/2018,12/31/19
Adobe After Effects Templates for Beginners,www.udemy.com/course/how-to-use-after-effects-templates/,Phil Ebiner,0.0,Free,4.5(629 ratings),Design,Design Tools,After Effects,"29,993",English,Improve your videos with pre-made After Effects templates. No previous skill required to spice up your videos today!,5/2016,12/31/19
Basic Animation In After Effects,www.udemy.com/course/basic-animation-in-after-effects/,Dara Harper,0.0,Free,4.3(997 ratings),Design,3D & Animation,After Effects,"24,742",English,"Learn basic animation, motion graphics and how to add special effects to video in After Effects.",10/2015,12/31/19
Learning Adobe After Effects cc  in egyptian arabic,www.udemy.com/course/aftereffects-arabic/,Eslam Osama Algwaily,0.0,Free,4.1(159 ratings),Design,3D & Animation,After Effects,"5,324",English,ÙÙ Ø§ÙØµÙØ± Ø­ØªÙ Ø§ÙØ¥Ø­ØªØ±Ø§Ù ÙÙ Ø¨Ø±ÙØ§ÙØ¬ Ø§ÙØ£ÙØªØ± Ø¥ÙÙÙØª ÙØªØµÙÙÙ Ø§ÙÙØ¤Ø«Ø±Ø§Øª Ø§ÙØ®Ø§ØµØ© ÙÙ Ø§ÙØ£ÙÙØ§Ù Ù ØªØµÙÙÙ ÙÙØ¯ÙÙÙØ§Øª Ø¯Ø¹Ø§Ø¦ÙØ© Ø¨Ø¥Ø­ØªØ±Ø§ÙÙØ©.,1/2017,12/31/19
Free After Effects Beginners Course,www.udemy.com/course/free-after-effects-beginners-course/,Anish M Kokani,0.0,Free,0.0(0 ratings),Design,Design Tools,After Effects,"1,667",English,After Effects Basic Introduction Course,6/2019,12/31/19
Basic Animation In After Effects,www.udemy.com/course/basic-animation-in-after-effects/,Dara Harper,0.0,Free,4.3(997 ratings),Design,3D & Animation,After Effects,"24,742",English,"Learn basic animation, motion graphics and how to add special effects to video in After Effects.",10/2015,12/31/19
Adobe After Effects Templates for Beginners,www.udemy.com/course/how-to-use-after-effects-templates/,Phil Ebiner,0.0,Free,4.5(629 ratings),Design,Design Tools,After Effects,"29,993",English,Improve your videos with pre-made After Effects templates. No previous skill required to spice up your videos today!,5/2016,12/31/19
After Effects Class 初めてでも安心！現役クリエイターが教える動画コンテンツ制作術,www.udemy.com/course/ae-complete-course/,OMOKAGE TV,164.99,11.99,"4.5(1,048 ratings)",ãã¶ã¤ã³,ãã¶ã¤ã³ãã¼ã«,After Effects,7736äººã®åè¬çãç»é²,æ¥æ¬èª,ã5Gãæä»£ã«åãã¦åç»åºåå¸å ´ã¯TVåºåå¸å ´ãè¶ããå¢ãã§ããæ­æãé³æ¥½PVãæã¤ããã«ãä¼ç¤¾ãä¼æ¥­PVãæã¤æä»£ã«ãªãã¾ããåç»ã¹ã­ã«ãããã°åäººã§ãããããåéã§æ´»èºãããã¨ã«ãªãã§ããããã¢ãã¿ã¼ã¨ãã§ã¯ãã§ãã£ã³ã¹ãæ´ãã§ãã ãã,11/2019,12/31/19
Formation Complète After Effects CC en 24h,www.udemy.com/course/formation-complete-after-effects-cc-2017/,Sébastien ARMAND,199.99,11.99,4.5(974 ratings),Design,3D et animation,After Effects,6Â 013,FranÃ§ais,Cette formation complÃ¨te vous permettra de bien dÃ©buter et devenir un expert sur After Effects CC,4/2019,12/31/19
After Effects para Motion designers: Do zero ao mercado,www.udemy.com/course/after_motion/,Yogo Costa,49.99,11.99,"4.5(2,609 ratings)",Design,3D e animaÃ§Ã£o,After Effects,9.332,PortuguÃªs,"Aprenda do zero as tÃ©cnicas mais vendidas no mercado de motion graphics, e descubra como vender para clientes globais.",9/2019,12/31/19
Adobe After Effects CC Masterclass — Vom Anfänger zum Profi,www.udemy.com/course/aftereffects-masterclass/,Justus Zeemann,199.99,11.99,4.4(388 ratings),Design,3D & Animation,After Effects,3.693,Deutsch,"Entdecke After Effects CC 2019, erstelle eigene Animationen und meistere die Funktionen. Tipps&Tricks, TastenkÃ¼rzel, uvm",9/2019,12/31/19
現役クリエイターが教える！After Effects モーショングラフィックス「超」入門,www.udemy.com/course/after_effects_motion_graphics/,OMOKAGE TV,99.99,11.99,4.6(141 ratings),ãã¶ã¤ã³,3Dã»ã¢ãã¡ã¼ã·ã§ã³,After Effects,1401äººã®åè¬çãç»é²,æ¥æ¬èª,ãã£ãã®ä¸æ¥ã§åç»åºåã§ãä½¿ããããã©ããã¢ãã¡ã¼ã·ã§ã³æè¡ãå­¦ã¹ã¾ããããã«Aeã§ä¸ããã°ã©ãã£ãã¯ãã¶ã¤ã³ãä½ãã¾ããèªåã§ä½ã£ããã¶ã¤ã³ã«åããä»ãããã¨ã§ããæ·±ãã¹ã­ã«ãèº«ã«ã¤ããäººããæ§ããå¶ä½ã¹ã­ã«ç¿å¾ãç®æãã¾ãã,12/2019,12/31/19
After Effects cc : はじめてのVisualEffects！プロが教えるVFX動画制作,www.udemy.com/course/aftereffects-japan-vfx/,OMOKAGE TV,149.99,11.99,4.4(233 ratings),ãã¶ã¤ã³,ãã¶ã¤ã³ãã¼ã«,After Effects,3224äººã®åè¬çãç»é²,æ¥æ¬èª,Visual Effectsã®æè¡ãç¿å¾ããèº«è¿ãªç°å¢ã§ãã¬ããæ ç»ã«ãããããªè¦è¦å¹ææ åãä½ããããã«ãªãã¾ããä»ã¾ãã«å¿è¦ã¨ããã¦ããã¹ã­ã«ãç¿å¾ãããã¨ã§ããããå ´æã§éå®ãããäººæã«ãªããã¨ã§ããããæ åãè¦ãå´ããè¦ããå´ã¸ï¼,1/2019,12/31/19
中二病が暴発するAfter Effects CC クリエイティブチュートリアル,www.udemy.com/course/bombastic-after-effects-cc/,(あくしょん) Murakami Yoshiyuki,104.99,11.99,4.4(240 ratings),ITã¨ã½ããã¦ã§ã¢,ãã®ä»,After Effects,2213äººã®åè¬çãç»é²,æ¥æ¬èª,å®è·µçã§ã¢ãã¡ããã¯ãªã´ã£ã¸ã¥ã¢ã«ã¹ã­ã«ãæã«å¥ãããï¼,12/2019,12/31/19
After Effects: De zero a Master,www.udemy.com/course/after-effects-de-zero-a-master/,Daniel Nuñez,114.99,11.99,"4.5(2,439 ratings)",Design,3D & Animation,After Effects,"8,135",Spanish,Curso Definitivo de After Effects,9/2018,12/31/19
After Effects CC 2019 - Do Básico ao Avançado,www.udemy.com/course/adobe-after-effects-cc-2019-do-basico-ao-avancado/,Professor Willian,104.99,11.99,4.7(125 ratings),Design,Ferramentas de design,After Effects,764,PortuguÃªs,Aprenda na pratica a utilizar o Adobe After Effects de forma avanÃ§ada criando diversos trabalhos e exercÃ­cios,9/2019,12/31/19
After Effects CC 2018 ve 2020: Sıfırdan Eğitim,www.udemy.com/course/after-effects-cc-2018-sfrdan-ileri-seviyeye/,Video Eğitim,139.99,11.99,"4.3(1,439 ratings)",TasarÄ±m,Grafik TasarÄ±m,After Effects,6.114,TÃ¼rkÃ§e,"After Effects ile sÄ±fÄ±rdan baÅlayarak filmlerinizi, Youtube ve sosyal medya videolarÄ±nÄ± gÃ¶z alÄ±cÄ± efektler ile sÃ¼sleyin.",12/2019,12/31/19
After Effects: Animando Personagens do Zero ao Mercado,www.udemy.com/course/after_personagem/,Yogo Costa,104.99,11.99,4.5(631 ratings),Design,3D e animaÃ§Ã£o,AnimaÃ§Ã£o em 2D,2.416,PortuguÃªs,Aprenda do absoluto ZERO como criar animaÃ§Ãµes de personagens no After Effects. Do desenho do personagem Ã  animaÃ§Ã£o.,2/2019,12/31/19
After Effects CC Masterclass - Actualizado a CC 2020,www.udemy.com/course/after-effects-cc-la-guia-completa-para-crear-animaciones/,Federico Garay,199.99,11.99,4.4(285 ratings),Design,Design Tools,After Effects,"2,429",Spanish,De cero a Master. Domina After Effects CC para mejorar tus videos con animaciones profesionales y efectos visuales,11/2019,12/31/19
Curso Online de Adobe After Effects CS6 e CC,www.udemy.com/course/curso-online-de-adobe-after-effects-cs6-e-cc/,André Rossiter,149.99,11.99,"4.5(1,489 ratings)",TI e software,Outro,After Effects,6.979,PortuguÃªs,Aprenda a fazer ediÃ§Ã£o de vÃ­deo focado em efeitos especiais ou vinhetas profissionais com adobe after efefcts,2/2019,12/31/19
After Effects: il corso per tutti,www.udemy.com/course/after-effects-per-tutti/,Fabio Pellencin,119.99,11.39,4.2(45 ratings),Design,3D & Animazione,After Effects,268,Italiano,"Impara After Effects in modo pratico e sviluppa i tuoi progetti, corso completamente in italiano, partendo da zero.",8/2019,12/31/19
20 Ateliers Pratiques sur Adobe After Effects CC,www.udemy.com/course/20-ateliers-pratiques-sur-adobe-after-effects-cc/,Sébastien ARMAND,199.99,11.39,4.6(135 ratings),Design,3D et animation,After Effects,980,FranÃ§ais,MaÃ®trisez les techniques plus avancÃ©es que vous offre After Effects et libÃ©rez votre crÃ©ativitÃ©,4/2019,12/31/19
Adobe Character Animator: あなたの顔をカメラ認識、自分だけのアバターを生み出すビギナークラス,www.udemy.com/course/character-animator-japan/,OMOKAGE TV,99.99,11.39,4.5(109 ratings),ãã¶ã¤ã³,ãã¶ã¤ã³ãã¼ã«,After Effects,908äººã®åè¬çãç»é²,æ¥æ¬èª,Adobe Character Animatorã«ä½¿ã£ããããªãã ãã®ã­ã£ã©ã¯ã¿ã¼ã¢ãã¡ã¼ã·ã§ã³ãä½ãã³ã¼ã¹ã§ããPCã«ã¡ã©ã«åãã£ã¦ãªãªã¸ãã«ã­ã£ã©ã¯ã¿ã¼ã«èªèº«ã§æ¼æãã¤ãããã¨ã§ãé«åº¦ãªåããèª°ã§ãç°¡åã«åç¾ãããã¨ãã§ãã¾ã,11/2018,12/31/19
Videomaker Superhero | 3 corsi in 1,www.udemy.com/course/videomaker-superhero/,Fabio Pellencin,159.99,11.39,4.2(11 ratings),Fotografia,Video design,After Effects,83,Italiano,"Premiere Pro, After Effects e Photoshop: impara tutti gli strumenti piÃ¹ importanti per diventare un vero videomaker.",9/2019,12/31/19
After Effects Definitivo em 30 Dias para Motion Designers,www.udemy.com/course/motion_masterclass_logo/,Yogo Costa,19.99,11.39,4.6(345 ratings),Design,3D e animaÃ§Ã£o,After Effects,1.389,PortuguÃªs,"Se Torne um Motion Designer! Aprenda Definitivamente o After Effects em 30 Dias, Estudando Apenas Meia Hora por Dia!",4/2019,12/31/19
VR動画編集入門：Premiere Pro/AfterEffectsの360VR編集指南書,www.udemy.com/course/vrvideojapan/,OMOKAGE TV,99.99,11.39,4.4(91 ratings),ãã¶ã¤ã³,ãã¶ã¤ã³ãã¼ã«,After Effects,774äººã®åè¬çãç»é²,æ¥æ¬èª,VRã¯æ åè¡¨ç¾ã®ã¿ãªãããåç»ãã¸ãã¹å¸å ´ãã¶ã£ãæ¬ãå¢ãã§ä¼¸ã³ã¦ãã¾ããè¦³åãçµå©å¼ãªã©ã¢ã¤ãã£ã¢ä¸ã¤ã§äºæ¥­ãèããã®ãVRåç»æ´»ç¨ã§ããæ¬ã³ã¼ã¹360Â°åç»ç´ æãç¨ããVRåç»ç·¨éã®å¥éã³ã¼ã¹ã§ãã,1/2018,12/31/19
Premiere Pro/AfterEffects cc 新機能エッセンシャルグラフィックスの活用方法,www.udemy.com/course/premiere_pro_cc_japan/,OMOKAGE TV,24.99,11.39,4.5(65 ratings), åç,ãããªãã¶ã¤ã³,After Effects,482äººã®åè¬çãç»é²,æ¥æ¬èª,ä¸ã¤ã®åç»ãä¸ç·ã«ä½æãã¾ããå¶ä½å·¥ç¨ã§ãããã¾ã§å¬éããªãã£ãç·¨éæã®ç´¹ä»ãã¹ãã¼ãã¢ããã®ã³ãããä¼ãããã¦é ãã¾ããã¾ãAfterEffectsã§ã®ã¨ãã»ã³ã·ã£ã«ã°ã©ãã£ãã¯ã¹æ´»ç¨ãåããã¦åé²ãã¾ããã,9/2017,12/31/19
