Course,URL,instructor,Price (full),Price (discount),Rank,Category 1,Category 2,Category 3,Enrollment,Language,Description,Last Update,Date Scraped
CCNA R&S (CCNAX) 200-125 Deep Dive:,www.udemy.com/course/ccnav3-routing-and-switching-200-125-ccnax-with-baldev/,Baldev Singh,99.99,11.39,4.6(164 ratings),IT & Software,IT Certification,Cisco CCNA,729,English,Learn from CCIE Experts. Course includes CCNA R&S Labs,3/2017,12/30/19
Cisco CCNA ICND2 200-105 Practice Tests/Exams,www.udemy.com/course/ciscoicnd2/,Matthew Fraser,19.99,11.39,4.1(106 ratings),IT & Software,IT Certification,Cisco CCNA,"1,449",English,Test your Cisco CCNA ICND2 200-105 knowledge on all of the official exam topics! Get prepared to earn your CCNA TODAY!,3/2019,12/30/19
Cisco CCNA Routing and Switching - CCNA 200-125 Exam Dumps,www.udemy.com/course/cisco-ccna-routing-and-switching/,ITNuggets Institute,19.99,11.39,4.0(9 ratings),IT & Software,IT Certification,Cisco CCNA,73,English,"Sharpen your cisco R & S skills , Get skills to crack interview, Every ccna key points covered , CCNA dumps",10/2018,12/30/19
Cisco CCNA Labs with Packet Tracer,www.udemy.com/course/cisco-ccna-labs-with-packet-tracer/,Matt Carey,99.99,11.39,3.9(25 ratings),IT & Software,IT Certification,Cisco CCNA,206,English,Learn how to configure Cisco devices with Cisco Packet Tracer and prepare for the CCNA exam. *Current for CCNA in 2018,7/2019,12/30/19
Cisco (200-125): CCNA Routing & Switching Practice Test,www.udemy.com/course/cisco-200-125-ccna-routing-switching-practice-test/,"Ashish • 20,000+ Students Worldwide",19.99,11.39,4.3(17 ratings),IT & Software,IT Certification,Cisco CCNA,165,English,Test your self before appearing for exam!,6/2018,12/30/19
Cisco Certified Network Associate Exam CCNA 200-125 Test,www.udemy.com/course/cisco-ccna-200-125-test/,"Ucertified 56,000+ Students 95 Courses",199.99,11.39,3.6(4 ratings),IT & Software,IT Certification,Cisco CCNA,"1,885",English,Pass Cisco Certified Network Associate Cisco Exam from your first attempt.,1/2018,12/30/19
Cisco CCNA R/S (200-125) - iOS Administration Labs,www.udemy.com/course/cisco-ccna-rs-200-125-ios-administration-labs/,Keith Gebhardt,74.99,11.39,4.8(55 ratings),IT & Software,IT Certification,Cisco CCNA,501,English,Cisco CCNA iOS Routing and Switching Administration and Protocols,10/2018,12/30/19
CISCO ccna 200-301 practice test (exam questions),www.udemy.com/course/cisco-ccna-200-301practice-test/,NikaJ Janjaria,19.99,11.39,4.5(1 rating),IT & Software,Network & Security,Cisco CCNA,23,English,new practise tests (2019 - 2020),11/2019,12/30/19
CCNA Security 210-260 - IINS v 3.0 - PART 6/6,www.udemy.com/course/ccna-security-210-260-iins-v-30-part-66/,sikandar Shaik,199.99,11.39,4.8(22 ratings),IT & Software,IT Certification,Cisco CCNA,384,English,Intrusion Prevention System - Web Security -Email Security,12/2017,12/30/19
CCNA WIRELESS WIFUND 200-355 EXAM SIMULATION QUESTIONS  1/2,www.udemy.com/course/veyhurdam-ccna-wireless-wifund-200-355-exam-simulation-questions-part1/,Veyhurdam Dikmen,19.99,11.39,4.1(9 ratings),IT & Software,IT Certification,Cisco CCNA,113,English,The Course You Need For CCNA Wireless Exam Simulations,9/2019,12/30/19
CCNA Routing and Switching - 100 % Physical (Real) Lab,www.udemy.com/course/ccna-routing-and-switching-100-physical-real-lab/,Adnan Ibrahim,19.99,11.39,3.8(4 ratings),IT & Software,IT Certification,Cisco CCNA,33,English,Learn from the Expert with Real Practical Examples and Problem Solutions.,7/2019,12/30/19
Cisco CCNA Real World Project - Network Upgrade in 5 Days,www.udemy.com/course/cisco-ccna-real-world-project-network-upgrade-in-5-days/,Marious Kuriata,24.99,11.39,4.5(99 ratings),IT & Software,IT Certification,Cisco CCNA,"1,085",English,Learn how to upgrade a real network in 5 days and boost your skills in preparation for your Cisco certification exam,10/2015,12/30/19
How to build a perfect lab at home and gain some experience,www.udemy.com/course/how-to-build-a-perfect-lab-at-home-and-gain-some-experience-ccna-cisco/,Marious Kuriata,24.99,11.39,4.3(50 ratings),IT & Software,IT Certification,Cisco CCNA,244,English,"Learn how to create a network and lab at home for any Cisco exam. A custom-made rack for CCENT, CCNA, and other exams",10/2017,12/30/19
Todd Lammle's ICND2 200-105 Certification Practice Tests,www.udemy.com/course/todd-lammles-icnd2-200-105-certification-practice-tests/,Todd Lammle,19.99,11.39,4.1(16 ratings),IT & Software,IT Certification,Cisco CCNA,77,English,High-quality Cisco ICND2 course and practice questions by Todd Lammle,5/2019,12/30/19
Routing Configuration & Router Administration for Cisco CCNA,www.udemy.com/course/routing-configuration-router-administration/,Lazaro Diaz,199.99,11.39,4.7(153 ratings),IT & Software,IT Certification,Cisco CCNA,"3,326",English,"This course will cover and prepare you for the Routing portion of Cisco's, CCNA (200-120) certification exam.",10/2018,12/30/19
IP Addressing for Beginners - CCNA Preparation,www.udemy.com/course/ip-addressing-for-beginners-ccna-preparation/,Armin Sarajlic,94.99,11.39,4.7(54 ratings),IT & Software,IT Certification,Network Infrastructure,"1,824",English,Everything a beginner needs to know about IP addresses and basics of Network Communication.,4/2017,12/30/19
"Cisco Switching TSHOOT Labs for CCNA,CCNP, and CCIE Students",www.udemy.com/course/cisco-switching-tshoot-labs-for-ccna-ccnp-and-ccie-students/,Bassam Alkaff,19.99,11.39,4.7(14 ratings),IT & Software,IT Certification,Cisco CCNA,"1,152",English,"Cisco Troubleshooting Labs in Switching for CCNA, CCNP, and CCIE Students",7/2019,12/30/19
CCNA COLLABORATION 210-065 CIVND PRACTICE EXAM QUESTIONS,www.udemy.com/course/veyhurdam-ccna-collaboration-210-065-civnd-practice-exam-questions/,Veyhurdam Dikmen,19.99,11.39,3.4(12 ratings),IT & Software,IT Certification,Cisco CCNA,108,English,The Course You Need For CCNA Collaboration 210-065 CIVND Implementing Cisco Video Network Devices Voice Exam Simulations,6/2019,12/30/19
CCNA Security (210-260) - Practice Exam,www.udemy.com/course/ccna-security-210-260-practice-exam/,"Ashish • 20,000+ Students Worldwide",19.99,11.39,4.1(16 ratings),IT & Software,IT Certification,Cisco CCNA,77,English,Implementing Cisco Network Security (IINS) Practice Test Papers in 6 Sets to make you prepare for the certification,1/2019,12/30/19
Cisco Networking LABS Crash Course for the CCNA,www.udemy.com/course/cisco-networking-crash-course/,Lazaro Diaz,199.99,11.39,4.9(25 ratings),IT & Software,IT Certification,Cisco CCNA,160,English,This course has all the labs you need to practice for a Cisco cert & real world,6/2018,12/30/19
Cisco Networking CCNA IPv6,www.udemy.com/course/networkingstepbystep-ipv6-addressing-and-basic-connectivity/,Sam Fitzgerald,74.99,11.39,4.2(198 ratings),IT & Software,Network & Security,Cisco CCNA,"16,096",English,"Cisco Networking CCNA IPv6 Taught Efficient, Quick, Painless, & Easy To Understand - Unlike The Other Guys",8/2018,12/30/19
CCNA Cloud  Fundamentals CLDFND 210-451 (1/2),www.udemy.com/course/ccna-cloud-fundamentals-cldfnd-210-451-12/,Giga networkers,24.99,11.39,4.4(23 ratings),IT & Software,IT Certification,Cisco CCNA,117,English,Start your Cisco Cloud Journey from here,10/2018,12/30/19
Cisco OSPF - Complete Understanding | Hands-on Training,www.udemy.com/course/ospf-complete-understanding/,Keith Gebhardt,74.99,11.39,4.4(72 ratings),IT & Software,IT Certification,Cisco CCNA,505,English,High-Level-Training for OSPF's Routing Protocol for Cisco CCNA & CCNP studies,8/2017,12/30/19
NEW Cisco CCNA IPv4 Course!,www.udemy.com/course/new-cisco-ccna-ipv4-course/,Lazaro Diaz,199.99,11.39,4.9(115 ratings),IT & Software,IT Certification,Cisco CCNA,498,English,This course is geared to enhance your understanding of the IPv4 protocol which is still used today in the workplace.,4/2017,12/30/19
CCNA IP Subnetting - Simplified,www.udemy.com/course/ccna-ip-subnetting-simplified/,"Kevin Wallace Training, LLC",19.99,11.39,4.8(76 ratings),IT & Software,"IT Certification
 ",Cisco CCNA,"1,217",English,Crush your next certification exam with your new subnetting skills.,3/2018,12/30/19
Cisco CCNA ICND2 (200-105): Practice Exams,www.udemy.com/course/cisco-ccna-icnd2-practice-tests/,Matt Carey,99.99,11.39,3.4(39 ratings),IT & Software,IT Certification,Cisco CCNA,137,English,These CCNA test questions are very close to what you will see on the actual CCNA ICND2 exam. *Current for 2019,9/2018,12/30/19
CCNA WIRELESS WIFUND 200-355 EXAM SIMULATION QUESTIONS  2/2,www.udemy.com/course/veyhurdam-ccna-wireless-wifund-200-355-exam-simulation-questions-part2/,Veyhurdam Dikmen,19.99,11.39,4.5(5 ratings),IT & Software,IT Certification,Cisco CCNA,76,English,The Course You Need For CCNA Wireless Exam Simulations,9/2019,12/30/19
"Setting Up Basic VoIP, POTS, Mobile Phone, and Softphone",www.udemy.com/course/setting-up-basic-voip-pots-mobile-phone-and-softphone/,Antonio Veva,99.99,11.39,3.9(14 ratings),IT & Software,IT Certification,Cisco CCNA,75,English,"Hey, I'm using real Cisco gears here! for SMART students :-) Nothing beats the feeling of using the REAL-CISCO-HARDWARE!",11/2018,12/30/19
CCNA DATA CENTER 200-150 DCICN PRACTICE EXAM QUESTIONS 1/2,www.udemy.com/course/veyhurdam-ccna-data-center-200-150-dcicn-practice-exam-questions-12/,Veyhurdam Dikmen,19.99,11.39,4.3(19 ratings),IT & Software,IT Certification,Cisco CCNA,96,English,The Course You Need For CCNA Data Center 200-150 DCICN Introducing Cisco Data Center Networking Nexus & UCS Exam Sims,12/2018,12/30/19
CCNA 200-125 Accelerated Prep Course (until 02/23/2020),www.udemy.com/course/cisco-ccna-200-125-v30-full-certification-prep-course/,Shaun Hummel,99.99,11.39,0.0(0 ratings),IT & Software,IT Certification,Cisco CCNA,14,English,"Study, Review and Prepare For CCNA 200-125 Exam (Until 02/23/2020)",11/2019,12/30/19
CCNA Routing and Switching - The Easy Certification Guide,www.udemy.com/course/ccna-routing-and-switching-the-easy-certification-guide/,Eduonix Learning Solutions,29.99,11.39,3.6(154 ratings),IT & Software,IT Certification,Cisco CCNA,"4,577",English,The Complete Course for Cisco Switching and Routing 200-120 CCNA Exam,12/2018,12/30/19
Cisco Access Control Lists with NAT / PAT,www.udemy.com/course/cisco-access-control-lists-complete-understanding/,Keith Gebhardt,74.99,11.39,4.7(48 ratings),IT & Software,IT Certification,Cisco CCNA,417,English,Cisco CCNA Objectives - Access Control Lists - Routing & Switching,10/2018,12/30/19
Cisco EIGRP - Complete Understanding | Hands-on Training,www.udemy.com/course/eigrp-complete-understanding/,Keith Gebhardt,74.99,11.39,4.5(52 ratings),IT & Software,IT Certification,Cisco CCNA,525,English,High-Level-Training for Cisco's EIGRP Routing Protocol for CCNA & CCNP studies,8/2017,12/30/19
Cisco CCNA Collaboration 210-060 CICD Practice Exam,www.udemy.com/course/cisco-ccna-collaboration-210-060-cicd-practice-exam/,Karan Singhal,24.99,11.39,0.0(0 ratings),IT & Software,IT Certification,Cisco CCNA,16,English,Pass Cisco 210-060 CICD Exam on the first attempt. 5 Practice Test with 325+ unique Questions and Answers.,7/2019,12/30/19
CCNA Practice Test ICND1(CCENT) and ICND2 (DEC 2019  Update),www.udemy.com/course/ccna-practice-test-icnd1ccent-and-icnd2-dec-2019-update/,Bhavesh Atara,19.99,11.39,3.6(10 ratings),IT & Software,IT Certification,Cisco CCNA,70,English,ICND1(CCENT) and ICND2 Practice Test 2 in 1,12/2019,12/30/19
Cisco 200-355 CCNA Wireless Implementing Cisco Wireless,www.udemy.com/course/cisco-200-355-ccna-wireless-implementing-cisco-wireless/,Rahul Kumar,199.99,11.39,0.0(0 ratings),IT & Software,IT Certification,Cisco CCNA,86,English,Cisco 200-355 CCNA Wireless Implementing Cisco Wireless Network Fundamentals in First Attempt,12/2019,12/30/19
CCNA 200-125 Practice Test (DEC 2019 Update),www.udemy.com/course/cisco-ccna-200-125-practice-test-july-2019-update/,Bhavesh Atara,19.99,11.39,4.0(23 ratings),IT & Software,IT Certification,Cisco CCNA,310,English,Best CCNA Practice Test with Latest update.,12/2019,12/30/19
Cisco Certified Network Associate (CCNA 200-125) Exam Prep,www.udemy.com/course/cisco-certified-network-associate-ccna-200-125-exam-prep/,Certify You,79.99,11.39,3.8(38 ratings),IT & Software,IT Certification,Cisco CCNA,151,English,"Ace the Official ""Cisco CCNA"" Exam: 200-125 in the first attempt. Guaranteed.",12/2019,12/30/19
Cisco Packet Tracer How To Guide,www.udemy.com/course/cisco-packet-tracer-how-to-guide/,IPCisco Gokhan Kosem,24.99,11.39,4.0(260 ratings),IT & Software,IT Certification,Packet Tracer,"5,484",English,Everything About Packet Tracer...! A Course For The Beginners of Packet Tracer and CCNA Labs...,4/2016,12/30/19
Interconnecting Cisco Networking Devices Part 2 (ICND2) v. 3,www.udemy.com/course/interconnecting-cisco-networking-devices-part-2-icnd2/,Integrity Training,199.99,11.39,3.6(6 ratings),IT & Software,IT Certification,Cisco CCNA,58,English,Exam 200-105 Interconnecting Cisco Networking Devices Part 2 version 3.0 CCNA,10/2018,12/30/19
CCNA DATA CENTER 200-150 DCICN PRACTICE EXAM QUESTIONS 2/2,www.udemy.com/course/veyhurdam-ccna-data-center-200-150-dcicn-practice-exam-questions-22/,Veyhurdam Dikmen,19.99,11.39,4.3(7 ratings),IT & Software,IT Certification,Cisco CCNA,47,English,The Course You Need For CCNA Data Center 200-150 DCICN Introducing Cisco Data Center Networking Nexus & UCS Exam Sims,12/2018,12/30/19
CCNA CyberSec Ops - SECFND 210-250 Questions and Answers,www.udemy.com/course/ccna-cybersec-ops-secfnd-210-250-questions-and-answers/,Samuel Kelly Brew,19.99,11.39,4.6(14 ratings),IT & Software,IT Certification,Cisco CCNA,49,English,Practice questions provided as you prepare for the 210-250 SECFND - Understanding Cisco Cybersecurity Fundamentals Exams,10/2018,12/30/19
Cisco CCNA Cyber Ops 210-250 SECFND Practice Exam Questions,www.udemy.com/course/veyhurdam-cisco-ccna-cyber-ops-210-250-secfnd-practice-exam-questions/,Veyhurdam Dikmen,19.99,11.39,4.8(2 ratings),IT & Software,IT Certification,Cisco CCNA,23,English,The Only Course You Need For Cisco CCNA Cyber Ops 210-250 SECFND *** 600 Practice Exam Questions,3/2019,12/30/19
Cisco 210-065:CCNA CIVND Certification,www.udemy.com/course/cisco-210-065ccna-civnd-certification/,Rahul Kumar,199.99,11.39,4.5(1 rating),IT & Software,IT Certification,Cisco CCNA,110,English,Cisco 210-065 CCNA Collaboration Implementing Cisco Video Network Devices (CIVND) Certification in First Attempt,12/2019,12/30/19
Todd Lammle's CCNA R/S 200-125 Certification Practice Tests,www.udemy.com/course/todd-lammles-cisco-ccna-rs-200-125-certification-practice-d/,Todd Lammle,24.99,11.39,3.8(10 ratings),IT & Software,IT Certification,Cisco CCNA,118,English,Sharpen your skills with 2 full practice tests that mimic the real 200-125 CCNA exam,3/2019,12/30/19
Cisco Packet Tracer CCNA Labs Adventure 2,www.udemy.com/course/cisco-packet-tracer-ccna-labs-adventure-2/,IPCisco Gokhan Kosem,69.99,11.39,4.3(14 ratings),IT & Software,IT Certification,Cisco CCNA,"2,348",English,***CCNA Exam is EASY to Pass Anymore..! Cover All Configurations For CCNA Exam and Write Your Adventure...! ***,10/2019,12/30/19
200-125 Cisco Certified Network Associate (CCNA) Exam,www.udemy.com/course/200-125-cisco-certified-network-associate-ccna-exam-t/,INFO IT HUB,154.99,11.39,4.0(16 ratings),IT & Software,IT Certification,Cisco CCNA,"1,776",English,Attend this 200-125 Cisco Certified Network Associate (CCNA) Exam will get a Good Score 80% on Main Exam,12/2019,12/30/19
CCNA Cyber Ops - TCP/IP Protocol Suite (2019),www.udemy.com/course/secfnd-tcpip-protocol-suite/,Md. Shahinoor Mannan,199.99,11.39,4.5(20 ratings),IT & Software,IT Certification,Cisco CCNA,306,English,Learn TCP/IP Protocol Suite to prepare yourself for CCNA Cyber Ops â SECFND #210-250,12/2019,12/30/19
Cisco Networking CCNA OSPF,www.udemy.com/course/networkingstepbystep-ospf/,Sam Fitzgerald,149.99,11.39,4.5(28 ratings),IT & Software,IT Certification,Cisco CCNA,"2,541",English,"Cisco Networking CCNA OSPF Taught Efficient, Quick, Painless, & Easy To Understand - Unlike The Other Guys",8/2018,12/30/19
CCNA-Security (210-260),www.udemy.com/course/ccna-security-210-260/,Ahmad Nadeem,34.99,11.39,3.6(29 ratings),IT & Software,IT Certification,Cisco CCNA,522,English,Cisco Certified Security Associate,1/2016,12/30/19
Cisco 200-150 Introducing Cisco Data Center Networking,www.udemy.com/course/cisco-200-150-certification-in-1st-attempt/,Rahul Kumar,199.99,11.39,5.0(2 ratings),IT & Software,IT Certification,Cisco CCNA,122,English,Cisco 200-150 Introducing Cisco Data Center Networking Certification in 1st Attempt,12/2019,12/30/19
Cisco CCNA Multiple Practice Labs + BGP,www.udemy.com/course/cisco-multiple-practice-lab/,Lazaro Diaz,199.99,11.39,4.2(20 ratings),IT & Software,IT Certification,Cisco CCNA,239,English,This a multiple topics practice lab for Cisco's CCNA certification exam or real world,3/2018,12/30/19
Cisco CCNA Cyber Ops - 210-255 SECOPS - Practice Tests,www.udemy.com/course/cisco-ccna-cyber-ops-210-255-secops-practice-tests/,Matt McClure,119.99,11.39,4.1(19 ratings),IT & Software,IT Certification,Cisco CCNA,107,English,Are you ready for the SECOPS test? These questions will help you find areas you might need to study a little more.,10/2018,12/30/19
CCNA Troubleshooting (TSHOOT) Simulation Labs,www.udemy.com/course/network-troubleshooting-skills-training/,Shaun Hummel,19.99,11.39,4.4(7 ratings),IT & Software,IT Certification,Cisco CCNA,741,English,Learn how to troubleshoot CCNA simulation labs and be prepared for the notoriously difficult CCNA exam.,11/2019,12/30/19
Cisco CCNA Networking Security 200-125 Exam Complete Course,www.udemy.com/course/ccna-bootcamp-from-beginner-to-advance/,Joydip Ghosh,199.99,11.39,3.8(316 ratings),IT & Software,"IT Certification
 ",Cisco CCNA,"18,391",English,Clear Cisco Networking CCNA Security 200-125 Exam with Confidence,5/2017,12/30/19
200-125 Cisco Certified Network Associate (CCNA) Exam,www.udemy.com/course/200-125-cisco-certified-network-associate-ccna-exam-y/,Tech Certify,159.99,11.39,3.7(12 ratings), IT & Software,IT Certification,Cisco CCNA,"1,538",English,Attend this 200-125 Cisco Certified Network Associate (CCNA) Exam will get a Good Score 80% on Main Exam,12/2019,12/30/19
Cisco CCNA Security IINS 210-260 Practice Exam Questions,www.udemy.com/course/cisco-ccna-security-iins-210-260-practice-exam-questions/,Veyhurdam Dikmen,19.99,11.39,0.0(0 ratings),IT & Software,IT Certification,Cisco CCNA,18,English,The Only Course You Need For Cisco CCNA Security IINS 210-260 Practice Exam Questions,3/2019,12/30/19
CCNA CyberSec Ops - SECOPS 210-255 Questions and Answers,www.udemy.com/course/ccna-cybersec-ops-secops-210-255-questions-and-answers/,Samuel Kelly Brew,19.99,11.39,2.1(2 ratings),IT & Software,IT Certification,Cisco CCNA,11,English,Practice questions provided as you prepare for the 210-255 SECOPS - Implementing Cisco Cybersecurity Operations Exams,10/2018,12/30/19
OSPF (IOS xr): Cisco CCNA Networking,www.udemy.com/course/ospf-ios-xr-cisco-training-course/,Sam Fitzgerald,149.99,11.39,5.0(5 ratings),IT & Software,IT Certification,Cisco CCNA,112,English,"CCNA Cisco Network OSPF (IOS xr) Taught Efficient, Quick, Painless, & Easy To Understand - Unlike The Other Guys",8/2018,12/30/19
CCNA Routing & Switching Labs- 2020,www.udemy.com/course/ccna-routing-switching-labs/,"Ashish • 20,000+ Students Worldwide",19.99,11.39,4.0(10 ratings),IT & Software,IT Certification,Cisco CCNA,140,English,Get solid foundation on Cisco Router and Switches to prepare for CCNA Certification,10/2019,12/30/19
CCNA Routing & Switching 200-125 Practice Exam Questions 1/2,www.udemy.com/course/veyhurdam-ccna-routing-switching-200-125-practice-exam-questions-12/,Veyhurdam Dikmen,19.99,11.39,5.0(1 rating),IT & Software,IT Certification,Cisco CCNA,21,English,The Only Course You Need For CCNA Routing and Switching 200-125 Exam Part 1 Exam Simulation Questions,12/2018,12/30/19
Learn Subnetting in Easy Steps to Pass the CCNA Exam,www.udemy.com/course/learn-subnetting-in-easy-steps-for-the-cisco-ccna-exam-2019/,Andre I.,99.99,11.39,4.6(13 ratings),IT & Software,IT Certification,Cisco CCNA,"2,121",English,Going for the CCNA Exam? Learn how to solve any Subnetting question in less than 30 seconds and get certified easily!,11/2019,12/30/19
Cisco CCNA to CCNP Transition,www.udemy.com/course/cisco-ccna-to-ccnp-transition/,Bassam Alkaff,39.99,11.39,4.4(6 ratings),IT & Software,IT Certification,Cisco CCNA,115,English,"Clarify confusing subjects in CCNA, and be ready to start your CCNP Studies with confidence.",7/2019,12/30/19
IT Networking Fundamentals for CISCO CCNA Exam,www.udemy.com/course/learn-it-networking-fundamental-from-scratch/,Technical Training Provider,49.99,11.39,3.9(11 ratings),IT & Software,IT Certification,Cisco CCNA,573,English,Practical course on IT Networking Fundamentals for CISCO CCNA Exam,2/2018,12/30/19
200-125 Cisco Certified Network Associate (CCNA) Exam,www.udemy.com/course/200-125-cisco-certified-network-associate-ccna-exam-k/,Tech Certify,154.99,11.39,3.8(24 ratings),IT & Software,IT Certification,Cisco CCNA,"3,058",English,Attend this 200-125 Cisco Certified Network Associate (CCNA) Exam will get a Good Score 80% on Main Exam,12/2019,12/30/19
Cisco 100-101 (ICND1) Exam Training Made Easy,www.udemy.com/course/cisco-100-101-icnd1-exam-training/,Infinite Skills,49.99,11.39,3.9(114 ratings),IT & Software,IT Certification,Cisco CCNA,"1,564",English,Cisco ( ICND1) Online Training. Part 1 Towards Passing The Cisco CCNA Routing and Switching Certification,1/2017,12/30/19
Cisco 200-125 CCNA Certification Exam : Practice Tests (NEW),www.udemy.com/course/cisco-200-125-ccna-certification-exam-practice-tests-new/,Chandrika patel,24.99,11.39,0.0(0 ratings),IT & Software, IT Certification,Cisco CCNA,58,English,Pass your CCNA Certification Exam in first attempt with this latest practice tests (New Updated latest questions ),12/2019,12/30/19
Cisco Packet Tracer CCNA Labs Adventure 1,www.udemy.com/course/cisco-packet-tracer-ccna-labs-adventure-1/,IPCisco Gokhan Kosem,69.99,11.39,3.9(125 ratings),IT & Software,IT Certification,Cisco CCNA,"4,171",English,***CCNA Exam is EASY to Pass Anymore..! Cover All Configurations For CCNA Exam and Write Your Adventure...! ***,10/2019,12/30/19
RIP Routing Protocol & Sub-Commands for Cisco CCNA,www.udemy.com/course/rip-protocol/,Lazaro Diaz,199.99,11.39,5.0(1 rating),IT & Software,IT Certification,Cisco CCNA,42,English,Learn RIP for real world Networking,4/2018,12/30/19
Cisco Networking CCNA FHRP,www.udemy.com/course/networkingstepbystep-first-hop-redundancy-protocols/,Sam Fitzgerald,149.99,11.39,5.0(19 ratings),IT & Software,IT Certification,Cisco CCNA,"5,708",English,"Cisco Networking CCNA FHRP Taught Efficient, Quick, Painless, & Easy To Understand - Unlike The Other Guys",8/2018,12/30/19
EIGRP Comprehensive Labs Course,www.udemy.com/course/eigrp-comprehensive-labs-course/,Lazaro Diaz,199.99,11.39,4.6(7 ratings),IT & Software,IT Certification,Cisco CCNA,41,English,This course will help you understand the intricacies of EIGRP,8/2018,12/30/19
CISCO CCNA 200-125 Practice Question,www.udemy.com/course/cisco-ccna-200-125-practice-question/,Hello Certificate,19.99,11.39,4.0(1 rating),IT & Software,IT Certification,Cisco CCNA,3,English,Want to pass your CISCO CCNA 200-125 Exam ? Practice with our 325 High Quality Question.,8/2019,12/30/19
Networking Protocols (CCENT/CCNA and CompTIA Network+ prep),www.udemy.com/course/networking-protocols-ccent-ccna-comptianetworkplus-prepcourse/,Edward James,124.99,11.39,4.0(14 ratings),IT & Software,IT Certification,Cisco CCNA,178,English,"Don't just know them but deep-dive into networking protocols such ARP, IP, ICMP and TCP . Practice using simple labs !",9/2017,12/30/19
Cisco CCNA Cyber Ops - ‎210-250 SECFND - Practice Tests,www.udemy.com/course/cisco-ccna-cyber-ops-210-250-secfnd-practice-tests/,Matt McClure,119.99,11.39,4.0(13 ratings),IT & Software,IT Certification,Cisco CCNA,69,English,Are you ready for the SECFND test? These questions will help you find areas you might need to study a little more.,10/2018,12/30/19
Cisco ICND2 (200-105)  Exam Practice Tests (New Updated),www.udemy.com/course/cisco-icnd2-200-105-exam-practice-tests-new-updated/,Mehul Patel,29.99,11.39,0.0(0 ratings),IT & Software,IT Certification,Cisco CCNA,53,English,New Updated Best 200-105 Practice Exams to test your knowledge and passing your real Cisco exam in first attempt,12/2019,12/30/19
CISCO CCNA 200-125 Practice Exam,www.udemy.com/course/cisco-ccna-200-125-practice-exam-c/,Certificate Field,19.99,11.39,2.0(1 rating),IT & Software,IT Certification,Cisco CCNA,3,English,This CISCO CCNA 200-125 Practice Test hasÂ  240 High quality questions which will help to prepare for your CCNA exam,8/2019,12/30/19
Cisco | Data Encapsulation 101,www.udemy.com/course/data-encapsulation-101/,Keith Gebhardt,19.99,11.39,4.7(274 ratings),IT & Software,IT Certification,Cisco CCNA,"7,288",English,Cisco CCNA exam objectives - Learn how data is encapsulated and communicates across networks using labs and wireshark!,8/2017,12/30/19
210-451: Understanding Cisco Cloud Fundamentals (CLDFND),www.udemy.com/course/210-451-understanding-cisco-cloud-fundamentals-cldfnd/,Karan Singhal,24.99,11.39,0.0(0 ratings),IT & Software,IT Certification,Cisco CCNA,5,English,Pass Cisco 210-451 Exam on the first attempt. 2 Practice Test with 84+ unique Questions and Answers.,7/2019,12/30/19
"Cisco: Switching, VTP, Inter Vlan and Etherchannel",www.udemy.com/course/cisco-switching-vtp-inter-vlan-and-etherchannel/,Rafael Palacios Lopez,19.99,11.39,0.0(0 ratings),IT & Software,IT Certification,Cisco CCNA,22,English,configuration guide for integrating technologies and standards in a corporate network and administrate corpora networks,6/2015,12/30/19
