Course,URL,instructor,Price (full),Price (discount),Rank,Category 1,Category 2,Category 3,Enrollment,Language,Description,Last Update,Date Scraped
The Complete Networking Fundamentals Course. Your CCNA start,www.udemy.com/course/complete-networking-fundamentals-course-ccna-start/,David Bombal,19.99,11.39,"4.5(15,470 ratings)",IT & Software,IT Certification,Cisco CCNA,"66,179",English,Learn about networking and start your journey to CCNA,12/2019,12/30/19
Cisco CCNA 200-125 and 200-301 – The Complete Guide,www.udemy.com/course/ccna-complete/,Neil Anderson,199.99,12.59,"4.7(12,450 ratings)",IT & Software,IT Certification,Cisco CCNA,"36,257", English,The top rated CCNA course online with all your questions answered. Full labs and 200-301 exam updates included.,12/2019,12/30/19
CCNA 2019 200-125 Video Boot Camp With Chris Bryant,www.udemy.com/course/ccna-on-demand-video-boot-camp/,Chris Bryant,19.99,11.39,"4.6(23,152 ratings)",IT & Software,IT Certification,Cisco CCNA,"99,010",English,"Join The 90,000+ Students Who Are Learning Real-World Skills AND Earning Their CCNA!",8/2018,12/30/19
Cisco CCNA Packet Tracer Ultimate labs: CCNA Exam prep labs,www.udemy.com/course/cisco-ccna-packet-tracer-ultimate-labs-ccna-exam-prep-labs/,David Bombal,19.99,11.39,"4.7(3,341 ratings)",IT & Software,IT Certification,Packet Tracer,"21,302",English,Are you ready for the CCNA exam? You sure? Check your knowledge with our CCNA Exam Prep Labs. Make sure you know topics,11/2019,12/30/19
Cisco ICND2 200-105 - CCNA Bootcamp,www.udemy.com/course/cisco-icnd2/,Neil Anderson,99.99,11.39,4.8(809 ratings),IT & Software,IT Certification,Cisco CCNA,"3,837",English,"The most comprehensive ICND2 course online with complete tutorials, flashcards and hands-on labs",12/2019,12/30/19
Cisco CCNA / ICND2 (200-105) Complete Course: Sims and GNS3,www.udemy.com/course/cisco-ccna-icnd2-200-105-complete-course-sims-and-gns3/,David Bombal,19.99,11.39,"4.7(1,305 ratings)",IT & Software,IT Certification,Cisco CCNA,"13,682",English,The complete course to help you prepare and pass Cisco's newest CCNA certification / ICND2 (200-105 exam) in 2019.,11/2019,12/30/19
CCNA Security 2019 210-260 Video Boot Camp With Chris Bryant,www.udemy.com/course/ccnasecurityvideobootcamp/,Chris Bryant,19.99,11.39,"4.4(3,083 ratings)",IT & Software,IT Certification,Cisco CCNA,"28,397",English,Earn Your CCNA Security 210-260 Certification AND Prepare For Real-World Networking Success!,8/2018,12/30/19
Cisco CCNA 200-301 (v1.0) Full Certification Prep Course,www.udemy.com/course/cisco-ccna-200-301-certification-guide/,Shaun Hummel,99.99,11.39,4.3(52 ratings),IT & Software,IT Certification,Cisco CCNA,592,English,"Study, prepare, and upgrade your skills with the new Cisco CCNA 200-301 certification exam.",12/2019,12/30/19
Cisco CCNA R/S (200-120 & 200-125): The Complete Course,www.udemy.com/course/the-complete-ccna-200-120-course/,Lazaro Diaz,199.99,11.39,"4.4(4,846 ratings)",IT & Software,IT Certification,Cisco CCNA,"42,416",English,This complete Cisco CCNA course will cover everything you need to prepare for the 200-120 & the NEW CCNA 200-125,2/2019,12/30/19
The New CCNA Exam v1.0 (200-301) By Hexa CCIE Khawar Butt,www.udemy.com/course/the-new-ccna-exam-v10-200-301-by-hexa-ccie-khawar-butt/,Khawar Butt,99.99,11.39,4.5(71 ratings),IT & Software,IT Certification,Cisco CCNA,567,English,"Covers 2019 newly added technologies like DMVPN, Wireless Technologies, IPSec , IPv6 by Hexa CCIE Mr Khawar Butt",9/2019,12/30/19
Cisco NEW CCNA R/S (200-125): The Complete Course,www.udemy.com/course/cisco-ccna-200-125-the-complete-course/,Lazaro Diaz,199.99,11.39,"4.5(3,811 ratings)",IT & Software,IT Certification,Cisco CCNA,"18,426",English,This NEW CISCO course is all you need to prepare & pass Cisco's new CCNA R/S 200-125 certification exam,2/2019,12/30/19
The Complete CCNA & CCNP Labs Course 2020- Basic to Advanced,www.udemy.com/course/ccnp-routing-protocols-labs/,"Ashish • 20,000+ Students Worldwide",129.99,11.39,4.4(381 ratings),IT & Software,IT Certification,Cisco CCNA,"4,570",English,"Complete guide for CCNA & CCNP students to Understand,Configure LAN Switch, EIGRP , OSPF, BGP, IPv6 & Cisco ASA Firewall",11/2019,12/30/19
New CCNAx 200-125 Routing and Switching,www.udemy.com/course/newccnax-200-120/,sikandar Shaik,99.99,11.39,"4.5(6,424 ratings)",IT & Software,IT Certification,Cisco CCNA,"93,212",English,Includes everything you will need to fully prepare for your new CCNA R/S certification,8/2016,12/30/19
Cisco CCNA 200-125 : Full Course For Networking Basics,www.udemy.com/course/new-ccna-full-course/,Networkel Inc.,119.99,11.39,"4.4(1,065 ratings)",IT & Software,IT Certification,Cisco CCNA,"10,284",English,*Great hands-on configuration labs* *Learn networking basics* *Covers ALL Cisco CCNA Topics* *Pass The Exam Easily !*,11/2019,12/30/19
Cisco CCNA 200-125: The Complete Course,www.udemy.com/course/cisco-ccna-200-120-course/,Matt Carey,189.99,12.59,4.4(563 ratings),IT & Software,IT Certification,Cisco CCNA,"2,380",English,"Study material for the new 200-301 CCNAÂ exam will be available here on February 24, 2020. *Current for the CCNA in 2019",7/2019,12/30/19
Cisco CCNA Practice Exams - 6 Exams (ICND1/2/CCNA),www.udemy.com/course/cisco-ccna-practice-exams/,Paul Browning,24.99,11.39,4.3(123 ratings),IT & Software,IT Certification,Cisco CCNA,"1,259",English,Learn to master important exam topics before you take the test for real. Save time and exam fees.,10/2019,12/30/19
Cisco CCNA Packet Tracer Ultimate labs: ICND2 Exam prep labs,www.udemy.com/course/cisco-ccna-packet-tracer-ultimate-labs-icnd2-exam-prep-labs/,David Bombal,19.99,11.39,4.8(248 ratings),IT & Software,IT Certification,Cisco CCNA,"1,435",English,Are you ready for the CCNA exam? You sure? Check your knowledge with our CCNA Exam Prep Labs. Make sure you know topics,7/2019,12/30/19
Cisco CCNA Cyber Ops: The Complete Course,www.udemy.com/course/cisco-ccna-cyber-ops-the-complete-course/,Matt Carey,189.99,11.39,4.1(323 ratings),IT & Software,IT Certification,Cisco CCNA,"1,660",English,Learn Cyber Security and prepare for your Cisco CCNA CyberOps certification exam. Kali Linux tutorial included! *2019,12/2019,12/30/19
CCNA Security and CCNP Security Deep Dive Part::1,www.udemy.com/course/ccnp-security-300-206_senss-with-b-s-deshwal-ccie-37094/,Baldev Singh,199.99,11.99,3.9(930 ratings),IT & Software,IT Certification,Cisco CCNA,"10,747",English,CCNA Security and CCNP Security 2016 With Baldev,3/2017,12/30/19
Cisco CCNA Security 210-260 (IINS),www.udemy.com/course/cisco-ccna-security-course/,Matt Carey,189.99,11.39,4.4(377 ratings),IT & Software,IT Certification,Cisco CCNA,"2,014",English,Learn all of the CCNA Security exam topics and pass the Cisco CCNA Security exam. *Current for CCNA Security in 2019,7/2019,12/30/19
Cisco CCNA in 60 Days,www.udemy.com/course/ccna-in-60-days/,Paul Browning,199.99,11.39,4.1(289 ratings),IT & Software,IT Certification,Cisco CCNA,"1,376",English,"Your daily study system including labs, theory, exams, crams and much more.",2/2019,12/30/19
Cisco CCNA Wireless (200-355): The Complete Course,www.udemy.com/course/cisco-ccna-wireless-200-355-the-complete-course/,Lazaro Diaz,199.99,11.39,3.8(390 ratings),IT & Software,IT Certification,Cisco CCNA,"1,714",English,This course is the only tutorial you'll need to be fully prepared for Cisco's NEW CCNA Wireless certification exam!,10/2017,12/30/19
Chris Bryant's CCNA Practice Exam Pack #1   (ICND1 Topics),www.udemy.com/course/chris-bryant-ccna-practice-exam-1/,Chris Bryant,19.99,11.39,4.2(357 ratings),IT & Software,IT Certification,Cisco CCNA,"3,430",English,Sharpen Your Skills With My CCNA Practice Exam Pack And Be Ready For TOTAL Success On Exam Day!,7/2018,12/30/19
Chris Bryant's CCNA Practice Exam Pack #2   (ICND2 Topics),www.udemy.com/course/chris-bryants-ccna-practice-exam-set-2/,Chris Bryant,19.99,11.99,4.2(125 ratings),IT & Software,IT Certification,Cisco CCNA,"2,297",English,Sharpen Your Skills For TOTAL Success On Exam Day With My Practice Exam Pack!,11/2018,12/30/19
CCNA Cyber Ops - SECOPS # 210-255 - Exam Simulations (2019),www.udemy.com/course/ccna-cyber-ops-secops-210-255-exam-questions-answers/,Md. Shahinoor Mannan,199.99,11.39,4.2(214 ratings),IT & Software,IT Certification,Cisco CCNA,"1,846",English,Prepare Yourself With Cisco's CCNA Cyber Ops - SECOPS # 210-255 Question & Answer Based Real Test Simulations (2019),12/2019,12/30/19
Cisco CCNA Collaboration 210-060 CICD - Voice Lab Course,www.udemy.com/course/cisco-ccna-collaboration-210-060-cicd-voice-lab-course/,Veyhurdam Dikmen,19.99,11.39,4.4(64 ratings),IT & Software,IT Certification,Cisco CCNA,438,English,Cisco CCNA Collaboration 210-060 Implementing Cisco Collaboration Devices Lab Course For CUCM Unity Presence,4/2019,12/30/19
CCNA Cyber Ops - SECFND # 210-250 - Exam Simulations (2019),www.udemy.com/course/ccna-cyber-ops-secfnd-210-250-exam-questions-answers/,Md. Shahinoor Mannan,199.99,16.19,4.3(366 ratings),IT & Software,IT Certification,Cisco CCNA,"2,030",English,Prepare Yourself With Cisco's CCNA Cyber Ops - SECFND # 210-250 Question & Answer Based Real Test Simulations (2019),12/2019,12/30/19
New! Cisco CCNA Wireless 200-355 WIFUND- The Complete Course,www.udemy.com/course/veyhurdam-ccna-wireless/,Veyhurdam Dikmen,19.99,11.39,3.8(97 ratings),IT & Software,IT Certification,Cisco CCNA,516,English,CCNA Wireless 200-355 Wifund Course Your Ultimate Guide To Become A Better Wireless Engineer WLC Site Survey Included,9/2019,12/30/19
Cisco CCNA Configuration Labs : Hands On Experience Guide,www.udemy.com/course/packet-tracer-labs/,Networkel Inc.,94.99,11.39,4.8(289 ratings),IT & Software,IT Certification,Packet Tracer,"7,871",English,*GET READY TO Cisco CCNA EXAM ! *BE A CONFIGURATION HERO ! * GREAT PACKET TRACER LABS *GET NETWORKING PRACTICE,11/2019,12/30/19
CCNA Security and CCNP Security Deep Dive Part::2,www.udemy.com/course/ccnp-security-300-209_simos-with-b-s-deshwal-ccie-37094/,Baldev Singh,99.99,11.39,4.4(58 ratings),IT & Software,IT Certification,Cisco CCNA,"2,338",English,CCNA Security and CCNP Security 2016 With Baldev,3/2017,12/30/19
Cisco Meraki Wireless Course with Labs,www.udemy.com/course/veyhurdam-cisco-meraki-wireless-course-with-labs/,Veyhurdam Dikmen,19.99,11.39,4.1(37 ratings),IT & Software,IT Certification,Cisco CCNA,229,English,Cisco Meraki Wireless Training With Step by Step Labs and Detailed Theory,7/2019,12/30/19
"CCNA Cyber Ops Tools: Sec Onion, Wireshark, and Kali Linux",www.udemy.com/course/ccna-cyber-ops-tools-sec-onion-wireshark-and-kali-linux/,Bassam Alkaff,59.99,11.39,4.7(18 ratings),IT & Software,IT Certification,Cisco CCNA,161,English,"Learn how to use Security Onion, Wireshark, Kali Linux, GNS3, Metasploit, Nmap in production and to build home labs",12/2019,12/30/19
Cisco CCNA 200-125 Video Training (2019) Plus Bonus!,www.udemy.com/course/cisco-ccna-video-training/,Kevin Rodgers,99.99,11.39,4.5(125 ratings),IT & Software,IT Certification,Cisco CCNA,475,English,Covers the full 200-125 CCNA Blueprint +,4/2019,12/30/19
CCNA 200-125 Practice Exam Tests Latest Dumps 2019,www.udemy.com/course/ccna-200-125-practice-exam-tests-latest-dumps-2019/,Mehul Patel,29.99,11.39,4.1(26 ratings),IT & Software,IT Certification,Cisco CCNA,248,English,New Updated Best CCNA 200-125 Practice Exams to test your knowledge and passing your real CCNA exam in first attempt,12/2019,12/30/19
"CCNA Security Real World Labs - Cisco ASA, Network Security",www.udemy.com/course/ccna-security/,Marious Kuriata,24.99,11.39,4.1(290 ratings),IT & Software,IT Certification,Cisco CCNA,"3,269",English,"Identify, lock down, and secure vulnerabilities in a small to medium enterprise branch network - real world training",2/2018,12/30/19
Pass the Cisco CCNA Voice 640-461 exam (ICOMM) Downloadable,www.udemy.com/course/pass-the-cisco-ccna-voice-icomm-exam/,David Bombal,19.99,11.39,4.4(475 ratings),IT & Software,IT Certification,Cisco CCNA,"3,503",English,"Detailed, practical and in-depth explanations and demonstrations of Cisco UC products. David has taught UC for >10 years",11/2014,12/30/19
Cisco CCNA ICND2 200-105,www.udemy.com/course/ccna-icnd2-200-101/,Matt Carey,99.99,11.39,4.4(375 ratings),IT & Software,IT Certification,Cisco CCNA,"1,826",English,Learn how to pass the Cisco CCNA ICND2 exam with in-depth CCNA study material. *Current for CCNA in 2019,1/2019,12/30/19
CCNA Routing and Switching 200-125 Practice Tests Dumps 2019,www.udemy.com/course/ccna-routing-and-switching-200-125-practice-tests-dumps-2019/,SKILLCERTPRO : Get Certified,19.99,11.39,4.1(54 ratings),IT & Software,IT Certification,Cisco CCNA,308,English,(200-125) Cisco Certified Network Associate (CCNA) - 470+ Unique Practice Exam Questions for Exam Preparation,12/2019,12/30/19
CCNA 200-125 Practice Tests (Training Completion),www.udemy.com/course/ccna-routing-and-switching-200-125-practice-tests/,Shaun Hummel,29.99,11.39,3.5(104 ratings),IT & Software,IT Certification,Cisco CCNA,491,English,Complete Your CCNA 200-125 Training: Exam Practice Questions + SIM Labs (ICND2 Included),11/2019,12/30/19
CCNA R&S 2019 (200-125)  By Hexa CCIE Khawar Butt,www.udemy.com/course/ccna-routing-and-switching-200-125-z/,Khawar Butt,19.99,11.39,4.6(185 ratings),IT & Software,IT Certification,Cisco CCNA,842,English,"Covers 2019 newly added technologies like DMVPN,QOS,IPV6 by Hexa CCIE Mr Khawar Butt",4/2019,12/30/19
CCNA Security - 7 Days till your Cisco 210-260 exam - Labs,www.udemy.com/course/ccna-security-labs/,Marious Kuriata,34.99,11.39,4.5(142 ratings),IT & Software,IT Certification,Cisco CCNA,"1,429",English,CCNA Security Labs that you can practice at home with a full list of commands. A review before the CCNA Security exam.,11/2017,12/30/19
Cisco CCNA Collaboration 210-065 CIVND - Video Lab Course,www.udemy.com/course/veyhurdam-cisco-ccna-collaboration-210-065-civnd-video-lab-course/,Veyhurdam Dikmen,19.99,11.39,4.2(25 ratings),IT & Software,IT Certification,Cisco CCNA,268,English,"Cisco CCNA Collaboration 210-065 Implementing Video Network Devices Lab Course For Telepresence, DMPs and Video Endpoint",5/2019,12/30/19
Cisco Networking Fundamentals & iOS Administation Labs,www.udemy.com/course/cisco-networking-introduction/,Keith Gebhardt,49.99,11.39,4.4(503 ratings),IT & Software,IT Certification,Cisco CCNA,"2,383",English,Complete Cisco IT Networking Fundamentals course aimed to prepare you for your Cisco CCNA studies,4/2019,12/30/19
CCNA 2016 - CCNA 200-125 exam - a complete guide - Cisco,www.udemy.com/course/ccna-cisco-200-125-exam-complete-guide/,Marious Kuriata,34.99,11.39,4.2(747 ratings),IT & Software,IT Certification,Cisco CCNA,"4,139",English,"Includes unique videos presenting REAL Cisco routers, switches, firewalls, access points, cables, connectors and labs",11/2019,12/30/19
Cisco CCNA Wireless 200-355 WIFUND Lab Course,www.udemy.com/course/veyhurdam-cisco-ccna-wireless-200-355-wifund-lab-course/,Veyhurdam Dikmen,19.99,11.39,4.3(24 ratings),IT & Software,IT Certification,Cisco CCNA,228,English,"CCNA Wireless 200-355 Wifund Lab Course Your Ultimate Guide To Become A Better Wireless Engineer, with Cisco WLC",6/2019,12/30/19
Cisco CCNA GNS3 Ultimate Labs: CCNA Exam Prep Labs to pass,www.udemy.com/course/cisco-ccna-gns3-ultimate-labs-ccna-exam-prep-labs-pass-your-exam/,David Bombal,19.99,11.39,4.6(95 ratings),IT & Software,IT Certification,Cisco CCNA,764,English,Are you ready for the CCNA exam? You sure? Check your knowledge with our CCNA Exam Prep Labs. Make sure you know topics,2/2018,12/30/19
Latest CCNA (200-125) 600 Dump Questions,www.udemy.com/course/ccna-routing-and-switching-dump-questions-600-questions/,Sinan Al-Ani,19.99,11.39,2.9(6 ratings),IT & Software,Network & Security,Cisco CCNA,169,English,Cisco CCNA Routing and Switching (200-125) Latest Dumps (More than 600 Questions with their Answers and Explanation),9/2019,12/30/19
1001 Cisco CCNA Exam Questions,www.udemy.com/course/1001-cisco-ccna-exam-questions/,How To Network,29.99,11.39,4.3(37 ratings),IT & Software,IT Certification,Cisco CCNA,368,English,Exam Style Prep Questions for the CCNA/ICND1/ICND2 Exams,12/2019,12/30/19
CCNA Labs - 7 Days till your Cisco 200-125 and 200-105 Exam,www.udemy.com/course/ccna-icnd2-cisco-labs/,Marious Kuriata,34.99,11.39,4.2(154 ratings),IT & Software,IT Certification,Cisco CCNA,"1,278",English,CCNA / ICND2 Labs that you can practice at home with a full list of commands. A review before the exam.,11/2017,12/30/19
CCNA Boost,www.udemy.com/course/ccna-boost/,Boss CBT,29.99,11.39,4.6(172 ratings),IT & Software,IT Certification,Cisco CCNA,"1,080",English,Boost your CCNA certification preparation with our expert networking instruction!,5/2015,12/30/19
The Ultimate Cisco CCNA Packet Tracer Project,www.udemy.com/course/the-ultimate-cisco-ccna-packet-tracer-project/,Bassam Alkaff,29.99,11.39,4.6(59 ratings),IT & Software,IT Certification,Cisco CCNA,535,English,"Master your CCNA studies, knowledge, and practical skills using this full packet tracer project course.",7/2019,12/30/19
Cisco CCNA,www.udemy.com/course/cisco-ccna-kiel/,Kiel Martin,19.99,11.39,4.0(367 ratings),IT & Software,IT Certification,Cisco CCNA,"3,517",English,CCNA Routing & Switching course,3/2017,12/30/19
CCNA Cyber Ops 210-250 (SECFND) + Kali Linux Hacking Tools,www.udemy.com/course/ccna-cyber-ops-secfnd/,Matt Carey,99.99,11.39,4.3(316 ratings),IT & Software,IT Certification,Cisco CCNA,"1,831",English,Learn Cyber Security and prepare for your Cisco CCNA CyberOps certification exam. Kali Linux tutorial included! *2019,12/2019,12/30/19
CCENT and CCNA Real World Labs - Cisco Training,www.udemy.com/course/ccnalabs/,Marious Kuriata,19.99,11.39,4.4(138 ratings),IT & Software,IT Certification,CCENT,"2,871",English,"When things go wrong... I keep recording! Learn how to troubleshoot routing, switching, wireless, security and much more",2/2018,12/30/19
iPexpert's CCNA DCICN Data Center Course,www.udemy.com/course/ipexperts-ccna-dcicn-data-center-course/,iPexpert Inc,49.99,11.39,3.6(188 ratings),IT & Software,IT Certification,"Cisco CCNA
 ","1,163",English,Get a firm understanding of the topics in the CCNA DCICN Data Center certification and basics of Cisco's DC track.,10/2015,12/30/19
Cisco - TCP/IP & OSI Network Architecture Models,www.udemy.com/course/cisco-tcpip-osi-network-architecture-models/,Keith Gebhardt,19.99,11.39,4.4(522 ratings),IT & Software,IT Certification,Cisco CCNA,"3,893",English,Learn Cisco Objectives - TCP/IP & OSI Models and understand protocols and the communication process,8/2017,12/30/19
CCNA Cyber Ops 210-255 (SECOPS),www.udemy.com/course/ccna-cyber-ops-secops/,Matt Carey,99.99,11.39,4.0(89 ratings),IT & Software,IT Certification,Cisco CCNA,623,English,Learn Cyber Security and prepare for your Cisco CCNA CyberOps certification exam. *Current for CCNA Cyber Ops in 2019,8/2018,12/30/19
CCNA Routing & Switching 200-125,www.udemy.com/course/ccna-routing-switching-200-125/,GreyCampus Inc.,0.0,199.99,4.0(83 ratings),IT & Software,IT Certification,Cisco CCNA,"1,398",English,Cisco Certified Network Associate - Routing & Switching certification,12/2019,12/30/19
CCNA Security 210-260 - IINS v 3.0 - PART 1/6,www.udemy.com/course/ccna-security-210-260-iins-v-30/,sikandar Shaik,199.99,11.39,4.3(137 ratings),IT & Software,IT Certification,Cisco CCNA,553,English,"Network Security - Common Security Attacks/Mitigation's - Hacking - Malicious Codes (Virus, Worms) - Threat Defense",12/2017,12/30/19
CCNA 200-125 And CCENT Practice Pack:  Subnetting Success!,www.udemy.com/course/ccna-200-125-and-ccent-practice-pack-subnetting-success/,Chris Bryant,34.99,11.39,5.0(81 ratings),IT & Software,IT Certification,Cisco CCNA,"1,292",English,Five Separate Subnetting Practice Tests And Fully Illustrated Answers To Help You NAIL The CCNA Exam!,11/2018,12/30/19
Cisco Packet Tracer All Labs : Cisco CCNA,www.udemy.com/course/cisco-packet-tracer-all-labs-cisco-ccna/,IPCisco Gokhan Kosem,199.99,11.39,4.3(25 ratings),IT & Software,Network & Security,Cisco CCNA,"3,931",English,** Learn CCNA Labs With eXcellenT Cisco Router and Switch Configurations..! **,11/2019,12/30/19
Layer 2 Switching & VLAN's for Cisco CCNA,www.udemy.com/course/layer-2-switching-vlans/,Lazaro Diaz,199.99,11.39,3.8(207 ratings),IT & Software,IT Certification,Cisco CCNA,"2,284",English,"This course is geared for Cisco's, CCNA (200-120) certification exam. It will cover the Switching portion of the CCNA.",11/2018,12/30/19
CCNA Service Provider - PART 4/4,www.udemy.com/course/ccnasp444/,sikandar Shaik,199.99,11.39,4.0(18 ratings),IT & Software,IT Certification,Cisco CCNA,226,English,"IOS -XR , WAN Technologies, VPN , HSRP,VRRP,GLBP",8/2018,12/30/19
ICND2 200-105 CCNA ROUTE & SWITCH PRACTICE EXAM QUESTIONS,www.udemy.com/course/veyhurdam-icnd2-200-105-ccna-route-switch-practice-exam-questions/,Veyhurdam Dikmen,19.99,11.39,4.3(18 ratings),IT & Software,IT Certification,Cisco CCNA,66,English,The Only Course You Need For CCNA ICND2 200-105 Interconnecting Cisco Networking Devices Part 1 Exam Simulations,12/2018,12/30/19
Cisco CCNA Data Center 200-150 DCICN - Nexus Lab Course,www.udemy.com/course/veyhurdam-cisco-ccna-data-center-200-150-dcicn-nexus-lab-course/,Veyhurdam Dikmen,19.99,11.99,3.6(21 ratings),IT & Software,IT Certification,Cisco CCNA,115,English,The Course You Need For CCNA Data Center 200-150 DCICN Introducing Cisco Data Center Networking Nexus UCS Manager Labs,5/2019,12/30/19
Cisco ICND1 100-105 Practice Tests (Training Completion),www.udemy.com/course/cisco-ccna-icnd1-100-105-practice-tests/,Shaun Hummel,19.99,11.39,4.0(31 ratings),IT & Software,IT Certification,CCENT,122,English,Complete Your ICND1 Training: Exam Level Practice Questions + SIM Labs,11/2019,12/30/19
CCNA Service Provider - PART 2/4,www.udemy.com/course/ccnasp222/,sikandar Shaik,199.99,11.39,4.6(21 ratings),IT & Software,IT Certification,Cisco CCNA,203, English,"Routing IPv4-IPv6 , EIGRP, OSPF, BGP,IOS-XR, SP routing Technologies",8/2018,12/30/19
CCNA COLLABORATION 210-060 CICD PRACTICE EXAM QUESTIONS,www.udemy.com/course/ccna-collaboration-210-060-cicd-practice-exam-questions/,Veyhurdam Dikmen,19.99,11.99,4.2(26 ratings),IT & Software,IT Certification,Cisco CCNA,157,English,The Course You Need For CCNA Collaboration 210-060 CICD Implementing Cisco Collaboration Devices Voice Exam Simulations,9/2019,12/30/19
"Cisco ICND2 - 200-105 - Practice Exams, Pass your Cisco exam",www.udemy.com/course/cisco-icnd2-200-105-practice-exams-pass-your-cisco-exam/,Marious Kuriata,24.99,11.39,4.3(38 ratings),IT & Software,IT Certification,Cisco CCNA,222,English,ICND2 practice exam questions with explanations and exam tips. Great for CCNA 200-125 students as well!,10/2018,12/30/19
CCNA Service Provider - PART 1/4,www.udemy.com/course/ccnasp111/,sikandar Shaik,199.99,11.39,4.4(38 ratings),IT & Software,IT Certification,Cisco CCNA,208,English,"Basic Networking, IP Addressing & Sub-netting, Switching Technologies",8/2018,12/30/19
New! Cisco CCNA Cyber Ops SECFND Course + Exam 210-250,www.udemy.com/course/veyhurdam-ccna-cyber-ops-210-250-secfnd-english/,Veyhurdam Dikmen,19.99,11.39,3.9(16 ratings),IT & Software,IT Certification,Cisco CCNA,106,English,Your Ultimate Guide To For CCNA Cyber Ops 210-250 Secfnd Exam + Practice Exam Questions,3/2019,12/30/19
200-125 Cisco Network Associate (CCNA) Certify Practice Exam,www.udemy.com/course/200-125-cisco-network-associate-ccna-certify-practice-exam/,Up Strive Hub,159.99,11.39,2.7(5 ratings),IT & Software,IT Certification,Cisco CCNA,692,English,Attend this 200-125 Cisco Network Associate (CCNA) Certify Practice Exam will get a Good Score 80% on Main Exam,12/2019,12/30/19
"Cisco CCNA: Vlans, Access-List & NAT + Bonus Material!",www.udemy.com/course/overview-of-vlans-access-list-nat-bonus-material/,Lazaro Diaz,199.99,11.39,4.7(131 ratings),IT & Software,IT Certification,Cisco CCNA,"2,141",English,"This course is geared for Cisco's, CCNA (200-120) certification exam. It will cover 3 essential things in the CCNA cert",11/2018,12/30/19
Cisco 640-461 (ICOMM) Exam Training,www.udemy.com/course/cisco-640-461-icomm-exam-training/,Infinite Skills,49.99,11.39,4.5(86 ratings),IT & Software,IT Certification,Cisco CCNA,738,English,Dive into Cisco's extensive VOIP technologies and CCNA Voice certification requirements in this hands-on video course.,1/2015,12/30/19
CCNA Security 210-260 - IINS v 3.0 - PART 3/6,www.udemy.com/course/ccna-security-210-260-iins-v-30-part-36/,sikandar Shaik,199.99,11.39,4.7(36 ratings),IT & Software,IT Certification,Cisco CCNA,410,English,Logging- NTP - Control Plane Security - Switch Security,12/2017,12/30/19
CCNA Service Provider - PART 3/4,www.udemy.com/course/ccnasp333/,sikandar Shaik,199.99,11.39,4.2(14 ratings),IT & Software,IT Certification,Cisco CCNA,180,English,"IP Services, Security",8/2018,12/30/19
CCNA Security 210-260 - IINS v 3.0 - PART 4/6,www.udemy.com/course/ccna-security-210-260-iins-v-30-part-46/,sikandar Shaik,199.99,11.39,4.6(69 ratings),IT & Software,IT Certification,Cisco CCNA,514,English,Firewall - Cisco ASA Firewalls - ASA ACLs - ASA NAT - IOS Zone Based Firewall,12/2017,12/30/19
Cisco CCNA Networking Basics for Beginners: Getting Started,www.udemy.com/course/cisco-networking-basics-for-beginners-getting-started/,Dr. Sunil Soni,39.99,11.39,4.2(122 ratings),IT & Software,Network & Security,Cisco CCNA,"3,630",English,Welcome to the World of Cisco CCNA Networking Basics for Beginners. Learn to build networks and its troubleshooting.,10/2019,12/30/19
CCNA Security 210-260 - IINS v 3.0 - PART 5/6,www.udemy.com/course/ccna-security-210-260-iins-v-30-part-56/,sikandar Shaik,199.99,11.39,4.3(50 ratings),IT & Software,IT Certification,Cisco CCNA,423,English,Cryptography - Virtual Private Network - IPSec Site to Site VPN - Remote Access VPN - SSL VPN,12/2017,12/30/19
