Course,URL,instructor,Price (full),Price (discount),Rank,Category 1,Category 2,Category 3,Enrollment,Language,Description,Last Update,Date Scraped
SUBNETTING for CCNA students,www.udemy.com/course/subnetting-in-less-than-one-hour/,Jimmy Larsson,19.99,11.39,4.4(56 ratings),IT & Software,IT Certification,Cisco CCNA,"1,268",English,Master subnetting when taking CCNA exam,2/2018,12/30/19
200-105 : CISCO ICND Part 2: Practice Tests,www.udemy.com/course/200-105-cisco-icnd-part-2-practice-tests/,Certification Master,49.99,11.39,0.0(0 ratings),IT & Software,IT Certification,Cisco CCNA,6,English,"Ace the ""Interconnecting Cisco Networking Devices Part 2 (200-105)"" exam in the first attempt.",12/2019,12/30/19
10 Labs similar of the CCNA 200-125 exam,www.udemy.com/course/10-labs-ccna-200-125-exam/,Yassin Laouichi,24.99,11.39,4.0(3 ratings),IT & Software,IT Certification,Cisco CCNA,24,English,You will be ready to pass the CCNA 200-125 LABs easily,6/2018,12/30/19
IT Security Gumbo: CCNA Certification Prep,www.udemy.com/course/it-security-gumbo-ccna-certification-prep/,Corey Charles,194.99,11.39,4.8(8 ratings),IT & Software,IT Certification,Cisco CCNA,40,English,CCNA Study Course,3/2018,12/30/19
"Cisco Routing TSHOOT Labs For CCNA, CCNP, and CCIE Students",www.udemy.com/course/cisco-routing-tshoot-labs-for-ccna-ccnp-and-ccie-students/,Bassam Alkaff,19.99,11.39,4.5(1 rating),IT & Software,IT Certification,Cisco CCNA,79,English,"Cisco Routing (OSPF & EIGRP )troubleshooting Labs For CCNA, CCNP, and CCIE Students",7/2019,12/30/19
CCNA R&S 200-125 v3.0 - 2.0 Routing Technology Labs,www.udemy.com/course/ccna-routing-technologies-labs/,Abdirizak Hersi,19.99,11.39,4.6(9 ratings),IT & Software,IT Certification,Cisco CCNA,953,English,"CCNA v3 exam is hard, Are you ready for it ? on this course we cover all the Routing labs required for the exam.",2/2018,12/30/19
CCNA Cyber Ops: Malware analysis using ELSA and PCAP Files,www.udemy.com/course/ccna-cyber-ops-malware-analysis-using-elsa-and-pcap-files/,Bassam Alkaff,19.99,11.39,4.4(3 ratings),IT & Software,IT Certification,Cisco CCNA,883,English,"Learn how to get PCAP files, use the tcpreplay command, and use ELSA to normalize. summarize, and aggregate logs",8/2019,12/30/19
CCNA 200-150 Cisco Data Center (DCICN) : New Practice Tests,www.udemy.com/course/ccna-200-150-cisco-data-center-dcicn-new-practice-tests/,Mehul Patel,29.99,11.39,0.0(0 ratings),IT & Software,IT Certification,Cisco CCNA,2,English,New Best 200-150 Practice Exams to test your skill and passing the real Cisco exam in first attempt,12/2019,12/30/19
Cisco 100-101 Interconnecting Cisco Networking Devices Exam,www.udemy.com/course/cisco-100-101-interconnecting-cisco-networking-devices-exam/,Tech Certify,154.99,11.39,3.7(10 ratings),IT & Software,IT Certification,Cisco CCNA,"2,441",English,Attend this Cisco 100-101 Interconnecting Cisco Networking Devices Exam will get a Good Score 80% on Main Exam,12/2019,12/30/19
210-060 Implementing Cisco Collaboration Devices Exam,www.udemy.com/course/210-060-implementing-cisco-collaboration-devices-exam-sy/,INFO IT HUB,159.99,11.39,2.5(1 rating),IT & Software,IT Certification,Cisco CCNA,701,English,Attend this 210-060 Implementing Cisco Collaboration Devices Exam will get a Good Score 80% on Main Exam,12/2019,12/30/19
Cisco CCNA 200-125: Beginner's Guide to Networking World,www.udemy.com/course/ccna-200-125/,Ashar Fraz,69.99,11.39,3.8(59 ratings),IT & Software,IT Certification,Cisco CCNA,327,English,The complete guide in accordance with the Official Cisco CCNA 200-125 R/S Syllabus with all Cisco CCNA Packet Tracer Lab,12/2018,12/30/19
210-060 Implement Cisco Collaboration Device Practice Exam,www.udemy.com/course/210-060-implement-cisco-collaboration-device-practice-exam/,Tech Certify,174.99,11.39,0.0(0 ratings),IT & Software,IT Certification,Cisco CCNA,398,English,Attend this 210-060 Implement Cisco Collaboration Device Practice Exam will get a Good Score 80% on Main Exam,12/2019,12/30/19
Cisco CCNA ICND2 (200-105) Practice Exam 2020 (updated),www.udemy.com/course/cisco-ccna-icnd2-200-105-practice-exam-2020-updated/,Certify Hub,19.99,11.39,0.0(0 ratings),IT & Software,IT Certification,Cisco CCNA,4,English,pass your Cisco CCNA ICND2 (200-105) exam in your first attempt by taking this course-300 Current & Updated Questions,8/2019,12/30/19
IPv6 Tutorials- Learn the Basics,www.udemy.com/course/ipv6-training-videos/,"Ashish • 20,000+ Students Worldwide",19.99,11.39,3.7(20 ratings),IT & Software,IT Certification,Cisco CCNA,119,English,"Step by step guide for networking students to understand IPv6 Design, Configuration, Implementation and Troubleshooting.",10/2019,12/30/19
CCNA R&S 200-125 v3.0 - 3.0 WAN Technology Labs,www.udemy.com/course/ccna-wan-technology-labs/,Abdirizak Hersi,19.99,11.39,4.6(98 ratings),IT & Software,IT Certification,Cisco CCNA,"5,370",English,"CCNA v3 exam is hard, Are you ready for it ? on this course we cover all the WAN labs required for the exam.",2/2018,12/30/19
New CISCO CCNA R & S - ICND 2(200-105): Certification Course,www.udemy.com/course/new-cisco-ccna-r-s-icnd-2200-105-certification-course/,GreyCampus Inc.,0.0,99.99,3.1(11 ratings),IT & Software,IT Certification,Cisco CCNA,"1,658",English,Cisco Certified Network Associate - Routing & Switching certification,6/2018,12/30/19
CCNA R&S 200-125 v3.0 - 1.0 LAN Switching Labs,www.udemy.com/course/ccna-lan-switching-labs/,Abdirizak Hersi,19.99,11.39,4.9(53 ratings),IT & Software,IT Certification,Cisco CCNA,"3,458",English,"CCNA v3 exam is hard, Are you ready for it ? on this course we cover all the labs required for LAN Switching on the exam",2/2018,12/30/19
Cisco 200-101 (ICND2) Exam Training Made Easy,www.udemy.com/course/cisco-200-101-icnd2-exam-training/,Infinite Skills,49.99,11.39,4.4(44 ratings),IT & Software,IT Certification,Cisco CCNA,927,English,Cisco ( ICND2) Online Training. Part 2 Towards Passing The Cisco CCNA Routing and Switching Certification,1/2017,12/30/19
200-105 Interconnecting Cisco Network Devices Practice Exam,www.udemy.com/course/200-105-interconnecting-cisco-network-devices-practice-exam/,Tech Certify,164.99,11.39,0.0(0 ratings),IT & Software,IT Certification,Cisco CCNA,626,English,Attend this 200-105 Interconnecting Cisco Network Devices Practice Exam will get a Good Score 80% on Main Exam,10/2019,12/30/19
CISCO CCNA RS (200-125) Certification Complete Course,www.udemy.com/course/ccna-routing-and-switching-200-120/,Ahmad Nadeem,44.99,11.39,3.4(159 ratings),IT & Software,IT Certification,Cisco CCNA,"2,814",English,"This is version 3 of CCNA Routing and Switching exam as is applicable since Aug 21, 2016",10/2016,12/30/19
Cisco CCNA IPv4 Tutorial: Everything You Need!,www.udemy.com/course/cisco-ccna-ipv4-tutorial-everything-you-need/,Lazaro Diaz,199.99,11.39,4.8(121 ratings),None,None,None,None,None,None,None,None
210-260 Implementing Cisco Network Security Practice Exam,www.udemy.com/course/210-260-implementing-cisco-network-security-practice-exam-y/,INFO IT HUB,164.99,11.39,0.0(0 ratings),IT & Software,IT Certification,Cisco CCNA,"1,335",English,Attend this 210-260 Implementing Cisco Network Security Practice Exam will get a Good Score 80% on Main Exam,12/2019,12/30/19
CCNA to CCNP Transition: Working with Passwords and Telnet,www.udemy.com/course/ccna-to-ccnp-transition-working-with-passwords-and-telnet/,Bassam Alkaff,19.99,11.39,4.3(10 ratings),IT & Software,IT Certification,Cisco CCNP,641,English,Learn about tricky and confusing subjects in the CCNA Curriculum such as how to work with passwords and Telnet,7/2019,12/30/19
Pass your CCNA 200-125 in 5 hours,www.udemy.com/course/pass-your-ccna-200-125/,Yassin Laouichi,49.99,11.39,3.3(12 ratings),IT & Software,IT Certification,Cisco CCNA,80,English,"Complete course to pass your CCNA 200-125 certification, This course will allow you to master LAN / WAN networks.",5/2018,12/30/19
CCNA R&S Exam and IP Addrress (English),www.udemy.com/course/ip-address-version-4/,Kriangsak Namkot,19.99,11.39,3.1(14 ratings),IT & Software,IT Certification,Cisco CCNA,679,English,You can calculate IP Address Version 4 with best technic and CCNA Exam,5/2019,12/30/19
CISCO CCNA (200-125) Questions: Pass on Your First Attempt,www.udemy.com/course/cisco-ccna-200-125-questions-pass-on-your-first-attempt-m/,Hasan Anwar,19.99,11.39,0.0(0 ratings),IT & Software,IT Certification,IT Fundamentals,2,English,CCNA practice exam questions. Get Your CCNA Before Its Too Late!,7/2019,12/30/19
CCNA Security IINS 210-260 Practice Tests,www.udemy.com/course/ccna-security-iins/,Akhil Behl,34.99,11.39,0.0(0 ratings),IT & Software,IT Certification,Cisco CCNA,3,English,Pass the exam with two high-quality practice tests that mimic the CCNA Security written exam,8/2019,12/30/19
Cisco CCNA Security 210-260 IINS Practice Test,www.udemy.com/course/cisco-ccna-security-210-260-iins-practice-test/,Professor A,49.99,11.39,0.0(0 ratings),IT & Software,IT Certification,Cisco CCNA,3,English,Cisco Certified Network Associate Security (CCNA Security),7/2019,12/30/19
Cisco CCNA 200-125 Real Exam Questions,www.udemy.com/course/cisco-ccna-200-125-real-exam-questions/,Arturo Gonzalez Garcia,19.99,11.39,3.9(9 ratings),IT & Software,IT Certification,Cisco CCNA,72,English,Real exam questions CCNA R&S 200-125,11/2017,12/30/19
CCNA Routing & Switching Practice Test (200-125 Exam),www.udemy.com/course/ccna-routing-switching-practice-test-200-125-exam/,Knowledge Surge,19.99,11.39,0.0(0 ratings),IT & Software,IT Certification,Cisco CCNA,13,English,Crack your CCNA exam with 6 Topic-wise Quizzes and more than 400 Questions,2/2019,12/30/19
Cisco CCNA: Understanding OSPF LSA Types,www.udemy.com/course/cisco-ccna-understanding-ospf-lsa-types/,Bassam Alkaff,19.99,11.39,3.7(2 ratings),IT & Software,IT Certification,Cisco CCNA,52,English,"Clarify the difference between each one of OSPF LSA Types, Redistribution metric & Type, EIGRP Auto-ummarization",7/2019,12/30/19
Cisco CCNA CyberOps (SECFND) - Practice Exams,www.udemy.com/course/cisco-ccna-cyberops-secfnd-practice-exams-training/,IP Specialist,19.99,11.39,4.5(12 ratings),IT & Software,IT Certification,Cisco CCNA,32,English,CCNA CyberOPS practice questions 4 parts (50 Questions/Part) Total= 200 CCNA CyberOps Practice Questions - 2018 Version,9/2018,12/30/19
Pass Your CCNA R&S (200-125) - 300+ Practice Test Questions,www.udemy.com/course/pass-your-ccna-rs-200-125-300-practice-test-questions/,E - Learning,19.99,11.39,0.0(0 ratings),IT & Software,IT Certification,Cisco CCNA,1,English,"More Practice More Skills, 300+ Questions, be prepared for CCNA Exam, too much knowledge about Routing and Switching.",12/2019,12/30/19
CCNA Routing & Switching 200-125 Practice Exam Questions 2/2,www.udemy.com/course/veyhurdam-ccna-routing-switching-200-125-practice-exam-questions-22/,Veyhurdam Dikmen,19.99,11.39,0.0(0 ratings),IT & Software,IT Certification,Cisco CCNA,8,English,The Only Course You Need For CCNA Routing and Switching 200-125 Exam Part 2 Exam Simulation Questions,12/2018,12/30/19
OSPFv3 (IOS xr): Cisco CCNA Networking Course,www.udemy.com/course/ccna-ospfv3-ios-xr-cisco-training-course/,Sam Fitzgerald,149.99,11.39,0.0(0 ratings),IT & Software,IT Certification,Cisco CCNA,43,English,"CCNA Cisco Networking OSPFv3 (IOS xr) Taught Efficient, Quick, Painless, & Easy To Understand - Unlike The Other Guys",8/2018,12/30/19
CCNA Wireless Official Exam Certification 640-721,www.udemy.com/course/ccna-wireless-official-exam-certification-640-721/,IT Certification Corner,99.99,11.39,0.0(0 ratings),IT & Software,IT Certification,Cisco CCNA,1,English,"Learn the fundamentals of CISCO network from ground up: Networking,Wireless and Security",9/2019,12/30/19
200-105 Interconnecting Cisco Networking Devices Exam,www.udemy.com/course/200-105-interconnecting-cisco-networking-devices-exam-h/,Up Strive Hub,149.99,11.39,1.4(2 ratings),IT & Software,IT Certification,Cisco CCNA,"1,308",English,Attend this 200-105 Interconnecting Cisco Networking Devices Exam will get a Good Score 80% on Main Exam,12/2019,12/30/19
CCNA 200-125 Exam LABS Explained!,www.udemy.com/course/ccna-200-125-exam-labs-explained/,Arturo Gonzalez Garcia,19.99,11.39,0.0(0 ratings),IT & Software,IT Certification,Cisco CCNA,4,English,Cisco CCNA 200-125 Exam LABS Explained,4/2019,12/30/19
CCNA Cyber Ops - SECFND (210-250) - Practice Exams,www.udemy.com/course/ccna-cyber-ops-secfnd-practice-exams/,Matt Carey,199.99,11.39,3.5(3 ratings),IT & Software,IT Certification,Cisco CCNA,16,English,These CCNA Cyber Ops test questions are very close to what you will see on the actual exam. *Current for 2019,2/2019,12/30/19
CCNA ROUTING & SWITCHING,www.udemy.com/course/ccna-routing-switching-j/,Abdul Vaheed,19.99,11.39,0.0(0 ratings),IT & Software,IT Certification,Cisco CCNA,4,English,Cisco CCNA Routing and Switching concepts and lab demonstrations,4/2019,12/30/19
CISCO CCNA 200-125 Practice Exam,www.udemy.com/course/cisco-ccna-200-125-practice-exam-z/,Hello Certificate,19.99,11.39,0.0(0 ratings),IT & Software,IT Certification,Cisco CCNA,0,English,Want to pass your CISCO CCNA 200-125 Exam ? Practice with our 280+ High Quality Question.,8/2019,12/30/19
Configuring network protocols: A beginners guide to CCNA,www.udemy.com/course/unetlab-ccna-200-125/,AJ Fra,19.99,11.39,0.0(0 ratings),IT & Software,IT Certification,Cisco CCNA,20,English,The road to becoming a network engineer is not easy. Taking advantage of this course will lead you on the right path.,12/2016,12/30/19
CCNA  200-125 V3 Practice Test exam,www.udemy.com/course/ccna-200-125-v3-practice-test-exam/,Emy Exams IT,199.99,11.39,0.0(0 ratings),IT & Software,IT Certification,Cisco CCNA,11,English,How about improving your SCORE before taking your Official exam?,12/2019,12/30/19
CCNA Security (210-260) IINS - Practice Exam ( New Updated ),www.udemy.com/course/ccna-security-210-260-iins-practice-exam-new-updated/,Mehul Patel,29.99,11.39,0.0(0 ratings),IT & Software,IT Certification,Cisco CCNA,16,English,New Updated Best CCNA Security Practice Exams to test your knowledge and passing your real Cisco exam in first attempt,12/2019,12/30/19
200-105 Interconnecting Cisco Networking Devices Test,www.udemy.com/course/200-105-interconnecting-cisco-networking-devices-test-k/,MY TECH LEARN,164.99,11.39,0.0(0 ratings),IT & Software,IT Certification,Cisco CCNA,21,English,Test your Skills while Attend 200-105 Interconnecting Cisco Networking Devices Certification Practice Test,10/2019,12/30/19
Cisco CCNA Primer,www.udemy.com/course/cisco-ccna-primer/,How To Network,19.99,11.39,4.2(19 ratings),IT & Software,IT Certification,Cisco CCNA,700,English,Everything you need to learn BEFORE you start the Cisco CCNA.,12/2014,12/30/19
Cisco Networking (ICND1) 100-105 Practice Test,www.udemy.com/course/cisco-networking-icnd1-100-105-practice-test/,War Of Cloud,19.99,11.39,0.0(0 ratings),IT & Software,IT Certification,Cisco CCNA,0,English,Cisco Networking (ICND1) 100-105 Practice Test,12/2019,12/30/19
Cisco CCNA: Configuring Frame-Relay,www.udemy.com/course/cisco-ccna-configuring-frame-relay/,Bassam Alkaff,19.99,11.39,5.0(1 rating),IT & Software,IT Certification,Cisco CCNA,145,English,"Understand and Master Configuring Frame-Relay on Cisco routers, and Clarify its ambiguity for CCNA Students.",7/2019,12/30/19
CCNA Routing & Switching - CCNA 200-125 Questions & Answers,www.udemy.com/course/ccna-routing-switching-ccna-200-125-questions-answers/,Samuel Kelly Brew,19.99,11.39,0.0(0 ratings),IT & Software,IT Certification,Cisco CCNA,0,English,Practice questions provided as you prepare for the CCNA 200-125 - CCNA Routing & Switching Exams,1/2019,12/30/19
Cisco CCNA Networking Security Exam,www.udemy.com/course/cisco-ccna-networking-security-exam/,Khaddaoui Lahcen,19.99,11.39,3.1(23 ratings),IT & Software,Network & Security,Cisco CCNA,"2,100",English,Clear Cisco Networking CCNA Security 200-125 Exam with Confidence,9/2019,12/30/19
Cisco CCNA 2019 Routing and Switching 200-125 exam questions,www.udemy.com/course/cisco-ccna-2019-routing-and-switching-200-125-exam-questions/,NikaJ Janjaria,19.99,11.39,0.0(0 ratings),IT & Software,Network & Security,Cisco CCNA,2,English,Check your knowledge in Cisco CCNA 200-125,2/2019,12/30/19
IT Security for Cisco CCNA: 640-554 IINS,www.udemy.com/course/cisco-ccna-security/,LearnSmart LLC,0.0,79.99,4.2(21 ratings),IT & Software,IT Certification,Cisco CCNA,543,English,Define the management plane and identify practices that can be used to make it more secure.,4/2015,12/30/19
Cisco Networking CCNA IPv6 OSPF,www.udemy.com/course/networkingstepbystep-ipv6-ospf/,Sam Fitzgerald,149.99,11.39,4.6(2 ratings),IT & Software,IT Certification,Cisco CCNA,850,English,"Cisco Networking CCNA IPv6 OSPF Taught Efficient, Quick, Painless, & Easy To Understand - Unlike The Other Guys",8/2018,12/30/19
CCNA to CCNP Transition: Miscellaneous Topics,www.udemy.com/course/ccna-to-ccnp-transition-miscellaneous-topics/,Bassam Alkaff,19.99,11.39,0.0(0 ratings),IT & Software,IT Certification,Cisco CCNA,64,English,"Clarify confusing subjects in CCNA, and be ready to start your CCNP Studies with confidence",7/2019,12/30/19
ICND2 - Cisco 200-105 - Nov 2019 - Practice Set,www.udemy.com/course/icnd2-cisco-200-105-nov-2019-practice-set/,Reshma Gulabani,54.99,11.39,0.0(0 ratings),IT & Software,IT Certification,Cisco CCNA,10,English,Just a set of ICND2 questions that can help you with your upcoming exam.,11/2019,12/30/19
AHA-VTS: Cisco CCNA Lab F.L.I.C.,www.udemy.com/course/aha-vts-dot-com-ccna-lab-flic/,Alim H. Ali,79.99,11.39,0.0(0 ratings),IT & Software,IT Certification,Cisco CCNA,1,English,Cisco CCNA Certification,2/2019,12/30/19
2020 Cisco Certified  CCNA200-125/200-105 Final Prep.,www.udemy.com/course/2019-2020-cisco-ccna-200-125200-105/,Emin Yardim,19.99,11.39,0.0(0 ratings),IT & Software,IT Certification,Cisco CCNA,1,English,Updated 09.12.2019: - Best CCNA 200-125 Practice Exams before you take the test for real. Save time and exam fees,8/2019,12/30/19
IP Addressing & Sub-netting,www.udemy.com/course/ip-addressing-sub-netting/,Datta Jagtap,29.99,11.39,0.0(0 ratings),IT & Software,IT Certification,Cisco CCNA,3,English,IP Addressing with IPv4 & IPv6 Types & Sub-netting,3/2019,12/30/19
Cisco CCNA: Everything about Static Routing!,www.udemy.com/course/cisco-ccna-everything-about-static-routing/,Bassam Alkaff,19.99,11.39,4.4(9 ratings),IT & Software,IT Certification,Cisco CCNA,738,English,Understand Static routing and both its basic and advanced configuration in depth.,7/2019,12/30/19
CCNA v6.0 Practice Exam,www.udemy.com/course/ccna-v60-practice-exam/,Syed Muhammad Ismail Shah,19.99,11.39,0.0(0 ratings),IT & Software,IT Certification,Cisco CCNA,1,English,CCNA v6.0 Practice Exam,9/2019,12/30/19
New CCNA ICND1 100-105 Practice Lab guide,www.udemy.com/course/new-ccna-icnd1-100-105-practice-lab-guide/,IProutez N,19.99,11.39,0.0(0 ratings),IT & Software,IT Certification,Cisco CCNA,4,English,CCNA ICND1,8/2017,12/30/19
Cisco CCNA Certification Course Preparation - Practice Test,www.udemy.com/course/cisco-ccna-certification-course-preparation/,Nivetha R. Vasanth,19.99,11.39,3.7(3 ratings),IT & Software,Network & Security,Cisco CCNA,14,English,An interesting test paper with explanation for answers to help you prepare & pass Cisco's newest CCNA v3(200-125) exam.,10/2017,12/30/19
CCNA Routing and Switching,www.udemy.com/course/ccna_routing_switching/,Exam Guru,49.99,11.39,0.0(0 ratings),IT & Software,IT Certification,Cisco CCNA,5,English,Complete your CCNA 200-125 Exam with this comprehensive Exam Practise guide,4/2018,12/30/19
200-125 Cisco Certified Network Associate Practice Exam,www.udemy.com/course/200-125-cisco-certified-network-associate-practice-exam/,Tech Certify,169.99,11.39,2.3(3 ratings),IT & Software,IT Certification,Cisco CCNA,"1,612",English,Attend this 200-125 Cisco Certified Network Associate Practice Exam will get a Good Score 80% on Main Exam,12/2019,12/30/19
New CISCO CCNA R & S - ICND 1(100-105): Certification Course,www.udemy.com/course/ccna-icnd-1/,GreyCampus Inc.,0.0,99.99,3.6(19 ratings),IT & Software,IT Certification,Cisco CCNA,859,English,Cisco Certified Entry Networking Technician (CCENT),1/2018,12/30/19
CCNA R&S 200-125 v3.0 - 4.0 Infrastructure Services Labs,www.udemy.com/course/ccna-infrastructure-services/,Abdirizak Hersi,19.99,11.39,3.0(52 ratings),IT & Software,IT Certification,Cisco CCNA,"2,524",English,"CCNA v3 exam is hard, Are you ready for it ? on this course we cover all the Infrastructure Labs required for the exam.",6/2018,12/30/19
CCNA R&S 200-125 v3.0 - 4.0 Infrastructure Services Labs,www.udemy.com/course/ccna-infrastructure-services/,Abdirizak Hersi,19.99,11.39,3.0(52 ratings),IT & Software,IT Certification,Cisco CCNA,"2,524",English,"CCNA v3 exam is hard, Are you ready for it ? on this course we cover all the Infrastructure Labs required for the exam.",6/2018,12/30/19
CISCO CCNA 200-125 Practice Exam 2020-Routing & Switching,www.udemy.com/course/cisco-ccna-200-125-practice-exam-2020-routing-switching/,Certify Hub,19.99,11.39,0.0(0 ratings),IT & Software,IT Certification,Cisco CCNA,0,English,Pass your CISCO CCNA 200-125 exam in your first attempt by taking this course-300 New & current updated Question,8/2019,12/30/19
CCNA (200-125) Practice Tests|Get Certified Easily For 2019,www.udemy.com/course/ccna-200-125-practice-testsget-certified-easily-for-2017/,Inspiring Generations Academy,0.0,34.99,4.3(17 ratings),IT & Software,IT Certification,Cisco CCNA,627,English,Final Prep For The CCNA | Test Your Knowledge | Pass The First Time | Questions and Answers Updated Daily!ââ,11/2019,12/30/19
CCNA Cyber Ops SECFND 210-250 Practice Tests | Series 2,www.udemy.com/course/secfnd-s2/,Dilanka Muthukumarana,34.99,11.39,1.0(1 rating),IT & Software,IT Certification,Cisco CCNA,7,English,"Must do the Test 3,4,5,6 Before the exam:) Learn and Practice for CCNA Cyber Ops - SECFND 210-250",7/2018,12/30/19
New CCNA Routing and Switching 100-105 ICND1 Lab1,www.udemy.com/course/new-ccna-routing-and-switching-100-105-icnd1-lab1/,IProutez N,19.99,11.39,4.0(7 ratings),IT & Software,IT Certification,Cisco CCNA,938,English,CCNA RS ICND1 labs ***New videos added**** use code ICND1LAB10,8/2017,12/30/19
200-105 Inter connecting Cisco Networking Devices Exam,www.udemy.com/course/200-105-inter-connecting-cisco-networking-devices-exam/,INFO IT HUB,154.99,11.39,2.4(2 ratings),IT & Software,IT Certification,Cisco CCNA,"1,274",English,Attend this 200-105 Inter connecting Cisco Networking Devices Exam will get a Good Score 80% on Main Exam0-,12/2019,12/30/19
CCNA Routing and Switching 200-125 REVISION GUIDE,www.udemy.com/course/ccna-routing-and-switching-200-125-revision-guide/,Packt Publishing,124.99,11.39,0.0(0 ratings),IT & Software,Network & Security,Cisco CCNA,4,English,"Become familiar with CCNA 200-125 exam objectives, and get ready for the exam in just a week",12/2019,12/30/19
CCNA-Networks Certification Real Exam Practice Question,www.udemy.com/course/ccna-networks-certification-real-exam-practice-question/,Abdur Rehman,19.99,11.39,2.8(2 ratings),IT & Software,IT Certification,Cisco CCNA,4,English,Learn to real exam question before taking official exam it will be make you fully prepared and will be save time&Fee,1/2019,12/30/19
CCNA Cyber Ops SECFND 210-250 Practice Tests | Series 1,www.udemy.com/course/secfnd-s1/,Dilanka Muthukumarana,19.99,11.39,3.4(3 ratings),IT & Software,IT Certification,Cisco CCNA,8,English,Learn and Practice for CCNA Cyber Ops - SECFND 210-250,7/2018,12/30/19
Cisco Network Security Certification For 2019 (210-260),www.udemy.com/course/cisco-network-security-certification-for-2018-210-260/,Inspiring Generations Academy,0.0,34.99,3.4(8 ratings),IT & Software,IT Certification,Cisco CCNA,"1,469",English,Final Prep For The CCNA: Security | Test Your Knowledge | Pass The First Time |,11/2019,12/30/19
CISCO CCNA 200-125 Practice Test : Routing & Switching 2020,www.udemy.com/course/cisco-ccna-200-125-practice-test-routing-switching/,Certify Hub,19.99,11.39,0.0(0 ratings),IT & Software,IT Certification,Cisco CCNA,2,English,Pass your CISCO CCNA 200-125 exam in your first attempt by taking this course-300 New & current updated Question,8/2019,12/30/19
"IT Networking for Cisco: (CCNA 200-120, 640-554, 640-721)",www.udemy.com/course/cisco-ccna-networking-core-concepts/,LearnSmart LLC,0.0,119.99,4.0(85 ratings),IT & Software,IT Certification,Cisco CCNA,"1,472",English,"Learn to manage & troubleshoot the fundamentals of Cisco network from the ground up: networking, security, and wireless.",11/2015,12/30/19
Cisco CCNA Network Fundamentals Chapter 2,www.udemy.com/course/cisco-ccna-network-fundamentals-chapter-2/,Kiel Martin,0.0,Free,"4.3(1,344 ratings)",IT & Software,IT Certification,Cisco CCNA,"31,463",English,This is a course is the 2nd course of Network Fundamentals series. Come and learn the OSI Model,12/2014,12/30/19
"CCNA IP Addressing and Subnetting - Practical, Exam Prep",www.udemy.com/course/ccna-ip-addressing-and-subnetting-practical-exam-prep/,David Bombal,0.0,Free,4.6(745 ratings),IT & Software,IT Certification,Cisco CCNA,"22,735",English,Prepare for the IP Subnetting exam topic in the CCNA 200-125 or ICND1 100-105 exams. Pass your CCENT or CCNA exam!,8/2017,12/30/19
CCNA Quiz Questions: Exam prep. Get ready for your exam!,www.udemy.com/course/ccna-quiz-questions-exam-prep-pass-ccna-exam/,David Bombal,0.0,Free,4.7(125 ratings),IT & Software,IT Certification,Cisco CCNA,"6,534",English,Are you ready for the CCNA exam? You sure? Check your knowledge with our CCNA Exam Quizzes. Make sure you're ready!,3/2019,12/30/19
CCNA EIGRP troubleshooting: Cisco CCNA and ICND2 exam prep,www.udemy.com/course/ccna-eigrp-troubleshooting-cisco-ccna-and-icnd2-exam-prep/,David Bombal,0.0,Free,4.7(152 ratings),IT & Software,IT Certification,Cisco CCNA,"10,554",English,Prepare for the EIGRP exam topic in the CCNA 200-125 or ICND2 200-105 exams. You need to learn EIGRP for your exam.,7/2019,12/30/19
