Course,URL,instructor,Price (full),Price (discount),Rank,Category 1,Category 2,Category 3,Enrollment,Language,Description,Last Update,Date Scraped
Cómo escribir email irresistible:Plantillas listas para usar,www.udemy.com/course/5-plantillas-de-correo-que-todo-emprendedor-necesita/,Vida por Diseño,64.99,11.39,3.4(48 ratings),Business,Entrepreneurship,Email Etiquette,999,Spanish,"Desde como conseguir clientes para su negocio hasta como ahorrar importantes cantidades de dinero, todo listo para usar",2/2018,12/31/19
ActiveCampaign E-mailmarketing Automation - word een Pro!,www.udemy.com/course/activecampaign-e-mailmarketing-automation/,Eelco Jacobs,94.99,11.39,4.1(9 ratings),Marketing,Digitale marketing,E-mailmarketing,33,Nederlands,Nederlandstalige cursus met de nieuwe navigatie van ActiveCampaign!,3/2018,12/31/19
فن التعامل بالايميل (Email Etiquette),www.udemy.com/course/arabic-email-etiquette/,Maged M. Koshty,49.99,11.39,4.4(40 ratings),Personal Development,Productivity,Email Marketing,292,Arabic,Ø¯ÙØ±Ø© ÙÙÙÙ Ø¢Ø¯Ø§Ø¨ Ø§ÙØ¨Ø±ÙØ¯ Ø§ÙØ¥ÙÙØªØ±ÙÙÙ ÙØªØ¹ÙÙ ÙÙÙÙØ© ÙØªØ§Ø¨Ø© Ø±Ø³Ø§Ø¦Ù Ø§ÙØ¨Ø±ÙØ¯ Ø§ÙØ¥ÙÙØªØ±ÙÙÙ Ø¨Ø´ÙÙ Ø¨Ø£Ø³ÙÙØ¨ Ø§Ø­ØªØ±Ø§ÙÙ,5/2018,12/31/19
Curso Completo de Email Marketing para Negocios y Personas,www.udemy.com/course/email-marketing-negocios/,Daniel Alejandro,79.99,11.39,4.4(21 ratings),Marketing,Marketing digital,Marketing por correo electrÃ³nico,149,EspaÃ±ol,Aprende como Automatizar tus Ventas por Medio de Mercadeo por Correo ElectrÃ³nico y con un TÃºnel o Embudo de Ventas,11/2019,12/31/19
Photoshop: Criando um E-mail Marketing Animado do Zero,www.udemy.com/course/photoshop-criando-um-e-mail-marketing-animado-do-zero/,Evandro Lima,19.99,11.39,4.6(69 ratings),Design,Web design,Marketing por e-mail,336,PortuguÃªs,Guia essencial para criar layouts de e-mail marketing,7/2018,12/31/19
Email Marketing: La herramienta de ventas más efectiva,www.udemy.com/course/email-marketing-la-herramienta-de-ventas-mas-efectiva/,Raúl Liñán,49.99,11.39,4.6(16 ratings),Development,E-Commerce,Email Marketing,91,Spanish,"Desarrolla, planifica y gestiona campaÃ±as eficaces de Email Marketing y aumenta tus ventas",1/2018,12/31/19
Créer une audience de fan accro à tes mails ⭐,www.udemy.com/course/formation-mailing/,Loïc PSC,99.99,11.39,4.0(6 ratings),Marketing,Principes de base du marketing,Marketing par e-mail,279,FranÃ§ais,Apprendre Ã  Ã©crire des mails qui poussent Ã  passer l'action,7/2019,12/31/19
AutoResponder Revelado: venda mais com emails personalizados,www.udemy.com/course/autoresponder-revelado-venda-mais-com-emails-personalizados/,Tiago Bacciotti Moreira,19.99,11.39,4.6(21 ratings),NegÃ³cios,Vendas,Marketing por e-mail,666,PortuguÃªs,"Como instalar, configurar e utilizar um autoresponder para gerar rapport com seus clientes",7/2016,12/31/19
E-mail Marketing - A Estratégia Do Zero A Primeira Venda,www.udemy.com/course/e-mail-para-marketing-digital/,Andre Silva,199.99,11.39,4.2(10 ratings),Marketing,Marketing digital,Marketing por e-mail,56,PortuguÃªs,"Descubra como gerar sua primeira venda ou mais com um mÃ©todo prÃ¡tico, simples e validado e bastante poderoso.",8/2019,12/31/19
Email Marketing mit Klick-Tipp für Profis,www.udemy.com/course/e-mail-marketing-mit-klick-tipp-fur-profis/,Jonas Klaholz,199.99,11.39,3.6(14 ratings),Marketing,Marketinggrundlagen,E-Mail-Marketing,120,Deutsch,Email Marketing Masterclass leicht gemacht - Wir machen dich zum Klick-Tipp Profi!,1/2018,12/31/19
Email Marketing: 3 Pasos Para Vender,www.udemy.com/course/email-marketing-3-pasos/,Alex Ramirez,49.99,11.39,5.0(2 ratings),Marketing,Marketing digital,Marketing por correo electrÃ³nico,14,EspaÃ±ol,Viaja RÃ¡pido de no Hacer Email Marketing a Lanzar un Anuncio en Facebook Para Construir tu Lista de Clientes Potenciales,11/2019,12/31/19
Email Marketing,www.udemy.com/course/email-marketing-vm/,Vasco Marques,39.99,11.39,4.1(13 ratings),Marketing,Digital Marketing,Email Marketing,57,Portuguese,Como conseguir mais resultados com tÃ©cnicas de email marketing. ConheÃ§a a plataforma de email marketing E-Goi.,9/2015,12/31/19
"Email Marketing, Técnicas para Aumentar Vendas - Copywriter",www.udemy.com/course/email-marketing-tecnicas-para-aumentar-vendas-copywriter/,Edson L P Camacho,24.99,11.39,4.2(10 ratings),Marketing,Marketing digital,Marketing por e-mail,44,PortuguÃªs,Como aumentar suas vendas com tÃ©cnicas simples de comunicaÃ§Ã£o persuasiva,11/2018,12/31/19
Como capturar os emails dos visitantes do seu site,www.udemy.com/course/como-capturar-emails-visitantes-site/,Miguel Brandão,24.99,11.39,4.8(7 ratings),Marketing,Marketing digital,Marketing por e-mail,50,PortuguÃªs,TÃ©cnicas e ferramentas para aumentar a sua lista de emails de forma natural,7/2018,12/31/19
Guía completa para ser un profesional del e-mail marketing,www.udemy.com/course/guia-completa-para-ser-un-profesional-del-e-mail-marketing/,Sergio Castro,24.99,11.39,4.3(22 ratings),Marketing,Digital Marketing,Email Marketing,567,Spanish,Convierte tus campaÃ±as de mail en un embudo de ventas con conocimientos teÃ³rico/practicos de email marketing y MailChimp,10/2018,12/31/19
Aumente suas vendas com email marketing,www.udemy.com/course/email-marketing-aweber/,Adriano Leszkowicz,199.99,11.39,3.6(107 ratings),Marketing,Marketing digital,Marketing por e-mail,949,PortuguÃªs,Utilize um autoresponder (aweber) para criar listas vender mais e gerar vendas repetidas,1/2016,12/31/19
Haz dinero con bases de datos,www.udemy.com/course/haz-crecer-tu-negocio-con-bases-de-datos/,Leandro Szachtman,49.99,11.39,4.5(10 ratings),Negocios,Ventas,Marketing por correo electrÃ³nico,127,EspaÃ±ol,Hacer crecer tu negocio con bases de emails nunca fue tan fÃ¡cil,4/2019,12/31/19
【最速1週間】でスタートする。今さら聞けないメールマーケティング。お客さんの心を鷲掴みにする本物マーケティング７ステップ,www.udemy.com/course/mail_marketing/,西田 光弘,199.99,11.39,4.5(12 ratings),ãã¼ã±ãã£ã³ã°,ãã¸ã¿ã«ãã¼ã±ãã£ã³ã°,ã¡ã¼ã«ãã¼ã±ãã£ã³ã°,148äººã®åè¬çãç»é²,æ¥æ¬èª,ç ã£ã¦ããäººèã»äººéé¢ä¿ã»ååºã»ã¡ã¼ã«ã¢ãã¬ã¹ããã¹ã¦ãã¡ã¼ã«ãã¼ã±ãã£ã³ã°ã«æ´»ããï¼ã¹ããã,7/2018,12/31/19
Programación para Mails Correos Macros Excel VBA,www.udemy.com/course/programacion-especial-macros-excel-vba-para-mails-o-correos/,Cristian Silva Alvarez,29.99,11.39,5.0(1 rating),InformÃ¡tica y software,Certificaciones de TI,Marketing por correo electrÃ³nico,402,EspaÃ±ol,Este es un curso ideal para aprender a enviar o distribuir correos para campaÃ±as de marketing o generaciÃ³n de informes,7/2019,12/31/19
Email Marketing con MailChimp,www.udemy.com/course/email-marketing-mailchimp/,Nicolas Laczka,119.99,11.39,3.9(4 ratings),Marketing,Marketing digital,Marketing por correo electrÃ³nico,218,EspaÃ±ol,Potencia tus ventas online con Mailchimp,5/2018,12/31/19
Getresponse Email Marketing für Anfänger,www.udemy.com/course/getresponse-email-marketing-beginner/,Christoph Palm,34.99,11.39,0.0(0 ratings),Marketing,Affiliate-Marketing,E-Mail-Marketing,19,Deutsch,Lerne wie du mit Emails Geld machst.,9/2019,12/31/19
Conviértete En El Crack Del Email Marketing Con GetResponse,www.udemy.com/course/curso-getresponse-espanol/,L FERNANDO MURO PERAL,54.99,11.39,4.0(15 ratings),Marketing,Marketing de producto,Marketing por correo electrÃ³nico,57,EspaÃ±ol,Aprende con 30 vÃ­deos tutoriales en EspaÃ±ol a manejar GetResponse Paso a Paso,9/2016,12/31/19
Dominando Activecampaign,www.udemy.com/course/dominando-activecampaign/,Klinsmann Fabian,49.99,11.39,0.0(0 ratings),Marketing,Fundamentos de marketing,Marketing por correo electrÃ³nico,10,EspaÃ±ol,Aprende a crear una audiencia para tu negocio online y offline,3/2018,12/31/19
Email Marketing para principantes hasta automatización,www.udemy.com/course/secretos-para-vender-con-email-marketing/,Estudio Other Space,29.99,11.39,3.8(6 ratings),Marketing,Marketing digital,Marketing por correo electrÃ³nico,33,EspaÃ±ol,Aprende a incrementar tus ventas con email marketing y crea campaÃ±as de email enfocadas a resultados,5/2017,12/31/19
"Обучающий видеокурс: ""Успешный контакт""",www.udemy.com/course/smash-contact/,Сергей Абалмасов,19.99,11.39,5.0(1 rating),ÐÐ¸Ð·Ð½ÐµÑ,ÐÑÐ¾Ð´Ð°Ð¶Ð¸,ÐÐ°ÑÐºÐµÑÐ¸Ð½Ð³ Ð¿Ð¾ ÑÐ»ÐµÐºÑÑÐ¾Ð½Ð½Ð¾Ð¹ Ð¿Ð¾ÑÑÐµ,10,Ð ÑÑÑÐºÐ¸Ð¹,7 ÑÐ°Ð³Ð¾Ð² Ðº Ð±ÑÑÑÑÐ¾Ð¼Ñ Ð²Ð·Ð»ÑÑÑ Ð¿ÑÐ¾Ð´Ð°Ð¶. Email - Ð¼Ð°ÑÐºÐµÑÐ¸Ð½Ð³ Ð¾Ñ Ð Ð´Ð¾ Ð¯.,12/2017,12/31/19
E-mail Marketing Prático,www.udemy.com/course/e-mail-marketing-rapido-e-pratico/,Osvaldo Henrique Rocha Silva,29.99,11.39,0.0(0 ratings),Marketing,Marketing digital,Marketing por e-mail,2,PortuguÃªs,A maneira mais rÃ¡pida de comeÃ§ar a fazer vendas atravÃ©s de E-mail Marketing,11/2019,12/31/19
التسويق بالبريد الإلكتروني | Email Marketing,www.udemy.com/course/teqanny-email/,Eng. Mustafa Othman,0.0,19.99,5.0(1 rating),Marketing,Digital Marketing,Email Marketing,4,Arabic,Ø¥Ø¨Ø¯Ø£ Ø¯ÙÙÙØªÙ Ø±Ø­ÙØªÙ ÙØªØ¹ÙÙ Ø§ÙØªØ³ÙÙÙ Ø§ÙØ¥ÙÙØªØ±ÙÙÙ ÙØ¹ Ø¯Ø¨ÙÙÙØ© Ø§ÙØªØ³ÙÙÙ Ø§ÙØ±ÙÙÙ Ø§ÙÙØªÙØ§ÙÙØ©,3/2019,12/31/19
Creación de Emailings Responsive con PS / Bee / Mailchimp,www.udemy.com/course/creacion-de-emailings-responsive-con-ps-bee-mailchimp/,Guille Tineo,19.99,11.39,0.0(0 ratings),Marketing,Marketing digital,Marketing por correo electrÃ³nico,1,EspaÃ±ol,Aprende a crear campaÃ±as de Emailing responsive con herramientas gratuitas.,11/2019,12/31/19
E-mail Marketing pelo Photoshop: Faça Você Mesmo!,www.udemy.com/course/e-mail-marketing-pelo-photoshop-faca-voce-mesmo/,Fábio Dreher,19.99,11.39,0.0(0 ratings),Marketing,Marketing digital,Marketing por e-mail,1,PortuguÃªs,"Crie vocÃª mesmo as peÃ§as de e-mail marketing de uma maneira simples, fÃ¡cil, rÃ¡pida e direta.",9/2019,12/31/19
Email Marketing - Atraia e Converta !,www.udemy.com/course/email-marketing-atraia-e-converta/,Gustavo Penna,19.99,11.39,3.3(24 ratings),Marketing,Marketing de redes sociais,Marketing por e-mail,92,PortuguÃªs,"Divulgue e venda muito mais, aprendendo a criar Campanhas de E-mail Marketing eficazes e de alta conversÃ£o.",7/2017,12/31/19
El poder del email marketing en el 2018,www.udemy.com/course/el-poder-del-email-marketing-en-el-2018/,Klinsmann Fabian,49.99,11.39,0.0(0 ratings),Marketing,Fundamentos de marketing,Marketing por correo electrÃ³nico,1,EspaÃ±ol,Descubre el proceso completo para enviar campaÃ±as de emails efectivas,4/2018,12/31/19
El poder del email marketing en el 2018,www.udemy.com/course/el-poder-del-email-marketing-en-el-2018/,Klinsmann Fabian,49.99,11.39,0.0(0 ratings),Marketing,Fundamentos de marketing,Marketing por correo electrÃ³nico,1,EspaÃ±ol,Descubre el proceso completo para enviar campaÃ±as de emails efectivas,4/2018,12/31/19
Email Marketing para Emprendedores,www.udemy.com/course/email-marketing-para-emprendedores/,Martin Torres Mtz,74.99,11.39,4.0(5 ratings),Marketing,Digital Marketing,Email Marketing,250,Spanish,Aprende Email Marketing para Implementar en tu Negocio o Emprendimiento,6/2019,12/31/19
Cómo usar Getresponse desde cero,www.udemy.com/course/como-usar-getresponse-desde-cero/,Robert Chappa,29.99,11.39,4.4(5 ratings),Marketing,Marketing de afiliados,Marketing por correo electrÃ³nico,10,EspaÃ±ol,Aprende de la a la z todo sobre Getresponse,3/2018,12/31/19
Curso Completo de E-mail Marketing,www.udemy.com/course/curso-completo-de-e-mail-marketing/,Rodrigo da Silva Gonçalves,0.0,169.99,5.0(2 ratings),Marketing,Marketing digital,Marketing por e-mail,5,PortuguÃªs,Aprenda todos os aspectos importantes do e-mail marketing e crie campanhas e estratÃ©gias de sucesso!,5/2019,12/31/19
Email marketing para empresas y negocios,www.udemy.com/course/curso-email-marketing/,Jose Luis Moreno Jimenez,0.0,69.99,4.8(2 ratings),Marketing,Other,Email Marketing,8,Spanish,Aprende como generar y optimizar los emails/boletines de tu empresa o negocio,6/2019,12/31/19
Emails fast kostenlos versenden | mit Sendy & Amazon,www.udemy.com/course/emails-gunstiger-versenden-mit-sendy-und-amazon-webservices/,Aljoscha Laschgari,19.99,11.39,4.2(7 ratings),IT & Software,Sonstiges,E-Mail-Marketing,94,Deutsch,"Eine Schritt-fuer-Schritt-Anleitung, wie Du Dich unabhaengig von externen Anbietern machst & 100x guenstiger versendest",12/2014,12/31/19
Newsletter e email marketing: partire con il piede giusto,www.udemy.com/course/newsletter-e-email-marketing-partire-con-il-piede-giusto/,Teacher-in-a-Box | Videocorsi Professionali,0.0,69.99,3.8(6 ratings),Marketing,Marketing digitale,Marketing tramite newsletter,35,Italiano,Matteo Masciotti,3/2018,12/31/19
Email Marketing 360 Mastery Course (in Hindi) By DMPI,www.udemy.com/course/email-marketing-360-mastery-course-in-hindi-by-dmpi/,GAURAV KUMAR,0.0,19.99,0.0(0 ratings),Marketing,Digital Marketing,Email Marketing,0,Hindi,Become An Email Marketing Expert,4/2019,12/31/19
"E-mail marketing: Cliente Fiel, melhorando  resultados",www.udemy.com/course/cliente-fiel/,Jonas Ferreira,49.99,11.39,3.8(8 ratings),Marketing,Marketing digital,Marketing por e-mail,227,PortuguÃªs,Quantas pessoas visitam seu site cada dia? E quantas delas deixam o nome e e-mail para contato? 1 e-mail = 1 consumidor,8/2013,12/31/19
Email Marketing Strategie Relance Mailchimp,www.udemy.com/course/email-marketing-strategie-relance-mailchimp/,Rene Major,49.99,11.39,0.0(0 ratings),Marketing,Marketing numÃ©rique,Marketing par e-mail,1,FranÃ§ais,Triplez Vos Ventes !,8/2019,12/31/19
Maîtrisez SG Autorépondeur Comme un PRO,www.udemy.com/course/sg-autorepondeur-pour-les-nuls/,Virgile SOLO Marketing,19.99,11.39,3.3(32 ratings),Marketing,Analyses et automatisation,Marketing par e-mail,581,FranÃ§ais,Apprenez Facilement Ã  Utiliser SG AutorÃ©pondeur et lancer votre business,12/2018,12/31/19
Cómo crear tu lista de contactos totalmente desde cero,www.udemy.com/course/como-crear-tu-lista-de-contactos-totalmente-desde-cero/,Sorin Predescu,0.0,19.99,4.5(9 ratings),Negocios,ComunicaciÃ³n,Marketing en Facebook,374,EspaÃ±ol,Aprender a crear una lista de contactos paso a paso sin ningÃºn conocimiento previo.,6/2017,12/31/19
Curso Autoresponder Gratuito 2.0,www.udemy.com/course/curso-autoresponder-gratuito-20/,WILKER COSTA,39.99,11.39,5.0(1 rating),Marketing,Marketing digital,Marketing por e-mail,2,PortuguÃªs,Curso completo para iniciantes que desejam utilizar a estratÃ©gia de e-mail marketing.,2/2019,12/31/19
E-Mail Marketing Sırları 2019: İstediğiniz E-Maile ulaşın.,www.udemy.com/course/e-mail-marketing-sirlari-2019-istediginiz-e-maile-ulasin/,Samet Metin Karaman,0.0,Free,5.0(8 ratings),Pazarlama,Dijital Pazarlama,E-posta PazarlamacÄ±lÄ±ÄÄ±,870,TÃ¼rkÃ§e,"AradÄ±ÄÄ±z kiÅilerin, firmalarÄ±n e-maillerini toplu yada bireysel olarak kolayca bulun ve e-mail gÃ¶nderin.",10/2019,12/31/19
ايميل ماركيتنج اكسيلانسى,www.udemy.com/course/email-marketing-excellence-with-mesbah-mahfouz/,Mesbah mahfouz elmetwally,0.0,Free,4.8(14 ratings),Marketing,Product Marketing,Email Marketing,459,Arabic,ÙØªØ¬ÙØ¨ ÙÙ Ø§ÙØ§Ø®Ø± ÙØ¹ ÙØµØ¨Ø§Ø­ ÙØ­ÙÙØ¸,12/2019,12/31/19
Autoresponder Gratis,www.udemy.com/course/curso-autoresponder-gratis/,Ricardo Aguiar,0.0,Free,4.5(18 ratings),Marketing,Marketing de afiliados,Marketing por e-mail,1.588,PortuguÃªs,Seu Negocio Totalmente no Automatico,6/2019,12/31/19
ايميل ماركيتنج اكسيلانسى,www.udemy.com/course/email-marketing-excellence-with-mesbah-mahfouz/,Mesbah mahfouz elmetwally,0.0,Free,4.8(14 ratings),Marketing,Product Marketing,Email Marketing,459,Arabic,ÙØªØ¬ÙØ¨ ÙÙ Ø§ÙØ§Ø®Ø± ÙØ¹ ÙØµØ¨Ø§Ø­ ÙØ­ÙÙØ¸,12/2019,12/31/19
Curso como crear tu MAIL CON DOMINIO PROPIO GRATIS!,www.udemy.com/course/crear-correo-con-dominio-propio/,Marcos Guerrini,0.0,Free,4.6(108 ratings),Productividad en la oficina,Otros,Marketing por correo electrÃ³nico,2.317,EspaÃ±ol,En este curso te enseÃ±arÃ© a crear desde cero hasta 1000 cuentas de correo con almacenamiento ilimitado GRATIS en YANDEX,9/2019,12/31/19
Email Marketing para Iniciantes,www.udemy.com/course/email-marketing-para-iniciantes/,Acerola Digital,0.0,Free,3.6(174 ratings),Marketing,Marketing digital,Marketing por e-mail,5.056,PortuguÃªs,Aprenda o passo a passo sobre como utilizar o Email Marketing para ter mais sucesso no seu negÃ³cio pela internet...,4/2015,12/31/19
이메일 마케팅 방법 입문 by Activecampaign,www.udemy.com/course/email-marketing-basic-by-activecampaign/,Growth Hacker,0.0,Free,4.6(3 ratings),ë§ì¼í,ëì§í¸ ë§ì¼í,ì´ë©ì¼ ë§ì¼í,206ëªì,íêµ­ì´,ì´ë©ì¼ ë§ì¼íì ì²ì ììíë ë¶ë¤ì´ ì½ê³  ë¹ ë¥´ê² ììí ì ììµëë¤.,ìë°ì´í¸ë¨,12/31/19
明日、会社を辞めても「食える人」になるメルマガ運営方法,www.udemy.com/course/mail-magazine/,石崎力也 (RIKIYA ISHIZAKI),0.0,Free,4.8(41 ratings),ãã¼ã±ãã£ã³ã°,ã½ã¼ã·ã£ã«ã¡ãã£ã¢ãã¼ã±ãã£ã³ã°,ã¡ã¼ã«ãã¼ã±ãã£ã³ã°,673äººã®åè¬çãç»é²,æ¥æ¬èª,"äººéé¢ä¿ã®é¢åãª""ã·ã³ãã¤""ä¼ç¤¾å¡ã«è¦åããä»ãã¦ç¬ç«ã»èµ·æ¥­ãããã¨ããäººã¯æ°å¤ããã¾ããã§ãææ¥ãä¼ç¤¾ãè¾ããã¨ããã§ãå®¢ãããæ¥ãªãã£ãããå£²ä¸ã¯ç«ã¡ã¾ããããã®ã³ã¼ã¹ã§ã¯ãããªå°æ¥ã®èµ·æ¥­å®¶ã«ã¡ã«ãã¬éå¶ã®ããã³ã·ã£ã«ããä¼ããã¾ãã",1/2019,12/31/19
E-Mail Marketing mit Newsletter2Go für Einsteiger und Profis,www.udemy.com/course/e-mail-marketing-mit-newsletter2go-fuer-einsteiger-und-profis/,Newsletter2Go GmbH,0.0,Free,4.5(1 rating),IT & Software,Sonstiges,E-Mail-Marketing,403,Deutsch,Newsletter2Go von A bis Z fÃ¼r professionelles E-Mail Marketing,7/2019,12/31/19
Crea y envía campañas de Email marketing e Email Masivo,www.udemy.com/course/curso-basico-de-email-marketing-con-mailchimp/,Camilo Barbosa TV,0.0,Free,4.2(740 ratings),Marketing,Marketing digital,Marketing por correo electrÃ³nico,11.840,EspaÃ±ol,"DiseÃ±a, crea, envÃ­a y analiza campaÃ±as de Email marketing",8/2017,12/31/19
Primeros pasos en email marketing y automation con E-goi,www.udemy.com/course/primeros-pasos-en-e-goi/,Plataforma E-goi,0.0,Free,4.5(374 ratings),Marketing,Marketing digital,Marketing por correo electrÃ³nico,6.430,EspaÃ±ol,GuÃ­a en vÃ­deo con los primeros pasos en la herramienta E-goi para crear fÃ¡cilmente tus campaÃ±as de marketing relacional.,1/2019,12/31/19
Curso de Email Marketing com Nitronews v2,www.udemy.com/course/curso-de-email-marketing-com-nitronews/,Nitronews - Email Marketing,0.0,Free,4.1(89 ratings),Marketing,Marketing digital,Marketing por e-mail,2.299,PortuguÃªs,O curso de email marketing da Nitronews possui tudo que vocÃª necessita para crescer com sua empresa!,8/2019,12/31/19
Email marketing pour les débutants,www.udemy.com/course/email-marketing-pour-les-debutants/,Arnaud LAMANDÉ,0.0,Free,3.4(8 ratings),Marketing,Principes de base du marketing,Marketing par e-mail,471,FranÃ§ais,"Apprenez les bases de l'emailing pour dÃ©velopper votre entreprise
 ",9/2019,12/31/19
ゼロから始めるメルマガ作成初級講座,www.udemy.com/course/merumaga/,佐藤 正一,0.0,Free,4.7(11 ratings),ãã¼ã±ãã£ã³ã°,ãã¸ã¿ã«ãã¼ã±ãã£ã³ã°,ã¡ã¼ã«ãã¼ã±ãã£ã³ã°,179äººã®åè¬çãç»é²,æ¥æ¬èª,Facebookãã¢ã¡ãã­ Twitterããã¾ããã¸ãã¹ã«æ´»ç¨ã§ãã¦ããªãããªãã¸ããããéå®¢ã§ã®å£²ä¸ã«ç´çµãã ã¡ã«ãã¬ã®å§ãæ¹ã»éãæ¹ã»ä½¿ãæ¹ãå°ããªä¼ç¤¾ã®å¶æ¥­è¡,3/2016,12/31/19
Email Marketing O GUIA COMPLETO 2018 - Do zero a 1º venda,www.udemy.com/course/e-mail-marketing-completo-2018-do-zero-a-1o-venda/,Andre Silva,0.0,Free,4.3(284 ratings),Marketing,Marketing digital,Marketing por e-mail,5.904,PortuguÃªs,Aprenda agora 2 estratÃ©gias infalÃ­veis de marketing digital para vender todo dia atravÃ©s do mÃ©todo ARV por e-mail.,9/2018,12/31/19
