Course,URL,instructor,Price (full),Price (discount),Rank,Category 1,Category 2,Category 3,Enrollment,Language,Description,Last Update,Date Scraped
Email Marketing using GetResponse - Your Step-By-Step Guide,www.udemy.com/course/email-marketing-using-getresponse-your-step-by-step-guide/,Neeraj Jaiswal,19.99,11.39,3.8(42 ratings),Marketing,Digital Marketing,Email Marketing,"10,079",English,Learn how to use GetResponse to manage and automate your Email Marketing,7/2015,12/31/19
"Email marketing for small business - more sales, less effort",www.udemy.com/course/email-marketing-for-small-business-more-sales-less-effort/,Allan Ward,19.99,11.39,5.0(1 rating),Marketing,Digital Marketing,Email Marketing,"1,465",English,Learn how to use email marketing to grow your business and generate more sales from your customers and prospects.,2/2015,12/31/19
Build a Sales Funnel from Scratch: Email Marketing with Wix,www.udemy.com/course/build-a-sales-funnel-from-scratch-email-marketing-with-wix/,Casey Chan,29.99,11.99,3.9(14 ratings),Business,Entrepreneurship,Email Marketing,49,English,Get started with E-mail marketing with this free solution!,8/2017,12/31/19
How to Start Your Money Making Email List,www.udemy.com/course/how-to-start-your-money-making-email-list/,Wenda O'Neill,79.99,11.99,4.5(1 rating),Marketing,Content Marketing,Email Marketing,601,English,Learn how to create your own Sales Funnel with this Step by Step Course,10/2018,12/31/19
How To Stay at Luxury Hotels For Free!,www.udemy.com/course/how-to-stay-at-luxury-hotels-for-free/,Holp Mike,99.99,11.99,5.0(1 rating),Marketing,Digital Marketing,Email Marketing,5,English,Learn how to use lead generation and email marketing to stay at luxury hotels around the world for free!,4/2019,12/31/19
Email Marketing GetResponse Beginners,www.udemy.com/course/email-marketing-getresponse-beginners/,Jader Tormen,19.99,11.99,5.0(2 ratings),Marketing,Digital Marketing,Email Marketing,3,English,Discover how to set up your Email autoresponder GetResponse so you can create an email list and make sales automatically,4/2018,12/31/19
Affordable Email Marketing Automation with MailerLite,www.udemy.com/course/email-marketing-automation-with-mailerlite/,Donald Latumahina,74.99,11.99,0.0(0 ratings),Marketing,Analytics & Automation,Automation,11,English,Grow your business with email marketing automation that won't break the bank,6/2017,12/31/19
The Business Building Email Formula to Launch Your Startup,www.udemy.com/course/launch-your-startup/,Bob Marx,199.99,11.99,4.3(32 ratings),Business,Entrepreneurship,Email Marketing,"7,342",English,Start Building your Business by selling and prospecting with this email sales formula for Entrepreneurs.,7/2015,12/31/19
Solopreneur success guide: #3 email list & affiliate plan,www.udemy.com/course/solopreneur-success-guide-3-email-list-affiliate-plan/,Creatives Academy,124.99,11.99,3.0(1 rating),Business,Entrepreneurship,Email Marketing,260,English,How to grow your email list with fun and ease! and become a successful affiliate marketer,10/2018,12/31/19
Passive Income from Targeted Lead Generation & Email,www.udemy.com/course/newemailmarketing/,Paul Tilley,199.99,11.99,5.0(1 rating),Marketing,Digital Marketing,Email Marketing,34,English,Free Email Web Scraping Strategy for White Hat Marketers,6/2019,12/31/19
Email Etiquette: How to Write Professionally in Business,www.udemy.com/course/email-etiquette-back-to-basics-with-professional-emails/,Zach Miller,19.99,11.99,3.9(42 ratings),Business,Communications,Etiquette,"8,373",English,"Learn the business basics. The etiquettes of communication increase online sales, marketing flow & customer management.",9/2019,12/31/19
Email Marketing For Affiliate Marketers,www.udemy.com/course/email-marketing-for-affiliate-marketers/,IMSource Academy,44.99,11.99,4.2(49 ratings),Marketing,Advertising,Email Marketing,"10,026",English,How To Build A True Push Button Online ATM And Run It From Anywhere In The World,9/2016,12/31/19
How you can increase your bookings with email marketing,www.udemy.com/course/how-you-can-increase-your-bookings-with-email-marketing/,Mark Simpson,19.99,11.99,0.0(0 ratings),Marketing,Other,Email Marketing,2,English,Email Marketing to Increase Direct Bookings,10/2019,12/31/19
Email Marketing:  Using an Online Newsletter Effectively,www.udemy.com/course/email-marketing-using-an-online-newsletter-effectively/,Riley Weller,74.99,11.99,0.0(0 ratings),Marketing,Digital Marketing,Email Etiquette,5,English,"Learn to Target and Group Subscribers, Set Up Automation, and Test for Results in Your Email Marketing Endeavors.",2/2019,12/31/19
"Email Marketing: DOUBLE Your List, Traffic & Clickbank Sales",www.udemy.com/course/double-your-subscriber-list-and-make-money-on-autopilot/,Tim Ernst,94.99,11.99,4.3(11 ratings),Marketing,Digital Marketing,Email Marketing,"1,261",English,Learn My Secret System That Gives Me Financial Freedom Using The Power of Email Marketing to Sell Clickbank Products,6/2017,12/31/19
Email Marketing: Learn Email Marketing That Drives Revenue,www.udemy.com/course/a-z-email-marketing-click-send-profit/,Barry North,89.99,11.99,3.4(36 ratings),Marketing,Marketing Fundamentals,Email Marketing,"5,889",English,Learn why you would want to use email marketing and why it's one of the best marketing options.,2/2017,12/31/19
We Write an Email Drip Sequence,www.udemy.com/course/write-an-email-drip-sequence/,Shaun Keating,29.99,11.99,0.0(0 ratings),Marketing,Content Marketing,Email Marketing,3,English,"In this We Write email writing class, youâll learn how to write an email drip sequence.",7/2019,12/31/19
More Time More Sales: Effective Email Management,www.udemy.com/course/more-time-more-sales-effective-email-management/,Ray Hollinger,39.99,11.99,3.7(3 ratings),Business,Sales,Sales Skills,70,English,Our one hour crash course in taking control of how you manage and process your email.,2/2015,12/31/19
Email Marketing: Build A Profitable Business From Scratch,www.udemy.com/course/email-marketing-build-a-profitable-business-from-scratch/,Daniel Martinez,19.99,11.39,3.8(15 ratings),Marketing,Digital Marketing,Email Marketing,"2,282",English,"IF YOU ARE NEW TO EMAIL MARKETING, YOU MUST TAKE THIS COURSE! Learn EVERYTHING you need, starting from the basics.",3/2018,12/31/19
Virtual Assistant training,www.udemy.com/course/professional-virtual-assistant-training/,Cory Nielsen,0.0,19.99,0.0(0 ratings),Business,Real Estate,Email Marketing,208,English,Learn how to become a profession Virtual assistant when it comes to cold outreach,10/2019,12/31/19
22 Weird Tricks To Get Your Emails Opened,www.udemy.com/course/22-weird-tricks-to-get-your-emails-opened/,James Canzanella,199.99,11.39,4.3(13 ratings),Marketing,Digital Marketing,Email Marketing,"1,918",English,22 Weird And Out Of The Box Tricks To Stick Out In Your Subscribers Inbox Like A Sore Thumb,6/2016,12/31/19
How to Create a Brilliant Newsletter People Want to Read?,www.udemy.com/course/create_newsletters/,Yariv Gai,19.99,11.39,3.4(4 ratings),Marketing,Content Marketing,Email Marketing,"1,451",English,Create Newsletters,3/2019,12/31/19
"Email Marketing Build A 10,000 Subscribers List In Any Niche",www.udemy.com/course/build-200-subscribers-in-24-hours-in-any-niche-possible/,Scrembo Paul,19.99,11.39,3.3(22 ratings),Marketing,Other,Email Marketing,"3,803",English,"How To Build A 10,000 Subscribers List In Any Niche in 24 h course you will learn how to get high quality subscribers",5/2015,12/31/19
The Entrepreneur's Guide to Email Marketing & Mailchimp,www.udemy.com/course/the-entrepreneurs-guide-to-email-marketing/,Sara Graham,0.0,54.99,5.0(2 ratings),Marketing,Branding,Email Marketing,11,English,"How to create branded email campaigns that engage your target customers to open, read and click!",12/2018,12/31/19
Email Development for Email Marketing and Enthusiasts,www.udemy.com/course/edemecourse/,Eugene Fedorenko,44.99,11.39,3.7(4 ratings),Development,Web Development,Email Marketing,12,English,Learn email coding basics as a part of the whole email creation process,10/2018,12/31/19
Basic concepts of email marketing,www.udemy.com/course/basic-concepts-of-email-marketing/,Narayanan Hariharan,49.99,11.39,0.0(0 ratings),IT & Software,Other,Email Marketing,3,English,This course contains basics to intermediate concepts of email marketing,2/2019,12/31/19
The Complete Beginners Guide To Building An Email List,www.udemy.com/course/the-complete-beginners-guide-to-building-an-email-list/,IMSource Academy,74.99,11.39,4.4(18 ratings),Marketing,Marketing Fundamentals,Email Marketing,"5,040",English,The step-by-step dead simple guide to building the most valuable asset in your online business,7/2016,12/31/19
Email Marketing Tips [From Beginner to Advanced],www.udemy.com/course/email-marketing-tips-from-beginner-to-advanced/,Invert Media,199.99,11.39,4.2(49 ratings),Marketing,Digital Marketing,Email Marketing,"10,799",English,"Landing Pages, Email Autoresponders, Mass Emailing, Building Email Lists, & Much Much More!",9/2019,12/31/19
Email Marketing - Amateur To Professional,www.udemy.com/course/email-marketing-basics-making-money-from-email-marketing/,Cyril Gupta,109.99,11.39,4.0(30 ratings),Marketing,Digital Marketing,Email Marketing,"4,120",English,Tips & Tricks to make you a better email marketer,8/2018,12/31/19
Email Marketing Deliverability 2017,www.udemy.com/course/email-marketing-deliverability-2014/,Mitrache Adrian,19.99,11.39,4.0(13 ratings),Marketing,Digital Marketing,Email Marketing,483,English,The complete email marketing deliverability guide for 2017,1/2015,12/31/19
Boost Your Business With Email Marketing Secrets,www.udemy.com/course/boost-your-business-with-email-marketing-secrets/,Daniele Protti,79.99,11.39,4.3(2 ratings),Marketing,Digital Marketing,Email Marketing,50,English,"Learn how to create compelling email marketing messages, setup an autoresponder, create optin forms, build email lists",7/2016,12/31/19
Email Marketing  - Build a Powerful List of Hungry Buyers,www.udemy.com/course/email-marketing-build-a-powerful-list-of-hungry-buyers/,Chris Douthit,194.99,11.39,4.3(17 ratings),Marketing,Digital Marketing,Email Marketing,583,English,Let me show you how to get hundreds of opt-ins daily then monitorize those members into weekly cash payouts.,5/2015,12/31/19
Easy & Effective Email Marketing With AWeber,www.udemy.com/course/email-marketing-made-easy-with-aweber2/,MindMekka ®,99.99,11.39,3.9(18 ratings),Marketing,Digital Marketing,Email Marketing,"5,504",English,Learn how to build your email list and harness the power of email marketing to propel your business towards success,10/2018,12/31/19
Email Marketing for All Levels: Set Up Email Campaigns,www.udemy.com/course/email-marketing-for-all-levels-set-up-email-campaigns/,Carl Taylor,64.99,11.39,4.2(7 ratings),Marketing,Digital Marketing,Email Marketing,"1,439",English,A step-by-step guide to writing your own successful email campaigns.,1/2015,12/31/19
Email Marketing Kickstart,www.udemy.com/course/email-marketing-kickstart/,Brian McLeod,49.99,11.39,3.7(8 ratings),Marketing,Digital Marketing,Email Marketing,523,English,"The Easiest, Friendliest, Funnest Email Marketing Training Ever!",10/2013,12/31/19
How to Extract Thousands of Emails with Search Engines,www.udemy.com/course/how-to-extract-thousands-of-emails-with-search-engines/,Denis Kino,24.99,11.39,4.0(33 ratings),Marketing,Search Engine Optimization,Email Marketing,"1,505",English,"Learn the art of being able to extract emails for any niche, keyword or location. All this with Search Engines.",3/2017,12/31/19
The Email Marketing Passive Income Blueprint,www.udemy.com/course/the-email-marketing-passive-income-blueprint/,Javier Gamero,199.99,11.39,3.5(10 ratings),Business,Home Business,Email Marketing,"2,468",English,Learn how to build simple email marketing sales funnels that can generate passive income.,5/2018,12/31/19
Email Marketing Using Google+ No Need For Emails,www.udemy.com/course/email-marketing-using-google-plus/,Remon Samry Dawoud,19.99,11.39,4.5(13 ratings),Marketing,Digital Marketing,Email Marketing,774,English,"""Want more sales? Why not generate an Email Campaign using Google Plus? No need for emails!""",7/2015,12/31/19
How to write your own successful Email Marketing Strategy ,www.udemy.com/course/emailstrategy/,Nadee Guy,134.99,11.39,4.1(26 ratings),Marketing,Digital Marketing,Email Marketing,133,English,"Use industry best practices to create, manage & continually improve a strategy to get the best from your email marketing",1/2017,12/31/19
Email Marketing For Bloggers - Easy Beginners Edition,www.udemy.com/course/emailmarketingforbloggers/,Michael Brown,49.99,11.39,3.8(2 ratings),Marketing,Digital Marketing,Email Marketing,157,English,"Learn with ease, exactly how to have your very first profitable email list setup for your blog, with no coding, today!",7/2013,12/31/19
Email Marketing - Total Mastery,www.udemy.com/course/email-marketing-total-mastery/,Cyril Gupta,64.99,11.39,4.3(6 ratings),Marketing,Digital Marketing,Email Marketing,138,English,From 0 To Profitable Email Marketing,9/2018,12/31/19
Email Marketing,www.udemy.com/course/email-marketing-/,Antoine Airoldi,19.99,11.39,5.0(1 rating),Marketing,Content Marketing,Email Marketing,4,English,Learn The Basics From The Expert,8/2018,12/31/19
Email Marketing 2018: Create a Custom Business Email Address,www.udemy.com/course/business-email-setup/,Stephen McKinney,19.99,11.39,4.2(31 ratings),Business,Entrepreneurship,Email Marketing,"2,461",English,Set up a Business Email with up to 50 users under your own domain. No monthly subscription.,1/2018,12/31/19
Email marketing basics for entrepreneurs,www.udemy.com/course/email-marketing-basics-for-entrepreneurs/,Creatives Academy,124.99,11.39,4.4(9 ratings),Marketing,Marketing Fundamentals,Email Marketing,738,English,The complete beginners guide to understand email marketing and use like a boss from day 1!,10/2018,12/31/19
Email Marketing Basics,www.udemy.com/course/email-marketing-for-beginners/,Andrea Becker,24.99,11.39,0.0(0 ratings),Marketing,Digital Marketing,Email Marketing,7,English,Learn fundamentals of email marketing,11/2017,12/31/19
How to Build an Email List without a Website,www.udemy.com/course/how-to-build-an-email-list-without-a-website/,Montina Young Portis,19.99,11.39,3.7(7 ratings),Marketing,Digital Marketing,Email Marketing,60,English,Email marketing is the BEST way to communicate with prospects. This step-by-step Beginner's Class will show you how.,11/2013,12/31/19
Email Marketing Made Simple,www.udemy.com/course/email-marketing-made-simple/,Ronnie Rokk Smith,74.99,11.39,4.6(3 ratings),Marketing,Marketing Fundamentals,Email Marketing,13,English,Learn the Basics & Fundamentals and Advanced Techniques of Email Marketing,3/2017,12/31/19
"Simple Cold Emailing, for Effective Professionals",www.udemy.com/course/simple-cold-emailing/,Roger Garza,19.99,11.39,5.0(1 rating),Marketing,Digital Marketing,Email Marketing,2,English,How to properly use cold emailing to increase sales,10/2019,12/31/19
Complete Email Marketing Solution Course - The Way (2020),www.udemy.com/course/complete-email-marketing-solution-course-the-way-2019/,Glory Omoye,49.99,11.39,0.0(0 ratings),Marketing,Digital Marketing,Email Marketing,1,English,Step-By-Step Videos showing how to have successful Email Campaigns with a great Inbox Delivery: Beginner to Advanced,5/2019,12/31/19
Email Marketing Basics: A Step-by-Step Beginner's Guide,www.udemy.com/course/email-marketing-basics-a-step-by-step-beginners-guide/,Sorin Constantin,94.99,11.39,3.9(34 ratings),Marketing,Digital Marketing,Email Marketing,"3,967",English,Learn how to build your first emil list and setup a basic email marketing strategy for your business.,11/2017,12/31/19
Email Marketing Using Aweber to Build Your List,www.udemy.com/course/email-marketing-pro/,Lisa Newton,34.99,11.39,4.2(2 ratings),Marketing,Digital Marketing,Email Marketing,22,English,"Create professional email campaigns, grow your list and build your business",7/2017,12/31/19
MailMUNCH Tutorial  for beginners -Free Mailmunch Tutorial,www.udemy.com/course/capturing-leads-with-mailmunch-on-your-website/,Ricky Wahowa,29.99,11.39,3.9(6 ratings),Marketing,Digital Marketing,Email Marketing,"1,263",English,"A Mailmunch Tutorial that will teach you how to collect leads, Create Newsletters and Landing Pages",5/2018,12/31/19
Email Marketing: How To Master MailChimp In 3 Hours,www.udemy.com/course/mailchimp-email-marketing-masterclass-become-an-email-marketing-expert/,Nick Walsh,19.99,11.39,2.8(33 ratings),Marketing,Digital Marketing,Mailchimp,"2,686",English,"MailChimp Insights: Grow An Email List, Automation Secrets, Facebook Ad Set Up, Email Campaigns, Made Easy & Fast",3/2018,12/31/19
Create An Automatic Email Lead Magnet,www.udemy.com/course/email-lead-magnet/,BlackBrick ©️,199.99,11.99,3.9(30 ratings),Marketing,Content Marketing,Email Marketing,"9,872",English,Create An Automatic Email Lead Magnet Which Will Grow Your Email List For You.,8/2018,12/31/19
10 Cool Ways To Get More Action From Your Marketing Emails,www.udemy.com/course/10-cool-ways-to-get-more-action-from-your-marketing-emails/,Mike DeVincent,194.99,11.39,4.2(12 ratings),Marketing,Content Marketing,Email Marketing,"2,579",English,"How To Squeeze As Much Value, Traffic, And Action From Your Current Email Subscribers While Still Being Totally Cool",10/2016,12/31/19
Email Marketing Mastermind: Build Your List & Grow Sales,www.udemy.com/course/digital-email-marketing-mastermind-course/,Andrew P.C.,199.99,11.39,0.0(0 ratings),Marketing,Digital Marketing,Email Marketing,"1,039",English,"Grow your email list fast, build a cult following, increase conversion rates, and multiply sales and profits.",4/2019,12/31/19
Email Marketing Basics,www.udemy.com/course/email-marketing-basic/,BlackBrick ©️,154.99,11.39,3.7(29 ratings),Marketing,Content Marketing,Email Marketing,"6,039",English,Learn the basics of email marketing,7/2019,12/31/19
Make Fans Feel Special - Email Lists for Musicians,www.udemy.com/course/make-fans-feel-special/,Clarence Charron,59.99,11.39,4.0(1 rating),Marketing,Digital Marketing,Email Marketing,3,English,How independent artists and creatives can build an authentic and loyal fanbase through their email list.,3/2019,12/31/19
"Getting Started with Email Marketing - Click, Send & Profit",www.udemy.com/course/getting-started-with-email-marketing-click-send-profit/,Alex Babenkof,19.99,11.39,0.0(0 ratings),Marketing,Other,Email Marketing,2,English,The Beginner's Guide to Engaging Email Marketing,5/2017,12/31/19
How to open a trial account for GSuite and FREE one at Zoho,www.udemy.com/course/how-to-create-free-custom-business-email-id/,Tech Academy,19.99,11.39,4.3(10 ratings),Marketing,Digital Marketing,Email Marketing,"1,041",English,Show you're in business and look professional with custom email at your company domain.,9/2019,12/31/19
Beginners Toolbox for Email Marketing,www.udemy.com/course/beginners-toolbox-for-email-marketing/,Tom Wiztek,19.99,11.39,3.9(7 ratings),Marketing,Digital Marketing,Email Marketing,717,English,How to start list building and using Autoresponders,4/2016,12/31/19
Ultimate E-mail List Building Course without Ads,www.udemy.com/course/ultimate-email-list-building-course-without-ads/,Ummu Salma,49.99,11.39,2.9(2 ratings),Marketing,Growth Hacking,Email Marketing,23,English,How to grow your e-mail list by 500+ in a week or two without Ads,1/2018,12/31/19
Make profit from your Email list,www.udemy.com/course/make-profit-from-your-email-list/,Laor Kael Heliraz,34.99,11.39,3.3(3 ratings),Marketing,Digital Marketing,Email Marketing,"1,194",English,Learn how to treat them nice -create sales on demand,1/2018,12/31/19
Email Marketing Masterclass,www.udemy.com/course/email-marketing-2014-grow-your-list-get-steady-traffic/,Sorin Amzu,19.99,11.39,2.0(1 rating),Marketing,Digital Marketing,Email Marketing,232,English,"Practical, actionable tactics to quickly increase your subscriber list and create emails they love to open",6/2014,12/31/19
E-mail Marketing Basics for Bloggers,www.udemy.com/course/email-marketing-for-bloggers/,Gertrude Nonterah,24.99,11.39,4.4(2 ratings),Marketing,Digital Marketing,Email Marketing,66,English,An easy-to-follow guide on how to build AND nurture an e-mail list from scratch especially for bloggers,6/2015,12/31/19
How My Email Marketing Performs 133 Times Above Competitors,www.udemy.com/course/business-relationships-via-email-marketing/,Nazir Tan Amir,19.99,11.39,3.9(14 ratings),Marketing,Digital Marketing,Email Marketing,759,English,"Learn why the emails I craft get opened, read and clicked...resulting in repeat sales and improved credibility",12/2014,12/31/19
Email Marketing & Automation: From Zero to Hero,www.udemy.com/course/email-marketing-automation/,Nitin Vishwakarma,19.99,11.39,3.3(2 ratings),Marketing,Digital Marketing,Email Marketing,9,English,Email Marketing is the future of Marketing Automation,3/2018,12/31/19
How My Email Marketing Performs 133 Times Above Competitors,www.udemy.com/course/business-relationships-via-email-marketing/,Nazir Tan Amir,19.99,11.39,3.9(14 ratings),Marketing,Digital Marketing,Email Marketing,759,English,"Learn why the emails I craft get opened, read and clicked...resulting in repeat sales and improved credibility",12/2014,12/31/19
Email Marketing For Artists,www.udemy.com/course/email-marketing-for-artists/,Melanie Greenwood,24.99,11.39,0.0(0 ratings),Marketing,Digital Marketing,Email Marketing,1,English,Learn how to promote your art products or services to potential customers via email marketing,10/2019,12/31/19
25 Mistakes You Make in Email Marketing & How To Fix Them,www.udemy.com/course/email-marketing-mistakes/,Anastasia Dedyukhina,0.0,39.99,4.5(15 ratings),Marketing,Digital Marketing,Email Marketing,65,English,Learn to send emails people love in an age of digital distraction,4/2017,12/31/19
Email Marketing - Marketing Automation & Drip Marketing,www.udemy.com/course/email-marketing-marketing-automation-drip-marketing/,Jayant Nandan,69.99,11.39,0.0(0 ratings),Marketing,Digital Marketing,Email Marketing,0,English,Learn Email Marketing using Mailchimp,12/2019,12/31/19
Email Marketing: The Best List Building Strategy For Success,www.udemy.com/course/email-marketing-the-best-list-building-strategy-for-success/,Obehi Ewanfoh - Aclasses,24.99,11.39,0.0(0 ratings),Marketing,Marketing Fundamentals,Email Marketing,"1,678",English,Learn The Email Strategy That Works,5/2019,12/31/19
How to Use MailChimp Email Marketing Software - Hands on!,www.udemy.com/course/how-to-use-mailchimp-email-marketing-software-hands-on/,Charlie Craine,19.99,11.39,3.0(181 ratings),Marketing,Digital Marketing,Email Marketing,"5,618",English,MailChimp for Beginners: From Zero to Building Your First Email Marketing Campaign,4/2016,12/31/19
Fashion Business Email Marketing Strategies,www.udemy.com/course/fashion-business-email-marketing-strategies/,Marina Vaskina,0.0,69.99,0.0(0 ratings),Marketing,Digital Marketing,Email Marketing,0,English,Master your email marketing to gain more sales!,1/2018,12/31/19
Email Marketing Domination,www.udemy.com/course/email-marketing-domination/,Ken Walker,19.99,11.39,4.6(3 ratings),Marketing,Marketing Fundamentals,Email Marketing,13,English,Tapping Into The Goldmine In Your Own Backyard,8/2017,12/31/19
First Steps in Email Marketing,www.udemy.com/course/email-marketing-crash-course/,iMarketer School LONDON,59.99,11.39,4.4(33 ratings),Marketing,Digital Marketing,Email Marketing,"6,651",English,"Learn email marketing as it is one of the inexpensive, reliable and powerful channels to online marketing.",4/2019,12/31/19
Never Get Hacked Again PROTECTION AGAINST SPAM CERTIFICATION,www.udemy.com/course/never-get-hacked-again-protection-against-spam-certification/,Alou TRAORE,19.99,11.39,0.0(0 ratings),IT & Software,IT Certification,Email Marketing,0,English,Protect your email accounts,12/2019,12/31/19
2018 - Build Targeted Mailing List Today Without a Website,www.udemy.com/course/build-targeted-mailing-list-today-with-no-website-no-opt-in/,Winston Wee,49.99,11.39,3.6(51 ratings),Marketing,Digital Marketing,Email Marketing,"2,764",English,"No Opt In, No Website, Build 1000 targeted Email leads Today. Or supercharge your existing list by another 10000 leads",4/2018,12/31/19
Profitable Email Marketing,www.udemy.com/course/profitable-email-marketing/,Profit Copilot,19.99,11.39,0.0(0 ratings),Marketing,Affiliate Marketing,Copywriting,2,English,Copy me and boost conversions,5/2019,12/31/19
Email Marketing:Build 6588 Buyers Subscribers For FREE,www.udemy.com/course/how-i-built-a-list-of-6588-buyers-subscribers-for-free/,Scrembo Paul,19.99,11.39,3.6(18 ratings),Marketing,Digital Marketing,Email Marketing,"4,909",English,Email Marketing 6588 Buyers Subscribers For FREE Marketing will teach you exactly everything you need to know to succeed,5/2015,12/31/19
Email Marketing: How to make more sales with email marketing,www.udemy.com/course/email-marketing-how-to-make-more-sales-with-email-marketing/,August Sutan,19.99,11.39,3.3(3 ratings),Marketing,Digital Marketing,Email Marketing,111,English,Discover The Exact Methods For Writing Highly Responsive Emails And Start Making More Sales From Your List.,6/2015,12/31/19
Write Emails That Lead to Viral Sales,www.udemy.com/course/write-emails-that-lead-to-viral-sales/,Olympio Vital Yaovi Robert,19.99,11.39,3.9(20 ratings),Marketing,Digital Marketing,Email Marketing,"2,795",English,Email writing based on real example through an effective email structure,2/2018,12/31/19
Write Emails That Lead to Viral Sales,www.udemy.com/course/write-emails-that-lead-to-viral-sales/,Olympio Vital Yaovi Robert,19.99,11.39,3.9(20 ratings),Marketing,Digital Marketing,Email Marketing,"2,795",English,Email writing based on real example through an effective email structure,2/2018,12/31/19
