Course,URL,instructor,Price (full),Price (discount),Rank,Category 1,Category 2,Category 3,Enrollment,Language,Description,Last Update,Date Scraped
Email Marketing:Build 6588 Buyers Subscribers For FREE,www.udemy.com/course/how-i-built-a-list-of-6588-buyers-subscribers-for-free/,Scrembo Paul,19.99,11.39,3.6(18 ratings),Marketing,Digital Marketing,Email Marketing,"4,909",English,Email Marketing 6588 Buyers Subscribers For FREE Marketing will teach you exactly everything you need to know to succeed,5/2015,12/31/19
Build Your email List Like a Ninja | Step-By-Step How To,www.udemy.com/course/build-your-email-list-like-a-ninja/,Cesar Pietri,24.99,11.39,3.9(11 ratings),Marketing,Growth Hacking,Email Marketing,"3,059",English,Learn exactly how to build your own highly responsive and highly profitable list that can produce sales and commisson,8/2015,12/31/19
Email Campaign Ultimate For Beginners,www.udemy.com/course/email-campaign-ultimate-for-beginners/,Obehi Ewanfoh - Aclasses,29.99,11.39,3.2(3 ratings),Marketing,Analytics & Automation,Email Marketing,"1,439",English,Learn Best Email Campaign Ultimate For Beginners,3/2019,12/31/19
Email Marketing Made Easy List Building for Free Automation,www.udemy.com/course/email-marketing-automation-list-building-made-easy-secerts/,"Nick Tsai Make Money Online & Work From Home Expert , Full Time Marketer",199.99,11.39,4.1(27 ratings),Business,Home Business,List Building,"4,554",English,Step by step guide to build a list from facebook & Free to promote your shopify store for small busines mailchimp awaber,10/2017,12/31/19
Write Emails that Get Opened and Positive Results,www.udemy.com/course/write-emails-that-dont-suck/,Daniel Hall,19.99,11.39,4.1(10 ratings),Business,Communications,Email Marketing,450,English,"Write emails that increase your success, create relationships, and make you look great.",5/2014,12/31/19
Digital Marketing Success with Email Marketing,www.udemy.com/course/digital-marketing-success-with-email-marketing/,Samuel OJO,34.99,11.39,0.0(0 ratings),Marketing,Digital Marketing,Email Marketing,573,English,"Become successful with email marketing, grow an email subscriber list and build high quality email marketing campaigns!",8/2018,12/31/19
How to Effectively Use A/B Split Testing for Email,www.udemy.com/course/effective-split-testing-for-email/,Sarah Carroll,19.99,11.39,0.0(0 ratings),Marketing,Analytics & Automation,Email Marketing,0,English,Interactive Guide and Strategy Training,10/2019,12/31/19
Learn How To Build A Buyers Email List On Autopilot,www.udemy.com/course/listbuilding/,Francesco Iantorno,49.99,11.39,3.1(5 ratings),Marketing,Affiliate Marketing,Email Marketing,222,English,An amazing course to learn how to build your buyers list on autopilot with a very simple method.,3/2015,12/31/19
How to Learn the Art of Email Marketing [Real Life Examples],www.udemy.com/course/how-to-learn-the-art-of-email-marketing/,Pawan Kumar,19.99,11.39,0.0(0 ratings),Marketing,Digital Marketing,Email Marketing,7,English,How can you make your emails compelling and from where you need to start? This course helps you to learn EVERYTHING.,1/2019,12/31/19
Introduction to Mailchimp: Design Beautiful Branded Emails,www.udemy.com/course/introduction-to-mailchimp-design-beautiful-branded-emails/,Ilya Lobanov,29.99,11.39,4.2(3 ratings),Design,Design Tools,Email Marketing,"4,917",English,Learn how to design and build email templates directly in Mailchimp.,12/2019,12/31/19
Email Marketing Complete Course | Grow Your Email List,www.udemy.com/course/email-marketing-complete-course/,BlackBrick ©️,199.99,11.99,3.8(34 ratings),Marketing,Content Marketing,Email Marketing,"8,068",English,"Email Marketing Complete Course - Use My Tips, Tricks And Tools To Grow Your Email List And Use It For Marketing.",4/2019,12/31/19
"Email Marketing from 0 to 1,000,000",www.udemy.com/course/email-marketing-up/,Timur Tregulov,19.99,11.39,2.7(7 ratings),Marketing,Other,Email Marketing,"2,216",English,Successful Email Marketing begins here!,1/2019,12/31/19
Email Marketing Sales Ninja,www.udemy.com/course/email-marketing-sales-ninja/,Pankaj Agarwal,19.99,11.39,4.3(10 ratings),Marketing,Digital Marketing,Email Marketing,"1,480",English,Learn how to use email marketing to grow and enhance your sales.,10/2017,12/31/19
VIP 3 in 1 Mailchimp-Aweber-Getresponse Email Marketing 2020,www.udemy.com/course/vip-3-in-1-mailchimp-aweber-getresponse-email-marketing-2020/,AlPacino Production,0.0,Free,1.9(2 ratings),Marketing,"Advertising
 ",Email Marketing,"1,295",English,"Get 3 Email Marketing Autoresponders (Mailchimp, Aweber, Getresponse) Courses For a Price Of 1",12/2019,12/31/19
Email marketing and list building 101 With Clickfunnels,www.udemy.com/course/email-marketing-and-list-building-101-with-clickfunnels/,"Nick Tsai Make Money Online & Work From Home Expert , Full Time Marketer",0.0,Free,3.7(11 ratings),Marketing,Digital Marketing,Email Marketing,"4,026",English,"How to start your list building business and work from home with Clickbank, jvzoo and amazon associate affiliate program",7/2019,12/31/19
Email Marketing Made Simple: Start Growing Your Email List,www.udemy.com/course/powerful-lead-generation-email-marketing-strategies-tactics/,Murli(Nick Name SACHIN) Kumar,0.0,Free,3.9(35 ratings),Marketing,Digital Marketing,Email Marketing,"3,434",English,"How to build your email list, Create an Effective Email Marketing Campaign That Makes Your Business",12/2019,12/31/19
Ultimate Email Marketing Using Getresponse for Beginners,www.udemy.com/course/email-marketing-using-getresponse/,Jatin Bindal,0.0,Free,4.3(53 ratings),Marketing,Digital Marketing,Email Marketing,"5,881",English,"How to create Getresponse email lists, opt-in forms & import email marketing lists to grow sales of any business!",3/2017,12/31/19
Basics of Email Marketing,www.udemy.com/course/basics-of-email-marketing/,SMstudy Certifications,0.0,Free,4.0(278 ratings),Marketing,Content Marketing,Email Marketing,"7,593",English,This is an introductory course on Email Marketing. It helps learners understand the basics of Email Marketing.,,12/31/19
Master Email Deliverability in 2019,www.udemy.com/course/master-email-deliverability/,Martin Wong,0.0,Free,3.7(61 ratings),Marketing,Digital Marketing,Email Marketing,"3,396",English,Learn the secrets to improving email deliverability and maximizing your email profitability.,1/2019,12/31/19
Email Marketing without web site+COPY WRITING+HACKS & TRICKS,www.udemy.com/course/email-marketing-without-web-sitecopy-writinghacks-tricks/,Weng Honn Kan,0.0,Free,3.9(13 ratings),Business,Home Business,Email Marketing,"3,846",English,"Pro Start Your Online Business Without Web Site , Learn Email Marketing , Copy Writing and Hacks + Tricks",10/2019,12/31/19
Getting Started with Constant Contact,www.udemy.com/course/getting-started-with-constant-contact/,Justin Lawrie,0.0,Free,3.8(56 ratings),Business,Communications,Email Marketing,"1,942",English,Master the ins and outs of Constant Contact and learn how to create more effective emails in less time.,1/2017,12/31/19
Complete Mailchimp Tutorial,www.udemy.com/course/complete-mailchimp-tutorial/,Ferdy Korpershoek,0.0,Free,4.6(406 ratings),Marketing,Digital Marketing,Email Marketing,"10,828",English,Learn how to create and grow an email list,9/2017,12/31/19
The Complete MailChimp Email Marketing Course For Beginners,www.udemy.com/course/the-complete-mailchimp-email-marketing-course-for-beginners/,Robin Haney,0.0,Free,4.7(45 ratings),Marketing,Content Marketing,Email Marketing,"4,107",English,Learn How To Set-up Your First Email Funnel and Start Earning From Your Email List,9/2019,12/31/19
Email List Building Strategies for Financial Advisors,www.udemy.com/course/email-list-building-strategies-for-financial-advisors/,Scott Chong,0.0,Free,3.6(8 ratings),Marketing,Digital Marketing,Email Marketing,"2,384",English,A step by step guide to building an email database of warm qualified leads who will buy from you!,7/2019,12/31/19
Email Marketing: Ultimate Tutorial To Using Drip Marketing!,www.udemy.com/course/email-marketing-ultimate-tutorial-to-using-drip-marketing/,Kevin Blackburn,0.0,Free,3.8(28 ratings),Marketing,Marketing Fundamentals,Email Marketing,"3,953",English,Learn How To Use Drip Email Marketing To Create Your Fully Optimised Email Marketing Operations!,9/2018,12/31/19
Create your own email marketing platform (AWS SES & Sendy),www.udemy.com/course/create-your-own-email-marketing-platform-aws-ses-sendy/,ElliteDevs IN,0.0,Free,3.9(25 ratings),IT & Software,Other,Email Marketing,"3,142",English,Save big on your email marketing costs by setting up your own platform,9/2019,12/31/19
Residential Real Estate Mastery Blueprint - Session III,www.udemy.com/course/residential-real-estate-mastery-blueprint-session-3/,"John W. Tanner, J.D., M.S.",0.0,Free,4.6(10 ratings),Marketing,Other,Email Marketing,"2,735",English,A Beginner's Guide to Real Estate Sales & Marketing,9/2017,12/31/19
How to Create an email Program in Marketo,www.udemy.com/course/how-to-create-an-email-program-in-marketo/,Gregg Hunter,0.0,Free,4.4(18 ratings),Marketing,Digital Marketing,Email Marketing,"2,534",English,Create your one off email blast,8/2019,12/31/19
Email Marketing Unlocked,www.udemy.com/course/email-marketing-unlocked/,David reid,0.0,Free,3.6(27 ratings),Marketing,Digital Marketing,Email Marketing,"4,951",English,Unlocked The Hidden Secrets To Getting Your Email Open Rates Increased,3/2018,12/31/19
Build Your Own SMTP Mail Server with Cpanel,www.udemy.com/course/smtp-mail-server-cpanel/,Hasan Aboul Hasan,0.0,Free,4.1(42 ratings),IT & Software,Other,cPanel,"2,460",English,Learn how to Build you own SMTP Mail Server with Cpanel and get 10/10 sending score,10/2019,12/31/19
Build Your Audience: One Email at a Time,www.udemy.com/course/build-your-audience-one-email-at-a-time/,Francesco Piluso,0.0,Free,3.4(8 ratings),Marketing,Growth Hacking,Email Marketing,"2,982",English,Email Lets You Know Your Audience On a Deeper Level,8/2019,12/31/19
Email Marketing Made Easy For Beginners,www.udemy.com/course/email-marketing-made-easy-for-beginners/,Ron Stefanski,0.0,Free,"4.3(1,131 ratings)",Marketing,Digital Marketing,Email Marketing,"26,161",English,Learn The Basics of Creating Effective Email Marketing Campaigns That Make Your Business More Successful,8/2016,12/31/19
"Email Marketing Tips, Strategies, and Automation Tricks 2019",www.udemy.com/course/email-marketing-tips-2019/,Donald Schwartz,0.0,Free,4.2(47 ratings),Marketing,Affiliate Marketing,Email Marketing,"4,338",English,A 2019 beginners guide to building your email list and how to build a long term profitable email marketing campaign,2/2019,12/31/19
Introduction To Constant Contact Toolkit,www.udemy.com/course/constant-contact-toolkit/,Frank Felker,0.0,Free,3.9(61 ratings),Marketing,Digital Marketing,Email Marketing,"9,402",English,An overview of the amazing new Toolkit platform from small business marketing leader Constant Contact,6/2014,12/31/19
Proven Ways to Improve Email open rate and Conversion,www.udemy.com/course/how-to-improve-email-open-rates-and-conversion/,AAM Ali,0.0,Free,3.4(8 ratings),Marketing,Digital Marketing,Email Marketing,"3,338",English,Actionable Steps that will Dramatically Improve your Email Open Rates and Email Conversion.,12/2018,12/31/19
Get started with email marketing and automation using E-goi,www.udemy.com/course/getting-started-with-e-goi/,Plataforma E-goi,0.0,Free,3.6(159 ratings),Marketing,Digital Marketing,Automation,"4,338",English,A set of video tutorials showing you how to use the E-goi platform to kickstart your relationship marketing campaigns,6/2017,12/31/19
GetResponse Email Marketing,www.udemy.com/course/getresponse-email-marketing/,GetResponse Online Marketing Platform,0.0,Free,3.8(84 ratings),Marketing,Digital Marketing,Email Marketing,"5,097",English,The ultimate email marketing course with advanced lessons on sustainable marketing strategy.,1/2018,12/31/19
Email Marketing mit MailChimp erfolgreich meistern,www.udemy.com/course/email-marketing-mit-mailchimp/,Toni Frisch,104.99,11.99,4.5(246 ratings),Marketing,Digitales Marketing,Mailchimp,1.680,Deutsch,"Lerne MailChimp von A - Z! Bring dein Email Marketing auf ein neues Level, mehr Abonnenten, mehr Newsletter, mehr Erfolg",11/2019,12/31/19
Crea un Embudo de Ventas desde Cero para tu Negocio Digital,www.udemy.com/course/crea-un-embudo-de-ventas-desde-cero-y-vende-mas/,Jose Mark,144.99,11.99,4.7(545 ratings),Marketing,Marketing digital,Marketing digital,2.286,EspaÃ±ol,AprenderÃ¡s como hacer un Embudo de Ventas Eficaz y que tu TrÃ¡fico se convierta en Cliente. Todo explicado Paso a Paso.,9/2017,12/31/19
3か月ステップメール実践プログラム - 反応率10倍のメルマガ運営ノウハウ,www.udemy.com/course/stepmail-marketing/,石崎力也 (RIKIYA ISHIZAKI),199.99,11.99,4.6(69 ratings),ãã¸ãã¹ã¹ã­ã«,å¶æ¥­,ã¡ã¼ã«ãã¼ã±ãã£ã³ã°,959äººã®åè¬çãç»é²,æ¥æ¬èª,ã¹ãããã¡ã¼ã«ã®æ¸ãæ¹ãã¡ã«ãã¬ã®æ§æãèª¬æãã¦ãã¾ããå·ä½çã«ã¯ã·ããªãªã®ä½ãæ¹ããã³ãã¬ã¼ãã®ä½¿ãæ¹ãããã«ã¡ãã£ã¢ã¨ãã¦ã®ã¡ã«ãã¬éå¶ãã¦ãã¦ããªã¼ããã³ã°ããè²©å£²ã¾ã§ã®æ¸ãæ¹ãè©³ããè§£èª¬ãã¦ãã¾ãã,1/2019,12/31/19
ステップメールのテンプレート及びシナリオの書き方・完全ガイド,www.udemy.com/course/autoresponder/,石崎力也 (RIKIYA ISHIZAKI),124.99,11.99,3.9(100 ratings),ãã¼ã±ãã£ã³ã°,ãã¸ã¿ã«ãã¼ã±ãã£ã³ã°,ã¡ã¼ã«ãã¼ã±ãã£ã³ã°,948äººã®åè¬çãç»é²,æ¥æ¬èª,ã¹ãããã¡ã¼ã«ã¯DRMã®æ ¹å¹¹ãçºãå¼·åãªãã¼ã«ã§ããã«ãé¢ããããã·ããªãªã®æ¸ãæ¹ãªã©éè¦ãªæå ±ã¯ã»ã¼æµå¸ããã¦ãã¾ãããä»åã¯åç¾æ§ãé«ãåå¿çã®é«ãã·ããªãªãæãããã®ãã³ãã¬ã¼ãï¼ã¹ãã¼ãªã¼ããªã³ã°åï¼ãç´¹ä»ãããã¨ã«ãã¾ããã,1/2019,12/31/19
最小のリストで最大の結果を出す｜ゼロからCVRの高いステップメールをマスターする講座,www.udemy.com/course/stepmail/,野口 渉,199.99,11.99,5.0(6 ratings),ãã¸ãã¹ã¹ã­ã«,å¨å®ãã¸ãã¹,ã¡ã¼ã«ãã¼ã±ãã£ã³ã°,75äººã®åè¬çãç»é²,æ¥æ¬èª,ã¡ã¼ã«ãã¼ã±ãã£ã³ã°ã®ä»£è¡¨ã¹ãããã¡ã¼ã«ï½æ¬å½ã®çµæã®åºããã¹ãããã¡ã¼ã«ã®åãã¨ãã¹ãããã¡ã¼ã«ã®å®ä¾ããå¨ã¦å¬éãã¾ãï¼,9/2019,12/31/19
Corso di Email Marketing con Mailchimp,www.udemy.com/course/corso-email-marketing-mailchimp/,Massimo Merlin,134.99,11.99,4.3(29 ratings),Marketing,Marketing digitale,Mailchimp,138,Italiano,"Scopri come creare una lista, segmentarla e realizzare campagne di email marketing efficaci con Mailchimp",7/2019,12/31/19
E-Mail Marketing mit Klick-Tipp: Werde Profi in 4 Stunden!,www.udemy.com/course/e-mail-marketing-mit-klick-tipp-werde-profi-in-4-stunden/,Sebastian Glöckner,199.99,11.99,0.0(0 ratings),Marketing,Digitales Marketing,E-Mail-Marketing,2.762,Deutsch,"Dein Start ins erfolgreiche E-Mail Marketing mit Klick Tipp. Schneller Listenaufbau, hohe Conversions, mehr Umsatz.",12/2019,12/31/19
Die eMailMarketing ErfolgsFormel,www.udemy.com/course/die-emailmarketing-erfolgsformel/,"Meike Hohenwarter, MSc",99.99,11.99,4.6(47 ratings),Marketing,Marketinggrundlagen,E-Mail-Marketing,458,Deutsch,"KlickTipp: Unglaublich erfolgreiches eMail-Marketing durch Tagging, plane das Versenden von Autorespondern & Newslettern",5/2019,12/31/19
Curso de Email Marketing y Automatizaciones con Mailchimp,www.udemy.com/course/curso-de-email-y-estrategias-de-marketing-con-mailchimp/,Camilo Barbosa TV,49.99,11.99,4.3(131 ratings),Marketing,Digital Marketing,Email Marketing,560,Spanish,"Crea campaÃ±as de email marketing efectivas y marketing automatizado con mailchimp, aumenta tu base de datos y aumenta tu",6/2017,12/31/19
Email Marketing & Automação - Active Campaign,www.udemy.com/course/email-marketing-automacao-active-campaign/,Helder Pinto,184.99,11.99,4.6(28 ratings),"Marketing
 ",Marketing digital,AutomaÃ§Ã£o,223,PortuguÃªs,Curso Completo,8/2018,12/31/19
MailChimp Email Marketing desde 0 con MailChimp ¡2018!,www.udemy.com/course/email-marketing-con-mailchimp/,Roxana Falasco,194.99,48.75,4.1(225 ratings),Marketing,Digital Marketing,Mailchimp,887,Spanish,Curso para dominar MailChimp. Aprende a crear CampaÃ±as de Marketing. Automatiza tus envÃ­os y consigue mÃ¡s suscriptores,5/2018,12/31/19
Aprenda Email Marketing com Photoshop e MailChimp,www.udemy.com/course/aprenda-email-marketing-com-photoshop-e-mailchimp/,Evandro Lima,19.99,11.39,4.4(35 ratings),Design,Web design,Marketing por e-mail,161,PortuguÃªs,Tudo que vocÃª precisa saber para divulgar o seu produto utilizando o email marketing!,9/2018,12/31/19
E-mail Marketing,www.udemy.com/course/e-mail-marketing-comschool/,ComSchool Cursos,19.99,11.39,4.3(173 ratings),Marketing,Marketing digital,Marketing por e-mail,628,PortuguÃªs,Curso de como usar o MailChimp em EstratÃ©gias de Email Marketing - vÃ­deoaula,8/2017,12/31/19
"Créer votre liste 100,000 Email Ciblés et générer des ventes",www.udemy.com/course/creer-votre-liste-100000-email-cibles-et-generer-des-ventes/,Mounsif EL LAABY,19.99,11.39,4.2(10 ratings),Marketing,Marketing numÃ©rique,Marketing par e-mail,79,FranÃ§ais,PrÃ©parez-vous Ã  extraire des Million d'adresse Email en une journÃ©e Ã  l'aide de mÃ©thodes secrÃ¨tes d'extraction.,2/2019,12/31/19
1万円以下の商品を販売するためのステップメールの作り方,www.udemy.com/course/5-stepmail/,石崎力也 (RIKIYA ISHIZAKI),199.99,11.39,4.2(8 ratings),ãã¼ã±ãã£ã³ã°,ãã¼ã±ãã£ã³ã°ã®åºç¤,ã¡ã¼ã«ãã¼ã±ãã£ã³ã°,191äººã®åè¬çãç»é²,æ¥æ¬èª,"Â¥3,000ãÂ¥10,000ã®åçºååããããã¯ãÂ¥3,000/mã®æé¡ãµã¼ãã¹ãè²©å£²ããããã®5éã®ã¹ãããã¡ã¼ã«ã®ä½ãæ¹ãè§£èª¬ãã¾ãããããããã®ã¡ã¼ã«ã§ã©ããªåå®¹ãæ¸ãã¦ããã°è¯ãã®ãå­¦ã¶ãã¨ãã§ãã¾ãã",1/2019,12/31/19
【完全ガイド】ConvertKitの使い方,www.udemy.com/course/how-to-use-convertkit/,根本 耕輔,19.99,11.39,4.8(13 ratings),ãã¼ã±ãã£ã³ã°,ãã¼ã±ãã£ã³ã°ã®åºç¤,ã¡ã¼ã«ãã¼ã±ãã£ã³ã°,130äººã®åè¬çãç»é²,æ¥æ¬èª,ConvertKitã¯MailChimpãããä½¿ããããããå®¢ããã®ç®¡çãç°¡åã§ãããªããã¤ã³ãã©ã¼ã ã®ä½æãããã¹ãããã¡ã¼ã«ã§ã®ã»ã¼ã«ã¹ã¾ã§ConvertKitã ãã§å®çµã§ãã¾ãã,11/2019,12/31/19
Faire des ventes flash avec un seul email de promo,www.udemy.com/course/ventes-flash-email-de-promo/,Renaud Demaret,19.99,11.39,4.3(6 ratings),Marketing,Marketing numÃ©rique,Marketing par e-mail,81,FranÃ§ais,L'email marketing associÃ© au copywriting peut faire des merveilles pour vendre en plus de vos boutiques e-commerce.,11/2019,12/31/19
電商大講堂，流量煉金術｜06 創造顧客終身價值的第一步：edm,www.udemy.com/course/ecforum-06-zh/,慕課 癮科技,0.0,19.99,4.5(10 ratings),é»å­åå,éç¼å·¥å·,é»å­éµä»¶å¸å ´è¡é·,332,Traditional Chinese,å­¸æåå å©ç¨ EDM çºä½ çåçèç¢åå¢å æåèé²åºçï¼éæèæå¡ä¹éäºåçæ©æ,12/2015,12/31/19
見込み客リスト（メールアドレス）の集め方,www.udemy.com/course/list-marketing/,石崎力也 (RIKIYA ISHIZAKI),199.99,11.39,4.2(32 ratings),ãã¼ã±ãã£ã³ã°,ãã¸ã¿ã«ãã¼ã±ãã£ã³ã°,ã¡ã¼ã«ãã¼ã±ãã£ã³ã°,270äººã®åè¬çãç»é²,æ¥æ¬èª,ãªã³ã©ã¤ã³ãã¸ãã¹ã«ããã¦ããªã¹ã(è¦è¾¼ã¿å®¢ã®ã¡ã¼ã«ã¢ãã¬ã¹)=å£²ä¸ã§ãããããããããªã¹ãã¯éè¦ãªãã§ããæ¬ã³ã¼ã¹ã§ã¯ããªã¹ããéããæ¹æ³(æ¦è¦)ãè§£èª¬ãã¦ãã¾ãã,8/2018,12/31/19
Facebook Werbeanzeigen für Email Marketing Meisterkurs,www.udemy.com/course/facebook-werbeanzeigen-fur-email-marketing-meisterkurs/,Marketing Hero,199.99,11.39,4.3(10 ratings),Marketing,Digitales Marketing,E-Mail-Marketing,863,Deutsch,"Generiere mehr Leads, lerne sie mit Mailchimp zu verwalten und lerne die Grundlagen von Facebook Messenger Marketing",12/2019,12/31/19
コンテンツアップグレードで見込み客リストを集める方法,www.udemy.com/course/contents-upgrade/,石崎力也 (RIKIYA ISHIZAKI),199.99,11.39,4.5(5 ratings),ãã¼ã±ãã£ã³ã°,ãã¼ã±ãã£ã³ã°ã®åºç¤,ã¡ã¼ã«ãã¼ã±ãã£ã³ã°,161äººã®åè¬çãç»é²,æ¥æ¬èª,ãã­ã°ã«ã³ã³ãã³ãã¢ããã°ã¬ã¼ããè¿½å ãããã¨ã§ãè¦è¾¼ã¿å®¢ãªã¹ãã®ç²å¾çãå¤§å¹ã«ã¢ãããã¾ããæ¬ã³ã¼ã¹ã§ã¯ãã³ã³ãã³ãã¢ããã°ã¬ã¼ãã®ã¢ã¤ãã£ã¢ãè¿½å æ¹æ³ãªã©ããç´¹ä»ãã¾ãã,8/2018,12/31/19
E-Mail Marketing - Newsletter die ankommen - Spam Filter ade,www.udemy.com/course/e-mail-marketing-newsletter-die-ankommen-spam-filter-ade/,Frank Hübner,94.99,11.39,4.0(19 ratings),Marketing,Affiliate-Marketing,E-Mail-Marketing,157,Deutsch,Keine Angst vor Spam Filtern - Zustellrate und Ãffnungsrate verbessern - Mehr Erfolg mit Marketing E-Mails,4/2017,12/31/19
Email Marketing para NO Expertos,www.udemy.com/course/email-marketing-para-no-expertos/,RankAcademy Global,84.99,11.39,4.0(23 ratings),Marketing,Marketing de contenidos,Marketing por correo electrÃ³nico,126,EspaÃ±ol,CÃ³mo DiseÃ±ar e Implementar una CampaÃ±a de Email Marketing 100% Automatizado para CUALQUIER Tipo de Negocio,10/2018,12/31/19
初心者のための マイスピー（MyASP）の使い方と読者ゼロからメルマガを始める方法,www.udemy.com/course/myasp-mail-marketing/,大原 正裕,199.99,11.39,3.6(5 ratings),ãã¼ã±ãã£ã³ã°,ãã¼ã±ãã£ã³ã°ã®åºç¤,ã¡ã¼ã«ãã¼ã±ãã£ã³ã°,48äººã®åè¬çãç»é²,æ¥æ¬èª,èªåè¿ä¿¡ã¡ã¼ã«ãã¹ãããã¡ã¼ã«ã®ãã³ãã¬ã¼ãä»,8/2019,12/31/19
Klick Tipp Starter - automatisiertes E-Mail Marketing,www.udemy.com/course/klicktipp-starter/,Thomas Schiesser,79.99,11.39,4.6(2 ratings),Marketing,Digitales Marketing,E-Mail-Marketing,20,Deutsch,Lerne Schritt fÃ¼r Schritt wie Du Dein KlickTipp Account einrichtest und mit E-Mail Marketing startest,4/2019,12/31/19
التسويق عن طريق الايميل عربي|Email marketing with Mail chimp,www.udemy.com/course/email_marketing_2018/,⭐ Saeed Shahin ⭐,0.0,19.99,4.8(33 ratings),Marketing,Digital Marketing,Email Marketing,375,Arabic,Ø§ÙØ¶Ù ÙÙØ±Ø³ Ø¹Ø±Ø¨Ùâ­Ø§Ø­ØµÙ Ø¹ÙÙ Ø¢ÙØ§Ù Ø§ÙØ§ÙÙÙÙØ§Øª Ø¨Ø´ÙÙ ÙÙÙÙ ÙØ§Ø´Ø®Ø§Øµ ÙÙØªÙÙÙ Ø¨Ø¹ÙÙÙ Ø®ÙØ§Ù Ø¯ÙØ§Ø¦Ù ÙÙØ· â­2018â­,4/2019,12/31/19
Email Marketing: Do Layout ao HTML,www.udemy.com/course/e-mail-marketing-do-layout-ao-html/,Yuri Zaban,0.0,19.99,4.5(4 ratings),Design,Web design,Marketing por e-mail,12,PortuguÃªs,Desenvolva o design para o seu Email Marketing e transforme em um HTML editÃ¡vel!,10/2018,12/31/19
