Course,URL,instructor,Price (full),Price (discount),Rank,Category 1,Category 2,Category 3,Enrollment,Language,Description,Last Update,Date Scraped
How to Audit Google Ads in Just 10 Minutes,www.udemy.com/course/audit-google-ads-in-just-10-minutes/,Joel Eckman,0.0,Free,4.3(42 ratings),Marketing,Digital Marketing,Google Ads (Adwords),"4,419",English,"Identify and eliminate waste in your Google Ads search, and display campaigns FAST!",8/2019,12/28/19
Google AdWords for Small Business: Secrets of an Agency Pro,www.udemy.com/course/google-adwords-for-small-business-secrets-of-an-agency-pro/,John Horn,0.0,Free,"4.4(1,892 ratings)",Marketing,Digital Marketing,Google Ads (Adwords),"53,704",English,Learn how to run profitable Google AdWords campaigns from a pro who has managed millions in ad spend,3/2017,12/28/19
Google Ads for Beginners,www.udemy.com/course/google-ads-for-beginnners/,Diego Davila,0.0,Free,4.2(14 ratings),Marketing,Advertising,Google Ads (Adwords),"1,995",English,"Create Google video Ads, search Ads, display Ads to reach new clients all over the world!",11/2019,12/28/19
Google Ads for Beginners,www.udemy.com/course/google-ads-for-beginnners/,Diego Davila,0.0,Free,4.2(14 ratings),Marketing,Advertising,Google Ads (Adwords),"1,995",English,"Create Google video Ads, search Ads, display Ads to reach new clients all over the world!",11/2019,12/28/19
Google Ads (Adwords) COMPLETO + Remarketing + Youtube Ads,www.udemy.com/course/google-adwords-pro/,Erick Kosmalski Scudero,199.99,11.39,"4.5(5,238 ratings)",Marketing,Marketing digital,Google Ads (Adwords),19.590,PortuguÃªs,Seja um mestre em PPC ads no Google Adwords! Comece do absoluto ZERO atÃ© a gestÃ£o PROFISSIONAL da sua conta.,10/2019,12/28/19
Curso Completo de Google Ads (AdWords) do Básico ao Avançado,www.udemy.com/course/curso-completo-de-google-ads-adwords-do-basico-ao-avancado/,Thiago Moch,199.99,11.39,4.6(631 ratings),Marketing,Publicidade,CertificaÃ§Ã£o em Google Ads (AdWords),2.231,PortuguÃªs,"TUDO que vocÃª precisa saber sobre as campanhas de Pesquisa, Display, YouTube e Remarketing. ATUALIZADO 2019!",11/2019,12/28/19
Corso Google Ads (ex AdWords) Pratico,www.udemy.com/course/corso-google-ads/,Massimo Merlin,194.99,11.39,4.7(85 ratings),Marketing,Marketing digitale,Google Ads (Adwords),453,Italiano,"Dalle Basi alle Tecniche per Garantire Performance di Alto Livello alle Campagne di Ricerca, Display e Remarketing",12/2019,12/28/19
GOOGLE ADS (Búsquedas SEM Adwords) Marketing Digital Desde 0,www.udemy.com/course/andresbrachetta-google-ads/,Andres Brachetta ⭐⭐⭐⭐⭐,199.99,11.39,4.5(516 ratings),Marketing,Advertising,Google Ads (Adwords),"1,790",Spanish,"â¢ Curso #1 Google Ads en EspaÃ±ol | Aprende a Posicionarte en Google con Adwords, Incrementa las Ventas de tu Negocio Hoy",4/2019,12/28/19
Mit Google Ads (AdWords) mehr Umsatz machen,www.udemy.com/course/google-ads-vom-anfanger-zum-experten/,Dietmar Fischer,139.99,11.39,4.2(114 ratings),Marketing,Digitales Marketing,Google Ads (Adwords),816,Deutsch,"Kunden gewinnen mit Google Ads (frÃ¼her AdWords), dem grÃ¶Ãten digitalen Marketing Channel. Google Ads ist kein Hexenwerk!",11/2019,12/28/19
Google Ads - Curso Completo Desde lo Básico Hasta Avanzado,www.udemy.com/course/google-ads-curso-completo-desde-lo-basico-hasta-avanzado/,Miguel Maraby,199.99,11.39,4.3(770 ratings),Marketing,Marketing digital,Google Ads (Adwords),2.466,EspaÃ±ol,Conoce cÃ³mo incrementar tus ventas utilizando correctamente Google Ads; es mejor saber que suponer.,6/2019,12/28/19
Google Ads (AdWords) 2019 - Fundamenty Marketingu PPC,www.udemy.com/course/google-ads-marketing/,Michał Lubaszewski,44.99,11.39,4.6(205 ratings),Marketing,Marketing cyfrowy,Google Ads (Adwords),1Â 783,Polski,Praktyczny kurs podstaw marketingu Google Ads (AdWords) dla kaÅ¼dego! Dowiedz siÄ jak zmieniÄ klikniÄcia w sprzedaÅ¼ PPC!,6/2019,12/28/19
Başlangıçtan Uzmanlık Seviyesine Google Ads (Adwords) Kursu,www.udemy.com/course/baslangictan-uzmanlik-seviyesine-google-ads-adwords-kursu-egitimi/,Onur Üsküplü,199.99,11.39,4.6(483 ratings),Pazarlama,Dijital Pazarlama,Google Ads (Adwords),1.668,TÃ¼rkÃ§e,"Google Adwords ya da Yeni AdÄ± ile Ads Kursu, Yeni ArayÃ¼z ile ÃÄrenmeye BaÅlayÄ±n. Sizde Google Adwords/Ads uzmanÄ± olun",2/2019,12/28/19
2019年度  Google Ads（グーグル広告）設定＆運用ガイド 最新・保存版,www.udemy.com/course/google-ads-u/,株式会社ウィニングフィールド 勝原　潤,134.99,11.39,4.0(37 ratings),ãã¼ã±ãã£ã³ã°,ãã¸ã¿ã«ãã¼ã±ãã£ã³ã°,Googleåºåï¼Adwordsï¼,358äººã®åè¬çãç»é²,æ¥æ¬èª,æ©æ¢°å­¦ç¿ãã¦ããGoogleåºåã®ä»çµã¿ã¨ä½¿ãæ¹ãè¦ãã¦å°é¡ã§ççºçåçãä¸ããã,8/2019,12/28/19
Google AdWords (Google Ads) Praxiskurs für Selbstständige,www.udemy.com/course/google-adwords-praxiskurs-fur-selbststaendige-und-unternehmer/,Dr. Sebastian Decker,149.99,11.39,4.0(127 ratings),Marketing,Digitales Marketing,Google Ads (Adwords),844,Deutsch,"Jetzt in 4 h Deine erste AdWords-Kampagne umsetzen und Kunden gewinnen: schnell, richtig und profitabel!",12/2017,12/28/19
Google Ads (AdWords) - 2019 - Podstawy,www.udemy.com/course/google-ads-adwords-podstawy/,Ernest Gurgól,74.99,18.75,4.9(55 ratings),Marketing,Marketing cyfrowy,Google Ads (Adwords),243,Polski,"Ponad 11 godzin praktycznej wiedzy wraz z licznymi przykÅadami, dziÄki ktÃ³rym nauczysz siÄ skutecznie reklamowaÄ biznes.",4/2019,12/28/19
デジタルマーケ担当者必見！成果を倍にするウェブ広告戦略とGoogle広告 × Googleアナリティクス実践,www.udemy.com/course/google-adwords_analytics/,繁伸 金村,19.99,11.39,4.0(230 ratings),ãã¼ã±ãã£ã³ã°,åºå,Googleã¢ããªãã£ã¯ã¹,2062äººã®åè¬çãç»é²,æ¥æ¬èª,æ°ä»»èãããã«ææãåºããããã¼ã±ã¿ã¼ãå­¦ã¶ã¹ãã¦ã§ãåºåã®å¨ä½æ¦ç¥ãä¼æãããã«ææãæå¤§éã«å¼ãåºãGoogleåºåã®éç¨æ¹æ³ã¨Googleã¢ããªãã£ã¯ã¹ã¨é£æºããåæã¾ã§ããã¹ã¿ã¼,8/2017,12/28/19
2019年度  Google Ads（グーグル広告）基礎・概論編　最新・保存版,www.udemy.com/course/google_ads_basic/,株式会社ウィニングフィールド 勝原　潤,69.99,11.39,4.4(41 ratings),ãã¼ã±ãã£ã³ã°,ãã¸ã¿ã«ãã¼ã±ãã£ã³ã°,Googleåºåï¼Adwordsï¼,300äººã®åè¬çãç»é²,æ¥æ¬èª,æ©æ¢°å­¦ç¿ãã¦ããGoogleåºåã®ä»çµã¿ã¨ä½¿ãæ¹ãè¦ãã¦å°é¡ã§ççºçåçãä¸ããã,1/2019,12/28/19
"Marketing en Facebook, Instagram, Youtube, Twitter y Google",www.udemy.com/course/marketing-en-facebook-instagram-youtube-twitter-y-google/,Miguel Maraby,114.99,11.39,4.0(782 ratings),Marketing,Marketing en redes sociales,Marketing en Facebook,3.273,EspaÃ±ol,Aprende a crear campaÃ±as digitales efectivas paso a paso en las Redes Sociales e incrementa las ventas de tu negocio.,6/2019,12/28/19
Google Ads (Adwords) : Se lancer sur le Réseau de recherche,www.udemy.com/course/comprendre-et-maitriser-google-ads/,Davy Martial,39.99,11.39,4.7(47 ratings),Marketing,Marketing numÃ©rique,Google Ads (Adwords),179,FranÃ§ais,CrÃ©ez votre premiÃ¨re campagne Google Ads (Google Adwords) et gagnez en visibilitÃ© !,11/2019,12/28/19
Corso Google ADS AdWords per Principianti (Edizione 2020),www.udemy.com/course/corso-completo-google-adwords/,Giovanni Pinna,174.99,11.39,3.8(357 ratings),Marketing,Marketing digitale,Google Ads (Adwords),1.371,Italiano,"Impara a creare, gestire e ottimizzare in autonomia campagne e annunci su Google, YouTube e i siti partner",9/2019,12/28/19
Neu: 10 Google Ads Strategien für clevere Online-Marketer,www.udemy.com/course/google-ads-strategien-fur-fortgeschrittene/,Malte Helmhold,19.99,11.39,4.5(36 ratings),Marketing,Digitales Marketing,Google Ads (Adwords),269,Deutsch,Google Strategien von YouTuber und Online-Marketer Malte Helmhold,10/2018,12/28/19
【集客＆利益UP】０から始める超実践型リスティング広告,www.udemy.com/course/listing_master/,SK LAB,199.99,11.39,4.1(39 ratings),ãã¼ã±ãã£ã³ã°,åºå,Googleåºåï¼Adwordsï¼,323äººã®åè¬çãç»é²,æ¥æ¬èª,"å®å¨åå¿èã®æ¹ã§ãããããéå®¢ãã§ããããã«ãã¾ããGoogleåºå(æ§ã°ã¼ã°ã«ã¢ãã¯ã¼ãº,Adwords)ãã¤ãã¼ãã­ã¢ã¼ã·ã§ã³åºåã¯ãã¡ããã®ãã¨ãWEBãã¼ã±ãã£ã³ã°ãã¦ã§ãåºåæ¦ç¥ãLP(ã©ã³ãã£ã³ã°ãã¼ã¸)ãçµ¡ãã¦ããã¾ãã",1/2019,12/28/19
Google Ads Zertifizierung - innerhalb von 2 Tagen,www.udemy.com/course/google-adwords-zertifikat/,Valentin Espagné,114.99,11.39,4.0(48 ratings),Marketing,Digitales Marketing,Google Ads (Adwords),411,Deutsch,Der Vorbereitungskurs fÃ¼r dein Google Ads Zertifikat - Grundlagen und Google Ads Suchmaschinenwerbung - in nur 2 Tagen,8/2018,12/28/19
Formation Google Ads / AdWords: de débutant à confirmé,www.udemy.com/course/formation-adwords-google-ads-comment-faire-de-la-pub-sur-google/,Anthony Millot,99.99,11.39,3.9(45 ratings),Marketing,Marketing numÃ©rique,Google Ads (Adwords),231,FranÃ§ais,Exploitez correctement le potentiel de Google et augmentez vos ventes en maÃ®trisant vos coÃ»ts,4/2019,12/28/19
Google ADS (Adwords) Masterclass: Venda Mais Com o GoogleADS,www.udemy.com/course/google-ads-adwords/,Igor Botelho,179.99,11.39,4.6(35 ratings),Marketing,Publicidade,Google Ads (Adwords),283,PortuguÃªs,Aprenda a Como Anunciar no Google ADS (Adwords) e Ter Resultados Reais Com Suas Campanhas. Tudo Que VocÃª Precisa.,10/2019,12/28/19
Google Ads - (técnicas de básico a avanzado con AdWords),www.udemy.com/course/google-adwords-2018-desde-fundamentos-hasta-optimizacion/,Marco Russo,144.99,11.39,3.8(174 ratings),Marketing,Publicidad,Google Ads (Adwords),4.163,EspaÃ±ol,"Aprende a optimizar al mÃ¡ximo las campaÃ±as, grupos de anuncios, anuncios de textos, keywords y crear informes.",11/2019,12/28/19
"Google Ads (Adwords) : conversions, balises & enchères",www.udemy.com/course/comprendre-et-maitriser-google-ads-conversions-balises-encheres/,Davy Martial,39.99,11.39,5.0(16 ratings),Marketing,Marketing numÃ©rique,Google Ads (Adwords),108,FranÃ§ais,"Choisissez votre strategie d'enchÃ¨res, mettez en place vos premiÃ¨res conversions et mesurez l'impact de vos campagnes !",11/2019,12/28/19
Curso de Google Ads Completo 2020 - 7 cursos em 1.,www.udemy.com/course/google-ads-completo-2020/,André Fontenelle,29.99,11.39,4.1(7 ratings),Marketing,Marketing digital,Google Ads (Adwords),121,PortuguÃªs,"Rede de Pesquisa, Rede de Display, YouTube, PromoÃ§Ã£o de App, Remarkerting e Google Analytics.",12/2019,12/28/19
Sıfırdan İleri Düzey Ads (AdWords) Eğitimi A'dan Z'ye,www.udemy.com/course/sfrdan-ileri-duzey-ads-adwords-egitimi-adan-zye/,Şenol KELEŞ,0.0,19.99,4.0(183 ratings),Pazarlama,Dijital Pazarlama,Google Ads (Adwords),566,TÃ¼rkÃ§e,Google Ads(AdWords) baÅlangÄ±Ã§ seviyesinden ileri seviyeye kadar Ã¶Ärenebileceksiniz. Ads uzmanÄ± olmaya hazÄ±r mÄ±sÄ±nÄ±z?,1/2019,12/28/19
Google Ads (Adwords) : Optimiser ses campagnes de recherche,www.udemy.com/course/google-ads-optimiser-ses-campagnes-de-recherche/,Davy Martial,39.99,11.39,4.6(14 ratings),Marketing,Marketing numÃ©rique,Google Ads (Adwords),67,FranÃ§ais,Optimiser vos campagnes de recherche Google Ads (Google Adwords) et amÃ©liorer votre retour sur investissement !,11/2019,12/28/19
はじめての人のGoogle広告入門！Google広告の初期設定から基本操作まで学び広告を出稿する手順を解説,www.udemy.com/course/google-ad/,山田 どうそん,199.99,11.39,4.2(18 ratings),ãã¼ã±ãã£ã³ã°,åºå,Googleåºåï¼Adwordsï¼,121äººã®åè¬çãç»é²,æ¥æ¬èª,Googleåºåã«ãã£ã¬ã³ã¸ãã¦ãªã¹ãã£ã³ã°åºåããã£ã¦ã¿ãããã©æä½ãé£ããã¦ä»ä¸æ­©è¸ã¿åºããªãã¨æã£ããã¨ã¯ããã¾ãããï¼ãã¾ãã«è±å¯ãªæ©è½ãããããã¦æãã¤ããããªãã¨ããæ¹ã®ããã«ã¼ã­ããåºåãåºãæé ãè§£èª¬ãã¦ãã¾ãã,8/2019,12/28/19
Google Ads (Adwords) : Se lancer sur Display & Remarketing,www.udemy.com/course/google-ads-se-lancer-sur-display-remarketing/,Davy Martial,39.99,11.39,4.3(10 ratings),Marketing,Marketing numÃ©rique,Google Ads (Adwords),62,FranÃ§ais,CrÃ©ez vos premiÃ¨res campagnes Google Ads (Adwords) sur le rÃ©seau Display (& Remarketing) et gagnez en visibilitÃ© !,11/2019,12/28/19
Google Ads (Adwords) : se lancer sur Youtube,www.udemy.com/course/google-ads-se-lancer-sur-youtube/,Davy Martial,39.99,11.39,4.7(4 ratings),Marketing,Marketing numÃ©rique,Google Ads (Adwords),53,FranÃ§ais,CrÃ©ez vos premiÃ¨res campagnes Youtube et faites connaÃ®tre vos produits et services !,11/2019,12/28/19
A-Z™ |Sıfırdan İleri Seviyeye Google Ads (Adwords) Eğitimi,www.udemy.com/course/google-ads-reklam-egitimi-dijital-pazarlama/,Umut İsmetoğlu,99.99,11.39,4.4(61 ratings),Pazarlama,Dijital Pazarlama,Google Ads (Adwords),230,TÃ¼rkÃ§e,Google Ads ile AlakalÄ± Her Åeyi SÄ±fÄ±rdan Ä°leri Seviyeye ÃÄrenerek Uzman Bir Dijital PazarlamacÄ± Olun ve ÃalÄ±ÅÄ±n!,6/2019,12/28/19
Google-Strategie-Kurs: SEO / Adwords das ist hier die Frage!,www.udemy.com/course/google-strategie-kurs-keyword-seo-adwords-kosten-nutzen-analyse/,Dr. Sebastian Decker,49.99,11.39,4.4(40 ratings),Marketing,Digitales Marketing,Google Ads (Adwords),230,Deutsch,Praxiskurs fÃ¼r Unternehmer: Wie viel Umsatz du realistisch Ã¼ber Google erzielen kannst und in welcher Zeit.,12/2017,12/28/19
Curso Google Ads do Básico ao Extremo + Bônus Curso Facebook,www.udemy.com/course/google-adwords-segredos-revelados/,Mauricio Fazolin,104.99,11.39,4.1(102 ratings),Marketing,Marketing digital,Google Ads (Adwords),424,PortuguÃªs,Aprenda a fazer Campanhas de Impacto no Google Ads com tÃ©cnicas testadas e comprovadas + Facebook Ads + Google Forms,12/2019,12/28/19
تعلم إعلانات جوجل 2019 دورة كاملة مكثفة Google Adwords,www.udemy.com/course/2019-google-adwords/,Abdullah Hamad,29.99,11.39,4.4(15 ratings),Marketing,Digital Marketing,Google Ads (Adwords),183,Arabic,ØªØ¹ÙÙ ÙÙÙÙØ© Ø¥ÙØ´Ø§Ø¡ Ø­ÙÙØ§Øª Ø¥Ø¹ÙØ§ÙÙØ© Ø¹ÙÙ Ø¹ÙÙ ÙÙØµØ§Øª Ø¬ÙØ¬Ù ÙØ¹ Ø¨ÙØ§Ø¡ Ø§ÙØªØ®Ø·ÙØ· Ø§ÙØ¥Ø³ØªØ±Ø§ØªÙØ¬Ù ÙØ§ÙØ¶Ù Ø§ÙÙÙØ§Ø±Ø³Ø§Øª ÙØªÙÙÙØ© ÙØ´Ø§Ø·Ù Ø§ÙØªØ¬Ø§Ø±Ù,8/2019,12/28/19
Google Ads (adwords) : L'analyse du modèle d'attribution,www.udemy.com/course/google-ads-analyse-du-modele-attribution/,Davy Martial,39.99,11.39,4.5(6 ratings),Marketing,Marketing numÃ©rique,Google Ads (Adwords),33,FranÃ§ais,Analysez l'impact de vos campagnes sur vos conversions et maximisez le retour sur investissement !,11/2019,12/28/19
Marketing Digital Focado em Google Ads,www.udemy.com/course/marketing-digital-focado-em-google-ads/,Rudmar Silveira - Doutor Ads,199.99,11.39,4.9(4 ratings),Marketing,Marketing digital,Google Ads (Adwords),41,PortuguÃªs,Aprenda Criar Campanhas de Marketing Digital Certeiras,10/2019,12/28/19
Google Ads Display Zertifikat - an einem Tag,www.udemy.com/course/google-adwords-display-zertifikat/,Valentin Espagné,69.99,11.39,4.3(2 ratings),IT & Software,IT-Zertifizierung,Google Ads (AdWords)-Zertifizierung,128,Deutsch,Der Vorbereitungskurs fÃ¼r deine Google AdWords Display Zertifizierung - werde zertifiziert innerhalb von 24 Std.,9/2018,12/28/19
Curso Google Adwords (Ads) do Zero até fazer Remarketing!,www.udemy.com/course/curso-de-google-adwords-2018-para-iniciantes-e-intermediario/,Tiago Maciel,139.99,11.39,4.4(168 ratings),Marketing,Marketing digital,Google Ads (Adwords),607,PortuguÃªs,"Aprenda a criar na prÃ¡tica, campanhas otimizadas no Google Ads Atualizado do Zero atÃ© fazer Remarketing!",6/2018,12/28/19
Campagne Pubblicitarie Professionali con Google Ads,www.udemy.com/course/campagne-pubblicitarie-professionali-con-google-adwords/,Andrea Baldoni,59.99,11.39,3.9(18 ratings),Marketing,PubblicitÃ ,Google Ads (Adwords),81,Italiano,Imparare da zero il Metodo Professionale di creazione di Campagne Google Ads + Consulenza privata di 30 minuti,10/2018,12/28/19
Google Ads para NO Expertos,www.udemy.com/course/google-adwords-para-no-expertos/,RankAcademy Global,84.99,11.39,4.4(375 ratings),Marketing,Digital Marketing,Google Ads (Adwords),"1,041",Spanish,"Como Entender, Crear, Administrar y Optimizar las CampaÃ±as de Publicidad en Google Adwords para Cualquier Negocio",9/2018,12/28/19
Google Ads (Adwords) : Optimiser ses campagnes display,www.udemy.com/course/google-ads-optimiser-ses-campagnes-display/,Davy Martial,39.99,11.39,4.4(4 ratings),Marketing,Marketing numÃ©rique,Google Ads (Adwords),27,FranÃ§ais,Optimiser vos campagnes display Google Ads (Google Adwords) et amÃ©liorer votre retour sur investissement !,11/2019,12/28/19
Google Adwords Masterclass: Werde zum Google Adwords Profi,www.udemy.com/course/google-adwords-masterclass-werde-zum-google-adwords-profi/,Jonas Klaholz,199.99,11.39,3.4(37 ratings),Marketing,Werbung,Google Ads (Adwords),1.050,Deutsch,Google Adwords leicht gemacht - Wir machen dich zum Google Adwords Profi!,11/2017,12/28/19
Temel ve Orta Düzey Google Ads 2019 (Adwords) Eğitimi,www.udemy.com/course/google-ads-egitimi-2019/,Enes USTA,94.99,11.39,4.7(14 ratings),Pazarlama,Dijital Pazarlama,Google Ads (Adwords),41,TÃ¼rkÃ§e,SÄ±fÄ±rdan BaÅlayarak Google Ads ÃÄrenmeye HazÄ±r MÄ±sÄ±nÄ±z?,5/2019,12/28/19
Curso Google Ads (Adwords) com Foco em Pequeno Orçamento,www.udemy.com/course/curso-google-ads-adwords-baixo-orcamento/,Mauricio Alexandre,39.99,11.39,3.6(6 ratings),Marketing,Marketing digital,Google Ads (Adwords),17,PortuguÃªs,As melhores prÃ¡ticas para vencer no Google Ads 2019 com um investimento restrito. Otimize seus esforÃ§os e resultados!,10/2019,12/28/19
Google Adwords e Facebook Ads - Marketing Digital Iniciantes,www.udemy.com/course/adwords-simples-e-rapido/,Wagner Cardoso,19.99,11.39,4.7(35 ratings),Marketing,Marketing digital,Google Ads (Adwords),204,PortuguÃªs,"Crie campanhas de Marketing Digital Completas e do ZERO com Adwords e Facebook Ads para Sites, Lojas e Youtube.",9/2019,12/28/19
Google Ads 2019: Crea tu Primera Campaña paso a paso,www.udemy.com/course/google-adwords-2018-crea-tu-primera-campana-paso-a-paso/,María Gil,199.99,11.39,3.9(166 ratings),Marketing,Marketing digital,Google Ads (Adwords),1.448,EspaÃ±ol,GuÃ­a para crear con Ã©xito tus primeros anuncios en Google Adwords e introducirte en el Marketing Digital y el pago PPC,1/2019,12/28/19
Structurer et Optimiser son compte AdWords,www.udemy.com/course/comment-creer-optimiser-campagnes-adwords-rentables/,Sébastien Tissier,49.99,11.39,3.7(15 ratings),Marketing,PublicitÃ©,Google Ads (Adwords),167,FranÃ§ais,DÃ©couvrez toutes les techniques pour optimiser le Retour sur Investissement de vos campagnes Adwords,1/2016,12/28/19
Google Adwords: mehr Klicks - weniger Kosten,www.udemy.com/course/google-adwords-kurs/,Norbert Weber,19.99,11.39,4.3(85 ratings),Marketing,Digitales Marketing,Google Ads (Adwords),575,Deutsch,So gewinnen Sie schnell und kostengÃ¼nstig neue Kunden und Interessenten,3/2016,12/28/19
Google Adwords para anunciarse con éxito (Actualizado 2017),www.udemy.com/course/google-adwords-para-anunciarse-con-exito/,Víctor Campuzano,89.99,11.99,4.4(434 ratings),Marketing,Advertising,Google Ads (Adwords),"1,691",Spanish,"Un recorrido paso a paso por todo el proceso de creaciÃ³n, anÃ¡lisis y optimizaciÃ³n de campaÃ±as en Google Adwords.",12/2017,12/28/19
google adword كورس احتراف انشاء وادارة اعلانات جوجل ادورد,www.udemy.com/course/google-adword/,Ahmed Apally,19.99,11.99,3.5(9 ratings),Marketing,Advertising,Google Ads (Adwords),191,Arabic,Ø§Ø­ØªØ±Ù Ø¹ÙÙ Ø§Ø¹ÙØ§ÙØ§Øª Ø§ÙØ´Ø¨ÙØ© Ø§ÙØ§Ø¹ÙØ§ÙÙØ© ÙØ¬ÙØ¬Ù Ø§Ø¯ÙØ±Ø¯,7/2019,12/28/19
Google Ads Para Bienes Raíces - Capta Propiedades Desde Casa,www.udemy.com/course/googleadsparabienesraices/,Alex Del ángel,164.99,11.99,3.7(5 ratings),Marketing,Search Engine Optimization,Google Ads (Adwords),45,Spanish,Master en Google Ads,5/2019,12/28/19
Google Ads 2018 para Principiantes (Antes Google Adwords),www.udemy.com/course/google-ads-2018-para-principiantes-antes-google-adwords/,Yersel Hurtado,199.99,11.99,4.8(58 ratings),Marketing,Digital Marketing,Google Ads (Adwords),484,Spanish,Aprende a Crear tu Primera CampaÃ±a Rentable Paso a Paso en Google Ads (Nueva Interface 2018) y Multiplica tus Ventas,8/2018,12/28/19
Google Ads. Campagne. Remarketing. Keywords. Merchant,www.udemy.com/course/corso-google-ads-pratico-campagne-strumenti-seo-progetti/,Roberto Santoli,74.99,11.99,0.0(0 ratings),Business,Vendite,Google Ads (Adwords),7,Italiano,Remarketing. Wordpress. Landing page. ex Adwords,12/2019,12/28/19
Introdução ao Google Adwords,www.udemy.com/course/introducao-ao-google-adwords-comschool/,ComSchool Cursos,19.99,11.99,3.2(177 ratings),Marketing,Marketing digital,Google Ads (Adwords),681,PortuguÃªs,Aprenda os conceitos bÃ¡sicos e veja como Ã© fÃ¡cil criar campanhas,1/2016,12/28/19
Google Ads Uzmanlığı Eğitimi - Google AdWords,www.udemy.com/course/google-adwords-reklam-egitimi/,Mustafa Coşkun,19.99,11.99,4.5(30 ratings),Pazarlama,ReklamcÄ±lÄ±k,Google Ads (Adwords),160,TÃ¼rkÃ§e,Tamamen SÄ±fÄ±rdan BaÅlayarak Google Ads ÃÄreneceksiniz. Ä°nternette Reklam Vermenin Profesyonel Halini Kolayca ÃÄrenin,3/2019,12/28/19
Комплексное обучение Яндекс Директу и Google Ads,www.udemy.com/course/shinta_ads_yd_spec_2018/,Игорь Чащин,64.99,11.99,3.0(1 rating),ÐÐ°ÑÐºÐµÑÐ¸Ð½Ð³,Ð ÐµÐºÐ»Ð°Ð¼Ð°,Google Ð ÐµÐºÐ»Ð°Ð¼Ð°,5,Ð ÑÑÑÐºÐ¸Ð¹,Ð¡Ð°Ð¼Ð¾ÑÑÐ¾ÑÑÐµÐ»ÑÐ½Ð¾ Ð¸Ð·ÑÑÐ¸ÑÐµ Ð¾ÑÐ½Ð¾Ð²Ñ ÐºÐ¾Ð½ÑÐµÐºÑÑÐ½Ð¾Ð¹ ÑÐµÐºÐ»Ð°Ð¼Ñ. ÐÐ´ÐµÐ°Ð»ÑÐ½Ð¾ Ð¿Ð¾Ð´Ð¾Ð¹Ð´ÐµÑ Ð´Ð»Ñ Ð½Ð¾Ð²Ð¸ÑÐºÐ¾Ð².,7/2018,12/28/19
Google Adwords Neukunden System für KMUs,www.udemy.com/course/adwords-neukunden-system-fur-kmus/,Daniel Angeloff,94.99,11.99,4.0(32 ratings),Marketing,Digitales Marketing,Google Ads (Adwords),244,Deutsch,"Mehr Klicks, Mehr Anfragen, Mehr Kunden Ã¼ber Google Adwords",5/2018,12/28/19
Máster de Publicidad Online - 6 cursos en 1,www.udemy.com/course/master-de-publicidad-online-6-cursos-en-1/,Raúl Liñán,199.99,11.99,3.8(17 ratings),Marketing,Advertising,Google Ads (Adwords),105,Spanish,"Desarrolla, gestiona y mide campaÃ±as de publicidad en las 6 principales plataformas en Internet y capta clientes",5/2018,12/28/19
"Publicidad en Google, Fundamentos de Marketing en Google Ads",www.udemy.com/course/andresbrachetta-ecosistema-publicitario-google/,Andres Brachetta ⭐⭐⭐⭐⭐,199.99,11.99,4.4(69 ratings),Marketing,Digital Marketing,Google Ads (Adwords),"1,618",Spanish,"â¢ Recomendado para Principiantes| InicÃ­ate en Google Ads y Publicita tu Negocio en Google, Youtube, Waze, Adwords, SEM.",4/2019,12/28/19
Formação em Google Ads (AdWords) | Do Zero ao Avançado,www.udemy.com/course/formacao-em-google-ads-adwords/,Rafael Mota,29.99,11.99,4.3(10 ratings),Marketing,Marketing digital,Google Ads (Adwords),309,PortuguÃªs,"Torne-se Expert em Google Ads. Aprenda Absolutamente tudo sobre Rede de pesquisa, Display, Youtube ads e Remarketing.",8/2019,12/28/19
"AdWords, corso pratico per promuovere online la tua attività",www.udemy.com/course/adwords-corso-pratico-per-promuovere-online-la-tua-attivita/,Mummu Academy E-Learning,139.99,11.99,4.4(28 ratings),Marketing,PubblicitÃ ,Google Apps,98,Italiano,"Usare Adwords per fare pubblicitÃ  online, guadagnare di piÃ¹ dai tuoi annunci e trovare nuovi clienti",5/2018,12/28/19
