Course,URL,instructor,Price (full),Price (discount),Rank,Category 1,Category 2,Category 3,Enrollment,Language,Description,Last Update,Date Scraped
Google AdWords para Principiantes,www.udemy.com/course/google-adwords-principiantes/,Alvaro Bellido,79.99,11.99,4.4(273 ratings),Marketing,Digital Marketing,Google Ads (Adwords),"2,687",Spanish,Este curso te enseÃ±arÃ¡ los conceptos bÃ¡sicos para que puedas crear la primera campaÃ±a de AdWords para tu negocio.,9/2015,12/28/19
Google AdWords (Ads) Reklamcılık Eğitimi,www.udemy.com/course/adan-zye-google-adwords-reklamcilik/,Sencer Yurdatapan,44.99,11.99,3.4(25 ratings),Pazarlama,Dijital Pazarlama,Google Ads (Adwords),100,TÃ¼rkÃ§e,"Google Ads, Arama ve GÃ¶rÃ¼ntÃ¼lÃ¼ Reklam AÄÄ±nda DoÄru ve Etkili Reklam Vermeyi ÃÄrenin!",6/2018,12/28/19
AdWords de Google. Crea las mejores campañas publicitarias,www.udemy.com/course/adwords-de-google-crea-las-mejores-campanas-publicitarias/,"Marco Canciani, M.Sc",129.99,11.99,4.4(27 ratings),Marketing,Marketing digital,Google Ads (Adwords),242,EspaÃ±ol,"Aprende todos los trucos y tÃ©cnicas para crear anuncios de Google AdWords de forma rÃ¡pida, directa y efectiva",9/2017,12/28/19
Google ADS pentru Începători - Realizat pe o Campanie Reala,www.udemy.com/course/google-ads-pentru-incepatori-5-zile-de-campanie-reala/,Secrier Alexandru,84.99,11.99,0.0(0 ratings),Marketing,Marketing digital,Marketing de conÈinut,3,RomÃ¢nÄ,LanseazÄ-Èi acum propria campanie Google AdWords Èi creÈte-Èi vÃ¢nzÄrile online,9/2019,12/28/19
ADWORDS Acelerado y Práctico *Nueva Interfaz* Google AdWords,www.udemy.com/course/adwords-red-de-busqueda-google-adwords-nueva-interfaz/,Beto Sanro,54.99,11.99,3.8(18 ratings),Marketing,Advertising, Google Ads (Adwords),64,Spanish,"AnÃºnciate como un Experto frente a Millones de Personas. Interfaz totalmente renovada. CampaÃ±as, Conversiones y Reportes",10/2017,12/28/19
PACK Imagens Ads | E-commerce e Dropshipping,www.udemy.com/course/imagens-ads/,José Rodrigo Lima da Silva,64.99,11.99,2.8(9 ratings),Design,Design grÃ¡fico,EdiÃ§Ã£o de imagens,27,PortuguÃªs,Crie Imagens e VÃ­deos IncrÃ­veis para seus Produtos |Todos os Formatos Feed e Stories ...,4/2019,12/28/19
Curso Google Ads Atualizado + Material de Apoio,www.udemy.com/course/curso-google-ads/,Diff Comunicação,19.99,11.99,4.2(8 ratings),Marketing,Marketing digital,Marketing digital,214,PortuguÃªs,"Mais vendas, mais visitantes no site, mais leads com campanhas de baixo custo.",3/2019,12/28/19
Pazarlama Stratejileri ve Google Ads Eğitimi,www.udemy.com/course/pazarlama-stratejileri-ve-google-ads-egitimi/,Anil Çi̇l,99.99,11.99,3.2(25 ratings),Pazarlama,Dijital Pazarlama,Google Ads (Adwords),119,TÃ¼rkÃ§e,"Stratejilere Hakim Olup, Google Ads'i ( Google Adwords ) Etkin KullanÄ±p,Dijital Pazarlama ile Hedeflerinize UlaÅÄ±n.",11/2018,12/28/19
Curso Acelerado de Google Adwords en 2019 - Garantizado!,www.udemy.com/course/curso-google-adwords-marketing-digital/,Hegel Eisenhower Gonzalez,99.99,11.99,3.7(34 ratings),Marketing,Digital Marketing,Google Ads (Adwords),281,Spanish,Aprende a crear campaÃ±as de publicidad efectivas en Google sin conocimientos previos y en solo una semana o menos!,2/2018,12/28/19
"Google Adwords, Curso completo con Profesor Certificado",www.udemy.com/course/google-adwords-curso-completo-con-profesor-certificado/,Nicolas Laczka,149.99,11.99,4.0(72 ratings),Marketing,Marketing digital, Google Ads (Adwords),818,EspaÃ±ol,Captar trÃ¡fico y generar ingresos con Google Adword.,2/2017,12/28/19
Olvídate del SEO y paga por Click - Adwords,www.udemy.com/course/olvidate-del-seo-y-paga-por-click-adwords/,Aaron Cárdenas,39.99,11.99,5.0(1 rating),Marketing,Marketing digital,Google Ads (Adwords),4,EspaÃ±ol,Experto en google adwords,11/2018,12/28/19
Google Web Designer для начинающих (2019),www.udemy.com/course/google-web-designer-2018/,Евгений Тридчиков,19.99,11.99,3.9(21 ratings),ÐÐ°ÑÐºÐµÑÐ¸Ð½Ð³,ÐÐ½ÑÐµÑÐ½ÐµÑ-Ð¼Ð°ÑÐºÐµÑÐ¸Ð½Ð³,Google Ð ÐµÐºÐ»Ð°Ð¼Ð°,428,Ð ÑÑÑÐºÐ¸Ð¹,ÐÐ°ÑÑÐ¸ÑÐµÑÑ ÑÐ¾Ð·Ð´Ð°Ð²Ð°ÑÑ Ð°Ð½Ð¸Ð¼Ð¸ÑÐ¾Ð²Ð°Ð½Ð½ÑÐµ HTML-5 Ð±Ð°Ð½Ð½ÐµÑÑ Ð´Ð»Ñ Google Adwords Ð¸ Ð¯Ð½Ð´ÐµÐºÑ ÐÐ¸ÑÐµÐºÑ,7/2018,12/28/19
Débuter avec Adwords,www.udemy.com/course/formation-google-adwords-debutant/,Sébastien Tissier,49.99,11.99,3.8(58 ratings),Marketing,PublicitÃ©,Google Ads (Adwords),415,FranÃ§ais,Apprenez comment utiliser Adwords pour toucher plus de clients et faire croitre votre business,1/2016,12/28/19
Google AdWords: Crea exitosas campañas publicitarias online,www.udemy.com/course/google-adwords-crea-exitosas-campanas-publicitarias-online/,Raúl Liñán,64.99,11.99,4.3(25 ratings),Marketing,Advertising,Google Ads (Adwords),103,Spanish,ObtÃ©n el mÃ¡ximo desempeÃ±o en la captaciÃ³n de clientes para un negocio o empresa con la publicidad de Google AdWords,1/2018,12/28/19
Google Ads 360 Mastery Course (in Hindi) By Gaurav Bhardwaj,www.udemy.com/course/google-ads-360-mastery-course-in-hindi-by-gaurav-bhardwaj/,GAURAV KUMAR,0.0,19.99,0.0(0 ratings),Marketing,Advertising,Google Ads (Adwords),0,Hindi,Learn How to Be On Top at Google's Search Results.,4/2019,12/28/19
Curso de Google Ads. Crea tus Primeras Campañas,www.udemy.com/course/curso-de-google-ads-crea-tus-primeras-campanas/,As Capacitación,99.99,11.99,0.0(0 ratings),Marketing,Digital Marketing,Google Ads (Adwords),2,Spanish,Aumenta tus ventas sin experiencia en la plataforma,11/2019,12/28/19
Utilizando Marketing Digital no Seu Negócio,www.udemy.com/course/utilizando-as-midias-sociais-no-seu-negocio/,Ligia Carvalho,34.99,11.99,5.0(1 rating),Marketing,Marketing digital,Marketing digital,5,PortuguÃªs,"Facebook, Instagram e Google Ads, SEO, Personas, Inbound Marketing e muito mais! Tudo o que vocÃª precisa saber!",6/2019,12/28/19
Aumente suas vendas com o Google Adwords,www.udemy.com/course/aumente-suas-vendas-com-o-google-adwords/,Sheila Piestun,29.99,11.99,4.4(10 ratings),Marketing,Marketing digital,Google Ads (Adwords),35,PortuguÃªs,Aprenda de uma vez por todas como criar uma campanha na rede de pesquisa da Google,2/2018,12/28/19
Google AdWords كيف تنشئ  حمله اعلانيه علي جوجل,www.udemy.com/course/google-adwords-t/,Waleed Abbas,19.99,11.99,2.5(2 ratings),Marketing,Digital Marketing,Google Ads (Adwords),9,Arabic,ÙÙÙÙØ© Ø§Ø³ØªØ®Ø¯Ø§Ù Ø¨Ø±ÙØ§ÙØ¬ Ø¬ÙØ¬Ù Ø§Ø¯ÙØ±Ø¯ ÙÙ Ø¥ÙØ´Ø§Ø¡ Ø­ÙÙØ© Ø§Ø¹ÙØ§ÙÙØ© Ø¹ÙÙ ÙØ­Ø±Ù Ø§ÙØ¨Ø­Ø« Ø¬ÙØ¬Ù,11/2016,12/28/19
"Google Ads Para Vendas, captura de Clientes, leads e Emails",www.udemy.com/course/google-ads-para-vendas-captura-de-clientes-leads-e-emails/,Matheus Oliveira,19.99,11.39,3.3(4 ratings),Marketing,Marketing digital,Google Ads (Adwords),14,PortuguÃªs,Google ads Para vendas e um mÃ©todo para vocÃª que deseja atrair mais clientes renovar sua carteira de clientes ou crescer,12/2018,12/28/19
Aprenda a anunciar no Google,www.udemy.com/course/aprenda-a-anunciar-no-google/,Michele Massarelli Cabral,49.99,11.39,5.0(1 rating),Marketing,Marketing digital,Google Ads (Adwords),3,PortuguÃªs,Teoria e prÃ¡tica,3/2019,12/28/19
Sıfırdan Temel ve Orta Düzey Google Adwords Eğitimi,www.udemy.com/course/temel-ortaduzey-google-adwords-ads-egitimi/,Eyüp Ceviz,29.99,11.39,4.2(6 ratings),Pazarlama,Dijital Pazarlama,Google Ads (Adwords),32,TÃ¼rkÃ§e,SÄ±fÄ±rdan Temel ve Orta DÃ¼zey Google Adwords EÄitimi,7/2018,12/28/19
Como Ganhar Créditos em AdWords para sua ONG,www.udemy.com/course/como-ganhar-creditos-em-adwords-para-sua-ong/,Soraia Novaes,89.99,11.39,4.4(5 ratings),Marketing,Publicidade,Google Ads (Adwords),13,PortuguÃªs,Compartilhe sua causa com o mundo,10/2019,12/28/19
Curso Google Ads Express para Iniciantes,www.udemy.com/course/curso-google-ads-express-para-iniciantes/,Mauricio Fazolin,94.99,11.39,4.5(1 rating),Marketing,Marketing digital,Google Ads (Adwords),2,PortuguÃªs,"FaÃ§a suas campanhas no Google Ads de maneira rÃ¡pida, fÃ¡cil e eficiente no novo painel inteligente do Google Ads",10/2019,12/28/19
Google Ads (adwords) Completo e Atualizado,www.udemy.com/course/googleadscompleto/,Luis Eduardo Lacerda Braz,199.99,11.39,0.0(0 ratings),Marketing,Marketing digital,Google Ads (Adwords),1,PortuguÃªs,"Aprenda a usar, Sem jogar dinheiro fora, a melhor ferramenta do Google para divulgar seu negÃ³cio do bÃ¡sico ao avanÃ§ado",10/2019,12/28/19
Google Ads Display Assessment,www.udemy.com/course/google-ads-display/,Jonathan Pericoco,19.99,11.39,0.0(0 ratings),Marketing,Marketing de conteÃºdo,Google Ads (Adwords),1,PortuguÃªs,Google Ads Display Certification,10/2019,12/28/19
Gana por clicks con adwords 2,www.udemy.com/course/gana-por-clicks-con-adwords-2/,Aaron Cárdenas,39.99,11.39,5.0(1 rating),Marketing,Marketing digital,Google Ads (Adwords),2,EspaÃ±ol,no hagas seo,11/2018,12/28/19
Kurs Google AdWords Reklama w Wyszukiwarce,www.udemy.com/course/kurs-google-adwords-reklama-w-wyszukiwarce/,eduweb.pl - Kursy Wideo,0.0,49.99,0.0(0 ratings),Marketing,Reklama,Google Ads (Adwords),1,Polski,PROMOCJA I BIZNES,6/2019,12/28/19
Google AdWords Guía para Principiantes ¡Actualizado 2017!,www.udemy.com/course/curso-adwords/,Roxana Falasco,194.99,48.75,4.0(92 ratings),Marketing,Search Engine Optimization,Google Ads (Adwords),415,Spanish,Aprende a usar AdWords. CÃ³mo crear anuncios efectivos y campaÃ±as rentables. Consigue mÃ¡s ventas con la menor inversiÃ³n,3/2018,12/28/19
Curso de Google Adwords Express,www.udemy.com/course/curso-de-google-adwords-express/,Carlos Muller,19.99,11.39,0.0(0 ratings),Marketing,Marketing digital,Google Ads (Adwords),1,PortuguÃªs,Seu NegÃ³cio em Destaque no Google com Resultados Express,9/2018,12/28/19
Kurs Google AdWords Reklama w Sieci Reklamowej,www.udemy.com/course/kurs-google-adwords-reklama-w-sieci-reklamowej/,eduweb.pl - Kursy Wideo,0.0,54.99,0.0(0 ratings),Marketing,Reklama,Google Ads (Adwords),2,Polski,PROMOCJA I BIZNES,6/2019,12/28/19
Google Adwords курсы,www.udemy.com/course/google-adwords-kz/,Nurzhol Tabigat,19.99,11.39,0.0(0 ratings),Business,Sales,Google Ads (Adwords),9,Kazakh,ÐÐ½ÑÐµÑÐ½ÐµÑ Ð¼Ð°ÑÐºÐµÑÐ¸Ð½Ð³,3/2018,12/28/19
How to Earn More with Google Adsense in Urdu/Hindi,www.udemy.com/course/how-to-earn-more-with-google-adsense-in-urduhindi/,MUNSAB Ali,19.99,11.39,0.0(0 ratings),Business,Home Business,Google Ads (Adwords),33,Urdu,How to earn online with Google Adsense,8/2017,12/28/19
Ausführlicher Google Adwords Grundkurs: Displaynetzwerk,www.udemy.com/course/ausfuhrlicher-google-adwords-grundkurs-displaynetzwerk/,Carlo Siebert,0.0,Free,3.9(35 ratings),Marketing,Digitales Marketing,Google Ads (Adwords),1.554,Deutsch,Schritt fÃ¼r Schritt zur ersten eigenen Adwords Kampagne im Displaynetzwerk. Live Screencast,7/2017,12/28/19
Ausführlicher Google Adwords Grundkurs: Google Shopping,www.udemy.com/course/ausfuhrlicher-google-adwords-grundkurs-google-shopping/,Carlo Siebert,0.0,Free,4.2(51 ratings),Marketing,Digitales Marketing,Google Ads (Adwords),1.598,Deutsch,Schritt fÃ¼r Schritt zur ersten eigenen Adwords Google Shopping Kampagne. Live Screencast,8/2017,12/28/19
Ausführlicher Google Adwords Grundkurs: Remarketing,www.udemy.com/course/ausfuhrlicher-google-adwords-grundkurs-remarketing/,Carlo Siebert,0.0,Free,4.2(21 ratings),Marketing,Digitales Marketing,Google Ads (Adwords),1.430,Deutsch,Schritt fÃ¼r Schritt zur ersten eigenen Adwords Remarketing Kampagne. Live Screencast,8/2017,12/28/19
Introducción a Google Adwords,www.udemy.com/course/introduccion-a-google-adwords/,Nicolas Laczka,0.0,Free,4.1(487 ratings),Marketing,Marketing digital,Google Ads (Adwords),10.806,EspaÃ±ol,Clases gratuitas sacadas de mi curso completo de AdWords. Descubriremos la interfaz y algunas opciones bÃ¡sicas.,4/2017,12/28/19
Ausführlicher Google Adwords Grundkurs: YouTube Werbung,www.udemy.com/course/ausfuhrlicher-google-adwords-grundkurs-youtube-werbung/,Carlo Siebert,0.0,Free,4.4(12 ratings),Marketing,Digitales Marketing,Google Ads (Adwords),1.413,Deutsch,Schritt fÃ¼r Schritt zur ersten eigenen YouTube Kampagne im Suchnetzwerk. Live Screencast,7/2017,12/28/19
Adwords : découvrir et se perfectionner,www.udemy.com/course/formation-google-adwords/,Vincent Chomier,0.0,Free,3.9(94 ratings),Marketing,Marketing numÃ©rique,Google Ads (Adwords),1Â 342,FranÃ§ais,Boostez vos ventes en ligne,2/2018,12/28/19
Ausführlicher Google Adwords Grundkurs: Suchnetzwerk,www.udemy.com/course/ausfuhrlicher-google-adwords-grundkurs-suchnetzwerk/,Carlo Siebert,0.0,Free,4.4(118 ratings),Marketing,Digitales Marketing,Google Ads (Adwords),2.164,Deutsch,Schritt fÃ¼r Schritt zur ersten eigenen Adwords Kampagne im Suchnetzwerk. Live Screencast,8/2017,12/28/19
(Ücretsiz) Google Ads Reklamcılığı [30 Dakika],www.udemy.com/course/ucretsiz-google-ads-adwords-egitimi/,Enes USTA,0.0,Free,4.3(104 ratings),Pazarlama,Dijital Pazarlama,Google Ads (Adwords),4.173,TÃ¼rkÃ§e,30 Dakika'da Google Ads ile Reklam OluÅturmak!,6/2019,12/28/19
Google Ads para Principiantes,www.udemy.com/course/google-ads-para-principiantes/,Diego Davila,0.0,Free,4.4(22 ratings),Marketing,Social Media Marketing,Google Ads (Adwords),"1,521",Spanish,"Cree anuncios con Google Ads y promocione su negocio, productos y servicios en Google y YouTube.",11/2019,12/28/19
