Course,URL,instructor,Price (full),Price (discount),Rank,Category 1,Category 2,Category 3,Enrollment,Language,Description,Last Update,Date Scraped
Instagram Marketing : le guide complet pour réussir !,www.udemy.com/course/instagram-marketing-guide-complet/,Matthieu Blanco,119.99,11.39,3.7(26 ratings),Marketing,Marketing sur les rÃ©seaux sociaux,Marketing autour d'Instagram,131,FranÃ§ais,"MaÃ®triser Instagram : la gestion de vos contenus, dÃ©velloppez vos audiences, clients et campagnes publicitaire",2/2019,01/01/20
Instagram Ads para Empresas | 2019 | Atualizado,www.udemy.com/course/campanhas-instagram-ads/,Mariana Klein,39.99,11.39,4.3(146 ratings),Marketing,Marketing de redes sociais,Marketing no Instagram,615,PortuguÃªs,Aprenda a promover seus posts no Instagram,6/2019,01/01/20
Cómo ser Influencer y monetizar tu Instagram,www.udemy.com/course/como-ser-influencer-y-monetizar-tu-cuenta-de-instagram/,Cyberclick • Marketing Digital,24.99,11.39,5.0(2 ratings),Marketing,Marketing en redes sociales,Marketing en Instagram,15,EspaÃ±ol,"Crea tu propia comunidad en Instagram y busca tus primeros clientes, Â¡las marcas te esperan!",10/2019,01/01/20
Instagram Stories 2019: Um Guia Para Conquistar Clientes,www.udemy.com/course/instagram-stories-um-guia-para-conquistar-clientes/,IClass Cursos Online,29.99,11.39,4.4(40 ratings),Marketing,Marketing de redes sociais,Marketing no Instagram,239,PortuguÃªs,EstratÃ©gias Poderosas Para Conquistar Muitos Clientes e Aumentar Exponencialmente Suas Vendas,8/2019,01/01/20
Adım Adım Instagram Eğitimi ve instagram'dan Para Kazanmak,www.udemy.com/course/instagramdan-para-kazanmak-ve-adm-adm-100000-takipciye/,Hakan Kaan Açıkgöz,194.99,11.39,3.3(79 ratings),Pazarlama,Sosyal Medya Pazarlama,Instagram Pazarlama,284,TÃ¼rkÃ§e,YarÄ±m milyon takipÃ§ili fenomenden : Instagramâdan para kazanmak ve profesyonel instagram stratejisi.,6/2018,01/01/20
Instagram'da Zirveye Doğru! - Instagram Sayfa Yönetimi,www.udemy.com/course/instagramda-zirveye-dogru-instagram-sayfa-yonetimi/,Rıza Furkan Şahin,94.99,11.39,3.8(34 ratings),Pazarlama,Sosyal Medya Pazarlama,Instagram Pazarlama,173,TÃ¼rkÃ§e,Dijital Pazarlama ve Sosyal Medya UzmanlÄ±ÄÄ± iÃ§in Instagram Sayfa YÃ¶netimi ve Ä°Ã§erik Ãretmek,5/2019,01/01/20
Instagram-Business: Vermarkte dich selbst!,www.udemy.com/course/instagram-business-marketing-kurs/,Alexander Schreiner,119.99,11.39,4.5(36 ratings),Marketing,Social-Media-Marketing,Instagram-Marketing,264,Deutsch,So gewinnst du durch Instagram-Marketing gezielt und automatisiert Kunden und vergrÃ¶Ãerst deine Reichweite!,11/2019,01/01/20
Instagram Marketing - Die perfekte Werbung auf Instagram,www.udemy.com/course/instagram-marketing-die-perfekte-werbung-auf-instagram/,André Thöne,199.99,11.39,3.8(41 ratings),Marketing,Social-Media-Marketing,Instagram-Marketing,598,Deutsch,Wie du unfassbar gÃ¼nstig und effektiv auf Instagram werben kannst,5/2017,01/01/20
Instagram : La stratégie ultime pour développer ton compte,www.udemy.com/course/instagram-la-strategie-ultime-pour-developper-ton-compte/,Julien Baron,19.99,11.39,3.7(86 ratings),Marketing,Marketing sur les rÃ©seaux sociaux,Marketing autour d'Instagram,1Â 466,FranÃ§ais,La mÃ©thodologie complÃ¨te pour maitriser comme un pro Instagram et l'utiliser comme outil marketing pour ton business,12/2018,01/01/20
Instagram Marketing 2019: tecniche e strategie per crescere,www.udemy.com/course/instagram-marketing-tecniche-e-strategie-per-crescere/,Chiara Pinna,189.99,11.39,2.9(237 ratings),Marketing,Content Marketing,Marketing su Instagram,1.080,Italiano,"Attira follower davvero interessati, convertili in clienti paganti e fai conoscere il tuo brand attraverso instagram",6/2019,01/01/20
Dein Instagram Kick: Programmiere deinen eigenen Bot!,www.udemy.com/course/instagram-sofort-mehr-follower/,Alexander Schreiner,199.99,11.39,4.0(7 ratings),Marketing, Social-Media-Marketing,Instagram-Marketing,112,Deutsch,Exklusive Anleitung 2019: Wie du mit einem Profi-Profil & deinem eigenen Bot sofort massenweise Follower sammelst,11/2019,01/01/20
Das beste Instagram-Marketing Tool in 2020!,www.udemy.com/course/das-beste-instagram-marketing-tool-in-2019/,Dominik Ebner,19.99,11.39,4.3(11 ratings),Marketing,Social-Media-Marketing,Instagram-Marketing,520,Deutsch,DAS Must-Have Instagram-Marketing Tool fÃ¼r schnelles Wachstum - mehr Likes und Follower garantiert!,4/2019,01/01/20
Instagram Marketing Masterplan - Automatisierte Reichweite,www.udemy.com/course/instagrammasterplan/,Moritz Barg,79.99,20.00,3.9(74 ratings),Marketing,Social-Media-Marketing,Instagram-Marketing,242,Deutsch,Gewinne TÃGLICH bis zu 100 ECHTE Instagram Follower indem du die geheimen Techniken von amerikanischen Agenturen nutzt!,1/2018,01/01/20
Instagram Ads para NO Expertos,www.udemy.com/course/instagram-ads-para-no-expertos/,RankAcademy Global,84.99,11.39,4.1(23 ratings),Marketing,Marketing digital,Marketing en Instagram,69,EspaÃ±ol,CÃ³mo Hacer Publicidad Exitosa en Instagram para CUALQUIER Tipo de PyME en el Mercado,7/2018,01/01/20
Instagram - De ZERO a 10.000 Seguidores Reais no Instagram,www.udemy.com/course/instagram-marketing-dez-mil-seguidores/,Rayan Maia,39.99,11.39,4.2(47 ratings),Marketing,Marketing de afiliados,Marketing no Instagram,165,PortuguÃªs,Comece hoje mesmo a obter novos seguidores para o seu negÃ³cio,1/2019,01/01/20
Instagram Marketing 2020: Wie du aktive Follower gewinnst!,www.udemy.com/course/instagram-marketing-2019-wie-du-aktive-follower-gewinnst/,Dominik Ebner,19.99,11.39,4.3(11 ratings),Marketing,Social-Media-Marketing,Instagram-Marketing,133,Deutsch,Die ultimative Schritt-fÃ¼r-Schritt Anleitung fÃ¼r 10.000 echte & aktive Instagram Follower in 2020!,6/2019,01/01/20
Instagram Marketing : Guide complet [visibilité / followers],www.udemy.com/course/instagram-marketing-guide-complet-visibilite-followers/,albert académie,79.99,11.39,3.5(39 ratings),Marketing,Marketing sur les rÃ©seaux sociaux,Marketing autour d'Instagram,233,FranÃ§ais,"Attirez des âfollowers ultra ciblÃ©s, convertissez-les en clients payants & faites grossir votre business grÃ¢ce Ã  Insta.",2/2018,01/01/20
Instagram for Doctors (Arabic)| احترف الانستغرام للأطباء,www.udemy.com/course/instagram-for-doctors-arabic/,Mohamad Sadekli,19.99,11.39,4.9(11 ratings),Marketing,Social Media Marketing,Instagram Marketing,40,Arabic,Ø£ÙÙ ÙÙØ±Ø³ Ø§Ø­ØªØ±Ø§ÙÙ ÙÙØ§ÙØ³ØªØºØ±Ø§Ù Ø¨Ø§ÙÙØºØ© Ø§ÙØ¹Ø±Ø¨ÙØ© ÙØ®ØµØµ ÙÙØ£Ø·Ø¨Ø§Ø¡ ÙØ£Ø·Ø¨Ø§Ø¡ Ø§ÙØ£Ø³ÙØ§Ù ÙØ·ÙØ§Ø¨ Ø§ÙØ·Ø¨ Ø¨ÙØ®ØªÙÙ Ø§Ø®ØªØµØ§ØµØ§ØªÙÙ,7/2019,01/01/20
Comment Gagner des Abonnés Rapidement sur Instagram (secret),www.udemy.com/course/comment-gagner-5000-abonnes-sur-instagram-en-1-semaine/,Jérémy BRB,79.99,11.39,3.7(2 ratings),Marketing,Marketing sur les rÃ©seaux sociaux,Marketing autour d'Instagram,21,FranÃ§ais,Croissance Turbo : Le combo le plus efficace pour gagner des abonnÃ©s rapidement sur Instagram,1/2019,01/01/20
Instagram Marketing Stratégie Gagnante,www.udemy.com/course/instagram-marketing-strategie-gagnante/,Rene Major,49.99,11.39,4.2(3 ratings),Marketing,Marketing sur les rÃ©seaux sociaux,Marketing autour d'Instagram,13,FranÃ§ais,Formation Instagram complÃ¨te VidÃ©os pas Ã  pas,8/2019,01/01/20
⭐️Instagram Fame: [10.000 ECHTE] Follower auf Instagram,www.udemy.com/course/echte-instagram-follower/,Alexander Hammerschmied,99.99,11.39,5.0(3 ratings),Marketing,Social-Media-Marketing,Instagram-Marketing,157,Deutsch,[10.000 und mehr] Nutze die ultimativen Wachstums-Strategien von Top-Influencern. Alle Techniken zum einfachen anwenden,5/2019,01/01/20
IGTV 2019: Domine o Canal de Vídeos do Instagram,www.udemy.com/course/igtv-domine-o-canal-de-videos-do-instagram/,IClass Cursos Online,19.99,11.39,4.8(5 ratings),Marketing,Marketing de redes sociais,Marketing no Instagram,65,PortuguÃªs,"Segredos, Truques e EstratÃ©gias de Marketing Para Conquistar Seu PÃºblico Pelo IGTV",8/2019,01/01/20
Como medir e melhorar os resultados no Instagram Stories,www.udemy.com/course/como-medir-e-melhorar-os-resultados-no-instagram-stories/,Júnior Siri,29.99,11.39,5.0(2 ratings),Marketing,Marketing de redes sociais,Marketing no Instagram,29,PortuguÃªs,Aprenda a melhorar os resultados de um dos formatos de maior alcance orgÃ¢nico dentre as mÃ­dias sociais.,11/2019,01/01/20
"Marketing en Instagram Para Personas, Empresas y Negocios",www.udemy.com/course/seguidores-instagram/,Daniel Alejandro,89.99,11.39,4.3(82 ratings),Marketing,Social Media Marketing,Instagram Marketing,366,Spanish,"Aprende Paso a Paso como Crear un Negocio con una Cuenta de Instagram, Como Vender con Instagram y Generar Clientes",11/2019,01/01/20
Il marketing in IGTV con Instagram video,www.udemy.com/course/il-marketing-in-instagram-con-i-video/,Paolo Caviezel,199.99,11.39,4.5(3 ratings),Marketing,Marketing Video & Mobile,Marketing su Instagram,28,Italiano,Dal conoscere INSTAGRAM VIDEO alle strategie di marketing in IGTV tutto in un unico corso,7/2019,01/01/20
Поиск сокровищ в  #Инстаграм,www.udemy.com/course/howtomakemoney/,Miroslav Budilin,44.99,11.39,3.9(40 ratings),ÐÐ°ÑÐºÐµÑÐ¸Ð½Ð³,ÐÐ½ÑÐµÑÐ½ÐµÑ-Ð¼Ð°ÑÐºÐµÑÐ¸Ð½Ð³,ÐÑÐ¾Ð´Ð²Ð¸Ð¶ÐµÐ½Ð¸Ðµ Ð² Instagram,176,Ð ÑÑÑÐºÐ¸Ð¹,ÐÑÐ¾ÐºÐ°ÑÐ°Ð¹ ÑÐ²Ð¾Ð¹ Ð¸Ð½ÑÑÐ°Ð³ÑÐ°Ð¼ Ð±ÐµÐ· Ð²Ð»Ð¾Ð¶ÐµÐ½Ð¸Ð¹,10/2018,01/01/20
Curso Completo de Compra e Venda de Seguidores no Instagram,www.udemy.com/course/gerar-seguidores-nas-midias-sociais-curso-completo/,Jonathan Marques,89.99,11.39,3.8(60 ratings),Marketing,Aumento de usuÃ¡rios de produto/serviÃ§o,Marketing no Instagram,224,PortuguÃªs,"Fama InstantÃ¢nea, aprenda a inserir Seguidores, ganhar de 15 Ã  500 Seguidores por dia Segmentados por localizaÃ§Ã£o.",9/2019,01/01/20
Instagram Follower kostenlos und automatisch DO IT YOURSELF,www.udemy.com/course/instagram-automatisiertes-organisches-wachstum/,Michael Schmid,29.99,11.39,4.0(46 ratings),Marketing,Growth Hacking,Instagram-Marketing,704,Deutsch,Growth Hacking - Wie man einen kostenlosen Instagram Bot vom Heimrechner betreibt - ohne Programmierkenntnisse.,2/2019,01/01/20
Instagram Story Masterclass - Marketing mit Instagram Story,www.udemy.com/course/instagram-story-marketing/,Philip Hofmacher,199.99,11.39,3.8(10 ratings),Marketing,Social-Media-Marketing,Instagram-Marketing,51,Deutsch,Sozial Media Marketing: Digitales Marketing auf Instagram erfolgreich umsetzen und die Instagram Stories meistern.,1/2019,01/01/20
Instagram  2018: Paso a paso hasta los 10.000 seguidores.,www.udemy.com/course/instagram-2018-paso-a-paso-hasta-los-10000-seguidores/,Fernando del Arco Llargués,34.99,11.39,3.6(153 ratings),Marketing,Marketing digital,Marketing en Instagram,2.055,EspaÃ±ol,Haz crecer de forma masiva tus seguidores e interacciones hasta que puedas monetizar tu cuenta.,5/2018,01/01/20
Neueste Instagram Hacks 2020- so bekommst Du jetzt Follower,www.udemy.com/course/neueste-instagram-hacks/,Christian Gera,199.99,11.99,0.0(0 ratings),Marketing,Social-Media-Marketing,Instagram-Marketing,14,Deutsch,Der neue Algorithmus 2020 ist da - es Ã¤ndert sich alles & wir gehen mit,12/2019,01/01/20
Instagram Marketing 2019: Cómo crecer en Instagram,www.udemy.com/course/instagram-marketing-2018-como-crecer-en-instagram/,María Gil,199.99,11.99,4.0(71 ratings),Marketing,Marketing en redes sociales,Marketing en Instagram,1.138,EspaÃ±ol,GuÃ­a paso a paso sobre CÃ³mo Crecer en Instagram utilizando las Mejores Estrategias de Marketing en Redes Sociales.,5/2019,01/01/20
Facebook & Instagram Marketing: Der Komplette Crashkurs,www.udemy.com/course/facebook-instagram-marketing-der-komplette-crashkurs/,Patrick Thiele,109.99,11.99,3.7(26 ratings),Marketing,Social-Media-Marketing,Facebook-Marketing,643,Deutsch,"Professionelle Marketing fÃ¼r Facebook & Instagram, Kostenloser Support & Tipps und Tricks zu Facebook & Instagram",6/2017,01/01/20
Batissez Une Communauté Instagram en Partant de ZÉRO,www.udemy.com/course/un-guide-complet-pour-passer-de-0-a-10000-abonnees-instagram/,Jessica Boulad,79.99,11.99,4.0(30 ratings),Marketing,Marketing numÃ©rique,Marketing autour d'Instagram,359,FranÃ§ais,Apprenez comment vous positionner sur Instagram pour attirer des abonnÃ©s hyper-ciblÃ©s et bÃ¢tir votre communautÃ©,6/2018,01/01/20
Los secretos de los Influencers para crecer en Instagram,www.udemy.com/course/los-secretos-de-los-influencers-para-crecer-en-instagram/,Jaime Martínez,94.99,11.99,4.6(9 ratings),Marketing,Marketing en redes sociales,Marketing en Instagram,60,EspaÃ±ol,Aprende las estrategias de los Influencers para sacarle el mÃ¡ximo partido a tu cuenta de instagram,11/2018,01/01/20
Instagram'da Sıfırdan Milyonlara! - Instagram Reklamcılığı,www.udemy.com/course/instagramda-sifirdan-milyonlara-instagram-reklamcligi/,Furkan PALABIYIK,69.99,11.99,2.8(9 ratings),Pazarlama,Sosyal Medya Pazarlama,Instagram Pazarlama,36,TÃ¼rkÃ§e,TÃ¼rkiye'nin En KapsamlÄ± Instagram Pazarlama Kursu!,6/2019,01/01/20
Instagram BOOSTER,www.udemy.com/course/instagram-power/,Damien Marketing Success,99.99,11.99,3.9(23 ratings),Marketing,Marketing sur les rÃ©seaux sociaux,CrÃ©ation de contenu,95,FranÃ§ais,Tire profit de la puissance d'Instagram !,1/2019,01/01/20
Instagram Marketing Komplettkurs: Deine ersten 10k Follower,www.udemy.com/course/instagram-marketing-komplettkurs-deine-ersten-10k-follower/,Patrick Thiele,124.99,11.99,3.6(48 ratings),Marketing,Social-Media-Marketing,Instagram-Marketing,898,Deutsch,#1 Instagram Masterclass: Der komplette Kurs fÃ¼r alle die auf Instagram durchstarten wollen,11/2017,01/01/20
Instagram-2-Go: Der Crashkurs für Quereinsteiger,www.udemy.com/course/instagram-crashkurs/,Alexander Schreiner,29.99,11.99,4.2(16 ratings),Marketing,Social-Media-Marketing,Instagram-Marketing,2.162,Deutsch,Lerne Instagram und all seine Geheimnisse kennen. Gehe die ersten Schritte in Richtung Instagram Marketing.,11/2019,01/01/20
Instagram Ads: Estratégias Vencedoras Para O Seu Negócio,www.udemy.com/course/instagram-ads-estrategias-vencedoras-para-o-seu-negocio/,Lucas Faggioni,119.99,11.99,4.3(7 ratings),Marketing,Marketing digital,Marketing no Instagram,17,PortuguÃªs,Aprenda como melhorar os resultados das suas campanhas do Instagram [AVANÃADO],6/2019,01/01/20
⭐Instagram-Influencer: Mehr Follower & Geld mit Top-Branding,www.udemy.com/course/instagram-engagierte-follower-durch-starkes-branding/,Philipp Stelzel,139.99,11.99,4.2(14 ratings),Marketing,Social-Media-Marketing,Instagram-Marketing,236,Deutsch,"So wirst du Influencer, baust deinen Account mit engagierten Followern auf und fÃ¤ngst an auf Instagram Geld zu verdienen",3/2019,01/01/20
インスタグラムで見込み客リストを集める方法,www.udemy.com/course/instagram-list/,石崎力也 (RIKIYA ISHIZAKI),199.99,11.99,2.6(7 ratings),ãã¼ã±ãã£ã³ã°,ãã¼ã±ãã£ã³ã°ã®åºç¤,Instagramãã¼ã±ãã£ã³ã°,32äººã®åè¬çãç»é²,æ¥æ¬èª,Instagramã¯ã2017å¹´æç¹ã§ã¢ã¯ãã£ãã¦ã¼ã¶ã¼æ°ã2000ä¸äººã¨ããªãå¤ãããã¸ãã¹ã§éå®¢ãããã¼ã«ã¨ãã¦æå¹ã§ããä»åã¯ãå§ããã°ããã§ãã¾ããã©ã­ã¯ã¼ãããªãæ¹ã®ããã«ãã©ã®ããã«ãã©ã­ã¯ã¼ãå¢ããã¦ããã®ããèª¬æãã¦ããã¾ã,12/2018,01/01/20
Domine os Instagram Stories: Destravando o Medo de Aparecer,www.udemy.com/course/domine-os-instagram-stories-destravando-o-medo-de-aparecer/,Fernando Vaz,99.99,11.99,4.8(5 ratings),Marketing,Marketing de redes sociais,Marketing no Instagram,21,PortuguÃªs,Aprenda a fazer Stories que Engajam e Vendem,7/2019,01/01/20
Instagram For Dummies,www.udemy.com/course/instagram-for-dummies/,Gabriele Valenti,34.99,11.99,4.7(2 ratings),Marketing,Social Media Marketing,Marketing su Instagram,6,Italiano,"Imparerai a creare un Feed ordinato, una biografia che converta gli utenti che passano in followers reali e tanto altro!",6/2019,01/01/20
Instagram Marketing: Conquistando mais seguidores,www.udemy.com/course/curso-instagram-marketing/,Matheus Fraga,34.99,11.99,4.4(21 ratings),Marketing,Marketing de redes sociais,Marketing no Instagram,61,PortuguÃªs,"Domine o instagram, Aprenda estrategias para aumentar seus seguidores, deixar seus seguidores cada vez mais engajado",8/2019,01/01/20
Instagram: Tus primeros 1000 seguidores en solo 2 semanas,www.udemy.com/course/curso-instagram-influencer/,Alberto Susin,24.99,11.99,4.1(13 ratings),Marketing,Marketing en redes sociales,Marketing en Instagram,60,EspaÃ±ol,Curso completo profesional para convertirte en influencer y crecer rapidamente tu cuenta personal o profesional,3/2018,01/01/20
Influencer-Marketing auf Instagram,www.udemy.com/course/influencer-marketing-instagram/,Markus Hermannsdorfer,119.99,11.39,3.7(9 ratings),Marketing,Social-Media-Marketing,Instagram-Marketing,83,Deutsch,Wie Du auf Instagram vierstellige Summen verdienst,3/2017,01/01/20
مبادئ التسويق والإعلان على انستغرام Instagram Marketing 2019,www.udemy.com/course/teqanny-ig19/,Eng. Mustafa Othman,0.0,19.99,4.4(10 ratings),None,None,None,None,None,None,None,None
Instagram Marketing 2019: Técnicas Avanzadas,www.udemy.com/course/instagram-marketing-2018-tecnicas-avanzadas/,María Gil,199.99,11.39,3.5(17 ratings),Marketing,Marketing en redes sociales,Marketing en Instagram,90,EspaÃ±ol,GuÃ­a Definitiva con las Estrategias mÃ¡s Avanzadas de Marketing en Instagram,5/2019,01/01/20
Instagram marketing - Aumenta tus clientes y ventas en horas,www.udemy.com/course/aumenta-tus-clientes-y-ventas-con-instagram-marketing/,Izrrael Sandrea,19.99,11.39,2.0(1 rating),Marketing,Social Media Marketing,Instagram Marketing,3,Spanish,Aprende a incrementar las ventas de tu negocio o servicio con Instagram Ads.,9/2019,01/01/20
إحترف فن التسويق بالهاشتاجات على أنستاجرام,www.udemy.com/course/hashtags_secrets/,Mohamed Annouri,19.99,11.39,0.0(0 ratings),Marketing,Social Media Marketing,Instagram Marketing,4,Arabic,Ø§ÙØ·Ø±Ù Ø§ÙØ°ÙÙØ© Ø§ÙØªÙ ÙÙ Ø®ÙØ§ÙÙØ§ Ø³ØªØ­ØµÙ Ø¹ÙÙ Ø£Ø²ÙØ¯ ÙÙ 10.000 ÙØªØ§Ø¨Ø¹ ÙÙ Ø§ÙØ£Ø³Ø§Ø¨ÙØ¹ Ø§ÙÙÙÙÙØ© Ø§ÙØ£ÙÙÙ Ø¨Ø§Ø³ØªØ®Ø¯Ø§ÙÙ ÙÙØ· Ø§ÙÙØ§Ø´ØªØ§Ø¬Ø§Øª,11/2019,01/01/20
Instagram wzrost: Jak zdobyć 1 tys. prawdziwych followersów,www.udemy.com/course/instagram-wzrost-jak-zdobyc-tysiac-followersow/,Przemysław Bogdan,19.99,11.39,3.9(4 ratings),Marketing,Marketing w mediach spoÅecznoÅciowych,Marketing na Instagramie,12,Polski,Skuteczna i pewna droga do tysiÄca obserwujÄcych- caÅa prawda o wzroÅcie bez Åciemniania,7/2019,01/01/20
⭐️Wie Influencer mit Instagram Geld verdienen [5-Stellig!],www.udemy.com/course/instagram-geld-verdienen/,Alexander Hammerschmied,99.99,11.39,0.0(0 ratings),Marketing,Social-Media-Marketing,Instagram-Marketing,125, Deutsch,Nutze die Strategien von Top-Influencern und Instagram Agenturen. Werde Reich mit Instagram und einem hÃ¶heren Einkommen.,5/2019,01/01/20
Aprendé a Vender en Internet en Mercado Libre y Redes,www.udemy.com/course/aprende-a-vender-en-internet/,Fabián Ramella,19.99,11.39,0.0(0 ratings),Negocios,Ventas,Marketing digital,6,EspaÃ±ol,E-Commerce y Venta Online en Mercadolibre & Redes Sociales,12/2019,01/01/20
"Instagram para emprendedores, empresas y negocios",www.udemy.com/course/instagram-para-emprendedores-empresas-y-negocios/,Jose Antonio Negrin Guerrero,19.99,11.39,5.0(1 rating),Marketing,Marketing en redes sociales,Marketing en Instagram,13,EspaÃ±ol,"Domina Instagram como un profesional y sacale el jugo a tu emprendimiento, marca personal, o negocio.",6/2019,01/01/20
Das Instagram Konzept,www.udemy.com/course/das-instagram-konzept/,Fabian Braun,24.99,11.39,5.0(2 ratings),Marketing,Social-Media-Marketing,Instagram-Marketing,12,Deutsch,"Ich werde dir zeigen, wie du deine Zielgruppe auf Instagram erreichst und dadurch tausende neue Follower generieren wirs",10/2017,01/01/20
Curso de Instagram Marketing Expresso 2020,www.udemy.com/course/curso-de-instagram-marketing/,Michael Araujo,189.99,11.39,4.3(8 ratings),Marketing,Marketing de redes sociais,Marketing no Instagram,31,PortuguÃªs,"As 10 Principais EstratÃ©gias para Atrair Seguidores Reais Super Segmentados, Converter em Clientes e Promover sua Marca",1/2019,01/01/20
Instagram: Conviértete en Influencer,www.udemy.com/course/instagram-conviertete-en-influencer/,Carlos Muñoz,199.99,11.39,3.1(38 ratings),Marketing,Marketing en redes sociales,Marketing en Instagram,155,EspaÃ±ol,Consigue miles de Seguidores en Instagram y vuÃ©lvete Popular,3/2018,01/01/20
Instagram Marketing para Negocios y Emprendedores,www.udemy.com/course/instagram-marketing-para-negocios-y-emprendedores/,John Christian Quiroga Rivera,29.99,11.39,4.0(108 ratings),Marketing,Social Media Marketing,Instagram Marketing,"1,824",Spanish,Con Instagram Marketing Aprende a Crear una Fuente de Prospesctos y Clientes Constantes para Tu Negocio o Emprendimiento,11/2018,01/01/20
Curso intermedio de Instagram para crear tu marca personal,www.udemy.com/course/curso-intermedio-de-instagram-para-crear-tu-marca-personal/,Carolina Franco,109.99,11.39,5.0(7 ratings),Marketing,Social Media Marketing,Instagram Marketing,17,Spanish,Crea contenido relevante para posicionar tu marca personal y crecer tu audiencia de forma orgÃ¡nica evitando bloqueos,10/2019,01/01/20
Despega con Instagram,www.udemy.com/course/despega-con-instagram/,Jommy Martínez,59.99,11.39,4.6(11 ratings),Marketing,Social Media Marketing,Instagram Marketing,43,Spanish,"No importa si tienes 1 o 1 MILLÃN de seguidores, aprende cÃ³mo incrementar tus ventas en Instagram con tÃ©cnicas que sÃ­ fu",9/2019,01/01/20
Curso Básico de Marketing para Instagram 2019,www.udemy.com/course/curso-de-marketing-para-instagram/,Leonardo Katsumi,19.99,11.39,4.3(22 ratings),Marketing,Marketing de redes sociais,Marketing no Instagram,585,PortuguÃªs,Aprenda tudo sobre as Melhores PrÃ¡ticas para seu Perfil no Instagram em 2019,7/2019,01/01/20
Live profissional no Instagram,www.udemy.com/course/live-profissional-no-instagram/,Ricardo Pires,19.99,11.99,3.0(1 rating),Marketing,Marketing de conteÃºdo,Marketing no Instagram,6,PortuguÃªs,FaÃ§a suas lives no instagram sem utilizar o celular.,7/2019,01/01/20
Shopify y Instagram: Domina Shopify Con Instagram Facilmente,www.udemy.com/course/dominashopifyconinstagram/,Audrey Millan,94.99,11.99,4.0(6 ratings),Marketing,Social Media Marketing,Instagram Marketing,42,Spanish,Como vas a poder dominar shopify y instagram. Aprenderas maneras para tener tus clientes en instagram.,11/2016,01/01/20
Aprende a crear una tienda online en Instagram de 0 a 100,www.udemy.com/course/aprende-a-crear-una-tienda-online-en-instagram-de-0-a-100/,Josue muñoz,19.99,11.99,0.0(0 ratings),Negocios,Emprendimiento,Marketing en Instagram,27,EspaÃ±ol,Vende en instagram de la manera mÃ¡s facil!,1/2019,01/01/20
Instagram Content Design & Marketing mit Affinity Designer,www.udemy.com/course/instagram-content-design-marketing-mit-affinity-designer/,MD Hero,49.99,11.99,3.5(1 rating),Marketing,Social-Media-Marketing,Instagram-Marketing,2,Deutsch,Meistere deine Social Media Instagram Seite mit dem richtigen Content Design & Marketing,12/2019,01/01/20
Gagner de l'argent sur Instagram sans produit et audience,www.udemy.com/course/gagner-de-largent-sur-instagram-sans-produit-et-audience/,Jérémy BRB,19.99,11.99,2.8(3 ratings),Business,Entreprenariat,Marketing autour d'Instagram,15,FranÃ§ais,La mÃ©thode complÃ¨te pour vendre des centaines de produits sur Instagram : Sans crÃ©er de produit et sans avoir d'audience,2/2019,01/01/20
Geld als Instagram Influencer verdienen,www.udemy.com/course/instagram-influencer/,⭐ Marina Arantes ⭐,99.99,11.99,3.9(5 ratings),Marketing,Social-Media-Marketing,Instagram-Marketing,49,Deutsch,"Wie Du Dein Instagram wachsen lÃ¤sst und zu Geld machst: Anleitung, um Deinen Instagram Account zu monetarisieren",6/2018,01/01/20
5 modelos de posts p/ engajar e vender no instagram [2019],www.udemy.com/course/como-engajar-e-vender-no-instagram/,Walace Emrich,39.99,11.99,4.4(9 ratings),Marketing,Marketing de redes sociais,Marketing no Instagram,29,PortuguÃªs,Transforme sua rede social em uma mÃ¡quina de vendas!,7/2019,01/01/20
Edição de Vídeos Quadrados Com Legenda,www.udemy.com/course/editando-para-o-instagram/,Daniel Smiderli,19.99,11.99,4.0(2 ratings),TI e software,Outro,Marketing no Instagram,9,PortuguÃªs,Aprenda a Preparar VÃ­deos Quadrados para o Instagram com Legenda,5/2019,01/01/20
Aprenda a criar um Nugget - vídeo de Instagram e Facebook,www.udemy.com/course/aprenda-a-criar-um-nugget-video-de-instagram-e-facebook/,Rafael Afonso Duarte,19.99,11.99,3.4(7 ratings),Marketing,Marketing de conteÃºdo,Marketing no Facebook,21,PortuguÃªs,Do zero atÃ© as redes sociais.,5/2019,01/01/20
