Course,URL,instructor,Price (full),Price (discount),Rank,Category 1,Category 2,Category 3,Enrollment,Language,Description,Last Update,Date Scraped
Instagram Growth Strategies To Build Your Brand Online,www.udemy.com/course/mastering-instagram/,Natasha Samuel,99.99,11.39,4.4(22 ratings),Marketing,Social Media Marketing,Instagram Marketing,158,English,"Learn how you can use Instagram to connect you with your ideal audience, build your brand, and bring in leads.",7/2019,01/01/20
Understanding Instagram Marketing - The Basics,www.udemy.com/course/understanding-instagram-marketing-the-basics/,Course Box,119.99,11.39,3.8(5 ratings),Marketing,Content Marketing,Instagram Marketing,"3,260",English,Fast Track Into Building Your Instagram and Growing Your Followers List.,8/2019,01/01/20
Instagram Success: Learn from the best brands on Instagram ,www.udemy.com/course/instagram-success-learn-from-the-best-brands-on-instagram/,Paul Sidoriak,19.99,11.39,3.9(13 ratings),Marketing,Social Media Marketing,Instagram Marketing,"1,207",English,Instagram is one of the fastest growing mobile platforms and having a more attractive profile is the key to standing out,10/2015,01/01/20
Grow Your Instagram Following,www.udemy.com/course/grow-your-instagram-following/,Christian Artiga,134.99,11.39,0.0(0 ratings),Marketing,Growth Hacking,Instagram Marketing,1,English,How to grow Instagram Social Media Following to your liking,4/2019,01/01/20
Learn How To Setup Instagram Profile Page From Scratch,www.udemy.com/course/learn-how-to-setup-instagram-profile-page-from-scratch/,Rohit Kadian,19.99,11.39,2.4(14 ratings),Marketing,Social Media Marketing,Instagram Marketing,"2,421",English,Everything you need to know ignorer to setup a perfect Profile,11/2019,01/01/20
How To Grow a Profitable Business Using Instagram,www.udemy.com/course/instasales/,Amy Madigan,0.0,94.99,0.0(0 ratings),Marketing,Social Media Marketing,Instagram Marketing,2,English,Learn to grow a profitable business by using Instagram + Instagram Stories,6/2018,01/01/20
Instagram Marketing For Business - The Ultimate Course,www.udemy.com/course/instagram-marketing-for-business-course/,Aaron Ward,194.99,11.39,3.9(4 ratings), Marketing,Social Media Marketing,Instagram Marketing,666,English,Create your own Instagram marketing strategy to execute daily: gaining engaged followers + increasing your income.,5/2017,01/01/20
Understanding Instagram Marketing - The Basics,www.udemy.com/course/understanding-instagram-marketing-the-basics/,Course Box,119.99,11.39,3.8(5 ratings),Marketing,Content Marketing,Instagram Marketing,"3,260",English,Fast Track Into Building Your Instagram and Growing Your Followers List.,8/2019,01/01/20
Go Viral With Instagram,www.udemy.com/course/go-viral-with-instagram/,George Estremera,34.99,11.39,0.0(0 ratings),Marketing,Digital Marketing,Instagram Marketing,0,English,Rapidly Grow A Super Targeted Instagram Fan Base,2/2019,01/01/20
How To Use Instagram To Promote Your Small Business!,www.udemy.com/course/how-to-use-instagram-to-promote-your-small-business/,Parth Reshamwala,19.99,11.39,3.4(4 ratings),Marketing,Social Media Marketing,Instagram Marketing,"1,253",English,7 Simple and Easy Way To Promote Your Small Business Using Instagram!.,10/2014,01/01/20
How To Get 300 Real Followers For Instagram a Day,www.udemy.com/course/how-to-get-300-real-followers-for-instagram-a-day/,Calvin Torra,0.0,19.99,0.0(0 ratings),Marketing,Social Media Marketing,Instagram Marketing,2,English,Build An Audience of Raving Instagram Followers & Expand Your Brand To The Masses,9/2017,01/01/20
The Ultimate Guide To Instagram Success,www.udemy.com/course/the-ultimate-guide-to-instagram-success/,Angela Long,19.99,11.39,4.0(8 ratings),Marketing,Social Media Marketing,Instagram Marketing,40,English,Leverage The Power Of Instagram With This Step-By-Step System,7/2016,01/01/20
Instagram Social Media Marketing,www.udemy.com/course/instagram-social-media-marketing-m/,Ahilan Chandran,24.99,11.39,5.0(2 ratings),Marketing,Branding,Instagram Marketing,2,English,Building Your Personal Brand,12/2019,01/01/20
Powerful Instagram Course,www.udemy.com/course/powerful-instagram-course/,Yevheniia Khmelova,89.99,11.39,0.0(0 ratings),Marketing,Social Media Marketing,Instagram Marketing,0,English,The Ultimate Guide to Instagram Strategy Development and Promotion,11/2019,01/01/20
"Instagram Hacks, Tips & Strategies To Gain REAL Followers",www.udemy.com/course/instagram-course/,Dee Greene,74.99,11.39,4.4(9 ratings),Marketing,Social Media Marketing,Instagram Marketing,44,English,Our Best Instagram Course Of 2018,1/2018,01/01/20
Instagram Selling - How To Sell On Instagram Like A Pro,www.udemy.com/course/instagram-selling-how-to-sell-on-instagram-like-a-pro/,Kevin Farrugia,79.99,11.39,3.0(4 ratings),Business,Sales,Instagram Marketing,27,English,"Avoid all of the pitfalls that break many Instagram sellers, get more people to buy your products and provide referrals",2/2016,01/01/20
Grow organically your instagram and build your business,www.udemy.com/course/grow-organically-your-instagram-and-monetize-your-content/,Evangelos Anagnostou,19.99,11.39,0.0(0 ratings),Business,Strategy,Business Development,145,English,"Learn how to grow organically your instagram, engage your followers and build your business",12/2018,01/01/20
Instagram and Personal Branding,www.udemy.com/course/instagram-and-personal-branding/,Sean Dalton Dalton,99.99,11.39,0.0(0 ratings),Marketing,Branding,Instagram Marketing,2, English,Establishing a Strong and Authentic Personal Brand on Instagram,5/2019,01/01/20
Instagram Marketing Secrets,www.udemy.com/course/instagram-marketing-secrets/,The Insight Team,114.99,11.39,4.2(19 ratings),Marketing,Social Media Marketing,Instagram Marketing,"2,007",English,"Weird, but Effective Strategies to Grow Your Instagram Account & Significantly Expand your Brand",6/2019,01/01/20
Pro Shopify/Ecommerce Instagram Story Ads stategy  Mastery,www.udemy.com/course/shopify-instagram-story-ads-stategy-mastery/,Hemza jabr,19.99,11.39,3.7(18 ratings),Marketing,Social Media Marketing,Instagram Marketing,"2,765",English,Ecommerce Marketing Strategy Using Instagram Ads. You'll see everything with the proof,2/2018,01/01/20
Success Story 101: How To Reach 5.000 Instagram Followers,www.udemy.com/course/instagram-course-for-huge-followers-sponsors-and-clients/,Nebojsa Milicevic,199.99,11.39,4.4(9 ratings),Marketing,Digital Marketing,Instagram Marketing,709,English,"Learn how to take Instagram Marketing to new level. Get followers , sell products, find clients and connect with people.",3/2018,01/01/20
Instagram Marketing Crash Course for Entrepreneurs,www.udemy.com/course/instagram-marketing-crash-course-for-entrepreneurs/,Sorin Constantin,94.99,11.39,4.0(47 ratings),Marketing,Social Media Marketing,Instagram Marketing,"2,096",English,Instagram Marketing - Learn the most powerful strategies and methods of how to use Instagram to build your business!,4/2017,01/01/20
Instagram Masterclass 2019 - Complete Instagram Marketing,www.udemy.com/course/theinstagram/,Minoti Inc,199.99,11.39,3.7(120 ratings),Marketing,Social Media Marketing,Instagram Marketing,"8,351",English,Simple and Easy Course to Instagram Marketing,4/2018,01/01/20
Instagram Marketing for Startups and Entrepreneurs,www.udemy.com/course/instagram-for-startups-and-entrepreneurs/,John Chang,0.0,Free,4.1(473 ratings),Marketing,Social Media Marketing,Instagram Marketing,"12,263",English,Your Road Map to Instagram Success as a Lean Startup in Getting Your Minimum Viable Product to Market and Making Pivots,5/2015,01/01/20
Instagram Influencer Marketing For Businesses,www.udemy.com/course/influencer-marketing-for-business/,Josh MacDonald,0.0,Free,3.9(156 ratings),Marketing,Social Media Marketing,Instagram Marketing,"7,704",English,Tap into hundreds of thousands of influencers who are waiting to recommend your product,12/2017,01/01/20
Instagram 2019- A Guaranteed Blueprint to 100s of Followers,www.udemy.com/course/instagram-2019-a-guaranteed-blueprint-to-100s-of-followers/,Austin Chan,0.0,Free,3.8(79 ratings),Marketing,Social Media Marketing,Instagram Marketing,"5,007",English,"Attract 100s of Engaged Instagram Followers, Learn the ""Secret"" of getting Followers, & Expanding Your Influence.",1/2019,01/01/20
Marketing on Instagram,www.udemy.com/course/marketing-on-instagram/,Three Sixty Academy,0.0,Free,3.6(533 ratings),Marketing,Social Media Marketing,Instagram Marketing,"17,772",English,Instagram marketing ideas to help grow your Instagram business profile!,3/2014,01/01/20
Instagram Food Blogger Mastery,www.udemy.com/course/instagram-food-blogger-mastery/,Dimitris Kamaritis,0.0,Free,4.0(64 ratings),Marketing,Social Media Marketing,Instagram Marketing,"7,114",English,Learn how to eat at restaurants for FREE while building a loyal Instagram community and becoming a leading food blogger,9/2018,01/01/20
"Instagram Marketing Automation 2020: More success, less time",www.udemy.com/course/instagram-marketing-automation-course-auto-like-follow-repost-schedule/,Pouya Eti • Digital Marketing Expert,0.0,Free,4.0(349 ratings),None,None,None,None,None,None,None,None
14 Day InstaSales Challenge For Shopify Merchants,www.udemy.com/course/14-day-instasales-challenge-for-shopify-merchants/,Caroline Balinska,0.0,Free,3.0(2 ratings),Marketing,Social Media Marketing,Instagram Marketing,"1,682",English,How to use Instagram to get more sales!,7/2019,01/01/20
Hacks to Organically Grow Your Instagram in 2018,www.udemy.com/course/hacks-to-organically-grow-your-instagram-in-2018/,Luna vega,0.0,Free,4.1(10 ratings),Marketing,Digital Marketing,Instagram Marketing,"1,916",English,5 Hacks to Massively Grow Your Instagram Following,9/2018,01/01/20
"How to get 50,000 Authentic Followers on Instagram",www.udemy.com/course/instagramgrowthcourse/,Dante Kohrs,0.0,Free,3.7(175 ratings),Marketing,Social Media Marketing,Instagram Marketing,"4,784",English,"Learn how to go from 0 - 50,000 followers from someone whose done it",7/2016,01/01/20
Profit Map 2.0: The Beginner's Guide to Instagram Marketing,www.udemy.com/course/profit-map-2-the-ultimate-guide-to-instagram-marketing/,Level Up Academy,0.0,Free,4.0(46 ratings),Business,Strategy,Instagram Marketing,"4,794",English,"Basics are the most important step. Get sponsored, make a profit when you post, learn the in's & out's of Instagram.",11/2017,01/01/20
Automating Instagram with InstaPy - The Official Guide,www.udemy.com/course/instapy-guide/,Tim Großmann,0.0,Free,4.4(206 ratings),Marketing,Growth Hacking,Instagram Marketing,"5,798",English,A complete guide to InstaPy - From installation to advanced features,4/2019,01/01/20
Instagram Growth Academy Complete Guide,www.udemy.com/course/instagram-growth-academy-complete-guide/,J Viana,0.0,Free,4.0(61 ratings),Marketing,Social Media Marketing,Instagram Marketing,"5,076",English,Mastering Instagram from someone who has an account with over 400k followers.,6/2017,01/01/20
Instagram - Instime - a platform for promotion and earnings,www.udemy.com/course/instagram_instime/,Ruslan Vlasiuk,0.0,Free,3.3(8 ratings),Marketing,Social Media Marketing,Instagram Marketing,"1,882",English,â¡ï¸â¡ï¸â¡ï¸The worldâs first platform for organic promotion and effective monetization of social activity on INSTAGRAMâ¡ï¸â¡ï¸â¡ï¸,5/2019,01/01/20
Instagram Small Business & Startup Marketing Foundation,www.udemy.com/course/instagram-small-business-startup-marketing-foundation/,Dave Rotheroe,0.0,Free,4.1(463 ratings),Marketing,Social Media Marketing,Instagram Marketing,"12,258",English,A step by step guide to building an account specifically designed for SELLING and avoiding damaging startup mistakes!,10/2016,01/01/20
Instagram Bootcamp 2019: Get More followers and Engagement,www.udemy.com/course/instagram-growth-bootcamp-2019/,David Dundas,0.0,Free,3.7(89 ratings),Marketing,Social Media Marketing,Instagram Marketing,"5,360",English,5-Day Mini Course to Jumpstart your Instagram Growth and Get More Engagement,3/2019,01/01/20
Powerful Instagram Sales Funnel to Grow Your Business,www.udemy.com/course/powerful-instagram-sales-funnel-to-grow-your-business/,Luna vega,0.0,Free,3.0(2 ratings),Marketing,Digital Marketing,Instagram Marketing,961,English,The Art of converting your followers into customers,9/2018,01/01/20
The Complete Instagram Marketing Course for Beginners 2018,www.udemy.com/course/the-complete-instagram-marketing-course-for-beginners-2018/,Adam Reed,0.0,Free,3.9(312 ratings),Marketing,Digital Marketing,Instagram Marketing,"10,394",English,"Learn how to market your business, products and services using Instagram, Influencers, Ads and Social Media Marketing.",5/2018,01/01/20
Curso Completo de Instagram Marketing,www.udemy.com/course/curso-instagram/,Diego Davila,199.99,11.39,"4.4(8,732 ratings)",Marketing,Marketing de redes sociais,Marketing no Instagram,25.738,PortuguÃªs,"Torne-se um lÃ­der no Instagram, Ganhe da concorrÃªncia, e crie uma comunidade de fÃ£s apaixonados pelo seu conteÃºdo.",10/2019,01/01/20
Die Instagram Marketing Masterclass: Lerne alles von A-Z,www.udemy.com/course/instagram-marketing-masterclass/,Timothy Meixner,199.99,11.39,4.4(306 ratings),Marketing,Social-Media-Marketing,Instagram-Marketing,3.030,Deutsch,"Alles Ã¼ber Instagram Stories, Influencer Marketing, Instagram Live, IGTV, Follower und bezahlte Werbung auf Instagram",3/2019,01/01/20
Marketing nas Redes Sociais - Curso COMPLETO (8 cursos em 1),www.udemy.com/course/marketing-redes-sociais/,Laura Marcon de Azevedo,169.99,11.39,4.3(444 ratings),Marketing,Marketing de redes sociais,Marketing no Facebook,2.092,PortuguÃªs,"Aprenda tudo sobre Social Media Marketing: Facebook, Instagram, Linkedin, gestÃ£o de mÃ­dias sociais e muito mais!",10/2019,01/01/20
"Instagram, il corso completo 2020 per imprese locali",www.udemy.com/course/instagram-business-come-usare-hashtag-aumentare-follower-aziende/,Matteo Orlandi,129.99,11.39,4.4(201 ratings),Marketing,Social Media Marketing,Marketing su Instagram,1.033,Italiano,Il corso completo per utilizzare tutte le funzioni di Instagram per le aziende e ottenere successo su questo social,12/2019,01/01/20
INSTAGRAM MARKETING: Curso Intensivo de Instagram,www.udemy.com/course/instagram-destaca-tu-cuenta-y-crea-audiencia/,Diana Muñoz,199.99,11.39,4.6(700 ratings),Marketing,Marketing en redes sociales,Marketing en Instagram,2.652,EspaÃ±ol,"Curso Completo. CÃ³mo usar Instagram de forma profesional, destacar de tu competencia y crecer una audiencia enganchada.",9/2019,01/01/20
Curso Instagram Marketing Completo - Do Básico ao Avançado.,www.udemy.com/course/curso-instagram-ads-completo-do-basico-ao-avancado/,André Fontenelle,34.99,11.39,4.4(69 ratings),Marketing,Marketing de redes sociais,Marketing no Instagram,588,PortuguÃªs,Domine a rede social do momento!,12/2019,01/01/20
Instagram Marketing 2019: ottenere Follower per guadagnare,www.udemy.com/course/instagram-come-aumentare-followers-e-creare-un-business/,Lorenzo Giustarini,199.99,11.39,4.7(311 ratings),Marketing,Social Media Marketing,Marketing su Instagram,731,Italiano,Impara tutti i segreti per gestire il tuo profilo in modo professionale e scopri i principali metodi per monetizzarlo!,10/2019,01/01/20
Das große Instagram-Kompendium 2020: Instagram von A bis Z,www.udemy.com/course/instagram-kompendium/,Alexander Schreiner,199.99,11.39,4.2(130 ratings),Marketing,Social-Media-Marketing,Instagram-Marketing,1.147,Deutsch,"Alles Wissenswerte zu Instagram-Stories, Live-Modus, Postings, Business-Accounts, Follower gewinnen & mehr",12/2019,01/01/20
Curso Completo de Instagram Marketing .,www.udemy.com/course/cursoinstagrammarketing/,Diego Davila,199.99,11.39,4.5(768 ratings),Marketing,Social Media Marketing,Instagram Marketing,"2,379",Spanish,"ConviÃ©rtete en un lÃ­der en el Instagram, gana a la competencia y crea una comunidad de fans apasionados por tu contenido",11/2019,01/01/20
Facebook & Instagram Reklamcılığı Eğitim Seti,www.udemy.com/course/facebook-instagram-reklamciligi-egitim-seti/,Enes USTA,144.99,11.39,"4.1(1,055 ratings)",Pazarlama,Sosyal Medya Pazarlama,Facebook Pazarlama,3.152,TÃ¼rkÃ§e,SÄ±fÄ±rdan Ä°leri Seviyeye Sosyal Medya ReklamcÄ±lÄ±ÄÄ±: Ä°ki Lider Platform Facebook ve Instagram,1/2019,01/01/20
Instagram Stories - Wie erzähle ich vertikal?,www.udemy.com/course/instagram-stories-wie-erzahle-ich-vertikal/,Svenja Walter,39.99,11.39,4.1(47 ratings),Marketing,Social-Media-Marketing,Instagram-Marketing,329,Deutsch,"Formate, Produktion und Insidertipps",4/2019,01/01/20
Der ultimative Instagram-Kurs 2020: Endlich mehr Follower!,www.udemy.com/course/der-ultimative-instagram-kurs/,Alexander Schreiner,199.99,11.39,4.3(501 ratings),Marketing,Social-Media-Marketing,Instagram-Marketing,2.406,Deutsch,"#1 Instagram-Bestseller! Wie du garantiert echte Follower und Likes gewinnst, ohne viel Arbeit zu investieren.",11/2019,01/01/20
Her Yönüyle Başarılı Instagram Yönetimi & Mobil Fotoğraf,www.udemy.com/course/her-yonuyle-basarili-instagram-yonetimi-dijital-fotograf/,Zeynep Cansoylu,144.99,11.39,4.3(558 ratings),Pazarlama,Sosyal Medya Pazarlama,Instagram Pazarlama,1.694,TÃ¼rkÃ§e,"instagram, instagram bÃ¼yÃ¼me yollarÄ±, instagram organik bÃ¼yÃ¼me ve 1.6 milyon takipÃ§ili Mustafa Seven'den fotoÄraf dersi",11/2019,01/01/20
Instagram 2019 - Droga do sukcesu w Social Media dla Biznesu,www.udemy.com/course/instagram-sukces-w-social-media/,Michał Lubaszewski,44.99,11.39,4.6(145 ratings),Marketing, Marketing cyfrowy,Marketing na Instagramie,956,Polski,Praktyczny kurs z Instagram zawierajÄcy obsÅugÄ kampanii w Instagram Ads (Facebook Ads) czyli marketing w Social Media,12/2018,01/01/20
Instagram Schritt-für-Schritt: Werde zum absoluten Experten!,www.udemy.com/course/werde-zum-absoluten-instagram-experten/,Daniel Huppertz,199.99,11.39,4.8(11 ratings),Marketing,Social-Media-Marketing,Instagram-Marketing,202,Deutsch,Wie Du ohne bezahlte Werbung eine Instagram-PrÃ¤senz aufbaust und Deine Produkte & Services gezielt vermarkten kannst!,7/2019,01/01/20
Instagram Marketing PRO - Curso COMPLETO,www.udemy.com/course/instagram-marketing-pro/,Erick Kosmalski Scudero,199.99,11.39,4.5(88 ratings),Marketing,Marketing de redes sociais,Marketing no Instagram,985,PortuguÃªs,"Domine o Instagram! Aprenda Marketing de ConteÃºdo OrgÃ¢nico (sem anÃºncios), OtimizaÃ§Ã£o de posts no Feed, Stories e mais!",12/2019,01/01/20
Instagram Marketing 2020: Rumo aos 10.000 Seguidores Reais,www.udemy.com/course/curso-seguidores-instagram/,Felipe Marcondes,199.99,11.39,4.5(59 ratings),Marketing,Marketing de redes sociais,Marketing no Instagram,416,PortuguÃªs,"EstratÃ©gias, tÃ©cnicas e ferramentas a CUSTO ZERO para alavancar seu negÃ³cio, marca, produto ou imagem no Instagram.",12/2019,01/01/20
Instagram Marketing 2020: Curso Completo Sobre Instagram,www.udemy.com/course/instagram-marketing-curso-online/,Igor Botelho,199.99,11.39,4.3(92 ratings),Marketing,Marketing de redes sociais,Marketing no Instagram,422,PortuguÃªs,"Aprenda Tudo Sobre Instagram Marketing, a Como Ganhar Dinheiro, Seguidor, Autoridade e Torne-se Um Expert No Instagram!",11/2019,01/01/20
インスタグラムマーケティングの基礎（コンテンツビジネス活用編）,www.udemy.com/course/instagram-mk/,山田 どうそん,199.99,11.39,4.2(11 ratings),ãã¼ã±ãã£ã³ã°,ã½ã¼ã·ã£ã«ã¡ãã£ã¢ãã¼ã±ãã£ã³ã°,Instagramãã¼ã±ãã£ã³ã°,111äººã®åè¬çãç»é²,æ¥æ¬èª,ã¤ã³ã¹ã¿ã°ã©ã ã¯ä¸çã§28åäººãæ¥æ¬ã§ã3000ä¸äººãå©ç¨ãã¦ããäººæ°ã®é«ãSNSã§ããã¤ã³ã¹ã¿ã°ã©ã ããã¸ãã¹å©ç¨ã§ããã°ç¡æã§è¦è¾¼ã¿å®¢ã«ãªã¼ããããã¨ãã§ãã¾ãã,10/2019,01/01/20
GANA SEGUIDORES EN INSTAGRAM: Curso intensivo 2019,www.udemy.com/course/curso_instagram/,Biel Tenias,109.99,11.39,4.6(75 ratings),Marketing,Marketing en redes sociales,Marketing en redes sociales,1.130,EspaÃ±ol,â El mejor curso para aprender a ganar seguidores en Instagram sin invertir en publicidad â,12/2019,01/01/20
Инстаграм Интенсив,www.udemy.com/course/instaintens/,Irina Libenshtein,24.99,11.39,3.9(17 ratings),ÐÐ°ÑÐºÐµÑÐ¸Ð½Ð³,ÐÐ°ÑÐºÐµÑÐ¸Ð½Ð³ Ð² ÑÐ¾ÑÐ¸Ð°Ð»ÑÐ½ÑÑ ÑÐµÑÑÑ,ÐÑÐ¾Ð´Ð²Ð¸Ð¶ÐµÐ½Ð¸Ðµ Ð² Instagram,112,Ð ÑÑÑÐºÐ¸Ð¹,"ÐÐ°Ðº Ð¿ÑÐ¾Ð´Ð°Ð²Ð°ÑÑ ÑÐµÑÐµÐ· Instagram, Ð´Ð°Ð¶Ðµ ÐµÑÐ»Ð¸ Ñ ÐÐ°Ñ ÑÐ°Ð¼ ÑÐµÐ¹ÑÐ°Ñ Ð½ÐµÑ Ð¿Ð¾Ð´Ð¿Ð¸ÑÑÐ¸ÐºÐ¾Ð²?",2/2019,01/01/20
A'dan Z'ye Instagram Reklamcılığı ve İçerik Üretimi,www.udemy.com/course/adan-zye-instagram-reklamclg-ve-icerik-uretimi/,Enes USTA,144.99,11.39,4.2(383 ratings),Pazarlama,Sosyal Medya Pazarlama,Instagram Pazarlama,1.395,TÃ¼rkÃ§e,"SÄ±fÄ±rdan Ä°leri Seviyeye Instagram YÃ¶netimi, Ä°Ã§erik Ãretimi ve ReklamcÄ±lÄ±ÄÄ±",4/2018,01/01/20
Настройка таргетированной рекламы для Facebook и Instagram,www.udemy.com/course/fb-target/,Альбина Замалутдинова,29.99,11.39,4.6(16 ratings),ÐÐ°ÑÐºÐµÑÐ¸Ð½Ð³,ÐÐ°ÑÐºÐµÑÐ¸Ð½Ð³ Ð² ÑÐ¾ÑÐ¸Ð°Ð»ÑÐ½ÑÑ ÑÐµÑÑÑ,ÐÑÐ¾Ð´Ð²Ð¸Ð¶ÐµÐ½Ð¸Ðµ Ð² Instagram,88,Ð ÑÑÑÐºÐ¸Ð¹,"ÐÑÑÑÐµ Ð¿Ð¾ÑÑÐ°ÑÐ¸ÑÑ 3 ÑÐ°ÑÐ° Ð½Ð° Ð¸Ð·ÑÑÐµÐ½Ð¸Ðµ Ð´Ð°Ð½Ð½Ð¾Ð³Ð¾ ÐºÑÑÑÐ°, ÑÐµÐ¼ Ð²ÑÑ Ð¶Ð¸Ð·Ð½Ñ Ð¿Ð»Ð°ÑÐ¸ÑÑ ÑÐ°ÑÐ³ÐµÑÐ¾Ð»Ð¾Ð³Ð°Ð¼!",4/2019,01/01/20
"Instagram base ed avanzato: SEO, Branding, Contenuti, Ads",www.udemy.com/course/instagram-marketing-base-ed-avanzato/,Roberto Santoli,104.99,11.39,3.9(101 ratings),Marketing,Social Media Marketing,Marketing su Instagram,635,Italiano,"Creazione, ottimizzazione e promozione del profilo. Instagram for business. SEO ed ADS. Local Marketing. Stories",9/2019,01/01/20
INSTAGRAM: Trucos Prácticos para las Historias de Instagram,www.udemy.com/course/trucos-practicos-para-las-historias-de-instagram/,Diana Muñoz,59.99,11.39,4.3(76 ratings),Marketing,Marketing en redes sociales,Marketing en Instagram,465,EspaÃ±ol,âCrea contenido de alta calidad estÃ©tica âAumenta tu engagement âAlcanza a una audiencia mÃ¡s amplia y targeteada,3/2019,01/01/20
Erfolgreiches Instagram-Marketing für Unternehmen,www.udemy.com/course/instagram-fuer-unternehmen-mehr-follower/,Jan Tissler,99.99,11.39,4.4(43 ratings),Marketing,Social-Media-Marketing,Instagram-Marketing,324,Deutsch,"Inklusive E-Book! In 4 Schritten zu besseren Inhalten, mehr Reichweite und den richtigen Followern",10/2019,01/01/20
Facebook-Creator Studio: Der ultimative Crash-Kurs,www.udemy.com/course/facebook-creator-studio/,Alexander Schreiner,84.99,11.39,4.2(3 ratings),Marketing,Social-Media-Marketing,Facebook-Marketing,51,Deutsch,Automatisiere deine Facebook- & Instagram-KanÃ¤le in wenigen Minuten!,11/2019,01/01/20
Instagram 2019 : devenez INFLUENCEUR et gagnez de l'ARGENT,www.udemy.com/course/instagram-2019/,Antoine Camarasa,199.99,11.39,3.9(17 ratings),Marketing,Marketing sur les rÃ©seaux sociaux,Marketing autour d'Instagram,109,FranÃ§ais,INSTAGRAMÂ 2019Â : ApprenezÂ Ã  crÃ©er un compte professionnel qui gÃ©nÃ¨rent des milliers de FOLLOWERSÂ  et GAGNER DE LâARGENT,12/2018,01/01/20
Instagram: Mehr Follower durch die perfekte Story gewinnen!,www.udemy.com/course/instagram-story-kurs/,Alexander Schreiner,119.99,11.39,4.7(39 ratings),Marketing,Social-Media-Marketing,Instagram-Marketing,290,Deutsch,"Lerne, wie du eine optimale Story erstellst und so noch mehr Follower fÃ¼r dein Instagram-Profil gewinnst!",11/2019,01/01/20
Instagram 2019 - Skuteczny Instagram Marketing dla Biznesu,www.udemy.com/course/szkolenie-instagram/,Bartosz Paczyński,59.99,11.39,4.5(16 ratings),Marketing,Marketing w mediach spoÅecznoÅciowych,Marketing na Instagramie,85,Polski,Szkolenie z Instagram Marketingu dla Biznesu (i nie tylko),12/2018,01/01/20
Fazer Dinheiro No Instagram Como Influencer 2020,www.udemy.com/course/fazer-dinheiro-no-instagram/,⭐ António Araújo ⭐,99.99,11.39,3.9(276 ratings),Marketing,Social Media Marketing,Instagram Marketing,941,Portuguese,Como crescer e monetizar o seu Instagram : Guia passo a passo para comeÃ§ar a fazer dinheiro no Instagram,4/2018,01/01/20
Criando Robôs com Python - Controlando o Instagram,www.udemy.com/course/aprenda-aumentar-seus-seguidores-no-instagram/,Gabriel Henrique Casemiro,19.99,11.39,4.8(14 ratings),Desenvolvimento pessoal,CriaÃ§Ã£o de marketing pessoal,Marketing no Instagram,194,PortuguÃªs,Utilize robÃ´s em Python para ganhar seguidores reais e segmentados para alavancar o alcance da seu perfil do Instagram.,7/2019,01/01/20
Insta Master Academy 2019: Da 0 a 30.000 followers,www.udemy.com/course/insta-master-academy/,Marko jablanovic,0.0,69.99,4.5(17 ratings),Marketing,Social Media Marketing,Marketing su Instagram,41,Italiano,"Attrai Followers in target, converti i visitatori in clienti paganti e fai crescere il tuo business con Instagram",3/2019,01/01/20
