Course,URL,instructor,Price (full),Price (discount),Rank,Category 1,Category 2,Category 3,Enrollment,Language,Description,Last Update,Date Scraped
Instagram Marketing for business - Gain Instagram Followers,www.udemy.com/course/gain-instagram-followers-instagram-marketing-course/,Rick Audet,189.99,11.99,3.9(65 ratings),Marketing,Social Media Marketing,Instagram Marketing,"2,097",English,"Instagram Marketing For Business: Get 10,000+ Instagram Followers,Grow Business, Go Viral & Leverage Instagram for sales",1/2018,01/01/20
(NEW) Master your bidding strategies on Facebook & Instagram,www.udemy.com/course/new-facebook-instagram-bidding-and-auction-strategy-2016/,Achmed Awad,149.99,11.99,4.3(26 ratings),Marketing,Advertising,Facebook Marketing,85,English,Get more results and revenue from your campaigns using custom bidding strategies. Easy step by step instructions!,2/2016,01/01/20
Instagram Marketing 2020: 5 Days To Your New Upgraded Insta.,www.udemy.com/course/instagram-marketing-2020-5-days-to-your-new-upgraded-insta/,Oksana Kelvich and Olga Stupakova,119.99,11.99,5.0(1 rating),Marketing,Social Media Marketing,Instagram Marketing,3,English,Only effective strategies to grow your REAL followers and expand your brand using Instagram.,10/2019,01/01/20
Instagram Marketing 2020 - Rocket Gram Influencer Marketing,www.udemy.com/course/instagram-marketing-2020-rocket-gram-influencer-marketing/,Nene The ideaList,99.99,11.99,0.0(0 ratings),Marketing,Social Media Marketing,Instagram Marketing,3,English,"Blue Print on How to Gain 1K - 10,000 ACTIVE FOLLOWERS & Create RAVING Fans",12/2019,01/01/20
Instagram Made Easy: Step By Step Guide To Using Instagram,www.udemy.com/course/instagram-made-easy-step-by-step-guide-to-using-instagram/,"Mayooran Senthilmani MSc, BSc, ACMA,CGMA",99.99,11.99,4.2(52 ratings),Marketing,Social Media Marketing,Instagram Marketing,"7,346",English,"Grow Your Followers, Drive Engagement, Build Your IGTV Channel, Marketing Strategies, Analytics, Shopping On Instagram",9/2018,01/01/20
Instagram Mastery: Guide to More Followers Step-by-Step 2018,www.udemy.com/course/instagram-growth-mastery/,Tom Lane,119.99,11.99,4.5(243 ratings),Marketing,Social Media Marketing,Instagram Marketing,"5,334",English,Grow a HUGE Following and Make Money with Instagram!,8/2018,01/01/20
Instagram Marketing Secrets-Get Unlimited Free Traffic 2020,www.udemy.com/course/instagram-marketing-secrets-get-unlimited-free-traffic/,AlPacino Production,49.99,12.50,3.9(8 ratings),Marketing,Social Media Marketing,Instagram Marketing,"1,219",English,Would You Like To Attract Unlimited Amount Of Free Traffic!,10/2019,01/01/20
Influencer Secrets: Rapid Instagram Growth & Monetization,www.udemy.com/course/influencer-secrets/,Kenny Couling,94.99,11.39,0.0(0 ratings),Marketing,Social Media Marketing,Instagram Marketing,4,English,Grow Your Instagram Page to 100k Followers While You Make Money,11/2019,01/01/20
Instagram Accelerator For Artists,www.udemy.com/course/instagram-accelerator-for-artists/,Melanie Greenwood,74.99,11.39,4.5(1 rating),Marketing,Social Media Marketing,Instagram Marketing,9,English,Learn how to promote your artwork on Instagram and gain loyal customers,5/2019,01/01/20
Instagram Marketing Growth Tips [Influencer Shortcuts],www.udemy.com/course/instagram-marketing-growth-tips-influencer-shortcuts/,Invert Media,199.99,11.39,4.4(74 ratings),Marketing,Social Media Marketing,Instagram Marketing,"15,008",English,"How to Grow Your Instagram Page, Get More Likes, Get More Comments, & Become an Influencer",9/2019,01/01/20
Instagram Strategies For Small Businesses,www.udemy.com/course/12-instagram-strategies/,Chloe Slade,19.99,11.39,4.6(4 ratings),Marketing, Social Media Marketing,Instagram Marketing,24,English,Grow your Instagram account with engaged followers.,5/2018,01/01/20
Instagram Marketing Mastery for Business Startup & Beginners,www.udemy.com/course/instagram-marketing-mastery-for-business-startup-beginners/,"Nick Tsai Make Money Online & Work From Home Expert , Full Time Marketer",99.99,11.39,4.8(7 ratings),Marketing,Social Media Marketing,Instagram Marketing,81,English,"Get more follower free without ads , best for for startups and entrepreneurs , 2017 2016 new content , mastery 101",10/2017,01/01/20
Instagram Marketing:  How To Get 10000 Followers In 2 Month,www.udemy.com/course/how-to-get-10000-real-followers-in-less-than-2-months/,Ali Kaissar,199.99,11.39,3.6(4 ratings),Marketing,Social Media Marketing,Instagram Marketing,333,English,"Target any field, gain large numbers of followers per day, automatically posting photos, and lots of like on your photos",11/2017,01/01/20
Create Instagram Quotes In Photoshop,www.udemy.com/course/create-instagram-quotes-in-photoshop/,Aleksandar Cucukovic,29.99,11.39,0.0(0 ratings),Marketing,Social Media Marketing,Instagram Marketing,2,English,Learn how to create beautiful quotes to inspire and motivate your Instagram followers,8/2019,01/01/20
Instagram Ads For Beginners: Hands On Training,www.udemy.com/course/instagram-ads/,Ali Mirza,149.99,11.39,4.2(57 ratings),Marketing,Social Media Marketing,Instagram Marketing,"1,742",English,Create your first Instagram Ad. Master Instagram marketing and Ads to generate traffic and email business leads.,11/2017,01/01/20
How to Use Instagram Video for Business and Building a Brand,www.udemy.com/course/instagramvideoforbusiness/,Montina Young Portis,19.99,11.39,4.5(6 ratings),Marketing,Video & Mobile Marketing,Instagram Marketing,152,English,"Learn how to build your brand and reach more clients, build relationships and market with Instagram Video Marketing.",5/2014,01/01/20
Instagram Marketing for Virtual Assistants,www.udemy.com/course/instagram-marketing-va/,Scott Paton,199.99,11.39,3.4(9 ratings),Marketing,Digital Marketing,Instagram Marketing,"3,884",English,How to grow your Instagram account on autopilot,5/2019,01/01/20
Instagram Marketing: Start Your Instagram Marketing Agency,www.udemy.com/course/instagram-marketing-agency/,eCommerce Hero,199.99,11.39,4.2(13 ratings),Marketing,Branding,Instagram Marketing,416,English,Build a highly profitable Instagram marketing agency from scratch with a reliable customers base & its own services,6/2018,01/01/20
Instagram Domination: Add Up To 100 Followers A Day For Free,www.udemy.com/course/instagram-domination-add-up-to-100-followers-a-day-for-free/,Vladimir Raykov,94.99,11.39,4.5(47 ratings),Marketing,Social Media Marketing,Instagram Marketing,"1,067",English,Discover The Top 3 Strategies That Will Help You Reach Your First 1000 And Beyond For Free,9/2019,01/01/20
Step by Step Guide To Organically Grow Your Instagram Page,www.udemy.com/course/step-by-step-guide-to-organically-grow-your-instagram-page/,Richard Hopp,19.99,11.39,3.8(15 ratings),Marketing,Social Media Marketing,Instagram Marketing,680,English,How to get more active Instagram Followers - Instagram Marketing Course,11/2017,01/01/20
Build Your Own Successful CPA System with Instagram,www.udemy.com/course/build-your-own-successful-cpa-system-with-instagram/,Mitrache Adrian,19.99,11.39,1.0(1 rating),Marketing,Affiliate Marketing,Instagram Marketing,72,English,Build your own CPA strategy in 4 simple steps,1/2015,01/01/20
Instagram Marketing 2018: Your Complete Instagram Training,www.udemy.com/course/instagram-marketing-2018-your-complete-instagram-training/,Jenny Frances,19.99,11.39,0.0(0 ratings),Marketing,Social Media Marketing,Instagram Marketing,8,English,"âStep by step to 10,000's of followers â Convert followers to paying customers âAll in just 10 minutes a day!",5/2018,01/01/20
Modern Intagram Marketing 2019,www.udemy.com/course/modern-intagram-marketing-2019/,Claude Bertin,99.99,11.39,3.9(5 ratings),Marketing,Social Media Marketing,Instagram Marketing,13,English,Following tips from this video course you can turbocharge your results with Instagram.,1/2019,01/01/20
Instagram Marketing 2019 -  Grow Your Business Like A Pro,www.udemy.com/course/instagram-marketing-2019/,Johannes Kanter,199.99,11.39,3.8(35 ratings),Marketing,Social Media Marketing,Instagram Marketing,253,English,Learn how to beat the Instagram marketing algorithm and grow your business like the pros do it,11/2018,01/01/20
Instagram Marketing Strategy: From Zero to Instagram Hero,www.udemy.com/course/instagram-marketing-strategy/,Erick Bulatowicz,0.0,194.99,3.9(163 ratings),Marketing,Social Media Marketing,Instagram Marketing,"10,154",English,Step-by-Step Instagram Marketing for Business and Personal Brand,11/2018,01/01/20
Instagram Marketing- GrowthHacking & Automation MICRO Course,www.udemy.com/course/instagram-marketing-growthhacking-automation-micro-course/,Justin Boggs,19.99,11.39,4.4(11 ratings),Marketing,Growth Hacking,Instagram Marketing,70,English,Growth Methods for Attracting Followers and Driving Traffic to Get Sales or Build Your Brand- No Fluff,4/2016,01/01/20
Your Step by Step Guide to Instagram for Small Businesses,www.udemy.com/course/authentic-instagram-marketing-for-small-businesses/,Pip Christie,24.99,11.39,4.0(1 rating),Marketing,Social Media Marketing,Instagram Marketing,5,English,Your guide to using the organic power of Instagram to build an engaged audience for your business in a heartfelt way.,7/2019,01/01/20
Instagram Marketing: Grow Your Online Business as Influencer,www.udemy.com/course/instagram-marketing-make-money-as-influencergrow-business/,Roi Business,89.99,11.39,3.8(37 ratings),Marketing,Digital Marketing,Instagram Marketing,"5,540",English,Grow and Monetize your Instagram: Complete Guide on Making Extra Profit from Instagram Marketing using Secret Methods,11/2018,01/01/20
Instagram Automation: Build A Bot with Python,www.udemy.com/course/instagram-automation-build-a-bot-with-python/,DoItWithCode Academy,19.99,11.39,3.9(64 ratings),Development,Software Engineering,Instagram Marketing,"9,953",English,Learn how to automate Instagram using Python,9/2019,01/01/20
Instagram Business Mastery 2019 - Expert Strategies,www.udemy.com/course/instagram-business-mastery-2019-expert-strategies/,Liam Evans,19.99,11.39,3.2(36 ratings),Marketing,Digital Marketing,Instagram Marketing,"5,107",English,"Grow your brand or business on Instagram like the pros, gain your first 10k followers for free.",5/2019,01/01/20
Instagram Marketing: From 0-1000 Real Followers in 30 Days,www.udemy.com/course/instagram-marketing/,Marouane Bembli,39.99,11.39,4.3(59 ratings),Marketing,Social Media Marketing,Instagram Marketing,"2,177",English,Instagram Marketing: From 0-1000 Instagram followers in a month. Become an authority in your niche.,3/2016,01/01/20
"The 2018 Instagram Marketing Blueprint to 10,000 Followers",www.udemy.com/course/the-2018-instagram-marketing-blueprint-to-10000-followers/,Timeesha Duncan,199.99,11.39,4.4(7 ratings),Marketing,Social Media Marketing,Instagram Marketing,39,English,"A step-by-step guide on how to go from 0 to 10,000 followers fast and convert them into sales!",5/2018,01/01/20
How To Use Instagram To Build A profitable Business.,www.udemy.com/course/instagram-profits/,Simon Colhoun,19.99,11.39,4.0(1 rating),Business,Entrepreneurship,Instagram Marketing,6,English,How To Build An E Mail List Lightning Fast With Instagram.,12/2018,01/01/20
A Guitarist's Guide to Instagram,www.udemy.com/course/a-guitarists-guide-to-instagram/,Haley Powers,19.99,11.39,0.0(0 ratings),Music,Other,Instagram Marketing,1,English,Getting the gigs and guitar opportunities you want though Instagram!,9/2019,01/01/20
Instagram Marketing - Small Businesses - Step by Step,www.udemy.com/course/instagram-success/,Jacqueline Hunter,24.99,11.39,3.9(12 ratings),Marketing,Social Media Marketing,Instagram Marketing,52,English,Grow your following & Increase your engagement. Geared to Handmade Business Owners who want to sell on Instagram.,1/2017,01/01/20
Grow Your Instagram Presence & Gain Highly Engaged Followers,www.udemy.com/course/grow-your-instagram-presence-gain-highly-engaged-followers/,Ronald Samson,34.99,11.39,0.0(0 ratings),Marketing,Growth Hacking,Instagram Marketing,3,English,"Bring in a Hyper Targeted Audience, Understand The Instagram Algorithm, & Use Most Efficient Hashtags to Maximize Growth",8/2018,01/01/20
Social Media Marketing: Promote a Business on Instagram,www.udemy.com/course/social-media-marketing-promote-a-business-on-instagram/,Mubarak Shah,19.99,11.39,3.5(72 ratings),Marketing,Social Media Marketing,Instagram Marketing,"10,417",English,Ultimate Instagram Marketing Tactics - Learn how to use Instagram to market your business to millions of online users,5/2015,01/01/20
Instagram Marketing: How To Generate Leads & Grow Your Brand,www.udemy.com/course/learn-to-generate-leads-grow-your-brand-with-instagram/,Evan Humber,24.99,11.39,4.3(18 ratings),Marketing,Social Media Marketing,Instagram Marketing,"1,020",English,"Instagram Domination, Become a Instagram Pro by generating leads and converting followers into paying customers",5/2016,01/01/20
Secret Instagram Rockstar Course|All Secret Methods Revealed,www.udemy.com/course/secret-instagram-rockstar-course/,Addy cave,19.99,11.39,0.0(0 ratings),Marketing,Social Media Marketing,Instagram Marketing,282,English,Learn All the Secrets which Big Instagram pages and Celebrities Use To Gain Millions of Followers and Fans,2/2019,01/01/20
Create Animated Instagram Stories in Photoshop,www.udemy.com/course/create-animated-instagram-stories-in-photoshop/,Aleksandar Cucukovic,49.99,11.39,4.8(2 ratings),Marketing,Social Media Marketing,Instagram Marketing,40,English,Bring life into your stories with simple animations to boost conversions and watch time,8/2019,01/01/20
Instagram Marketing For Business: Become An Instapreneur,www.udemy.com/course/become-an-instapreneur/,Alexandre Kan,99.99,11.39,4.3(5 ratings),Marketing,Social Media Marketing,Instagram Marketing,19,"English
 ",Discover How To Turn Your Passion Into Profit Using Instagram And Run A Profitable Business On Automation,8/2018,01/01/20
Instagram How-To Guide,www.udemy.com/course/instagram-how-to-guide/,Frances Leary,24.99,11.39,4.2(3 ratings),Marketing,Social Media Marketing,Instagram Marketing,10,English,Gain the technical knowledge you need to start using Instagram for business now.,10/2018,01/01/20
How to Grow Your Instagram For Business Owners and Bloggers,www.udemy.com/course/double-your-instagram-following-and-income-in-2019/,Camille marsh,99.99,11.39,0.0(0 ratings),Marketing,Social Media Marketing,Instagram Marketing,3,English,Your complete guide to increasing your income and influence with Instagram,10/2019,01/01/20
Instagram for business:  Marketing Tactics,www.udemy.com/course/how_to_sell_on_instagram/,Yariv Gai,19.99,11.39,0.0(0 ratings),Marketing,Digital Marketing,Instagram Marketing,"3,380",English,Selling Jewelry using Instagram,6/2019,01/01/20
Getting Instagram Followers: Growing Instagram Pages Fast,www.udemy.com/course/getting-instagram-followers/,Alex Person,19.99,11.39,4.2(28 ratings),Marketing,Social Media Marketing,Instagram Marketing,"1,083",English,"A no B.S guide to growing an organic Instagram following and pushing traffic to your website or store, fast and free.",9/2016,01/01/20
INSTAGRAM FOR INFLUENCERS: 1000 FOLLOWERS IN 7 DAYS!,www.udemy.com/course/instagram-for-influencers-1000-followers-in-7-days/,Kristin Ford,59.99,11.39,0.0(0 ratings),Marketing,Social Media Marketing,Instagram Marketing,1,English,Build a MASSIVE Following in 7 Days on Instagram!,10/2019,01/01/20
Instagram Marketing: How to gain 100 organic followers daily,www.udemy.com/course/instagram-gain-100-organic-followers-daily/,Marques Salgado,24.99,11.39,0.0(0 ratings),Personal Development,Personal Brand Building,Instagram Marketing,9,English,Want to become an Instagram expert?,4/2017,01/01/20
Best type of Instagram Marketing for results,www.udemy.com/course/best-type-of-instagram-marketing-for-results/,Donnell Smart,54.99,11.39,0.0(0 ratings),Marketing,Social Media Marketing,Instagram Marketing,1,English,2019 Instagram marketing steps,5/2019,01/01/20
"Instagram Marketing: Build, Grow, Monetize, and Influence ✔",www.udemy.com/course/best-seller-instagram-course/,"Michael M, (MIB) ✔",19.99,11.39,4.0(17 ratings),Marketing,Social Media Marketing,"Instagram Marketing
 ","2,338",English,"âBuild Your Instagram Profile, Grow 10K Instagram Followers, Monetize Your Audience, and Become an Instagram Influencerâ",10/2018,01/01/20
Instagram Marketing: Getting A Massive Amount Of Followers,www.udemy.com/course/instagram-marketing-a-z/,Barry North,89.99,11.39,3.8(72 ratings),Marketing,Social Media Marketing,Instagram Marketing,"7,551",English,Learn why you should start using Instagram to build your traffic base.,2/2017,01/01/20
The Ultimate Instagram Marketing Success Course,www.udemy.com/course/marketingsuccess/,⭐ SianSocial ⭐ Sian Day,19.99,11.39,3.7(3 ratings),Marketing,Social Media Marketing,Instagram Marketing,955,English,"Increase your engagement, followers, leads and success!",9/2018,01/01/20
Instagram Secrets for Small Business Owners,www.udemy.com/course/instagramsecrets/,Julia Milstone-Turner,199.99,11.39,0.0(0 ratings),Marketing,"Social Media Marketing
 ",Instagram Marketing,2,English,"Get 1,000 Followers every Month for 1 hr Per Week",6/2018,01/01/20
Instagram Marketing: How To Gain Targeted Followers in 1 Day,www.udemy.com/course/instagram-marketing-course/,Aaron Ward,19.99,11.39,3.9(59 ratings),Marketing,Social Media Marketing,Instagram Marketing,851,English,Instagram Marketing Techniques Proven to Gain Thousands of Real Followers and Convert Them To Customers.,7/2017,01/01/20
Complete Instagram Marketing for Business: Follower To Sales,www.udemy.com/course/instagram-business-followers/,Daniel Alejandro,139.99,11.39,4.3(81 ratings),Marketing,Social Media Marketing,Instagram Marketing,"2,069",English,Learn to use Instagram from the Beginning. Follow Three Methods to generate Thousands of Followers. From 0 To 10k,6/2018,01/01/20
Instagram Marketing: How To Gain Targeted Followers in 1 Day,www.udemy.com/course/instagram-marketing-course/,Aaron Ward,19.99,11.99,3.9(59 ratings),Marketing,Social Media Marketing,Instagram Marketing,851,English,Instagram Marketing Techniques Proven to Gain Thousands of Real Followers and Convert Them To Customers.,7/2017,01/01/20
"Instagram Marketing 2019: A Step-By-Step to 5,000 Followers",www.udemy.com/course/instagram-marketing-2019-a-step-by-step-to-5000-followers/,Vlad Alexandrescu,59.99,11.99,3.1(7 ratings),Marketing,Social Media Marketing,Instagram Marketing,"1,813",English,"Attract Laser-Targeted Instagram Followers, & Convert Followers to Paying Customers Using Instagram",3/2019,01/01/20
Tried and tested tips to grow your Instagram from scratch,www.udemy.com/course/tried-and-tested-tips-to-grow-your-instagram-from-scratch/,Abhilash Mende,19.99,11.99,0.0(0 ratings),Business,Entrepreneurship,Instagram Marketing,1,English,"Taking you through a real time demonstration of my sample Instagram page, this course would help you grow from scratch.",12/2018,01/01/20
Instagram Traffic Fan Base,www.udemy.com/course/instagram-traffic-fan-base/,Jader Tormen,19.99,11.99,0.0(0 ratings),Marketing,Social Media Marketing,Instagram Marketing,0,English,Want to Learn How to Rapidly Grow a Super Targeted Instagram Fan Base... The Right Way?,4/2018,01/01/20
Instagram for Retailers,www.udemy.com/course/instagram-for-retailers/,Crystal Vilkaitis,0.0,199.99,0.0(0 ratings),Marketing,Social Media Marketing,Instagram Marketing,0,English,Learn How to Easily Market and Sell More Your Products Using Instagram! *Bonus* Influencer Marketing Packet and How-To,4/2019,01/01/20
How to post directly to Instagram form your pc or notebook,www.udemy.com/course/postinstagram/,Philip Hofmacher,199.99,11.99,3.5(48 ratings),Marketing,Social Media Marketing,Instagram Marketing,"9,859",English,"Save a lot of time by using gramblr to post directly to your instagram feed, now more publishing needed",2/2018,01/01/20
Becoming an Instagram Influencer,www.udemy.com/course/becoming-an-instagram-influencer/,Sean Dalton Dalton,99.99,11.99,0.0(0 ratings),Marketing,Branding,Instagram Marketing,1,English,Creating Authentic Content and Monetizing Your Following.,1/2019,01/01/20
How To Learn Instagram Marketing For Absolute Beginners 2019,www.udemy.com/course/how-to-learn-instagram-marketing-for-absolute-beginners-2019/,chantelle taylor,84.99,11.99,4.2(4 ratings),Marketing,Social Media Marketing,Instagram Marketing,785,English,Learn How To Grow On Instagram 2019,9/2019,01/01/20
Long-Term Instagram Success,www.udemy.com/course/long-term-instagram-success/,Everyday Solutions,39.99,11.99,0.0(0 ratings),Marketing,Social Media Marketing,Instagram Marketing,"1,001",English,"A No-Nonsense Course That Will Help You Increase Engagement , Attract New Visitors And Remain Successful On Instagram",12/2019,01/01/20
Instagram Marketing  Mastery Course In 2020,www.udemy.com/course/instagram-marketing-mastery-course/,akshay Mayekar,184.99,11.99,0.0(0 ratings),Marketing,Social Media Marketing,Instagram Marketing,0,English,In This Course U Will Learn How To Increase Followers With Proof And How To Make Money With Instagram,12/2019,01/01/20
Instagram Marketing Rock Star 2018,www.udemy.com/course/instagram-marketing-rock-star-2018/,Eric Tompkins,19.99,11.99,0.0(0 ratings),Marketing,Social Media Marketing,Instagram Marketing,2,English,Build a massive following and monetize your Instagram account.,9/2017,01/01/20
Find new Customers w/ the right Instagram Marketing Strategy,www.udemy.com/course/instagram-marketing-all-you-need-to-know/,Markus Korsten,19.99,11.99,3.2(11 ratings),Marketing,Social Media Marketing,Instagram Marketing,"1,534",English,Get on the Instagram Train - it's just getting huge and you need to secure the spot for your Business,4/2015,01/01/20
How to Network on Instagram Direct Message,www.udemy.com/course/how-to-network-on-instagram-direct-message/,Charles Postiaux,19.99,11.99,3.9(18 ratings),Business,Media,Instagram Marketing,"3,211",English,Skyrocket Your Audience and Your Business Today,2/2018,01/01/20
"Instagram - Community, Business, Influancer",www.udemy.com/course/toprepostme-mastering-instagram/,Arman Ayvazyan,19.99,11.99,4.0(3 ratings),Marketing,Social Media Marketing,Instagram Marketing,"1,197",English,"Connect to real influancers, become the one",6/2019,01/01/20
How to use Instagram for New and Aspiring Speakers,www.udemy.com/course/public-speaker-attract-a-loyal-audience-using-instagram/,Wendy Kier,19.99,11.99,2.0(1 rating),Business,Communications,Instagram Marketing,106,English,"The one master strategy you need to know to rapidly grow your likes, followers and buyers list.",11/2016,01/01/20
How I Gain 3000+ Instagram Followers in 30 Days (+Software),www.udemy.com/course/gain-3000-instagram-followers-in-30-days-free-software/,Alex Mac,19.99,11.99,2.8(5 ratings),Marketing,Social Media Marketing,Instagram Marketing,256,English,"The ""It's Complicated"" Instagram Secret Exposed. Learn Instagram automation and essential Instagram marketing strategies",4/2018,01/01/20
Top Marketing Tips:Grow Your Instagram And Facebook Fast!,www.udemy.com/course/top-marketing-secretsgrow-your-instagram-and-facebook-fast/,Hannah Priore,19.99,11.39,3.6(12 ratings),Marketing,Social Media Marketing,Facebook Marketing,"1,815",English,"Learn how to have an engaging audience, increase your traffic and build rapport with new prospects.",8/2016,01/01/20
Instagram Mastery  - Learn How to Gain More Followers 2020,www.udemy.com/course/instagram-mastery-course-learn-how-to-gain-1000s-of-followers/,Brian CB,199.99,11.39,4.0(47 ratings),Marketing,Growth Hacking,Instagram Marketing,"3,317",English,Learn How to grow your Instagram account & gain more followers - Ultimate Instagram Marketing Course. Grow on Instagram,9/2018,01/01/20
"Instagram Marketing Domination: Boost Leads, Sales & Profits",www.udemy.com/course/instagram-marketing-domination/,Sam Samuel,149.99,11.39,3.8(8 ratings),Marketing,Social Media Marketing,Instagram Marketing,"2,560",English,"Instagram for business| Dominate Instagram Using Our Tricks, tips and Strategies to increase traffic, sales and profits.",10/2018,01/01/20
Instagram Marketing for Business: Pro Tactics & Strategy,www.udemy.com/course/instagram-marketing-hacks/,Skill Boost,94.99,11.39,3.4(130 ratings),Marketing,Growth Hacking,Instagram Marketing,"8,717",English,Pro Instagram marketing hacks and some extras that help you to promote your business on Instagram and get success.,4/2017,01/01/20
Turn Instagram Stories Lurker Into Newsletter Subscribers,www.udemy.com/course/instagram-stories-into-subscribers/,Natasha Samuel,29.99,11.39,0.0(0 ratings),Marketing,Social Media Marketing,Instagram Marketing,1,English,Learn how to promote your opt-in using Instagram Stories strategies to grow your newsletter list.,7/2019,01/01/20
Instagram marketing from A to Z,www.udemy.com/course/instagram-marketing-from-a-to-z/,Nagy Andras,19.99,11.39,0.0(0 ratings),Marketing,Social Media Marketing,Instagram Marketing,1,English,Learn instagram marketing from zero,,01/01/20
Instagram Marketing: Grow And Monetize Your Following,www.udemy.com/course/instagram-marketing-grow-and-monetize-your-following/,Emmanuel Kamau,94.99,11.39,5.0(1 rating),Marketing,Digital Marketing,Instagram Marketing,9,English,"Learn How To Attract, Educate, And Monetize Your Instagram Following",12/2017,01/01/20
Instagram Marketing in 2019: Ultimate 30 Days Action Plan,www.udemy.com/course/instagram-marketing-2018/,Ustin Kompaniets,124.99,11.39,3.8(184 ratings),Marketing,Social Media Marketing,Instagram Marketing,"1,260",English,"Master Instagram Marketing Strategy - Grow Business, Gain Followers, Go Viral, Add Influence, Leverage Account With Ads",2/2018,01/01/20
Instagram Marketing 2019 - 10Xing Your Brand,www.udemy.com/course/instamarketing/,Evan Cardimino,19.99,11.39,5.0(1 rating),Marketing,Growth Hacking,Instagram Marketing,7,English,We'll teach you EVERYTHING you need to know in 30 minutes of video!,7/2019,01/01/20
