Course,URL,instructor,Price (full),Price (discount),Rank,Category 1,Category 2,Category 3,Enrollment,Language,Description,Last Update,Date Scraped
Udemy Experto: Cómo Crear un Curso Paso a Paso - Unofficial,www.udemy.com/course/udemy-experto-como-crear-un-curso-paso-a-paso-online/,Rudolf González,199.99,11.39,4.1(34 ratings),EnseÃ±anzas y disciplinas acadÃ©micas,EducaciÃ³n en lÃ­nea,CreaciÃ³n de cursos en lÃ­nea,220,EspaÃ±ol,Aprende a crear y vender cursos online que te permitan generar grandes ingresos y mejorar tu estilo de vida.,3/2018,12/29/19
Systeme-io facile !,www.udemy.com/course/maitriser-systeme-io-en-2h/,Patrick LOUICHE,99.99,11.39,4.2(21 ratings),Business,StratÃ©gie,CrÃ©ation de cours en ligne,88,FranÃ§ais,"Votre business Internet 100% automatisÃ©, tunnel de vente, site membre, webinaires evergreen avec Systeme-io !",10/2018,12/29/19
Como criar cursos e gerar renda na Udemy?  (unofficial),www.udemy.com/course/udemy-para-professores-e-empreendedores-unofficial/,Leila Adriano Ostoyke,64.99,11.39,5.0(9 ratings),Ensino e estudo acadÃªmico,EducaÃ§Ã£o online,CriaÃ§Ã£o de cursos online,103,PortuguÃªs,Udemy para Professores e Empreendedores: crie cursos que geram resultados reais! (unofficial),12/2019,12/29/19
"Como criar um curso online,editar videos, e vender seu curso",www.udemy.com/course/como-criar-um-curso-online-seu-produto-digital-em-27-dias/,Jhon lima,84.99,11.39,4.0(13 ratings),Ensino e estudo acadÃªmico,EducaÃ§Ã£o online,CriaÃ§Ã£o de cursos online,172,PortuguÃªs,"Aprenda como criar um curso online,aprenda como editar videoaulas Ã© vender seu curso online na udemy,(Unofficial)",12/2019,12/29/19
Finde die profitabelste Nische für Dein Online-Business,www.udemy.com/course/udemy-kurserstellung-finde-deine-nische/,Sebastian Glöckner,199.99,11.39,4.3(46 ratings),Wissenschaft & Lehre,Online-Bildung,Online-Kurs-Erstellung,303,Deutsch,"Ein Top-Dozent packt aus! Lerne, wie Du immer wieder profitable Nischen fÃ¼r Dein Online-Business findest.",12/2019,12/29/19
Développer et créer une formation Udemy - non officiel,www.udemy.com/course/udemy-creation-formation/,Mark Timberlake,139.99,11.39,4.8(16 ratings),Formations et diplÃ´mes,Formation en ligne,CrÃ©ation de cours en ligne,152,FranÃ§ais,CrÃ©ation de formation vidÃ©o sur Udemy pour les formateurs en ligne voulant dÃ©livrer un enseignement de haute qualitÃ©.,3/2016,12/29/19
【2019年こそ講師デビュー】ユーデミー 最初のコースをリリースする前に知っておきたかったこと (非公式),www.udemy.com/course/masukawa_006/,マスカワ シゲル,34.99,11.39,4.4(44 ratings),æè²ã»æé¤,ãªã³ã©ã¤ã³æè²,ãªã³ã©ã¤ã³ã³ã¼ã¹ä½æ,158äººã®åè¬çãç»é²,æ¥æ¬èª,ã¦ã¼ããã¼ / udemy è¬å¸«ããã¥ã¼ããèããªãã¾ãããããï¼ããã¥ã¼ä¸å¹´ç®ã®è¬å¸«ã ãããããããã¾ã§è¨ããï¼èª°ãæãã¦ãããªãã£ããè¬å¸«ããã¥ã¼ãæ§ããã¿ãªãããç¥ã£ã¦ããããæå ±ãï¼ã¤ã®ã³ã¼ã¹ã«ã¾ã¨ãã¾ãã (unofficialï¼,12/2019,12/29/19
Curso Completo de Renda Passiva com E-books e Cursos Online,www.udemy.com/course/curso-completo-de-renda-passiva-com-e-books-e-cursos-online/,Erick Augusto,199.99,11.39,4.4(6 ratings),NegÃ³cios,NegÃ³cios domÃ©sticos,Investimentos,64,PortuguÃªs,Publique seu livro digital e impresso na Amazon ou curso online e tenha todos os meses uma renda extra passiva!,5/2019,12/29/19
Как Создать Онлайн-курс на Udemy: Пошаговое Руководство,www.udemy.com/course/online-course-dev-101/,Олег Гант,24.99,11.39,4.4(32 ratings),ÐÑÐµÐ¿Ð¾Ð´Ð°Ð²Ð°Ð½Ð¸Ðµ Ð¸ Ð°ÐºÐ°Ð´ÐµÐ¼Ð¸ÑÐµÑÐºÐ¸Ðµ Ð´Ð¸ÑÑÐ¸Ð¿Ð»Ð¸Ð½Ñ,ÐÐ±ÑÑÐµÐ½Ð¸Ðµ Ð¿ÑÐµÐ¿Ð¾Ð´Ð°Ð²Ð°ÑÐµÐ»ÐµÐ¹,Ð¡Ð¾Ð·Ð´Ð°Ð½Ð¸Ðµ Ð¾Ð½Ð»Ð°Ð¹Ð½-ÐºÑÑÑÐ¾Ð²,167,Ð ÑÑÑÐºÐ¸Ð¹,ÐÐ°ÑÑÐ¸ÑÐµÑÑ ÑÐ¾Ð·Ð´Ð°Ð²Ð°ÑÑ Ð¾Ð½Ð»Ð°Ð¹Ð½-ÐºÑÑÑÑ Ð¸ Ð¿Ð¾Ð»ÑÑÐ°Ð¹ÑÐµ Ð´Ð¾ÑÐ¾Ð´ Ð¾Ñ ÑÐ²Ð¾Ð¸Ñ Ð·Ð½Ð°Ð½Ð¸Ð¹ Ð¸ Ð¶Ð¸Ð·Ð½ÐµÐ½Ð½Ð¾Ð³Ð¾ Ð¾Ð¿ÑÑÐ°.,4/2016,12/29/19
【2019年こそ講師デビュー】Udemy 武器としてのコース構成４つのスタイル（unofficial）,www.udemy.com/course/masukawa_012/,マスカワ シゲル,39.99,11.39,4.7(9 ratings),æè²ã»æé¤,è¬å¸«åããã¬ã¼ãã³ã°,ãªã³ã©ã¤ã³ã³ã¼ã¹ä½æ,55äººã®åè¬çãç»é²,æ¥æ¬èª,å½åå¤200ä»¥ä¸ã®Udemyã³ã¼ã¹ãåè¬ãèªèº«ã20ä»¥ä¸ã®ã³ã¼ã¹ãå¬éãã¦ããè¬å¸«ã ããä½ããï¼ãã¹ã¦ã®Udemyã³ã¼ã¹ã¯ï¼ã¤ã«åãããããã³ã¼ã¹ä½æã«ç´æ¥å½¹ç«ã¤ãä½¿ãããç¥è­ããã®ã³ã¼ã¹ã§ä»ããã¤ã³ã¹ãã¼ã«ï¼ï¼unofficialï¼,12/2019,12/29/19
Udemyでコースを出したい人のためのコース - unofficial,www.udemy.com/course/udemy-lecturer-unofficial/,井上 ヨウスケ,49.99,11.39,4.6(7 ratings),æè²ã»æé¤,ãªã³ã©ã¤ã³æè²,ãªã³ã©ã¤ã³ã³ã¼ã¹ä½æ,36äººã®åè¬çãç»é²,æ¥æ¬èª,ããªãã®ã¹ã­ã«ãåç»ã«ãã¦åå¥ãæã«ãã¦ã¿ã¾ãããï¼,5/2019,12/29/19
Crea tu curso Online - Crea un Vídeo de Calidad con Camtasia,www.udemy.com/course/crea-un-video-de-calidad-con-camtasia/,Nicolas Laczka,199.99,11.39,4.1(67 ratings),Teaching & Academics,Online Education,Camtasia,621,Spanish,Edita y produce videos de alta calidad y difÃºndelos a travÃ©s de plataformas como Youtube.,9/2014,12/29/19
【2019年こそ講師デビュー！】ユーデミー/Udemyコース スクリプトの書き方 (非公式/unofficial),www.udemy.com/course/masukawa_004/,マスカワ シゲル,59.99,11.39,4.5(34 ratings),æè²ã»æé¤,ãªã³ã©ã¤ã³æè²,ãªã³ã©ã¤ã³ã³ã¼ã¹ä½æ,192äººã®åè¬çãç»é²,æ¥æ¬èª,ã¦ã¼ããã¼ã³ã¼ã¹ä½ããå§ãããªãã¾ãããããï¼èª°ãæãã¦ãããªãã£ããç´ã¨ãã³ã ãã§ä»ããã¯ãããããã¦ã¼ããã¼ã®ã³ã¼ã¹ä½ããããã«ããã¾ããã¹ã¯ãªããä½ããªãã«ã¡ã©ããã¤ã¯ãã«ã ã¿ã¸ã¢ããã¬ãã¢ãã­ã¨ãã£ãé£ããæ©æã¯ä¸åä¸è¦ï¼ï¼éå¬å¼ï¼,12/2019,12/29/19
Masterclass d’elearning pour formateur (6 formations en une),www.udemy.com/course/masterclass-elearning-pour-formateur/,Renaud Demaret,19.99,11.39,4.4(8 ratings),Formations et diplÃ´mes,Formation en ligne,CrÃ©ation de cours en ligne,71,FranÃ§ais,Tout ce quâil faut savoir pour crÃ©er une formation en ligne de qualitÃ© et vendre des formations en ligne Ã  une audience.,11/2019,12/29/19
ベストセラーになるオンラインコースの構成と作り方,www.udemy.com/course/best-seller/,石崎力也 (RIKIYA ISHIZAKI),199.99,11.39,4.0(10 ratings),ãã¼ã±ãã£ã³ã°,ã³ã³ãã³ããã¼ã±ãã£ã³ã°,ãªã³ã©ã¤ã³ã³ã¼ã¹ä½æ,43äººã®åè¬çãç»é²,æ¥æ¬èª,åã¯ããã¾ã§ã«è¤æ°ã®ãã¹ãã»ã©ã¼ã³ã¼ã¹ãä½æãã¦ãã¾ãããããããã«ã¯å±éç¹ãããã¾ããã©ã®ã³ã¼ã¹ã§ããã©ã³ã¯è³æã¨4ã¤ã®è¦ç´ ãå«ã¾ãã¦ãããã§ãããã®ã³ã¼ã¹ã§ã¯ããããªãã©ã³ã¯è³æã®ä½ãæ¹ã¨4ã¤ã®è¦ç´ ãäºä¾ãå«ããªããè§£èª¬ãã¾ããã,2/2019,12/29/19
Jak Stworzyć Kurs Online na Udemy: Po Polsku (Unofficial),www.udemy.com/course/kurs-online-na-udemy-kompletny-przewodnik-unofficial/,Rafal Galinski,0.0,19.99,4.5(8 ratings),Nauczanie i studia,Nauka przez internet,Tworzenie kursÃ³w online,58,Polski,"StwÃ³rz Kurs Online na Udemy, Generuj DochÃ³d Pasywny bez Ryzyka, (unofficial) polski kurs",11/2019,12/29/19
Corso Completo per Istruttore Udemy di Successo (Unofficial),www.udemy.com/course/corso-completo-per-istruttore-udemy-di-successo-unofficial/,Massimiliano Alfieri,159.99,11.39,4.9(4 ratings),Insegnamento e studi universitari,Formazione online,Creazione di corsi online,31,Italiano,"Ottieni un entrata fissa mensile lavorando da casa e condividendo le tue conoscenze, diventa un istruttore di successo!",11/2019,12/29/19
Udemy Eğitmeni Ol - Udemy'de Kurs Vererek Kazanç Unofficial,www.udemy.com/course/udemy-egitmeni-ol-udemyde-kurs-ver/,Mustafa Coşkun,19.99,11.39,4.7(26 ratings),ÃÄretim ve Akademi,Online EÄitim,Online Kurs OluÅturma,132,TÃ¼rkÃ§e,Profesyonel EÄitmen Olun ve Udemy Ãzerinde Udemy EÄitimi Vererek Para Kazanmaya BaÅlayÄ±n - Kurs OluÅturma Unofficial,3/2019,12/29/19
Aprende a editar videos y déjalos listos para YouTube,www.udemy.com/course/aprende-a-editar-videos-para-tus-cursos-y-video-tutoriales/,Jose Ruben Guerrero Esparza,19.99,11.39,4.6(27 ratings),Teaching & Academics,Online Education,Online Course Creation,893,Spanish,Aprende a editar tus videos y dejarlos listos para tus cursos o video tutoriales.,7/2018,12/29/19
Curso Online Express: guia prático para cursos de sucesso!,www.udemy.com/course/curso-online-guia-pratico-para-cursos-de-sucesso/,Leila Adriano Ostoyke,64.99,11.39,4.4(56 ratings),Ensino e estudo acadÃªmico,EducaÃ§Ã£o online,CriaÃ§Ã£o de cursos online,286,PortuguÃªs,Aprenda a criar cursos online de sucesso de forma prÃ¡tica e eficiente! Crie cursos que geram RESULTADOS REAIS!,3/2019,12/29/19
Passives Einkommen mit Udemy Kursen (unofficial),www.udemy.com/course/udemykurs/,Tobias Becker,69.99,11.39,4.6(5 ratings),Business,SelbststÃ¤ndigkeit,Passives Einkommen,18,Deutsch,Online Videokursen erstellen von A bis Z! Der erste Schritt in Richtung finanzielle Freiheit (Deutsch),11/2019,12/29/19
Teachableの使い方 - 独自ドメインの設定と日本語化の方法,www.udemy.com/course/how-to-use-teachable/,石崎力也 (RIKIYA ISHIZAKI),199.99,11.39,4.4(34 ratings),æè²ã»æé¤,ãªã³ã©ã¤ã³æè²,ãªã³ã©ã¤ã³ã³ã¼ã¹ä½æ,219äººã®åè¬çãç»é²,æ¥æ¬èª,Teachable ã®åºç¤çãªæä½æ¹æ³ã¨ä½¿ãæ¹ãè§£èª¬ãã¾ããç¬èªã«ã¹ã¿ã ãã¡ã¤ã³ã®è¨­å®æ¹æ³ï¼CNAMEï¼ããæ¥æ¬èªåããæé ãããã¦ã³ã¼ã¹ã®ä½ãæ¹ãç´¹ä»ãã¾ãã,1/2019,12/29/19
ユーデミーで売れるコースを作る－自宅で自由な収入を得る方法（非公式）,www.udemy.com/course/the-profit/,佐々木徹 (Toru Sasaki),19.99,11.39,4.4(66 ratings),æè²ã»æé¤,ãªã³ã©ã¤ã³æè²,ãªã³ã©ã¤ã³ã³ã¼ã¹ä½æ,457äººã®åè¬çãç»é²,æ¥æ¬èª,ããªããçµé¨ããçã¿ãåå¥ã«å¤ããï¼å ´æã¨æéãé¸ã°ãããããªã«ã¡ã©ãªãã§åç»ã³ã¼ã¹ãä½ãããªã³ã©ã¤ã³ãã¸ãã¹ã®çµé¨ããªãã¦ãå®å®ããåå¥ãä½ãæ¹æ³ãUdemyããã15å¥ãããè¬å¸«ãå¬éãã¾ãã,2/2017,12/29/19
オンラインスクール構築プログラム：作ったオンラインスクールを合計５つのメディアにマルチユースする方法,www.udemy.com/course/zero-ichi-onlineschool/,山田 どうそん,199.99,11.39,4.3(20 ratings),æè²ã»æé¤,ãªã³ã©ã¤ã³æè²,ãªã³ã©ã¤ã³ã³ã¼ã¹ä½æ,131äººã®åè¬çãç»é²,æ¥æ¬èª,ãªã³ã©ã¤ã³ã¹ã¯ã¼ã«ãä½æããæé ãã¼ã­ããã¹ãããã»ãã¤ã»ã¹ãããã§å­¦ç¿ãã¾ãããï¼åãæ®æ®µãªã³ã©ã¤ã³ã¹ã¯ã¼ã«ãä½æãã¦ããæé ãå®éã«ã³ã¼ã¹ãä½æããªããè§£èª¬ãã¦ãã¾ããã³ã¼ã¹éãã«é²ãã¦ããã°èª°ã§ãï¼ã¤ã®ã³ã¼ã¹ãå®æããããã¾ããããã«,8/2019,12/29/19
Créez votre Formation Vidéo dès ce soir | Simple & Pratique,www.udemy.com/course/creer-une-formation-en-ligne-facilement/,Jason Raba,49.99,11.39,4.1(5 ratings),Formations et diplÃ´mes,Formation en ligne,CrÃ©ation de cours en ligne,20,FranÃ§ais,CrÃ©er & vendre une Formation vidÃ©o | Formation en ligne | Produit numÃ©rique | Web marketing | business en ligne,8/2019,12/29/19
Video Eğitim Hazırlama,www.udemy.com/course/videoegitim/,Bora Arslantürk,69.99,11.39,3.9(39 ratings),ÃÄretim ve Akademi,ÃÄretmen EÄitimi,Online Kurs OluÅturma,183,TÃ¼rkÃ§e,"Video eÄitim seti hazÄ±rlamak, nete yÃ¼klemek ve hatta ek gelir elde etmek isteyen Ã¶Äretmenler, uzmanlar bu kurs size gÃ¶re",2/2019,12/29/19
Curso OnLine de Edição de Vídeo para Educação a Distância,www.udemy.com/course/melhor-curso-online-de-edicao-de-video-para-educacao-a-distancia/,André Rossiter,79.99,11.99,4.2(28 ratings),Ensino e estudo acadÃªmico,EducaÃ§Ã£o online,CriaÃ§Ã£o de cursos online,155,PortuguÃªs,OrientaÃ§Ãµes sobre ediÃ§Ã£o de vÃ­deo com foco em educaÃ§Ã£o a distÃ¢ncia. Confira aulas demonstrativas sem compromisso,9/2018,12/29/19
Novatos en e-Learning: Crea tu proyecto educativo on-line,www.udemy.com/course/novatos-en-e-learning/,Patricio Bustamante M.,49.99,11.99,4.3(30 ratings),Teaching & Academics,Online Education,Online Course Creation,184,Spanish,"AprederÃ¡s todo lo que necesitas saber para crear tu primero proyecto e-learning de manera rÃ¡pida, sencilla y econÃ³mica.",6/2015,12/29/19
【2日でわかる】宅録マイクの選び方～初心者でもわかるマイクの種類から録音の基本～,www.udemy.com/course/recording/,Ryohei Watanabe,64.99,11.99,4.3(19 ratings),é³æ¥½,è£½é ,ãªã¼ãã£ãªå¶ä½,197äººã®åè¬çãç»é²,æ¥æ¬èª,å®é²ã§ä½¿ãããã¤ã¯ã«ã¤ãã¦å­¦ãã§é²é³å¥éãã¾ãããï¼,6/2019,12/29/19
Udemy création de cours pour des revenus passifs unofficial,www.udemy.com/course/udemy-creation-de-cours-pour-des-revenus-passifs-unofficial/,Nicolas Forgue,39.99,11.99,4.3(3 ratings),Business,Entreprenariat,CrÃ©ation de cours en ligne,16,FranÃ§ais,Comment crÃ©er votre business en ligne en vendant des cours sur Udemy unofficial,12/2018,12/29/19
Criar Curso – Seu Primeiro Curso no Ar!,www.udemy.com/course/criar-curso/,Marco Aurélio Gomes,24.99,11.99,4.7(25 ratings),Ensino e estudo acadÃªmico,EducaÃ§Ã£o online,CriaÃ§Ã£o de cursos online,174,PortuguÃªs,"Como planejar, produzir, publicar, divulgar e vender seu curso on-line",9/2017,12/29/19
Udemy’de Online Eğitim Vererek Eğitmen Olun (UnOfficial),www.udemy.com/course/udemyde-egitmen-olun/,Mehmet TEK,199.99,11.99,4.3(34 ratings),ÃÄretim ve Akademi,Online EÄitim,Online Kurs OluÅturma,1.087,TÃ¼rkÃ§e,Online Kurslar HazÄ±rlayarak Bilgilerinizi PaylaÅÄ±n ve Parasal Olarak ÃzgÃ¼rlÃ¼ÄÃ¼nÃ¼zÃ¼ Elde Edin,10/2019,12/29/19
【2019年こそ講師デビュー】ユーデミー 既に知ってることの中からコーステーマを見つける！ブレストガイド (非公式),www.udemy.com/course/masukawa_008/,マスカワ シゲル,34.99,11.99,4.7(15 ratings),æè²ã»æé¤,ãªã³ã©ã¤ã³æè²,ãªã³ã©ã¤ã³ã³ã¼ã¹ä½æ,85äººã®åè¬çãç»é²,æ¥æ¬èª,ã¦ã¼ããã¼è¬å¸«ã«ãªããããã©ãä¸ä½èªåã«ä½ãæããããï¼ãã­ã°ã©ãã¼ã§ãç ä¿®è¬å¸«ã§ããªããããâã®ç§ãéçºããæ¢ã«èªåãç¥ã£ã¦ãããã¨ã®ä¸­ããã³ã¼ã¹ãã¼ããã¿ã¤ããããã®ãã¬ã¤ã³ã¹ãã¼ãã³ã°ã®ãã¯ããã¯ãä½ãã¨ãããªãããã§å¬éï¼,12/2019,12/29/19
Camtasia 2019 für Anfänger: Screencast und Videobearbeitung,www.udemy.com/course/camtasia-2019-fur-beginner-screencast-und-videobearbeitung/,"Mark Hagelauer, M.Sc.",19.99,11.99,4.6(6 ratings),IT & Software,Sonstiges,Camtasia,91,Deutsch,Camtasia 9 fÃ¼r Beginner: Erstelle mithilfe der Schritt-fÃ¼r-Schritt-Anleitung deinen erfolgreichen Kurs!,11/2019,12/29/19
Jak tworzyć kurs online,www.udemy.com/course/jak-tworzyc-kurs-online/,Mepi.pl Video Tutorials,79.99,11.99,4.4(9 ratings),Nauczanie i studia,Nauka przez internet,Adobe Premiere,78,Polski,"Adobe Premiere, Photoshop, Lightroom, OBS, Captivate VR wirtualna rzeczywistoÅÄ w praktyce szkoleÅ online",11/2018,12/29/19
Curso Online 100% Práctico. Cómo crear un Curso y Publicarlo,www.udemy.com/course/como-crear-2-cursos-y-generar-activos/,Marcelo Rodríguez Rodríguez,24.99,11.99,4.4(21 ratings),Teaching & Academics,Online Education,Online Course Creation,"1,286",Spanish,Â¿Quieres Crear tu Curso Online? AquÃ­ los Secretos Â¡Tu imperio en Internet en 3 semanas!,12/2019,12/29/19
Créer votre première mega formation,www.udemy.com/course/creer-votre-premiere-mega-formation/,Nicolas Forgue,49.99,11.99,4.6(2 ratings),Formations et diplÃ´mes, Formation en ligne,CrÃ©ation de cours en ligne,34,FranÃ§ais,"Comment crÃ©er votre premiÃ¨re mega formation, Ã©tape par Ã©tape",10/2018,12/29/19
【2019年こそ講師デビュー】デビュー前に知って欲しい！Udemy辞めたくなったらみるコース（unofficial）,www.udemy.com/course/masukawa_010/,マスカワ シゲル,39.99,11.99,4.9(9 ratings),æè²ã»æé¤,ãªã³ã©ã¤ã³æè²,ãªã³ã©ã¤ã³ã³ã¼ã¹ä½æ,75äººã®åè¬çãç»é²,æ¥æ¬èª,è¬å¸«ããã¥ã¼ã®ããï¼è¬å¸«ã¨ãã¦å¤§æåããããã®ã³ã¼ã¹ã¯ãã£ã¦ããç¶ããããã®ã³ã¼ã¹ã¯ããã¾ããã§ãããä»ã¾ã§ã¯ãè¦å´ãã¦ããã¥ã¼ãããã®ã®ããããªããããªãï¼æã£ã¦ãã®ã¨éãï¼ããè¾ããããã...ãããªæã«è¦³ããæå¾ã®ç ¦ããã®ã³ã¼ã¹ã§ã,12/2019,12/29/19
Çok Satan Online Kurs Oluşturma ve Pazarlama Taktikleri,www.udemy.com/course/online-kurs-olusturmanin-sirlari/,Emrah Yüksel,19.99,11.99,4.1(40 ratings),ÃÄretim ve Akademi,Online EÄitim,Online Kurs OluÅturma,895,TÃ¼rkÃ§e,6 Ayda 10.000 Kurs KaydÄ± NasÄ±l AlÄ±nÄ±r TÃ¼m Deneyimlerimi Bu Kursta Sizlerle PaylaÅÄ±yorum.,10/2018,12/29/19
"Udemy - Creare, gestire e promuovere un corso - Unofficial",www.udemy.com/course/udemy-creare-gestire-promuovere-corso-unofficial/,Roberto Santoli,89.99,11.99,4.1(21 ratings),Insegnamento e studi universitari,Formazione online,Creazione di corsi online,155,Italiano,Strumenti. Aspetti fiscali. SEO. Promozione organica. Contenuti,10/2019,12/29/19
Podia - La meilleure façon de vendre des cours en ligne,www.udemy.com/course/vendre-des-cours-en-ligne-avec-podia/,Renaud Demaret,19.99,11.99,3.9(11 ratings),Formations et diplÃ´mes,Formation en ligne,CrÃ©ation de cours en ligne,31,FranÃ§ais,"HÃ©bergez et vendez vos ebooks, cours en ligne, fichiers tÃ©lÃ©chargeables, espaces membres et programmes d'affiliations.",11/2019,12/29/19
Recursos y/o herramientas para la creación de cursos online,www.udemy.com/course/recursos-yo-herramientas-para-la-creacion-de-cursos-online/,Hecsil Martínez,24.99,11.99,4.7(2 ratings),EnseÃ±anzas y disciplinas acadÃ©micas,EducaciÃ³n en lÃ­nea,CreaciÃ³n de cursos en lÃ­nea,11,EspaÃ±ol,"creaciÃ³n de curso, curso online, recursos para cursos e-learning,",7/2019,12/29/19
Udemy - Crea tu Curso en 1 Semana Paso a Paso - Unofficial,www.udemy.com/course/creacion-cursos-udemy/,Daniel Alejandro,0.0,0,4.4(13 ratings),Teaching & Academics,Online Education,Online Course Creation,113,Spanish,Aprende a Crear un Curso Exitoso en Udemy Paso a Paso. Instructor con MÃ¡s de 8.000 Estudiantes en Udemy - Unofficial,11/2019,12/29/19
GRAVE VÍDEOS E CURSOS 2X MAIS RÁPIDO COM XSPLIT FREE?,www.udemy.com/course/como-gravar-videos-e-cursos-2x-mais-rapido-com-xsplit/,Aguinaldo Dalberto,0.0,0,4.5(36 ratings),Ensino e estudo acadÃªmico,EducaÃ§Ã£o online,TransmissÃ£o ao vivo,269,PortuguÃªs,"Aprenda Definitivamente, gravar aulas, vÃ­deos, capturar a tela e realizar transmissÃµes ao vivo utilizando XSplit !",1/2019,12/29/19
Como Crear un Curso en Udemy En Solo 5 Dias (medio tiempo),www.udemy.com/course/como-crear-un-curso-udemy-en-5-dias/,Bob Marx,199.99,11.39,4.3(53 ratings),Teaching & Academics,Online Education,Online Course Creation,563,Spanish,"Un sistema sencillo, paso a paso - Â¡ObtÃ©n las ideas de tu cabeza y ponlas en la pantalla en menos tiempo!",7/2015,12/29/19
Creeaza Cursuri Pe Udemy - Unofficial,www.udemy.com/course/creeaza-cursuri-pe-udemy-unofficial/,Claudiu Titus Georgescu,0.0,0,4.3(8 ratings),ActivitÄÈi didactice Èi academice,EducaÈie online,Crearea de cursuri online,33,RomÃ¢nÄ,Tot Ce Trebuie Sa Stii Ca Sa Creezi Cursuri Pe Udemy Repede Si Usor (Unofficial),12/2018,12/29/19
Como criar um curso de sucesso na Udemy - Unofficial,www.udemy.com/course/como-criar-um-curso-online-de-sucesso-na-udemy/,Raquel Furchinetti,0.0,0,4.9(4 ratings),NegÃ³cios,Empreendedorismo,CriaÃ§Ã£o de cursos online,495,PortuguÃªs,Crie seu curso de sucesso na Udemy do Absoluto Zero - Unofficial,9/2019,12/29/19
Comment gagner 100€/mois en enseignant sur internet,www.udemy.com/course/gagner-100-euros-mois-en-enseignant-sur-internet/,Renaud Demaret,0.0,0,4.0(6 ratings),Formations et diplÃ´mes,Formation en ligne,CrÃ©ation de cours en ligne,51,FranÃ§ais,Vous savez des choses que la plupart des gens ignorent et vous pouvez vous crÃ©er un revenu mensuel grÃ¢ce Ã  Ã§a.,11/2019,12/29/19
Thinkificの使い方：オンラインスクールを構築しコースを販売する方法,www.udemy.com/course/how-to-sell-online-courses-with-thinkific/,石崎力也 (RIKIYA ISHIZAKI),0.0,0,4.1(6 ratings),æè²ã»æé¤,ãªã³ã©ã¤ã³æè²,ãªã³ã©ã¤ã³ã³ã¼ã¹ä½æ,100äººã®åè¬çãç»é²,æ¥æ¬èª,ãªã³ã©ã¤ã³ã¹ã¯ã¼ã«éå¶ï¼Thinkficï¼ã®å®å¨ã¬ã¤ãã§ãããã¼ã±ãããã¬ã¤ã¹ã«é ¼ããèªå1äººã§ã§ãªã³ã©ã¤ã³ã³ã¼ã¹ãå¶ä½ãè²©å£²ããæ¹æ³ãå­¦ã³ã¾ãããã,1/2019,12/29/19
