Course,URL,instructor,Price (full),Price (discount),Rank,Category 1,Category 2,Category 3,Enrollment,Language,Description,Last Update,Date Scraped
Udemy Masters: Learn Online Course Creation - Unofficial,www.udemy.com/course/online-course-masters/,Phil Ebiner,199.99,11.99,"4.6(1,837 ratings)",Teaching & Academics,Online Education,Online Course Creation,"10,482",English,"Gain freedom with your own online courses & Udemy courses: idea, validation, production, & promotion. (Unofficial)",11/2019,12/29/19
Build a Six-Figure Online Business Selling Online Courses,www.udemy.com/course/create-and-sell-your-own-online-course/,Eli Natoli,94.99,11.99,4.6(398 ratings),Teaching & Academics,Online Education,Online Business,"4,858",English,Course creation: Learn exactly how to build a six-figure online business by creating and selling online courses.,8/2019,12/29/19
How to Create an Awesome Online Course,www.udemy.com/course/how-to-create-an-awesome-online-course/,Miguel Hernandez,199.99,15.59,"4.5(1,558 ratings)",Teaching & Academics,Online Education,Online Course Creation,"15,337",English,Miguel Hernandez reveals all the secrets he uses to make over 90K a year teaching online,11/2018,12/29/19
Udemy Course Creation for Passive Income (Unofficial),www.udemy.com/course/udemy-masterclass-passive-income/,Louise Croft,199.99,11.39,4.6(584 ratings),Teaching & Academics,Online Education,"Passive Income
 ","2,065",English,"Udemy course creation for earning in your sleep, even without Udemy teaching experience. Practical & honest (unofficial)",7/2019,12/29/19
Teach English Online: find students and start teaching now,www.udemy.com/course/teach-english-online/,Charles Cornelius MA CertEd CELTA,199.99,11.39,4.7(647 ratings),Teaching & Academics,Online Education,Teaching English,"3,721",English,The complete guide for anyone who wants to start a freelance career teaching English online,12/2019,12/29/19
"How to Create, Market & Sell Online Courses",www.udemy.com/course/how-to-create-market-and-sell-online-courses/,Instructor HQ,199.99,11.99,4.5(92 ratings),Teaching & Academics,Online Education,Online Course Creation,754,English,Daniel Scott details the steps he uses to make 100k per month creating and selling online courses.,5/2019,12/29/19
Udemy Mastery: How to create 1 course per day! (Unofficial),www.udemy.com/course/udemy-mastery-how-to-create-1-course-per-day-unofficial/,Business Hero,199.99,11.39,4.5(249 ratings),Teaching & Academics,Online Education,Online Course Creation,"2,478",English,#1 Udemy Course Creation Masterclass: The complete course for everyone who wants to create 1 course/day (Unofficial),11/2017,12/29/19
Online Course Creation (No. 1) - The 1-Week Plan,www.udemy.com/course/online-course-creation/,Cha~zay Sandhriel Ph.D.,179.99,11.39,4.8(194 ratings),Teaching & Academics,Online Education,Online Course Creation,"1,057",English,Let's create your first online course in one week. This step-by-step plan shows you how to go from planning to publish.,10/2019,12/29/19
Create The Best Online Courses Without Being On Camera,www.udemy.com/course/create-the-best-online-courses-without-being-on-camera/,Pat Parra,49.99,12.50,4.5(88 ratings),Teaching & Academics,Online Education,Online Course Creation,"2,841",English,Learn how to create online courses without being on camera and still get the best ratings in your niche,9/2019,12/29/19
Udemy Masters 2016: Online Course Creation - Unofficial,www.udemy.com/course/unofficial-teach-online-courses-complete-udemy-course-creation-guide/,Phil Ebiner,29.99,11.39,4.9(916 ratings),Teaching & Academics,Online Education,Online Course Creation,"40,167",English,Learn exactly how to create and sell online courses and have massive success with your own Udemy courses. (Unofficial),1/2017,12/29/19
Udemy Course Creation: Launching a Udemy Course (Unofficial),www.udemy.com/course/online-course-launch/,Phil Ebiner,199.99,11.39,4.8(80 ratings),Teaching & Academics,Online Education,Online Course Creation,"9,127",English,Have your best Udemy course launch ever with this 30-day blueprint for launching a Udemy course! (Unofficial),1/2018,12/29/19
Let's Create a Course in Articulate Storyline 3 / 360,www.udemy.com/course/lets-create-a-course-in-articulate-storyline-3-360/,Thor Melicher,49.99,11.99,4.4(509 ratings),Teaching & Academics,Online Education,Articulate Storyline,"1,847",English,Learn By Doing: Create a Course from Start to Finish in Articulate Storyline 3 / 360,11/2019,12/29/19
Teach Online: How To Create In-Demand Online Courses  ,www.udemy.com/course/teach-online-how-to-create-in-demand-online-courses/,Debbie LaChusa,49.99,11.39,4.8(83 ratings),Teaching & Academics,Online Education,Teacher Training,"1,135",English,Learn How to Turn Your Expertise into Online Courses that Attract More Students & Earn You Passive Income,10/2014,12/29/19
Udemy Course Creation Blueprint Online - Unofficial,www.udemy.com/course/create-course-and-sell-online-udemy-courses/,Musicians Inspired,199.99,11.39,4.6(451 ratings),Teaching & Academics,Online Education,Online Course Creation,"3,500",English,Udemy course creation guide A to Z - learn how to TRULY create a passive income salary online and be free - unofficial,9/2019,12/29/19
"Unofficial Udemy, Camtasia  and PowerPoint Course Creation",www.udemy.com/course/unofficial-udemy-course-creation-camtasia-and-powerpoint/,Brian Jackson,19.99,11.99,4.8(197 ratings),Teaching & Academics,Online Education,Online Course Creation,"11,096",English,"Unofficial Udemy Course Creation with Camtasia Studio 8, Camtasia 9/2018/2019 and PowerPoint 2016 Presentations",7/2019,12/29/19
6 Figure Online Teaching Masterclass: The Complete Course,www.udemy.com/course/6-figure-online-teaching-masterclass-the-complete-course/,Business Hero,199.99,11.39,4.7(31 ratings),Teaching & Academics,Online Education,Business Development,"1,293",English,#1 Certified Online Teaching Masterclass: Start your 6-figure online teaching business today!,2/2018,12/29/19
Passive Income Masterclass: Learn to Build Passive Income,www.udemy.com/course/passive-income-masterclass-learn-to-build-passive-income/,Business Hero,199.99,11.99,4.2(49 ratings),Teaching & Academics,Online Education,Passive Income,"2,889",English,"7 Courses In 1: Build Your Own Shopify Store, Trade Cryptocurrencies, Stocks & ETFs, Buy Businesses & Teach Online",4/2018,12/29/19
Udemy Masterclass (Unofficial): The Complete Guide on Udemy,www.udemy.com/course/udemy-masterclass-unofficial-the-complete-guide-on-udemy/,Business Hero,194.99,11.99,4.7(38 ratings),Teaching & Academics,Online Education,Online Course Creation,"2,770",English,"Create bestselling Udemy courses, sign up 1000s of students to your Udemy courses & build your Udemy brand (Unofficial)",2/2018,12/29/19
How To Create An Online Course To Dominate Your Niche - 2020,www.udemy.com/course/online-course-creation-elearning/,Alex Genadinik,29.99,11.99,4.6(36 ratings),Teaching & Academics,Teacher Training,Online Course Creation,313,English,"Create an amazing online course and sell it on Udemy (unofficial), Skillshare or your Elearning website using Thinkific",12/2019,12/29/19
"The Ultimate, Unofficial Udemy Online Course Creation Guide",www.udemy.com/course/the-ultimate-unofficial-udemy-online-course-creation-guide/,Sundog Education by Frank Kane,49.99,11.99,4.7(64 ratings),Teaching & Academics,Online Education,Online Course Creation,277,English,Learn the tips and tricks of one of Udemy's top instructors - create online courses that sell. (Unofficial),10/2019,12/29/19
Launch Your Own Online School and Increase Your Profits,www.udemy.com/course/thinkific/,Cha~zay Sandhriel Ph.D.,194.99,11.99,4.4(89 ratings),Teaching & Academics,Online Education,Online Course Creation,"1,638",English,"Watch me create a course from A-Z using the Thinkific platform. It's so easy, anyone can do it. Income samples shared!",10/2019,12/29/19
How to Create an Online Course: From Beginning to End,www.udemy.com/course/how-to-create-an-online-course-from-beginning-to-end/,Riley Weller,84.99,11.99,4.3(13 ratings),Business,Entrepreneurship,Online Course Creation,"4,273",English,"Create Passive Income Through Your Passion and Niche with Professionalism, Quality, and Education.",1/2019,12/29/19
Coursepreneur - How To Quickly Create Your Online Course,www.udemy.com/course/coursepreneur/,James Burchill,199.99,11.99,4.3(4 ratings),Teaching & Academics,Online Education,Online Course Creation,45,English,Generate Leads & Make Passive Income With Your Online Course. * The same system I use to make over 4-figures per month *,11/2019,12/29/19
Teach on Udemy- Become an Online Instructor - Unofficial,www.udemy.com/course/make-money-teaching-on-udemy/,Andrew Williams,94.99,11.99,4.6(58 ratings),Teaching & Academics,Online Education,Online Course Creation,913,English,A step-by-step guide to becoming a great online Instructor. No experience required.,3/2019,12/29/19
Teach Online: How to Market and Sell Online Courses,www.udemy.com/course/teach-online-how-to-market-and-sell-online-courses/,Debbie LaChusa,49.99,11.99,4.6(50 ratings),Teaching & Academics,Online Education,Online Course Marketing,685,English,Learn Internet Marketing Strategies to Attract More Students and Sell More Online Courses,4/2016,12/29/19
How to Create A Udemy Course in 5 Days or Less - Unofficial,www.udemy.com/course/unofficial-how-to-create-a-udemy-course-in-5-days-or-less/,Bob Marx,199.99,11.99,4.7(372 ratings),Teaching & Academics,Online Education,Online Course Creation,"7,575",English,* 2017 * A Simple Step-by-Step System - Get Your Ideas Out of Your Head and Onto The Screen in Less Time!,10/2017,12/29/19
Beginner: Improve Video Production & Video Creation In 1 Day,www.udemy.com/course/beginner-video-production-video-creation-for-youtube/,Alex Genadinik,39.99,11.99,4.6(20 ratings),Teaching & Academics,Teacher Training,Online Course Creation,309,English,"Better video production quickly! Video editing, video lighting, presentation tips, body language for video production",12/2019,12/29/19
Successful Online Course Creation On Udemy - Unofficial,www.udemy.com/course/successful-online-course-creation-on-udemy-unofficial/,Dr Karen E Wells,94.99,11.99,4.4(2 ratings),Teaching & Academics,Online Education,Online Course Creation,33,English,How To Successfully Create Online Courses On The Platform Of Udemy. Earn A Passive Income & Change Your Life! Unofficial,11/2019,12/29/19
Earn Passive Income Teaching On Udemy In 2019 - Unofficial,www.udemy.com/course/teachonudemy/,Joe Parys,199.99,11.99,4.6(36 ratings),Teaching & Academics,Online Education,Online Course Creation,"3,788",English,Learn how to earn passive income teaching on Udemy - Unofficial You don't need much to get started join our course today,2/2019,12/29/19
"Create, Launch & Sell Your Premium Online Course",www.udemy.com/course/create-launch-sell-your-premium-online-course/,Ryan Lecour,199.99,11.99,4.3(37 ratings),Teaching & Academics,Online Education,Online Course Creation,"2,759",English,Test Your Topic | Create Your Course | Convert Sales,10/2016,12/29/19
Create Interactive Online Courses w/ Articulate Storyline 2,www.udemy.com/course/ebros-articulate-storyline/,Jeff Batt,99.99,11.99,4.5(332 ratings),Teaching & Academics, Teacher Training,Articulate Storyline,"2,071",English,Become an Articulate Storyline 2 Ninja! In this course we cover everything from A-Z within Articulate Storyline 2.,1/2017,12/29/19
Build Your First Udemy Course for 2020 - Unofficial,www.udemy.com/course/unofficial-udemy-course-creation-and-promotion-mastery/,Jimmy Naraine,199.99,11.99,4.5(295 ratings),Teaching & Academics,Online Education,Online Course Creation,"6,726",English,"Content creation tips, filming secrets, marketing and increasing enrollment in your courses.",11/2019,12/29/19
Become a Successful Online Trainer - Teach Online Worldwide!,www.udemy.com/course/complete-udemy-bestsellers-online-course-creation-unofficial/,TJ Walker,199.99,11.39,4.2(63 ratings),Teaching & Academics,Online Education,Online Course Creation,"8,143",English,Advanced - Online Course Creation for Instructors Who Want to Create Bestsellers and Dominate Their Niche. No Beginners,4/2019,12/29/19
Online Teaching Live Lesson Strategies For Teachers & Tutors,www.udemy.com/course/online-teaching-tricks/,Kerstin Cable,59.99,11.39,4.5(104 ratings),Teaching & Academics,Online Education,Teacher Training,"1,503",English,"Learn how to teach online lessons, work from anywhere, get your business started and market yourself online",5/2017,12/29/19
Learn to create eLearning courses using Articulate Storyline,www.udemy.com/course/articulate-storyline/,Prashant Gupta,49.99,14.99,3.8(49 ratings),Teaching & Academics,Online Education,Articulate Storyline,353,English,"Learn to quickly create effective and engaging courses and presentations that include voice overs, video and animations",10/2013,12/29/19
How To Become a Best-Selling Udemy Instructor (Unofficial),www.udemy.com/course/become-a-best-selling-udemy-instructor/,Cha~zay Sandhriel Ph.D.,194.99,11.39,4.9(54 ratings),Teaching & Academics,Online Education,Online Course Creation,311,English,Do you want to create best-selling online courses? Tips and tricks from a 6-year best-selling veteran instructor.,10/2019,12/29/19
Create Great Online Classes & Be A Great Online Teacher,www.udemy.com/course/teach-teachers-online-teaching/,Todd McLeod,74.99,11.39,4.3(19 ratings),Teaching & Academics,Online Education,Teacher Training,115,English,Online teacher training to teach online classes and prepare for online teaching jobs,8/2018,12/29/19
How to Create a Best-Selling Online Course in 7 Steps,www.udemy.com/course/how-to-create-a-best-selling-online-course-in-7-steps/,Idan Gabrieli,199.99,11.39,4.7(35 ratings),Teaching & Academics,Teacher Training,Online Course Creation,"5,272",English,"Learn how to select a winning topic, design awesome content and record and edit engaging and professional lectures",10/2019,12/29/19
How To Create An Online Course That Sells,www.udemy.com/course/how-to-create-an-online-course-that-sells/,Sandor Kiss,199.99,11.39,4.4(147 ratings),Teaching & Academics,Online Education,Online Course Creation,"7,055",English,Two bestselling authors reveal their system to build 35 bestselling courses in 5 months.,11/2018,12/29/19
Udemy Blueprint - Easy Online Course Creation Unofficial,www.udemy.com/course/simple-course-creation/,Jimmy Hernandez,119.99,11.39,5.0(2 ratings),Teaching & Academics,Online Education,Online Course Creation,723,English,Udemy Blueprint - Ultimate Online Course Creation using Camtasia 9 to Earn Passive Income on Udemy - Unofficial,6/2018,12/29/19
Udemy Course Creation - Teach Online Masterclass Unofficial,www.udemy.com/course/teach-online-course-creation-masterclass/,Mark Timberlake,199.99,11.39,4.6(52 ratings),Teaching & Academics,Online Education,Teacher Training,"1,151",English,Build Your Own Online Teaching Business - Teacher Training - Unofficial,10/2018,12/29/19
Create Your Own Wordpess Website To Sell Courses,www.udemy.com/course/create-your-own-wordpess-website-to-sell-courses/,Michael Veri,19.99,11.39,4.4(42 ratings),Teaching & Academics,Online Education,Online Course Creation,"8,891",English,Create your own Online Course Website with Wordpress to sell your Online Courses,5/2019,12/29/19
Online Course Creation (No. 6) - Create Green Screen Videos,www.udemy.com/course/green-screen-video-course/,Cha~zay Sandhriel Ph.D.,194.99,11.39,4.2(86 ratings),Teaching & Academics,Online Education,Online Course Creation,"1,563",English,All about green and blue screen video recording using Camtasia editing so you can create best-selling online courses.,10/2019,12/29/19
Become An Online Instructor & Earn Passive Income With Ease!,www.udemy.com/course/become-an-online-instructor-earn-passive-income-with-ease/,Sandy Dee,69.99,11.39,4.9(5 ratings),Teaching & Academics,Online Education,Online Course Creation,20,English,We debunk all the myths and help you to teach engaging tutorials! Online course creation for Udemy & more! Unofficial,12/2019,12/29/19
Create Certification Courses And Increase Course Enrollments,www.udemy.com/course/certification-courses/,Cha~zay Sandhriel Ph.D.,149.99,11.39,4.7(26 ratings),Teaching & Academics,Online Education,Online Course Creation,187,English,Learn how to turn your current online courses into certification courses. Enjoy happier students by being the expert.,10/2019,12/29/19
How to Create an Online Course: Step-By-Step Fast Start 2019,www.udemy.com/course/create-your-own-profitable-online-course-in-the-next-4-weeks/,James J Forno,194.99,11.39,4.6(35 ratings),Teaching & Academics,Online Education,Online Course Creation,"1,246",English,[2019] Learn to QUICKLY create a QUALITY + PROFITABLE online course AND build your customer base in as little as 4 weeks,5/2019,12/29/19
Certification5 WEC Online Business Life Coaching,www.udemy.com/course/women-empowerment-5-online-business-life-coaching-certification/,Womanly Wealth Academy |Integrative Coaching Experts,199.99,11.39,4.8(14 ratings),Teaching & Academics,Online Education,Online Course Creation,468,English,Become an Online Business Life Coach for Women Empowerment|Accreditation + Credentials + WEC Directory for Level 2 Grads,12/2019,12/29/19
How To Teach Online Full Time with Udemy 2018 - Unofficial,www.udemy.com/course/teachfulltime/,Joe Parys,199.99,11.39,4.5(126 ratings),Teaching & Academics,Online Education,Online Course Creation,"8,110",English,In this complete course students will learn how to teach online and earn full time income with Udemy in 2018 Unofficial,6/2018,12/29/19
Create & Sell Courses Online (Course Creator's Sales Funnel),www.udemy.com/course/create-sell-courses-online-course-creators-sales-funnel/,Nathan Williams,199.99,11.39,5.0(3 ratings),Business,Entrepreneurship,Online Course Creation,"1,287",English,"How To Create & Profit From ""Affordable"" Courses!",3/2019,12/29/19
Turn your book into a course,www.udemy.com/course/profit-from-your-knowledge-turn-your-book-into-a-course/,Dale Darley,49.99,11.39,4.3(31 ratings),Teaching & Academics,Online Education,Online Course Creation,"1,344",English,Simple steps to creating a course from your book,10/2017,12/29/19
How to Create a Udemy Course: Step-By-Step 2019 - Unofficial,www.udemy.com/course/unofficial-how-to-create-a-udemy-course-in-2-days/,James J Forno,199.99,11.39,4.7(49 ratings),Teaching & Academics,Online Education,Online Course Creation,"1,959",English,*2019* Learn exactly how to create your own Udemy course in one week using a proven step-by-step system - (Unofficial),5/2019,12/29/19
Create and Sell Online Courses with Teachable and Thinkific,www.udemy.com/course/create-and-sell-online-courses/,Phil Ebiner,29.99,11.39,3.2(141 ratings),Teaching & Academics,Online Education,Online Course Creation,"12,227",English,The complete guide to self-hosting online courses: turn your online courses into a full-time business with our training!,1/2018,12/29/19
Pre-Selling For Online Course Entrepreneurs,www.udemy.com/course/powerful-pre-sell/,Ryan Lecour,139.99,11.39,3.7(27 ratings),Teaching & Academics,Online Education,Online Course Creation,"4,315",English,Get Paid to Create Information Products Before They Exist (without under-delivering or being a greedy puss),11/2016,12/29/19
How to Create A Course Promo Video that Sells,www.udemy.com/course/create-course-promo-video-that-sells/,Ramgopal from Presentation Process,99.99,11.39,3.8(25 ratings),Teaching & Academics, Online Education,Online Course Creation,127,English,Create compelling Promotional Videos fast with 4-step system used by top-selling course creators (PPT+ Script Templates),10/2018,12/29/19
Online Course Creation (No. 5) - Your Course Outline,www.udemy.com/course/how-to-create-online-courses/,Cha~zay Sandhriel Ph.D.,149.99,11.39,4.6(89 ratings),Teaching & Academics,Online Education,Online Course Creation,"1,050",English,Learn how to take your in-person healing and coaching business and turn your knowledge into online courses for income.,10/2019,12/29/19
UDEMY - Create Udemy Courses Easier With EasyVSL -Unofficial,www.udemy.com/course/create-udemy-courses-in-minutes/,Chris Towland,194.99,11.39,4.8(114 ratings),Teaching & Academics,Online Education,Online Course Creation,"1,724",English,Learn how anyone can create online courses with no prior experience. This software works on PCs and Apple Mac,12/2019,12/29/19
How to teach an online course,www.udemy.com/course/how-to-teach-an-online-course/,Huw Collingbourne,19.99,11.39,4.9(265 ratings),Teaching & Academics,Online Education,Online Course Creation,"6,954",English,Make professional instructional videos â on an amateur budgetâ¦,8/2014,12/29/19
The Complete Udemy Instructor Mastermind [Unofficial Course],www.udemy.com/course/the-complete-udemy-instructor-mastermind-unofficial-course/,Bryan Guerra,199.99,11.39,4.9(5 ratings),Business,Media,Online Course Creation,"2,605",English,"How to create Courses for Udemy, Optimize them for Search, & Rank them for long term Passive Income [Unofficial Course]",9/2019,12/29/19
Learning Path: Canvas: Create Amazing Courses with Canvas,www.udemy.com/course/learning-path-canvas-create-amazing-courses-with-canvas/,Packt Publishing,199.99,11.39,4.2(11 ratings),Teaching & Academics,Online Education,Online Course Creation,65,English,Learn collaboration and build courses with Canvas,8/2017,12/29/19
Creating Udemy Courses: A Step-By-Step Guide - Unofficial,www.udemy.com/course/unofficial-creating-udemy-courses-a-step-by-step-guide/,Scott Britton,194.99,11.39,4.2(181 ratings),Teaching & Academics,Online Education,Online Course Creation,"10,515",English,"The most comprehensive guide on creating, publishing, launching, and growing a Udemy course. Contains Udemy growth hacks",3/2016,12/29/19
How To Make Udemy Courses - With Final Cut Pro( Unofficial ),www.udemy.com/course/creating-online-courses-with-final-cut-pro/,Joshua Blewett,199.99,11.39,5.0(4 ratings),Teaching & Academics,Online Education,Final Cut Pro,667,English,The complete guide to creating and editing online courses,6/2018,12/29/19
Create Online Courses with Camtasia 2019 and PowerPoint 2016,www.udemy.com/course/create-online-courses-with-camtasia-2019-and-powerpoint-2016/,Brian Jackson,19.99,11.39,3.9(4 ratings),Teaching & Academics,Other Teaching & Academics,Online Course Creation,31,English,Learn to create online courses with Camtasia 2019 and PowerPoint 2016 and publish on YouTube and the top course sites,6/2019,12/29/19
Create High-End Products: From Digital to Physical Products,www.udemy.com/course/create-physical-products/,Cha~zay Sandhriel Ph.D.,179.99,11.39,4.6(5 ratings),Teaching & Academics,Online Education,Online Course Creation,100,English,"Earn more and receive expert status by turning your digital products into high-end, physical, shippable products.",10/2019,12/29/19
"Create an online training course, how to build elearning",www.udemy.com/course/create-an-online-training-course-how-to-build-elearning/,Platform One Virtual Services,194.99,11.39,3.7(14 ratings),Teaching & Academics,Online Education,Online Course Creation,68,English,"Build your online course, train the trainer online course, become an instructional designer, how to create an elearn",2/2019,12/29/19
How to create online courses using Articulate Rise,www.udemy.com/course/how-to-create-online-courses-using-articulate-rise/,Prashant Gupta,49.99,11.39,4.9(17 ratings),Teaching & Academics,Online Education,Online Course Creation,75,English,Learn to create web based tutorials and online courses using Articulate Rise,5/2017,12/29/19
How to Create Your Own Successful Online Course Now,www.udemy.com/course/how-to-create-your-own-successful-online-course-now/,Roma Waterman,199.99,11.39,4.5(44 ratings),Teaching & Academics,Online Education,Online Course Creation,"1,022",English,A Beginners Guide to Creating and Marketing an online course,12/2018,12/29/19
Create Your First Successful Online Business,www.udemy.com/course/create-an-online-course-the-complete-and-proven-guide/,Rob Percival,199.99,11.39,4.1(48 ratings),Teaching & Academics,Online Education,Online Course Creation,"1,522",English,"How to structure, record, edit, and maximize your online course for massive reach and impact for first-time teachers.",5/2018,12/29/19
Online Video Course Essentials,www.udemy.com/course/online-video-course-essentials/,Cody Ray Miller,199.99,11.39,4.8(4 ratings),Teaching & Academics,Online Education,Online Course Creation,"2,082",English,"Create great videos, share them with the world, and profit while you sleep!",10/2018,12/29/19
Course creation for busy entrepreneurs: #1 the masterplan,www.udemy.com/course/course-creation-for-busy-entrepreneurs-1-the-masterplan/,Kenz Soliman,124.99,11.39,4.9(78 ratings),Teaching & Academics,Online Education,Entrepreneurship Fundamentals,"1,537",English,The ultimate guide to get ready and plan to create your online course empire,10/2018,12/29/19
How To Teach Your First Online Course,www.udemy.com/course/how-to-teach-your-first-online-course/,Mike DeVincent,194.99,11.39,4.7(10 ratings),Teaching & Academics,Online Education,Online Course Creation,383,English,Discover smart tactics and long term strategy to create an awesome course and love every part of teaching!,7/2019,12/29/19
Online Course Creation: Teach an Online Course,www.udemy.com/course/how-to-teach-an-online-course2/,TJ Walker,199.99,11.39,4.0(28 ratings),Teaching & Academics,Online Education,Online Course Creation,"5,436",English,You can create compelling video lectures in your own online course creation,4/2019,12/29/19
Udemy Course Creation For Passive Income (Unofficial),www.udemy.com/course/unofficial-easy-udemy-course-creation-step-by-step/,Dave Espino,139.99,11.39,4.4(85 ratings),Teaching & Academics,Online Education,Online Course Creation,"1,779",English,I've published 52 courses on Udemy. Why not use my super-simple & FAST Udemy course creation process? (Unofficial),3/2016,12/29/19
