Course,URL,instructor,Price (full),Price (discount),Rank,Category 1,Category 2,Category 3,Enrollment,Language,Description,Last Update,Date Scraped
Create a Website with the Twenty Twenty Theme,www.udemy.com/course/create-website-twenty-twenty-theme/,David Utke,0.0,Free,3.6(5 ratings),Design,Web Design,Web Development,"2,733",English,"Step 1 To Done! Design, SEO and all the little details you need to know to make a pro website.",12/2019,12/29/19
Get started Creating Websites Everything you need provided,www.udemy.com/course/get-started-creating-websites-everything-you-need-provided/,Laurence Svekis,0.0,Free,4.4(71 ratings),Development,Web Development, ,"18,156",English,Everything you need to know on how to create your own websites even sell them for extra income. Online income made easy,11/2019,12/29/19
Web Development Concepts with Scriptcase,www.udemy.com/course/web-development-concepts-with-scriptcase/,Carlos Ferreira,0.0,Free,4.2(135 ratings),Development,Web Development,Scriptcase,"11,252",English,For those who want to start programming with web technologies!,7/2017,12/29/19
Brackets Editor Tools and Resources for web developers,www.udemy.com/course/brackets-io-tutorial/,Laurence Svekis,0.0,Free,4.7(10 ratings),Design,Web Design,Web Development,"3,254",English,Introduction to using Brackets code editor to write code. Explore how to customize and see features of Brackets,11/2019,12/29/19
Ultimate Web Development with HTML and CSS,www.udemy.com/course/ultimate-web-development-with-html-and-css/,LYHUL LONG,0.0,Free,3.9(28 ratings),Development,Web Development, ,"3,737",English,Learn Web Development by creating a Blog with HTML and CSS,11/2019,12/29/19
7 Ways to Make Your Blog More Visually Appealing,www.udemy.com/course/7-ways-to-make-your-blog-visually-appealing/,Scott Baxter,0.0,Free,3.9(12 ratings),Development,Web Development, ,"4,695",English,"How to Create an Amazing, Engaging Website",9/2018,12/29/19
Make webpages in minutes without coding on your smartphone,www.udemy.com/course/create-webpages-in-minutes-on-your-smartphone/,Een jeen,0.0,Free,3.7(37 ratings),Business,Other,Web Development,"4,553",English,"Start creating wonderful webpages by just adding the content such as images,videos,text and more.",9/2018,12/29/19
Web development and design | from Level 0,www.udemy.com/course/web-development-boot-camp-from-zero-to-hero-darwish/,M Darwish,0.0,Free,3.8(85 ratings),Development,Web Development, ,"7,116",English,"HTML5 Basics, CSS3 Basics",7/2019,12/29/19
Building no-code apps on bubble for newbies by Zeroqode Lab,www.udemy.com/course/how-to-build-apps-without-code-on-bubble-beginners-guide/,Levon Terteryan,0.0,Free,4.3(13 ratings),IT & Software,Other,Web Development,"2,843",English,Learn how to build beautiful and powerful web applications without writing a single line of code. By Zeroqode Lab,6/2019,12/29/19
Web Development - Complete Fast Track Course (2019),www.udemy.com/course/web-development-fast-track/,Ruben Giuliani,0.0,Free,"4.4(1,432 ratings)",Development,Web Development, ,"42,468",English,"HTML, CSS, Javascript, JQuery, PHP, MySQL - master the foundations of modern web development.",1/2019,12/29/19
Learn How to Create a Successful Website for Your Brand,www.udemy.com/course/learn-how-to-create-a-successful-website-for-your-brand/,David Di Franco,0.0,Free,3.9(43 ratings),Business,Entrepreneurship,Web Development,"5,963",English,A 10-lecture course explaining how to create a successful website for your online brand â divided into two sub-courses.,1/2015,12/29/19
Building Apps with Third Party Integrations,www.udemy.com/course/building-apps-with-third-party-integrations/,Mike Solomon,0.0,Free,4.4(31 ratings),Development,Web Development, ,"6,341",English,"How to make safe, secure and robust web apps that use third party APIs",12/2018,12/29/19
Fundamentals of Solace Administration,www.udemy.com/course/fundamentals-of-solace-administration/,Leah Robert,0.0,Free,4.1(265 ratings),IT & Software,Other,Web Development,"2,799",English,A beginner's guide to Solace messaging,7/2018,12/29/19
"How To Start A Website for Writers, Artists & Creative Types",www.udemy.com/course/how-to-start-a-website-for-writers-artists-creative-types/,Baker Lawley,0.0,Free,4.2(234 ratings),Business,Entrepreneurship,Web Development,"19,460",English,"Share your work with the world with this free, detailed, step-by-step guide to starting a website for writers & artists!",4/2014,12/29/19
"How to Register a Domain, Set Up Hosting, and Edit Web Pages",www.udemy.com/course/register-domain-setup-hosting-create-web-page/,Andrew Tye,0.0,Free,4.5(192 ratings),Development,Web Development, ,"9,466",English,"Register a domain name, set up web hosting, create pages and add pictures, links, video, WordPress and PayPal to website",3/2018,12/29/19
Create Website from scratch in Urdu & Hindi,www.udemy.com/course/create-website-from-scratch-in-urdu-hindi/,Uh Tuts,0.0,Free,4.5(258 ratings),Development,Web Development,Hindi,"6,849",English,Website layout in HTML and CSS,6/2016,12/29/19
Create Your Very Own Author Website,www.udemy.com/course/create-your-own-author-website-to-attract-1000s-of-new-fans/,Carl Plumer,0.0,Free,4.1(18 ratings),Personal Development,Creativity,Web Development,"2,765",English,"The first step to creating a solid platform, attract readers, establish credibility, and sell your books!",10/2015,12/29/19
Learn HTML and CSS by Building a Stylish Login Form,www.udemy.com/course/learn-html-and-css-by-building-a-stylish-login-form/,Zaowl Dev,0.0,Free,4.0(98 ratings),Development,Web Development, ,"6,168",English,Take Your Web Development Skills to the Next Level,10/2018,12/29/19
"Remove annoying ads from YouTube, Facebook and other places",www.udemy.com/course/web-adblock/,Alex Gorbunov,0.0,Free,3.8(94 ratings),Business,Media,Web Development,"5,507",English,Easy. Fast. Free. Block all ads from viewing. Have a choice not to view the ads while surfing.,2/2017,12/29/19
Web development road map series,www.udemy.com/course/web-development-road-map-series/,Ahmed Ahmed Hassan,0.0,Free,3.1(9 ratings),Development,Web Development, ,"1,814",English,the path to be a web developer and the most common techniques (JavaScript - PHP- C# - Python ),11/2019,12/29/19
Create & Build Custom Website Without Coding WordPress 2019,www.udemy.com/course/custom-website-without-coding/,Jamshaid Raza,0.0,Free,3.6(59 ratings),Development,Web Development,Web Design,"4,835",English,Make complete website in WordPress With free plug-in and theme and Design your own custom premium website without coding,11/2018,12/29/19
HTML and CSS - Lets Build a Mixer Clone,www.udemy.com/course/html-and-css-lets-build-a-mixer-clone/,Joe Santos Garcia,0.0,Free,4.2(65 ratings),Development,Web Development,CSS,"7,604",English,Learn to code for free,8/2019,12/29/19
Fundamentals of Solace Development,www.udemy.com/course/fundamentals-of-solace-development/,Leah Robert,0.0,Free,4.1(200 ratings),IT & Software,Other,Web Development,"2,795",English,A developer's guide to messaging with Solace PubSub+,12/2018,12/29/19
Create Google Homepage with HTML and CSS in just 40 mins,www.udemy.com/course/create-google-homepage-with-html-and-css-in-just-40-mins/,Zaowl Dev,0.0,Free,4.5(95 ratings),Development,Web Development, ,"5,588",English,Built By Doing,10/2018,12/29/19
"Cloning Amazon, Netflix & Spotify",www.udemy.com/course/learn-html-css-clone-amazon-netflix-spotify/,Ironhack Bootcamp,0.0,Free,3.8(288 ratings),Development,Web Development,CSS,"18,694",English,Learn HTML + CSS by recreating the home pages of some amazing companies.,9/2017,12/29/19
HTML and CSS - Lets Build a Mixer Clone,www.udemy.com/course/html-and-css-lets-build-a-mixer-clone/,Joe Santos Garcia,0.0,Free,4.2(65 ratings),Development,Web Development,CSS,"7,604",English,Learn to code for free,8/2019,12/29/19
EverWeb Website Builder: Create a Website Visually,www.udemy.com/course/everwebcourse/,EverWeb Learning Center,0.0,Free,4.2(33 ratings),Development,Web Development, ,"6,984",English,A complete course on how to easily build your own website using EverWeb.,10/2019,12/29/19
Web Developer Basics,www.udemy.com/course/webbasics/,Mohamed Hosny,0.0,Free,3.8(88 ratings),Development,Web Development, ,"8,060",English,Basics of the most common web programming languages at one package on your hand.,10/2018,12/29/19
Building a Niche Website For Beginners,www.udemy.com/course/authority-website-mini-course/,Ron Stefanski,0.0,Free,4.3(645 ratings),Business,Entrepreneurship,Web Development,"18,526",English,Learn the basics of creating a successful niche website with guides on choosing your domain name and your market.,10/2019,12/29/19
Formation Complète Développeur Web,www.udemy.com/course/formation-developpeur-web/,John Codeur,199.99,13.19,"4.6(15,935 ratings)",DÃ©veloppement,DÃ©veloppement Web,DÃ©veloppement Web,43Â 665,FranÃ§ais,"Le DÃ©veloppement Web de A Ã  Z. Apprenez HTML, CSS, Javascript, jQuery, Bootstrap, PHP, MySQL, Wordpress...",12/2019,12/29/19
"Desarrollo Web Completo con HTML5, CSS3, JS AJAX PHP y MySQL",www.udemy.com/course/desarrollo-web-completo-con-html5-css3-js-php-y-mysql/,Juan Pablo De la torre Valdez,199.99,11.99,"4.6(15,755 ratings)","Development
 ",Web Development, ,"41,485",Spanish,"Aprende Desarrollo Web con este curso 100% prÃ¡ctico, paso a paso y sin conocimientos previos, INCLUYE PROYECTO FINAL",11/2019,12/29/19
【世界で30万人が受講】フルスタック・Webエンジニア講座（2019最新版）,www.udemy.com/course/completeweb2_jp/,井上 博樹 (Hiroki Inoue),199.99,11.39,"4.2(2,767 ratings)",éçº,ã¦ã§ãéçº,ã¦ã§ãéçº,24387äººã®åè¬çãç»é²,æ¥æ¬èª,"25 ã®ã¦ã§ããµã¤ããã¢ãã¤ã«ã¢ããªãéçºããªãããã­ã°ã©ãã³ã°ï¼ HTML5, WordPress, CSS3, Javascript, Bootstrap 4,PHP, Python, MySQL) ãå­¦ã³ãWebã¨ã³ã¸ãã¢ã«ãªããï¼",6/2019,12/29/19
Der komplette Web-Entwickler Kurs 2.0 -Erstelle 25 Webseiten,www.udemy.com/course/der-komplette-webentwickler-2/,Denis Panjuta,199.99,11.39,"4.5(4,837 ratings)",Programmierung,Webentwicklung,Webentwicklung,28.679,Deutsch,"Web Entwicklung. Erstelle eigene Webseiten und mobile Apps mit HTML, CSS, Javascript, jQuery, PHP, Python, MySQL.",10/2019,12/29/19
Web 開発入門完全攻略コース - プログラミング をはじめて学び創れる人へ！未経験から現場で使える開発スキルを習得！,www.udemy.com/course/web-application-development/,中村祐太 （Yuta Nakamura）,199.99,11.39,"4.2(1,960 ratings)",éçº,ã¦ã§ãéçº,ã¦ã§ãéçº,11943äººã®åè¬çãç»é²,æ¥æ¬èª,"HTML ãCSS ã®åºç¤ã1ããå­¦ã³ã«ãã§ã®Webãµã¤ãã®å¶ä½ããã©ãã®ã£ã©ãªã¼ã®å¶ä½ãRuby on Rails ãä½¿ã£ãã¿ã¹ã¯ç®¡çã¢ããªéçºãããã¦JavaScript, MySQL, Gitãªã©Webéçºã«å¿é ãªã¹ã­ã«ãå­¦ã¶ã",12/2019,12/29/19
Desenvolvimento Web Completo 2019 - 20 cursos + 20 projetos,www.udemy.com/course/web-completo/,Jorge Sant Ana,199.99,11.39,"4.6(11,461 ratings)",Desenvolvimento,Desenvolvimento web,Desenvolvimento web,34.012,PortuguÃªs,Domine e aplique em projetos prÃ¡ticos as maiores e principais tecnologias de desenvolvimento web do mercado.,10/2019,12/29/19
Komple Uygulamalı Web Geliştirme Eğitimi | 2019,www.udemy.com/course/komple-web-developer-kursu/,Sadık Turan,199.99,11.39,"4.6(8,156 ratings)",YazÄ±lÄ±m GeliÅtirme,Web GeliÅtirme,Web GeliÅtirme,24.692,TÃ¼rkÃ§e,"SÄ±fÄ±rdan ileri seviyeye 'Web GeliÅtirme': Html, Css, Sass, Flexbox, Javascript, Bootstrap,JQuery,Asp.Net Mvc ve Core Mvc",12/2019,12/29/19
Die komplette Web-Entwickler Masterclass,www.udemy.com/course/web-entwickler-masterclass/,Denis Panjuta,199.99,11.39,"4.6(1,221 ratings)",Programmierung,Webentwicklung,Webentwicklung,7.853,Deutsch,"Lerne HTML, CSS, Javascript, jQuery, Bootstrap, PHP und werde zum kompletten Webentwickler in 6 Wochen",2/2019,12/29/19
Web developer od podstaw w 15 dni,www.udemy.com/course/kurs-web-developer-od-podstaw-w-15-dni/,Samuraj Programowania,0.0,19.99,"4.8(3,620 ratings)",IT i oprogramowanie,Inne,Tworzenie stron internetowych,7Â 215,Polski,ZdobÄdÅº solidne podstawy HTML i CSS i zyskaj umiejÄtnoÅci potrzebne do samodzielnego tworzenia nowoczesnych stron www.,10/2018,12/29/19
Zaawansowane projekty w CSS i JavaScript,www.udemy.com/course/zaawansowane-projekty-w-css-i-javascript/,Samuraj Programowania,0.0,34.99,4.8(289 ratings),Programowanie,Tworzenie stron internetowych,Tworzenie stron internetowych,2Â 295,Polski,7 projektÃ³w + BEM + Sass + Node.js + npm + JavaScript + webpack + Bootstrap + animacje + responsywnoÅÄ i optymalizacja,11/2019,12/29/19
Curso Desenvolvedor Web Completo + 10 de projetos.,www.udemy.com/course/curso-desenvolvedor-web-completo/,André Fontenelle,199.99,11.39,"4.5(14,790 ratings)",Desenvolvimento,Desenvolvimento web,Desenvolvimento web,50.248,PortuguÃªs,O treinamento de Desenvolvimento Web mais vendido desta plataforma no Brasil,11/2019,12/29/19
"Der große Kurs der Webentwicklung: HTML, CSS, JS, PHP und Co",www.udemy.com/course/webentwicklung/,David Mika,199.99,11.39,4.6(463 ratings),Programmierung,Webentwicklung,Webentwicklung,2.900,Deutsch,"Moderne Webseiten erstellen mit HTML 5, CSS 3, JavaScript, jQuery, Bootstrap 4 un PHP 7! Responsive Webdesign inklusive!",7/2019,12/29/19
Curso completo de Desenvolvimento Web - Crie 6 projetos,www.udemy.com/course/curso-completo-do-desenvolvedor-web/,Jorge Sant Ana,74.99,11.39,"4.6(17,988 ratings)",Desenvolvimento,Desenvolvimento web,Desenvolvimento web,46.179,PortuguÃªs,"Aprenda a desenvolver sites e sistemas web do zero utilizando HTML, CSS, Bootstrap, JavaScript, JQuery, PHP, POO e MySQL",10/2019,12/29/19
Полный Курс Веб-Разработчика 2.0,www.udemy.com/course/the-complete-web-developer-course-2-russian/,Rob Percival,199.99,11.39,4.5(282 ratings),Ð Ð°Ð·ÑÐ°Ð±Ð¾ÑÐºÐ°,ÐÐµÐ±-ÑÐ°Ð·ÑÐ°Ð±Ð¾ÑÐºÐ°,ÐÐµÐ±-ÑÐ°Ð·ÑÐ°Ð±Ð¾ÑÐºÐ°,1Â 146,Ð ÑÑÑÐºÐ¸Ð¹,"Ð Ð°Ð·ÑÐ°Ð±Ð¾ÑÐ°Ð¹ÑÐµ 25 Ð²ÐµÐ±-ÑÐ°Ð¹ÑÐ¾Ð² Ð¸ Ð¿ÑÐ¸Ð»Ð¾Ð¶ÐµÐ½Ð¸Ð¹ Ñ Ð¿Ð¾Ð¼Ð¾ÑÑÑ HTML, CSS, Javascript, PHP, Python, MySQL Ð¸ Ð´ÑÑÐ³Ð¸Ñ Ð¸Ð½ÑÑÑÑÐ¼ÐµÐ½ÑÐ¾Ð²!",7/2019,12/29/19
Веб разработка - с нуля до профессионала. Full Stack,www.udemy.com/course/web-full-stack/,YouRa Allakhverdov,199.99,11.39,4.6(388 ratings),Ð Ð°Ð·ÑÐ°Ð±Ð¾ÑÐºÐ°,ÐÐµÐ±-ÑÐ°Ð·ÑÐ°Ð±Ð¾ÑÐºÐ°,ÐÐµÐ±-ÑÐ°Ð·ÑÐ°Ð±Ð¾ÑÐºÐ°,1Â 519,Ð ÑÑÑÐºÐ¸Ð¹,"Web - HTML5, CSS3, JavaScript, jQuery, Bootstrap, PHP, MySQL, Python",12/2019,12/29/19
Crea sistemas Ecommerce con PHP 7 con pagos de PAYPAL y PAYU,www.udemy.com/course/crea-sistemas-ecommerce-con-php-y-con-pagos-de-paypal-y-payulatam/,Juan Fernando Urrego,199.99,11.39,"4.6(2,090 ratings)",Development,Web Development,PHP,"8,448",Spanish,Aprende a crear tu propio ecosistema de comercio electrÃ³nico con PHP 7 usando AdminLTE y recibe pagos con PAYPAL y PAYU,12/2019,12/29/19
"(Ken Cen出品)建網百科全書-使用 HTML,CSS,JS, jQuery,php,mySQL 建立網站",www.udemy.com/course/ken-cens/,Ken Cen,199.99,11.39,"4.6(1,947 ratings)",é»å­åå,ç¶²é éç¼,ç¶²é éç¼,7678,Traditional Chinese,ä¸èµ·å»ºç«12åçå¯¦ç¶²é ,5/2019,12/29/19
Conviértete en un Desarrollador Web desde cero Paso a Paso,www.udemy.com/course/desarrollo-web-desde-cero-paso-a-paso/,Gilbert Rodríguez,149.99,11.39,4.4(980 ratings),Development,Web Development,JavaScript,"3,911",Spanish,Curso completo para el aprendizaje desde cero paso a paso conociendo las mejores tecnologÃ­as de la web (Desarrollo Web),12/2019,12/29/19
Programação Web com Django Framework - do básico ao avançado,www.udemy.com/course/programacao-web-com-django-framework-do-basico-ao-avancado/,Geek University,199.99,11.39,4.7(116 ratings),TI e software,Outro,Django,741,PortuguÃªs,Aprenda a criar aplicaÃ§Ãµes comerciais com todo o poder de Python e Django,12/2019,12/29/19
Curso Completo do Desenvolvedor Web,www.udemy.com/course/curso-html5-css3-javascript/,Glaucio Daniel Souza Santos,154.99,11.39,"4.5(6,187 ratings)",Desenvolvimento,Desenvolvimento web,Desenvolvimento web,15.509,PortuguÃªs,"Aprenda desenvolvimento web, crie um site do zero do bÃ¡sico ao avanÃ§ado, aprenda HTML5 e CSS3 com muito JavaScript.",11/2019,12/29/19
"Curso de Desenvolvimento WEB com ES6, TypeScript e Angular",www.udemy.com/course/curso-de-desenvolvimento-web-com-es6-typescript-e-angular-4/,Jorge Sant Ana,199.99,11.39,"4.6(2,641 ratings)",Desenvolvimento,Desenvolvimento web,Desenvolvimento web,10.002,PortuguÃªs,"Crie aplicaÃ§Ãµes WEB incrÃ­veis como Peixe Urbano e Instagram utilizando JavaScript ES6, TypeScript e Angular",10/2019,12/29/19
Fundamentos de Programación,www.udemy.com/course/fundamentos-de-la-programacion/,Jose Javier Villena,199.99,11.39,"4.3(2,070 ratings)",Desarrollo,Lenguajes de programaciÃ³n,Java,6.232,EspaÃ±ol,"Aprende las Bases de la ProgramaciÃ³n en 9 lenguajes a la vez: Java, Python, Go, C++, PHP, Ruby, C#, JavaScript y C",12/2017,12/29/19
Komple ASP.NET Web Geliştirme Eğitimi|62 Saat|2019,www.udemy.com/course/angular-6-ve-aspnet-core-mvc-bastan-sona-proje-gelistirme/,Engin Demiroğ,199.99,11.39,"4.7(1,649 ratings)",YazÄ±lÄ±m GeliÅtirme,Web GeliÅtirme,Web GeliÅtirme,5.814,TÃ¼rkÃ§e,"Web Development: HTML,CSS,Bootstrap 4,JavaScript ES6+,Angular,C#,Entity Framework,ASP.NET MVC & CORE,API,SQL Veri TabanÄ±",12/2019,12/29/19
Kurs WordPress ⭐ZEROdoPRO / Strona.Blog.Sklep ✅Krok po Kroku,www.udemy.com/course/kurs-online-wordpress-pro/,Dawid Polsakiewicz,99.99,25.00,4.4(210 ratings),Programowanie, Tworzenie stron internetowych,Tworzenie stron internetowych,1Â 176,Polski,"Dla poczÄtkujÄcych. Jak zaÅoÅ¼yÄ Bloga, zbudowaÄ wÅasnÄ StronÄ, lub stworzyÄ Sklep Internetowy? Na Systemie WordPress.",10/2019,12/29/19
ฝึกสร้าง เว็บ จาก เริ่มต้น ไปเป็น มือโปร,www.udemy.com/course/web-developer-bootcamp/,Olan Samritjiarapon,144.99,36.25,4.6(390 ratings),à¸à¸²à¸£à¸à¸±à¸à¸à¸²,à¸à¸²à¸£à¸à¸±à¸à¸à¸²à¹à¸§à¹à¸,à¸à¸²à¸£à¸à¸±à¸à¸à¸²à¹à¸§à¹à¸,à¸à¸¹à¹à¹à¸£à¸µà¸¢à¸à¸¥à¸à¸à¸°à¹à¸à¸µà¸¢à¸,à¹à¸à¸¢,"à¸«à¸¥à¸±à¸à¸ªà¸¹à¸à¸£à¸à¸µà¹à¸à¸¸à¸à¸à¸°à¹à¸à¹à¹à¸£à¸µà¸¢à¸à¸ªà¸£à¹à¸²à¸ Web à¸à¹à¸§à¸¢à¹à¸à¸à¹à¸à¹à¸¥à¸¢à¸µà¸¥à¹à¸²à¸ªà¸¸à¸à¸à¸­à¸ HTML, CSS, JS, Bootstrap, JQuery, Node.js, MongoDB à¹à¸¥à¸° Git",6/2018,12/29/19
Lerne großartige Webseiten zu erstellen,www.udemy.com/course/grossartige-webseiten-erstellen/,Jannis Seemann,199.99,11.39,4.6(585 ratings),Programmierung,Webentwicklung,Webentwicklung,7.091,Deutsch,"Webentwickler in 30-Tagen: Lern HTML/CSS, JavaScript/jQuery, AngularJS, Bootstrap, Git, PHP, Objektorientierung & MySQL",12/2018,12/29/19
Curso de Desarrollo Web Completo 2.0,www.udemy.com/course/curso-de-desarrollo-web-completo-2/,Jose Luis Núñez Montes,199.99,11.39,"4.3(2,309 ratings)",Desarrollo,Desarrollo web,Desarrollo web,7.808,EspaÃ±ol,"Â¡Aprende haciendo! HTML5, CSS3, Javascript, jQuery, Bootstrap 4, WordPress, PHP, MySQL, APIs, apps mÃ³viles y Python",11/2017,12/29/19
Le développement web de A à Z par la pratique,www.udemy.com/course/developpement-web-a-z-par-pratique/,Boris Flesch,199.99,11.39,4.3(309 ratings),DÃ©veloppement,DÃ©veloppement Web,DÃ©veloppement Web,1Â 989,FranÃ§ais,"IntÃ©ressÃ© par le dÃ©veloppement web ? Apprenez Ã  crÃ©er des sites internet en HTML, CSS, PHP et SQL en partant de zÃ©ro !",,12/29/19
"Создание современных адаптивных веб сайтов. HTML5, CSS3",www.udemy.com/course/web-professional-html5/,YouRa Allakhverdov,199.99,11.39,4.5(126 ratings),Ð Ð°Ð·ÑÐ°Ð±Ð¾ÑÐºÐ°,ÐÐµÐ±-ÑÐ°Ð·ÑÐ°Ð±Ð¾ÑÐºÐ°,ÐÐµÐ±-ÑÐ°Ð·ÑÐ°Ð±Ð¾ÑÐºÐ°,569,Ð ÑÑÑÐºÐ¸Ð¹,ÐÐ·ÑÑÐ¸ÑÐµ Ð¾ÑÐ½Ð¾Ð²Ñ Ð²ÐµÐ± Ð´Ð¸Ð·Ð°Ð¹Ð½Ð° Ð¸ ÑÐ°Ð·ÑÐ°Ð±Ð¾ÑÐºÑ ÑÐµÐ°Ð»ÑÐ½ÑÑ ÑÐ¾Ð²ÑÐµÐ¼ÐµÐ½Ð½ÑÑ Ð²ÐµÐ± ÑÐ°Ð¹ÑÐ¾Ð² Ð¿ÑÐ¸ Ð¿Ð¾Ð¼Ð¾ÑÐ¸ HTML5 Ð¸ CSS3 Ð¸ jQuery Ñ Ð½ÑÐ»Ñ!,12/2019,12/29/19
Universidad JavaScript: El mejor curso sobre JavaScript!,www.udemy.com/course/universidad-javascript-angular-react-vue-typescript-html-css-bootstrap/,Global Mentoring Ing. Ubaldo Acosta,19.99,11.39,4.6(457 ratings),Development,Web Development,JavaScript,"7,683",Spanish,"El mejor y mÃ¡s completo curso de JavaScript 2019: Construye proyectos reales JavaScript, E6S, TypeScript, Angular y mÃ¡s!",3/2019,12/29/19
Desenvolvimento Web Avançado 2019,www.udemy.com/course/curso-desenvolvedor-web-avancado/,André Fontenelle,199.99,11.39,4.7(204 ratings),Desenvolvimento,Desenvolvimento web,Desenvolvimento web,2.122,PortuguÃªs,"REACT, ANGULAR, BOOTSTRAP, TYPESCRIPT, JQUERY, JAVASCRIPT e muito mais.",11/2019,12/29/19
"Web Fundamentos 2019 - HTML5, CSS3 e JavaScript",www.udemy.com/course/web-html5-css3-javascript/,Hcode Treinamentos,139.99,11.39,4.6(366 ratings),Desenvolvimento,Desenvolvimento web,Desenvolvimento web,825,PortuguÃªs,"Aprenda HTML5, CSS3 e JavaScript do Zero. Construa projetos web reais, e um site responsivo em 50 aulas.",4/2019,12/29/19
全端初體驗,www.udemy.com/course/fullstack-starter/,Taker Wu,0.0,199.99,4.8(331 ratings),é»å­åå,ç¶²é éç¼,ç¶²é éç¼,1682,Traditional Chinese,ä½¿ç¨åç«¯æè¡ HTML/CSS/jQueryï¼æ­é PHP å¾ç«¯ä»¥å MySQL è³æåº«ï¼é¨èª²éè´ 2 åãå°æ¡ãå¯¦æ°ç·´ç¿,3/2019,12/29/19
「世界で7万人が受講！未経験からWebプログラマーになるための全て」2018年最新版,www.udemy.com/course/programingjp/,Victor Bastos,49.99,12.59,3.9(823 ratings),éçº,ã¦ã§ãéçº,ã¦ã§ãéçº,12404äººã®åè¬çãç»é²,æ¥æ¬èª,Masaaki Hatano ç£ä¿®ã2018å¹´ã®ææ°çã¸updateæ¸ã¿ï¼åå¿èåãã»æ¥æ¬èªå¹ãæ¿ãçï¼,11/2015,12/29/19
"Komple JavaScript ES6+ (2019): Node.js,Express,Angular,Mongo",www.udemy.com/course/full-stack-web-developer-kursu/,Engin Demiroğ,199.99,11.39,4.6(548 ratings),YazÄ±lÄ±m GeliÅtirme,Web GeliÅtirme,Web GeliÅtirme,2.439,TÃ¼rkÃ§e,"Web GeliÅtirme: HTML5, CSS3, JavaScript, ES6, Bootstrap 4, TypeScript, Angular 6, Node.js, NPM, Express, MongoDB, MEAN",12/2019,12/29/19
MASTER EN PHP 7 CON MYSQL Y MUCHO MAS...¡TRAILER AQUI!,www.udemy.com/course/phpcomonadieteloexplico/,Pablo Sanz,199.99,11.39,4.7(174 ratings),Desarrollo,Desarrollo web,MySQL,2.381,EspaÃ±ol,"Php 7 Masterclass 2019 ! Mysql html desde cero, importante no genera somnolencia! Crearemos proyectos increÃ­bles.",11/2019,12/29/19
Guida per Sviluppatori a Django REST Framework e Vue JS,www.udemy.com/course/guida-per-sviluppatori-a-django-rest-framework-e-vue-js/,Michele Saba,199.99,11.39,4.6(87 ratings),Sviluppo,Sviluppo Web,Sviluppo Web,436,Italiano,Impara a creare REST API Professionali e potenti Single Page Applications con Django e Vue JS !,10/2019,12/29/19
Corso Completo di Sviluppo Web: crea da zero il tuo business,www.udemy.com/course/corso-completo-di-sviluppo-e-programmazione-web-italiano/,Nikolay Kolev,149.99,11.39,4.5(345 ratings),Sviluppo,Sviluppo Web,Sviluppo Web,1.290,Italiano,"Progetta siti web e sviluppa la tua attivitÃ : dalle basi in HTML, CSS/SASS e PHP/SQL, alla gestione dei clienti",8/2018,12/29/19
Der Komplette Web-Entwickler Kurs - Erstelle 14 Webseiten,www.udemy.com/course/derkomplettewebentwicklerkurs/,Denis Panjuta,199.99,11.39,4.0(572 ratings),Programmierung,Webentwicklung,Webentwicklung,12.040,Deutsch,"Web Entwicklung von Grund auf in 6 Wochen. HTML, JS, CSS, PHP, MySQL, Bootstrap, Wordpress, APIs, Mobile Apps alles das.",12/2018,12/29/19
"Desarrollo Web con Vue js 2, PHP 7 y MariaDB",www.udemy.com/course/desarrollo-web-con-vuejs-2-php-y-mariadb/,Jorge Maldonado B.,199.99,11.39,4.5(119 ratings),Desarrollo,Desarrollo web,Desarrollo web,529,EspaÃ±ol,"Aprende a usar vue.js 2, webpack, axios, vue-router, vue-resource, vue-cli, vuex, firebase, firestore, php 7 y MariaDB",6/2019,12/29/19
JavaScript 2019: Curso desde Principiante hasta Profesional,www.udemy.com/course/javascript-moderno-para-principiantes/,Grover Vásquez,149.99,11.39,4.4(137 ratings),Desarrollo,Desarrollo web,JavaScript,1.194,EspaÃ±ol,"JavaScript Moderno 2019 para principiantes, aprende los fundamentos, POO, Ajax, ES6+, WebPack y Ejemplos de aplicaciÃ³n.",11/2019,12/29/19
