Course,URL,instructor,Price (full),Price (discount),Rank,Category 1,Category 2,Category 3,Enrollment,Language,Description,Last Update,Date Scraped
The Web Developer Bootcamp,www.udemy.com/course/the-web-developer-bootcamp/,Colt Steele,199.99,11.39,"4.6(147,639 ratings)",Development,Web Development, ,"502,640",English,"The only course you need to learn web development - HTML, CSS, JS, Node, and More!",12/2019,12/29/19
The Complete 2020 Web Development Bootcamp,www.udemy.com/course/the-complete-web-development-bootcamp/,Angela Yu,199.99,11.39,"4.7(30,480 ratings)",Development,Web Development, ,"111,439",English,"Become a full-stack web developer with just one course. HTML, CSS, Javascript, Node, React, MongoDB and more!",12/2019,12/29/19
The Complete Web Developer in 2020: Zero to Mastery,www.udemy.com/course/the-complete-web-developer-zero-to-mastery/,Andrei Neagoie,199.99,11.39,"4.7(28,086 ratings)",Development,Web Development, ,"97,327",English,"Learn to code and become a Web Developer in 2020 with HTML, CSS, Javascript, React, Node.js, Machine Learning & more!",12/2019,12/29/19
The Complete Web Developer Course 2.0,www.udemy.com/course/the-complete-web-developer-course-2/,Rob Percival,199.99,11.39,"4.5(53,888 ratings)",Development,Web Development, ,"241,633",English,"Learn Web Development by building 25 websites and mobile apps using HTML, CSS, Javascript, PHP, Python, MySQL & more!",10/2019,12/29/19
The Complete Junior to Senior Web Developer Roadmap (2020),www.udemy.com/course/the-complete-junior-to-senior-web-developer-roadmap/,Andrei Neagoie,199.99,11.39,"4.7(3,923 ratings)",Development,Web Development, ,"36,239",English,Go from Junior Developer to Senior Developer. Learn all the technical skills Senior Web Developers know in 2020!,12/2019,12/29/19
The Advanced Web Developer Bootcamp,www.udemy.com/course/the-advanced-web-developer-bootcamp/,Colt Steele,199.99,11.39,"4.5(7,032 ratings)",Development,Web Development, ,"59,926",English,"Learn React 16, Redux, D3, ES2015, Testing, CSS Flexbox, Animations, SVG, AJAX, and more!",4/2018,12/29/19
Git a Web Developer Job: Mastering the Modern Workflow,www.udemy.com/course/git-a-web-developer-job-mastering-the-modern-workflow/,Brad Schiff,199.99,11.39,"4.7(5,203 ratings)",Development,Web Development, ,"24,257",English,"Learn Git, GitHub, Node.js, NPM, Object-oriented JavaScript, ES6, webpack, Netlify, BEM and Job Interview Tips",11/2019,12/29/19
Ultimate Web Designer & Developer Course: Build 23 Projects!,www.udemy.com/course/web-developer-course/,Brad Hussey,199.99,11.39,"4.5(10,399 ratings)",Development,Web Development,Web Design,"61,025",English,Become a Full-Stack Developer - Learn Everything from Design to Front & Back-End Programming.,1/2018,12/29/19
The Complete 2019 Web Development Course - Build 15 Projects,www.udemy.com/course/complete-web-development-course/,Development Island (UK),199.99,11.39,"4.5(4,147 ratings)",Development,Web Development, ,"20,074",English,"The only course you need to become a full-stack web developer. Covers HTML5, CSS3, JS, ES6, Node, APIs, Mobile & more!",12/2019,12/29/19
Pre-Programming: Everything you need to know before you code,www.udemy.com/course/pre-programming-everything-you-need-to-know-before-you-code/,Evan Kimbrell,124.99,11.39,"4.6(5,357 ratings)",Development,Programming Languages,Web Development,"101,027",English, Increase your chance of success learning to code and communicating with other developers,12/2019,12/29/19
The Complete Front-End Web Development Course!,www.udemy.com/course/front-end-web-development/,Joseph Delgadillo,194.99,11.39,"4.3(5,184 ratings)",Development,Web Development, ,"178,081",English,"Get started as a front-end web developer using HTML, CSS, JavaScript, jQuery, and Bootstrap!",11/2019,12/29/19
Running a Web Development Business: The Complete Guide,www.udemy.com/course/the-complete-guide-to-running-a-web-development-business/,Evan Kimbrell,149.99,11.39,"4.5(1,297 ratings)",Development,Web Development,Home Business,"30,860",English,Learn how to start and grow a successful web development business. Get up & running and making sales in under a week.,12/2019,12/29/19
The Complete 2019 Fullstack Web Developer Course,www.udemy.com/course/thecompletewebdeveloper/,Kalob Taulien,199.99,11.39,"4.4(3,642 ratings)",Development,Web Development, ,"79,207",English,"Learn HTML, HTML5, CSS, CSS3, JavaScript, PHP, jQuery, Ajax & MySQL from scratch! Build a login system at the end!",6/2018,12/29/19
The Result-Oriented Web Developer Course -  BOOTCAMP 2020,www.udemy.com/course/result-oriented-web-developer-course/,Vertex Academy,199.99,11.39,4.6(396 ratings),Development,Web Development, ,"5,891",English,"Become a Full-Stack Web Developer by building 9 major projects using HTML, CSS, JavaScript, Node.js, and More! Complete",11/2019,12/29/19
The Complete PHP Full Stack Web Developer Bootcamp 1.0,www.udemy.com/course/the-complete-php-full-stack-web-developer-bootcamp/,Srinivas Vanamala,199.99,11.39,4.7(358 ratings),Development,Web Development, ,"14,180",English,"Learn to build websites with HTML , CSS , JAVASCRIPT , Bootstrap , PHP , MySQL , WordPress , OOP & more!",12/2019,12/29/19
"Build Responsive Website Using HTML5, CSS3, JS And Bootstrap",www.udemy.com/course/build-responsive-website-using-html5-css3-js-and-bootstrap/,Irfan Dayan,94.99,11.39,"4.2(2,860 ratings)",Development,Web Development,Responsive Design,"96,815",English,"Learn HTML5, CSS3, JavaScript, jQuery and Bootstrap framework by building a modern looking responsive website.",10/2019,12/29/19
"Complete Web Development Course: HTML, Vue.js, PHP, MySQL",www.udemy.com/course/web-development-html5-css3-php-oop-and-mysql-database/,OnlyKiosk Tech,199.99,11.39,4.5(905 ratings),Development,Web Development, ,"4,222",English,"HTML5, CSS3, JavaScript, jQuery, Responsive Web Page, VueJS, AJAX, PHP, CLI, NPM, Babel, Webpack, MySQL, OOP, Express.js",9/2019,12/29/19
Freelance Newbie,www.udemy.com/course/freelance-newbie/,RealTough Candy,99.99,11.39,4.6(56 ratings),Development,E-Commerce,Web Development,501,English,"A Beginnerâs Guide to Finding Clients, Making Money, and Building Your Web Development Empire",11/2019,12/29/19
Introduction to Programming,www.udemy.com/course/introduction-to-programming-level-i/,Framework Television Inc.,194.99,11.39,4.7(738 ratings),Development,Programming Languages,Web Development,"3,990",English,Professional Coding Skills for Beginners,7/2019,12/29/19
SASS - The Complete SASS Course (CSS Preprocessor),www.udemy.com/course/sass-the-complete-sass-course-css-preprocessor/,Code And Create,19.99,11.39,4.6(108 ratings),Design,Web Design,CSS,719,English,"SASS - Learn SASS, the most popular CSS Extension. Build modern and beautiful projects using SASS and lots of CSS",10/2019,12/29/19
Become a Certified Web Developer,www.udemy.com/course/become-a-certified-web-developer/,Framework Television Inc.,99.99,11.39,"4.4(1,899 ratings)",Development,Web Development, ,"29,358",English,"Complete coverage of HTML, CSS, Javascript and PHP while you Earn Four Respected Certificatons",11/2019,12/29/19
Becoming a Free Lance Web Developer - The Complete Guide,www.udemy.com/course/launch-and-grow-your-career-as-a-successful-web-developer/,Alexander Oni,124.99,11.39,4.6(70 ratings),Personal Development,Career Development,Web Development,516,English,Learn actionable steps for launching a successful career as a freelance web developer from an experienced professional,3/2019,12/29/19
"*NEW* Web Development Secrets 2020 - CRP, HTTP, AJAX & More",www.udemy.com/course/new-web-development-secrets/,Clyde Bowes,199.99,11.39,4.7(10 ratings),IT & Software,Operating Systems,AJAX,155,English,Become a Pro. Understand the process of fetching data from a server and displaying it. Novice to pro in easy steps.,11/2019,12/29/19
Full Stack Web Development Masterclass: Beginner To Advanced,www.udemy.com/course/the-complete-web-developer-masterclass-beginner-to-advanced/,Ashutosh Pawar,194.99,11.39,4.3(258 ratings),Development,Web Development, ,"11,473",English,"Learn full stack web development with HTML5, CSS , Bootstrap 4, Javascript, ES6, VueJs, Node.Js, PostgreSQL & More",4/2019,12/29/19
The Ultimate Web Developer How To Guide,www.udemy.com/course/learn-web-development-complete-step-by-step-guide-to-success/,Laurence Svekis,199.99,11.39,"4.8(1,085 ratings)",Development,Web Development, ,"48,245",English,"Complete web developer Guide to websites working with HTML, CSS, JavaScript, PHP, Bootstrap, JQuery, MySQL and more",11/2019,12/29/19
The Complete Web Developer Masterclass: Beginner To Advanced,www.udemy.com/course/webdevelopercourse/,Joe Parys,199.99,11.39,"3.9(2,987 ratings)",Development,Web Development, ,"39,851",English,In this complete masterclass course students will learn how to build their very own website from scratch through example,8/2016,12/29/19
The Essential Web Developer Course - Build 12 Websites,www.udemy.com/course/the-essential-web-developer-course/,Robert Kanaat,199.99,11.39,"4.3(1,043 ratings)",Development,Web Development, ,"25,293",English,"From an absolute beginner, to a certified Web developer, this course will teach you the ABCs of Web development.",10/2019,12/29/19
Ultimate Web Developer Course Build 10 Websites from Scratch,www.udemy.com/course/ultimate-web-developer-course-build-10-websites-from-scratch/,Laurence Svekis,199.99,11.39,4.7(359 ratings),Development,Web Development, ,"10,996",English,"Build 10+ complete websites from scratch, supercharge your portfolio learn how to create websites",11/2019,12/29/19
"Build Modern Responsive Website With HTML5, CSS3 & Bootstrap",www.udemy.com/course/build-modern-responsive-website-with-html5-css3-bootstrap/,Irfan Dayan,149.99,11.39,4.4(990 ratings),Development,Web Development,Responsive Design,"4,790",English,"Learn HTML5, CSS3, jQuery, Bootstrap And Build Modern Responsive Website With Modern Trends From Scratch.",10/2019,12/29/19
PHP OOP Complete Ecommerce Project Course - 4 Courses in 1,www.udemy.com/course/php-complete-ecommerce-project/,Kazi Ariyan,199.99,11.39,4.2(67 ratings),Development,E-Commerce,Object Oriented Programming,429,English,"OOP PHP Masterclass. Learn OOP , Mysql Database, Array Fundamentals and How to Create Professional Ecommerce Project",8/2019,12/29/19
Get a Job As a Web Developer: A Step-by-Step Guide,www.udemy.com/course/get-a-job-career-as-a-frontend-web-developer-step-by-step-guide/,Kalob Taulien,199.99,11.39,4.7(175 ratings),Development,Web Development,Career Change,"1,287",English,"Tips, tricks and industry secrets to help you land that web development job! A step-by-step guide to getting hired.",8/2019,12/29/19
Modern Web Design & Development: Creating a PWA in Angular 8,www.udemy.com/course/2019-guide-to-creating-a-progressive-web-app-portfolio/,Jacinto Wong,19.99,11.39,4.7(35 ratings),Development,Web Development, ,"7,607",English,"Suitable for All Levels - Learn Design Principles, Angular CLI, Firebase, Photo Editing, and More!",11/2019,12/29/19
Complete HTML & CSS: Learn Web Development with HTML & CSS,www.udemy.com/course/html-css-web-development/,Peter - Web Development: HTML & CSS,199.99,11.99,4.0(174 ratings),IT & Software,Other,CSS,"10,173",English,Web Development: Master HTML & CSS and build amaizing websites. Learn HTML & CSS. Learn Web Development. HTML & CSS,3/2019,12/29/19
Learn JavaScript for Web Development,www.udemy.com/course/javascript-learn-javascript-essentials-and-build-project/,Irfan Dayan,74.99,11.99,"4.5(2,721 ratings)",Development,Web Development,JavaScript,"105,186",English,Advance your Web Development Skills By Learning Javascript from JavaScript Expert!,9/2019,12/29/19
Become a Professional Programmer,www.udemy.com/course/become-a-programmer/,Stone River eLearning,199.99,11.99,4.5(538 ratings),Development,Programming Languages,Web Development,"5,430",English,"Learn programming with HTML5, CSS3, Python, Swift, Google Go, Java, Perl, C++, Ruby on Rails and more.",8/2017,12/29/19
Become a Kick-Ass Web Developer: From Newbie to Pro,www.udemy.com/course/become-a-web-developer/,Simon Sez IT,199.99,11.99,4.6(72 ratings),Development,Web Development, ,"7,154",English,The 11 must have web programming courses to help you become the ultimate web developer. Includes 40+ hours of training.,7/2019,12/29/19
3D Programming with WebGL and Babylon.js for Beginners,www.udemy.com/course/webgl-tutorial/,Pablo Farias Navarro,199.99,11.99,4.3(125 ratings),Development,Web Development,WebGL,"1,034",English,Upgrade your skills and become future-ready by incorporating 3D technologies in your web development belt,8/2015,12/29/19
The Full Stack Web Development Bootcamp 2020,www.udemy.com/course/the-full-stack-web-development-bootcamp-2020/,Darragh O'Neill,199.99,11.99,4.4(122 ratings),Development,Web Development, ,"10,197",English,"Learn HTML, CSS, JavaScript, jQuery, PHP & mySQL to become a talented, confident full-stack web developer in 2020.",12/2019,12/29/19
"Top Web Development Bundle: Django, Ruby on Rails, Node",www.udemy.com/course/ultimate-web-development-bundle-django-ruby-on-rails-node/,John Elder,199.99,11.99,4.5(13 ratings),Development,Web Development,Django,"4,606",English,"Learn The Three Most Popular Web Development Frameworks! Django and Python, Ruby on Rails, and Node and Javascript!",11/2019,12/29/19
Restaurant Website with Online Ordering & App with WordPress,www.udemy.com/course/restaurant-website-with-online-ordering-reservation-and-app/,Shashank Phatkure,19.99,11.99,4.4(55 ratings),Development,E-Commerce,Web Development,"4,989",English,"Learn how to design business website like restaurant, cafe or bar with reservation, online ordering & app in WordPress",11/2019,12/29/19
"Coding for Entrepreneurs: Learn Python, Django, and More.",www.udemy.com/course/coding-for-entrepreneurs/,Justin Mitchel,194.99,11.99,"4.4(1,001 ratings)",Development,Web Development, ,"24,437",English,"A Programming Class for Non-Technical Founder(s). Learn Django- the #1 Python Frameworks, APIs, HTML, CSS, + Payments.",1/2016,12/29/19
Build Online Dating Website from scratch till deployment,www.udemy.com/course/build-online-dating-website-from-scratch-till-deployment/,Eldor Togaymurotov,199.99,11.99,4.2(14 ratings),Development,Web Development, ,175,English,"Complete Web Development by Node, Express and JavaScript",9/2019,12/29/19
The Complete E-Commerce Web Developer Course 5.0,www.udemy.com/course/e-commerce-web-developer-course/,Syed Raza,199.99,11.99,4.0(102 ratings),Development,Web Development,E-Commerce,"3,510",English,"Learn how to become a Web Developer from scratch using PHP, SQL, CSS, and HTML",9/2019,12/29/19
Customizing AppGini web applications,www.udemy.com/course/customizing-appgini-web-applications/,Ahmed Genedy,0.0,49.99,4.1(277 ratings),Development,Web Development, ,955,English,Extend what your AppGini web applications can do. Learn the fine details of tailoring the generated code efficiently.,8/2019,12/29/19
The Complete Web Developer Course | CMS Project,www.udemy.com/course/complete-webdev-course/,Tanzeel Ur Rehman,199.99,11.99,4.2(200 ratings),Development,Web Development, ,"7,689",English,"Become a Web developer | Master complete Web Development with HTML5, CSS3, JavaScript, jQuery, Bootstrap4, PHP & MySQL!",1/2019,12/29/19
Web Development Masterclass - Complete Certificate Course,www.udemy.com/course/web-development-masterclass-complete-certificate-course/,YouAccel Training,199.99,11.99,4.0(317 ratings),Development,Web Development, ,"5,086",English,Learn to setup virtual cloud servers and develop database-driven websites using the latest web technologies.,6/2019,12/29/19
IPFS and Decentralised Networking,www.udemy.com/course/ipfs-networking/,Vinay Phadnis,159.99,11.99,4.0(41 ratings),Development,Development Tools,Web Development,325,English,Understand basics of IPFS - InterPlanetary File System. Build a website on IPFS and create decentralised DropBox clone,7/2019,12/29/19
Flutter Web Development Course Build Complete FlutterWeb App,www.udemy.com/course/flutter-web-development-course-build-complete-flutterweb-app/,Code With YDC,199.99,11.99,3.6(75 ratings),Development,Web Development,Dart Programming Language,"19,050",English,"Flutter Web development Course Will Teach You-How To Build Complete Web App Using Flutter,Flutter Web App,Flutter UI",9/2019,12/29/19
How to Build Your Own Website,www.udemy.com/course/how-to-build-your-own-website/,Bryan Guerra,199.99,11.39,4.6(189 ratings),Development,Web Development, ,"28,225",English,A step-by-step course on how you can build your very own professional and optimized website,9/2019,12/29/19
Complete Web Development: 22 Courses in 1,www.udemy.com/course/the-complete-web-development-course/,Creative Online School,194.99,11.39,4.4(457 ratings),Development,"Web Development
 ", ,"29,379",English,"Learn PHP, Apache, MySQL, MongoDB, Python, JavaScript, XML, JSON, HTML, CSS, Wordpress and more. With practical examples",10/2018,12/29/19
Become a Web Developer from Scratch,www.udemy.com/course/how-to-become-a-web-developer-from-scratch/,Victor Bastos,49.99,11.39,"4.0(2,986 ratings)",Development,Web Development, ,"70,744",English,This course covers all you need to know about becoming a top skilled web developer even if you never programmed before!,11/2016,12/29/19
Webpack 4 - First Steps,www.udemy.com/course/webpack-4-first-steps/,Mehul Mohan,199.99,11.39,4.5(16 ratings),Development,Web Development,Webpack,111,English,Use Webpack to bundle and automate a lot of regular JavaScript workflow task and become a powerful JS developer!,4/2019,12/29/19
Ionic 4 & Angular — Complete Guide to Modern Web Development,www.udemy.com/course/ionic-angular-complete/,Jai Preston,199.99,11.39,1.8(3 ratings),Development,Web Development,Ionic,24,English,"A no-nonsense, PRACTICAL approach to real-world project-building with with Ionic and Angular.",12/2019,12/29/19
Travel Developer Course - Work Remotely as a Digital Nomad,www.udemy.com/course/the-complete-travel-developer-course-become-a-digital-nomad/,PJ Manning,19.99,11.99,4.6(55 ratings),Development,Web Development, ,277,English,Learn how to design and build websites while working around the world,1/2019,12/29/19
The Most Comprehensive Web Development Course,www.udemy.com/course/comprehensive-web-developer-course/,Supriyo Kundu,199.99,11.39,4.4(155 ratings),Development,Web Development, ,"1,399",English,"Learn HTML, CSS, Javascript, Jquery, Bootstrap, Ajax, PHP, Worpress step by step with many cool Projects Included",11/2017,12/29/19
The Complete Web Developer Bootcamp - Beginner to Expert,www.udemy.com/course/job-ready-web-developer/,Robeen Dey,189.99,11.39,"4.1(1,896 ratings)",Development,Web Development, ,"15,282",English,"Complete web development training. Get hired by building real apps with HTML, CSS, JS, Rails in this immersive course.",7/2015,12/29/19
"Responsive Web & Mobile Development in HTML,CSS & Javascript",www.udemy.com/course/complete-web-development-with-html-css-and-javascript/,QAEversity .,19.99,11.39,"3.7(1,166 ratings)",Development,Web Development, ,"18,202",English,"Create interactive and responsive web/hybrid mobile apps for android and ios using HTML, CSS and Javascript",11/2018,12/29/19
Build Your Web Developer Portfolio and Brand To Get Hired,www.udemy.com/course/build-your-web-developer-portfolio-and-brand-to-get-hired/,Joe Santos Garcia,199.99,11.39,4.6(32 ratings),Development,Web Development, ,218,English,Get a level above all other developers applying for same job,9/2018,12/29/19
"Full stack Universal React with Redux, Node js and MongoDB",www.udemy.com/course/full-stack-universal-react-with-redux-express-and-mongodb/,Marco Tomasello,0.0,194.99,3.8(724 ratings),Development,Web Development, ,"3,501",English,"Learn full stack Javascript: Client and Universal React with Redux, Node js, Express, MongoDB and build a Shopping-cart",7/2018,12/29/19
JavaScript Programming from A-Z: Learn to Code in JavaScript,www.udemy.com/course/complete-javascript/,Euan - JavaScript Programming,199.99,11.39,4.2(297 ratings),Design,Web Design,Java,"16,417",English,JavaScript: Learn to write clear & efficient code in JavaScript. Learn JavaScript. Complete JavaScript Guide. JavaScript,3/2019,12/29/19
Spring Live - Hands on web application development,www.udemy.com/course/spring-live-tutorial/,Daniel Ellebæk,19.99,11.39,4.9(6 ratings),Development,Web Development,Front End Web Development,33,English,Develop Spring web applications explained in a down-to-earth-way,12/2018,12/29/19
Web Development-A Practical HTML CSS and JS Beginner Course,www.udemy.com/course/web-development-a-practical-html-css-and-js-beginner-course/,Norbert B. Menyhart,199.99,11.39,4.8(5 ratings),Development,Web Development, ,21,English,"HTML5, CSS3 SASS and JavaScript Modern Responsive websites using CSS Flexbox & CSS Grid, Manipulate the DOM & send JSON",12/2019,12/29/19
Introduction to Programming for Beginners,www.udemy.com/course/introduction-to-programming-for-beginners/,Bluelime Learning Solutions,124.99,11.39,3.8(84 ratings),Development,Programming Languages,Web Development,"1,956",English,Practical Hands-On beginners Programming step by step.,3/2018,12/29/19
Create a Successful Multivendor Website Like Amazon,www.udemy.com/course/create-a-buy-and-sell-website-like-amazon-with-joomla/,Mathew Tamin,94.99,11.39,4.2(89 ratings),Development,Web Development,Joomla,421,English,"Now you too, can create and launch your own marketplace for anyone to buy or sell their products with Joomla. No coding!",1/2017,12/29/19
Crush Your 2019 New Year's Resolution and Learn to Code,www.udemy.com/course/2019webdevelopment/,Mammoth Interactive,199.99,11.99,4.6(6 ratings),Development,Web Development, ,316,English,The best way to learn Python. Learn all about creating apps with code in more detail than any YouTube tutorial.,3/2019,12/29/19
"The Web Development Course: HTML5, CSS3, JavaScript",www.udemy.com/course/the-web-development-course-html5-css3-javascript/,Aatef Jaberi,149.99,11.39,4.1(43 ratings),Development,Web Development, ,355,English,"Learn web development course by building website and program by using HTML5, CSS3 and JavaScript. Include huge project",8/2018,12/29/19
Technical SEO: 2-Second Website Load Speed In 1 Day,www.udemy.com/course/improve-page-load-speed/,Alex Genadinik,39.99,11.39,3.9(32 ratings),Development,Web Development,Conversion Rate Optimization,206,English,"Faster website with Technical SEO, UX design & web development using GTMetrix, Google Lighthouse, PageSpeed Insights",12/2019,12/29/19
2019 Calendar App: Let's Build It!,www.udemy.com/course/2019-calendar-app-lets-build-it/,Jesse Caine,19.99,11.39,4.4(34 ratings),Development,Web Development, ,"4,806",English,"Build a real world web application using HTML, CSS, Javascript, PHP and MySQL.",1/2019,12/29/19
Login and Registration with Email Verification using PHP OOP,www.udemy.com/course/login-and-registration-with-email-verification-using-php-oop/,Faraz Abbas,189.99,11.39,4.3(10 ratings),Development,Web Development,PHP,68,English,"Create Secure Login & Registration System with Email verification, login through FB & Google, etc using PHP & MySQLi OOP",4/2017,12/29/19
Internet and Web Development Fundamentals,www.udemy.com/course/internet-and-web-development-fundamentals/,YouAccel Training,99.99,11.39,4.1(35 ratings),Development,Web Development, ,"8,778",English,Learn how the Internet Works and Setup a Testing & Production Web Server,4/2019,12/29/19
"The Complete 5 Volume Series: If You Can Cook, You Can Code",www.udemy.com/course/the-complete-series-if-you-can-cook-you-can-code/,Timothy Kenny,199.99,11.39,3.6(51 ratings),Development,Software Engineering,Web Development,609,English,"5-in-1 Course Bundle, 14 hrs: Use the Metaphor of Cooking to Learning Programming 101, Computers, AI, Big Data and More",1/2017,12/29/19
Laravel + Vue: Create an advanced forum,www.udemy.com/course/laravel-vue-create-an-advanced-forum/,Mikołaj Marciniak,114.99,11.39,3.0(3 ratings),Development,Web Development, ,31,English,Create a forum of your dreams...,3/2019,12/29/19
ASP.NET C# - Enterprise Web Systems From Novice to Expert,www.udemy.com/course/aspnet-c-enterprise-web-systems-from-novice-to-expert/,Mohammed Wuhaidi,19.99,11.39,3.5(72 ratings),Development,Web Development,ASP.NET,879,English,Web Programming Course for Building a Real Enterprise Web Systems and Websites from Point Zero Using ASP.NET C#.,4/2017,12/29/19
Become a Professional Web Developer | Version 3.0,www.udemy.com/course/web-development-tutorials/,Stone River eLearning,199.99,11.39,4.2(399 ratings),Development,Web Development, ,"7,334",English,"Everything you need to know to become a professional web developer from scratch, updated for modern development.",2/2017,12/29/19
"WhatsApp Chat App with PHP, MySQL, Javascript, Bootstrap 4",www.udemy.com/course/whatsapp-chat-app-with-php-mysql-javascript-bootstrap-4/,Muhammad Ali Zeb,99.99,11.39,0.0(0 ratings),Development,Web Development, ,18,English,PHP Chat Application Projects in PHP and MySQL - Facebook Messenger Chat App - Dynamic Website WhatsApp Clone Project,11/2019,12/29/19
Learning Path: Modern Web Development with JavaScript,www.udemy.com/course/learning-path-modern-web-development-with-javascript/,Packt Publishing,199.99,11.39,4.8(2 ratings),Development,Web Development, ,46,English,"Discover object-oriented development, build engaging and reactive user interfaces, and create highly scalable, developer",8/2018,12/29/19
Web Development with Asp.Net Using C# MS SQL Database Basic,www.udemy.com/course/learn-web-development-create-dynamic-website-complete-guide/,Sachin Srivastava,19.99,11.39,2.9(7 ratings),Development,Web Development, ,38,English,"Asp.Net Using C#, Learn SQL Server, Make Yourself Web Developer, beginners to advance Tutorial, make own Dynamic website",9/2018,12/29/19
