Course,URL,instructor,Price (full),Price (discount),Rank,Category 1,Category 2,Category 3,Enrollment,Language,Description,Last Update,Date Scraped
Optimising your website: A development workflow continued,www.udemy.com/course/optimising-your-website-a-development-workflow-continued/,Rik Lewis,49.99,11.39,0.0(0 ratings),Development,Web Development, ,2,English,Learn a development workflow that uses Gulp and Git in order to optimise your website,6/2019,12/29/19
Codeigniter 3 - Superb CRUD Generator And Multiple Roles,www.udemy.com/course/codeigniter-3-superb-crud-generator-and-multiple-roles/,Kukuh Setiawan,39.99,11.39,0.0(0 ratings),Development,Web Development,CodeIgniter,0,English,so powerful machine to produce a lot of projects in a short time,10/2019,12/29/19
Build A Restaurant Website,www.udemy.com/course/build-a-restaurant-website-with-online-booking-using-wordpress/,Rich Peterson,24.99,11.39,3.7(7 ratings),Business,Entrepreneurship,Web Development,"1,284",English,"Using Wordpress, you'll have your own simple, beautiful restaurant website (with menus) up and running in an afternoon.",12/2016,12/29/19
A Web Development Crash Course in HTML5 and CSS3,www.udemy.com/course/crash-course-html-and-css/,Derek Glenna,24.99,11.39,4.5(104 ratings),Development,Web Development, ,"1,568",English,Learn HTML5 and CSS3 so that you can build your own website! No programming experience required.,11/2017,12/29/19
Build A Social Network Using Ning,www.udemy.com/course/build-your-own-hosted-social-network-platform/,Rich Peterson,24.99,11.39,3.7(13 ratings),Business,Entrepreneurship,Web Development,"1,530",English,"Looking for a quick way to build your own social networking site like Facebook, Twitter or Pinterest? Try this course!",12/2016,12/29/19
Create a website for Youtube channel and learn about wix,www.udemy.com/course/build-amazing-website-for-youtube-videos-without-coding/,Een jeen,19.99,11.39,4.0(17 ratings),Marketing,Content Marketing,Web Development,"1,844",English,"Increase your youtube audience, channel branding by building a website.Earn more from Youtube videos and learn about wix",3/2018,12/29/19
1 Hour with HTML,www.udemy.com/course/1-hour-with-html/,Jitro Bittikaka,49.99,11.99,4.2(35 ratings),IT & Software,IT Certification,Web Development,"1,692",English,Learning basic web programming HTML step-by-step in 1 hour,6/2019,12/29/19
Web Development with Angular 2 and Bootstrap,www.udemy.com/course/web-development-with-angular-2-and-bootstrap/,Packt Publishing,124.99,11.39,3.1(9 ratings),Development,Web Development, ,35,English,Become an ace at creating stunning Angular2 applications using Bootstrap,11/2017,12/29/19
Learn Programming and Web Development fast from zero in 2019,www.udemy.com/course/learn-programming-and-web-development-fast-from-zero-in-2019/,Lipiam Co,24.99,11.39,0.0(0 ratings),Development,Web Development, ,2,English,Build web applications with Django,7/2019,12/29/19
How to Build Your Own Profitable Website Step by Step,www.udemy.com/course/how-to-build-your-own-profitable-website-step-by-step/,Shayan Rahimi,0.0,199.99,3.9(6 ratings),Business,Home Business,Web Development,49,English,The complete step-by-step guide to setting up your very own profit-making website.,2/2016,12/29/19
Complete Web Developer Course to Build Premium Web Templates,www.udemy.com/course/complete-web-developer-course-to-build-premium-web-templates/,Niamul Hasan,19.99,11.39,3.8(48 ratings),Development,Web Development, ,377,English,You will able to develop your own responsive website or premium web templates which you can able to sell on ThemeForest,11/2015,12/29/19
Build modern responsive websites with HTML5 and CSS3,www.udemy.com/course/create-modern-websites/,Bihan Mahadewa,179.99,11.39,4.4(77 ratings),Development,Web Development, ,"12,957",English,Create a responsive website as quickly as possible with the latest technologies. Enroll with this course now.,1/2019,12/29/19
The Extreme Web Development Course - For Beginners,www.udemy.com/course/the-extreme-web-development-course/,Paul Carlo Tordecilla,194.99,11.39,4.3(87 ratings),Development,Web Development, ,"1,528",English,"Learn Web development easily and automatically.HTML5, CSS3, Javascript, JQuery,Ajax,Bootstrap 4 ,PHP ,MYSQL and MORE...",10/2017,12/29/19
Learning Path: Visual Studio: Simplify App & Web Development,www.udemy.com/course/learning-pathvisual-studiosimplify-app-and-web-development/,Packt Publishing,199.99,11.39,3.5(3 ratings),Development,Programming Languages,Visual Studio,50,English,"Make application development easier, faster, and more productive using the new features of Visual Studio 2015",4/2017,12/29/19
HTML & CSS: The Web Developers Bible,www.udemy.com/course/html-css-the-web-developers-bible/,Geek Mode,24.99,11.39,0.0(0 ratings),IT & Software,Other,CSS,0,English,A beginners guide,11/2019,12/29/19
"Add Videos as Your Website Background, Strategies & Coding",www.udemy.com/course/add-videos-as-website-background/,Binary Business Learn More +,19.99,11.39,0.0(0 ratings),Development,Web Development, ,36,English,Learn all the Strategies and Techniques of Choosing and Setting a Background Video that suits Best with your Website.,8/2015,12/29/19
Python 3  - Ultimate Beginners Course,www.udemy.com/course/python-3-ultimate-beginners-course/,Dilip Krishna,19.99,11.39,0.0(0 ratings),Development,Programming Languages,Web Development,0,English,This course aims at beginners who want to learn python practically,12/2019,12/29/19
Complete Web Development with Wordpress For Beginners,www.udemy.com/course/complete-web-development-with-wordpress-for-beginners/,Lawt Aung,99.99,11.39,3.4(3 ratings),Development,Web Development, ,"1,012",English,"Learn how to build website from scratch, track traffic with google analytics, and improve SEO to increase web traffic",3/2019,12/29/19
Build Your Own Web Site,www.udemy.com/course/buildyourownwebsite/,Marco  Bruno,29.99,11.39,5.0(4 ratings),Development,Web Development, ,310,English,"A simple way to create your Web Site Step-By-Step including everything you need at no extra cost, all inclusive.",1/2017,12/29/19
Learning React 16.8+ and React Ecosystem by Full Examples,www.udemy.com/course/learning-react-and-react-ecosystem-by-full-examples/,Mahmoud El Kotoury,19.99,11.39,0.0(0 ratings),Development,Web Development,Front End Web Development,2,English,Learn all important topics of React and React ecosystem by practical examples,4/2019,12/29/19
PHP in Web Development in 2020,www.udemy.com/course/php-in-web-development-in-2020/,akshay Mayekar,19.99,11.39,3.5(26 ratings),Development,Web Development,Front End Web Development,"4,502",English,Learn php in Web Development,7/2019,12/29/19
Learn comprehensive web development,www.udemy.com/course/learn-to-use-html5-css3-bootstrap-jquery-and-mysql-crud/,Santosh Jadagoudar,49.99,11.39,3.5(4 ratings),Development,Web Development, ,"1,756",English,The only complete web development course. Run an eCommerce business.,5/2015,12/29/19
Build Your Own Perfect WordPress Website,www.udemy.com/course/build-your-own-perfect-wordpress-website/,Vishuddha Website,49.99,11.39,0.0(0 ratings),Development,Web Development,WordPress,2,English,The Most Complete DIY WordPress Website Builder Course Around,6/2019,12/29/19
Build A One Page Business Or Portfolio Website,www.udemy.com/course/build-a-one-page-business-or-portfolio-website-free-theme-wordpress/,Rich Peterson,24.99,11.39,4.1(10 ratings),Business,Entrepreneurship,Web Development,"1,390",English,"Using Wordpress, you'll have your own single page, simple business or portfolio website up and running in an afternoon.",12/2016,12/29/19
Build professional sites without coding 10 plus projects,www.udemy.com/course/build-professional-sites-without-coding/,MUHAMMAD AMAAN,19.99,11.39,3.2(2 ratings),Design,Web Design,Web Development,526,English,"Learn how to create video,social network,blog and other sites without coding",9/2016,12/29/19
CIW WEB JAVA DEVELOPER  (JCERT) practice exams,www.udemy.com/course/ciw-web-java-developer-jcert-practice-exams/,Derrick Brew,29.99,11.39,0.0(0 ratings),IT & Software,IT Certification,Web Development,9,English,Pass the CIW 1D0-532 certification on the first attempt. 120 questions,3/2019,12/29/19
Coding Faster - Web Development Productivity Masterclass,www.udemy.com/course/coding-faster-web-development-productivity-masterclass/,Iulian Bubolea,124.99,11.39,3.4(7 ratings),Development,Web Development,Personal Productivity,"1,014",English,Achieve more in less time !,10/2017,12/29/19
Learn the basics of the Web development: Coding Tactics,www.udemy.com/course/learn-the-basics-of-the-web-development-in-2-hours/,Iulian Bubolea,124.99,11.39,4.2(34 ratings),Development,Web Development, ,"3,778",English,"Build powerful professional Websites, starting from Zero",4/2017,12/29/19
Complete HTML CSS Guide : Design and Code Responsive Website,www.udemy.com/course/learn-how-to-design-and-code-responsive-website-from-scratch/,Reinis Bērziņš,19.99,11.39,4.1(87 ratings),Development,Web Development, ,"4,271",English,"Learn how to design and then develop fully functional, real world website with various features and effects.
 ",3/2017,12/29/19
How to create a website by your own?,www.udemy.com/course/how-to-create-a-website-by-your-own/,Rony Man,19.99,11.39,0.0(0 ratings),Development,Web Development, ,1,English,By elementor on WordPress,5/2019,12/29/19
FullPage: The Complete Guide to Flat Websites,www.udemy.com/course/easy-flat-design/,Awesome Apps,19.99,11.39,2.8(14 ratings),"Design
 ",Graphic Design,Web Development,818,English,An Easy and Quick Way to Create Flat Modern Websites From Scratch With FullPage,11/2013,12/29/19
How to build a Parallax Website without Coding,www.udemy.com/course/how-to-build-a-parallax-website/,Freedom Portis,24.99,11.39,2.8(4 ratings),Design, Web Design,Web Development,45,English,Step by steps manual on the parallax design,1/2014,12/29/19
Web Development practical examples,www.udemy.com/course/web-development-practical-examples-worth-500/,Asem Hamid,99.99,11.39,4.0(3 ratings),Development,Web Development, ,"1,216",English,Learn practical web development projects,4/2015,12/29/19
7 Tweaks To Keep Your Website Looking Great!,www.udemy.com/course/7-hacks-to-create-a-perfect-website/,Boomy Tokan,34.99,18.99,3.8(23 ratings),Marketing,Marketing Fundamentals,Web Development,"3,302",English,Make Your Website Stand Out,9/2017,12/29/19
The One Stop Shop for Web Development,www.udemy.com/course/intro-to-the-hackable-workspace-and-web-development-b/,Rishov Chatterjee,149.99,11.39,4.1(13 ratings),Development,Web Development, ,52,English,True Web Development for Beginners,3/2018,12/29/19
Make a basic minimalist website,www.udemy.com/course/make-a-basic-minimalist-website/,John Bura,69.99,11.39,3.6(2 ratings),Development,Web Development, ,"1,140",English,Learn to make a website in 1 hour. Spend an inspiring and productive hour building a website.,6/2015,12/29/19
Guide to Becoming a Digital Nomad in 2018,www.udemy.com/course/ultimate-guide-to-making-a-website-in-under-1-hour/,Jordan G,19.99,11.39,0.0(0 ratings),Development,Web Development, ,1,English,Learn How the Pros Build a WordPress Website in Easy to Understand Lessons,12/2018,12/29/19
Pareto for Developers - How To be an Excellent Programmer,www.udemy.com/course/pareto-for-developers-the-missing-link-to-excelence/,Nicolas Rossello,39.99,11.39,4.5(5 ratings),Development,Programming Languages,Web Development,29,English,10 Lessons that nobody is teaching about the skills needed to become an excellent developer( and very well paid too),3/2015,12/29/19
How to Build your First Website-Understand the English terms,www.udemy.com/course/how-to-build-your-first-website-understand-the-english-terms/,Graeme McLeish,19.99,11.39,0.0(0 ratings),Development,Web Development, ,0,English,Use the Internet to sell to more customers.,10/2017,12/29/19
Build Your Website In 7 Days Without Coding,www.udemy.com/course/build-your-own-website-without-coding/,Amber Renae,0.0,19.99,0.0(0 ratings),Design,Web Design,Web Development,0,English,"Quickly create a functional website that showcases your talents, without breaking the bank or getting stuck in tech-wars",1/2016,12/29/19
Building websites without coding skills using Webydo,www.udemy.com/course/building-websites-without-coding-skills-using-webydo/,QScutter Tutorials,19.99,11.39,4.7(3 ratings),Development,Web Development, ,23,English,Create and Manage code free business websites,3/2014,12/29/19
Learn to make a colorful one page website,www.udemy.com/course/learn-to-make-a-colorful-one-page-website/,John Bura,199.99,11.39,4.2(40 ratings),Development,Web Development, ,"1,412",English,Learn to make a website in 1 hour. Spend an inspiring and productive hour building a website.,6/2015,12/29/19
"Design from Scratch, Code and Launch!",www.udemy.com/course/design-from-scratch-code-and-launch/,J Skills,99.99,11.39,0.0(0 ratings),Development,Web Development,Web Design,2,English,"A Course to Learn Design and Development, WordPress, Angular 2 & more!",8/2017,12/29/19
The All-In-One Web Development Course,www.udemy.com/course/the-all-in-one-web-development-course/,Nauman Sajid,84.99,11.39,4.4(21 ratings),Development,Web Development, ,572,English,"Everything you need to know, all in one place",5/2017,12/29/19
Speedy Reboot Web Bootcamp,www.udemy.com/course/reboot-web-bootcamp/,Helder Goncalves,19.99,11.39,0.0(0 ratings),IT & Software,Other,Web Development,1,English,A course where you will dip your feet into the basics as well as more advanced subjects of Web Development,11/2018,12/29/19
Understanding the Web Development Process ,www.udemy.com/course/understanding-the-web-development-process/,Freedom Portis,19.99,11.39,2.4(4 ratings),Development,Web Development, ,884,English,What you need to know before contacting a developer to build a website,8/2014,12/29/19
"Web Development: HTML, CSS, & JavaScript for Coding Sites",www.udemy.com/course/web-development-html-css-and-javascript-for-coding-sites/,Asem Hamid,99.99,11.39,4.0(12 ratings),Development,Web Development,CSS,866,English,"This course is practical, you will learn to generate code on the spot, and work along with the videos",3/2015,12/29/19
Learn to make a simple website from scratch,www.udemy.com/course/learn-to-make-a-simple-website-from-scratch/,John Bura,49.99,11.39,4.0(5 ratings),Development,Web Development, ,"1,132",English,Learn to make a website in 1 hour. Spend an inspiring and productive hour building a website.,6/2015,12/29/19
Bootstrap 4 for Beginners,www.udemy.com/course/bootstrap-4-for-beginners/,Muhammad Ismail,49.99,12.50,5.0(1 rating),Development,Web Development,Bootstrap,1,English,Bootstrap 4 for Beginners to intermediate,6/2019,12/29/19
A Self-Taught Developer Guide : HTML and CSS Tips,www.udemy.com/course/a-self-taught-developer-guide-html-and-css-tips/,Web Dev Compass,49.99,11.39,4.0(1 rating),Development,Web Development, ,1,English,Learn Front-End Development by learning HTML5 AND CSS3 at a minimal cost and enjoy the instructor support.,11/2019,12/29/19
Practical Web Development: Make Websites Quickly And Easily,www.udemy.com/course/make-beautiful-websites-in-a-few-hours/,Wilson Wang,19.99,11.39,3.6(7 ratings),Development,Web Development, ,"2,394",English,"A comprehensive guide to website creation, including server setup, domain name, templates, and more.",11/2015,12/29/19
Learn Basics of Web Development - HTML and CSS,www.udemy.com/course/learn-basics-of-web-development-html-and-css/,Aadesh Shah,0.0,19.99,3.7(5 ratings),Development,Web Development, ,"2,002",English,Learn from the industry expert. Basics of HTML and CSS right from root ground level with best coding ethics,11/2018,12/29/19
Learn Web Development Using VueJS,www.udemy.com/course/learn-web-development-using-vuejs/,Eduonix Learning Solutions,39.99,11.39,3.9(29 ratings),Development,Web Development,Vue JS,177,English,Learn to build new age UIs using the progressive JavaScript Framework - VueJS,12/2018,12/29/19
Play Video and Audio files over the Web,www.udemy.com/course/play-video-and-audio-files-over-the-web/,Phil Cowcill,19.99,11.39,5.0(1 rating),Development,Web Development, ,9,English,Simple ways of playing media over the web,6/2015,12/29/19
Web development crash course,www.udemy.com/course/web-development-crash-course-u/,DANISH SHAIKH,19.99,11.39,0.0(0 ratings),Development,Web Development, ,4,English,Fast and easy way to learn web development,2/2018,12/29/19
Certified CIW Web Developer Specialist Practice Tests 2019,www.udemy.com/course/certified-ciw-web-developer-specialist-practice-tests-2018/,Inspiring Generations Academy,0.0,34.99,4.2(2 ratings),Development,Web Development, ,"1,577",English,Final Prep For The CIW Web Developer | Test Your Knowledge | Pass The First Time,11/2019,12/29/19
Become Front End Web Developer GURU,www.udemy.com/course/frontendwebguru/,Devansh Varshney,99.99,11.39,3.5(4 ratings),Development,Web Development, ,303,English,Learn Web Development Essentials and Become a Web Developer GURU from Scratch,6/2018,12/29/19
Build and Grow A Website Effectively From Nothing,www.udemy.com/course/build-and-grow-a-website-effectively-from-nothing/,John Waller,19.99,11.39,5.0(1 rating),Design,Web Design,Web Development,908,English,Road map to build a website,7/2015,12/29/19
What to learn to become a web developer?!,www.udemy.com/course/what-to-learn-to-become-a-web-developer/,Sofia Kostiunina,19.99,11.39,4.2(19 ratings),Development,Web Development, ,"2,096",English,Find an answer to your question: live blog!,8/2019,12/29/19
Setup AMPPS localhost for web development,www.udemy.com/course/localhost-setup/,Laurence Svekis,199.99,11.39,4.4(33 ratings),Development,Development Tools,Web Development,"4,352",English,"Learn how to setup and run an AMPPS local server. Develop, trouble shoot and test PHP and database applications locally",11/2019,12/29/19
Web Development For Beginners: Get A Website Live in Hours,www.udemy.com/course/howtocreatewebsitesusingblogger/,Andrew Pyle,74.99,11.39,4.0(74 ratings),Marketing,Content Marketing,Web Development,"6,673",English,Web Development can be expensive. Learn how to unleash the power of Blogger to build your own websites in a few hours.,10/2012,12/29/19
The Definitive Guide For Website Owners ,www.udemy.com/course/the-definitive-guide-for-website-owners/,Spyros Papaspyropoulos,29.99,11.39,3.6(4 ratings),IT & Software,Other,Web Development,98,English,Learn how to understand your Web Designer and how to make the right choices for your website.,3/2014,12/29/19
Modern Web Development By Example,www.udemy.com/course/modern-web-development-by-example/,Packt Publishing,124.99,11.39,0.0(0 ratings),IT & Software,Other,Web Development,9,English,"A hands on, example-driven crash course in HTML, CSS, JavaScript, jQuery, Node.js Bootstrapâand more. Suitable for begin",7/2018,12/29/19
"Earn Big Profits With Web Development, Simple and Easy!",www.udemy.com/course/earn-big-profits-by-building-simple-and-easy-websites/,James Bos,89.99,11.39,4.2(27 ratings),Development,Web Development, ,"3,072",English,Beginners Introduction to Web Development and Building Landing Pages,2/2017,12/29/19
Web development for Absolute Beginners,www.udemy.com/course/web-development-for-absolute-beginners/,Eduonix Learning Solutions,44.99,11.39,0.0(0 ratings),Development,Web Development, ,9,English,"Learn HTML, CSS, JavaScript, Bootstrap, PHP and MySQL from ground up",12/2018,12/29/19
Inspirational Web Development - A Beginner Approach -,www.udemy.com/course/inspirational-web-development-level-0/,Mohammed AbuIriban,19.99,11.39,4.2(49 ratings),Development,Web Development, ,"5,326",English,Your first step in creating cutting edge websites.,1/2016,12/29/19
Web Development Fundamentals - Practice Test,www.udemy.com/course/web-development-fundamentals-practice-test/,Aravind Selvam,19.99,11.39,0.0(0 ratings),Development,Web Development, ,1,English,"Helps Build quick, modern web applications and responsive websites to ensure your organization is top at the Rank Chart",4/2018,12/29/19
How To Create a Professional Photography Website (NO CODING),www.udemy.com/course/how-to-create-a-10000-dollars-photography-website-for-less-than-100/,Iftah Abdelghafour,49.99,11.39,3.8(5 ratings),Design,Web Design,Photography,"1,455",English,"Learn how to create a $10,000 Professional Website for your Photography Business For Less Than $100.",2/2016,12/29/19
I Don't Fear Code (or Zombies),www.udemy.com/course/i-dont-fear-code-or-zombies/,John Rhea,59.99,11.39,0.0(0 ratings),Development,Web Development, ,0,English,"More HTML and CSS for Writers, Editors, and Beginners",7/2019,12/29/19
Design Your  Website WWW,www.udemy.com/course/web-development-course-learn-in-just-1-day-by-pooja-thakar/,Pooja Thakar,199.99,11.39,3.9(56 ratings),Development,Web Development, ,"5,213",English,"Web Design Your Complete Guide to Web Design Website is your Virtual Office, Right Solution to your Lead Problems",5/2017,12/29/19
Web Development Using Django 2X and Bootstrap ||Hindi||Urdu|,www.udemy.com/course/web-development-beginners-in-hindi-or-urdu/,Ahmad Mohsin,0.0,Free,4.4(64 ratings),IT & Software,IT Certification,Web Development,"4,994",English,"A practical Web Development course for Beginners, using Django 2X Frame Work and Bootstrap to Make you up and Running",6/2019,12/29/19
Web Developer Course on Creating a Business Website,www.udemy.com/course/web-developer-course-on-creating-a-business-website/,Laurence Svekis,0.0,Free,4.3(254 ratings),Business,Entrepreneurship,Web Development,"26,976",English,Guide to setting up a website learn about setting up a web business HTML CSS and JavaScript create your own website,11/2019,12/29/19
Free Website Builder /  Application Builder,www.udemy.com/course/build-website/,Manish Gupta,0.0,Free,3.6(225 ratings),Development,Web Development, ,"13,718",English,"Create Website , Mobile App , Shopping cart and Web development without coding",5/2018,12/29/19
Getting Started as a Web Developer,www.udemy.com/course/refactoru-getting-started-as-a-web-developer/,RefactorU LLC,0.0,Free,4.3(797 ratings),Development,Web Development, ,"32,239",English,"We introduce you to your development environment including Sublime Text, Command Line, and Git for version control.",11/2015,12/29/19
The Complete Responsive Web Design Course,www.udemy.com/course/the-complete-responsive-web-design-course/,Pablo Farias Navarro,0.0,Free,4.0(113 ratings),Development,Web Development, ,"5,829",English,Enhances your skills in responsive web design and create professional websites,4/2018,12/29/19
Learn Web Development by Creating a Social Network,www.udemy.com/course/meteor-tutorial/,Pablo Farias Navarro,0.0,Free,4.4(218 ratings),Development,Web Development,Meteor Framework,"11,599",English,"Learn to code from scratch by building your own Social Network with HTML, CSS, JavaScript and Meteor",6/2016,12/29/19
Build A WordPress Website from Home,www.udemy.com/course/step-by-step-guide-for-building-a-website/,Mitch Stevens,0.0,Free,4.2(72 ratings),Development,Web Development, ,"8,710",English,Learn how to start your own niche content site with no coding skills required.,5/2015,12/29/19
Build A WordPress Website from Home,www.udemy.com/course/step-by-step-guide-for-building-a-website/,Mitch Stevens,0.0,Free,4.2(72 ratings),Development,Web Development, ,"8,710",English,Learn how to start your own niche content site with no coding skills required.,5/2015,12/29/19
Fun & Easy Introduction to Web Development,www.udemy.com/course/fun-easy-web-development-for-beginners/,David Ames,0.0,Free,4.0(215 ratings),Development,Web Development, ,"6,832",English,"Learn the Basics of HTML, CSS & JavaScript",4/2018,12/29/19
"Build a Quiz App with HTML, CSS, and JavaScript",www.udemy.com/course/build-a-quiz-app-with-html-css-and-javascript/,James Quick,0.0,Free,4.5(490 ratings),Development,Web Development,CSS,"15,402",English,"Improve your core development skills by building a Quiz App with HTML, CSS, and JavaScript",3/2019,12/29/19
Publish Websites with WebHostingSquared,www.udemy.com/course/webhosting-101/,Jeremiah F,0.0,Free,4.5(6 ratings),Development,Web Development, ,"2,662",English,How to put your website on the internet with a .com web address!,5/2019,12/29/19
How To Make A Web Page With No Code,www.udemy.com/course/how-to-make-a-web-page-with-no-code/,David Bentley,0.0,Free,4.3(175 ratings),Development,Web Development, ,"11,295",English,Step-by-step detailed how-to instructions. Making a website for free has never been so simple!,3/2017,12/29/19
Omnis Academy,www.udemy.com/course/omnis-academy-en/,Andreas Pfeiffer,0.0,Free,4.2(16 ratings),Development,Web Development, ,"1,799",English,Development of a web- and mobile app,6/2018,12/29/19
Learn HTML5 and CSS3 By Coding Your First Website,www.udemy.com/course/learn-html5-and-css3-by-coding-your-first-website/,Zaowl Dev,0.0,Free,4.0(134 ratings),Development,Web Development,HTML,"6,455",English,Learn and build your own website with HTML5 and CSS3,10/2018,12/29/19
Save time learn How to Setup a localhost machine in minutes,www.udemy.com/course/learn-how-to-setup-a-localhost-machine/,Laurence Svekis,0.0,Free,4.6(85 ratings),Development,Programming Languages,Web Development,"14,835",English,"Quick guide for setting up a localhost machine, run PHP to Wordpress all on your computer without the need of a server",8/2015,12/29/19
Learn HTML & CSS From Scratch! The Beginners Guide,www.udemy.com/course/learn-html-css-from-scratch-the-beginners-guide/,Aaron Craig,0.0,Free,4.6(106 ratings),Design,Web Design,CSS,"4,963",English,Ever wanted to make websites but didn't know how to start? Then this course was made for you!,2/2019,12/29/19
Create Your Own Website In 2 Hours,www.udemy.com/course/create-your-own-website-in-2-hours/,Wesley Atkins,0.0,Free,4.6(288 ratings),Design,Web Design,Web Development,"20,475",English,An easy to follow step-by-step course on building a quality website in record time -- WITHOUT technical skills â¦,12/2013,12/29/19
