Course,URL,instructor,Price (full),Price (discount),Rank,Category 1,Category 2,Category 3,Enrollment,Language,Description,Last Update,Date Scraped
Learn the basics of web development,www.udemy.com/course/learn-the-basics-of-web-development/,Joel Carter,29.99,11.99,3.5(1 rating),Development,Web Development,Front End Web Development,2,English,The Beginner's Guide to web development!,2/2019,12/29/19
Learn Web Development Using  HTML5 Advanced Programing ,www.udemy.com/course/html5-advanced/,Somenath Sen,124.99,11.39,4.2(4 ratings),Development,Web Development,HTML5,606,English,Learn Web Development using HTML & HTML5 advanced programing and make your own interactive websites.,7/2015,12/29/19
HTML And CSS For Beginners - Create Your First Website,www.udemy.com/course/html-and-css-for-beginners-create-your-first-website/,Johan Nordin,49.99,11.39,4.0(1 rating),Development,Web Development,CSS,21,English,Learn HTML and CSS - Create Your First Website From Scratch - Code Like The Experts,12/2017,12/29/19
Complete Web Developer Course-Build The Next Big Thing,www.udemy.com/course/complete-web-developer-course-build-the-next-big-thing/,Gary Li,24.99,11.39,4.2(32 ratings),Development,Web Development, ,334,English,"Start learning how to build the next big thing! Learn HMTL, CSS, Javascript,Jquery, Bootstrap, PHP,Mysql, Stripe API,AWS",12/2016,12/29/19
PHP Web Development with MySQL,www.udemy.com/course/web-development-with-php-mysql/,Ali Raza Sardar Ali,199.99,11.39,4.9(5 ratings),IT & Software,Other,Web Development,38,English,Web Application Development with PHP & MySQL,12/2019,12/29/19
Certified Web Developer,www.udemy.com/course/certified-web-developer/,How To Network,129.99,11.39,4.2(5 ratings),IT & Software,IT Certification,Web Development,62,English,A guide for beginners who want to dive into the exciting world of web development.,1/2018,12/29/19
"React for Beginners: Build an App, & Learn the Fundamentals",www.udemy.com/course/react-for-beginners-build-an-app-and-learn-the-fundamental/,Ryan Johnson,19.99,11.99,4.3(46 ratings),Development,Web Development,JavaScript,146,English,"All React, No Distractions. This course will stick to the fundamentals, and guide you through creating your first app",11/2018,12/29/19
Learning Path: Web Development with PHP 7 and Laravel 5,www.udemy.com/course/learning-path-web-development-with-php-7-and-laravel-5/,Packt Publishing,199.99,11.39,4.2(26 ratings),Development,Web Development,Laravel,176,English,Apply your knowledge to build amazing web applications with PHP 7 and Laravel,5/2017,12/29/19
Build A Directory Website,www.udemy.com/course/build-an-online-directory-website-using-wordpress/,Rich Peterson,24.99,11.39,4.2(15 ratings),Business,Entrepreneurship,Web Development,"1,030",English,"Using Wordpress, you'll have your own directory website (like Yellow Pages or Yelp) up and running in an afternoon.",12/2016,12/29/19
Advanced Ionic & Angular: 10 Techniques in Web Development,www.udemy.com/course/ionic-angular-advanced-concepts/,Jai Preston,19.99,11.39,0.0(0 ratings),Development,Web Development, ,3,English,"Kubernetes, Docker, Notifications, Custom scripts, Background Tasks & More â take your web dev skills to the NEXT LEVEL!",11/2019,12/29/19
Create a 5 Page Business Website With Joomla Without Coding,www.udemy.com/course/how-to-create-a-professional-5-page-website-with-joomla/,Mathew Tamin,94.99,11.39,4.3(6 ratings),Development,Web Development,Joomla,537,English,You have less than 30 seconds to convince visitors to stay on your website. Learn how to design a site that keeps them.,10/2013,12/29/19
"Get A Web Developer Job - The Tips, Tricks & Tech Revealed",www.udemy.com/course/get-a-web-dev-job/,James Bedford,49.99,11.39,4.3(19 ratings),Development,Web Development, ,"1,088",English,Get the Web Developer Job you Always Wanted! Learn the Secrets & Tech to Succeed - Includes free Portfolio and Resume!,7/2018,12/29/19
Learning Path: Aurelia: Web Development for UI Developers,www.udemy.com/course/learning-path-aurelia-web-development-for-ui-developers/,Packt Publishing,199.99,11.39,3.3(13 ratings),Development,Web Development,Aurelia Framework,115,English,Develop applications using the next generation UI framework for web and mobile developmentâAurelia,5/2017,12/29/19
"Make A Responsive Website Project #1: CSS, HTML & Javascript",www.udemy.com/course/make-a-bootstrap-website-project-2-css-html-javascript/,Eric Tam,164.99,11.39,4.2(10 ratings),Development,Web Development, ,"3,821",English,"Create A Responsive Website Using HTML, CSS, Javascript and Bootstrap",7/2019,12/29/19
Beginners Guide to Web Development,www.udemy.com/course/beginners-guide-to-web-development/,Packt Publishing,199.99,11.39,0.0(0 ratings),Development,Web Development, ,6,English,"Learn HTML, CSS, and JavaScript to design and develop web applications. Discover how to scrape any application easily",3/2019,12/29/19
#1 FREE Website: create from scratch the perfect website!,www.udemy.com/course/free-website-create-the-perfect-website/,Roger Lobo,19.99,11.39,0.0(0 ratings),Development,Web Development, ,3,English,"Super-fast, secure, mobile-ready. Step-by-step detailed instructions. Free website builder,cloud AWS. And fully updated!",11/2019,12/29/19
Web Development for beginners: Build Website from Scratch,www.udemy.com/course/web-development-design/,Jamshaid Raza,199.99,11.39,3.9(19 ratings),Design,Web Design,Web Development,154,English,Learn complete web design & development from scratch . Design website from PSD to HTML and CSS for beginners fast.,8/2017,12/29/19
Wordpress for Beginners - Master Wordpress Quickly,www.udemy.com/course/wordpress-for-beginners-2019-wordpress-development-guide/,Gurpreet Singh,19.99,11.39,4.6(13 ratings),Design,Web Design,Web Development,52,English,"Wordpress for Beginners 2019 - Wordpress Theme Development Guide No Experience, Programming, or Coding Necessary.",6/2019,12/29/19
The Complete Django Web Development Course,www.udemy.com/course/the-complete-modern-web-development-course/,Lipiam Co,199.99,11.99,4.4(11 ratings),Development,Web Development, ,596,English,The best course for starters and advanced developers,5/2016,12/29/19
JavaScript Complete Real time Production Usage (2019),www.udemy.com/course/javascript-complete-real-time-production-usage-2019/,B Praveen Kumar,19.99,11.39,5.0(8 ratings),Development,Web Development, ,24,English,"Take a deep dive into JavaScript, a Must-Know Language in Web Development, with a Hands-on.",9/2019,12/29/19
Building Websites With Photoshop CC,www.udemy.com/course/building-websites-with-photoshop-cc/,Stone River eLearning,19.99,11.39,4.4(12 ratings),Design,Design Tools,Web Development,72,English,Learn step-by-step how to build web layouts and extract code with Photoshop CCâ¦the right way!,7/2014,12/29/19
Responsive Web Development with HTML5 & CSS3 For Beginners,www.udemy.com/course/responsive-web-development-with-html5-css3-for-beginners/,Robert Nana Sarpong,99.99,11.39,4.4(40 ratings),Development,Web Development, ,"5,182",English,â­Build Six Real World Projects(With Flexbox and CSS Grid) and Also Learn How To Host Your Website Online For Free!â­,4/2019,12/29/19
The complete Web development course with projects,www.udemy.com/course/the-complete-web-development-course-with-projects/,Shakzee Arain,199.99,11.39,0.0(0 ratings),Development,Web Development, ,2,English,Learn Web Development From Scratch To Master Level Just In One Course,12/2019,12/29/19
Get Started with Web Development By Building Games,www.udemy.com/course/get-started-with-web-development-by-building-games/,CS PRO,199.99,11.39,3.9(10 ratings),Development,Web Development, ,"3,285",English,"Build Games and Learn HTML5, CSS3, Canvas, Javascript and Loader",8/2018,12/29/19
Web Development with NodeJS and MongoDB,www.udemy.com/course/web-development-with-nodejs-and-mongodb/,Packt Publishing,84.99,11.39,3.2(34 ratings),Development,Web Development, ,288,English,A practical guide to building an interactive and fully-featured web application from scratch with NodeJS and MongoDB,2/2016,12/29/19
Start Your Own Forum Website in 15 Minutes ,www.udemy.com/course/forum-web-development/,David Gabriele,39.99,11.39,4.2(46 ratings),Development,Web Development, ,"5,449",English,Forum web development : Build your own forum website within 15 minutes where people can start discussion on any topic,1/2015,12/29/19
Learn 5 Popular CMS of World. Web Development without Code,www.udemy.com/course/5-cms-all-websites-become-a-web-developer-without-coding/,JobboJ Courses,99.99,11.39,4.7(6 ratings),Development,Web Development, ,"1,137",English,"Learn How to Build ALL Websites from Zero without Coding. 5 Best CMS for your E-commerce, blog, photo gallery or forum",11/2017,12/29/19
Getting Started with Ruby Programming for Web Development,www.udemy.com/course/ruby-for-beginners/,Scott Taylor,19.99,11.39,4.4(25 ratings),Development,Software Engineering,Ruby,"1,117",English,"Introduction to Ruby on Rails Programming for Web Development, Learn Object Oriented Ruby Programming Concepts",1/2017,12/29/19
Create a Hotel Booking Website And Accept Reservations,www.udemy.com/course/create-a-hotel-booking-website-and-accept-reservations-with-joomla/,Mathew Tamin,94.99,11.39,2.9(2 ratings),Development,Web Development,Hotel Management,61,English,"Create a professional website for your hotel, motel or rental property and accept reservations online instantly.",11/2016,12/29/19
Quick website with .NET CORE 3.0 and pure JavaScript,www.udemy.com/course/quick-website/,Taurius Litvinavicius,29.99,11.39,3.7(37 ratings),Development,Web Development,.NET,"8,581",English,Develop quick website without razor and with pure JavaScript,2/2019,12/29/19
Develop and Launch Your First Website in Just One Day!,www.udemy.com/course/basic-web-crash-course/,Awesome Inc,24.99,11.39,3.7(8 ratings),Development,Web Development, ,"1,233",English,"Build your first website and learn the basics of HTML & CSS. The course also covers Weebly, Wordpress, and self-hosting.",3/2014,12/29/19
Creating a Website Made Easy,www.udemy.com/course/creating-a-website-made-easy/,"Rod Martin, Jr.",19.99,11.39,0.0(0 ratings),Development,Web Development, ,15,English,"Learn how to choose a domain, find a web host, plus design and code your website in HTML5 and CSS3.",6/2015,12/29/19
"IPFS - NextGen Web - Develop, Deploy, Integrate",www.udemy.com/course/ipfs-nextgen-web-develop-deploy-integrate/,Kalpana Sharma,24.99,11.39,4.4(2 ratings),IT & Software,Other,Web Development,13,English,"Learn to install IPFS, develop and deploy IPFS supported applications",1/2019,12/29/19
Cloud Control Panel From Scratch using Python/Django,www.udemy.com/course/cloud-control-panel-from-scratch-using-pythondjango/,Abhijan Guha,94.99,11.39,4.4(19 ratings),Development,Web Development,Django,"1,225",English,Control your Cloud/Web apps with powerful Django,12/2016,12/29/19
Flask: What's in it For You,www.udemy.com/course/flask-whats-in-it-for-you/,Douglas Starnes,39.99,11.39,0.0(0 ratings),Development,Web Development, ,5,English,Create web applications and APIs quickly with the Flask microframework and Python,6/2019,12/29/19
"Basic Concepts of Web Development, HTTP and Java Servlets",www.udemy.com/course/web-application-and-java-servlet-concepts/,Sanjay Patel,34.99,11.39,3.8(77 ratings),Development,Web Development,HTTP,"2,860",English,"The basics you must be knowing while coding good web applications. Not only for Java guys, but for any web developer.",9/2015,12/29/19
Web Site for Beginners - Learn Web Building like knitting,www.udemy.com/course/web-design-for-grandmothers-with-html/,Ersen Kiremitci,19.99,11.39,4.5(165 ratings),Development,Web Development,HTML,"9,444",English,HTML made easy with real life examples. Learn how to make a web site with html.,9/2016,12/29/19
"Create Free, Fast and Secure Static Website",www.udemy.com/course/create-free-fast-and-secure-static-website/,Jan Zavrel,19.99,11.39,3.7(260 ratings),Development,Web Development, ,"12,276",English,"Quick and easy guide to set up your web using free tools, resources and services",7/2016,12/29/19
Learn To Create Different Website Layouts & Media Queries,www.udemy.com/course/websitelayouts/,Joe Parys,199.99,11.39,3.5(50 ratings),Development,Web Development, ,"6,541",English,In this complete course students will learn to create multiple website layouts and media queries for their websites,8/2015,12/29/19
Master Website Development From Scratch Using HTML & CSS,www.udemy.com/course/become-master-in-web-development-from-scratch-using-htmlcss/,QAEversity .,19.99,11.39,4.3(14 ratings),Development,Web Development, ,653,English,This course is focused for beginners to master website development and become expert website developers using HTML & CSS,11/2014,12/29/19
"WebDev: Cool Parts with HTML5, JavaScript ES6 & CryptoJS",www.udemy.com/course/webdev-cool-parts/,Ireneusz Erik Owsiak,19.99,11.39,3.9(2 ratings),Development,Software Engineering,Web Development,68,English,"Start using cool & exciting features that come from HTML5, JavaScript ES6 and CryptoJS",3/2017,12/29/19
HTML5 CSS3 JQUERY Single Page Website Project from Scratch,www.udemy.com/course/html5-css3-jquery-single-page-website-project-from-scratch/,Laurence Svekis,119.99,11.39,4.5(43 ratings),Development,Web Development, ,"1,758",English,Build your own website from scratch Step by Step easy to follow guide web development. Learn to use HTML5 CSS3 JQUERY,11/2019,12/29/19
Creating Modern Websites from Scratch using HTML & CSS,www.udemy.com/course/creating-modern-websites-from-scratch-using-html-css/,Thas R. Eagans,24.99,11.39,4.6(15 ratings),Design,Web Design,Web Development,881,English,"Learn from the most up-to-date course, the skills you need, to charge 4-digit figures for the websites you create.",10/2015,12/29/19
Make A Responsive Website From Scratch: Javascript and HTML,www.udemy.com/course/make-a-responsive-website-from-scratch-javascript-and-html/,Eric Tam,169.99,11.39,3.7(25 ratings),Development,Web Development, ,"9,020",English,"Create a responsive restaurant website using HTML, CSS and Javascript (JQuery)",3/2019,12/29/19
Build A Social Network Using Social Engine,www.udemy.com/course/build-a-social-network-or-voting-platform-using-social-engine-cloud/,Rich Peterson,24.99,11.39,4.4(20 ratings),Business,Entrepreneurship,Web Development,"3,402",English,"Discover how to quickly and easily build a beautiful, hosted social network for your online community.",12/2016,12/29/19
Social Network Web Development,www.udemy.com/course/how-to-create-a-social-network-site-from-scratch/,Leo G.,199.99,11.39,3.1(32 ratings),Development,Web Development, ,"2,715",English,"Web Develop your Social Network Site using HTML, CSS, jQuery, ASP.NET, SQLServer and more, with this step-by-step course",2/2014,12/29/19
Modern Web Development with HTML5 and CSS,www.udemy.com/course/modern-web-development-with-html5-and-css/,Infinite Skills,49.99,11.39,4.6(8 ratings),IT & Software,Other,CSS,48,English,"Go hands-on with the latest HTML5 and CSS standards to create compelling, usable web layouts and formatted content.",1/2017,12/29/19
Weather Application with Angular Express,www.udemy.com/course/weather-application-with-angular-express/,ITPro TV,99.99,11.39,5.0(2 ratings),Development,Web Development, ,7,English,Angular and Express... Putting it together!,1/2019,12/29/19
Hands-On Web Development with Vue.js,www.udemy.com/course/hands-on-web-development-with-vuejs/,Packt Publishing,124.99,11.39,3.7(3 ratings),Development,Web Development, ,32,English,Provide richer and interactive User Interfaces to your web applications to deliver high-quality production code,6/2018,12/29/19
Web Development Tools the Pros Use: Code Productivity Hacks,www.udemy.com/course/web-development-tools/,Ryan Carter,29.99,11.39,3.9(12 ratings),Development,Web Development, ,"2,599",English,"Take your web development skills to the next level. Beyond the basics, you'll learn the tricks of the trade from a pro.",9/2015,12/29/19
In Depth Web Development Made Easy,www.udemy.com/course/in-depth-web-development-from-scratch/,Tommy Mertell,19.99,11.39,4.1(36 ratings),Development,Web Development, ,"3,273",English,"Learn how to see web development as a puzzle, where you're just fitting the pieces together.",1/2016,12/29/19
DevOps: Streamlining Web Development,www.udemy.com/course/devops-streamlining-web-development/,Packt Publishing,199.99,11.39,2.0(2 ratings),IT & Software,Other,DevOps,41,English,Accelerate web development and work effectively by making the most of the DevOps tools,4/2017,12/29/19
Laravel Project 2019: Build a beautiful referral system[pt1],www.udemy.com/course/laravel-course-build-a-full-referral-system-with-laravel/,Dave Partner,19.99,11.39,4.2(8 ratings),Development, Web Development,Laravel,"3,407",English,Learn to build high performing industrial standard web applications using laravel,11/2018,12/29/19
Advanced Drag and Drop uploader and Cropping System,www.udemy.com/course/addvanced-drag-and-drop-uploader-and-cropping-system/,Faraz Abbas,199.99,11.39,4.2(13 ratings),Development,Web Development, ,65,English,Learn how to create drag & drop uploading and cropping system from scratch to advance,6/2016,12/29/19
web development for beginners,www.udemy.com/course/web-development-for-beginners/,Adnan Ahmad,19.99,11.99,4.1(171 ratings),Development,Web Development, ,"11,939",English,"HTML,CSS,JavaScript and JQuery",2/2019,12/29/19
Learn Laravel 6 CRUD by creating To-Do List App From Scratch,www.udemy.com/course/learn-laravel-6-crud-by-creating-to-do-list-app-from-scratch/,Hamza Ahmoud,19.99,11.39,3.5(4 ratings),Development,Web Development, ,"1,830",English,Learn to master Laravel to make advanced applications by Using Crud Operations,10/2019,12/29/19
Practical Web Programming 101,www.udemy.com/course/practical-web-programming-101/,Ireneusz Erik Owsiak,19.99,11.39,4.7(6 ratings),Development,Web Development, ,210,English,"Build A Functional, End To End Website!",2/2017,12/29/19
How to built a modern website fast and easy,www.udemy.com/course/html-and-css-fast/,Marian Sergiu,19.99,11.39,3.7(8 ratings),Design,Web Design,Web Development,"1,206",English,Modern website fast and easy with CSS3 and HTML5. Learn webdesign fast and very easy. Built first website today.,4/2016,12/29/19
Website for beginners:Build a site with no coding experience,www.udemy.com/course/website-for-beginnersbuild-a-site-with-no-coding-experience/,Gil Zapata,29.99,11.39,5.0(1 rating),Development,Web Development, ,4,English,How to build a website within 48 hours. You will learn how to build a site from scratch with no coding experience,11/2018,12/29/19
Introduction to  Web Development For Complete Beginners,www.udemy.com/course/introduction-to-web-development-for-complete-beginners/,Bluelime Learning Solutions,109.99,11.39,3.3(25 ratings),Development,Web Development, ,"2,070",English,Learn the basic building blocks for web development by creating 7 Practical and useful apps,9/2017,12/29/19
Introduction to Web Development,www.udemy.com/course/introduction-to-web-development-2017/,Doug Walters,19.99,11.39,0.0(0 ratings),IT & Software,Other,Web Development,4,English,"Learn the basics of web development using HTML, CSS, and JavaScript.",3/2017,12/29/19
Compare Website Builder Software,www.udemy.com/course/website-builder-software-reviews-weebly-vs-squarespace-vs-wix/,Rich Peterson,24.99,11.39,4.3(29 ratings),Development,Web Development, ,"1,557",English,We look at Squarespace vs Weebly vs Wix vs Google Sites vs Wordpress vs Webydo vs Webflow vs Sidengo vs LightCMS & More,7/2018,12/29/19
Become a Modern Web Developer,www.udemy.com/course/become-a-modern-web-developer/,Stone River eLearning,199.99,11.39,3.4(18 ratings),Development,Web Development, ,151,English,Learn cutting edge web development skills to stay ahead of your peers,2/2017,12/29/19
Become A Web Developer And Seller - Build Websites With HTML,www.udemy.com/course/the-ultimate-building-and-selling-websites-course/,Amir Rimer,199.99,11.39,3.0(69 ratings),Development,Web Development,HTML,"22,267",English,"Discover how you can build simple HTML websites, and sell them quickly for massive profits",5/2015,12/29/19
Tutorial to Create Your Own Website,www.udemy.com/course/learn-to-create-your-own-website-for-free/,Dr. Dheeraj Mehrotra,19.99,11.39,4.0(9 ratings),Personal Development,Career Development,Web Development,"3,554",English,Towards a WOW Showcase of yourself online.,4/2019,12/29/19
3 Web Development Essentials,www.udemy.com/course/web-development-essentials/,Jesse Boyer,29.99,11.39,0.0(0 ratings), Development,Web Development, ,3,English,Reusable Knowledge for Decades,10/2019,12/29/19
Build a website HTML5 CSS3 Beginner Course,www.udemy.com/course/how-to-build-a-website-html5-css3-beginner-course/,Laurence Svekis,149.99,11.39,4.2(59 ratings),Development,Web Development,HTML5,"7,969",English,Complete Starters Guide to Creating a website form scratch HTML5 CSS3 PHP contact from Responsive Design Templates,11/2019,12/29/19
Introduction to web development,www.udemy.com/course/intro-to-web-dev/,Tatiana Minina,19.99,11.39,4.4(39 ratings),Development,Web Development, ,"3,044",English,"Build the website: How to start if you never did it before (Wix, WordPress; HTML, images and more)",6/2017,12/29/19
The One Day Website,www.udemy.com/course/your-irresistible-website/,Philippa Davies,19.99,11.39,5.0(3 ratings),Business,Communications,Web Development,129,English,Build an irresistible website for your business goals - in just one day,7/2015,12/29/19
How to Get a Job as a Web Developer - Start Your Career,www.udemy.com/course/how-to-get-a-job-as-a-developer/,Adria Jimenez,144.99,11.39,3.7(34 ratings),Development,Web Development,Job Search,241,English,A course on getting a job as a web developer. You have the developer skills; now it's time to get a job in the industry.,11/2017,12/29/19
The Complete Web Developer Course,www.udemy.com/course/the-complete-web-developement-course/,Parth Bhimajiyani,194.99,11.39,0.0(0 ratings),Development,Web Development, ,3,English,"Learn Web Development using HTML, CSS, Javascript, PHP, Mysql and more...",5/2018,12/29/19
"Introduction to PHP7, Bootstrap 4 and JavaScript.",www.udemy.com/course/introduction-to-php7-bootstrap4-and-javascript/,Pranan Subba,19.99,11.39,5.0(2 ratings),IT & Software,IT Certification,Web Development,5,English,"Introduction to PHP7, Bootstrap 4, Ajax and JavaScript by practical project 'PetNotes'.",4/2019,12/29/19
Create Twitter in a Weekend,www.udemy.com/course/create-twitter-in-a-weekend/,Khoa Tran,194.99,11.39,4.1(3 ratings),IT & Software,Other,Web Development,34,English,The goal of this course is to build a basic database website (using phpMyAdmin),6/2017,12/29/19
Learn how to Build Modern and Beautiful Responsive Website,www.udemy.com/course/learn-how-to-build-modern-and-beautiful-responsive-website-with-html/,Charles Karanja,19.99,11.39,0.0(0 ratings),Design,Web Design,Web Development,55,English,The ultimate Beginner Full Stack Web for Development. The fastest way to learn HTML & start to build real websites.,9/2017,12/29/19
The Guide of the Advanced Techniques in Web Development,www.udemy.com/course/the-ultimate-advanced-techniques-in-web-development/,Iulian Bubolea,134.99,11.39,4.7(2 ratings),Development,Web Development, ,949, English,Do you want to increase your income by improving the way you code?,6/2017,12/29/19
"Advanced Html,Css,Jade(pug),Materializecss Course",www.udemy.com/course/advanced-html-css-with-materializecss/,Yoel fisher,104.99,11.39,0.0(0 ratings),Development,Web Development, ,2,English,learn a better workflow for web development using my workflow,9/2019,12/29/19
Passive Income with Niche Websites,www.udemy.com/course/niche-marketing2/,Joe Adri,19.99,11.39,3.8(90 ratings),Marketing,Digital Marketing,Web Development,"13,789",English,Creating passive Income Niche Websites,11/2016,12/29/19
Build a Website / Blog in 3 Days With No Tech Training,www.udemy.com/course/build-a-website-blog-in-3-days/,John Dionysiou,199.99,11.39,4.3(11 ratings),Development,Web Development, ,108,English,Learn all of the skills you need to build an website / blog using Thrive Themes in this STEP BY STEP instructional,6/2018,12/29/19
Site Development Associate CIW 1D0-61B Practice Tests,www.udemy.com/course/site-development-associate-ciw-1d0-61b-practice-tests/,Strobe Practice Tests,19.99,11.39,0.0(0 ratings),IT & Software,IT Certification,Web Development,2,English,Prepare for the CIW 1D0-61B exam,11/2019,12/29/19
Web Development In 2020,www.udemy.com/course/web-development-in-2020/,akshay Mayekar,19.99,11.39,2.9(5 ratings),Teaching & Academics,Online Education,Front End Web Development,"3,614",English,Learn Web Development As Absolute Beginner,12/2019,12/29/19
Complete Bootstrap & Materialize CSS Course for Beginners,www.udemy.com/course/complete-bootstrap-materialize-css-course-for-beginners/,Ikenna Ukpai,59.99,11.39,0.0(0 ratings),Development,Web Development, ,58,English,Learn the essentials of Bootstrap 4 and Materialize CSS and start building responsive websites.,7/2019,12/29/19
Advanced Backend Web Development,www.udemy.com/course/refactoru-adv-backend-dev/,RefactorU LLC,54.99,11.39,3.6(11 ratings),Development,Web Development, ,357,English,"We will also look at the basics of Coffeescript, a quick and powerful way to write Javascript.",11/2015,12/29/19
Learning Path: Master Web Development with Ruby on Rails 5,www.udemy.com/course/learning-path-master-web-development-with-ruby-on-rails-5/,Packt Publishing,199.99,11.39,0.0(0 ratings),Development,Web Development,Ruby on Rails,26,English,Get started with Rails 5 today and build robust web applications for the modern web,6/2017,12/29/19
Mastering MEAN Web Development,www.udemy.com/course/mastering-mean-web-development/,Packt Publishing,94.99,11.39,3.1(8 ratings),Development,Web Development, ,241,English,Everything you need to know to build flawless and robust websites with the MEAN stack,4/2016,12/29/19
