Course,URL,instructor,Price (full),Price (discount),Rank
Intro To Chord Progressions: Write Simple Songs On Piano,www.udemy.com/course/beginner-songwriting-how-to-write-a-song-on-piano/,Eddie Makes,"₩27,500","₩13,200",Rating: 4.3 out of 54.3 - (27)
How To DJ with Ableton Live,www.udemy.com/course/how-to-dj-with-ableton-live/,Samuel Kissee,"₩22,000","₩13,200",Rating: 3.9 out of 53.9 - (7)
Music Theory - Master the Fundamentals,www.udemy.com/course/music-theory-master-the-fundamentals/,David Varney,"₩22,000","₩13,200",Rating: 0.0 out of 50.0 - (0)
Sing Professionally - From Amateur to Pro in 30 Days,www.udemy.com/course/sing-professionally-from-amateur-to-pro-in-30-days/,"Reuben Ch'ng, Alvin Chong","₩38,500","₩13,200",Rating: 3.1 out of 53.1 - (43)
Play Gypsy Jazz Rhythm Guitar! Vol 3 - Waltz Accompaniment,www.udemy.com/course/gypsy-jazz-guitar-waltz-accompaniment/,Alex Simon,"₩77,000","₩13,200",Rating: 4.8 out of 54.8 - (2)
Bluegrass Guitar Licks - Guitar Improvisation,www.udemy.com/course/licks-unlocked-on-the-guitar-key-of-g/,Lesson Pros,"₩220,000","₩13,200",Rating: 4.2 out of 54.2 - (12)
Traktor Tips - Basics Course,www.udemy.com/course/traktor-tips-basics-course/,Alan Churchill,0,$19.99,Rating: 4.5 out of 54.5 - (10)
Music Theory Intro: DIY Circle of 5th -Guitar Piano Ukulele,www.udemy.com/course/fun-diy-circle-of-5ths-for-musicians-guitar-piano-ukulele/,Rosa Suen,$19.99,$11.99,Rating: 4.1 out of 54.1 - (36)
Guitar Improvisation and Soloing: started with simple Solos,www.udemy.com/course/guitar-improvisation-and-soloing-get-started-w-simple-solos/,Robert Turrell,$19.99,$11.99,Rating: 3.2 out of 53.2 - (4)
Learn Simple Sacred Chants for Meditation Yoga on Harmonium,www.udemy.com/course/learn-simple-sacred-chants/,Gaurav Verma,$19.99,$11.99,Rating: 0.0 out of 50.0 - (0)
How to Memorise the Music You Play,www.udemy.com/course/how-to-memorise-the-music-you-play/,John Goodstadt,0,$19.99,Rating: 5.0 out of 55.0 - (1)
Guitar Lessons: Play & Sing to LANDSLIDE (Fleetwood Mac),www.udemy.com/course/guitarlessonlandslide/,Joe Borowsky,$74.99,$11.99,Rating: 4.6 out of 54.6 - (3)
Learn the Music Business and explode your music career!,www.udemy.com/course/learn-the-music-business/,Terry Moorer,$49.99,$11.99,Rating: 3.7 out of 53.7 - (18)
A Guide to Analog Synths: For the modern EDM enthusiast.,www.udemy.com/course/secrets-of-analog-synths/,Sam Gill,$24.99,$11.99,Rating: 3.8 out of 53.8 - (14)
Learn How To Play 25 Classic Hip Hop Songs Ch.2,www.udemy.com/course/learn-how-to-play-25-hip-hop-classic-songs-ch2/,JayJay Johnson,$24.99,$11.99,Rating: 4.8 out of 54.8 - (7)
Play Incredible Guitar Solos:  Essential Exercises,www.udemy.com/course/guitarsolo/,Ryan Rostrom,$49.99,$11.99,Rating: 4.1 out of 54.1 - (10)
How to play two Star Wars themes in 30 minutes on harmonica,www.udemy.com/course/instant-harmonica-play-two-star-wars-themes-in-30-minutes/,Ben Hewlett,$39.99,$11.99,Rating: 4.5 out of 54.5 - (25)
Music Theory  Vol. 2: Scales and Chords,www.udemy.com/course/music-theory-vol-2-scales-and-chords/,Ilse Lozoya,$39.99,$11.99,Rating: 4.4 out of 54.4 - (22)
Creating The Drop in 1 hour: Stay by Zedd & Alessia Cara,www.udemy.com/course/creating-the-drop-stay-by-zedd-alessia-cara/,Wilson Chen,$99.99,$11.99,Rating: 4.2 out of 54.2 - (36)
Making Neuro / D&B Bass In Ableton,www.udemy.com/course/making-neuro-bass-in-ableton/,W. A. Production Academy,$49.99,$11.99,Rating: 5.0 out of 55.0 - (1)
Learn to play “MARGARITAVILLE” on the Steel Drum!,www.udemy.com/course/learn-to-play-margaritaville-on-the-steel-drum/,Mark Piantanida,$19.99,$11.99,Rating: 5.0 out of 55.0 - (26)
How to use Quintal Chords,www.udemy.com/course/how-to-use-quintal-chords/,Oluwayanmife (Also Known as Yummy) Akintola,$199.99,$11.99,Rating: 0.0 out of 50.0 - (0)
Play Piano 13: Improvise My Heart Will Go On Chords By EAR,www.udemy.com/course/play-piano-13-improvise-on-my-heart-will-go-on-chords/,Rosa Suen,€194.99,€10.99,Rating: 5.0 out of 55.0 - (3)
Chord Confidence Part 1 -  Learn Chords on Guitar: Beginner,www.udemy.com/course/chord-confidence-part-1-beginner-guitar/,Charles Dupuis,€19.99,€18.99,Rating: 4.5 out of 54.5 - (4)
Absolute Beginner Guitar Lesson Easy Step By Step - Module 1,www.udemy.com/course/absolute-beginner-guitar-lesson-easy-step-by-step-module-1/,Prabir Jana,€19.99,€10.99,Rating: 5.0 out of 55.0 - (8)
Even More Chord Positions on Keyboard: Piano Building Blocks,www.udemy.com/course/piano-building-blocks-learn-to-play-chord-inversions-vol-2/,Nathan Lawrence,€99.99,€10.99,Rating: 4.8 out of 54.8 - (5)
Bluegrass Guitar Essentials: Webisodes 5 & 6,www.udemy.com/course/bluegrass-guitar-essentials-webisodes-5-6/,Eric Beaty,€29.99,€10.99,Rating: 4.3 out of 54.3 - (5)
'Greensleeves' Creative Piano Lessons Course,www.udemy.com/course/greensleeves-creative-piano-lessons-course/,Mister Musicarta,€19.99,€18.99,Rating: 5.0 out of 55.0 - (3)
#6 Piano Secret Trick: Rosa's Runs & Fills - Polychord Hands,www.udemy.com/course/6-piano-secret-trick-rosas-runs-fills-polychord-hands/,Rosa Suen,€194.99,€10.99,Rating: 5.0 out of 55.0 - (3)
Swing Low - The 101 Authentic Nashville Piano Style Course,www.udemy.com/course/swing-low-nashville-piano-style/,Peter Janzen,€19.99,€10.99,Rating: 4.8 out of 54.8 - (8)
Sax From Scratch: YouTube and Stage Performing,www.udemy.com/course/sax-from-scratch-youtube-and-stage-performing/,John Peterson,€19.99,€10.99,Rating: 3.8 out of 53.8 - (12)
Rhythm #3: Play 16th Note - Ballad 9 and Melody Fill - D Key,www.udemy.com/course/15-hand-coordination-16th-note-left-hand-ballad-9-d-key/,Rosa Suen,€194.99,€10.99,Rating: 5.0 out of 55.0 - (2)
Understanding chords to improve songwriting.,www.udemy.com/course/understanding-chords-to-improve-songwriting/,Chris Richter,€19.99,€10.99,Rating: 4.6 out of 54.6 - (15)
Music Mastering in Ableton Live,www.udemy.com/course/music-mastering-in-ableton-live/,RD Play,€24.99,€11.99,Rating: 3.5 out of 53.5 - (4)
Sell Beats Online for Beginners,www.udemy.com/course/sell-beats-online-for-beginners/,Travis Schave,€19.99,€10.99,Rating: 4.0 out of 54.0 - (8)
Trumpet Playing for Beginners/Returners: No. B.S  24 Lessons,www.udemy.com/course/learn-how-to-play-the-trumpet/,Danny Carney,€49.99,€10.99,Rating: 3.0 out of 53.0 - (5)
Vocal Warm Ups For An Awesome Voice,www.udemy.com/course/vocal-warm-ups-for-an-awesome-voice/,Jacob Obling Nygaard,€19.99,€10.99,Rating: 5.0 out of 55.0 - (1)
Future Bass & Trap Tips / Tricks,www.udemy.com/course/future-bass-trap-tips-tricks/,W. A. Production Academy,€49.99,€10.99,Rating: 5.0 out of 55.0 - (1)
Play Piano 3: Improvise Chords to Enchanted Evening by Ear,www.udemy.com/course/play-piano-3-improvise-chords-to-enchanted-evening-by-ear/,Rosa Suen,€194.99,€11.99,Rating: 4.7 out of 54.7 - (5)
Flatpicking the Bluegrass Fiddle Tune Salt Creek on guitar,www.udemy.com/course/learn-the-bluegrass-fiddle-tune-salt-creek-on-guitar/,Lesson Pros,€199.99,€11.99,Rating: 4.5 out of 54.5 - (3)
Basic Piano One,www.udemy.com/course/basic-piano-one/,Jason Dzamba,€44.99,€11.99,Rating: 5.0 out of 55.0 - (1)
808 Creation,www.udemy.com/course/808-creation/,W. A. Production Academy,€49.99,€11.99,Rating: 0.0 out of 50.0 - (0)
Jerusalem's Ridge on Guitar Learn the Bluegrass Fiddle Tune,www.udemy.com/course/learn-the-fiddle-tune-jerusalems-ridge-on-guitar/,Lesson Pros,€199.99,€11.99,Rating: 4.8 out of 54.8 - (7)
Modal Improv for the Jazz Pianist,www.udemy.com/course/modal-improv-for-the-jazz-pianist/,Martan Mann,€29.99,€11.99,Rating: 0.0 out of 50.0 - (0)
Killer Harmonica sounds using the tongue and bending notes ,www.udemy.com/course/benhewlettharmonicatuitionint3/,Ben Hewlett,€34.99,€11.99,Rating: 4.6 out of 54.6 - (5)
Rhythm Studies and Strumming Patterns,www.udemy.com/course/rhythm-studies-and-strumming-patterns/,Kun Loong Chia,€19.99,€11.99,Rating: 5.0 out of 55.0 - (1)
#4 Piano Hand Coordination: Fun Piano Runs in 2 Beats C Key,www.udemy.com/course/learn-piano-technique-4-piano-run-in-2-beats-in-c-key-song/,Rosa Suen,€194.99,€11.99,Rating: 4.1 out of 54.1 - (4)
#16 Piano Trick:  Play EZ Groupings Nostalgic Accompaniment,www.udemy.com/course/16-piano-trick-play-ez-groupings-nostalgic-accompaniment/,Rosa Suen,€194.99,€11.99,Rating: 3.3 out of 53.3 - (2)
Music Theory For Beginners,www.udemy.com/course/music-theory-for-beginners-d/,Jacob Obling Nygaard,€39.99,€11.99,Rating: 4.2 out of 54.2 - (2)
How to Write Better Sounding Music in Less Time,www.udemy.com/course/how-to-write-a-track-for-tv-in-60-minutes-or-less/,Eddie Grey,€24.99,€11.99,Rating: 3.8 out of 53.8 - (2)
"Piano Keyboard Lessons: Read Music, Theory & Composition",www.udemy.com/course/piano-keyboard-lessons-read-music-theory-composition/,Easy Learn,€184.99,€11.99,Rating: 3.9 out of 53.9 - (87)
Learn Piano with Beethoven,www.udemy.com/course/step-by-step-piano-fur-elise-for-newbies/,Jarrod Bell,€29.99,€11.99,Rating: 4.6 out of 54.6 - (5)
#11 Hand Coordination  - Flowing Ballad 9 - Because He Lives,www.udemy.com/course/11-hand-coordination-flowing-ballad-9-because-he-lives/,Rosa Suen,€194.99,€11.99,Rating: 4.6 out of 54.6 - (3)
Copyright Like a Rock/Star,www.udemy.com/course/copyright-like-a-rockstar/,Suzanne Paulinski,€19.99,€11.99,Rating: 4.8 out of 54.8 - (9)
Advanced Bassoon Studies - Learn to Master the Bassoon!​,www.udemy.com/course/advanced-bassoon/,MusicProfessor Online Music Lessons,€49.99,€11.99,Rating: 5.0 out of 55.0 - (2)
"Piano Lessons - Play Basic, Sound Like a Pro",www.udemy.com/course/piano-lessons-play-basic-sound-like-a-pro/,Andrew Grant,€19.99,€11.99,Rating: 5.0 out of 55.0 - (1)
"Easy to Learn Shri Ram Kirtan, Bhajans, Mantras on Harmonium",www.udemy.com/course/easy-to-learn-shri-ram-hanuman-kirtans-bhajans-chants/,Gaurav Verma,€19.99,€11.99,Rating: 0.0 out of 50.0 - (0)
#8 Chord Progression:Music Theory 10 Levels Old Rugged Cross,www.udemy.com/course/8-chord-progressionmusic-theory-10-levels-old-rugged-cross/,Rosa Suen,€199.99,€11.99,Rating: 4.5 out of 54.5 - (6)
Learn how to sing better in 10 lessons,www.udemy.com/course/learn-how-to-sing-better-in-10-lessons/,Alexandra Belibou,€49.99,€11.99,Rating: 3.7 out of 53.7 - (19)
Fur Elise  and Traumerei  - Piano Classics Vol.1,www.udemy.com/course/piano-classics-vol1/,Ilse Lozoya,€49.99,€11.99,Rating: 0.0 out of 50.0 - (0)
The 80/20 Beginner Guitar Course,www.udemy.com/course/the-8020-beginner-guitar-course/,Jason Lawrence,€49.99,€11.99,Rating: 4.3 out of 54.3 - (37)
Learn Garageband on Mac for beginners making music,www.udemy.com/course/haugergarageband/,Danny Hauger,€19.99,€11.99,Rating: 0.0 out of 50.0 - (0)
Learn how to make Greek music with Cubase,www.udemy.com/course/learn-how-to-make-greek-music-with-cubase/,Yossi Aharon,€74.99,€11.99,Rating: 5.0 out of 55.0 - (2)
Extended Range Bass Volume 2 Building Technique - Intervals,www.udemy.com/course/extended-range-bass-practicing-intervals-volume-4/,Vinnie Venkov,0,€29.99,Rating: 0.0 out of 50.0 - (0)
Blues Master - Professional Techniques Piano Course,www.udemy.com/course/blues-master-professional-techniques-piano-course/,Sergei Filimonov,0,€29.99,Rating: 0.0 out of 50.0 - (0)
"Play Piano 2:  Play ""Love Me Tender"" By Ear with 2-5 Chords",www.udemy.com/course/play-piano-2-improvise-play-standards-by-ear-aura-lee/,Rosa Suen,€194.99,€11.99,Rating: 4.7 out of 54.7 - (8)
"recreating the hit song ""Hello"" from Adele",www.udemy.com/course/recreating-the-hit-song-hello-from-adele/,Gábor Csordás,€49.99,€11.99,Rating: 0.0 out of 50.0 - (0)
Introduction to Music Theory,www.udemy.com/course/introductiontomusictheory/,Brandon H,€49.99,€11.99,Rating: 4.5 out of 54.5 - (20)
Learn Basic Carnatic  Music - Level 2,www.udemy.com/course/learn-basic-carnatic-music-level-2/,Rashmi K,€114.99,€28.75,Rating: 0.0 out of 50.0 - (0)
Guitar Lessons for Beginners - Learn How to Play Guitar,www.udemy.com/course/play-guitar/,Khurshid Amin,฿600,฿360,Rating: 4.4 out of 54.4 - (17)
How To Play Blues Guitar - Ragtime Blues Guitar Techniques,www.udemy.com/course/acoustic-blues-guitar-ragtime-blues-techniques/,Jim Bruce,"฿1,800",฿450,Rating: 4.5 out of 54.5 - (1)
Mental Training for Musicians,www.udemy.com/course/mental-training-for-musicians/,Alexandra Belibou,"฿1,400",฿360,Rating: 5.0 out of 55.0 - (1)
Ultimate Ableton Live 9: Part 2 - Recording & Warping,www.udemy.com/course/ableton2/,Jason Allen,"฿1,000",฿360,Rating: 4.9 out of 54.9 - (164)
Tune that Sour Note on Your Piano,www.udemy.com/course/how-to-tune-your-own-piano/,Thomas Daniel,฿600,฿360,Rating: 3.9 out of 53.9 - (6)
How to make a basic lo-fi chill beat in FL Studio,www.udemy.com/course/how-to-make-a-basic-lo-fi-chill-beat-in-fl-studio/,Cody Red,฿600,฿360,Rating: 3.3 out of 53.3 - (8)
How To Write Music For Video Games: JRPG,www.udemy.com/course/how-to-write-music-for-video-games-jrpg/,Chris Nairn,"฿2,200",฿360,Rating: 3.7 out of 53.7 - (2)
Bending the blue notes to give you killer sound on harmonica,www.udemy.com/course/benhewlettharmonicatuitionint2/,Ben Hewlett,"฿1,200",฿360,Rating: 4.6 out of 54.6 - (5)
How to be a DJ,www.udemy.com/course/how-to-be-a-dj/,Academy of Film Fashion and Design,฿600,฿360,Rating: 4.0 out of 54.0 - (17)
Jazz Guitar Basics,www.udemy.com/course/jazz-guitar-basics/,"Jan Pospisil, Martin Cohen","฿1,800",฿360,Rating: 3.0 out of 53.0 - (1)
Save Tons with The Complete Guide on How To Make A Record,www.udemy.com/course/how-to-make-a-cd-record/,Simon Vinestock,"฿5,800",฿360,Rating: 4.6 out of 54.6 - (7)
Piano Foundation Course In Arranging Song And Playing By Ear,www.udemy.com/course/practical-piano-course-on-arrangement-playing-by-ear/,Harry Yong,"฿3,400",฿360,Rating: 3.4 out of 53.4 - (3)
Practical Steps to Overcoming Performance Anxiety,www.udemy.com/course/practical-steps-to-overcoming-performance-anxiety/,Luciane Cardassi,"฿3,600",฿360,Rating: 4.1 out of 54.1 - (44)
Music Production in FL Studio - The Production Fundamentals,www.udemy.com/course/music-production-in-fl-studio-the-production-fundamentals/,Wilson Chen,"฿3,800",฿360,Rating: 4.0 out of 54.0 - (10)
Learn How To Play The Drum Set: Masterful Drumming Volume 2,www.udemy.com/course/learn-how-to-play-the-drum-set-masterful-drumming-volume-2/,Larry Crowe,"฿1,000",฿360,Rating: 0.0 out of 50.0 - (0)
Instant Harmonica - play When the Saints on harmonica now!,www.udemy.com/course/instant-harmonica-play-when-the-saints-on-harmonica-now/,Ben Hewlett,"₩22,000","₩13,200",Rating: 5.0 out of 55.0 - (1)
Piano With Willie: Jazz Kids - Vol 4,www.udemy.com/course/piano-with-willie-jazz-kids-vol-4/,Willie Myette,"₩44,000","₩13,200",Rating: 0.0 out of 50.0 - (0)
#7 Play Piano Trick: Quartal Harmony + Rosa's EZ Fingering,www.udemy.com/course/7-play-piano-trick-quartal-harmony-rosas-ez-fingering/,Rosa Suen,"₩214,500","₩13,200",Rating: 4.5 out of 54.5 - (4)
Mini Rock Guitar Course - Improvise using Arpeggios n licks,www.udemy.com/course/mini-rock-guitar-course-improvise-using-arpeggios-n-licks/,Tamal Ghosh,"₩22,000","₩13,200",Rating: 5.0 out of 55.0 - (1)
From your mind to your audience - Music production course,www.udemy.com/course/creative-music-production/,Francesco Generali,"₩49,500","₩13,200",Rating: 4.8 out of 54.8 - (5)
Instant Harmonica - play Somewhere Over the Rainbow now!,www.udemy.com/course/instant-harmonica-play-somewhere-over-the-rainbow-now/,Ben Hewlett,"₩44,000","₩13,200",Rating: 4.6 out of 54.6 - (3)
Intervallic Pattern to Pivot Keys for Guitar,www.udemy.com/course/grand-intervallic-pattern-to-pivot-keys/,Shaun Smith,0,"₩22,000",Rating: 4.8 out of 54.8 - (3)
Guitar For Beginners - How to Basics of note reading,www.udemy.com/course/practice-guitar-with-no-previous-experience-and-become-a-pro/,Kevin Zugschwert,"₩33,000","₩13,200",Rating: 4.8 out of 54.8 - (2)
GarageBand: A Comprehensive Guide to Making Music,www.udemy.com/course/garageband/,Michael Feinstein,"₩22,000","₩13,200",Rating: 3.7 out of 53.7 - (28)
How to EDM : Mix and Master a song in ableton,www.udemy.com/course/how-to-edm-mix-and-master-a-song-in-ableton/,Mohamed Benaouidate ( Angerwolf ),"₩27,500","₩13,200",Rating: 0.0 out of 50.0 - (0)
Master Apple Music,www.udemy.com/course/master-apple-music/,Gareth Pickering,"₩55,000","₩13,200",Rating: 4.2 out of 54.2 - (4)
Guitar Practice Skills: Learn Your Pentatonic Scales,www.udemy.com/course/guitar-practice-skills-pentatonic-scales-for-guitar/,Brian molin,"₩55,000","₩13,200",Rating: 0.0 out of 50.0 - (0)
Play 1000s of Songs On The Guitar | Cheater Chords,www.udemy.com/course/how-to-play-any-song-on-the-guitar-secret-chords/,Kaiwen F.,"₩93,500","₩13,200",Rating: 4.2 out of 54.2 - (8)
Music Theory Fundamentals,www.udemy.com/course/music-theory-fundamentals-101/,Christopher Siu,"₩77,000","₩13,200",Rating: 0.0 out of 50.0 - (0)
Ear Training for the Very Beginner Vol.3,www.udemy.com/course/ear-training-for-the-very-beginner-vol3/,Ilse Lozoya,"₩55,000","₩13,200",Rating: 5.0 out of 55.0 - (2)
Ear Training for the Very Beginner Vol.4,www.udemy.com/course/ear-training-for-the-very-beginner-vol4/,Ilse Lozoya,"₩55,000","₩13,200",Rating: 4.0 out of 54.0 - (1)
Building A Successful Touring Career,www.udemy.com/course/building-a-successful-touring-career/,Wisdom Moon,"¥12,000","¥3,000",Rating: 0.0 out of 50.0 - (0)
Strumming from scratch - Rhythm guitar lesson for Beginners,www.udemy.com/course/strumming-from-scratch-rhythm-guitar-lesson-for-beginners/,Tamal Ghosh,"¥2,400","¥1,270",Rating: 4.7 out of 54.7 - (19)
How to DJ Using Your Laptop Computer,www.udemy.com/course/how-to-dj-using-your-laptop-computer/,Dan Van Casteele,"¥2,400","¥1,270",Rating: 3.0 out of 53.0 - (25)
Starting Your Voice Acting Career on a Budget,www.udemy.com/course/staring-your-voice-acting-career-on-a-budget/,Stacy Thomas,"¥4,800","¥1,270",Rating: 0.0 out of 50.0 - (0)
"Music Entrepreneurship, Part 2: Funding Your Business",www.udemy.com/course/music-business-fundamentals-part-2-funding-your-business/,Jason Allen,"¥3,000","¥1,270",Rating: 5.0 out of 55.0 - (3)
Extended Range Bass Volume 3 Technique  For 6 String Bass,www.udemy.com/course/extended-range-bass-essential-of-the-6-string-bass-volume-5/,Vinnie Venkov,0,"¥3,000",Rating: 0.0 out of 50.0 - (0)
88 Logic - The Essential Guide To Learning Piano,www.udemy.com/course/88-logic-the-ultimate-course-for-learning-piano/,Stevie  Mac,0,"¥3,000",Rating: 5.0 out of 55.0 - (1)
How To Become a Full-time Artist and Get '1000 True-fans'!,www.udemy.com/course/how-to-become-a-full-time-artist-and-get-1000-true-fans/,Maikol Petersen,"¥11,400","¥1,270",Rating: 3.6 out of 53.6 - (5)
Cultivating Super Fans,www.udemy.com/course/cultivating-super-fans/,Wisdom Moon,"¥12,000","¥3,000",Rating: 4.0 out of 54.0 - (1)
"Euphonium Solos: Learn to Perform Three Fun, Unique Pieces!",www.udemy.com/course/intermediate-euphonium-solos/,MusicProfessor Online Music Lessons,"¥6,000","¥1,270",Rating: 4.6 out of 54.6 - (5)
Stay Motivated While Learning Music Online,www.udemy.com/course/stay-motivated/,Micah Blake,"¥12,000","¥1,270",Rating: 4.6 out of 54.6 - (13)
"Ableton Live, Beyond Music Production: The Masterclass",www.udemy.com/course/audio-visuals-lighting-the-live-performance-masterclass/,David O'Leary,"¥24,000","¥1,270",Rating: 4.5 out of 54.5 - (9)
Lead Guitar Course - Level 1 (Lessons #1-4),www.udemy.com/course/lead-guitar-course-level-1-lessons-1-4/,Thomas V. Dekker,"¥18,000","¥1,270",Rating: 4.0 out of 54.0 - (17)
Learning the FUNK,www.udemy.com/course/learning-the-funk/,Cori Jacobs,"¥2,400","¥1,270",Rating: 4.0 out of 54.0 - (12)
Lear how to play the song : Ala Remsh on Oud,www.udemy.com/course/ala-remsh-english-on-oud/,Ihab Radwan,"¥3,000","¥1,270",Rating: 5.0 out of 55.0 - (3)
A Quick Audacity Audio Editing Tutorial - Audacity Tutorial,www.udemy.com/course/quick-audacity-audio-editing-tutorial/,Ricky Wahowa,"¥3,000","¥1,270",Rating: 4.0 out of 54.0 - (3)
Rhythm to Rock Drum Lessons,www.udemy.com/course/drum-lesson-1-quarter-notes/,Thomas Nelson,"₩22,000","₩13,200",Rating: 3.8 out of 53.8 - (4)
Piano Theory,www.udemy.com/course/piano-theory/,Starling Jones Jr,"₩22,000","₩13,200",Rating: 4.7 out of 54.7 - (4)
How To Make A Record,www.udemy.com/course/howtomakearecord/,Cheryl B. Engelhardt,"₩55,000","₩13,200",Rating: 4.3 out of 54.3 - (7)
How To Remix a Song in Eight Easy Steps,www.udemy.com/course/how-to-make-a-remix-in-eight-easy-steps/,Colin Warn,"₩104,500","₩13,200",Rating: 3.2 out of 53.2 - (6)
FL Studio Hardstyle Production - Gated Kick and tips/tricks,www.udemy.com/course/fl-studio-hardstyle-production-gated-kick-and-tipstricks/,Kim Marcel Friedrich,"₩33,000","₩13,200",Rating: 4.0 out of 54.0 - (1)
MUSIC kNOW! - Phase 1 (Science and Art through Guitar),www.udemy.com/course/music-know-phase-1-science-and-art-through-guitar/,Bruno H. R. Tonelli,"₩27,500","₩13,200",Rating: 0.0 out of 50.0 - (0)
"Rapidly Learn & Master Acoustic Guitar, Classic Fingerstyle",www.udemy.com/course/learn-acoustic-guitar-beginners-course/,"Milan Mitic, Alex Davidovic","₩33,000","₩13,200",Rating: 3.7 out of 53.7 - (4)
"Improvise Puccini´s ""E Lucevan le Stelle"" on Piano",www.udemy.com/course/compose-and-improvise-through-puccini/,Peter Janzen,"₩22,000","₩13,200",Rating: 4.6 out of 54.6 - (6)
Christmas Songs on the Guitar Course - Merry Christmas!,www.udemy.com/course/christmas-songs-on-the-guitar-easy/,Lesson Pros,"₩220,000","₩13,200",Rating: 5.0 out of 55.0 - (5)
The Art of Augmented - Intermediate Gypsy Jazz Guitar,www.udemy.com/course/guitar-magic-the-art-of-augmented-vol-1/,Alex Simon,"₩71,500","₩13,200",Rating: 4.4 out of 54.4 - (2)
The Art of the Rock Shuffle - Guitarist's Guide,www.udemy.com/course/shuffle-school-101a-the-rock-shuffle-a-primer-for-guitar/,Scott Perry,"₩22,000","₩13,200",Rating: 4.6 out of 54.6 - (9)
Fundementals of Singing - Become a Great Singer,www.udemy.com/course/the-fundementals-of-singing/,Axel Ortiz,"₩55,000","₩13,200",Rating: 4.2 out of 54.2 - (2)
Guitar Barre/Bar Chords Simplified!,www.udemy.com/course/barre-chords-simplified/,Eli Cowling,"₩22,000","₩13,200",Rating: 4.9 out of 54.9 - (2)
Play Gypsy Jazz Rhythm Guitar! Vol. 2 - Gypsy Bossas,www.udemy.com/course/play-gypsy-jazz-rhythm-guitar-gypsy-bossas/,Alex Simon,"₩66,000","₩13,200",Rating: 5.0 out of 55.0 - (2)
How to Release a Professional Beat Tape,www.udemy.com/course/how-to-release-a-professional-beat-tape/,Riley Weller,"₩110,000","₩13,200",Rating: 4.0 out of 54.0 - (2)
'Chords for Carl' piano solo,www.udemy.com/course/chords-for-carl-piano-solo/,Mister Musicarta,0,"₩22,000",Rating: 4.9 out of 54.9 - (5)
Singer's Holistic Voice Warm Up Course,www.udemy.com/course/singers-holistic-voice-warm-up-course/,Elina Laivera,$29.99,$11.99,Rating: 0.0 out of 50.0 - (0)
Playing Piano : Reading and Playing Classical Tunes Vol.I,www.udemy.com/course/piano-playing-beggining-the-journey/,Ilse Lozoya,$49.99,$11.99,Rating: 3.7 out of 53.7 - (10)
Beginner's Ukulele - Pick Basics,www.udemy.com/course/beginners-ukulele-pick-basics/,"Paul Lennon, Amanda Jones",$29.99,$11.99,Rating: 4.4 out of 54.4 - (3)
Blues Guitar Made Simple,www.udemy.com/course/blues-guitar-made-simple/,Private Guitar Class,$19.99,$11.99,Rating: 4.3 out of 54.3 - (7)
Sampling,www.udemy.com/course/sampling/,Jay Picasso,$19.99,$11.99,Rating: 3.0 out of 53.0 - (1)
Music Theory Grade 1,www.udemy.com/course/abrsm-music-theory-grade-1/,Michael Luck,$19.99,$11.99,Rating: 4.6 out of 54.6 - (26)
Piano for the Absolute Beginner,www.udemy.com/course/onlinelessons/,Louis Jones,$59.99,$11.99,Rating: 0.0 out of 50.0 - (0)
How to Use Automation Clips in FL Studio,www.udemy.com/course/how-to-use-automation-clips-in-fl-studio/,Riley Weller,$44.99,$11.99,Rating: 0.0 out of 50.0 - (0)
Play Autumn Leaves' falling notes on piano with no reading!,www.udemy.com/course/autumnleaves/,Anton R. Tajanlangit,$29.99,$11.99,Rating: 3.8 out of 53.8 - (16)
How To Sell More Products At Live Events,www.udemy.com/course/increasesales/,Christopher Greenwood,$99.99,$11.99,Rating: 4.6 out of 54.6 - (9)
Audio editing with Audacity,www.udemy.com/course/audio-editing-with-audacity/,Nicolas Forgue,$29.99,$11.99,Rating: 0.0 out of 50.0 - (0)
"Fingerstyle Guitar - Arranging, Skills, Techniques for ALL",www.udemy.com/course/fingerstyle-guitar-arranging-skills-techniques-for-all/,Harry Cho,$69.99,$11.99,Rating: 1.6 out of 51.6 - (2)
"Ableton Beginners Beat Course, Easily Make This Beat 2",www.udemy.com/course/ableton-beginners-beat-course-easily-make-this-beat-2/,Kevin Altenor,$149.99,$11.99,Rating: 0.0 out of 50.0 - (0)
“Rock It Like The Pros” Build Your Very Own Musical Career,www.udemy.com/course/learn-how-to-compose-your-music-career-in-1-day-or-less/,Frank Hernandez,$19.99,$11.99,Rating: 3.5 out of 53.5 - (1)
Music Theory Made Easy (Lessons 28-32),www.udemy.com/course/music-theory-iii-part-writing-and-analysis/,"David Spondike, Ph.D.",$34.99,$11.99,Rating: 4.4 out of 54.4 - (16)
Let's Django Gypsy Jazz Guitar,www.udemy.com/course/letsdjango/,Rick Payne,$24.99,$11.99,Rating: 3.7 out of 53.7 - (2)
FL Studio Hardstyle Production - Common Hardstyle Kick Tut,www.udemy.com/course/fl-studio-hardstyle-production-common-hardstyle-kick-tut/,Kim Marcel Friedrich,"₩33,000","₩13,200",Rating: 0.0 out of 50.0 - (0)
Be a Musician Through Piano Improvisation. Basics - 24 keys.,www.udemy.com/course/pianoimprovise-everykey/,Tony Chapman,"₩22,000","₩13,200",Rating: 3.9 out of 53.9 - (6)
Filmmaking: How to Shoot A Music Video With Your Cell Phone,www.udemy.com/course/how-to-shoot-a-music-video-with-your-cell-phone/,New York Alt Arts Academy,"₩22,000","₩13,200",Rating: 0.0 out of 50.0 - (0)
