Course,URL,instructor,Price (full),Price (discount),Rank
Pianoforall - Incredible New Way To Learn Piano & Keyboard,www.udemy.com/course/pianoforall-incredible-new-way-to-learn-piano-keyboard/,Robin Hall,$199.99,$11.99,"Rating: 4.7 out of 54.7 - (25,901)"
Complete Guitar System - Beginner to Advanced,www.udemy.com/course/complete-guitar-system-beginner-to-advanced/,Erich Andreas,$199.99,$11.99,"Rating: 4.5 out of 54.5 - (17,776)"
"Music Theory Comprehensive Complete! (Levels 1, 2, & 3)",www.udemy.com/course/music-theory-complete/,Jason Allen,$74.99,$11.99,"Rating: 4.5 out of 54.5 - (9,651)"
BECOME A GREAT SINGER: Your Complete Vocal Training System,www.udemy.com/course/become-a-great-singer-your-complete-vocal-training-system/,Robert Lunte,$199.99,$11.99,"Rating: 4.1 out of 54.1 - (3,820)"
Music Production in Logic Pro X - The Complete Course!,www.udemy.com/course/thecompletelogicprox/,"Tomas George, Christopher Carvalho, Ian Alexander, Digital Music Masters",$194.99,$11.99,"Rating: 4.6 out of 54.6 - (4,698)"
"Music Theory Comprehensive Complete: Part 4, 5, & 6",www.udemy.com/course/music-theory-comprehensive-combined-part-4-5-6/,Jason Allen,$114.99,$11.99,"Rating: 4.6 out of 54.6 - (1,385)"
"Music Theory for Electronic Music COMPLETE: Parts 1, 2, & 3",www.udemy.com/course/music-theory-for-electronic-music-complete-parts-1-2-3/,Jason Allen,$119.99,$11.99,"Rating: 4.6 out of 54.6 - (4,439)"
Music Production in Ableton Live 10 - The Complete Course!,www.udemy.com/course/abletonlive10/,"Tomas George, Digital Music Masters",$194.99,$11.99,"Rating: 4.5 out of 54.5 - (2,019)"
The Professional Guitar Masterclass,www.udemy.com/course/the-professional-guitar-masterclass/,Michael Palmisano,$199.99,$11.99,"Rating: 4.4 out of 54.4 - (4,399)"
Ultimate Beginner Guitar Masterclass (2020 Update),www.udemy.com/course/beginner-guitar-masterclass/,Henry Olsen,$199.99,$11.99,"Rating: 4.6 out of 54.6 - (2,617)"
"Learn to play HARMONICA, the easiest instrument to pick up!",www.udemy.com/course/benhewlettharmonicatuitionultimate-harmonica-course/,Ben Hewlett,$199.99,$11.99,"Rating: 4.4 out of 54.4 - (3,705)"
Music + Audio Production in Logic Pro X - The Complete Guide,www.udemy.com/course/music-production-in-logic-pro-x-course/,Make Pro Music,$199.99,$11.99,"Rating: 4.5 out of 54.5 - (7,861)"
SINGING SIMPLIFIED #1: The Fast-Track to Singing Like a Pro,www.udemy.com/course/singing-simplified/,Steve Glazer,$149.99,$11.99,"Rating: 4.6 out of 54.6 - (1,412)"
FL Studio 20 - Music Production In FL Studio for Mac & PC,www.udemy.com/course/fl-studio/,"Martin Svensson, Music-Prod.com Education",$194.99,$11.99,"Rating: 4.5 out of 54.5 - (1,592)"
Elite Singing Techniques - Phase I,www.udemy.com/course/elite-singing-techniques-phase-1/,Eric Arceneaux,0,$99.99,"Rating: 4.7 out of 54.7 - (2,334)"
"Ultimate Ableton Live 10 COMPLETE: Parts 1, 2, and 3",www.udemy.com/course/ableton-live-10-complete/,Jason Allen,$84.99,$11.99,"Rating: 4.4 out of 54.4 - (1,462)"
"Music Theory Comprehensive Complete: Part 7, 8, & 9",www.udemy.com/course/music-theory-comprehensive-combined-part-7-8-9/,Jason Allen,"¥13,800","¥1,320",Rating: 4.6 out of 54.6 - (278)
Breathing Bootcamp for Singers,www.udemy.com/course/breathing-bootcamp-for-singers/,Eric Arceneaux,0,"¥11,400",Rating: 4.8 out of 54.8 - (318)
How to Become a DJ - Learn How to Start DJing Online Today,www.udemy.com/course/online-dj-course/,Ross Palmer,"¥24,000","¥1,430","Rating: 4.6 out of 54.6 - (2,053)"
Game Music Composition: Make Music For Games From Scratch,www.udemy.com/course/gamemusiccourse/,Karleen Heong,"¥24,000","¥1,430","Rating: 4.6 out of 54.6 - (2,262)"
The Professional Bass Masterclass,www.udemy.com/course/the-professional-bass-masterclass/,Rajiv Narang,"¥24,000","¥1,490","Rating: 4.5 out of 54.5 - (1,356)"
"The Complete EDM Production Course - Produce, Mix & Master",www.udemy.com/course/edm-production/,Fuad Murad,"¥24,000","¥1,430","Rating: 4.5 out of 54.5 - (1,054)"
Learn To Play The Drums,www.udemy.com/course/learndrums/,Billy Baker,"¥10,800","¥1,490","Rating: 4.6 out of 54.6 - (1,040)"
Learn Guitar: Zero to Guitar Fingerpicking in 30 days,www.udemy.com/course/zero-to-guitar-fingerpicking/,Patrick O'Malley,"¥24,000","¥1,320",Rating: 4.5 out of 54.5 - (862)
Learn piano or keyboard from scratch - Complete piano course,www.udemy.com/course/learn-to-play-the-piano-from-scratch/,Martin Cohen,"¥24,000","¥1,320",Rating: 4.6 out of 54.6 - (572)
The Ultimate Piano Chords Course - for Piano & Keyboard,www.udemy.com/course/the-ultimate-piano-chord-course-for-piano-keyboard/,Arthur Bird,"¥12,000","¥1,430",Rating: 4.7 out of 54.7 - (514)
Beginner Violin Course - VIOLIN MASTERY FROM THE BEGINNING.,www.udemy.com/course/beginner-violin-lessons-violin-master-course/,Lesson Pros,"¥24,000","¥1,430",Rating: 4.6 out of 54.6 - (770)
The Complete Piano Course - Master The Piano,www.udemy.com/course/the-complete-piano-course/,Iliya Ryakhovskiy,"¥11,400","¥1,270","Rating: 4.4 out of 54.4 - (1,172)"
Music Composition 1,www.udemy.com/course/music-composition-1/,Jonathan Peters,"¥12,000","¥1,320","Rating: 4.4 out of 54.4 - (1,098)"
Music Composition Bundle: Composition & Film Scoring 1 & 2,www.udemy.com/course/music-composition-bundle-composition-film-scoring/,Jason Allen,"¥16,200","¥1,380",Rating: 4.3 out of 54.3 - (886)
The Complete Mixing Masterclass,www.udemy.com/course/mixing-masterclass/,Jason Allen,"¥9,600","¥1,380",Rating: 4.3 out of 54.3 - (285)
"Music Theory Comprehensive Complete: Part 10, 11, & 12",www.udemy.com/course/music-theory-comprehensive-combined-part-10-11-12/,Jason Allen,"¥12,600","¥1,270",Rating: 4.9 out of 54.9 - (111)
Sound Healing PRO Course: Part 1,www.udemy.com/course/sound-healing-pro-course-part-1/,Medicine of Sound,€199.99,€11.99,Rating: 4.4 out of 54.4 - (164)
"Ultimate Ableton Live 10, COMPLETE: Parts 4, 5, and 6",www.udemy.com/course/ultimate-ableton-live-10-complete-parts-4-5-and-6/,Jason Allen,€84.99,€11.99,Rating: 4.5 out of 54.5 - (320)
Pianoforall - 'Classics By Ear' - Erik Satie,www.udemy.com/course/pianoforall-classics-by-ear-erik-satie/,Robin Hall,€19.99,€11.99,Rating: 4.6 out of 54.6 - (495)
Find your voice of nature (Throat singing),www.udemy.com/course/find-your-voice-of-nature/,Alex Kuular,€199.99,€50.00,Rating: 4.6 out of 54.6 - (209)
Ultimate Beginner Electric Guitar Masterclass (2020 Update),www.udemy.com/course/rock-guitar-masterclass/,Henry Olsen,€199.99,€11.99,Rating: 4.7 out of 54.7 - (749)
Read Music FAST!,www.udemy.com/course/sight-reading/,Benedict Westenra,€19.99,€11.99,"Rating: 4.6 out of 54.6 - (2,228)"
"Drum Programming Masterclass: COMPLETE (Parts 1, 2, and 3)",www.udemy.com/course/drum-programming-masterclass-complete-parts-1-2-and-3/,Jason Allen,€69.99,€11.99,Rating: 4.3 out of 54.3 - (301)
Complete Guide to Maschine Mk3,www.udemy.com/course/complete-guide-to-maschine-mk3/,Rob Jones,€39.99,€11.99,Rating: 4.4 out of 54.4 - (463)
How To Sing #1: Complete Vocal Warm ups & Voice Physiology,www.udemy.com/course/singing-lessons-online/,Roma Waterman,€149.99,€11.99,"Rating: 4.5 out of 54.5 - (2,128)"
Jazz Piano - Ultimate Beginners Course for Piano & Keyboard,www.udemy.com/course/jazz-piano-the-ultimate-beginners-course/,Arthur Bird,€99.99,€11.99,Rating: 4.7 out of 54.7 - (182)
"SINGING SIMPLIFIED #2: Greater Range, Power and Control",www.udemy.com/course/singing-simplified-level-2/,Steve Glazer,€149.99,€11.99,Rating: 4.7 out of 54.7 - (170)
"Music Theory Comprehensive Complete: Parts 13, 14, & 15",www.udemy.com/course/music-theory-comprehensive-parts-13-14-15/,Jason Allen,€109.99,€11.99,Rating: 4.8 out of 54.8 - (24)
"SONGWRITING SIMPLIFIED: Music Theory, Melody & Creativity",www.udemy.com/course/songwriting-simplified/,Steve Glazer,€149.99,€11.99,Rating: 4.6 out of 54.6 - (423)
Complete Ukulele Beginner Course (2020 Update),www.udemy.com/course/complete-ukulele-beginner-course/,Jakob Puchmayr,€114.99,€11.99,Rating: 4.7 out of 54.7 - (407)
Acoustic Guitar System | Melodic Guitar Lessons for Beginner,www.udemy.com/course/acoustic-guitar-system/,Marco Cirillo,€39.99,€11.99,Rating: 4.7 out of 54.7 - (355)
Rock Singing | Complete Voice Training,www.udemy.com/course/rock-singing/,"Draven Grey, Robert Lunte",€199.99,€11.99,Rating: 4.5 out of 54.5 - (64)
Music Composition 2,www.udemy.com/course/music-composition-2/,Jonathan Peters,$99.99,$11.99,Rating: 4.6 out of 54.6 - (326)
Phase 2 - Becoming A Natural Singer ,www.udemy.com/course/phase-2-becoming-a-natural-singer/,"Eric Arceneaux, Jared Latchford, Mike Bryant, LEORA NOSKO",0,$99.99,Rating: 4.9 out of 54.9 - (407)
Music Theory for Electronic Producers - The Complete Course!,www.udemy.com/course/electronicmusictheory/,"Tomas George, Digital Music Masters",$194.99,$11.99,Rating: 4.6 out of 54.6 - (800)
Ableton Push - Workflow and Production,www.udemy.com/course/ableton-push-workflow-and-production/,Mitch Lee,$94.99,$11.99,Rating: 4.5 out of 54.5 - (663)
Sound Healing Pro Course: Part 2,www.udemy.com/course/sound-healing-pro-course-part-2/,Medicine of Sound,$199.99,$11.99,Rating: 4.9 out of 54.9 - (39)
Practical Music Theory 101 For Guitar,www.udemy.com/course/music-theory-101-for-guitar/,Henry Olsen,$199.99,$11.99,Rating: 4.5 out of 54.5 - (231)
The Basics Of Pro Songwriting,www.udemy.com/course/the-basics-of-pro-songwriting/,Tom Worth,$49.99,$11.99,Rating: 4.6 out of 54.6 - (828)
Piano Fastlane -  From ZERO to HERO with Piano & Keyboard,www.udemy.com/course/piano-fastlane/,Simon Kirkils,$199.99,$11.99,Rating: 4.6 out of 54.6 - (546)
The Ukulele Academy: Play Music Today!,www.udemy.com/course/the-ukulele-academy/,Andrew J. Smith,$119.99,$11.99,Rating: 4.5 out of 54.5 - (506)
Learn to Play Saxophone: Beginner to Pro in Under Four Hours,www.udemy.com/course/saxophone-a-beginners-guide/,MusicProfessor Online Music Lessons,$49.99,$11.99,Rating: 4.4 out of 54.4 - (864)
The Complete Piano & Music Theory Beginners Course,www.udemy.com/course/piano-lessons-music-theory-beginners-course/,Musicians Inspired,$99.99,$11.99,"Rating: 4.4 out of 54.4 - (1,496)"
Songwriting & Music Production In GarageBand- A Total Guide!,www.udemy.com/course/songwriting-music-production-in-garageband-a-total-guide/,Dean Davis,$199.99,$11.99,Rating: 4.4 out of 54.4 - (865)
Music Composition with the Piano: Ultimate Keyboard Theory,www.udemy.com/course/piano-keyboard-music-composition/,Jack Vaughan,$49.99,$11.99,Rating: 4.7 out of 54.7 - (388)
Orchestration 1: Compose Orchestral Music for Strings,www.udemy.com/course/orchestrationcourse/,Karleen Heong,$199.99,$11.99,Rating: 4.7 out of 54.7 - (647)
Intermediate Guitar Fingerpicking,www.udemy.com/course/intermediate-guitar-fingerpicking/,Patrick O'Malley,$199.99,$11.99,Rating: 4.5 out of 54.5 - (131)
How to play Piano - Go from a Beginner/Intermediate to a Pro,www.udemy.com/course/how-to-play-piano-go-from-a-beginnerintermediate-to-a-pro/,Oluwayanmife (Also Known as Yummy) Akintola,$199.99,$11.99,Rating: 4.2 out of 54.2 - (679)
30 day challenge - learn to play the harmonica in one month!,www.udemy.com/course/30-day-challenge-learn-to-play-the-harmonica-in-one-month/,Ben Hewlett,"₩82,500","₩13,200",Rating: 4.4 out of 54.4 - (431)
"Learn How To Freestyle Rap, Rap Like A Pro, And Write Lyrics",www.udemy.com/course/how-to-freestyle-rap/,Pat Parra,"₩214,500","₩53,625",Rating: 4.9 out of 54.9 - (262)
Music Producer Masterclass: Make Electronic Music,www.udemy.com/course/music-producer-masterclass/,Chester Sky,"₩220,000","₩13,200",Rating: 4.5 out of 54.5 - (606)
Music Production I - Learn to be a Music Producer!,www.udemy.com/course/music-production/,Mitch Houston,"₩220,000","₩13,200","Rating: 4.6 out of 54.6 - (1,023)"
Extreme Singing: Grit & Screaming,www.udemy.com/course/extreme-singing/,"Draven Grey, Robert Lunte","₩165,000","₩13,200",Rating: 4.5 out of 54.5 - (245)
Orchestration,www.udemy.com/course/orchestration/,Jonathan Peters,"₩165,000","₩13,200",Rating: 4.4 out of 54.4 - (326)
Learn Compression & Dynamics Processing: The Complete Guide!,www.udemy.com/course/compression/,"Signature Sound, Ian Sutton","₩110,000","₩13,200",Rating: 4.7 out of 54.7 - (586)
"Acoustic Guitar Redefined. Learn Chords, Rhythm and Melody!",www.udemy.com/course/acoustic-guitar-redefined/,Marco Cirillo,"₩44,000","₩13,200",Rating: 4.3 out of 54.3 - (346)
Ultimate Live Sound School (1st Edition),www.udemy.com/course/ultimate-live-sound-school-1st-edition/,David Wills,"₩165,000","₩13,200",Rating: 4.4 out of 54.4 - (550)
Mixing & Mastering with Presonus Studio One✅,www.udemy.com/course/mixing-mastering-with-presonus-studio-one/,Gary Hiebner,"₩176,000","₩13,200",Rating: 4.5 out of 54.5 - (251)
StichMethod Blues Master Class Part 1.,www.udemy.com/course/stichmethod-blues-master-class-part-1/,Ian Stich,0,"₩49,500",Rating: 4.9 out of 54.9 - (795)
How To Sing  #2: Increase Vocal Range & Blend Registers,www.udemy.com/course/how-to-sing-increase-vocal-range-blend-registers-agility/,Roma Waterman,"₩165,000","₩13,200",Rating: 4.2 out of 54.2 - (467)
Song Science #1: How Pros Use 6 Chords to Write Hit Songs,www.udemy.com/course/songtheory1/,Musicians Inspired,"₩55,000","₩13,200","Rating: 4.6 out of 54.6 - (1,062)"
Fingerstyle Guitar STEP BY STEP: Learn Songs & Arrangements,www.udemy.com/course/fingerstyle-guitar-step-by-step/,Nir Mehlman,"₩220,000","₩13,200",Rating: 4.4 out of 54.4 - (256)
Song Science #2: The Complete Songwriting Chord Guide,www.udemy.com/course/songtheory2/,Musicians Inspired,"₩110,000","₩13,200",Rating: 4.7 out of 54.7 - (691)
Mixing & Mastering Electronic Dance Music (EDM),www.udemy.com/course/mixing-mastering-edm/,Fuad Murad,"₩104,500","₩13,200",Rating: 4.5 out of 54.5 - (512)
How to Make a Mixtape - Make a Seamless DJ Mix in Ableton,www.udemy.com/course/make-a-mixtape-ableton/,Ross Palmer,$149.99,$11.99,Rating: 4.7 out of 54.7 - (345)
"Ultimate Ableton Live 9 COMPLETE: Parts 1, 2, & 3",www.udemy.com/course/ultimate-ableton-live-complete/,Jason Allen,$99.99,$11.99,"Rating: 4.5 out of 54.5 - (2,814)"
Be a Voice Actor: Making a Living with Your Voice,www.udemy.com/course/beavoiceactor/,Laci Morgan,$149.99,$11.99,Rating: 4.4 out of 54.4 - (478)
Piano for Singer/Songwriters | Write Songs and Perform Live!,www.udemy.com/course/pianoforsingersongwriters/,Musicians Inspired,$99.99,$11.99,Rating: 4.7 out of 54.7 - (698)
Blues Piano Lessons! A Course In Blues Piano & Improvisation,www.udemy.com/course/blues-piano-improvisation-amaze-yourself/,Arthur Bird,$49.99,$11.99,Rating: 4.7 out of 54.7 - (288)
Master Guitar In 90 Days: Step-By-Step Lessons For Beginners,www.udemy.com/course/rockstar-guitar-90-day-challenge/,Music Matchr,$199.99,$11.99,Rating: 4.2 out of 54.2 - (591)
Pure Pentatonic Power: Rock and Blues Lead Guitar Course,www.udemy.com/course/pure-pentatonic-power-a-masterclass-in-rock-and-blues/,Guitar Joolz,$99.99,$11.99,Rating: 4.4 out of 54.4 - (198)
Comprehensive Mixing Guide - Music Production in Logic Pro X,www.udemy.com/course/logic-pro-x-mixing-course/,"Tomas George, Ian Alexander, Digital Music Masters",$194.99,$11.99,Rating: 4.5 out of 54.5 - (64)
How to Solo Like a Pro on Guitar,www.udemy.com/course/how-to-solo-like-a-pro-on-guitar/,"Sean Daniel, Dovydas Music",0,$69.99,Rating: 4.4 out of 54.4 - (23)
Beginner Piano,www.udemy.com/course/beginner-piano/,Benedict Westenra,$29.99,$11.99,Rating: 4.7 out of 54.7 - (530)
COMPLETE Guitar Fretboard Mastery,www.udemy.com/course/complete-guitar-fretboard-mastery/,"Sean Daniel, Justin Mitchell",0,$34.99,Rating: 4.2 out of 54.2 - (79)
Learn How to Improvise on Guitar in 30 Days,www.udemy.com/course/learn-how-to-improvise-on-guitar/,Filippo Dall'Asta,$199.99,$11.99,Rating: 4.6 out of 54.6 - (490)
Music Production with Presonus Studio One ✅,www.udemy.com/course/produce-your-first-song-in-studio-one/,Gary Hiebner,$49.99,$11.99,Rating: 4.5 out of 54.5 - (569)
Learn How to Make Electronic Music with Cubase,www.udemy.com/course/jumpstart-your-music-production-career-with-cubase/,Max Porcelli,$59.99,$11.99,Rating: 4.5 out of 54.5 - (461)
Music Production in Logic Pro X : Digital Audio Mastering,www.udemy.com/course/mastering/,"Tomas George, Christopher Carvalho, Digital Music Masters",$194.99,$11.99,Rating: 4.4 out of 54.4 - (307)
"Film, TV, & Video Game Music Composition + Production Basics",www.udemy.com/course/film-tv-video-game-music-composition-production/,Steven Melin,$199.99,$11.99,Rating: 4.5 out of 54.5 - (538)
"Songwriting 101- Composition, Lyrics + Music Production",www.udemy.com/course/songwriting-and-music-composition-course/,"Tomas George, Peter Darling, Digital Music Masters",$194.99,$11.39,Rating: 4.2 out of 54.2 - (135)
Flamenco Guitar,www.udemy.com/course/flamenco-guitar-a/,R. Collomb,$34.99,$11.39,Rating: 4.4 out of 54.4 - (297)
Sound Design 102: Using Synthesis for Music Production,www.udemy.com/course/sound-design-fundamentals-synthesis/,Jason Allen,$39.99,$11.99,Rating: 4.6 out of 54.6 - (571)
Music Theory,www.udemy.com/course/musictheory/,Jonathan Peters,$99.99,$11.39,Rating: 4.5 out of 54.5 - (341)
Learn to Play the Flute: Beginner Basics to Intermediate,www.udemy.com/course/beginnerflute/,MusicProfessor Online Music Lessons,$49.99,$11.39,Rating: 4.7 out of 54.7 - (755)
Read Music FAST! Part 2: intervals & key signatures,www.udemy.com/course/key-signatures/,Benedict Westenra,$29.99,$11.39,Rating: 4.9 out of 54.9 - (348)
RelationShapes: Complete Guitar Scales Learning System,www.udemy.com/course/relationshapes/,Trey Xavier,0,$49.99,Rating: 4.5 out of 54.5 - (453)
The Heavenly Piano Masterclass - Piano Improvisation Mastery,www.udemy.com/course/heavenlypianomasterclass/,Mark Shian,$99.99,$11.99,Rating: 4.5 out of 54.5 - (88)
101 Blues riffs - learn how the harmonica superstars do it!,www.udemy.com/course/play-harmonica-riffs-like-the-blues-harp-superstars-part-1/,Ben Hewlett,$199.99,$12.59,Rating: 4.5 out of 54.5 - (185)
STRUMMING SIMPLIFIED: 51 Guitar Rhythms For All Styles!,www.udemy.com/course/strumming-simplified-1/,Steve Glazer,$124.99,$11.39,Rating: 4.7 out of 54.7 - (128)
Classical Guitar Essentials - The Basics Part 1,www.udemy.com/course/classical-guitar-essentials-the-basics-part1/,Hani Gamal,$64.99,$11.39,Rating: 4.7 out of 54.7 - (487)
Music Production in Studio One - Learn Presonus Studio One 4,www.udemy.com/course/studio-one-music-production-course/,"Tomas George, Ian Alexander, Digital Music Masters",$194.99,$11.39,Rating: 4.5 out of 54.5 - (76)
GarageBand Masterclass: GarageBand for Music Production,www.udemy.com/course/garageband-course/,"Jeremy Deighan, Concept Courses ⁯⁯⁯⁯⁯",$199.99,$11.99,Rating: 4.5 out of 54.5 - (529)
Beginner Mandolin Course MANDOLIN MASTERY FROM THE BEGINNING,www.udemy.com/course/beginner-mandolin-course-mandolin-mastery-from-the-beginning/,Lesson Pros,$199.99,$11.99,Rating: 4.5 out of 54.5 - (84)
Jazz for the Curious Guitarist,www.udemy.com/course/jazz-for-the-curious-guitarist/,Dan Dresnok,$199.99,$11.99,Rating: 4.6 out of 54.6 - (285)
Harmonica Jamz: Play Any Song and JAM with Friends,www.udemy.com/course/harmonicajamz/,Cooper - Guitar Songs Masters,$199.99,$11.39,Rating: 4.5 out of 54.5 - (130)
Songwriting in Logic Pro X for Electronic Music Production,www.udemy.com/course/songwritinglogicpro/,"Tomas George, Digital Music Masters","₩214,500","₩13,200",Rating: 4.4 out of 54.4 - (236)
How to Compose Epic Music,www.udemy.com/course/how-to-compose-epic-music/,Mikael Baggström,"₩82,500","₩13,200",Rating: 4.6 out of 54.6 - (25)
"Making DJ Edits, Mashups & Remixes in Ableton",www.udemy.com/course/making-dj-edits-mashups-remixes-in-ableton/,Richie Atkins,"₩88,000","₩13,200",Rating: 4.8 out of 54.8 - (46)
Soundtrack Composer Masterclass: Score Films and Video Games,www.udemy.com/course/soundtrack-composer-masterclass/,Chester Sky,"₩220,000","₩13,200",Rating: 4.5 out of 54.5 - (186)
Orchestration 2: Compose Orchestral Music for Woodwinds,www.udemy.com/course/orchestrationcourse2/,Karleen Heong,"₩220,000","₩13,200",Rating: 4.8 out of 54.8 - (27)
Learn to Play the Trumpet: Beginner to Pro Made the Easy Way,www.udemy.com/course/trumpet-a-beginners-guide/,MusicProfessor Online Music Lessons,"₩55,000","₩13,200",Rating: 4.4 out of 54.4 - (648)
Piano Chords,www.udemy.com/course/piano-chords/,Benedict Westenra,"₩44,000","₩13,200",Rating: 4.6 out of 54.6 - (386)
"How to Make a Mashup, Remix & Edit for DJing using Ableton",www.udemy.com/course/how-to-make-a-mashup/,Ross Palmer,"₩165,000","₩13,200",Rating: 4.6 out of 54.6 - (37)
The Complete Jazz Theory Course - Jazz Chords/Scales &  More,www.udemy.com/course/complete-jazz-theory-course-jazz-chords-scales/,Martin Cohen,"₩110,000","₩13,200",Rating: 4.4 out of 54.4 - (147)
How to Compose Ambient Music,www.udemy.com/course/ambient-music-composition/,Mikael Baggström,"₩82,500","₩13,200",Rating: 4.5 out of 54.5 - (62)
Music Production in Logic Pro X : Mixing Vocals,www.udemy.com/course/logic-pro-x-mixing/,"Tomas George, Christopher Carvalho, Digital Music Masters","₩214,500","₩13,200",Rating: 4.5 out of 54.5 - (204)
Bass Guitar Lessons For Beginners,www.udemy.com/course/the-music-coach-online-bass-guitar-lesson-program/,Todd Porter,"₩104,500","₩13,200",Rating: 4.3 out of 54.3 - (281)
Mixing EDM Vocals:  Create Professional Vocal Tracks,www.udemy.com/course/mixing-edm-vocals/,Fuad Murad,"₩77,000","₩13,200",Rating: 4.6 out of 54.6 - (84)
FL Studio 20 Workflow - Learn How To Work Fast in FL Studio,www.udemy.com/course/fl-studio-workflow/,"Martin Svensson, Music-Prod.com Education","₩214,500","₩13,200",Rating: 4.5 out of 54.5 - (110)
Avid Pro Tools 12 Fundamentals,www.udemy.com/course/avid-pro-tools-12-fundamentals/,Infinite Skills,"₩55,000","₩13,200",Rating: 4.4 out of 54.4 - (443)
The Note Reading Bootcamp - Read Music Fast!,www.udemy.com/course/reading-music-notes/,Musicians Inspired,"₩110,000","₩13,200",Rating: 4.6 out of 54.6 - (303)
How to Jam on Guitar with Confidence!,www.udemy.com/course/how-to-jam-on-guitar-with-confidence/,"Sean Daniel, Ian Stich",0,€34.99,Rating: 4.6 out of 54.6 - (240)
Beginners Guitar Lessons | The Essential Acoustic Course,www.udemy.com/course/beginners-guitar-lessons-the-essential-acoustic-course/,Your Guitar Academy,€19.99,€11.99,Rating: 4.8 out of 54.8 - (242)
Artist Management for the Music Business,www.udemy.com/course/artist-management-for-the-music-business/,Christopher Palmer,€99.99,€25.00,Rating: 4.6 out of 54.6 - (170)
Audio Mastering: the complete guide,www.udemy.com/course/audio-mastering-the-complete-guide-i/,Marco Galvan,€94.99,€11.99,Rating: 4.4 out of 54.4 - (209)
Learn to Play Clarinet: Beginner to Pro in Under Five Hours,www.udemy.com/course/clarinet-a-beginners-guide/,MusicProfessor Online Music Lessons,€49.99,€11.99,Rating: 4.6 out of 54.6 - (503)
Music Production in FL Studio 20 - FL Studio Essentials!,www.udemy.com/course/fl-studio-music-production-course/,"Tomas George, Ian Alexander, Digital Music Masters",€194.99,€11.99,Rating: 4.4 out of 54.4 - (55)
Mixing Music - Learn how to mix a Pop Rock Song like a Pro!,www.udemy.com/course/in-depth-mixing-poprock/,"Signature Sound, Ian Sutton",€84.99,€11.99,Rating: 4.4 out of 54.4 - (205)
QUICKLY Become a Jazz Chords Master (Guitar),www.udemy.com/course/jazz-chords-master/,Cooper - Guitar Songs Masters,€79.99,€11.99,Rating: 4.5 out of 54.5 - (26)
Play YOUR Favorite Songs: The Guitar Super-Course,www.udemy.com/course/guitar-super-course/,Cooper - Guitar Songs Masters,€199.99,€11.99,Rating: 4.4 out of 54.4 - (276)
Advanced Acoustic Guitar Fingerpicking,www.udemy.com/course/advanced-acoustic-guitar-fingerpicking/,Patrick O'Malley,€199.99,€11.99,Rating: 4.7 out of 54.7 - (27)
Guitar Lessons for the Curious Guitarist,www.udemy.com/course/guitar-lessons-for-the-curious-guitarist/,Dan Dresnok,€199.99,€11.99,Rating: 4.6 out of 54.6 - (223)
The Ultimate Guide to Logic Pro X Instrument Plugins & VSTs,www.udemy.com/course/logic-pro-instruments-course/,Jack Vaughan,€49.99,€11.99,Rating: 4.7 out of 54.7 - (165)
Learn how to DJ From The Wu-Tang Clan,www.udemy.com/course/learn-how-to-dj-from-the-wu-tang-clan/,Dj Symphony Wu-Tang Clan,€99.99,€11.99,Rating: 4.7 out of 54.7 - (163)
Vocal Warmups for Great Technique,www.udemy.com/course/vocal-warmups-for-great-technique/,Robert Lischetti,€199.99,€11.99,Rating: 4.7 out of 54.7 - (357)
Fun Beginner Ukulele Course,www.udemy.com/course/beginner-ukulele/,Henry Olsen,€54.99,€11.99,Rating: 4.7 out of 54.7 - (242)
Logic Pro X Manual 101 - Complete Logic Pro X Masterclass,www.udemy.com/course/logic-pro-x-manual-101-complete-masterclass/,"Martin Svensson, Music-Prod.com Education",€194.99,€11.99,Rating: 4.7 out of 54.7 - (323)
Adventures in Classical Music—Music Appreciation for All!,www.udemy.com/course/adventures-in-classical-music/,William Neely,€199.99,€10.99,Rating: 4.4 out of 54.4 - (526)
Complete Audio Production Course: Record & Mix Better Audio,www.udemy.com/course/audio-production-course/,"Video School Online Inc, Phil Ebiner, Tomas George, Digital Music Masters",€199.99,€10.99,Rating: 4.4 out of 54.4 - (110)
Music Production II - Music Production Workflow - COMPLETE!!,www.udemy.com/course/music-production-ii-recording-complete-course/,Mitch Houston,€194.99,€10.99,Rating: 4.6 out of 54.6 - (210)
Sound Design 101: Using Sampling for Music Production,www.udemy.com/course/sound-design-fundamentals-sampling/,Jason Allen,€39.99,€10.99,Rating: 4.5 out of 54.5 - (175)
Learn Jazz Piano Today,www.udemy.com/course/learn-jazz-piano-with-willie-today/,Willie Myette,€49.99,€10.99,Rating: 4.4 out of 54.4 - (331)
Pure Rock Guitar. Play Guitar Like the Gods of Rock 2019/20,www.udemy.com/course/pure-rock-guitar-play-like-the-gods-of-rock/,Guitar Joolz,€99.99,€10.99,Rating: 4.8 out of 54.8 - (44)
