Course,URL,instructor,Price (full),Price (discount),Rank
Gypsy Jazz / Jazz Manouche Rhythm Guitar Fundamentals,www.udemy.com/course/gypsy-jazz-rhythm-guitar-course/,Harry Edwards,£149.99,£10.99,Rating: 4.6 out of 54.6 - (8)
How to Design Your Own Guitar,www.udemy.com/course/how-to-design-your-own-guitar/,Mark Bailey,0,"₩88,000",Rating: 4.7 out of 54.7 - (43)
Recording Vocals the Right Way,www.udemy.com/course/recording-vocals-the-right-way/,"Matt Hayes, Wyatt Oates","₩49,500","₩13,200",Rating: 4.2 out of 54.2 - (86)
Spirit Drum Lessons For Beginners - The Music Coach,www.udemy.com/course/the-music-coach-online-spirit-drum-course-i/,Tanya Porter,0,"₩104,500",Rating: 4.1 out of 54.1 - (3)
Play Songs on the Piano FLUENTLY: Smooth Chord Changes,www.udemy.com/course/fluent-piano-songs/,Cooper - Guitar Songs Masters,"₩66,000","₩13,200",Rating: 4.1 out of 54.1 - (48)
Pro Tools - Quick Start,www.udemy.com/course/protoolsquickstart/,Pulsating Waves,"₩33,000","₩13,200",Rating: 4.0 out of 54.0 - (50)
HARMONICA mastery - Learning the Basic 12 Bar Blues Bassline,www.udemy.com/course/instant-harmonica-learning-the-basic-12-bar-blues-bassline/,Ben Hewlett,"₩82,500","₩13,200",Rating: 4.6 out of 54.6 - (24)
"Flute Solos: Learn how to Perform Three Fun, Unique Pieces",www.udemy.com/course/flute-solos/,MusicProfessor Online Music Lessons,"₩55,000","₩13,200",Rating: 4.7 out of 54.7 - (15)
Sylenth Synthesizer - Audio Production Synthesis Course,www.udemy.com/course/sylenth-synthesizer-audio-production-synthesis-course/,"Martin Svensson, Music-Prod.com Education","₩214,500","₩13,200",Rating: 4.6 out of 54.6 - (38)
Piano for Singers: Quickly Learn to Accompany Yourself,www.udemy.com/course/piano-for-singers-quickly-learn-to-accompany-yourself/,Eve Williams MMus,"₩44,000","₩13,200",Rating: 4.0 out of 54.0 - (11)
Music Theory: Read and feel musical rhythms like a pro,www.udemy.com/course/read-and-feel-musical-rhythms-like-a-pro/,Alexandra Belibou,"₩33,000","₩13,200",Rating: 4.6 out of 54.6 - (19)
Master Class # 11:  Play Piano Techniques Learn Piano 1 to10,www.udemy.com/course/learn-piano-11-play-piano-techniques-master-class-1-to10/,Rosa Suen,"₩220,000","₩13,200",Rating: 4.4 out of 54.4 - (16)
Create Arrangements from Lead Sheets and Fakebooks.,www.udemy.com/course/my-romance/,Willie Myette,"₩44,000","₩13,200",Rating: 4.9 out of 54.9 - (22)
Padshop 2 Quickstart,www.udemy.com/course/padshop-2-quickstart/,Paul Marx,0,"₩22,000",Rating: 4.4 out of 54.4 - (3)
Beginner Flute Instruction,www.udemy.com/course/beginner-flute-instruction/,Angela McBrearty,"₩110,000","₩13,200",Rating: 4.5 out of 54.5 - (36)
Make Music Videos With Your Phone- Part 1,www.udemy.com/course/make-music-videos-with-your-phone-part-1/,"Dean Davis, Blake Schulze Photography","₩110,000","₩13,200",Rating: 4.6 out of 54.6 - (19)
Alternate Picking Speed & Accuracy,www.udemy.com/course/alternate-picking-speed-accuracy/,Adam Saunders,"₩22,000","₩13,200",Rating: 4.6 out of 54.6 - (57)
Ableton Live - DJ Mixtape & Podcasts in Ableton Live Course,www.udemy.com/course/how-to-make-a-dj-mixtape-in-ableton-step-by-step-course/,"Martin Svensson, Music-Prod.com Education","₩214,500","₩13,200",Rating: 4.5 out of 54.5 - (67)
Simple easy Harmonica tuition for tone-deaf musical newbies!,www.udemy.com/course/simple-easy-harmonica-tuition-for-tone-deaf-musical-newbies/,Ben Hewlett,"₩82,500","₩13,200",Rating: 5.0 out of 55.0 - (1)
History of Rock Music I - From the Early Blues to the 1960s,www.udemy.com/course/history-of-rock-music-i-from-the-early-blues-to-the-1960s/,Vasilis Kallis,"₩66,000","₩13,200",Rating: 4.9 out of 54.9 - (13)
Audacity for Podcasting - Master's Level,www.udemy.com/course/afpmasters/,Carey Green,"₩33,000","₩13,200",Rating: 4.4 out of 54.4 - (34)
How To Write a Rap Song,www.udemy.com/course/how-to-write-a-rap-song/,Christopher Greenwood,"₩110,000","₩13,200",Rating: 4.5 out of 54.5 - (2)
Logic Pro X Training for Music Producers,www.udemy.com/course/the-logic-pro-bootcamp-level-1/,Sal A.,"₩22,000","₩13,200",Rating: 4.2 out of 54.2 - (268)
Learn Old School Authentic Blues Lead & Rhythm guitar,www.udemy.com/course/learn-old-school-authentic-blues-lead-rhythm-guitar/,David Taub,"₩33,000","₩13,200",Rating: 4.4 out of 54.4 - (4)
DJ Course Pioneer DDJ 400 Learn From The Dutch!,www.udemy.com/course/dj-course-pioneer-ddj-400-learn-from-the-dutch/,United DJ School,"₩27,500","₩13,200",Rating: 3.4 out of 53.4 - (2)
The Musicarta Pentatonics Workbook,www.udemy.com/course/the-musicarta-pentatonics-workbook/,Mister Musicarta,"₩33,000","₩22,000",Rating: 4.8 out of 54.8 - (6)
Music Theory ABRSM Grade 2 Complete,www.udemy.com/course/music-theory-abrsm-grade-2/,Victoria Williams LmusTCL BA(Mus),"₩110,000","₩13,200",Rating: 4.8 out of 54.8 - (39)
Grain Sample Manipulator - Propellerhead Reason,www.udemy.com/course/grain-sample-manipulator-propellerhead-reason/,Dean Krain,"₩55,000","₩13,200",Rating: 4.1 out of 54.1 - (14)
Ultimate Bass Technique Workout,www.udemy.com/course/ultimate-bass-technique-workout/,Bogdan Radovic,"₩55,000","₩13,200",Rating: 4.4 out of 54.4 - (21)
Learn how to Create Great Songs in GarageBand for iPad,www.udemy.com/course/learn-how-to-create-great-songs-in-garageband-for-ipad/,Phil Heeley,"₩49,500","₩13,200",Rating: 4.5 out of 54.5 - (39)
Learn to Play Percussion: Beginner to Pro made the Easy Way!,www.udemy.com/course/percussion/,MusicProfessor Online Music Lessons,"₩55,000","₩13,200",Rating: 4.2 out of 54.2 - (24)
"Advanced Rich Piano Chords with Tritones, Quartals and UST's",www.udemy.com/course/piano-with-willie-tritones-phat-chords/,Willie Myette,"₩44,000","₩13,200",Rating: 4.9 out of 54.9 - (14)
How to Become a Voice Actor and More!,www.udemy.com/course/the-official-diy-guide-to-voice-acting/,Donald Fittsgill Jr.,"₩22,000","₩13,200",Rating: 4.2 out of 54.2 - (42)
Piano Technique Exercises Vol.1,www.udemy.com/course/piano-skills-improve-your-piano-technique/,Ilse Lozoya,"₩55,000","₩13,200",Rating: 4.1 out of 54.1 - (25)
THUMBS UP KIDS GUITAR - For children AND adults!,www.udemy.com/course/thumbs-up-kids-guitar-for-children-and-adults/,Lindsay Ginn,"₩148,500","₩13,200",Rating: 4.1 out of 54.1 - (9)
FL Studio Hardstyle Production How to make a Hardstyle Kick,www.udemy.com/course/how-to-make-a-hardstyle-kick/,Kim Marcel Friedrich,"₩33,000","₩13,200",Rating: 4.0 out of 54.0 - (10)
Writing Bass Lines,www.udemy.com/course/writing-bass-lines/,Lutz Academy,"₩55,000","₩13,200",Rating: 4.6 out of 54.6 - (6)
DJ Techniques With Ableton Live: The Clear and Simple Guide,www.udemy.com/course/how-to-dj/,Jason Allen,"₩33,000","₩13,200",Rating: 3.7 out of 53.7 - (29)
"Learn Piano Today: How to Play Blues, Rock & Boogie Keyboard",www.udemy.com/course/learn-how-to-play-blues-rock-boogie-woogie-piano-today/,David Brogan M.Mus.,"₩110,000","₩13,200",Rating: 4.4 out of 54.4 - (26)
Essential Theory and Technique for Guitar,www.udemy.com/course/essential-theory-and-technique-for-guitar/,Troy Davidson (Studio33Guitar),"₩22,000","₩13,200",Rating: 4.5 out of 54.5 - (300)
Tascam DP-24 (DP-32) DVD Tutorial,www.udemy.com/course/tascam-dp-24-dp-32-dvd-tutorial/,David Wills,"₩33,000","₩13,200",Rating: 4.4 out of 54.4 - (29)
Learn to Play the Tuba: Beginner to Pro in Under Five Hours!,www.udemy.com/course/beginner-tuba/,MusicProfessor Online Music Lessons,"₩55,000","₩13,200",Rating: 4.6 out of 54.6 - (66)
Guitar Lessons for Beginner Guitar Players,www.udemy.com/course/key-to-success-beginner-guitar-course/,Justin Hazel,"₩115,500","₩13,200",Rating: 4.3 out of 54.3 - (20)
"Acoustic, Analog and Digital Signals Explained",www.udemy.com/course/acoustics-analog-and-digital-fundamentals-for-everyone/,Max Porcelli,"₩22,000","₩13,200",Rating: 4.3 out of 54.3 - (32)
True Finger Independence - Become a Guitar Master,www.udemy.com/course/true-finger-independence/,Lucas Cesar de Oliveira Imbiriba,0,"₩88,000",Rating: 5.0 out of 55.0 - (1)
Earning an Income Online: The Fiverr Edition,www.udemy.com/course/earning-an-income-online-with-cubase-the-fiverr-edition/,Federico Soler Fernández,"₩82,500","₩13,200",Rating: 4.8 out of 54.8 - (14)
Music Production: Improve Your Sound,www.udemy.com/course/learn-how-to-make-banging-beats-with-no-experience/,Joseph Evans,"₩220,000","₩13,200",Rating: 4.2 out of 54.2 - (139)
Music Theory Comprehensive: Part 14: The Fugue and Invention,www.udemy.com/course/music-theory-comprehensive-part-14-the-fugue-and-invention/,Jason Allen,"₩44,000","₩13,200",Rating: 3.9 out of 53.9 - (19)
Audio Engineering: Adjectives of Audio,www.udemy.com/course/audio-engineering-adjectives-of-audio/,"Christopher ""Czar"" Smith","₩55,000","₩13,200",Rating: 4.2 out of 54.2 - (15)
Learn to play the Bouzouki - Greek Bouzouki Lessons,www.udemy.com/course/greek-bouzouki-lessons/,Yossi Aharon,"₩82,500","₩13,200",Rating: 3.9 out of 53.9 - (42)
How To Play Guitar: 3 Minutes Daily Lessons,www.udemy.com/course/how-to-play-guitar-3-minutes-daily-lessons/,Jason Allen,"₩27,500","₩13,200",Rating: 4.7 out of 54.7 - (14)
From Silence to Sound: Composing for Film & Commercials,www.udemy.com/course/from-silence-to-sound/,Jonathan Haidle,"₩38,500","₩13,200",Rating: 4.0 out of 54.0 - (28)
Recording in Presonus Studio One Made Easy,www.udemy.com/course/recording-in-presonus-studio-one-made-easy/,David Vignola,"₩27,500","₩13,200",Rating: 4.1 out of 54.1 - (3)
Gospel Piano Chord Mastery Course - Piano Lessons For All,www.udemy.com/course/gospel-piano-chord-mastery-piano-lesson/,Oluwajoba Odesanya,"₩22,000","₩13,200",Rating: 4.7 out of 54.7 - (2)
Produce a 1980's Electro Funk Track in Ableton Live 9 & 10,www.udemy.com/course/produce-a-1980s-electronic-funk-track-in-ableton-live-9-10/,Rob Webster,"₩22,000","₩13,200",Rating: 4.5 out of 54.5 - (6)
Play By Ear #4: Play Song By Ear with 3 Chords Using Any Key,www.udemy.com/course/play-by-ear-4-play-many-songs-by-ear-with-3-chords-sing/,Rosa Suen,"₩214,500","₩13,200",Rating: 4.6 out of 54.6 - (15)
Writing & Recording Your First Rap Song,www.udemy.com/course/writing-your-first-rap-song/,Donovon Jenson,"₩38,500","₩13,200",Rating: 4.3 out of 54.3 - (24)
How To Co-Write Songs Like The Pro's,www.udemy.com/course/how-to-co-write-songs-like-the-pros/,Tom Worth,"₩22,000","₩13,200",Rating: 4.6 out of 54.6 - (31)
Songwriting for Impact + Valuable Lyrics,www.udemy.com/course/goldwriterpro/,Alexander Star,"₩192,500","₩13,200",Rating: 5.0 out of 55.0 - (1)
College Level Jazz Theory part 1.,www.udemy.com/course/college-level-jazz-theory-part-1/,Joseph Armetta,"₩22,000","₩13,200",Rating: 3.5 out of 53.5 - (20)
#3 Read Music Notes Fast:   Speed Read 11 Treble Clef Notes,www.udemy.com/course/read-music-notes-fast-l3-how-to-read-music-notes-in-speed/,Rosa Suen,"₩214,500","₩13,200",Rating: 4.5 out of 54.5 - (21)
Learn 3 - All Time A R Rahman Hits on Carnatic Flute!,www.udemy.com/course/arrahman-hits/,Sriharsha Ramkumar,0,"₩132,000",Rating: 4.8 out of 54.8 - (37)
"Piano Zen: Experience Your True, Unlimited Musical Potential",www.udemy.com/course/piano-zen-relaxing-meditative-piano-lessons-for-beginners/,Thomas Rheingans,"₩49,500","₩13,200",Rating: 3.9 out of 53.9 - (31)
The Ultimate Guitar Players Guide to Major Scales,www.udemy.com/course/the-beginner-guitar-players-guide-to-major-scales/,GuitArmy - Chris Rupp,"₩22,000","₩13,200",Rating: 4.8 out of 54.8 - (17)
Ninja Chord Changes - Master your guitar chord changes,www.udemy.com/course/ninja-chord-changes/,Dan Thorpe (Guitar Domination),"₩22,000","₩13,200",Rating: 4.3 out of 54.3 - (46)
Virtuosic technique of piano play in 12 minutes a day,www.udemy.com/course/virtuosic-technique-of-piano-play-in-12-minutes-a-day/,Sergei Filimonov,0,"¥2,400",Rating: 4.7 out of 54.7 - (49)
How to use Slash Chords to create unique sounds & Basslines,www.udemy.com/course/how-to-use-slash-chords-to-create-unique-sounds-basslines/,Oluwayanmife (Also Known as Yummy) Akintola,"¥24,000","¥1,380",Rating: 4.2 out of 54.2 - (11)
Total beginner to intermediate guitar - Learn to play by ear,www.udemy.com/course/beginner-guitar-learn-to-play-by-ear/,Daniel Boudreau,"¥5,400","¥1,380",Rating: 4.6 out of 54.6 - (7)
"Harmony & arranging 4 classical, acoustic Fingerstyle guitar",www.udemy.com/course/learn-harmony-arranging-classical-acoustic-guitar-pro-music-theory-now/,Luigi Pati,"¥5,400","¥1,380",Rating: 5.0 out of 55.0 - (2)
Learn Electronic Music Production in Ableton Live,www.udemy.com/course/become-a-pro-music-producer-from-scratch/,Henrique Caiano,"¥2,400","¥1,380",Rating: 4.3 out of 54.3 - (74)
Mastering Made Easy,www.udemy.com/course/mastering-made-easy/,David Vignola,"¥3,000","¥1,380",Rating: 0.0 out of 50.0 - (0)
Piano Lessons for the R&B Fan,www.udemy.com/course/piano-lessons-for-the-rb-fan/,James Gaither,"¥12,000","¥1,380",Rating: 3.9 out of 53.9 - (6)
How To Read Music,www.udemy.com/course/reading-music/,Jason Allen,"¥3,600","¥1,380",Rating: 4.3 out of 54.3 - (8)
Learn lead guitar in the style of Joe Satriani,www.udemy.com/course/learn-lead-guitar-in-the-style-of-joe-satriani/,David Taub,"¥3,600","¥1,380",Rating: 4.4 out of 54.4 - (24)
Starting to play the blues on your harmonica in easy steps ,www.udemy.com/course/benhewlettharmonicatuitionint1/,Ben Hewlett,"¥4,200","¥1,380",Rating: 4.5 out of 54.5 - (10)
Beginner Guitar: You Only Need 6 Chords,www.udemy.com/course/you-only-need-6-chords/,Ryan Rostrom,"¥12,000","¥1,380",Rating: 4.6 out of 54.6 - (17)
Learn the Viola - Scales and Fundamentals,www.udemy.com/course/learn-the-viola-scales-and-fundamentals/,Kathleen Stringplay,"¥9,600","¥1,380",Rating: 4.4 out of 54.4 - (18)
Learn Piano #1 - Basic Harmony & 14 Piano Improvisation Tips,www.udemy.com/course/piano-reharmonization-method-kit-1-away-in-a-manger-level-1/,Rosa Suen,"¥23,400","¥1,380",Rating: 4.2 out of 54.2 - (55)
Logic Pro X: Music Production Tips,www.udemy.com/course/logic-pro-x-tutorial-tips-tricks-for-music-producers/,Joseph Evans,"¥24,000","¥1,380",Rating: 4.5 out of 54.5 - (78)
DJ with Ableton Live (includes a full warping course),www.udemy.com/course/dj-with-ableton-live-includes-a-full-warping-course/,Mark Cochrane,"¥3,000","¥1,380",Rating: 4.2 out of 54.2 - (23)
How To Mix Monitors from Front of House,www.udemy.com/course/how-to-mix-monitors-from-front-of-house/,Soulsound School,"¥3,600","¥1,380",Rating: 4.3 out of 54.3 - (8)
Songwriting For Life - With Juliette Reilly,www.udemy.com/course/songwritingjuliettereilly/,Juliette Reilly,"₩33,000","₩13,200",Rating: 4.5 out of 54.5 - (10)
9 Principles of Fast Piano Learning | First Song In Minutes,www.udemy.com/course/learn-piano-in-2-hours-first-song-in-6-mins/,Thlalefo Moshanyana,"₩22,000","₩13,200",Rating: 4.9 out of 54.9 - (2)
The Definitive Guide To Mastering Music Improvisation,www.udemy.com/course/the-definitive-guide-to-mastering-music-improvisation/,Jeffrey Chappell,0,"₩55,000",Rating: 4.3 out of 54.3 - (33)
"Ultimate Ableton Live 10, Part 2: Recording & Warping",www.udemy.com/course/ultimate-ableton-live-10-part-2-recording-warping/,Jason Allen,"₩33,000","₩13,200",Rating: 4.4 out of 54.4 - (24)
Rhythm  -  the basics,www.udemy.com/course/rhythm-the-basics/,Michael Emenau,"₩22,000","₩13,200",Rating: 4.8 out of 54.8 - (5)
How to Use a MIDI Keyboard as a Beatmaker in FL Studio,www.udemy.com/course/how-to-use-a-midi-keyboard-as-a-beatmaker-in-fl-studio/,Riley Weller,"₩154,000","₩13,200",Rating: 5.0 out of 55.0 - (1)
Engineering Sound  for Home Recording  and Music Production,www.udemy.com/course/the-basics-of-sound-for-recording/,Jim Britton,"₩27,500","₩13,200",Rating: 3.8 out of 53.8 - (43)
Write Your First Piece of Music In 14 Steps Finale Edition!,www.udemy.com/course/write-your-first-piece-of-music-in-14-steps-finale-edition/,Cody Weinmann,"₩27,500","₩13,200",Rating: 4.0 out of 54.0 - (2)
audio engineering: Basics of Compression,www.udemy.com/course/audio-engineering-basics-of-compression/,"Christopher ""Czar"" Smith","₩55,000","₩13,200",Rating: 4.3 out of 54.3 - (30)
Pentatonic Power Series!,www.udemy.com/course/pentatonic-power-series/,Shredmaster Scott,"₩22,000","₩13,200",Rating: 4.7 out of 54.7 - (8)
Ear Training Course for Audio Engineers and Musicians,www.udemy.com/course/ear-training-for-audio-engineers-and-musicians/,Sean Shannon,"₩55,000","₩13,200",Rating: 5.0 out of 55.0 - (2)
The Percussive Acoustic Guitar Method,www.udemy.com/course/the-percussive-acoustic-guitar-method/,Miguel Rivera,"₩27,500","₩13,200",Rating: 4.4 out of 54.4 - (3)
Master Oboe Playing: Intermediate Instruction Made Simple!,www.udemy.com/course/oboe-beyond-beginner/,MusicProfessor Online Music Lessons,"₩55,000","₩13,200",Rating: 4.8 out of 54.8 - (21)
How to Read Sheet Music: Everything You Need To Know,www.udemy.com/course/how-to-read-sheet-music/,Micah Blake,"₩110,000","₩13,200",Rating: 4.4 out of 54.4 - (11)
Make Your First Future Bass Track - In FL Studio,www.udemy.com/course/futurebass/,Colin Warn,"₩104,500","₩13,200",Rating: 3.7 out of 53.7 - (40)
Circular Breathing for musicians - practical skills,www.udemy.com/course/circular-breathing-for-musicians-practical-skills/,Jonathan (Jonny) Cope,"₩22,000","₩13,200",Rating: 4.6 out of 54.6 - (11)
Play Any Song in ANY 12 Keys Using A Powerful Number Method,www.udemy.com/course/play-any-song-in-all-12-keys-using-a-powerful-number-method/,Rosa Suen,$194.99,$11.99,Rating: 4.0 out of 54.0 - (29)
Learn Sidechain Compression for EDM Music Production,www.udemy.com/course/learn-sidechain-compression-for-music-production/,Mikael Baggström,$24.99,$11.99,Rating: 4.7 out of 54.7 - (119)
Music Theory For Beat Makers 2,www.udemy.com/course/music-theory-for-beat-makers-2-popular-chord-progressions/,"Joseph Evans, Matt Guarino",$199.99,$11.99,Rating: 4.3 out of 54.3 - (32)
Flute Pro Series - You're about to love practicing the flute,www.udemy.com/course/flute-pro-series/,MusicProfessor Online Music Lessons,$49.99,$11.99,Rating: 3.8 out of 53.8 - (9)
How To DJ With Your Numark DJ2GO2,www.udemy.com/course/how-to-dj-with-your-numark-dj2go2/,Joey Santos,$24.99,$11.99,Rating: 4.4 out of 54.4 - (23)
Playing Piano: Scales and Arpeggios Vol.I : Major keys,www.udemy.com/course/playing-piano-major-scales-and-arpeggios-voli/,Ilse Lozoya,$49.99,$11.99,Rating: 4.9 out of 54.9 - (9)
Music theory for complete beginners ,www.udemy.com/course/music-theory-for-complete-beginners-1/,Miguel Fajardo,$19.99,$11.99,Rating: 4.6 out of 54.6 - (207)
Logic Pro X: Dj Snake EDM Music Production in Logic Pro X,www.udemy.com/course/create-a-dj-snake-style-track-in-logic-pro-x/,"Martin Svensson, Music-Prod.com Education",$194.99,$11.99,Rating: 4.6 out of 54.6 - (30)
Video Game Music Composition / Production,www.udemy.com/course/video-game-music-composition-create-game-music-from-scratch/,Adam Caterer,$199.99,$11.99,Rating: 3.8 out of 53.8 - (10)
Audacity: Edit & Improve Audio Files,www.udemy.com/course/audacity-tutorials-for-beginners-learn-to-edit-audio-files/,Joseph Evans,$199.99,$11.99,Rating: 4.0 out of 54.0 - (47)
Learn to play the Sitar From Scratch,www.udemy.com/course/learn-to-play-the-sitar-from-scratch/,Manu Rajeev,$99.99,$11.99,Rating: 4.0 out of 54.0 - (4)
Drumming into Jazz,www.udemy.com/course/drumming-into-jazz/,Kevin DePree,0,$34.99,Rating: 5.0 out of 55.0 - (2)
GarageBand: Make Rap Beats,www.udemy.com/course/how-to-make-beats-in-garageband/,Joseph Evans,$199.99,$11.99,Rating: 4.4 out of 54.4 - (77)
Playing Piano By Ear: Complete Guide for Aspiring Musicians,www.udemy.com/course/learn-piano-by-ear/,Roy Denton,$149.99,$11.99,Rating: 4.0 out of 54.0 - (76)
Flute Masterclass: 5 Methods to Improve Your Tone Today,www.udemy.com/course/flute-masterclass-5-methods-to-improve-your-tone-today/,Angela McBrearty,$49.99,$11.99,Rating: 4.6 out of 54.6 - (30)
Produce Electro Big Room in under 5 Hours with FL Studio,www.udemy.com/course/produce-electro-big-room-in-under-5-hours-with-fl-studio/,Stephen Loader,$24.99,$11.99,Rating: 3.1 out of 53.1 - (98)
College Level Jazz Theory Part 2,www.udemy.com/course/college-level-jazz-theory-part-2/,Joseph Armetta,£19.99,£11.99,Rating: 4.4 out of 54.4 - (2)
Chopin / Prelude & Waltz  Piano Classics Vol.3,www.udemy.com/course/chopin-prelude-waltz-piano-classics-vol3/,Ilse Lozoya,£49.99,£11.99,Rating: 0.0 out of 50.0 - (0)
The Blues Guitar Style Of Big Bill Broonzy,www.udemy.com/course/the-blues-guitar-style-of-big-bill-broonzy/,Rick Payne,£24.99,£11.99,Rating: 5.0 out of 55.0 - (1)
"Learn Guitar to Worship: Learn 4 Songs and unlock a 1,000!",www.udemy.com/course/learnguitartoworship/,Sam Choi,£199.99,£50.00,Rating: 4.6 out of 54.6 - (66)
How to Get your Music Licensed ✅,www.udemy.com/course/how-to-make-money-with-music-licensing/,Gary Hiebner,£49.99,£11.99,Rating: 4.3 out of 54.3 - (23)
"Ultimate Ableton Live 10, Part 1: The Interface & The Basics",www.udemy.com/course/ultimate-ableton-live-10-part-1-the-interface-the-basics/,Jason Allen,£29.99,£11.99,Rating: 4.6 out of 54.6 - (52)
Guitar Lessons - Economy Picking Essentials,www.udemy.com/course/guitar-lessons-economy-picking-essentials/,FretHub Guitar Lessons,£34.99,£11.99,Rating: 4.2 out of 54.2 - (19)
Structural Hearing - Phrasing and Form in Piano Playing,www.udemy.com/course/structural-hearing-phrasing-and-form-in-piano-playing/,Emma Leiuman,0,£29.99,Rating: 5.0 out of 55.0 - (2)
SONGWRITING FOR THE BEGINNER - HOW TO GET STARTED,www.udemy.com/course/top-10-tips-for-songwriters-with-sandi-millar/,Lesson Pros,£199.99,£11.99,Rating: 4.0 out of 54.0 - (51)
Learn Piano #6 - Jazz Cocktail Sound 7b9 in Piano Bar Music,www.udemy.com/course/tap-into-smooth-jazz-cocktail-sound-in-piano-bar-music/,Rosa Suen,£194.99,£11.99,Rating: 4.4 out of 54.4 - (17)
The Step by Step Beginners Guide to Pro Tools 12,www.udemy.com/course/protools12introstepbystep/,sean slaughter,£49.99,£19.99,Rating: 4.1 out of 54.1 - (24)
Learn Piano #2 - Play Piano Color Chords & 19 Ballads,www.udemy.com/course/kit-1-level-2-piano-reharmonization-away-in-a-manger/,Rosa Suen,£194.99,£11.99,Rating: 4.1 out of 54.1 - (28)
Stagecraft for Live Sound Engineers,www.udemy.com/course/stagecraft-for-live-sound-engineers/,Soulsound School,£29.99,£11.99,Rating: 4.7 out of 54.7 - (36)
Learn how to bend notes the easy way on your HARMONICA today,www.udemy.com/course/the-easy-way-to-bend-notes-on-harmonica-yes-you-can-do-it/,Ben Hewlett,£74.99,£11.99,Rating: 4.5 out of 54.5 - (31)
Spotify Profits For Advertising,www.udemy.com/course/spotifyadprofits/,Christopher Greenwood,£99.99,£11.99,Rating: 2.7 out of 52.7 - (3)
Play Piano In A Day - Play chords in every key by ear,www.udemy.com/course/play-piano-in-a-day/,JD KIMBER,£29.99,£11.99,Rating: 4.4 out of 54.4 - (20)
Mixing Masterclass: How To Mix Vocals In Logic Pro X,www.udemy.com/course/mixing101/,Kia Orion,"¥24,000","¥1,380",Rating: 3.9 out of 53.9 - (16)
Cajon for Beginners,www.udemy.com/course/cajon-for-beginners/,Matthias Philipzen,"¥3,600","¥1,380",Rating: 4.6 out of 54.6 - (5)
GarageBand: Make Hip Hop Songs,www.udemy.com/course/garageband-tutorial-create-a-hip-hop-song-in-garageband/,"Joseph Evans, Jeremy Deighan, Concept Courses ⁯⁯⁯⁯⁯","¥24,000","¥1,380",Rating: 4.3 out of 54.3 - (53)
Clarinet Pro Series - Fall in love with the Clarinet,www.udemy.com/course/clarinet-pro-series/,MusicProfessor Online Music Lessons,"¥6,000","¥1,380",Rating: 4.3 out of 54.3 - (12)
Play Piano or Keyboard from Chord Charts (with Music Theory),www.udemy.com/course/play-piano-or-keyboard-from-chord-charts/,Matthias Jäger,"¥4,800","¥1,380",Rating: 4.8 out of 54.8 - (8)
Advanced Horn Studies - Learn to Master the French Horn!​,www.udemy.com/course/advanced-french-horn/,MusicProfessor Online Music Lessons,"¥6,000","¥1,380",Rating: 5.0 out of 55.0 - (3)
How To Get a Record Deal - Music Artist Development 101,www.udemy.com/course/how-to-get-a-record-deal-music-artist-development-101/,Billy Allen,"¥9,000","¥1,380",Rating: 4.5 out of 54.5 - (18)
Music Theory Comprehensive: Part 3 - Minor Keys and More,www.udemy.com/course/music-theory-3/,Jason Allen,"¥4,800","¥1,380",Rating: 4.6 out of 54.6 - (58)
31 Day Guitar Challenge,www.udemy.com/course/31dayguitar/,Nathan Forrest,"¥8,400","¥1,380",Rating: 4.9 out of 54.9 - (40)
How To Mix And Effect Vocals,www.udemy.com/course/how-to-mix-and-effect-vocals/,W. A. Production Academy,"¥6,000","¥1,380",Rating: 4.2 out of 54.2 - (5)
Beginner Guitar Masterclass: Basic Chord Changing,www.udemy.com/course/beginner-guitar-masterclass-basic-chord-changing-drills/,Brian molin,"¥10,200","¥1,380",Rating: 4.8 out of 54.8 - (2)
Have Fun with Beginner Blues Piano,www.udemy.com/course/have-fun-with-beginner-blues-piano/,Karen Gibson,"¥9,000","¥1,380",Rating: 4.8 out of 54.8 - (53)
FingerstyleGuitar by Jacques Stotzem - Basic Level,www.udemy.com/course/basic-fingerstyleguitar-jacques-stotzem/,DizzyFingers Academy,0,"¥3,600",Rating: 4.4 out of 54.4 - (38)
Your Band Doesn't Need a Record Deal,www.udemy.com/course/recording-your-album/,"James Scott, Katrin Brunier, Draven Grey","¥24,000","¥1,380",Rating: 5.0 out of 55.0 - (3)
Learn lead guitar in the high octane style of Gary Moore,www.udemy.com/course/learn-lead-guitar-in-the-high-octane-style-of-gary-moore/,David Taub,"¥3,600","¥1,380",Rating: 5.0 out of 55.0 - (13)
Trumpet Lessons For Beginners,www.udemy.com/course/the-music-coach-online-trumpet-lesson-program/,"Todd Porter, Steve Dyte","¥11,400","¥1,380",Rating: 4.6 out of 54.6 - (23)
Guitar Lessons - Two Handed Tapping Essentials,www.udemy.com/course/guitar-lessons-two-handed-tapping-essentials/,FretHub Guitar Lessons,$34.99,$11.99,Rating: 4.6 out of 54.6 - (14)
