Course,URL,instructor,Price (full),Price (discount),Rank
"Aprenda Guitarra do Zero em 45 Dias, com Mauricio Alabama",www.udemy.com/course/aprenda-guitarra-do-zero/,"Mauricio Alabama, Rob Lopes","¥7,800","¥1,950","Rating: 4.7 out of 54.7 - (1,340)"
Dj de 0 a 100.  Aprende a mezclar con Software de Dj,www.udemy.com/course/dj-de-0-a-100-conviertete-en-disk-jockey-profesional/,Dj Alon,0,₺49.99,Rating: 4.6 out of 54.6 - (501)
Corso di chitarra base completo per principianti - Guitar,www.udemy.com/course/corso-di-chitarra-base-completo-per-principianti/,Massimiliano Alfieri,₺209.99,₺28.99,Rating: 4.4 out of 54.4 - (209)
Ableton Live 10 - Producción Musical y Diseño Sonoro,www.udemy.com/course/produccion-musical-y-diseno-sonoro-con-ableton-live-10/,"Mario Nieto, Master Devs Formación Especializada en 3D, Programación C# VR y Videojuegos",₺229.99,₺28.99,Rating: 4.5 out of 54.5 - (410)
Super-Curso de Guitarra Práctico Para Principiantes,www.udemy.com/course/super-curso-de-guitarra-practico-para-principiantes/,Rodolfo Gonzalez Rodriguez,₺179.99,₺28.99,Rating: 4.2 out of 54.2 - (389)
Ableton Live 10 Masterclass,www.udemy.com/course/electronic-music-production-in-ableton-live-10/,Dennis Schnichels,₺209.99,₺28.99,Rating: 4.2 out of 54.2 - (136)
Gitarre spielen wie die Profis,www.udemy.com/course/gitarrenakkordespielenwiedieprofis/,Timo Maiwald,₺69.99,₺28.99,Rating: 4.7 out of 54.7 - (134)
Curso definitivo de Guitarra Clásica,www.udemy.com/course/curso-definitivo-de-guitarra-clasica/,Miguel A. Iglesias,₺389.99,₺28.99,Rating: 4.5 out of 54.5 - (93)
"Guitarra Blues - Do Zero ao Modern, com Mauricio Alabama",www.udemy.com/course/guitarra-blues-do-zero-ao-modern/,"Mauricio Alabama, Rob Lopes",₺239.99,₺60.00,Rating: 4.8 out of 54.8 - (198)
Simplificando e Dominando o Campo Harmônico na Guitarra,www.udemy.com/course/simplificando-e-dominando-o-campo-harmonico-na-guitarra/,"Mauricio Alabama, Rob Lopes",₺239.99,₺60.00,Rating: 4.8 out of 54.8 - (528)
Violão do Zero ao Samba (em Português),www.udemy.com/course/violao-do-zero-ao-samba-em-portugues/,Emilio Cantini,₺179.99,₺28.99,Rating: 4.7 out of 54.7 - (84)
"Aprenda a Improvisar na Guitarra, com Mauricio Alabama",www.udemy.com/course/aprenda-a-improvisar-na-guitarra/,"Mauricio Alabama, Rob Lopes",₺239.99,₺60.00,"Rating: 4.7 out of 54.7 - (1,370)"
Canto y Vocalización para todos,www.udemy.com/course/canto-y-vocalizacion-para-todos/,Internacional Tercera Llamada A.C.,₺49.99,₺28.99,Rating: 4.5 out of 54.5 - (48)
Logic Pro X - La guida di base completa,www.udemy.com/course/logic-pro-x-la-guida-di-base-completa/,"Michele Lombardi, Marco Zanoni",0,₺169.99,Rating: 4.7 out of 54.7 - (66)
"Escalas Pentatônicas - O Curso Final, com Mauricio Alabama",www.udemy.com/course/escalas-pentatonicas/,"Mauricio Alabama, Rob Lopes",₺239.99,₺60.00,Rating: 4.7 out of 54.7 - (406)
Il corso di Canto Moderno con il Metodo TVS in italiano,www.udemy.com/course/il-corso-di-canto-moderno-con-il-metodo-tvs-in-italiano/,"Robert Lunte, Sergio Calafiura",₺409.99,₺28.99,Rating: 4.3 out of 54.3 - (29)
"Engatinhando nas Escalas da Guitarra, com Mauricio Alabama",www.udemy.com/course/engatinhando-nas-escalas-da-guitarra/,"Mauricio Alabama, Rob Lopes",₺139.99,₺35.00,Rating: 4.7 out of 54.7 - (338)
Production Musicale avec Logic Pro X : le guide complet,www.udemy.com/course/production-musicale-logic-pro-x/,Vincent Retg,"¥18,000","¥1,270",Rating: 4.4 out of 54.4 - (343)
GarageBand【DTM初心者】講座 vol.1★iOS［iPad＆iPhone用］簡単操作で演奏・作曲・アレンジ✅,www.udemy.com/course/garageband-ios/,storeG K.Nakamura,"¥8,400","¥1,380",Rating: 4.3 out of 54.3 - (64)
"Sonido Profesional - ¡Fundamentos, técnicas y secretos!",www.udemy.com/course/curso-sonidoprofesional/,CLAVEDIGITAL Training Center,"¥12,000","¥1,270",Rating: 4.7 out of 54.7 - (368)
Rekordbox Dj - Mezcla como un profesional,www.udemy.com/course/rekordbox/,Dj Alon,0,"¥2,400",Rating: 4.8 out of 54.8 - (206)
"Curso de Partitura Para Guitarra, Simples e Divertido",www.udemy.com/course/curso-de-partitura-para-guitarra/,"Mauricio Alabama, Rob Lopes","¥13,800","¥3,450",Rating: 4.7 out of 54.7 - (39)
"Armonía y Teoría musical aplicada, parte 1",www.udemy.com/course/armonia-y-teoria-musical-aplicada-1/,Marco Galvan,"¥11,400","¥1,270",Rating: 4.5 out of 54.5 - (71)
Cour Complet d'Entraînement Vocal selon la méthodologie TVS,www.udemy.com/course/become-a-great-singer-the-tvs-method-in-french/,"Robert Lunte, Priscila Da Costa","¥24,000","¥1,270",Rating: 4.6 out of 54.6 - (19)
Die Grundlagen der Musiktheorie lernen,www.udemy.com/course/musiktheorie/,Wolfram Groh,"¥6,000","¥1,270",Rating: 4.0 out of 54.0 - (59)
"Construindo e Dominando Acordes, com Mauricio Alabama",www.udemy.com/course/construindo-e-dominando-acordes-na-guitarra/,"Mauricio Alabama, Rob Lopes","¥13,800","¥3,450",Rating: 4.8 out of 54.8 - (197)
Home Studio - Guia definitivo da Produção Musical,www.udemy.com/course/papohzguiadefinitivo/,Mariano Júnior,"¥7,200","¥1,270",Rating: 4.5 out of 54.5 - (105)
Curso de Violão I - Instituto Convert Music,www.udemy.com/course/curso-de-violao-i-instituto-convert-music/,Instituto Convert Music,"¥21,600","¥2,300",Rating: 4.5 out of 54.5 - (128)
Sıfırdan Piyanoya - Haftalar İçinde Piyano Öğrenin,www.udemy.com/course/sifirdan-piyanoya-haftalar-icinde-piyano-ogrenin/,Furkan Han Mert,"¥14,400","¥1,270",Rating: 4.4 out of 54.4 - (279)
Curso de Piano Nível Intermediário (por música e ouvido),www.udemy.com/course/curso-de-piano-nivel-intermediario-por-musica-e-ouvido/,Luciano Alves,"¥14,400","¥1,270",Rating: 4.5 out of 54.5 - (159)
"Harmonia Funcional na Guitarra, com Mauricio Alabama",www.udemy.com/course/harmonia-funcional-na-guitarra/,"Mauricio Alabama, Rob Lopes","¥13,800","¥3,450",Rating: 4.7 out of 54.7 - (332)
Curso de Produção com FL Studio - Aprende a Fazer Música,www.udemy.com/course/cursocompletoflstudio/,KV Music Beats,0,"¥5,400",Rating: 4.6 out of 54.6 - (62)
Curso de Lenguaje Musical desde cero ✅✅ Curso de SOLFEO,www.udemy.com/course/curso-de-lenguaje-musical-desde-cero/,El Profe de Piano,"¥3,000","¥1,270",Rating: 4.4 out of 54.4 - (28)
Acordeón Diatónico Desde Cero,www.udemy.com/course/acordeon-diatonico-desde-cero/,Iram Gallardo,0,"₩60,500",Rating: 4.7 out of 54.7 - (88)
Débuter la Guitare - Le MEILLEUR cours pour Débutants,www.udemy.com/course/bien-debuter-la-guitare/,Edouard de MyGuitare,"₩49,500","₩13,200",Rating: 4.3 out of 54.3 - (147)
Chanter #1: Echauffement Complet de la Voix et Respiration,www.udemy.com/course/chanter-1-echauffement-complet-de-la-voix-et-respiration/,Fanchon Lucas,"₩220,000","₩13,200",Rating: 4.4 out of 54.4 - (298)
Componer Canciones. Curso Básico,www.udemy.com/course/curso-basico-para-componer-canciones/,Pere Hernàndez,"₩55,000","₩13,200",Rating: 4.5 out of 54.5 - (181)
GarageBand【DTM作曲入門】講座 vol.2★iOS［iPad＆iPhone用］理論を使えば誰でも作曲できる✅,www.udemy.com/course/garageband-ios-music/,storeG K.Nakamura,"₩77,000","₩13,200",Rating: 3.9 out of 53.9 - (17)
Teoría y Ejercicios de Pentatónicas para Guitarra Eléctrica!,www.udemy.com/course/armonia-y-teoria-musical-aplicada-la-guitarra-electrica/,Aitor Epas Guitar,"₩49,500","₩13,200",Rating: 4.5 out of 54.5 - (138)
Curso Completo de DJ para iniciante com VirtualDJ,www.udemy.com/course/dj-para-iniciante-com-virtualdj/,Led Russo,"₩44,000","₩13,200",Rating: 4.3 out of 54.3 - (150)
Bağlama Çalmayı Öğrenin | Müzik Eğitimi ( Kısa Sap ),www.udemy.com/course/baglama-dersi-1/,"Öğr. Gör. Sefa Kırlı, Erdoğan ERKEN","₩104,500","₩13,200",Rating: 4.2 out of 54.2 - (156)
Curso completo de Pro Tools,www.udemy.com/course/cursoprotools/,Leandro Uriel Fernandez,"₩49,500","₩13,200",Rating: 4.4 out of 54.4 - (53)
ボイストレーニング100日プログラム,www.udemy.com/course/iggyvocal/,Vocal School Iggy,"₩181,500","₩13,200",Rating: 4.3 out of 54.3 - (11)
ABİ BANA GİTAR ÖĞRET,www.udemy.com/course/abi-bana-gitar-ogret/,Vehbi Can Uyaroğlu,"₩220,000","₩13,200",Rating: 4.3 out of 54.3 - (315)
Producción Musical profesional ¡De la técnica a la venta!,www.udemy.com/course/produccionmusical/,CLAVEDIGITAL Training Center,"₩110,000","₩13,200",Rating: 4.4 out of 54.4 - (94)
Introducción al violín 1: cómo dominar la técnica del arco,www.udemy.com/course/introduccion-al-violin-1-como-dominar-la-tecnica-del-arco/,La Pizzicata Escuela - Lucy Garrote,"₩132,000","₩13,200",Rating: 4.6 out of 54.6 - (45)
Le solfège facile et complet en 8 heures,www.udemy.com/course/le-solfege-facile-et-complet-en-8-heures/,Myriam Birger,0,"₩104,500",Rating: 4.9 out of 54.9 - (33)
Erste Schritte am Klavier 1.0,www.udemy.com/course/erste-schritte-am-klavier-1_0/,Mailyn Rebecca Streit,0,"₩165,000",Rating: 4.9 out of 54.9 - (6)
Logic Pro X el Curso completo con los secretos de Producción,www.udemy.com/course/logic-pro-x-produccion/,Alberto Diaz de Leon,"₩71,500","₩13,200",Rating: 4.4 out of 54.4 - (226)
Acordes para Piano na Prática (iniciante ao avançado),www.udemy.com/course/acordes-para-piano-na-pratica/,Luciano Alves,"₩132,000","₩13,200",Rating: 4.8 out of 54.8 - (75)
Chanter#3: Transformez votre Voix en 7 jours,www.udemy.com/course/chanter3-transformez-votre-voix-en-7-jours/,Fanchon Lucas,"₩220,000","₩13,200",Rating: 4.2 out of 54.2 - (63)
Aprende a tocar Guitarra RAPIDO y FACIL con Guitarsimple,www.udemy.com/course/aprende-a-tocar-guitarra-rapido-y-facil-con-guitarsimple/,Alvaro Avila,"₩44,000","₩13,200",Rating: 4.4 out of 54.4 - (131)
FL Studio 20 Eğitim Seti: Trap Müzik Besteleyerek Öğrenin,www.udemy.com/course/flstudioturkce/,Mert Balkaş,"₩27,500","₩13,200",Rating: 4.6 out of 54.6 - (89)
Aprenda Tocar Violão em Poucas Aulas,www.udemy.com/course/aprenda-tocar-violao-em-poucas-aulas-com-sandro-silva/,Sandro Silva,"₩137,500","₩13,200",Rating: 4.3 out of 54.3 - (98)
Fundamentos de Ingeniería en Audio,www.udemy.com/course/fundamentos-de-ingenieria-en-audio/,Marco Galvan,"₩55,000","₩13,200",Rating: 4.6 out of 54.6 - (103)
Yeni Başlayanlar İçin Elektro Gitar,www.udemy.com/course/yeni-baslayanlar-icin-elektro-gitar/,Deniz Sayman,"₩82,500","₩13,200",Rating: 4.6 out of 54.6 - (148)
FL STUDIO (expliqué à ma grand mère),www.udemy.com/course/fl-studio-explique-a-ma-grand-mere/,Johnny Karaté,"₩82,500","₩13,200",Rating: 4.3 out of 54.3 - (100)
Plettrata Alternata - Il Pickslanting,www.udemy.com/course/plettrata-alternata/,Luca Milieri,0,"₩55,000",Rating: 4.4 out of 54.4 - (59)
FL Studio Eğitimi | Sıfırdan İleri Seviyeye,www.udemy.com/course/fl-studio-egitimi-sifirdan-ileri-seviyeye/,Vedat Gezme,"₩99,000","₩24,750",Rating: 4.3 out of 54.3 - (37)
Corso Ableton Live base,www.udemy.com/course/corso-ableton-live-base/,Innova Academy,"₩148,500","₩13,200",Rating: 4.6 out of 54.6 - (228)
FL Studio 20 Desde Cero | Producción Musical Profesional,www.udemy.com/course/fl-studio-20-desde-cero-produccion-musical-profesional/,Olbaid Music,"₩165,000","₩41,250",Rating: 4.3 out of 54.3 - (27)
تعلم التعليق الصوتي في 7 أيام مع الأستاذ مروان بن حفصية,www.udemy.com/course/voiceoverarab/,Marwan Benhafsia,0,"₩220,000",Rating: 4.8 out of 54.8 - (161)
Горловое пение. Онлайн мастер класс,www.udemy.com/course/gorlovoepenie/,Alex Kuular,"₩198,000","₩49,500",Rating: 4.6 out of 54.6 - (27)
Masterizacion de Audio: La guía completa de cómo masterizar,www.udemy.com/course/masterizacion-de-audio-la-guia-completa-de-como-masterizar/,Marco Galvan,"₩104,500","₩13,200",Rating: 4.4 out of 54.4 - (313)
Logic Pro X einfach lernen,www.udemy.com/course/logic-pro-x-einfach-lernen/,Wolfram Groh,"₩104,500","₩13,200",Rating: 3.8 out of 53.8 - (145)
Müzik Teorisi (Armoni) : 1,www.udemy.com/course/muzik-teorisi-armoni-1/,Deniz Sayman,R$174.99,R$23.99,Rating: 4.2 out of 54.2 - (227)
O Contrabaixo Definitivo,www.udemy.com/course/ocontrabaixodefinitivo/,Iving Barros,R$144.99,R$23.99,Rating: 4.2 out of 54.2 - (85)
"Criatividade na Improvisação na Guitarra, c/Mauricio Alabama",www.udemy.com/course/criatividade-na-improvisacao-na-guitarra/,"Mauricio Alabama, Rob Lopes",R$324.99,R$81.25,Rating: 4.7 out of 54.7 - (74)
Aprende Acordeón Desde Cero,www.udemy.com/course/aprende-acordeon-desde-cero/,Iram Gallardo,0,R$159.99,Rating: 4.8 out of 54.8 - (95)
الدورة العمليّة في التعليق الصوتي مع نسيم رمضان,www.udemy.com/course/mvqvgabb/,Nassim Ramadan,0,R$39.99,Rating: 4.8 out of 54.8 - (39)
Curso de Mixagem,www.udemy.com/course/curso-de-mixagem-modulo-i-rock/,Vinicius Bernucci Bernardes Da silva,R$189.99,R$23.99,Rating: 4.4 out of 54.4 - (130)
Chanter#2:  Le secret pour augmenter votre étendue vocale,www.udemy.com/course/chanter2-le-secret-pour-augmenter-votre-etendue-vocale/,Fanchon Lucas,R$579.99,R$23.99,Rating: 4.6 out of 54.6 - (45)
Curso de Canto: como usar a voz,www.udemy.com/course/cursodevoz/,Debora Abreu,R$324.99,R$23.99,Rating: 4.7 out of 54.7 - (117)
Entendendo e Aplicando Rock Fusion na Guitarra,www.udemy.com/course/entendendo-e-aplicando-rock-fusion-na-guitarra/,"Mauricio Alabama, Rob Lopes",R$324.99,R$81.25,Rating: 4.5 out of 54.5 - (55)
Ableton Live - Einstieg in die Musikproduktion,www.udemy.com/course/ableton-live-grundlagen/,"Marc ""Selec"" Zimmermann",R$54.99,R$23.99,Rating: 4.7 out of 54.7 - (113)
Corso Ableton Live intermedio,www.udemy.com/course/corso-ableton-live-intermedio/,Innova Academy,R$444.99,R$23.99,Rating: 4.6 out of 54.6 - (140)
Elektro Gitar ( Orta - İleri Seviye ),www.udemy.com/course/elektro-gitar-orta-ileri-seviye/,Deniz Sayman,R$204.99,R$23.99,Rating: 4.3 out of 54.3 - (278)
GUITAR FREAK SYSTEM [Curso Completo - Violão e Guitarra],www.udemy.com/course/guitarfreaksystem/,Fernando Vieira,R$579.99,R$145.00,Rating: 4.4 out of 54.4 - (111)
Domine Todos os Recursos do Logic Pro X,www.udemy.com/course/domine-todos-os-recursos-do-logic-pro-x/,Caetano Salles,R$294.99,R$23.99,Rating: 4.5 out of 54.5 - (95)
Mundharmonika spielen - mein schönstes Hobby,www.udemy.com/course/mundharmonika-spielen-mein-schonstes-hobby/,SCHOTT MUSIC GmbH  & Co. KG,R$54.99,R$39.99,Rating: 4.6 out of 54.6 - (35)
Curso de bajo eléctrico nivel 1,www.udemy.com/course/curso-de-bajo-electrico-nivel-1/,Escuela de Bajo,R$129.99,R$23.99,Rating: 4.3 out of 54.3 - (80)
Técnica e Expressão na Guitarra Solo,www.udemy.com/course/tecnica-e-expressao-na-guitarra-solo/,Vilmar Gusberti,0,$104.99,Rating: 4.6 out of 54.6 - (73)
Gitarren Masterclass - Gitarre lernen für Einsteiger,www.udemy.com/course/gitarren-masterclass/,Marius Worch,$149.99,$10.44,Rating: 4.4 out of 54.4 - (14)
初めてのAudition CCマスター講座,www.udemy.com/course/audition-cc/,AdobeMania ミハラ,$199.99,$10.44,Rating: 3.8 out of 53.8 - (19)
"Técnica de Guitarra! Pentatónicas, Sweep picking, Tapping...",www.udemy.com/course/tecnica-de-guitarra-pentatonicas-sweep-picking-tapping/,Aitor Epas Guitar,$49.99,$10.44,Rating: 4.8 out of 54.8 - (17)
Kompletter Gitarrenkurs: Gitarre lernen von Anfang an,www.udemy.com/course/kompletter-gitarrenkurs-gitarre-lernen-von-anfang-an/,Jakob Puchmayr,$104.99,$10.44,Rating: 4.5 out of 54.5 - (45)
Curso de Violão Popular,www.udemy.com/course/curso-de-violao/,Clube do Músico,$24.99,$10.44,Rating: 4.2 out of 54.2 - (195)
Vehbi Can Uyaroğlu İle Ukulele Dersi,www.udemy.com/course/ukulele-dersi/,Vehbi Can Uyaroğlu,$199.99,$10.44,Rating: 4.6 out of 54.6 - (68)
Une prod de A à Z avec Ableton Live 10,www.udemy.com/course/formation-ableton-live/,David Berdugo,0,$199.99,Rating: 4.7 out of 54.7 - (3)
Domine Todos os Recursos do Pro Tools 12,www.udemy.com/course/domine-todos-os-recursos-do-pro-tools/,Caetano Salles,$114.99,$10.44,Rating: 4.6 out of 54.6 - (81)
Come creare da zero sequenze per il live,www.udemy.com/course/come-creare-da-zero-sequenze-per-il-live/,Michele Lombardi,0,$49.99,Rating: 4.8 out of 54.8 - (74)
Técnicas profesionales de ecualización de audio (EQ),www.udemy.com/course/aprende-a-usar-un-ecualizador-como-un-profesional/,Marco Galvan,$29.99,$10.44,Rating: 4.6 out of 54.6 - (207)
Componer Canciones. Curso Avanzado,www.udemy.com/course/componer-canciones-curso-avanzado/,Pere Hernàndez,$59.99,$10.44,Rating: 4.7 out of 54.7 - (52)
Aplicando Modos Gregos Sobre Escalas Pentatônicas,www.udemy.com/course/aplicando-modos-gregos-sobre-escalas-pentatonicas-na-guitarra/,"Mauricio Alabama, Rob Lopes",$64.99,$16.25,Rating: 4.6 out of 54.6 - (45)
Formation complète de chant en ligne,www.udemy.com/course/apprendreachanter/,Davina Shefet,$119.99,$10.44,Rating: 4.3 out of 54.3 - (7)
Singen ohne Grenzen,www.udemy.com/course/pepper-your-voice-singen-ohne-grenzen/,Jennifer Pepper,$64.99,$10.44,Rating: 3.9 out of 53.9 - (58)
Uso de consolas mezcladoras de audio (mixers),www.udemy.com/course/uso-de-consolas-mezcladoras-de-audio/,Marco Galvan,$54.99,$10.44,Rating: 4.6 out of 54.6 - (39)
Curso de Harmonia Funcional,www.udemy.com/course/curso-de-harmonia-funcional/,Caetano Salles,$54.99,$9.99,Rating: 4.6 out of 54.6 - (50)
Due approcci alla Musica Applicata,www.udemy.com/course/due-approcci-alla-musica-applicata/,Antonio Genovino,$34.99,$9.99,Rating: 4.6 out of 54.6 - (34)
Producción electrónica en FL Studio 12,www.udemy.com/course/curso-integral-de-musica-electronica-en-fl-studio-12/,Tomás Acosta,$99.99,$10.99,Rating: 4.6 out of 54.6 - (62)
"Armonía y Teoría musical aplicada, parte 2",www.udemy.com/course/armonia-y-teoria-musical-aplicada-parte-2/,Marco Galvan,$94.99,$9.99,Rating: 5.0 out of 55.0 - (4)
Selim Işık Gitar Dersi  - Nasıl Çalınır? Nasıl yazılır?,www.udemy.com/course/selim-isk-gitar-dersi-2-nasl-calnr-nasl-yazlr/,Selim Işık,$124.99,$9.99,Rating: 4.9 out of 54.9 - (26)
Créer sa musique avec GarageBand : le guide complet,www.udemy.com/course/garageband-guide-complet/,Vincent Retg,$99.99,$9.99,Rating: 4.3 out of 54.3 - (89)
"Curso de piano para cantantes "" Cantantes al Piano""",www.udemy.com/course/cantantesalpiano/,Ariel Sanchez-La Tecla Espacio musical,$64.99,$9.99,Rating: 4.6 out of 54.6 - (13)
Teoría musical Vol. 1,www.udemy.com/course/teoria-musical-introduccion/,Ilse Lozoya,$39.99,$9.99,Rating: 4.7 out of 54.7 - (167)
Popüler Müzik için Piyano Dersleri,www.udemy.com/course/populer-muzik-icin-piyano-dersleri/,Edip Bağrıyanık,$49.99,$9.99,Rating: 4.4 out of 54.4 - (45)
GarageBandを使ってカッコいい音楽をパソコンで作ってみよう！ Make cool music with GB,www.udemy.com/course/garageband-v/,JCCD Studio,$114.99,$9.99,Rating: 3.9 out of 53.9 - (38)
Guitarra Blues Para Principiantes,www.udemy.com/course/guitarra-blues-para-principiantes/,Rodolfo Gonzalez Rodriguez,$54.99,$9.99,Rating: 4.2 out of 54.2 - (23)
Curso Completo de Teclado + Revista Digital Grátis,www.udemy.com/course/curso-completo-de-teclado/,Edicase Negócios Editoriais Ltda,$109.99,$9.99,Rating: 4.6 out of 54.6 - (119)
Evde Müzik Prodüksiyonuna Giriş,www.udemy.com/course/evde-muzik-produksiyonuna-giris/,Deniz Sayman,$64.99,$9.99,Rating: 4.2 out of 54.2 - (81)
In Windeseile ganze Songs am Klavier spielen lernen,www.udemy.com/course/klavierkurs/,Daniel Logar,$49.99,$9.99,Rating: 4.1 out of 54.1 - (17)
Ableton Live: Il corso essenziale,www.udemy.com/course/coachweero/,Coach Weero,$169.99,$9.99,Rating: 4.0 out of 54.0 - (18)
Curso de piano 101 - Tocando partituras y acordes - Vol.1,www.udemy.com/course/curso-de-piano-101-tocando-partituras-y-acordes/,Ilse Lozoya,$169.99,$9.99,Rating: 4.3 out of 54.3 - (88)
Compondo na Guitarra com Mauricio Alabama,www.udemy.com/course/compondo-na-guitarra-com-mauricio-alabama/,"Mauricio Alabama, Rob Lopes","฿4,400","฿1,100",Rating: 4.9 out of 54.9 - (84)
Curso de Solfeo para Cantantes!,www.udemy.com/course/curso-de-solfeo-para-cantantes-y-musicos/,Susan Noratto,"฿2,600",฿360,Rating: 4.7 out of 54.7 - (100)
Técnica e Expressão Vocal com Alirio Netto,www.udemy.com/course/tecnica-e-expressao-vocal-com-alirio-netto/,Alirio Bossle Neto,"฿3,800",฿360,Rating: 4.6 out of 54.6 - (144)
Lendo e escrevendo partitura,www.udemy.com/course/lendo-e-escrevendo-partitura/,Jonathan Álex,"฿5,400",฿360,Rating: 4.6 out of 54.6 - (22)
Curso completo de Guitarra Blues em Português,www.udemy.com/course/curso-completo-de-guitarra-blues-em-portugues/,Emilio Cantini,"฿2,200",฿360,Rating: 4.5 out of 54.5 - (64)
Introducción a  Pro Tools,www.udemy.com/course/introduccion-a-pro-tools/,Carlos de Jesus Alberto Lira,"฿1,200",฿360,Rating: 4.7 out of 54.7 - (99)
Curso de Fingerstyle (Chord-Melody) em Português,www.udemy.com/course/curso-de-fingerstyle-chord-melody-em-portugues/,Emilio Cantini,"฿1,800",฿360,Rating: 3.4 out of 53.4 - (76)
Cours du Oud complet - de A à Z,www.udemy.com/course/cours-oud-premier-niveau/,Ihab Radwan,"฿3,800",฿360,Rating: 4.4 out of 54.4 - (82)
Curso Ableton 10,www.udemy.com/course/curso-ableton-10/,DJEM - FOR PROFISSIONAL DJs,"฿3,600",฿360,Rating: 4.0 out of 54.0 - (68)
Logic Pro X: Dein Schnelleinstieg in die Musikproduktion,www.udemy.com/course/logicprox-dein-schnelleinstieg/,Silvan Radeloff,"฿3,600",฿360,Rating: 4.6 out of 54.6 - (82)
Kısa Sap Bağlama Eğitimi - İLERİ SEVİYE,www.udemy.com/course/enstruman-ogreniyorum-kisa-sap-baglama-egitimi-ileri-seviye/,Enstrüman Öğreniyorum,0,"฿3,600",Rating: 4.2 out of 54.2 - (21)
Apprendre le Mixage/ Mastering sur [FL Studio 20],www.udemy.com/course/apprendre-le-mixage-mastering-sur-fl-studio-20/,Mathias TeddyUp,"฿1,800",฿360,Rating: 4.0 out of 54.0 - (13)
Curso Completo de Produção Musical,www.udemy.com/course/producao-musical-express-1/,Caetano Salles,"฿4,000",฿360,Rating: 4.1 out of 54.1 - (28)
"Curso de Canto Consciente: Kantama, la voz de tu esencia",www.udemy.com/course/curso-de-canto-consciente-kantama-la-voz-de-tu-esencia/,Natalia Larramendi,"฿3,000",฿360,Rating: 4.1 out of 54.1 - (35)
Основы музыкального бизнеса,www.udemy.com/course/insimplebasic/,InSimple. Ru,0,฿800,Rating: 4.8 out of 54.8 - (130)
Curso de FL Studio para Iniciantes,www.udemy.com/course/cursoflstudio/,KV Music Beats,0,฿800,Rating: 3.9 out of 53.9 - (46)
Produção de podcasts nos moldes do Escriba Cafe,www.udemy.com/course/producao-de-podcasts/,Christian Gurtner,"฿2,000",฿360,Rating: 4.3 out of 54.3 - (137)
Jazz Chord Base: Coole Jazz-Akkorde auf der Gitarre spielen.,www.udemy.com/course/die-jazz-chord-base/,Stefan Mens,"฿2,800",฿360,Rating: 4.3 out of 54.3 - (33)
Musikproduktion im Heimstudio: Komponieren mit MIDI-Effekten,www.udemy.com/course/komponieren-mit-midi-effekten/,"Marc ""Selec"" Zimmermann",฿800,฿360,Rating: 4.5 out of 54.5 - (36)
馬叔叔搖滾吉他課程,www.udemy.com/course/mashushuguitar/,馬叔叔 Uncle Ma,0,"฿1,600",Rating: 4.8 out of 54.8 - (32)
Fundamentos da Técnica para Guitarra,www.udemy.com/course/fundamentos-da-tecnica-para-guitarra/,Vilmar Gusberti,0,"฿2,600",Rating: 4.9 out of 54.9 - (193)
Introducción al violín 2: entrenamiento de la mano izquierda,www.udemy.com/course/introduccion-al-violin-2-entrenamiento-de-la-mano-izquierda/,La Pizzicata Escuela - Lucy Garrote,"฿5,000",฿360,Rating: 5.0 out of 55.0 - (1)
Apprendre à mixer sa musique rapidement,www.udemy.com/course/mixage-rapide/,Vincent Retg,"฿3,600",฿360,Rating: 4.4 out of 54.4 - (34)
Digitale Musikproduktion - Eine Einführung mit FL Studio,www.udemy.com/course/digitale-musikproduktion-fl-studio/,Benjamin Meyer,฿600,฿360,Rating: 4.3 out of 54.3 - (54)
Impara ad Accompagnarti al Pianoforte in 4 ore,www.udemy.com/course/impara-ad-accompagnarti-al-pianoforte-in-4-ore/,Christian Salerno,"฿3,400",฿850,Rating: 4.9 out of 54.9 - (6)
Sprach- und Gesangsaufnahmen in bester Qualität produzieren,www.udemy.com/course/sprach-und-gesangsaufnahmen/,"Marc ""Selec"" Zimmermann","฿1,000",฿360,Rating: 4.5 out of 54.5 - (61)
"Corso di Chitarra Intermedio, approfondisci la tua tecnica",www.udemy.com/course/corso-di-chitarra-intermedio-approfondisci-la-tua-tecnica/,Massimiliano Alfieri,"฿6,200",฿360,Rating: 4.6 out of 54.6 - (6)
Técnicas Profesionales de Compresión de Audio,www.udemy.com/course/tecnicas-profesionales-de-compresion-para-musicos-y-djs/,Marco Galvan,"฿1,000",฿360,Rating: 4.6 out of 54.6 - (103)
Уроки Гитары С Нуля Для Начинающих,www.udemy.com/course/playguitar/,Борис Шлыков,฿600,฿360,Rating: 4.5 out of 54.5 - (17)
Curso de Guitarra desde cero a profesional (Nivel 1),www.udemy.com/course/curso-de-guitarra-cero-a-profesional-nivel-1/,Diego Erley Duran,"฿1,400",฿360,Rating: 4.2 out of 54.2 - (66)
Producción Musical con FL Studio 20,www.udemy.com/course/produccion-musical-con-fl-studio/,"Tomas George, Federico Garay, Ian Alexander, Digital Music Masters","฿7,800",฿360,Rating: 4.4 out of 54.4 - (16)
Schlagzeug für Anfänger – der Grundkurs,www.udemy.com/course/schlagzeug-fur-anfanger-der-grundkurs/,Dirk Erchinger,"฿1,800",฿360,Rating: 4.7 out of 54.7 - (20)
Singe deine Songs mit einer ausdrucksstarken Stimme,www.udemy.com/course/singe-deine-songs-mit-einer-ausdrucksstarken-stimme/,Carina Hager,$64.99,$10.99,Rating: 4.2 out of 54.2 - (31)
Escalas Pentatónicas Para Guitarra - Improvisación y Solos,www.udemy.com/course/escalas-pentatonicas-para-guitarra-improvisacion-y-solos/,Rodolfo Gonzalez Rodriguez,$64.99,$10.99,Rating: 4.6 out of 54.6 - (29)
Elif Kutlubay Keman Öğreniyorum,www.udemy.com/course/elif-kutlubay-keman-ogreniyorum/,Elif Kutlubay,$49.99,$10.99,Rating: 4.4 out of 54.4 - (29)
Gitar A-Z™ | Profesyonel Müzisyenden Gitar Kursu,www.udemy.com/course/gitar-kursu/,"Semih Keçeci, Petra Akademi",$19.99,$10.99,Rating: 4.5 out of 54.5 - (564)
Der GarageBand Schnelleinstieg,www.udemy.com/course/garageband-lernen/,Wolfram Groh,$59.99,$10.99,Rating: 4.3 out of 54.3 - (16)
